author,comments,downvotes,id,score,selftext,time_created,title,upvotes,subreddit,type
ILisnotItaLy,5,5,1rpwbu,0,First of all the source is here site that I saw in a recent threadhttpwwwfutilityclosetcomicewater I thought a lot on this question and though the answer on the site is the water level stays the same does it really is the true answer Does the answer consider the different density of ice or it isnt even matter ,1385745901.0,A boat floats in a swimming pool In the boat is a block of ice If the block is dumped into the water and melts does the water level rise or fall,3,askscience,top_day
Filous,7,5,1rpf7x,0,if it would take the speed of light traveling for  years to go to KOI how do they know it is there and how do we know its constitution ,1385726249.0,If it would take  ly to travel to KOI how do we know that it exists since the fastest speed in the universe is the speed of light  c,3,askscience,top_day
Fantastic,187,670,1ronxr,1192,As a follow up question why dont your teeth heal on your own like other bones in your body I know enamel plays a factor,1385693298.0,Why doesnt your immune system fight off the bacteria that causes cavities,1862,askscience,top_day
Phydeaux,36,247,1rpive,610,All flames such as from a candle or lighter all tend to go out after reaching a minimum size I suspect that simply making a tiny source isnt enough to do it For example birthday candles are much smaller than standard candles but their flame is only marginally smallerIs there some limiting factor,1385732219.0,Is it possible to create a microscopic flame,857,askscience,top_day
Byatch,123,156,1rokpj,300,As the title suggests I have a cylinder that I pinch the end to flatten it much like a toothpaste tube Does this shape have a name and can its volume be determined based on length and diameter,1385690209.0,Does the  dimensional shape created when one end of a cylinder is pinched have a name If so what is it and what is the formula for its volume,456,askscience,top_day
ElPix,20,35,1rpkur,68,So suppose its winter and its too hot for the time of the year for a long period of time  Is it possible that trees start growing leaves too early And if so will they lose them again after it gets back colder,1385734854.0,If its too hot for a long period of time in winter is it possible that trees grow leaves early,103,askscience,top_day
zamonto,9,27,1rpbvb,32,,1385720626.0,Why does the pitch change when you zip a zipper fasterslower,59,askscience,top_day
Sanko,10,12,1rp86x,23,,1385715014.0,Could there be an object that casts shadow but is not visible ,35,askscience,top_day
yourarm,8,6,1rp7i5,20,Paint is liquid and solid and the liquids would usually evaporate to leave the solid colour on the wall Does that mean that vacuums would affect the way that paint driesOr does the energy from the sun still cause the paint to dry,1385714012.0,Will paint dry in space,26,askscience,top_day
celticfan,10,15,1rpxux,15,,1385747290.0,Did birds and animals like squid or octopus develop beaks seperately or do they share a common ancestor,30,askscience,top_day
AwesomerThanMe,5,10,1ronfo,16,They look like thishttpimgurcomctfosj,1385692818.0,Why does water form these tiny air bubbles on the side of a glass bottle if it is allowed to sit still for a while,26,askscience,top_day
MadHatter,25,24,1rpxrq,15,So Ive been thinking if all humans are practically  identical in the sense of genes the closest person to you genetically is either your child or your siblingIs there any sense in discussing which one has more genes that are identical to yours,1385747222.0,Genetically speaking whos more related to you your siblings or your childrenparents,39,askscience,top_day
yunoreligion,9,13,1rpiq9,15,Some recent SciFi movies got me thinking about this  Could we create usable cameras so small there is no way a person could discover them with the naked eye  What are the limiting factors,1385731995.0,What is the smallest practical size a video camera could be,28,askscience,top_day
paolog,2,5,1rpdnd,11,If I understand correctly vitamin C aids absorption of iron and vitamin D aids absorption of calcium Is this true of other minerals required by the body or is it just these two,1385723632.0,Which minerals have an associated vitamin that aids their absorption,16,askscience,top_day
ThatSneakyHippo,9,8,1roisb,9,As in are there any neutronsprotonselectrons just whizzing around by themselves not part of any atom Sorry if its a stupid question,1385688320.0,Are there any loose sub atomic particles,17,askscience,top_day
leftylouis,10,3,1rp7zv,6,So far my understanding of light is that it is radiation of an photon or a wavelengthin this case it isnt a particle But i know that by the decay of an electron to a lower shell there will be energy wich will be emitted into a wavelength and if has the right ammount of energy then we can see it  so is it that in a lightbulb that you force a lot of electrons through wire that doesnt really allow them to pass but how do they release radiation in this way and how does a LED do this about the electron You have a neutron with betadecay udd to uud the up is a bit lighter then the down so there is some excess energy wich is a electron and a positron anti electron the electron has a negative charge nad the proton a positive but doe this charge mean a constant emission of photons wich makes electromagnetism wich keeps makes up the electron shells and what does the negative charge do i am probably a bit on the wrong path with this story but i dont really know how to ask my questions but i hope this makes senseand ofcourse now knowing if a electron is a particle or a wavelength isnt really helping me either because it is hard to think something is not a particle but but a wavelength and then what is a wavelength but in some situations it is hard to understand that there is a particle without mass etc etc i dont want to spend too much time on this but i allready gave up on even thinking about it i just want to learn some basics so i know what is going on while doing chemistry instead of just using electrons interacting with protonsThanks,1385714678.0,How does a Lightbulb or LED emit photons  from electron to photon,9,askscience,top_day
DudetheGuy,9,5,1rpj3t,3,Just like the title if we were to build a space elevator that went up as high as the international space station would the person in the elevator experience zero gravity at the top of it The reason I was wondering is because I thought the feeling of zeroG was caused by falling and missing the ground and am not sure if its the same with the elevator Any answer would be appreciated thanks,1385732547.0,Is there zerogravity at the top of a space elevator,8,askscience,top_day
nicknacc,2,2,1rozc0,5,Wouldnt it suck all the water out,1385704173.0,Shouldnt a hypertonic brine solution DEHYDRATE turkey meat,7,askscience,top_day
Rostifer,6,2,1rozo5,4,So Im reading this book The Man in the High Castle Its about an alternate history where the Axis win WWII Anyway in the book the Germans have drained the Mediterranean in order to make more farmland For quite a few different reasons this sort of thing doesnt seem possible to me water displacement issues the saltiness of the sea bed also it seems like it would just take way too longSo what do you think Is it possible If so how would you do it What sort of problems might a project like this cause Edit Grammar,1385704516.0,Would it be possible to drain the Mediterranean Sea in order to grow crops in the sea bed,6,askscience,top_day
Nachie,13,7,1ronyp,4,,1385693325.0,If I shake a canteen full of water long enough and hard enough will the water ever get warm from the friction,11,askscience,top_day
axtolip,7,1,1rodeo,5,We have a source that emits one single photon This single photon goes throught a beam splitter that has a  of probability of sending it through one path or another Eventually these two paths cross each other If we dont try to measure through which path the photon went could we say the photon has taken both paths If so would these two photons be able to interefere once the paths cross Would it be possible to measure said interference,1385682852.0,Quantum erasers is one single photon capable of interfering with itself,6,askscience,top_day
