author,comments,downvotes,id,score,selftext,time_created,title,upvotes,subreddit,type
Fantastic,187,671,1ronxr,1188,As a follow up question why dont your teeth heal on your own like other bones in your body I know enamel plays a factor,1385693298.0,Why doesnt your immune system fight off the bacteria that causes cavities,1859,askscience,top_day
Phydeaux,36,249,1rpive,608,All flames such as from a candle or lighter all tend to go out after reaching a minimum size I suspect that simply making a tiny source isnt enough to do it For example birthday candles are much smaller than standard candles but their flame is only marginally smallerIs there some limiting factor,1385732219.0,Is it possible to create a microscopic flame,857,askscience,top_day
Byatch,123,153,1rokpj,298,As the title suggests I have a cylinder that I pinch the end to flatten it much like a toothpaste tube Does this shape have a name and can its volume be determined based on length and diameter,1385690209.0,Does the  dimensional shape created when one end of a cylinder is pinched have a name If so what is it and what is the formula for its volume,451,askscience,top_day
ElPix,20,34,1rpkur,68,So suppose its winter and its too hot for the time of the year for a long period of time  Is it possible that trees start growing leaves too early And if so will they lose them again after it gets back colder,1385734854.0,If its too hot for a long period of time in winter is it possible that trees grow leaves early,102,askscience,top_day
zamonto,9,27,1rpbvb,34,,1385720626.0,Why does the pitch change when you zip a zipper fasterslower,61,askscience,top_day
Sanko,10,13,1rp86x,23,,1385715014.0,Could there be an object that casts shadow but is not visible ,36,askscience,top_day
yourarm,8,6,1rp7i5,19,Paint is liquid and solid and the liquids would usually evaporate to leave the solid colour on the wall Does that mean that vacuums would affect the way that paint driesOr does the energy from the sun still cause the paint to dry,1385714012.0,Will paint dry in space,25,askscience,top_day
celticfan,10,13,1rpxux,17,,1385747290.0,Did birds and animals like squid or octopus develop beaks seperately or do they share a common ancestor,30,askscience,top_day
AwesomerThanMe,5,12,1ronfo,13,They look like thishttpimgurcomctfosj,1385692818.0,Why does water form these tiny air bubbles on the side of a glass bottle if it is allowed to sit still for a while,25,askscience,top_day
MadHatter,25,25,1rpxrq,14,So Ive been thinking if all humans are practically  identical in the sense of genes the closest person to you genetically is either your child or your siblingIs there any sense in discussing which one has more genes that are identical to yours,1385747222.0,Genetically speaking whos more related to you your siblings or your childrenparents,39,askscience,top_day
yunoreligion,9,15,1rpiq9,11,Some recent SciFi movies got me thinking about this  Could we create usable cameras so small there is no way a person could discover them with the naked eye  What are the limiting factors,1385731995.0,What is the smallest practical size a video camera could be,26,askscience,top_day
paolog,2,5,1rpdnd,10,If I understand correctly vitamin C aids absorption of iron and vitamin D aids absorption of calcium Is this true of other minerals required by the body or is it just these two,1385723632.0,Which minerals have an associated vitamin that aids their absorption,15,askscience,top_day
wearebladers,9,7,1rpcs5,11,Already said pretty much everything in the title curious if there is maybe some reason for this,1385722123.0,Why do many viruses that are successful kill people and animals wouldnt it be more efficient for them to keep the host species alive and spread further,18,askscience,top_day
ThatSneakyHippo,9,9,1roisb,7,As in are there any neutronsprotonselectrons just whizzing around by themselves not part of any atom Sorry if its a stupid question,1385688320.0,Are there any loose sub atomic particles,16,askscience,top_day
leftylouis,10,3,1rp7zv,7,So far my understanding of light is that it is radiation of an photon or a wavelengthin this case it isnt a particle But i know that by the decay of an electron to a lower shell there will be energy wich will be emitted into a wavelength and if has the right ammount of energy then we can see it  so is it that in a lightbulb that you force a lot of electrons through wire that doesnt really allow them to pass but how do they release radiation in this way and how does a LED do this about the electron You have a neutron with betadecay udd to uud the up is a bit lighter then the down so there is some excess energy wich is a electron and a positron anti electron the electron has a negative charge nad the proton a positive but doe this charge mean a constant emission of photons wich makes electromagnetism wich keeps makes up the electron shells and what does the negative charge do i am probably a bit on the wrong path with this story but i dont really know how to ask my questions but i hope this makes senseand ofcourse now knowing if a electron is a particle or a wavelength isnt really helping me either because it is hard to think something is not a particle but but a wavelength and then what is a wavelength but in some situations it is hard to understand that there is a particle without mass etc etc i dont want to spend too much time on this but i allready gave up on even thinking about it i just want to learn some basics so i know what is going on while doing chemistry instead of just using electrons interacting with protonsThanks,1385714678.0,How does a Lightbulb or LED emit photons  from electron to photon,10,askscience,top_day
DudetheGuy,9,4,1rpj3t,5,Just like the title if we were to build a space elevator that went up as high as the international space station would the person in the elevator experience zero gravity at the top of it The reason I was wondering is because I thought the feeling of zeroG was caused by falling and missing the ground and am not sure if its the same with the elevator Any answer would be appreciated thanks,1385732547.0,Is there zerogravity at the top of a space elevator,9,askscience,top_day
Geminel,2,3,1rp09t,4,,1385705134.0,Are satellites effected by lunar gravity If so how do they compensate to maintain orbit,7,askscience,top_day
nicknacc,2,2,1rozc0,4,Wouldnt it suck all the water out,1385704173.0,Shouldnt a hypertonic brine solution DEHYDRATE turkey meat,6,askscience,top_day
Rostifer,6,2,1rozo5,5,So Im reading this book The Man in the High Castle Its about an alternate history where the Axis win WWII Anyway in the book the Germans have drained the Mediterranean in order to make more farmland For quite a few different reasons this sort of thing doesnt seem possible to me water displacement issues the saltiness of the sea bed also it seems like it would just take way too longSo what do you think Is it possible If so how would you do it What sort of problems might a project like this cause Edit Grammar,1385704516.0,Would it be possible to drain the Mediterranean Sea in order to grow crops in the sea bed,7,askscience,top_day
Nachie,13,6,1ronyp,5,,1385693325.0,If I shake a canteen full of water long enough and hard enough will the water ever get warm from the friction,11,askscience,top_day
Lionstrong,6,10,1rom21,7,,1385691498.0,Can you fly over the Arctic Circle to get to the other side of the planet Is this an actual route by commercial airlines,17,askscience,top_day
NicholasCajun,1,2,1rp4aw,2,Ive read that one day all other galaxies will recede into the unobservable part of the universe with only our own galaxy remaining visibleSo suppose a civilization much like ours arose in that time frame  what would they not be able to figure out that we are able to Would they be able to infer there are other galaxies out there Would they be able to come up with the Big Bang theory That sort of stuff,1385709584.0,In what way would our knowledge of astronomyphysicsetc have been limited if our observable universe had been limited to just our galaxy,4,askscience,top_day
eliminate,2,2,1rp418,2,For example in my blind spot If I close one eye the blind spot is there but is filled in by my brain to what is roughly in the background and I dont notice it Another example I have a little brown dog that looks like a brown pillow when hes curled up When I saw an actual brown pillow on my chair for a split second I saw it as my dog ,1385709276.0,How much of vision is filled in by the brain,4,askscience,top_day
ThunderOrb,5,1,1roeuz,3,I have a salt water aquarium and tend to have pretty big issues with the salt evaporating around the filterhood of the tank I always put it back in as I refill the tank with fresh water so that the concentration doesnt get too far off from idealI was looking at the tank today and wondering If I stopped putting the evaporated salt back into the tank could my fish eventually acclimatize themselves to a brackish or freshwater environment or is such a feat biologically impossible for them,1385684290.0,Could a marine fish be eventually acclimatized to fresh water,4,askscience,top_day
axtolip,7,2,1rodeo,4,We have a source that emits one single photon This single photon goes throught a beam splitter that has a  of probability of sending it through one path or another Eventually these two paths cross each other If we dont try to measure through which path the photon went could we say the photon has taken both paths If so would these two photons be able to interefere once the paths cross Would it be possible to measure said interference,1385682852.0,Quantum erasers is one single photon capable of interfering with itself,6,askscience,top_day
barbanegra,5,3,1rpabd,1,,1385718127.0,Are there any planets bigger than their neighbour stars If so would these smaller stars gravitate around the planet,4,askscience,top_day
shdyyy,3,3,1rpq89,2,I was reading this studyhttpswwwdropboxcomsgknhzskzibartAFBFpdf which talks about distribution of fibronectinFN in cardiomyocytescardiac muscle cellsThe study claims that fibronectinFN is distributed in the next three locations in relation to cardiomyoctesgtalong fibrous structureswhich includes collagen type I fibres in Extra cellular matrixECMgtin basement membrane along cardiomyocte cell surface gtat luminar surfaces of Tranverse Tubulemore specifically along TT membrane As I was searching on internet I found those two pictures which show fibronectinFN position in relation to cardiomyoctecardiac muscle cellI marked fibronectin with arrows on those two picturesFirst picturehttpimageshackcomaimgxoxjpgSecond picturehttpimageshackcomaimgadvjpgSo my question is if we take in consideration our study from beginning of this post which of the above study mentioned locations of fibronectinFN is shown on those two picturesPicture  Does marked fibronectin represent FN located along fibrous structures in ECM or FN located in basement membrane along cardiomyocte cell surfacePicture  Does marked fibronectin represent FN located along fibrous structures in ECM or FN located in basement membrane along cardiomyocte cell surfaceQWhich of the above study mentioned locations of fibronectin is shown on those two picturesOn this second point I will focus on a third location where fibronectin is also distributed according to above study As above study mentions this third location is fibronectin distributed at luminar surfaces of Tranverse TubulesFN distributed along TT membranesHere is one quote from the studygtFurthermore the present study demonstrated fibronectinFN along Transverse TubularTT membranesSince they used word along TT membrane does this mean that fibronectinFN is located close to the TT membrane but not touching the TT membraneFirst option of my drawingOr does it mean that fibronectin is locatedlaying on the actual surface of TT membraneSecond option of my drawingHere is the link to my drawinghttpimageshackcomaimgdcjpgQWhich option of my drawing correctly represent statement of the studyfibronectin is distributed along TT membrane,1385740560.0,Fibronectin location in relation to heart cellscardiomyoctes Your response is highly appreciated,5,askscience,top_day
Upheave,2,3,1rpj0x,0,,1385732408.0,How does light intensity affect a plant cell on a molecular level Including hormone production,3,askscience,top_day
hameerabbasi,7,3,1rpid6,1,As far as I understand a particle only has a definite position when it is observed How does it know it was observed By its interaction with surrounding particles of courseMy confusion lies here If none of the particles around it have definite positions either how does any particle in the universe know for sure that it was observed Is this probabilistic in some way too If so is there an easy way to dumb it down,1385731454.0,How do you know something is a measurement or observation in Quantum Mechanics,4,askscience,top_day
wtfnothingavailable,0,4,1rpi5y,0,,1385731133.0,What is theoretically the lowest wavelength laser we could use to read information on a disc,3,askscience,top_day
PoohBearGroup,6,2,1rpaf7,1,Hi AskScience long time lurker first time poster I was wondering while in the shower as many of my hypothetical questions originate whether it is possible to create an electromagnetic field strong enough to repulse all the electrons from a solid leaving only protons which would subsequently all be repulsed and effectively vaporise a solid object How strong would the field have to be to do this ,1385718340.0,Electric Field Capable of Vaporising a Solid,3,askscience,top_day
stetelepta,1,2,1rp77u,2,httpiimgurcomVxPbaCpng,1385713626.0,Theres a tiny dot in the SDO footage at  Could that be ISON,4,askscience,top_day
CHESTERCPPERPT,2,2,1rp54b,2,,1385710598.0,When scientists announce they discovered which gene causes alcoholism schizophrenia certain forms of cancer etc what are the implications for how that can better humanity  finding cures engineering offspring etc,4,askscience,top_day
Downvotemyaccount,3,1,1rp4yk,2,,1385710425.0,Why wouldnt the Universe eventually collapse in on itself from the constant pull of gravity,3,askscience,top_day
delawaregal,1,0,1rp4n7,2,Inspired by thishttpwwwredditcomrspacecommentsrnjasecondsolarsystemlikeoursdiscovered article They discovered a second solar system like ours with the small rocky planets in the orbits closest to the star and the gas giants on the outer orbits Is there a reason for this formation Is it possible for gas planets to be closer to the host star,1385710044.0,What determines the arrangement of different types of planets in solar systems,2,askscience,top_day
honeybeebuzz,0,0,1rp1ze,2,When I smoke if I hold the cigarette slightly down sometimes it follows my finger before going straight up into the air Why does it do this,1385706887.0,Why does the path smoke travels cling to objects,2,askscience,top_day
xian,1,2,1rp1tp,2,It seems that if we inserted a gene that coded for a protein which broke down the pesticides into their genome then that gene would rapidly spread through the population essentially solving the problem at least for the bees without needing to use different pesticides,1385706721.0,Would it be possible to genetically engineer bees with an immunity to the pesticides which are currently killing them off,4,askscience,top_day
buyongmafanle,2,0,1rp0s1,3,After my eye surgery I went from  to  I felt I had ridiculously good eyesight Since  is defined as average eyesight that made me wonder what the best vision measurement ever recorded or possible for the human eye would be,1385705632.0,What is the maximum recorded or possible human vision measurement as defined by a  definition,3,askscience,top_day
wickedguru,4,0,1royyw,3,If the dinosaurs ruled the Earth what prevented the process of them reevolving after they were wiped outOther mammals surviving Environmental changesIs it possible for a species to evolve again once it has become extinct,1385703810.0,Why didnt dinosaurs evolve again after they went extinct,3,askscience,top_day
miibc,3,1,1romjn,2,If you remove all water from Earth can you fill in all of the oceans up to sealevel with the earth above sealevel,1385691957.0,If you take the total amount of land mass above sealevel is it equal to the total amount of sea water,3,askscience,top_day
OxCAFEBABE,4,1,1ro8bz,2,Is it possible to cobine several flash memory units together to create massively parallel data storage unit Because  units with MBs reading speed would already make GBs more than most SSDs,1385677971.0,Cluster of flash memory units,3,askscience,top_day
TheHansen,0,2,1rqfma,0,A gyroscope resists rotation so will a gyroscope resist the rotation of the earth What effect does gravity have on this  if any ,1385761353.0,What are the effects of gyroscopic forces on the rotation of the earth,1,askscience,top_day
Alawishus,0,1,1rqeus,0,From a very laymans understanding of the constituents of the universe it seems plausible that maybe space time is what spins And the size  of the mass controls the viscosity between matter and space time So more massive objects interact with space time with greater friction causing the warping effect around massive objects Why is this stupid,1385760756.0,Does the universe spin,1,askscience,top_day
Jubguy,1,2,1rqeob,0,,1385760631.0,What causes different lifespans across different speciese of animals Does size have a factor Great Dane having shorter lifespan than a yorkie and if so why isnt it consistent across all animals,2,askscience,top_day
SavageBillah,1,1,1rp9gl,1,I recently started looking closer at Nikola Teslas work and when something really sparks my interest Ill read the Patent When reading about the Wardenclyffe Tower I was beyond interested To think Unlimited free energy wirelessly sent all over the worldSo Heres the PatenthttpwwwgooglecompatentsUSI would really appreciate it if someone would take a look at it and let me know what they think Is this possibleSide note I also think its amazing I can read something Nikola Tesla wrote almost  years ago If I could meet anyone from history I think it would be him,1385716869.0,Does Nikola Teslas Wardenclyffe Tower work Patent US,2,askscience,top_day
jkthe,2,0,1rp6wm,2,I remember reading in a book that the maximum possible processing speed of a computer is limited by the speed of light How is this possible,1385713146.0,How is processing power affected by the speed of light,2,askscience,top_day
Fusionnn,5,1,1rp2py,1,If you look at a dice the side that is a  has  indentations which would create  times the amount of drag compared to the side with  because there is more surface area If you rolled an infinite number of times then wouldnt the dice not be random,1385707702.0,Would a dice not truly be random since the indentations on each side have different surface area and ultimately different air friction,2,askscience,top_day
mediokrek,2,1,1rp0ya,1,Im working on a game and have a bit of an issue Ive been wrestling with  The game takes place in a spacecraft orbiting in an eccentric orbit which takes it near the edge of the solar system and I need a good way of generating gravity on the ship  Ideally Id like to keep with as hard of scifi as I can which is where Im running into issuesMy original plan called for a ship which simply accelerated at a constant rate of ms which would have provided the gravity needed  A change in design from a ship exiting the solar system to one orbiting rendered that unusable  A rotating ship that uses centrifugal force for its gravity could still work but is inconvenient for some gameplay sequences I have in mindSo I figured Id check with you  Are there any other ways of simulating gravity in space  Even theoretical methods would be immensely helpful  Thanks ,1385705834.0,What are some less known ways of simulating gravity on a spacecraft,2,askscience,top_day
optimister,0,0,1rozgj,1,The history of science is a process where old theories are disproved and displaced by newer ones but are there exceptions to this  Can you think of examples of older rejected theories or views in your field that eventually came to be accepted as valid  edit example In Astronomy Aristarchus heliocentric theory was rejected in favour of the geocentric theory though it would come to be acknowledged and adopted centuries later  ,1385704299.0,Examples of scientific regression,1,askscience,top_day
EdgarAllanBroe,3,2,1rozdg,1,Evolution is generally thought of either in terms of the predatorprey arms race or sexual selection both of which seem to reward extraordinary traitsmutations biggerfasterlouderbrighteretc But are there any examples of a species or evolutionary lineage losing or simplifying a previously advanced amp advantageous trait without going extinct A hypothetical example would be sabretoothed tigers evolving their massive sabreteeth to hunt a specific animal but upon a change in climate and available prey selecting towards smaller sabreteeth to prey upon a different animal  but along the same branch of the evolutionary tree not a case where a seperate smallertoothed relative stepped in to fill their niche ,1385704204.0,Are there any instances in the fossil record of a species devolving for lack of a better term,3,askscience,top_day
thedrunkmnk,4,0,1royxd,1,I know that EM waves differ in wavelength frequency and energy but is there a specific point when an EM wave becomes another What changes across these ranges of wavelengths,1385703765.0,Is there a specific range of wavelengths for say radio waves or xrays Why,1,askscience,top_day
vivalarevoluciones,2,0,1roj3s,1,,1385688653.0,How to improve seed beck effect  What material are the best energy harvesting thermocouples made from,1,askscience,top_day
kdbfh,4,5,1roh5n,0,,1385686636.0,Are all stars the same distance as we are from other stars Like is there stars that are really close to each other,5,askscience,top_day
xDmgx,3,0,1rofgc,1,,1385684883.0,Why when you shake a carbonated beverage is the carbonation released,1,askscience,top_day
StellarParallax,4,6,1rpvm6,0,I googled it but there wasnt much of an explanation  And also out of curiosity what would happen if earth stopped spinning does it relate,1385745293.0,Why does a ball stay on my finger when its spinning but fall when it isnt,4,askscience,top_day
Sneaky,4,2,1rpl5q,1,We are experimenting with plants and we would like to build a faraday cage to keep the electromagnetic radiation out but let light get in so that both our plants get an equal amount of light Would there be a way for us to do such thing and still be able to give it water and keep the temperature on a level we would like,1385735256.0,Faraday Cage that blocks Radio waves WiFi Phone but lets light through,3,askscience,top_day
Spangel,2,3,1rpiyx,0,Are there documented cases of this happening  What would it take how far would the cars have to drive like this etc,1385732337.0,Can a car race car or example draft another car to the point where the engine is overheated due to the airflow being reduced to the point of not cooling the engine good enough,3,askscience,top_day
JellyfishPies,2,1,1rp4cp,0,This sounds like a question that would come from either a complete idiot or a th grader maybe a complete idiot th grader though i pride myself on being fairly intelligent the only issue is that i faced a serious autoimmune disease in Elementary School which caused me to be deprived of some key early education purely due to my illness Hopefully that didnt come to clear through grammaticalspelling errors THE ACTUAL QUESTION You woundt believe how hard it is to get an answer without getting that brain numbing television show flooding your results Quite simply what is the big bang and how did it happen andor begin I heard something about a supernova Please explain,1385709665.0,What iswas the Big Bang,1,askscience,top_day
monstazilla,4,2,1rp2hf,0,,1385707450.0,If I am bench pressing a lb bar with lb weights on each end is each arm doing half the total weight or is each arm doing the total weight individually,2,askscience,top_day
ballisticmissionary,1,1,1roywu,0,,1385703739.0,How can sharks detect such small amounts of blood in water over such a great distance,1,askscience,top_day
mcandroid,0,2,1roopm,1,Please check the following link for the images and questions I think it would be easier to understand the explanation while looking at the imageshttpimgurcomaUyqXI just have high school level physics knowledge but Im currently involved in some research on this matterThank you for your time,1385694047.0,Question related to hydrodynamics,3,askscience,top_day
tymuthi,2,2,1roi9d,0,If you were in the space station looking down would you be able to see the same storm cloud i would see looking upHow big would it have to be to be see by the space stationWhats the smallest thing you can see from the space stationA cool thing to see would be a picture from the space station and it shows a little circle which is what is visible to the human eye,1385687774.0,would you be able to see the clouds we see from space,2,askscience,top_day
SmellyRaghead,3,2,1rpcqt,0,Ive been reading this articlehttpsmediumcomhowtousetheinternetfbcdBut at the end there seems to be a contradictionIf anyone even you encrypt lock something with your public key only you can decrypt it unlock with your secret private keyIf you encrypt lock something with your private key anyone can decrypt it unlock but this serves as a proof you encrypted it its digitally signed by youWat,1385722071.0,Question on public key cryptography,1,askscience,top_day
Nebula,7,2,1rp33e,0,It seems like all the laws of physics we come up with are assumed constant through all of spacetime And since science doesnt allow for assumptions so I wanted to know what some of the evidence is that this is true,1385708110.0,What evidence do we have that the rules of physics have stayed the same throughout spacetime and will stay constanf,1,askscience,top_day
