author,comments,downvotes,id,score,selftext,time_created,title,upvotes,subreddit,type
nakedamerican,6,31,1r2xom,91,So the buddhist gets his hot dog one with everything Pays the hot dog vendor with a  bill The vendor takes the money and then nothing The buddhist is confused for a moment until the vendor repliesChange must come from within,1384976955.0,A buddhist monk walks up to a hot dog stand,122,jokes,new
kunair,12,81,1r2w9q,247,Because he knows where all the naughty girls live,1384976058.0,Why is Santa so jolly,328,jokes,new
jola,1,4,1r2ury,0,I gotta lilo,1384975092.0,You wont be hearing from me for a while Im being investigated for stealing swimming pool inflatables,4,jokes,new
LeavesItHanging,50,254,1r2uke,679,You should go up to a person and start telling them thisThere are three bees stuck in a jar Two females and one male The females want to get out of the jar and the male knows how to get out of the jar One of the females goes to the male and asks him How do I get out of this thing The male bee is very horny and he replies Fuck me and Ill tell you Out of desperation the female bee fucks him and says Now tell me how to get out of this jar The male keeps his promise and tells the female bee to go round the corner and shoot upwards the jar lid will pop open She complies and does what he said she goes round the corner and goes up but she hits the lid so hard that she dies and it lid remains closedNow there is one male and female bee The last female bee is also desperate to get out so she goes to the male bee and asks him How do I get out of this jar The male bee being very horny says again Fuck me and Ill tell you The female being equally desperate fucks him and he tells her how to get out go round the corner and shoot upwards the jar lid will pop open Same advice he gave to the first bee The second female bee listens to him and she goes round the corner and shoots upwards she too hits the lid and falls down and diesNow the male bee is remaining alone in the jar He feels lonely and he knows how to get out of the jar So he does what he told the female bees goes round the corner and shoots up The jar pops open and he leavesAt this point the person youre telling it to would be like HowTo which you should reply Fuck me and Ill tell you,1384974956.0,Three bees in a jar,933,jokes,new
kokain,1,29,1r2rjv,121,A woman woke in the middle of the night to find her husband missing from their bed In the stillness of the house she could hear a muffled sound downstairs She went downstairs and looked all around finally finding her husband in the basement crouched in the corner facing the wall and sobbing What  s wrong with you she asked himRemember when your father caught us having sex when you were sixteen he replied And remember he said I had two choices I could either marry you or spend the next twenty years in prison Baffled she said Yes I remember So what I would have been a free man today,1384973033.0,A woman woke in the middle of the night to find her husband missing from their bed,150,jokes,new
Fileobrother,1,0,1r2qe7,1,The handicap,1384972281.0,Whats the most important part of a vegetables golf stats,1,jokes,new
JimmyNuggets,0,8,1r2ppe,9,Knock KnockWhos thereInterrupting CowInterrupting Cow whoMoo FUCK,1384971804.0,Knock knock,17,jokes,new
CullenRob,9,22,1r2oyy,68,Ten tickles,1384971330.0,What does it take to make a squid laugh,90,jokes,new
kokain,1,14,1r2mb8,26,A blonde a brunette and a redhead all work at the same office for a female boss who always goes home earlyHey girls says the brunette one day lets go home early tomorrow She  ll never know So the next day they all leave right after the boss does The brunette gets some extra gardening done the redhead goes to a bar and the blonde goes home to find her husband having sex with the female bossShe quietly sneaks out of the house and vows to return home at her normal time the next dayIn the morning the brunette says That was fun we should do it again sometimeNo way says the blonde I almost got caught  ,1384969565.0,A Blonde a brunette and a redhead,40,jokes,new
laxerado,9,104,1r2jlg,248,The first guy walks up to the bar and sits down The bartender asks him what hes drinking The man says Ill have a rum and coke The bartender then reaches behind the bar and after a couple seconds the bartender hands him and apple What the hell is this I asked you for a rum and coke damnit the bartender looks to him and says Trust me just eat No way man this is an apple I want my drink Trust me says the bartender So the guy decides ehh why not and bites into it Whoa he exclaims That tastes like rum Flip it over says the bartender And so he does Whoa he exclaims again this side tastes like coke Thats amazing how did you do that The bartender says nothing and gives the man a wink The second guy walks in sits down and orders a gin and tonic then goes through the same thing as the first and finally bites into it Whoa he says that tastes like gin Flip it over says the bartender That tastes like tonic Thats amazing And now the third guy walks up with the first two explaining to him how awesome this bartender is These apples taste just like the drinks we ordered exclaimed the first He can make it taste like anything you want says the second guy Anything the third guy asks Well Mr Bartender in that case I want one that tastes like pussy Thinking he had him stumped the bartender shrugs and after a couple seconds hands him an apple He bites into it and immediately spits it out This apple tastes like Shit he yelled The bartender replies flip it over,1384967799.0,Three guys walk in to a bar,352,jokes,new
busykat,7,14,1r2ia7,23,Noeye deer Note we are from Hicksville USA This may not make sense without the Midwestern accent ,1384966949.0,What do you call a deer without eyes,37,jokes,new
sflo,0,4,1r2hzw,0,They enter the elevator and he asks her Are you going down She says no Then he asks Would you like to,1384966765.0,A guy follows a cute girl into an elevator,2,jokes,new
boxofkangaroos,7,18,1r2hay,10,,1384966277.0,Why was six afraid of the rhetorical question,28,jokes,new
kokain,9,89,1r2g2x,294,A man and a woman are sitting beside each other on a flight to New YorkThe woman sneezes takes out a tissue gently wipes her nose and then visibly shudders for about ten secondsA few minutes later the woman sneezes againOnce more she takes a tissue wipes her nose and then shuddersA few more minutes pass before the woman sneezes and violently shudders againCurious the man says I cant help noticing that you shudder every time you sneeze Are you OK Im so sorry if Im disturbing you says the woman Im suffering from a very rare medical condition Whenever I sneeze I have an orgasmAre you taking anything for it he asks Yes  says the woman Pepper ,1384965499.0, Im suffering from a very rare medical condition,383,jokes,new
Laugarhraun,0,1,1r2fk1,0,The second ones a race for the cureShamelessely stolen from yesterdays SMBChttpwwwsmbccomicscomid,1384965145.0,Whats the difference between eugenics and a charity marathon,1,jokes,new
kokain,0,5,1r2edp,0,Humpty Dumpty sat on his bedAs Little Bo Beep was giving him head Just as he came she began to weepShe could tell by the tasteHed been screwing her sheep  ,1384964338.0,Humpty Dumpty  that sly bastard,4,jokes,new
tumadreporfavor,1,7,1r2ebt,0,I cant peanut butter my dick into your ass,1384964303.0,Whats the difference between peanut butter and jam,4,jokes,new
eggfriedrice,5,2,1r2bwa,0,and says to the owner id like a girl pleasethe owner replies sorry mate weve only got dead bodies todaythe man says oh ok then and hes led to a room with a dead body on a bed and starts to go at itjust as he is finishing the body starts to foam at the mouth and the man scared shitless screams shes alive shes alivethe owner comes running in and says oh ill get you another one this ones full,1384962450.0,A man walks into a brothel,2,jokes,new
quackdefense,0,3,1r2bk1,0,Why did Michael Jackson build Neverland RanchHe was fucking immature,1384962211.0,Neverland Ranch,1,jokes,new
banebot,0,8,1r25ts,0,Maya Ingenue ,1384957637.0,If Jennifer Lawrence was a poet what would her name be,3,jokes,new
paulasutton,0,14,1r23t6,8,For example I heard about a girl who lied to her husband about how she got pregnant and now there is an entire religion,1384955692.0,You know when you lie things can get out of hand very quickly,22,jokes,new
themndiddy,66,925,1r21l4,1344,AspareIguess,1384953175.0,What does a vegetable get in bowling,2269,jokes,new
madatspaghetti,8,11,1r1zkj,1,Said the blind to the deaf,1384950596.0,Lets see here,12,jokes,new
extralongnipples,2,13,1r1r4i,34,At least acne waits until  to come on a boys face,1384937048.0,Whats the difference between a priest and acne,47,jokes,new
Bassface,1,12,1r1qk0,14,He goes to the bartender and saysTwo beers mate One for now and one for the road,1384936154.0,A man walks into a bar with a big slab of asphalt under his arm,26,jokes,new
HuMn,2,14,1r1pyy,1,Write Please turn over on both sides of a page and hand it to her ,1384935269.0,How do you keep a blonde busy,15,jokes,new
paulasutton,23,160,1r1pbd,267,I at least hope they separate us by music genre,1384934349.0,If we all end up going to jail for downloading music,427,jokes,new
CursedDemon,1,4,1r1nqw,1,A periodic table,1384932295.0,What do you call a grumpy girls desk,5,jokes,new
OhSchistGneiss,0,7,1r1mp4,0,What do you call it when a person in a wheelchair tries to get through a nonautomatic doorA tard time,1384931022.0,What do you call,4,jokes,new
kuttanpilla,3,18,1r1mn0,20,I dont understand why she threw a fit though ,1384930963.0,I complimented someone for their amazing mustache,38,jokes,new
SpartanMonkey,0,9,1r1kgj,0, Im going back in time and getting a hipster implant before metal was cool,1384928709.0,Ive been seeing a lot of commercials for lawsuits concerning metal on metal hip implants,6,jokes,new
ttnorac,0,9,1r1kfr,0,No wait it was a horse So a man comes into a horse ,1384928680.0,A man comes into a bar,6,jokes,new
corexbit,0,5,1r1kc3,1,A man was sitting in a bar drinking a pint when the bartender asks Why the long face The man replies I was fired today for drinking on the job Damn where did you work the bartender asked The man sighs and says back The sperm bank,1384928578.0,A man was sitting in a bar,6,jokes,new
brunu,13,89,1r1ix7,55,Now hes just somebody that we used to know,1384927156.0,Does anyone remember Gotye,144,jokes,new
mycockyomama,5,15,1r1guj,22,When a man and a woman get married they apply for a marriage license  When two lesbians tie the knot what do they getA liquor license read it out loud,1384925287.0,A joke from my yo patient earlier today,37,jokes,new
haggs,13,26,1r1ftx,39,If youre forced to try it as a kid you probably wont like it as an adult,1384924412.0,What does anal sex and broccoli have in common,65,jokes,new
mydogdindoit,5,10,1r1fjz,0,,1384924178.0,Mother tells her computer geek son Go get a carton of milk and if they have eggs get  So he goes and returns with  cartons of milk,9,jokes,new
Mantis,0,9,1r1epz,0,One cuts them off the other sucks them off,1384923503.0,Whats the difference between a rabbi and a priest,7,jokes,new
Sockrats,0,4,1r1d6q,0,An eavesdropper,1384922290.0,What do you call a nosy pooper,3,jokes,new
stats,2,6,1r1css,0,Obscure facts or jokes that you know Or any ideas for like a really short sketch that would be great too The more nerdy the better,1384922012.0,Obscure facts or short sketches for beginning of classes,2,jokes,new
brady,1,5,1r1ax5,9,Juan on Juan,1384920588.0,What do you call two Mexicans playing basketball,14,jokes,new
Cowtippin,20,128,1r18cr,417,Getting a hand job from a chick is like watching the special OlympicsYou keep cheering them on but deep down inside you know you can do better,1384918714.0,Special Hand Job,545,jokes,new
Smithereens,0,8,1r166w,0,but my dad told me to face my fearsthought of this while washing my face,1384917234.0,I really didnt want to go the dermatologist,4,jokes,new
megaman,13,65,1r0zyz,109,A pirate walks in a bar with a paper towel on his head the bartender says whats with that the Pirate says ARR I have Bounty on me head,1384913086.0,A pirate walks in a bar,174,jokes,new
tritter,18,32,1r0y38,4, A fiveday holiday requires one overnight bag Phone conversations are over in thirty seconds flat You can open all your own jars When clicking through the channels you dont have to stop at the bits where someones crying All your orgasms are real You can go to the toilet without a support group When your work is criticized you understand that everyone doesnt secretly hate you Nobody wonders if you swallow You never have to clean a toilet You can be showered and ready to go in ten minutes You save time and money by washing up in bulk every thirdweek Sex never means worrying about your reputation If someone forgets to invite you to something it means thatthey forgot to invite you It doesnt mean that they hate you and he or she can still be your friend You can quietly watch a game on TV with a mate for hours without it ever occurring to you that hes mad at you You never look at the size of a babys head and break into asweat You can piss anywhere man Hot wax never comes near your pubic area One mood all the time Same work more pay Grey hair and wrinkles add character The remote control is yours and yours alone No such thing as bunnyhopping half an inch above the toiletseat People dont look at your chest when youre talking to them You can buy condoms without the chemist imagining you arenaked If you dont call your mate when you say you will he wonttell your other friends and they wont try to work out what theproblem is One day you will be a dirty old man and youre looking forwardto it You never have to miss a sexual opportunity because yourenot in the mood Not liking a person doesnt exclude having great sex withthem Life will go on if the bed sheets dont get changed once in awhile Biological clock Having a beer belly is a perfect reason for wearing a tshirt Your friends can be trusted never to trap you with So noticeanything different None of your coworkers has the power to make you cry You dont have to shave below your neck You dont have to curl up next to a hairy arse every night You can be thirty and single and nobody even notices You can write your name in the snow with your piss Chocolate is just another food Flowers fix everything You never have to worry about other peoples feelings You get to think about sex  per cent of your waking hours Reverse parking is easy Foreplay is optional Window shopping is what you do when you buy windows You dont have to clean your house if the meter reader iscoming You never feel compelled to stop a mate from getting laid Car mechanics tell you the truth You dont give a fuck if no one notices your new haircut Ryan Gosling or Chris Hemsworth does not exist in your universe Angelina Jolie does,1384911925.0, Reasons Why its Better to Be a Man Than a Woman,36,jokes,new
jackshazam,3,11,1r0ww2,4,The pilot was a loaf of bread But how did the plane take offYeast Rises,1384911131.0,Why did the plane crash,15,jokes,new
soapbutt,0,11,1r0kir,0,Bidet mate ,1384903059.0,How does an Australian clean is bum,7,jokes,new
randomfanboy,4,24,1r0jx0,27,Tequila,1384902666.0,Why did the Mexican push his wife off a cliff,51,jokes,new
randomfanboy,0,15,1r0iwh,20,Toucan play at that game,1384902062.0,What does a bird say when it wants revenge,35,jokes,new
Cowtippin,6,31,1r0hra,93,I just ordered a chicken and an egg We shall see what one comes first,1384901350.0,Ebay is great,124,jokes,new
DONTPMMEURTITS,3,7,1r0ff1,3,Son they can both look out the window,1384899938.0,Why do tweekers do it doggie style,10,jokes,new
BigDeeDs,5,16,1r0ewf,50,Uncles,1384899624.0,What is worst than ants in your pants,66,jokes,new
OldSchoolCoolCool,7,2,1r0beq,10,It was the classic prisoner in a gulag tells the story of how he got there format and this guy was explaining how he started off as the welltodo general manager of a factory or something had his own car and at some point he made a mocking comment about the government so he was demoted to midlevel management where he had to take the bus and he made another disparaging comment so he was demoted to some bluecollar job where he had to ride a bike to work I think the punchline was something likegt and one day I had put my bike alongside a fence and was about to go to work when a policeman said you cant leave your bike here a parade with government officials is scheduled to go through this street later and I replied oh itll be fine I have a good padlock and thats how I got hereSearched online and looked through a few Soviet joke collections to no avail Help me rjokes I couldnt find a more appropriate subreddit but feel free to redirect me,1384897524.0,Request Help me remember a Soviet joke,12,jokes,new
iJustnoreason,1,7,1r082f,0,,1384895477.0,Do you like rhetorical questions,6,jokes,new
danimal,10,70,1r05mt,176,Bob had broken his leg and his buddy Mick comes over to see himMick How you doinBob Fine Hey do me a favor go upstairs and get me my slippers My feet are freezingMick goes up and sees Bobs hot  year old twin sisters lying on the bed He says your brother sent me up to have sex with both of youThey say prove itMick shouts downstairs Bob both of themBob shouts back of course Whats the point of fucking one,1384893958.0,A fucking mistake,246,jokes,new
MoohLeprechuan,4,11,1r01tl,0,A walk,1384891558.0,What do you call a fly with no wings,7,jokes,new
Googolplex,9,35,1r01b2,113,If you ever want to see who is more loyal your dog or your girlfriend just take both of them in their sleep and put them in the trunk of your car Drive around for a couple of hours park open the trunk and see which one will be happy to see you,1384891245.0,Dogs vs Girlfriends,148,jokes,new
gentlebot,0,8,1qzzg8,3,I dont know how to put this butIm kind of a big deer,1384890075.0,What did the Japanese buck say to the doe he was courting OC,11,jokes,new
SpiderDice,2,14,1qzx4i,25,This is actually a true storyMy friend who was an EMT working in South Los Angeles was called to a Domestic Violence scene in Compton Upon arriving on the scene a man was sitting on the front porch holding the back of his head where blood was spilling out Are you okay What happened hereI was tryin to get some stank on my hang low and the bitch hit me over the head with a smoothie Whoa Calm down I cant understand you sir What exactly happened I told you I was tryin to get some stank on my hang low and the bitch hit me with a smoothieWhat does that mean Stank on my hang lowYeah man My dick suckedOkay But the hell is a smoothieA smoothie You know that thing that makes your clothes flatMy friend couldnt help but bust out laughing,1384888583.0,An EMT was called to a scene in the ghetto,39,jokes,new
kokain,15,50,1qztu8,237,A farmer ordered a hightech milking machineIt happened that the equipment arrived when his wife was away so he decided to test it on himself first He inserted his penis into the equipment turned the switch on and voila everything else was automatic  He really had a good time because the equipment provided him with as much pleasure as his wife did When the fun was over he found that he could not take the instrument offHe read the manual but did not find any useful information He tried every button on the instrument Some made the equipment squeeze shake or suck harder or softer but still without successPanicking he called the supplier  s Customer Service Hot LineHello I just bought a milking machine from your company Its fantastic But how can I take it off the cows udderCustomer Service replied Dont worry The machine was programmed to release automatically after collecting about two gallons of milk ,1384886578.0,A farmer ordered a hightech milking machine,287,jokes,new
qwertyqyle,4,6,1qzqgh,5,So a man took a trip to Jamaica He was having a great time In the morning he enjoyed some world famous Blue Mountain coffee Around lunch time he tried some ganja and joined a drum circle Later that evening he was at a local bar had some Rum and a couple red stripes He made his way to the toilet to relieve himself when he noticed something odd on the man standing next to him Hey Im not trying to be a creep he said but I think we have the same initials I see you have WN tatooed on your cock The Jamaican laughs and replies Nah man when its fully erect it says Welcome to the beautiful island of Jamaica man,1384884469.0,Jamaican Holiday,11,jokes,new
carmichael,3,5,1qzqg1,8,The second one is a race for the cureSourcehttpwwwsmbccomicscomid,1384884466.0,Whats the difference between eugenics and a charity marathon,13,jokes,new
ydno,61,1549,1qzibm,1843,You know how sometimes even when youre not hungry youll get tempted to eat something just because its in front of you      Well thats how I lost my job as a gynecologist,1384879354.0,You know how sometimes,3392,jokes,new
persianduck,4,90,1qzhwa,179,Just because Im in the majors and shes a minor Doesnt mean it cant happen,1384879059.0,I hate when people say Shes out of your league,269,jokes,new
DuckTwizzler,0,5,1qzb61,0,Pulled a muscle,1384874520.0,What did the lobster do at the disco,4,jokes,new
tritter,4,26,1qz8it,21,Tell him that asylum seekers kill pedophiles,1384872476.0,How do you confuse a Daily Mail reader,47,jokes,new
merryjester,1,32,1qz80v,60,The judge looks down from the bench and says Mister MouseI cant believe what Im hearing You say you want to divorce your wife because shes crazyMickey replies Your honor I didnt say Minnie was crazy I said she was fucking Goofy,1384872081.0,Mickey Mouses divorce hearing,92,jokes,new
Legithmus,17,103,1qz7zu,211,He took the rhombus,1384872056.0,Why was the mathematician late for work,314,jokes,new
GoldCash,3,13,1qz7xp,2,You really cant tell the difference between a fish and an elephant,1384872015.0,Whats the difference between a fish and an elephant OC,15,jokes,new
BenakaGinge,3,8,1qz516,17,He was pulled under by a strong currant ,1384869341.0,Did you hear about the man who drowned in a bowl of Muesli,25,jokes,new
Randomflyingobject,16,75,1qz4n7,156,A man goes to the carnival with his family and they decide to split up to enjoy the rides The husband walks by a tent with a sign advertising a fortuneteller He doesnt believe in such thingsbut decides to go inside anyway A woman looks up from a small table with a crystal ball and speaks  Greetings would you like your fortune foretold  Thinking for a second he answers Id like some proof first that you arent a fake The woman looks into her crystal ball and answers  I see you have two lovely children with you this fine dayPff I have three children not twoThe woman grins back Thats what you think,1384868950.0,A man goes to the carnival,231,jokes,new
explodingbarrels,11,16,1qyy1c,9,Ive got more than enough to eat at home,1384860876.0,hes not all bad after an  hour shift at a local food kitchen mayor Rob Ford selflessly turned down a hot meal,25,jokes,new
Mukhers,0,16,1qyszi,0,None of us would be here today if Jesus hadnt slain that fucking giant pumpkin,1384852579.0,I think its a shame that young people today no longer even know why we celebrate Halloween,16,jokes,new
jey,1,8,1qyl0o,0,Nothing because he is the one who knocks,1384842247.0,What does Walter White say when someone tells him a knockknock joke,5,jokes,new
toyfulskerl,1,9,1qygz5,31,An Air Force Major is just finishing up at a urinal when a Marine Corp Captain enters the bathroom As the Marine is peeing the Air Force officer makes a show of carefully soaping and scrubbing his hands with military precision Just as the Air Force Major is drying off his hands the Marine flushes and heads for the doorYou know in the Air Forces they teach us that you should always wash your hands after you pee says the Air Force MajorReally replies the Marine In the Corp they just teach us not to pee on our hands,1384838090.0,Bathroom Etiquette,40,jokes,new
CheeseBadger,2,11,1qyg84,10,Grey Moose,1384837534.0,What brand of vodka does a Canadian drink,21,jokes,new
hzaybek,4,17,1qydp2,4,I made this joke up in like middle school I think,1384835465.0,What do you call a black dinosaur TYRONEASAURUS REX,21,jokes,new
chinabox,1,7,1qydek,0,Cantelope,1384835252.0,What is a homophobes favorite fruit,6,jokes,new
ZinMan,11,79,1qy4ip,270,I was banging this nice Lady over her kitchen table when we heard the front door open She said Its my husband Quick try the back door Thinking back I really should have ran  but you dont get offers like that every day,1384829175.0,Try the back door,349,jokes,new
kidjingo,3,8,1qy3hl,3,Root Beer and  scoops of ice cream,1384828491.0,How do you make a dead baby float,11,jokes,new
fandapucker,2,22,1qy2lh,1,A genie appears and tells the men that when they jump off the cliff they will land in a giant pile of whatever they yell while falling The black man runs and jumps and yells BITCHES and lands in a crowd of sexy women The white man jumps off and yells MONEY and lands in stacks upon stacks of hundred dollar bills The Asian man is running and as he approaches the edge of the cliff trips on a rock and yells SHIT,1384827894.0,A black man white man and Asian man are standing on a cliff,23,jokes,new
grackychan,94,698,1qy1iq,1368,Friendship between womenA woman didnt come home one night The next day she told her husband she had slept over at a friends house The man called his wifes  best friends None of them knew about itFriendship between menA man didnt come home one night The next day he told his wife that he had slept over at a friends house The woman called her husbands  best friends Eight of them confirmed that he had slept over and two claimed that he was still there ,1384827248.0,Friendship between men and women,2066,jokes,new
remainclam,20,143,1qxzxm,267,He took the chickens job,1384826242.0,Whyd the Mexican cross the road,410,jokes,new
