author,comments,downvotes,id,score,selftext,time_created,title,upvotes,subreddit,type
HitlersKitchen,21,131,1qo21a,203,She was wearing mittens,1384487115.0,Why could no one hear Helen Keller cry for help when she fell off a bridge,334,jokes,new
brendanvista,5,21,1qo1t0,10,One upon a time a guy goes into a bar in Louisiana where theres a robot bartenderThe robot says What will you haveThe guy says WhiskeyThe robot brings back his drink and says to the man Whats your IQThe guy says The robot then proceeds to talk about physics space exploration and medical technology The guy leaves but he is curious So he goes back into the barThe robot bartender says What will you haveThe guy says WhiskeyAgain the robot brings the man his drink and says Whats your IQThe guy saysThe robot then starts to talk about NASCAR Budweiser the Saints and LSU TigersThe guy leaves but finds it very interesting so he thinks he will try it one moretime He goes back into the barThe robot says What will you haveThe guy says Whiskey and the robot brings him his whiskeyThe robot then says Whats your IQThe guy says Uh about The robot leans in real close and says So you people still happy with Obama and the government,1384486936.0,Discriminating Robot Bartender,31,jokes,new
TumescentAngel,29,338,1qnod8,898,Just today I had to explain to someone that there is a vas deferens between a testicle and a penis,1384476905.0,Some people are ignorant about anatomy,1236,jokes,new
kathyee,1,20,1qnm1q,16,A large jet plane crashed on a farm in the middle of rural Kentucky Panic stricken the local sheriff mobilized and descended on the farm in force By the time they got there the aircraft was totally destroyed with only a burned hull left smoldering in a tree line that bordered the farmThe sheriff and his men entered the smoking mess but could find no remains of anyone They spotted the farmer plowing a field not too far away as if nothing had happened They hurried over to the mans tractor Hank the sheriff yelled panting and out of breathDid you see this terrible accident happen Yep Sure did the farmer mumbled unconcerned cutting off the tractors engine Do you realize that is Air Force One the airplane of the President of the United States Yep Were there any survivors Nope Theys all kilt straight out the farmer answered I done buried them all myself Took me most of the morning President Obama is dead the sheriff asked Well the farmer grumbled restarting his tractorHe kept asaying he wasnt    But you know how bad that sumbitch lies,1384475183.0,Air Force One crashes in a field,36,jokes,new
ADillPickle,4,7,1qnlrc,0,They get crabby Badum tsss,1384474976.0,Why shouldnt happy people hang out with crustaceans,5,jokes,new
Takaian,0,20,1qnll4,17,when they decide to stop and check out the new neighbors who moved in on their block They walk over to the tall fence surrounding the yard and the first boy looks through a hole He finds himself staring at a beautiful naked sunbathing woman He wildly gestures for the second boy to look and then the third boy However when the third boy looks through the hole after a few seconds he screams and runs down the street towards his house The other two boys look at each other in bewilderment and go home very confused The next day the boys stop by the house in hopes of seeing the same woman and again find her sunbathing naked Yet again once the third boy looks through the hole he screams and runs down the street The other two boys are still extremely confused as they walk homeThe following day they stop by the house again and lo and behold the woman is out sunbathing naked again When the third boy gets his turn and screams the other two grab him and prevent him from running off The first boy says Look Every time you take a look at that lady you scream and take off What is wrong with youThe third boy turns and replies Wellmy mom always told me that if I ever looked at a woman naked I would turn to stoneand I felt a part of me getting reeeallly hard,1384474859.0,Three young boys are walking home from school one day,37,jokes,new
ICanSpellCheckForYou,13,32,1qnlcg,137,That means no black peopleCredit goes to a person on either Americas Got Talent or Britains Got Talent cant remember which,1384474687.0,My kids will be friends with people of all colors of the rainbow,169,jokes,new
StylesAreIncomplete,1,7,1qn886,0,He was a seminal fluid dynamicist,1384465825.0,What is the historical significance of Sir George Stokes,6,jokes,new
righteousguy,1,6,1qn6xb,0,I was surprised I didnt know they worked,1384464964.0,My mother in law fell down a well,5,jokes,new
Davex,5,14,1qn65m,0,Beef Stroganoff,1384464496.0,What do you call a masturbating cow,9,jokes,new
sarge,7,42,1qn5zp,52,When I was a boy I prayed and prayed for a bike but never got one Then I realized that God dont work that way So I stole a bike then asked for forgiveness  ,1384464389.0,Little Johnny,94,jokes,new
inthyface,1,20,1qn5q0,0,It depends on how close they are to the MexicoUnited States border,1384464211.0,Who is faster Speedy Gonzales or Road Runner,17,jokes,new
whiteferrett,7,113,1qn4l1,212, This penguin was driving cross country when suddenly his car starts to smoke he pulls into a small town and leaves his car with the local mechanic The mechanic tells him it will be done in about  hours and he should go wander the town for a while So the penguin wanders around checking a few stores and then getting ice cream He checks his watch and realizes it had been  hours already When he gets back the mechanic tells him Looks like you just blew a seal The penguin quickly wiped his beak embarrassed and replied No no I swear its just ice cream,1384463482.0,This penguin was driving cross country when suddenly his car starts to smoke,325,jokes,new
Furevuralone,2,14,1qn3z0,0,You could call it memento,1384463102.0,Im a female with a male foot fetish,13,jokes,new
ChinSoup,1,6,1qn3de,0,,1384462702.0,Which former British darts champion had the skin from one of the digits on his feet ceremoniously removed,1,jokes,new
spitacular,1,7,1qn1qc,13,A few months after he got home he got a call from a woman he had spent some time with while he was out of town Remember me from a while back We had a few drinks and I was a good sport we had a good time He said Of course how could I forget about you Janet She told him Well I just found out Im pregnant and Im going to kill myself The businessman chuckled and said WOW you are a good sport,1384461665.0,Did you hear about the man who went on a business trip,20,jokes,new
SpilliamWooner,3,19,1qn1ph,0,,1384461650.0,Have you ever heard a joke with no punchline,19,jokes,new
cumbubs,1,10,1qn15m,0,Niggers and poo are the same thing,1384461316.0,Why did the black man wipe his ass,3,jokes,new
PlatypusManifest,1,0,1qn0nl,1,I cant even run,1384461009.0,Im not a racist,1,jokes,new
deputydavis,22,43,1qmzvm,163,Joke sent to me from family couldnt find it hereOLD people  have problems that you havent even considered yet      An yearold man was requested by his  Doctor for a sperm count as part of his physical exam The doctor gave the man a jar and said Take this jar home and bring back a semen  sample tomorrow  The next day the yearold man reappeared at the doctors office and gave him the  jar which was as clean and empty as on the  previous day  The doctor asked what happened and the man explained Well doc its like thisfirst I tried with my right hand but nothing   Then I tried with my left hand but still nothing Then I asked my wife for help  She tried with her right hand then with her left still nothing  She tried with her mouth first with the teeth inthen with her teeth out still  nothing  She even called up Arleen the lady next door and she tried too first with both hands then an armpit and she even tried squeezin it between her knees but still nothing The doctor was shocked You asked your  neighbor     The old man replied Yep none of us could get the jar open  ,1384460519.0,Old Man Problems,206,jokes,new
batman,2,9,1qmyot,14,Kick his sister in the mouth ,1384459782.0,How do you circumcise a redneck,23,jokes,new
Themoneymancan,4,20,1qmwoi,0,That way her boyfriends can say they Mount Everest,1384458492.0,If I ever have a daughter I am naming her Everest,19,jokes,new
naturehatesyou,0,12,1qmuhb,12,Yours,1384457064.0,What kind of cigarettes do California kids smoke,24,jokes,new
erics,1,7,1qmt9k,0,I dont want any of these stupid puns or jokes that arent actually funny Does anyone have any jokes that are actually funny that are not racist Even if they are racist or any insults The shorter the joke the better,1384456262.0,Need funny jokes  preferably not racist,2,jokes,new
Chickennii,4,10,1qmski,0,,1384455794.0,A joke I thought of I dont know if fo sho means for short or for shore but I like to think that people are being overly nautical,6,jokes,new
GooLuster,2,16,1qmrck,22,He kills me,1384454958.0,Ive got a friend whos a psychopath and hes got a brilliant sense of humour,38,jokes,new
hadowfax,1,11,1qmr66,0,Well they made headlines ,1384454842.0,Did you guys hear about those new corduroy pillows,6,jokes,new
y,1,25,1qmqmb,5,Job Interview Human Resources Manager What is your greatest weakness Old Man  Honesty Human Resources Manager I dont think honesty is a weakness Old Man  I dont really give a shit what you think,1384454469.0,Why Old Men Dont Get Hired,30,jokes,new
Blawdfire,10,34,1qmppj,40,Because shes dead,1384453882.0,Why cant Helen Keller drive a car,74,jokes,new
Phoneking,0,4,1qmjte,0,A boy and a girl were playing Hide and Seek When they finished playing the boy says to the girl Hey I learned this new game last night called The Parking Garage The girl says Oooh how neat How do you play it So they ran and went into the girls house  minutes later the girls parents heard screaming so they ran upstairs opened the girls bedroom door and found the boys testicles bleeding The mother asked What just happened up hereThe girl says Oh we were playing this game called The Parking Garage but his car wouldnt fit so we had to cut the wheels off,1384449958.0,My best joke The Parking Garage,3,jokes,new
acoustickitty,8,89,1qmik3,168,I dont know either but whoever did should get a no bell prize ,1384449116.0,Do you know who invented the Knock Knock joke,257,jokes,new
LexicalFap,0,7,1qmia4,2,He had the marx scheme,1384448937.0,Did you hear about the guy who aced the communism exam,9,jokes,new
MyCakeDayIsNov,14,44,1qmi04,128,Old age,1384448748.0,If Abraham Lincoln were alive today what would he be famous for,172,jokes,new
ironfalls,0,14,1qmhxz,5,During sex Santa suddenly stops amp remains motionlessWife What the hell are you doingSanta I have seen this on youtube Its called BUFFERING,1384448704.0,Another SantaBanta Joke,19,jokes,new
WhereintheOK,3,43,1qmh1s,77,Her mother frantically calls their priest requesting an exorcism She describes the details She has been spinning about wildly climbing on the walls running on the ceiling moving about nonstop The priest replies I dont know what you want me to do Sounds like shes already exercising plenty,1384448099.0,A daughter is seemingly possessed by a demon,120,jokes,new
WhereintheOK,0,14,1qmfqq,0,Theyre conceded,1384447176.0,I hate how the losers of every election maintain such a high view of themselves,13,jokes,new
parin,16,37,1qmfpg,64,beef stroganoff,1384447156.0,What do you call a masturbating cow,101,jokes,new
labaconator,6,15,1qme1x,41,He was reading road signs at  miles per hour,1384446081.0,Why did the blind driver have no hands,56,jokes,new
Plattbagarn,5,10,1qmb0n,0,The son of a family was growing up so the mother wanted the father to talk to him about the flowers and the beesLater on the father and son are out walking when the father suddenly asks  Son do you remember the field over there  Yes  Do you remember the girls we met there  Yes  Do you remember what we did to them  What of it Thats how the bees does it,1384443888.0,Parental advice,10,jokes,new
chanman,2,7,1qm3u5,20,,1384437705.0,What if there were no hypothetical situations,27,jokes,new
SarkyTyke,1,9,1qm3dq,12,NoHas it come out yet,1384437244.0,Have you seen the film constipated,21,jokes,new
cornbeef,4,9,1qlzjs,2,I bought a new house last week but the previous owners had put a really steep staircase in I did ask the estate agent but they just told me that the previous owners were that way inclinedI got caught vandalising my neighbours roof thankfully they have forgiven me and we have moved on Now I can start again with a clean slateI went to a car dealership and looked at a car that could only go in reverse I wasnt happy but ended up buying it i suppose thats just the way it goes,1384432578.0,My work colleague sees himself as the pun king he just made up these jokes opinions,11,jokes,new
ToteSport,14,18,1qlwsb,56,Paddy Englishman and Paddy Irishman are walking along the beach together when they come upon a lamp in the sand Being familiar with such clichés they picked up the lamp rubbed it and lo and behold a genie appeared before themFor releasing me from my prison I shall grant you both one wish eachPaddy Englishman goes first and thinks silently for a momentWell genie I love my country and Im sick of it being ruined by lazy immigrants who do nothing but live off of state benefits and handouts I wish all the immigrants were gone from my country and that it was just us English that lived there Furthermore I want a giant wall built around the coast and borders of England so nobody else can get inDone says the genie and poof Paddy Englishman is back in England with the rest of his compatriotsGenie says Paddy Irishman tell me more of this giant wall surrounding EnglandWell its over a mile high and half a mile thick Nothing can get in or out the genie repliedPaddy Irishman thought for a moment then looked to the genie and saidFill it with water,1384428390.0,Paddy Englishman and Paddy Irishman,74,jokes,new
Jivesliven,96,1655,1qlwgg,2017,He just wants to sit and cry in his wheelchair,1384427828.0,I thought my son would like that I bought him a trampoline but oh no,3672,jokes,new
Apiperofhades,9,63,1qlvn7,67,I was walking down the street when I saw a black guy holding a TV     I thought holy shit is that mine     I went home to check    But nah mine was at home polishing my shoes    ,1384426422.0,I saw a guy holding a TV,130,jokes,new
Elijah,2,4,1qltch,1,Hes to short to be an essaySorry if repostSorry if racist,1384422577.0,Why was the mexican midget a paragraph,5,jokes,new
XxsadisticTrexX,2,2,1qlsba,6,Freud rice,1384420896.0,What did the messed up psychologist have for dinner,8,jokes,new
Beishe,0,8,1qlqhz,0,Womens rights,1384417961.0,You guys wanna hear a joke,2,jokes,new
GatorJohnson,0,3,1qloyn,1,They marched backwards and the Polish thought they were leaving ,1384415620.0,How was Germany able to Take over Poland so easily,4,jokes,new
mindtrapped,0,6,1qlnn3,0,I dunno but the real question is howd they get in there in the first place,1384413809.0,How many mice does it take to screw in a lightbulb,3,jokes,new
RomanUA,1,11,1qlml0,0, in the front  in the back and  in the ash tray,1384412511.0,How do you fit  Jews in a car,5,jokes,new
proROKexpat,0,13,1qlkcj,8,A large jet plane crashed on a farm in the middle of rural Kentucky Panic stricken the local sheriff mobilized and descended on the farm in force By the time they got there the aircraft was totally destroyed with only a burned hull left smoldering in a tree line that bordered the farmThe sheriff and his men entered the smoking mess but could find no remains of anyone They spotted the farmer plowing a field not too far away as if nothing had happened They hurried over to the mans tractor Hank the sheriff yelled panting and out of breathDid you see this terrible accident happen Yep Sure did the farmer mumbled unconcerned cutting off the tractors engine Do you realize that is Air Force One the airplane of the President of the United States Yep Were there any survivors Nope Theys all kilt straight out the farmer answered I done buried them all myself Took me most of the morning President Obama is dead the sheriff asked Well the farmer grumbled restarting his tractorHe kept asaying he wasnt    But you know how bad that sumbitch lies,1384410025.0,A large plane crashed,21,jokes,new
JohnMakesHisMove,3,5,1qlj6o,6,Theyre making headlines,1384408887.0,Did you hear about the new corduroy pillows,11,jokes,new
ARCHMEDE,5,6,1qlhvr,5,Because it was pissed off,1384407638.0,Why did the condom fly across the room,11,jokes,new
DRBABYFOOD,1,10,1qlgtf,10,To show girls what its like to live with an annoying cunt,1384406720.0,Why did God invent the yeast infection,20,jokes,new
mycall,9,56,1qlgfe,95,Two engineering students were biking across a university campus when one said Where did you get such a great bike The second engineer replied Well I was walking along yesterday minding my own business when a beautiful woman rode up on this bike threw it to the ground took off all her clothes and said Take what you want The first engineer nodded approvingly and said Good choice The clothes probably wouldnt have fit you anyway,1384406380.0,Two engineering students were biking,151,jokes,new
ihaveaweirdq,2,10,1qlevx,14,Literally,1384405079.0,You gotta hand it to blind prostitutes,24,jokes,new
OldManMullet,0,5,1qleo4,1,big hands and big feet  out of ,1384404896.0,You know what they say about a guy with,6,jokes,new
thisisyourdad,3,7,1qldq3,10,A Texan gets pulled over for speeding The officer says You got an ID The Texan says  about what,1384404136.0,My fathers Texas joke,17,jokes,new
robertsmithistheshit,0,12,1qlbm4,28,He kneels before the priest and says Father Im afraid to confess somethingSpeak my son the priest consoles The man looks nervous but beginsLast night my wife and I were having dinner together for the first time in a while At one point right in the middle of the meal I looked up and noticed how ravishing she looked in her dress Our eyes locked and a spark flew between us that hasnt existed in years and I couldnt help myself I just grabbed her and tore off her clothes and we made love right there on the tableThere is no sin in being passionate with your wife my son the priest says You have nothing to confessThe man looks surprised Really Youre not going to kick us out of the churchHeavens no Why would I do thatWell they kicked us out of the restaurant,1384402452.0,A man goes to confession at his church,40,jokes,new
gregg,1,10,1ql6wj,3,Döppelspider,1384398882.0,What has  legs and speaks german,13,jokes,new
FellatioDunbar,89,1016,1ql3ma,1059,End a race ,1384396566.0,What did the Boston Bombers do that Hitler couldnt,2075,jokes,new
opi,8,14,1ql2vn,14,Because they cantelope,1384396053.0,Why couldnt the melons get married,28,jokes,new
opi,5,17,1ql0l2,48,He pasta way,1384394465.0,How did the Italian chef die,65,jokes,new
Brewbird,3,13,1ql0i8,4,Mother  pulls out picture from purse This is my son Abdullah He would have been  now but alas he became a martyrMother  Ah yes I remember when he lost his first tooth sighsMother  pulls out another picture This is my son Hussein He would have been  now but alas he became a martyrMother  Ah yes I remember when he took his first steps deep sighMother  pulls out yet another picture  This is my son Muhammed He would have been  now but alas he became a martyrMother  Ah yes I remember when he was born deepest sigh You know they blow up so fast,1384394408.0,Two Mothers Are Sitting Together At An Outdoor Café In Baghdad,17,jokes,new
aster,0,5,1ql0ct,2,after I destroy Uranus,1384394295.0,There will only be seven planets,7,jokes,new
atem,5,6,1qkzla,12,Ya ever hear the one about the Polish AstronautsYeah so they decided to go on a mission to the sun  The Americans called them up saying Poland  You cant go to the sun  Youll burn aliveThe Poles responded AHA  We go at night,1384393768.0,The Polish Astronauts,18,jokes,new
carydog,2,27,1qkzil,49,A black guy is walking through the ghetto one night when he kicks a trash can over and out comes a genie The genie says I am the ghetto genie I shall grant you one wish for freeing me from my wretched home The black guy says Just one I thought genies granted  wishes The genie replies Hey I got  Take it or leave it Just one so think hard The black says I dont need to think about it I wish to be white and surrounded by pussy The genie says Youre absolutely sure this is your single greatest wish The black guy says Yep Do it So the genie turns him into a tampon,1384393717.0,Ghetto genie,76,jokes,new
goatrentals,2,7,1qkxvl,2,Its the only country where burning fags is still acceptable,1384392519.0,I love Britain,9,jokes,new
ARedMailbox,4,8,1qkxho,6,Drew Brees The guys a saint,1384392222.0,Whos the nicest player in the NFL,14,jokes,new
iwantout,0,6,1qksyk,0,In the best life you haveAmerican SalaryChinese CookBritish HouseJapanese WifeIn the worst life you haveChinese SalaryBritish CookJapanese HouseAmerican Wife,1384389056.0,The Best and Worst Possible Life,4,jokes,new
ReighIB,1,9,1qks38,14,Give a woman a little and shell return a lotGive her some groceries and shell give you a feastGive her some sperm and shell give you childrenGive her some crap and shell give you a whole load of shit,1384388443.0,Women,23,jokes,new
AnonymousCommenter,1,32,1qkruq,175,A blind man enters a bar not knowing its ladies night He finds his way to a barstool and orders a drink After sitting there for awhile he yells to the bartender Hey you wanna hear a blonde joke The bar immediately falls quiet In a deep voice the woman next to him says Before you tell that joke sir you should know five things  The bartender is a blonde woman  The bouncer is a blonde woman   Im a  feet tall  pound blonde woman with a black belt in karate  The woman sitting next to me is blonde and is a professional weightlifter  The woman to your right is a blonde and is a professional wrestler Now think about it seriously Mister Do you still wanna tell that joke The blind man thinks for a second shakes his head and declares Nah  Not if Im gonna have to explain it five times ,1384388291.0,Ladies Night,207,jokes,new
FaceBreaker,0,4,1qkrk6,0,I dont wish for a lifetime supply every time I smell patchouli ,1384388095.0,Whats the difference between a hippie on fire and a lifetime supply of patchouli,2,jokes,new
TheTrooperKC,1,4,1qkl7l,1,At least she cant get the clap,1384383732.0,Did you hear about the prostitute with no hands,5,jokes,new
forgottenbutnotgone,0,7,1qkktg,0,He decided to Be Her Now,1384383483.0,Did you here Ram Dass is getting a sex change,2,jokes,new
jikerman,1,7,1qkkpg,3,A woman is at her fathers deathbed She hasnt seen him in years and now they only have a few moments leftDad Im sorry she whispersGoodbye Sorry he says Im dead,1384383414.0,A sad dad joke,10,jokes,new
takesjokeliterally,7,49,1qkkar,53,Nothing they were both stuck up cunts,1384383163.0,What did one tampon say to the other,102,jokes,new
mvanoort,2,7,1qkjc1,7,It goes pretty smoothly until you start hitting the rock ,1384382547.0,How is digging fence post holes like being the mayor of Toronto,14,jokes,new
LustInSpace,1,21,1qkj2z,13,The Diarrhea of Anne Frank,1384382382.0,Whats brown and runs in the attic,34,jokes,new
delicioushypocrisy,2,7,1qkfcn,0,Let me fill you in,1384380029.0,Has anyone ever told you what its like to be royally screwed,6,jokes,new
zlap,0,10,1qkcqj,0,Do I know youI follow you on twitter,1384378448.0,Did you like the movie yesterday How is Jerry doing at school Its a pity you broke up with Mark he was OK,4,jokes,new
ProfessorTairyGreene,3,12,1qkbc4,12,the bartender says Youre on buddy Theres no way you can fart the entire National Anthem So the guy pulls down his pants and starts crapping all over the bar The bartender shouts What the hell are you doing and the guy says What Even Pavarotti had to clear his throat,1384377585.0,A guy walks into a bar and bets the bartender he can fart the National Anthem,24,jokes,new
nathantheman,1,16,1qkb9b,0,He doesnt know hes black yet,1384377528.0,Why is stevie wonder always smiling,12,jokes,new
NJFTYM,2,4,1qk94k,0,My aunt got struck by lightning at a golf course It was in between the first and second holes something about her stance ,1384376227.0,My aunt got struck by lightning at a golf course,4,jokes,new
ThatDandyMan,3,5,1qk8x5,12,A corny one,1384376092.0,Whats the healthiest type of joke,17,jokes,new
NiceMeetingYou,1,1,1qk829,7,bracket,1384375563.0,What do you call a bee in a space rocket,8,jokes,new
Iconoclastics,6,49,1qk62t,141,The one Rabbi looks at the other and says I think I am going to go in there convert and get the  dollars The other Rabbi looks at him in disbelief and says You must be joking Your grandfather was a studious Rabbi in Russia your father emigrated to this country and also became a Rabbi and you have spent your whole life studying the Torah to also become a Rabbi how could you just up and decide to convert like that The other Rabbi shrugs his shoulders and walks into the church Several minutes pass by when he emerges to meet his incredulous friend who immediately asks So did you convert Yes he replies Well did you get the  dollars he asks to which he replies Is that all you people ever think about    ,1384374338.0,Two Rabbis are walking down the street and they walk past a Catholic church advertising a  payout for anyone who converts that day,190,jokes,new
everclaire,5,7,1qk4cr,7,In little Nazis,1384373238.0,How did Hitler tie his shoes,14,jokes,new
