author,comments,downvotes,id,score,selftext,time_created,title,upvotes,subreddit,type
jomama,4,13,1regj0,46,Beer nuts are  deer nuts are under a buck,1385359466.0,Whats the difference between beer nuts and deer nuts,59,jokes,new
JustGivingRedditATry,1,21,1reemh,29,Social netwerking,1385357926.0,What do you call making your booty clap for likes and upvotes,50,jokes,new
Albythere,6,30,1re5io,182,This morning I was in luck and was able to buy two boxes of Bud Light cheapI placed the boxes on the front seat and headed back home I stopped at a service station where a dropdead gorgeous blonde in a short skirt was filling up her car at the next pumpShe glanced at the two boxes of beer bent over and leaned in my passenger window and said in a sexy voice Im a big believer in barter handsome Would you be interested in trading sex for beerI thought for a few seconds and asked What kind of beer ya got,1385348799.0,Beer,212,jokes,new
KroganVanguard,1,9,1re4mi,28,Public indecency my ass,1385348116.0,The other day I was almost arrested for mooning,37,jokes,new
kdotrukon,4,27,1re1c0,30,Darn tootin this is so dumb im sorry,1385345466.0,What do you call a cowboy with a case of bad gas,57,jokes,new
ktajlili,8,29,1re06s,44,Once there was a woman sitting in the doctors office complaining of incessant gas She says to the doctor Ive been having silent farts all day I had one in the harris teeter one in church andum one right now The doctor replied I think you need to get your hearing checked ,1385344576.0,A joke my mommy told me ,73,jokes,new
docpepson,113,2472,1rdxt4,2146,Because Ken came in a different boxBadum tiss,1385342837.0,Why did Barbie never get pregnant,4618,jokes,new
DoctorCocktor,1,9,1rdtjb,0,Juan Andonlé,1385339476.0,What do you call your Mexican crush,4,jokes,new
ZinMan,0,18,1rdrbg,0,The first grade teacher was asking her class to think of a word that started with each letter of the alphabet She began with A Several students raised their hands but in the back Johnny a notoriously foul mouthed kid was jumping up and down pleading to be called on The teacher thinking Johnny would say something like asshole skipped hima dn called on Jennifer Apple Jennifer said Very good Jennifer said the teacher Next was B Again Johnny was jumping up and down with a raised hand The teacher thinking Johnny would say butthole or bastards instead called on Tommy Baseball said Tommy Next was C and Johnny immediately began jumping up and down wanting to be called on The teacher thought for sure Johnny would say Cunt so she called on Alice Cat said Alice On through the alphabet they went and by the time they reached R it became too obvious the teacher was ignoring Johnny She couldnt think of a bad word that began with R so she cautiously called upon JohnnyRATS Teacher he exclaimed The teacher was relieved not the best word but not that bad But Johnny wasnt done Big fucking rats teacher with huge cocks like that spreading his arms as wide as he could,1385337762.0,Johnny in st Grade,13,jokes,new
son,5,36,1rdqi0,94,She then began to strip and eventually got naked   When her orthodontist walked in he exclaimed obviously embarrassed Oh my  Im sorry you mustve walked in the wrong building  The doctors is next door  She assured him she was in the right building pointed to her vagina and said You put my husbands retainer in you can get it out,1385337132.0,A woman goes into her orthodontists office,130,jokes,new
vfcascaes,5,18,1rdpd4,0,,1385336201.0,Is Black Friday bigger than all the other Fridays,17,jokes,new
humanornament,1,14,1rdpct,1,Lets make like a baby and head out,1385336194.0,This party is boring,15,jokes,new
RainbowGod,2,13,1rdoet,0,,1385335476.0,My life,7,jokes,new
Albythere,6,31,1rdmq4,141,A Man went to the doctors office to ask for a Triple Dose of ViagraThe doctor told him that he couldnt allow him a triple doseWhy not asked the manBecause its not safe replied the doctorBut I need it really bad said the manWell why do you need it so badly asked the doctorThe man said My girlfriend is coming into town on Friday my exwife will be here on Saturday and my wife is coming home on Sunday Cant you see Ive got to have a triple doseThe doctor finally relented saying All right Ill give it to you but you have to come in Monday morning so that I can check you to see if there are any side effectsOn Monday afternoon the man dragged himself into the doctors officehis right arm in a slingThe doctor asked Good gawd What happened to you The man said No one showed up,1385334242.0,Triple dose,172,jokes,new
cromagnus,1,11,1rdlt7,0,I asked him why and he told me Beware of blood in the water The fearsome beast will bite your head clean off unprovoked when you least expect it,1385333580.0,A guy I know calls womens periods shark week,6,jokes,new
molafich,3,17,1rda7e,24,two fish swim into a concrete wall one turn to the other and saysDam,1385325342.0,two fish,41,jokes,new
FlyingMonkey,17,238,1rd7fv,492,A teacher asks her class If there are  birds sitting on a fence and you shoot one of them how many will be left She calls on little Johnny None they all fly away with the first gunshot The teacher replies The correct answer is  but I like your thinking Then Little Johnny says I have a question for YOU There are three women sitting on a bench having ice cream One is delicately licking the sides of the triple scoop of ice cream The second is gobbling down the top and sucking the cone The third is biting off the top of the ice cream Which one is married The teacher blushing a great deal replies Well I suppose the one thats gobbled down the top and sucked the cone The correct answer is the one with the wedding ring on but I like your thinking,1385323318.0,A teacher asks her class,730,jokes,new
HashSlingingHacker,2,19,1rd2or,19,A young businessman was getting ready for a trip His flight wasnt until later in the night so he decided to go into work get his tickets work for a bit and then get on the flight right from work As he walked into work he couldnt help but notice that the secretary who was working the front desk has en enormous chest He snuck a look but did not stare He approached herBusinessman Hi Im Adam I need my pickets to Titsburgh He immediately recognized his slipSecretary Excuse meBusinessman Uhh Sorry I mean uh I need my tickets to Pittsburgh Secretary Oh of course here you go She slid him the tickets and he proceeded to take his walk of shame to the elevator On the way up he reminded himself of how much of an idiot he was He arrived on the floor where he worked and went to his boss Boss Hey glad to see you made it Only a few people came in todayBusinessman Yeah no problem God I just made such an ass of myself downstairs I feel like an idiot Boss Whatd you doBusinessman Well you know that girl with the big chest who works the front desk Well I went up to her and asked her for my plane tickets What I meant to say was I need my tickets to Pittsburgh but I ended up saying I need my pickets to TitsburghBoss Oh dont worry about it Its just a little slip It happens to me all the time Like last week I was having dinner with my wife What I MEANT to say was Pass me the butter but what I actually said was You horrible bitch you ruined my life,1385319691.0,A little slip,38,jokes,new
sean,1,18,1rd0x1,18,An Aboriginal was walking along the beach when he found a bottle He thought that he might be able to sell it and make some money so he started cleaning it up rubbing it with his sleeveAll of a sudden a genie popped out and said I will grant you three wishes but wish carefullySo the Aboriginal says I would love to be whitePOOF He becomes whiteFor my second wish I would love to be richPOOF He becomes rich and is dressed in designer clothes and has a nice carOkay says the genie what is your third wishHmm says the Aboriginal this is something I have always wanted I never want to have to work againOkay says the geniePOOF He is turned into an Aboriginal,1385318346.0,The genie and the Aboriginal,36,jokes,new
jackslack,1,17,1rcmvp,0,Because when you see it you turn one degree and walk away,1385305715.0,Why is it called xbox one,6,jokes,new
pizzarun,3,8,1rchan,0,They become super glue,1385297539.0,What happens to gay horses when they die,6,jokes,new
SGrumpy,61,660,1rcg2l,1313,had spent four days together and they were getting a little testy One morning the first friend says You know were starting to get on each others nerves Why dont we split up todayIll hike north and spend the day looking around you hike south and spend the day Then tonight well have dinner and share our experiences over the campfireThe second friend agrees and hikes south The first man hikes northThat night over dinner the first man tells his storyToday I hiked into a beautiful valley I followed a stream up into a canyon and ate lunch Then I swam in a crystal clear mountain lake As I sat out and dried I watched deer come and drink from the stream The wildflowers were filled with butterflies and hawks floated all day overhead How was your dayThe second friend says I went south and ran across a set of railroad tracks I followed them until I came across a young woman tied to the tracks I cut the ropes off gently lifted her off the tracks and I had sex with her in every imaginable way all afternoon Finally when I was so tired I could barely move I came back to campWow the first guy exclaimed Your day was MUCH better than mine Did you get a blow job tooNah says the second friend over his meal I couldnt find her head,1385295183.0,Two men camping in the mountains,1973,jokes,new
SGrumpy,3,23,1rcfp5,64,hoping to breed them for ham bacon etc After several weeks he notices that none of the pigs are getting pregnant and calls the vet for help The vet tells the farmer that he should try artificial insemination The farmer doesnt have the slightest idea what this means but not wanting to display his ignorance only asks the vet how he will know when the pigs are pregnant The vet tells him that they will stop standing around and will instead lay down and wallow in the mud when they are pregnant the farmer hangs up and gives it some thoughtHe comes to the conclusion that artificial insemination means he has to impregnate the pigs So he loads the pigs into his truck drives them out into the woods has sex with them all brings them back and goes to bed Next morning he wakes and looks out at the pigs Seeing that they are all still standing around he concludes that the first try didnt take effect and loads them into the truck again He drives them out to the woods bangs each pig twice for good measure brings them back and goes to bedNext morning he wakes to find the pigs still just standing around One more try he tells himself and proceeds to load them up and drive them out to the woods He spends all day shagging the pigs and upon returning home falls listlessly into bed The next morning he cannot even raise himself from the bed to look at the pigs He asks his wife to look out and tell him if the pigs are laying in the mud No she says there all in the truck and one of them is honking the horn,1385294425.0,A farmer buys several pigs,87,jokes,new
mspace,6,27,1rcdl8,92,A teacher was giving a lesson on the circulation of the blood Trying to make the matter clearer he said Now boys if I stood on my head the blood as you know would run into it and I should turn red in the face Yes sir the boys said Then why is it that while I am standing upright in the ordinary position the blood doesnt run into my feet A little fellow in the back shouted Cause yer feet aint empty ,1385290087.0,Lessons,119,jokes,new
dudewhodoesstuff,9,23,1rcdgz,25,To get a byte to eat,1385289834.0,Why did the computer cross the road,48,jokes,new
NascentEcho,12,115,1rc6wx,182,I think this joke would be more funny with a punchlinewooden tit,1385277844.0,My girlfriend got mahogany breast implants yesterday,297,jokes,new
ThethNeedle,11,185,1rc35x,337,and the theme is composers Bruce tells the other stars  Ill dress up as Mozart Sylvester responds Id be a great Beethoven As the two are planning their costumes Arnold checks the time and notices hes late for an appointment As he hurries out the door Bruce and Stallone ask Hey Arnold wholl you dress up as Arnold responds as he walks out of the room Ill be Bach,1385273143.0,Bruce Willis Arnold Schwarzenegger and Sylvester Stallone are planning a costume party,522,jokes,new
FightEntropy,1,3,1rc27g,6,which isnt too difficult as a kleptomaniac,1385272032.0,They say not to covet,9,jokes,new
omailnumber,26,159,1rbu8e,485,A male whale and a female whale were swimming off the coast of Japan when they noticed a whaling ship The male whale recognized it as the same ship that had harpooned his father many years earlier He said to the female whale Lets both swim under the ship and blow out of our air holes at the same time and it should cause the ship to turn over and sink They tried it and sure enough the ship turned over and quickly sank Soon however the whales realized the sailors had jumped overboard and were swimming to the safety of shore The male was enraged that they were going to get away and told the female lets swim after them and gobble them up before they reach the shore At this point he realized the female was becoming reluctant to follow him Look she said I went along with the blow job but I absolutely refuse to swallow the seamen,1385263952.0,A whale of a joke,644,jokes,new
thewizard,45,427,1rbnld,940,The librarian replied Fuck off you wont bring it back,1385257978.0,A man went to a library and asked for a book on committing suicide,1367,jokes,new
tueman,6,16,1rbn6x,0,Why did curiousity kill the cat,1385257622.0,I have but one question,12,jokes,new
amosfargus,2,25,1rbmg3,30,The bartender says Why the same face,1385257001.0,Two Chinese men walk into a bar,55,jokes,new
MisterPigoo,0,14,1rbj6a,0,Straight Outta Coffin,1385254091.0,Where is Eazy E from,7,jokes,new
CaptainPFace,3,59,1rbj2o,113,He was invited to thunday math ,1385253995.0,Why did Mike Tyson bring his calculator to church,172,jokes,new
carydog,0,35,1rbhxz,34,with a mysterious illness After the doctor said that there was nothing else he could do he turned and left the couple alone in the room The man asked his wife Honey is there anything I can do for you before you goShe weakly replied Yes I want you to go down on meHer husband was shocked What Why You mean right here nowYes please dear It would make me happy one last timeSo the husband reluctantly begins to carry out his wifes request As his wife nears climax she becomes more and more animated and finally screams out in pleasureThe husband looks at her in shock just as the doctors and nurses rush into the room The wife looks at the everyone and says I feel wonderful Better than Ive felt in my life The doctor in disbelief asked what had happened The wife explained what had transpired and just then her husband sat down on the bed weepingHis wife asked Honey why are you crying You saved my lifeHer husband answered her Yes and Im so happy about that Its just to think I could have saved Mom and Aunt Mary,1385253022.0,A mans wife lay dying in the hospital,69,jokes,new
Irishguy,1,8,1rbehf,0,The gorilla gets out to shit,1385250012.0,Whats the difference between a gorilla and an Italian in the bathtub,6,jokes,new
InnerBoyka,3,15,1rbdha,0,take a taxi,1385249179.0,How do you get to Carnegie Hall,11,jokes,new
alamurda,4,21,1rb7g9,12,A girl cat asked her boyfriend cat where her mouse stuffed animal was He says that was a stuffed animal I thought it was real so I ate it She responds THIS IS WHY WE CANT HAVE MICE THINGS ,1385244266.0,cat problems,33,jokes,new
XeroInfinity,19,162,1rb7ap,393,Suddenly he sees a little girl being attacked by a pit bull dog  He runs over and starts fighting with the dog He succeeds in killing the dog and saving the girls lifeA policeman who was watching the scene walks over and says You are a hero tomorrow you can read it in all the newspapers Brave New Yorker saves the life of little girlThe man says But I am not a New Yorker Oh then it will say in newspapers tomorrow morning Brave American saves life of little girl  the policeman repliedBut I am not even an American Says the manOh what are you then The policeman asks The man replies I am a SaudiThe next day the newspapers says Islamic extremist kills innocent American dog,1385244144.0,A man was walking in Central Park in NYC,555,jokes,new
BallerOnABudget,9,21,1rb0ga,40,i cant wait for it to come out,1385238629.0,did you hear about that new movie called constipation,61,jokes,new
James,1,13,1razgy,14,The cat shat on the mat,1385237841.0,What happened when Sean Connery bought himself a little kitten,27,jokes,new
rwebb,3,21,1rayzh,39,Its Christmas Eve and Santa comes down the chimney and sees a hot girl sitting there  She says Santa please stay Santa says  ho ho ho gotta go gotta go gotta deliver presents to the children I know So she takes off her shirt and pants and says Santa please stay Santa says  ho ho ho gotta go gotta go gotta deliver presents to the children I know So she takes off her bra and panties and says  Santa please stay Santa says  hey hey hey gotta stay gotta stay cant get up the chimney with my dick this way,1385237469.0,Merry Christmas,60,jokes,new
ballew,3,20,1rayw7,24,The size of their clock ,1385237399.0,Whats the difference between white time and black time Warning Dad joke,44,jokes,new
Mobythenarwahle,11,29,1raszc,46,PLEASE NOTE I am from Germany so please bear with my English skillsA hunter goes into the woods to shoot a bear He always wanted a bear trophyAfter a few hours of walking through the woods and not finding anything the hunter was about to walk back home but suddenly he saw a bear Just around  meters away He took his rifle aimed andBANGAs the smoke got blown away by the wind the hunter looked at the place the bear sleept just a few seconds ago Butbutwhere did it go OH MY GOD HE IS GOING TO KILL ME NOSuddenly something tapped on the hunters shoulder The hunter slowly turned aroundand there he stoodthe mighty bear he was about to shootit was big black and had giant claws on its feetThe bear saidHuntereither you will let me fuck you or I will kill you Your choiceThe hunter was stunneda speaking bear What Hehow did he move that quickly anyways Whywhy does he want to fuck meBut the hunter quickly managed to rearange his thoughts and saidWellI dont want to dieso Excellent Now bend over Interrupted the bear The hunter did what the bear wanted him to do He bent over and the bear fucked his assThe next day the hunter said to himselfI am getting that bitch My anus is still bleeding and I have to kill him before any of my friends find out So he grabs his rifle and leaves Still a little wobbly on his legs he sneaks through the woods After just a few minutes he finds the bear again Sleeping at tge same spot as last time So the hunter took his rifle aimed and  BANGAfter a few seconds the hunter looked up ButWHAT I HIT THAT BIWellwellhello there hunter Said the bear Thats how we meet again God dammit Said the hunter You know the deal hunter You will let me fuck you and I will let you liveSo the hunter bends forward and the bear takes him again This time even harder than last timeAfter hours of torture by the bear the hunter walks back home The next day the hunter gets really mad He grabs hus rifle and storms out I WILL KILL THAT SON OF A BITCH I WILL CUT HIS THROAT USE HIS SKIN AS A TOWEL The hunter runs through the woods YellingBEAR WHERE ARE YOU MOTHERFUCKER COME HERE YOU SON OF A BITCHSoon enougth he finds the bear Sleeping So he grabs his rifle walks up to himHe rises his rifle aims it right at the bears head and BANGHe opens his eyes andThe bear is goneSo the bear says Hunter I get the feeling that you dont come here to shoot me,1385232651.0,The hunter and the bear,75,jokes,new
MarchingPillows,3,31,1rasps,77,A bartender is clearing up for the night when he hears a knock at the door When he opens it he finds a homeless man standing there who asks    Excuse me but could I bother you for a toothpick    The bartender doesnt see why not and so gives the man a tooth pick  Later on there is another knock at the door and it another homeless man who again asks    Excuse me could you give me a toothpick    And again the bartender gives him a toothpick   Just as he is away to look up the bartender hears one final knock at the door Upon opening it he sees just like the two previous times a homeless man Only this time he asks for a straw The bartender fetches a straw but out of curiosity asks why The homeless man says    Some guy threw up round the corner and all the good stuff is gone,1385232443.0,Straws and Toothpicks,108,jokes,new
iHobbledehoy,6,13,1rapg8,0,,1385229839.0,Nigger,4,jokes,new
maarliya,4,15,1ransa,42,A young couple came into the church office to fill out a premarriage questionnaire form The young man who had never talked to a pastor before was quite nervous and the pastor tried to put him at ease When they came to the question Are you entering this marriage of your own free will There was a long pause Finally the girl looked over at the apprehensive young man and said Put down Yes,1385228472.0,Getting Married,57,jokes,new
TacoPrince,1,14,1rakgs,9,not many people approve ,1385225727.0,I have a new Obama joke but,23,jokes,new
meltyourheart,1,5,1rajkf,0,Because theyre two tired,1385224886.0,Why cant bicycles stand up on their own,5,jokes,new
Dougifyouknowme,1,4,1rahc6,0,They call the renovaters and tell them that one wall is  meters by  meters and the two other walls are  meter by  meters The renovators ask Thats only three walls dont you want all the walls to be tiled The couple replies We wanted to but Deadpool broke the fourth wall,1385222809.0,A couple is getting new tiles in their bathroom,3,jokes,new
laxerado,11,73,1raesf,258,When he tripped and fell over a bridge railing and landed in the river below Before secret service could get to him  kids who were fishing pulled him out of the water He was so grateful he offered the kids whatever they wanted in return for saving his life The first kid said I want to go to Disney world To which Obama replied not a problem Ill even fly you there in Air Force one The second kid then says I want a new pair of Nike Air Jordans You got it Said Obama Ill even have Michael Jordan himself sign them Then the third kid says I want a motorized wheelchair with a built in big screen tv and headset Obama seemed a bit confused at this You dont look like yore handicapped He said To which the kid replied I will be after my dad finds out I saved you from drowning ,1385220245.0,Barack Obama was out jogging one day,331,jokes,new
