author,comment,downs,id,post,subreddit,type,ups,score
Wrym,Mr Continetti Im not scared of liberalism because I know what it means and its not what you myopic twerps at NRO or the Weekly Standard insist it means,0,cdm5lcv,1rdck5,politics,new,1,1
mitchwells,Only the most dimwitted of conservatives refers to filling vacant court seats as packing the courts,2,cdm3rjh,1rdcnd,politics,new,4,2
wattmeter,A grateful world is unconcerned,1,cdm2z79,1rdcrp,politics,new,8,7
FortHouston,Since Republican foreign policy entails no options for diplomatic resolutions it is no surprise those war mongers are blasting this deal  After all they are the political party that spews the irrational Bush DoctrinehttpenwikipediaorgwikiBushDoctrine which stupidly promotes preventative war for peaceFurthermore that article cites a singular Democrat named Schumer as critical of the deal instead of a few or many as the title erroneously claims  As seen by reading the article Pelosi said Last nights agreement is an essential step toward meeting our ultimate objective,1,cdm339d,1rdcrp,politics,new,7,6
kdawg,There are many politicians in the United States from both political parties and at virtually every level of government that unquestioningly do the bidding of the Israeli Lobby It appears that their first allegiance is to the State of Israel  ,0,cdm7kmq,1rdcrp,politics,new,3,3
fellowkaintuck,Treasonists every one,1,cdm80gd,1rdcrp,politics,new,4,3
AdelleChattre,All sharply differed with the presidents suggestion that people improve their gas mileage by properly inflating their tires and the first ladys suggestion that people drink water,0,cdmp67g,1rdcrp,politics,new,1,1
lrdishtar,I dont understand why there should be regulation on cannabis any more than there is on  Benadryl Melatonin  or Tylenol which actually kills  peoplehttpenwikipediaorgwikiParacetamoltoxicity each year Cannabis has killed exactly zero people for all of documented medical history  Why are we even talking about regulating such a benign plant  ,1,cdma2dn,1rdcsx,politics,new,3,2
shadowbanmeplz,None Vote Freedom baby,5,cdm2wr6,1rdcsx,politics,new,5,0
shadowbanmeplz,I smoke two joints in the morning I smoke two joints at nightI pass some laws I smoke two more,3,cdm3uln,1rdcw6,politics,new,4,1
TheArmyOf,Sending coal in the mail triggers the demand for coal and makes America more dependent on fossil fuelsNext time please send a wind turbine or a solar panel  will be just as funny but environmentallyfriendly,2,cdm5lxr,1rddl6,politics,new,17,15
RandomExcess,This act may be investigated as possible terrorism,5,cdm4brg,1rddl6,politics,new,9,4
dontdoit,Its too bad they got the hospital involved into this Otherwise I think its a kind of a comicalgood natured protest No toxins or death threats like we see from crazy constituents ,1,cdm4n5v,1rddl6,politics,new,5,4
MGDarion,Why send them something as useful as a flammable rock  Next time send them something useless,0,cdm6rqh,1rddl6,politics,new,6,6
BrobotMonkey,Thanks to you guys Santa cant even remember what month it is,1,cdmfckb,1rddl6,politics,new,5,4
WalkingShadow,Actually the tradition is to give coal and switches to misbehaving children the coal to go into the furnace and the switches to whip them with,2,cdml0oe,1rddl6,politics,new,4,2
XiaomuWave,Seems unnecessary  It passed and the people who voted against it arent exactly going to feel shame or anything regarding their decision,3,cdm50lt,1rddl6,politics,new,6,3
dweeegs,This definitely harbors intense political discussion,2,cdmb40z,1rddl6,politics,new,3,1
blue,This needs to be reposted in rnottheonion,2,cdmc4un,1rddl6,politics,new,3,1
plato,If the Republican leadership goes on record saying they will remove the filibuster even more when theyre in power than the Dems should immediately call them on it and do exactly that  If the filibuster is destined to be completely eliminated than by all means get rid of it now while competent people are running the government  Besides Republicans effectively thwarted the will of the people in the House of Reps via gerrymandering why not restore the will of the people in the Senate by getting rid of the filibuster ,3,cdmbcji,1rddmp,politics,new,7,4
Ds,Im fine with the filibuster as long as they actually have to do it Get those geezers up there talking about nothing for  hours If you really believe that destroying the government is a worthwhile venture then you better be ready to actually fucking do it,1,cdmgauf,1rddmp,politics,new,3,2
maroger,Just what our system needs further discouragement to vote Already a minority of people are voting for the majority Lets just whittle it down more Meanwhile there is near zero voter fraud and the little there is comes from instances where ID is not required or from insider manipulation of the votes Democracy USA USA,6,cdm9rd9,1rdh5k,politics,new,18,12
Scarecrow,In the state where my parents were born before WWII they only issued birth certificates to babies born in a hospital babies born at home were never issued birth certificates  Both of my parents were born at home in  mother and in  father  Neither ever had a birth certificate issued  Up until the mid s people could use the baptismal record of their church if Catholic as a form of ID but the government stopped recognizing those  NonCatholics had to rely on something elseBoth of my parents had Social Security cards that they used for ID in place of birth certificates for many years but when my father had his identity stolen in  by someone he presented his SS to as part of proving his identity they ceased this practiceMy father passed in  so he no longer has to worry about such things but my mother has learned that she cannot renew her drivers licence at all because she has no birth certificate  There are many elderly in her home state that dont even if they have other forms of ID birth certificates seem to trump them all  It doesnt seem to matter that there are multitudes of Americans without,0,cdmkavs,1rdh5k,politics,new,8,8
UncreativeName,I have no idea what its like getting a fresh one but I had to renew my grandmas license recently She doesnt drive anymore so on the DMV site I just checked the box for ID only instead of license and that was all No charge ,4,cdmclbn,1rdh5k,politics,new,9,5
ScornAdorned,But if its not hard for ME to get an ID then who cares,2,cdmnftd,1rdh5k,politics,new,5,3
nicksvr,Voting is about the only thing that State and Federal governments dont require an ID for How about requiring a SSN for voting The computer will register  vote per SSN,8,cdmbop3,1rdh5k,politics,new,12,4
sgefan,Just tell them you vote R Youll get in within two minutes,6,cdmfmxf,1rdh5k,politics,new,9,3
crft,What would be the point of voter suppression laws if they didnt suppress the vote and disproportionately affect the people who are the most likely to vote liberalThe Republicans may be scumfilth who only work for the wealthy but theyre usually quite capable at perverting democracy what with the gerrymandering and the buying of the votes and the voter suppression etc The idea of having photo ID is fine in and of itself everyone should Being able to prove you are who you say you are isnt a bad thing but if youre going to make such a rule make it crystal clear some years beforehand and make sure people get issued their IDs But of course thats not what the desired effect here is,3,cdmgqnl,1rdh5k,politics,new,5,2
rubberstuntbaby,Voter ID laws are a solution to a nonexistent problem which simultaneously creates actual problemsVoter ID fraud almost never happens because it requires the commission of a serious felony that has a smaller effect on an election than the margin of error in the ballot counting process,0,cdn8xrq,1rdh5k,politics,new,2,2
Norass,But its OK to require an ID and often times exorbitant taxes to exercise our continually narrowing right to keep and bear arms,3,cdmkjgv,1rdh5k,politics,new,2,-1
Rekcals,gtI really want to vote I want to vote at the polling place I dont want to vote absentee  Oh I need to get a photo ID  and Im concerned about the waiting time at drivers licensing stationsSounds to me like they dont want to vote very much at all,21,cdmalxx,1rdh5k,politics,new,17,-4
Jackvi,Jesus at least  people in a few states have had problems obtaining an IDThis is gross misconduct racial profiling segregation violence against women racism suppression conservative political overpowering bullying offensive both in language and in posture ignorant culturally insensitive probusiness antisuffrage misogynistic and patriotic  Rally your banners you freethinkers progressives and multiculturalists were at war again ,6,cdmjls7,1rdh5k,politics,new,4,-2
Kinglink,Wonderful a list of people who choose to remain uninformed and we claim thats the laws problemIf you choose not to know how to vote or not what you need to do to vote thats not on the laws thats on youI forgot to register in a new state when I moved one time  I guess that was voter suppression by this sniff test ,23,cdm9lnn,1rdh5k,politics,new,8,-15
wattmeter,The  news organizations and journalistic institutions are under no obligation to use White House photographs if their readers and subscribers find them objectionable ,2,cdm66el,1rdie7,politics,new,7,5
FortHouston,None of those  news organizations bitched about Ws staff giving them a list of acceptable questions to askRegardless the Oval Office obviously is not big enough to host  photographers from  news organizations,3,cdm6w0p,1rdie7,politics,new,6,3
fellowkaintuck,Oh boo boo booThe real question is  does anyone really read usnewscom,1,cdm82r9,1rdie7,politics,new,4,3
mcstoopums,Most of the media is useless anyway If they arent taking more dumb photos at the White House maybe they could actually go find some real news,0,cdm89t1,1rdie7,politics,new,1,1
Joocemann,Why  Why do the police think they need devices of WAR  This is absurd  Military equipment and police equipment are designed for completely different purposes  The police  years ago were hardly even allowed to draw a weapon unless they confirmed that suspects had weapons or had fired  and yet now that is commonplace to draw weapons on anyone old ladies boyscouts black kids you name it  The escalation of undue police aggression is getting way too dangerous for the people they think they are serving  This is not policing  This is becoming a war that will generate our own homebred insurgency  The investment class read  but actually  loves this shit  They are immuneexempt from the issues this causes and they benefit from the effects,1,cdmc552,1rdkz9,politics,new,14,13
cm,Complete with DU contamination  Can you say karma,1,cdmcrk7,1rdkz9,politics,new,4,3
tophatjones,Seems like a white elephant I doubt Shithole North Carolina will be able to afford long term upkeep on a vehicle like thatThe moron pig says its about the safety of the people inside but Its really just about intimidation Cops shoot more people every year with their little sidearms than people with high powered hunting rifles have ever injured,5,cdmcwbl,1rdkz9,politics,new,5,0
ig,Precursor to all the unused extra drones well have watching us soon too,0,cdmdyju,1rdkz9,politics,new,2,2
BrutalTruth,Obama We cannot continue to rely only on our military in order to achieve the domestic national security objectives that we set we have got to have civilian security force that is just as powerful just as strong just as well fundedObama on Civilian SecurityhttpwwwyoutubecomwatchvTtyGzHfysamphd,0,cdmjc6q,1rdkz9,politics,new,2,2
oldfartbob,Should be perfect for swat team raids on the homes of felons who havent paid their overdue library book fines,0,cdm9yh4,1rdkz9,politics,new,1,1
Choralone,So if we repurpose them to police the public reaction is why do we need these Police are too militantIf we dont repurpose them  its just more government waste we could have used theseJust sayin,1,cdmlbn3,1rdkz9,politics,new,2,1
polizeibamf,They dont get the guns that go along with them They just get a heavily armored truck If I am in a hostage situation or something I definitely want the police coming to get me in something that I can hide inbehind without fear of a bullet going through it This isnt big news either the military has been giving vehicles they do not need to the police for a long time,2,cdmin0c,1rdkz9,politics,new,2,0
qmechan,Not a metaphor Cheney family tradition,3,cdmfsmi,1rdl4u,politics,new,4,1
dventimi,This Liz Cheney episode has brought out the worst atavistic impulses in Liberals and has revealed us to be as bad at reasoning as we ever imagine conservatives to be  ,1,cdmr4uy,1rdl4u,politics,new,2,1
MGDarion,I think this all depends on whether or not Liz Cheney was genuinely for or against gay marriage  If she was genuinely opposed to gay marriage despite the fact that I strongly disagree with her I could respect her honesty  If she really was just trying to gain the conservative base then what she did was more than a little disgusting,6,cdm6my2,1rdl4u,politics,new,6,0
waylaidbyjackassery,Thats nothing   Her old man threw  of our troops under the Iraqi WMD BusWho could STOP from voting for a family like this,3,cdmtmmd,1rdl4u,politics,new,3,0
wwjd,Republicans have no bounds when it comes to personal gain least of all immediate familyThis is what they mean when they speak of family values,2,cdn8szy,1rdl4u,politics,new,2,0
jpurdy,Cornyn comment a diversion from his being worried about a really wacko fundamentalist opponent in his next primary Louie Gohmert apparently declined the opportunity but there will be someone else just as crazy ,1,cdm931b,1rdmxl,politics,new,4,3
XiaomuWave,Obama eating breakfast this morning was intended to focus attention away from Obamacare  ,0,cdmb46r,1rdmxl,politics,new,3,3
qmechan,I thought Obamacare was a diversion from Syria Shit who has the cheat sheet,0,cdmfsc2,1rdmxl,politics,new,2,2
plato,Doing good things is just a diversion from all the bad things you are doing,0,cdmba4z,1rdmxl,politics,new,1,1
Sidwill,All politicians lie Some lies are relatively benign others result in war and death,0,cdmkyvp,1rdn1u,politics,new,2,2
MockingDead,Trying to justify the liar in charge right now,6,cdm7s6q,1rdn1u,politics,new,6,0
pcar,I had to work a job once down in southcentral LA  Not as bad as you think but definitely sketchy after dark  We were setting up a temp office in an area that was both industrial and residential and we needed highspeed internet setup  I literally called every cable company and none offered highspeed internet  ATampT offered base DSL for over  a month because we also needed to run lines to the building and setup a phone service  A contractor came out to see if it was even possible to get cable internet and he said we were about  ft too far away from the nearest connection we went with Clear  Im not from southcentral so to be in a place where you cant get affordable internet was kind of a shock  It sounds funny even to me but access to information is really a basic human right  Every single person deserves to know at least who they are what theyre made of and why its good to keep asking why  Many of the communities without internet access are also those without information access Poorperforming or no schools at all  Not just in the US but across the world  Without access to information and education the world becomes very small  Down to the neighborhood and the block  And as the world gets smaller so do the opportunities and the ideas for the future  And without a future selling crack or robbing a convenience store doesnt seem like such a big dealPrisons cost taxpayers more than  billion a year Every year that an inmate spends in prison costs  An individual sentenced to five years for a  theft costs the public more than  The cost of a life term averages  million  Over the course of the last  years the amount of money spent on prisons was increased by  while that spent on elementary and secondary education was increased by only   What do you expect from a society like thatWe have a crisis of information,8,cdmed1n,1rdow1,politics,new,30,22
crazyMcLazy,gtAbout  percent of black male highschool dropouts under age  are now behind bars he says compared with an incarceration rate of  percent for the population as a whole gtTheres parts of poor communities that are leading violent and desperate lives between prison and an early death And we need to see those people as human and to see whats happening to them as something that could be prevented,1,cdmbs72,1rdow1,politics,new,15,14
Hyperion,Americas prison and criminal justice systems are in desperate need of reformBut to say something likegtonly the forced labor camps of the former USSR under Stalin approached these levels of penal confinementWithout at least paying some sort of Honorable Mention to the forced labordeath camps in North Korea just really doesnt seem rightWe should always speak accurately even if we are talking about bad things we dont like,6,cdmfk2p,1rdow1,politics,new,12,6
bmwrider,All these idiots complaining about the title who have no idea what the article is about,1,cdmgs20,1rdow1,politics,new,4,3
Sleekery,That kind of extreme hyperbole just tunes people out,4,cdmomrw,1rdow1,politics,new,4,0
TheArmyOf,gt What her research shows is that these institutions may be selfdefeating and may carry very significant social costs Western says And so the whole effort to improve public safety through criminaljustice supervision and through incarceration may have significantly backfired and may in many ways have contributed to the ongoing poverty and shortage of opportunities that we see there Arent there two sides to that issueOne is that to fight gang violence we must increase the use of police force and reduce the availability of guns in the neighborhoods This is not cheap but thats one way to approach itAnother way is to reduce police and increase gun availability Mathematical modeling of the behavior shows that if gang members shoot one another more often there will be simply fewer gang members until one gang wins over or they reach some kind of truceIm not sure America is ready for the second approach Therefore first approach is the best we can do even with egregious imprisonment and high frequency of recidivism,4,cdmh2bg,1rdow1,politics,new,2,-2
bongrippa,I dont know I have a pair of boxerbriefs that are pretty snug,9,cdma6sz,1rdow1,politics,new,4,-5
Haviq,you said penal,9,cdmfudn,1rdow1,politics,new,2,-7
Natedogg,Sensationalism is funIf you want to compare the Gulag to the US prison system first read thishttpseansrussiablogorgusprisonindustrialcomplexversusthestalinistgulagI think youll find this comparison quite absurd,9,cdmg6q5,1rdow1,politics,new,3,-6
gameinator,Every dollar the government takes in tax dollars could have been spent by someone else and thus would have helped the economy just as much as the government spending itEvery service provided by the government could just as easily be provided by the free market and many still are offered at a higher quality than government can provide private schools vs public schools apartments vs section  housing UPS vs the Postal ServiceThe difference between money spent by the government and money spent by the consumer is that the government faces little to no consequences if they waste money or spend it poorly  If the government provides only a very basic lowquality and overpriced service it still gets government dollars and politicians can make a big deal about minor and inconsequential improvements  If a private producer provided the same lowquality and overpriced service theyd soon go out of business and be replaced in the marked by someone providing a higher quality service for a lower price,4,cdm8uj3,1rdp01,politics,new,9,5
iamjacksprofile,gt As we become richer we value security and insurance more and we are willing to spend more on it What would lead this guy to think we were getting richer,0,cdmn4ff,1rdp01,politics,new,2,2
blue,US depositors warn new fees could force them to switch their fucking banks,0,cdm9b00,1rdsir,politics,new,7,7
jpe,OP is behind a pay wall  why does anyone use FT as a reddit link,1,cdm8f91,1rdsir,politics,new,4,3
FortHouston,Right  Because cutting their whorish profits is not an option for those bank profiteers,4,cdm7tt4,1rdsir,politics,new,8,4
TastyYams,The government made the insurance companies raise ratesThe government made the banks charge depositors moreThis just keeps getting better,4,cdm8nmo,1rdsir,politics,new,5,1
dekcufteg,does anyone here remember the days when a bank drafted check involved the bank owing you the amount on the check and not charging a service charge on you cashing that check like you were a customer rather than a note holder,1,cdm9f2g,1rdsir,politics,new,2,1
jpurdy,Bank depositors experiencing negative revenue might just be disincentivised from depositing money in those banks ,0,cdmavj6,1rdsir,politics,new,1,1
waylaidbyjackassery,They should do what they did with old WWI artillery piecesremove all moving parts and put them in playgrounds,0,cdmm8l9,1rdsvh,politics,new,1,1
GentlemanVillain,Every deal for peace must start somewhere This is a far better step than we had before ,2,cdm90do,1rdtcb,politics,new,8,6
shaman,We only make peace with our enemies Thats why its called making peace  Petyr Baelish Game of Thrones,0,cdm8zpq,1rdtcb,politics,new,1,1
RalMaken,The deal does not stop Iran from enriching Uranium Its the exact same deal North Korea got  Look how that ended up Obama is a wimp and a fool,18,cdm8b5w,1rdtcb,politics,new,10,-8
TokiDokiHaato,WalMart has become a symbol  and a major cause  of the nations widening gap between the superrich and the rest The companys controlling family the Waltons have a net worth of more than  billion This is more than the total wealth of  percent of all Americans  over  million peopleThis really gets me  Youre worth that much but refuse to treat your employees with respect  Meanwhile the same people shopping at your store are subsidizing your underpaid workers with welfare programs via tax dollars  Programs they wouldnt need to use if a company making billions paid them a living wage  Its disgusting,94,cdmfz41,1rdx0w,politics,new,466,372
Dlax,If WalMart workers go on strike on Black Friday as they should riots will start It is already incredibly dangerous working Black Friday standing in front of the doors was the last thing they want to do on that day MURICANS dont care about others they just want huge discounts and will  blame the workers for not working calling them lazy etc The world is approaching the point of poor uprisings if we dont change something soon I believe This should shake things up quite a bit,63,cdmfn3b,1rdx0w,politics,new,199,136
Eurotrashie,Walmart comes across as a cult ,21,cdmawrb,1rdx0w,politics,new,78,57
gmooa,Probably why certain factions fought Obamas appointments to the NLRB tooth and nail to keep if from being able to make decisions like this that they knew would be coming and were long overdue,19,cdme9ov,1rdx0w,politics,new,56,37
whatnowdog,If the economy can continue to pick up the way Walmart and other companies have treated their workers will come back to bite them I try not to shop at Walmart all they are doing is transferring money to China management and shareholders while taxpayers subsidize their low paid floor workers   ,10,cdmbl1i,1rdx0w,politics,new,48,38
phdpeabody,Its important to remember the news coveragehttpwwwyoutubecomwatchvcHIWdXJRWk of this provided by Fox News was in fact a paid promotion,9,cdme9w9,1rdx0w,politics,new,34,25
whatnowdog,If the economy can continue to pick up the way Walmart and other companies have treated their workers will come back to bite them I try not to shop at Walmart all they are doing is transferring money to China management and shareholders while taxpayers subsidize their low paid floor workers   ,9,cdmeuin,1rdx0w,politics,new,17,8
cuaddict,Can you not fire employees that go on strike,5,cdmhuzn,1rdx0w,politics,new,13,8
blahtender,Meanwhile Im still getting hrwhatever Joedipshit wants to leave me at Applebees,7,cdmjxnv,1rdx0w,politics,new,18,11
flamingopanic,Employers that pay poverty wages yet rake in huge profits are disgusting but what Im really confused about is why the minimum wage isnt raised across the country if its causing such a massive problem ie people being paid poverty wages by bigbox stores and other employers and being subsidized by other taxpayers Isnt the reason these people are getting away with treating their employees like this because the law allows them to pay shit wages,3,cdmhumm,1rdx0w,politics,new,11,8
imalwaysfapping,Even if they sold porn I wouldnt shop at walmart,1,cdmioi8,1rdx0w,politics,new,11,10
redaemon,Walmart will probably just outright close any stores that choose to protest The employees who joined in the protesting will be reviled by their former coworkers as the jerks who caused them all to lose their jobsThis has been Walmarts typical approach to unionization  the cost of closing a few stores is nothing to themWidespread action would be nice but it would be unrealistic to expect Walmart employees to achieve that kind of organization on such short notice,4,cdmj2ax,1rdx0w,politics,new,9,5
knut,Step up the pressure Walmart employees The public and now the law are behind you,3,cdmk9iv,1rdx0w,politics,new,10,7
JanetCoquette,I absolutely hate WalMart and refuse to shop there I think that they not only do not pay their employees a living wage but they make an art form of ripping off the consumer It drives me crazy when I hear friends say I hate it too but I have to shop there because the prices are so cheap ,3,cdmmrok,1rdx0w,politics,new,10,7
