author,comment,downs,id,post,subreddit,type,ups,score
wattmeter,This is not something Emma Roller is going to put in her portfolio as it is short mindless and crappy rehash filler by someone who seems ready to start a holiday,2,cdon5si,1rm904,politics,new,2,0
inputwtf,While I like Emma Roller and the Weigel blog I probably would have submitted the Newsweek story directly,0,cdoq7k5,1rm904,politics,new,1,1
WalkingShadow,Wisconsin Republicans control the Governorship the state Senate the Assembly and the Supreme Court so if you like what you see you know what to do to get itWisconsin Republicans who have been prominent in the national news recently Scott Walker Paul Ryan Reince Priebus Jim Sensenbrenner Sean Duffey Ron JohnsonMostly making fools of themselves IMO but Wisconsin voters are a fickle bunch,0,cdox1o1,1rmd99,politics,new,6,6
RentalCanoe,Well youre no longer stuck in traffic if you hand your drunk uncle the car keys and he drives straight into the ditch,1,cdox5n6,1rmd99,politics,new,4,3
RentalCanoe,Unfortunately we in Wisconsin continue to lag behind Minnesota and Illinois while Walkers policies continue to fail Except of course when you consider his goal is to help the Koch Bros and the wealthiest Wisconsinites only Then hes doing great,1,cdox6bx,1rmd99,politics,new,4,3
luthier,i like scooter ive voted for him  times now after all the recalls and stuff prepare for downvotes,18,cdoo9i5,1rmd99,politics,new,9,-9
theshallowdrowned,And yethttpwwwtheguardiancomworldnovobamacarestatelevelturnaroundcaliforniaUS healthcare signups jump at state level in promising sign of turnaround Insurance applications on California exchanges up  Accelerating growth rates give hope to administration officialsThats how a nonFox source has it,3,cdop4nm,1rmeeq,politics,new,3,0
WalkingShadow,gtOn August   the City of Camden and Camden County announced that the city police department would be disbanded in favor of a new county police force Wellknown law enforcement executive John Timoney was retained to develop an organizational and functional plan for the departmentgtThe creation of the county police force in place of the city force was expected to save between  and  million annually out of the  million budget of the city police department Unlike the city police department it replaces the new county department is not unionized Savings were expected to come from reducing the fringe benefits that had been required under the citys union contractgtThe move was endorsed by the Mayor of Camden Dana Redd who indicated that the new police department would be more costeffective and that the high absentee rate of city officers had affected the former departments ability to keep the city safe An official of the Camden Fraternal Order of Police which represented city police officers described the plan as union busting and called it a recipe for disaster that would replace experienced city officers with new personnel unfamiliar with the city A community group known as the Citizens Community Committee for Public Safety along with the Camden Fraternal Order of Police criticized the plan as being political not practical The mayors political opponents also criticized the disbandment of the citys departmentgtThe new department took over primary responsibility for policing the City of Camden on May   It reached its full complement of  sworn officers on June   when  recruits were commissionedgtOn October   the results of a vote by County Police officers to unionize were announced By a margin of two votes the New Jersey Fraternal Order of Police NJFOP was selected to represent the officers The previous month superior officers voted to be represented by the NJFOPWikipediahttpenwikipediaorgwikiCamdenCountyPoliceDepartment,0,cdowtw0,1rmf12,politics,new,1,1
justjustjust,Wonder if they are using Martin OMalleys crime stat plan Goes like this Dont look for criminals Dont report crimes even if you happen to catch a criminal See crime rate plummet ,2,cdoqtep,1rmf12,politics,new,3,1
deliasgone,Stuff like this boggles my mind I get being opposed to a politician and that making you predisposed to view what they do with suspicion but this is such a blackandwhite trueorfalse easily checked story How can you be that intellectually vapid or politically hackneyed that you can go around saying he closed the Vatican embassy when all he did was move it into a new building The idiocychutzpah of people never ceases to amaze,1,cdox245,1rmhj0,politics,new,16,15
ObeeJuan,Conservatives were quick to criticize Obama on the moveShocking      no one ever,1,cdowezs,1rmhj0,politics,new,10,9
CrazyWiredKeyboard,FW FW FW FW FW FW FW FW FW false,1,cdosh1q,1rmhj0,politics,new,8,7
nosayso,Its sad that people are partisan and stupid enough that this doesnt immediately register as bullshit to someone who reads it  Let alone someone ostensibly powerful and assumedly intelligent enough to be the governor of a state,0,cdoxpw5,1rmhj0,politics,new,5,5
totallyclips,when you dont have the truth on your side just lie,0,cdp7ll2,1rmhj0,politics,new,5,5
wattmeter,Ireland announced its decision to shut its embassy to the Vatican in  ,2,cdovp18,1rmhj0,politics,new,4,2
BobNoel, the process of moving the embassy from its current location to the compound at the US Embassy to Italy began under Jebs brother President George W Bush whose administration purchased the buildings The new location is actually a tenth of a mile closer to the Vatican and the move will come with no reduction in staff or activitiesI yearn for the day when some talking head will grow a pair and ask him why he lies so much,0,cdpx14z,1rmhj0,politics,new,1,1
notadeadperson,Oh yeah hes such a moderate,5,cdozuto,1rmhj0,politics,new,3,-2
DwarvenRedshirt,Im confused as to how this is a myth  The Vatican embassy is being closed is it not,7,cdp2k9k,1rmhj0,politics,new,1,-6
mnocket,gtIf the problems arent fixed insurers fear a worstcase scenario where consumers sign up for insurance through the website and think theyre enrolled only to find out at the doctors office that they dont have any coverage    Whats worse than not being able to sign up  Thinking youve signed up and then finding out later that your data never made it the insurance company and you dont actually have insurance,0,cdoqxyt,1rmj67,politics,new,3,3
FortHouston,Coincidentally health insurance was jacked up before Obama Cares and is still jacked up regardless of that website amp its glitches,2,cdoqk5r,1rmj67,politics,new,2,0
justjustjust,The website isnt the problem,1,cdotcfp,1rmj67,politics,new,2,1
Rednblu,I give this a D for being all non sequiturs for example      gt      can you guarantee that someone whos gone through this process and signed up will have coverage January  As of today the honest answer would be no What does the guarantee have to do with itSurely the applicant would call the carrier to make sure that the application appeared in the insurers system  Even Amazoncom drops a significant number of my orders if I dont check,1,cdorfxd,1rmj67,politics,new,1,0
debunkingbunk,Even if you bury it on rpolitics through the Liberal Downvote Brigade it still exists in real life,6,cdoq9rm,1rmj67,politics,new,4,-2
Rednblu,gt Ms Hudaks decision averts another potentially humiliating recall vote and allows a panel of county Democrats to choose her temporary successor ensuring that Republicans cannot immediately take control of the Senate   gt Polls show that voters embrace aspects of the new laws But the measures have infuriated gun advocates and Republicans    ,7,cdor5o4,1rmmi4,politics,new,14,7
CheesewithWhine,Special election turnouts are abysmally lowIs this the new GOP plan going forward now Force recall elections whenever they can and then sneak back seats that they lost using super low turnout elections in which the only people that vote are as Lindsay Graham put it angry white guys,11,cdp11f7,1rmmi4,politics,new,13,2
EnglishTeethPolice,Democrats afraid of democracy  Who would have thoughtOf course the partisan parasites here will be totally in favor of subverting the will of the people to recall someone when it suits their particular cause,5,cdp5y62,1rmmi4,politics,new,9,4
treedick,Colorado has set the tone for the gun control debate Vote to take rights away and lose your job ,32,cdor5uc,1rmmi4,politics,new,29,-3
fellowkaintuck,Ah I see the NRA wants more Coloradans to die from gun violence in the future   Tis said for our children that groups like the NRA exist Let us give thought to this during this Christmas season  That in this season of Jesus our Saviors birth  that American parents will buy guns to put under the Christmas tree that will later be used to kill Gods Children,27,cdownyx,1rmmi4,politics,new,22,-5
justjustjust,we all adjustWhat does that mean,0,cdotn1v,1rmn7l,politics,new,3,3
Tokkul,Wow the comments were so bad thought they must have been troll accounts,0,cdozgb0,1rmomn,politics,new,4,4
DavePH,Now those bastards are going to limit voting to citizens,1,cdp1rm1,1rmomn,politics,new,2,1
Mayhem,I honestly never understood the opposition to this Its not racist to ask someone to prove a who they are and b that theyre legally entitled to vote in the election ,11,cdoshaz,1rmomn,politics,new,6,-5
GEarHEad,All socialists countries that get liberals hard require Id to vote Were talking about countries with universal health care welfare entitlements big social safety nets etc that liberals want to emulate but they cant do Id laws Whats the saying You have noting to fear if you have noting to hide Seriously for how smart the Democrat party is opposing this is pretty stupid ,11,cdou7fp,1rmomn,politics,new,2,-9
WalkingShadow,The writer fails to mention any airline bankruptcies Its not  beneficial for consumers or employees when an airline goes bankrupt Sure its the free market adjusting itself but a lot of people get hurtHe also fails to give any examples of industries he wants to see deregulated Lobbying maybe The construction industry Slaughterhouses,0,cdow90t,1rmpjc,politics,new,3,3
fellowkaintuck,Is there ever anything in Forbes worth reading anymore,0,cdowmem,1rmpjc,politics,new,3,3
pilto,Yeah because putting in a pipeline is the same as killing thousands of native americansGet some fucking perspective,1,cdpbpq5,1rmpqb,politics,new,1,0
WalkingShadow,gtHawaii voters approved the constitutional amendment in  which states The Legislature shall have the power to reserve marriage to oppositesex couples The ballot measure passed with a nearly  majorityNow the legislature has used that power and declined to reserve marriage to oppositesex couples,0,cdow1op,1rmqd0,politics,new,2,2
drewiepoodle,dude give it rest you losthttpswwwyoutubecomwatchvMQGkOGZubQ,0,cdosyo8,1rmqd0,politics,new,1,1
throwaway,His plan is simple  Do more evil hide it better,4,cdowc28,1rmsam,politics,new,7,3
aburp,I havent heard are they also going to have sites in other languages Russian Korean French Vietnamese They cant get the main website up and running how are they going to get the rest of them working ,2,cdotomu,1rmsr9,politics,new,3,1
fellowkaintuck,Why is there a Spanish language version  Why would they need to spend tax money on thatI want my Gaelic version,1,cdowln4,1rmsr9,politics,new,2,1
graynow,there should not be anyone particularly in the richest country in the world  ,2,cdovmye,1rmxb5,politics,new,3,1
FutureCatHorder,If the GOP succeeds in cutting food stamps again the number of people who truly go hungry will rise Personally I would prefer a higher minimum wage tied to inflation which would reduce the need for food stamps But if we cant get even that the choice is expand government assistance so nobody is missing meals while others purchase elevators for their high end luxury cars,2,cdoxppd,1rmxb5,politics,new,2,0
CharlieDarwin,It is funny how the corporations offered health insurance to their employees that had policies that offended their religious beliefs prior to the ACA health insurance  But somehow the ACA offends them,1,cdov2g0,1rn0vu,politics,new,15,14
RealMuthsera,But corporations are people too ,2,cdouyoe,1rn0vu,politics,new,10,8
boomanwho,If corporations have the same rights as people Then people should have the same rights as corporations starting with the tax code  I should only be taxed on my profits savings which is revenues income minus expenses housing food transportation health care etc,0,cdp6p6i,1rn0vu,politics,new,7,7
neilbakker,httpenwikipediaorgwikiCorporatepersonhoodCorporate personhood is the legal concept that a corporation may be recognized as an individual in the eyes of the law This doctrine forms the basis for legal recognition that corporations as groups of people may hold and exercise certain rights under the common law and the US Constitution For example corporations may contract with other parties and sue or be sued in court in the same way as natural persons or unincorporated associations of persons The doctrine does not hold that corporations are flesh and blood people apart from their shareholders officers and directors nor does it grant to corporations all of the rights of citizens,0,cdpbh8f,1rn0vu,politics,new,2,2
mikeydaylight,its a shame that corporations are legally seen as people,1,cdpa8bl,1rn0vu,politics,new,1,0
PiercePyrite,Why are corporate persons being denied their th amendment rights  When do we get corporate suffrage Corporate personhood makes perfect sense if you dont think about it too much,0,cdpfldn,1rn0vu,politics,new,1,1
PastaArt,And if a church bible school decides to go from nonprofit to profit because the rules governing nonprofit restrict the kinds of teachings what then  If both for profit and nonprofit are limiting what religious organizations do then the freedom of religion is hamperedI think theres more to this story,7,cdoyf1c,1rn0vu,politics,new,3,-4
nixonrichard,Interesting  Back when it was the Ground Zero Mosque a religious building funded by a corporate consortium everyone seemed to think that corporate entity had freedom of religion,13,cdouz3o,1rn0vu,politics,new,4,-9
Continuityorganizer,Im amazed at the assumption that laws imposed on corporations somehow dont affect people If you tax corporations you tax people If you limit corporate speech you censor people If you deny religious liberties to corporations you deny religious liberties to people Corporations arent some extradimensional entities theyre people just groups of people ,17,cdoy17o,1rn0vu,politics,new,2,-15
FortHouston,Years ago Blue Laws in Texas prevented grocery stores amp pharmacies from opening on any Sunday which was an obvious problem for people who became ill on Saturday night and needed OTCs and filled prescriptions to get betterMy nonreligious parents opposed the Blue Laws in Texas because they propped up a society that erroneously believed anybody who shopped or bought a beer on a Sunday was an evil heathen bound to burn in mythical Hell  While I ardently believe that our society can survive without a few days of shopping every year I am very glad the Blue Laws were gutted in Texas,1,cdoz9b0,1rn10u,politics,new,4,3
iamjacksprofile,I dont think the government should be telling businesses which days they can and cant be open Period,0,cdp9p0b,1rn10u,politics,new,1,1
GloriousBaconMan,Fuck that The religious moral majority already interferes enough with peoples lives,2,cdp1xke,1rn10u,politics,new,2,0
jpurdy,Meanwhile the Walton family spends millions supporting political evangelical groups trying to replace public education with fundamentalist voucher schools ,12,cdozo1l,1rn2uu,politics,new,56,44
TheSilverNoble,I think this is a dialogue that needs to be pushed more Prices may go up slightly if we raise the minimum wage but were already paying for it anyway and in the least efficient way possible ,5,cdp2y46,1rn2uu,politics,new,18,13
zakrak,I fucking hate WalMartTarget Manager,0,cdp2tw4,1rn2uu,politics,new,10,10
Toph,Dont ever shop at Walmart ever again,4,cdp1nc8,1rn2uu,politics,new,12,8
azflatlander,So dont shop at walmartShop at WalmartExpect Walmart wages,2,cdp8anr,1rn2uu,politics,new,6,4
kingtimmy,Well the obvious solution is to cut food stamps and medicaid Time to end the free ride,0,cdpbssy,1rn2uu,politics,new,4,4
miacane,Youre also subsidizing all the mom and pop stores that pay minimum wage with no benefits People can rag on national chains all they want but they pay no more or less than the prevailing retail wage ,1,cdpg9bq,1rn2uu,politics,new,4,3
TheArmyOf,Any proof to back up that shes a valid tax payer  of Americans pay no income tax whatsoeverhttpwwwbusinessinsidercomofamericansdontpayfederalincometax and Elizabeth DiNovellahttpwwwlinkedincompubelizabethdinovellabb has worked at something called Culture Editor which somehow doesnt rhyme with big bucks but might rhyme with EITCI like to wave my taxpayer flag as much as the next guy but if you aint paying much you aint subsidizing much eitherAnd this is not personal Id bring this up if the article was written by General Electric Corporation as well Back up or shut up,0,cdp91u7,1rn2uu,politics,new,3,3
marekknowak,Stop lying  Youre not subsiding WallMartYou are subsidising low wage workers whether they work for large retailers or pop and mom storesThe fact that those workers receive welfare has nothing to do with the wage they receive  Please learn economics Edit  I see that my previous statement is ambiguous  I meant  the wage they receive isnt determined by the fact that they receive welfare or not,11,cdpgf1j,1rn2uu,politics,new,14,3
Amymeow,Most retail stores pay about the same starting wage Target wal mart walgreens  all those little mall stores And most only offer benefits if you get full time Which almost never happens in retail So ya people with or with out kids may need additional assistance if they only make  per hour At any employer ,1,cdp7mlw,1rn2uu,politics,new,2,1
TheYar,Im getting tired of the idea that taxes subsidize companies that employ lowincome That entire idea rests on the button that a company owns their employees and is in control of and responsible for everything about them  Its a bizarre scary concept Your taxes are not subsidizing Walmart Stop saying that they are,10,cdpk8qs,1rn2uu,politics,new,11,1
migtjvt,For fuck sake  Enough with this ridiculous fallacious argumentSay what you will about their employment practices and theres plenty to criticize but you are not subsidizing Walmart by virtue of what they pay their workers  For that to be true all those workers would have to somehow not be needing public assistance if they were not Walmart employees or all of them would magically have a job that pays enough to not require such assistance or that somehow in absence of these programs walmart would alter its employee wagesCan you guys please just stick to making good arguments as opposed to popular sounding rhetoric that really doesnt make any sense,0,cdpq8fb,1rn2uu,politics,new,1,1
tableman,If you shop at wallmart you are not allowed to complain You cant expect low prices and high cost You guys have to accept reality,0,cdp1ma3,1rn2uu,politics,new,1,1
Suckerbet,its a simple fix the minimum wage needs to raised to be a living wage which is what it was meant to be when it was instituted what good is a minimum wage if you cant make enough to pay your rent and eat on a  hour work week and it should be automatically adjusted annually for inflation to keep it a living wage not only does it force corporations to pay their fair share but it will get millions of working poor out of poverty and off the welfare rolls,11,cdoym3b,1rn2uu,politics,new,7,-4
Player,In all honestly what do you want Walmart to do They pay their employees for their services If the employee is not happy with the exchange they are free to quitWorking at Wallmart does not require any skills and can be done by virtually anyone I assume that the workers that rely on foodstamps are adults that made mistakes in their past and dont have the ability to do anything more complex then move boxes or scan items Different for studentsWallmart isnt the problem here,36,cdozspo,1rn2uu,politics,new,27,-9
jpark,Yes yes You have done your union job for todayGo get your check for a job well done,15,cdoz52w,1rn2uu,politics,new,6,-9
Tokkul,Should have ran ads during the NFL games about the good stamp cuts so poor families who didnt know wouldInstead there will be thank Ted Cruz ads,3,cdozhtm,1rn30e,politics,new,5,2
Danielfair,I dont see how its stealing from them when it was a free gift from the government in the first place,3,cdpad18,1rn30e,politics,new,6,3
realitycheck,This joke of an article from a joke of a site and the morons that support this shit are the reason that this sub was removed from the front page yet the same morons who wined about how we need to reinstate the fairness doctrine cried like  year old girls when the mods got rid of crap sites like huffpost and dailykos oh the irony,11,cdp1lvq,1rn30e,politics,new,9,-2
debunkingbunk,Obama is promoting bullying through workplace violence When will this man stop a,12,cdovw7s,1rn30e,politics,new,3,-9
wangbangerisatool,and Obama wonders why the GOP wont play niceMost divisive president ever  What a jerk ,23,cdoweew,1rn30e,politics,new,10,-13
Axiom,Americans should never be targeted by the American Military thats one of the benefits of being an American citizen  If an American does something wrong they are to be pursued and captured by American Civilian authorities Any evidence used to apprehend andor convict is to be reviewed and approved by American Judges With no exceptions All evidence shall be submitted to the public record according to established law in America Anything less is illegal and is the definition of Tyranny Edited to add These benefits only apply to American citizensIf you are not an American citizen you have no inherent right to be protected under American law,3,cdoyft8,1rn31a,politics,new,15,12
heavenlytoaster,A secret amount of evidence,3,cdovy4a,1rn31a,politics,new,10,7
hardcore,Only an American So for anybody else  no rulesno evidence,1,cdp3imq,1rn31a,politics,new,7,6
sgefan,One of these secret rules is questioning the secret rules,1,cdoyyed,1rn31a,politics,new,6,5
justjustjust,Little do those senators know simply asking for the rules places one on the disposition matrix,2,cdozdjr,1rn31a,politics,new,7,5
Joocemann,Due Process you scumbag,1,cdp11tr,1rn31a,politics,new,5,4
Floki,America is going downhill our government is breaking all our founding laws that secure our freedoms Seems like Americas biggest threat right now is our own people in office What America has stood for for  years is dying off and people dont even care ,1,cdp5hy2,1rn31a,politics,new,4,3
Bixby,We dont like his face,0,cdp43me,1rn31a,politics,new,2,2
Natedogg,And the letter states that these Senators believe that the killing of Anwar AlAulaqi was justified  No shit,5,cdoxmry,1rn31a,politics,new,7,2
JimmyX,gt As we see it every American has the right to know when their government believes it is allowed to kill themAs I see it perhaps American should have the right to kill members of their government they dont like,2,cdoxxgi,1rn31a,politics,new,4,2
qmechan,Well signing up for AlQaeda is a pretty good start,1,cdp1k7m,1rn31a,politics,new,2,1
ICouldBeHigher,Oh they saw some convincing evidence Didnt Colin Powell take some convincing evidence to the UN A person should have the opportunity to defend themselves in open court And not just US citizens Much as the US and UK use each other to get info on each others citizens what keeps them from using this approach to kill each others citizens without due process if we only demand it for our own,1,cdp914c,1rn31a,politics,new,2,1
beamish,Amazing how a supposedly civilized society like the US is constantly engaged in murder whether it be via covert operations or capital punishment What a disgrace,1,cdpbisu,1rn31a,politics,new,2,1
throwaway,What a bunch of racists,8,cdox8wm,1rn31a,politics,new,2,-6
fellowkaintuck,So we should expect Congress to slap trade restrictions on Saudi Arabia nowWe should have done it when they killed  of our citizens,7,cdowkez,1rn4b0,politics,new,27,20
rooster,By what right does the United States decree that Iran cant have nukes Saudi Arabia cant have nukes and that Israel can,5,cdoxahz,1rn4b0,politics,new,12,7
Wupta,Birthplace if Islam and majority of the suicide bombers responsible for  American deaths It should be made into a parking lot ,5,cdpa9xy,1rn4b0,politics,new,5,0
Continuityorganizer,This is the result of Obama deciding that Iran should be allowed to have nuclear weapons Thanks Obama ,31,cdoxry0,1rn4b0,politics,new,9,-22
IiveviI,that article is meta as hell ,0,cdp6o4k,1rn6fn,politics,new,2,2
OhpizzaFag,This crap distracts from the problems were currently facing  ,0,cdp4lkz,1rn6fn,politics,new,2,2
wattmeter,Potential presidential candidates are not waiting are they Are we to suspend our disbelief and pretend it is not happening,2,cdoxqfj,1rn6fn,politics,new,1,-1
HamsterSandwich,What if your employer was a Jehovah Witness and didnt want to allow your insurance provider to pay for needed blood would that be OKWhat if your employer was a Christian Scientist and didnt want your insurance provider to pay for most medical procedures would that be OK,415,cdowxuo,1rn6ow,politics,new,1637,1222
bitpurity,Heh inconceivableOn a more serious note I wonder how that affects women who have hormonal imbalances that requires a birth control pill to help regulate the hormones,113,cdoy7bp,1rn6ow,politics,new,462,349
ogenrwot,Which is exactly why insurance shouldnt be provided by your employer,70,cdowmw4,1rn6ow,politics,new,354,284
Wrym,Those who argue in favor of an employer having the authority to dictate your medical options are nothing short of bootlicks,179,cdoxfgs,1rn6ow,politics,new,432,253
cmputar,That CEO would be fucking stupid You know whats more detrimental to the business Babies,79,cdowlpe,1rn6ow,politics,new,226,147
