author,comment,downs,id,post,subreddit,type,ups,score
jpurdy,The Republicans that represent the evangelical organizations that elected them the same people who shut down our government over the ACA will never let this happen Its not just hundreds of millions Estimates of their political funding primarily in state political races and their antiabortion and antigay movements are  billion a year That doesnt include the millions in taxpayer funds their elected representatives in state legislatures spend in the courts fighting to keep the unconstitutional legislation theyve passed ,12,cdo4bg2,1rj3me,politics,new,15,3
speaktodragons,How about this We will require all politicians who are running for office have weekly debates with a panel of fact checkers and take live questions from the audience with follow up questions Instead of giving political speeches to there party  We will require media services to air the debates regardless of what is the on schedule programs and all sporting events will be reschedule not to conflict with he debates I would also suggest a truth in political advertising laws that supply who is funding it and to supply its sources online ,1,cdnxjic,1rj3me,politics,new,5,4
drew,So I keep losing track  Is reddit angry or happy with Obama right now,23,cdnzk3b,1rj3me,politics,new,25,2
dealwithit,Glad to see they are going after George Soros,10,cdo24oe,1rj3me,politics,new,12,2
brandhay,Unfortunately it doesnt sound like this scheme will be effectivehttpwwwpoliticocomstorybarackobamaadministrationtaxesnonprofitgroupsnewruleshtml,2,cdo3chv,1rj3me,politics,new,4,2
lBannedl,TLDR Rules to better define political activity for groups hiding under the guise as socialwelfare groups that funnel undisclosed taxexempt money into the political arenaTLDRRERepublican Edition Obama is taking away your first amendment rights and he probably wants your second amendments rights too,5,cdo3ilv,1rj3me,politics,new,7,2
knoblesavage,InterestingWhile they cannot give money directly to a candidate socialwelfare groups can run ads or getoutthevote drives  They also can pass on money to other outside groups like Super PACs that face fewer restrictions on their activities  Representative Darrell Issa seems to confirm that the socialwelfare groups give political advantage to one side by arguing that taking them away will disproportionately effect their interestsThe fact that the administrations new effort only affects social welfare organizations  and not powerful unions or business groups  underscores that this is a crass political effort by the administration to get what political advantage they can when they canThe irony is that  socialwelfare is only socialism if it is given directly to citizens and not trickleddown through private groups People should take note and introduce the biggest social welfare bill possible and call it the small government and big business bill to reduce the amount of government contractors companies needed to provide essential services social needs to citizens Big business can then focus on creating those jobs through innovation that we hear about ,0,cdo506m,1rj3me,politics,new,2,2
Razed,Hes just lost track of which defense contractors and wall Streeters he owes favors to  This is an attempt to fix that,2,cdo511x,1rj3me,politics,new,4,2
Estebonus,Im sorry I was looking at your right hand while I was being fisted by your left,1,cdo5z00,1rj3me,politics,new,3,2
arthurpaliden,No chance of passing Legal election rigging is too entrenched in the fabric of US politics,1,cdo6l0y,1rj3me,politics,new,2,1
terroher,The rules No group with Tea Party in its name shall be allowed to be tax exempt Edit I was being facetious but I guess I wasnt far off gtThe proposed rules do not address other taxexempt fundraisers such as labor unions and business organizations like the US Chamber of Commerce which are classified as c taxexempt organizations and can also raise and spend political money anonymously,0,cdo208b,1rj3me,politics,new,2,2
RiflePoet,Lessig YO,0,cdo29l5,1rj3me,politics,new,1,1
fannyalgersabortion,Lets start with the fucking mormons,5,cdo5gg7,1rj3me,politics,new,6,1
cmdiii,Oh these Democrats are so adorable when they propose legislation that has absolutely zero chance of passing,0,cdo5x9j,1rj3me,politics,new,1,1
aaronwhite,Annnnnnd someones declaring this an assault on the Tea Party and Christianity in ,1,cdo5zlz,1rj3me,politics,new,1,0
wilts,POT TO REIN IN KETTLEMore at ,1,cdo6gfa,1rj3me,politics,new,2,1
Jimonalimb,Now that they got that guy who made that video,0,cdo73db,1rj3me,politics,new,1,1
ExcelsiorKingsley,There must be a lot of right wing tax exempt groups now,0,cdo7cik,1rj3me,politics,new,1,1
mab,The problem with taxing them is then theyll have a say in how its used,0,cdoc7pk,1rj3me,politics,new,1,1
Zero,Lets kill nonprofit influence while doing absolutely nothing to rein in the disaster that is corporate lobbyingNot that nonprofits are inherently good many are bad but lets be honest here the government is going to be corrupt regardless of nonprofit lobbying  Oil subsidies military overspending antispeech antipiracy laws  these are the products of corporate entanglement in the government,1,cdocp78,1rj3me,politics,new,1,0
JoshtheCynic,Go get emDark money c groups have made a mockery of the statute and have flooded our politics with invisible and unaccountable money The Obama DOJ and the IRS need to go after these dark money groups and their founders to the fullest extent of the lawmany such groups should be shut down and the rich people who corrupt our system should face tax evasionbribery charges,0,cdoejdr,1rj3me,politics,new,1,1
skyshock,Does that include religious organizations churches temples mosques etc,0,cdof0wy,1rj3me,politics,new,1,1
hblask,Hypocritical president is hypocritical,0,cdoq6ad,1rj3me,politics,new,1,1
MET,So theyre basically telling the IRS to continue denying taxexempt status to groups that had been held up to help prevent them having any effect in the last few elections  with permission now Nice  I am really unable to consider this good news because the oversight and review of IRS activities has become SO blatently partisan in the past few years  The IRS has rules that should be evenly enforced within a reasonable amount of time from the groups initial application period Should NOT matter which party is affiliated with with group  ,0,cdo021f,1rj3me,politics,new,1,1
LinoaB,Its about time  Overdue ,7,cdo0cnh,1rj3me,politics,new,7,0
bahanna,gt Part of taxexempt social welfare groups appeal is that the groups do not have to disclose the identities of their donors as long as they spend less than half their time and money on political activitiesWell thats always been the problem If you let companies keep secrets then the wealthy will hide behind them Whats concerningannoying is that this article doesnt explain how the administrations new effort only affects social welfare organizations  and not powerful unions or business groups because thats how we determine whether a challenge would be on solid groundsAnyone care to contribute edit my pageloading fucked up apparently theres more reading,1,cdo0j5e,1rj3me,politics,new,1,0
Odkin,Oh so hes going after UnionsSilly me he only uses the governments massive regulatory bureaucracy to reward his friends and punish his enemies,27,cdo427h,1rj3me,politics,new,26,-1
guyonthissite,Unless it includes unions which it does not this is a rather transparent attack at something that will hurt the rights funding a lot more than the left,8,cdnzvxo,1rj3me,politics,new,7,-1
fellowkaintuck,Wait wait wait I thought the Tea Party stood for taxed enough already  No mention of any social concerns there Just too many taxes and too much governmentIs is actually admitting it is just another run of the mill right wing religious nut party  Im aghast I tell you aghast,10,cdns1ci,1rj3qy,politics,new,72,62
MarcoVincenzo,Gays are a damn sight better than neocons or theists this is a change for the better,6,cdnuuek,1rj3qy,politics,new,23,17
jrock,As a Floridian from Broward this sounds fabulous ,1,cdnv1u0,1rj3qy,politics,new,18,17
shillyshally,This is wonderfully amusing,6,cdnrgw8,1rj3qy,politics,new,15,9
LumenKraft,Power Bottoms for Romney This was a poster in my town around the election,0,cdnzwu5,1rj3qy,politics,new,6,6
phillypro,The Tea Partysaving us from those Fags and NegroesGo Get em Boys,3,cdo4qjg,1rj3qy,politics,new,6,3
thecoolstu,Its the gays and the aliens Theyre building landing strips for gay martians First Des Moines Iowa now FloridaI swear to God,0,cdnyqz8,1rj3qy,politics,new,4,4
ShakeGetInHere,Countdown till the reddit Tea Party fanboys flood the thread break out their bagpipes and start No True Scotsmaning all over the placeThese guys dont represent the Tea Party theyre probably just DNC plants  The Real Tea Party doesnt care about social issues only low taxation and small government  Pay no attention to the Confederate flag over there,0,cdo6hft,1rj3qy,politics,new,4,4
roastbeeftacohat,this sort of thing is going to start happening more and more the real question is how this will work out in the primaries,0,cdnybxs,1rj3qy,politics,new,3,3
bluemeep,Egad its like a carton caricature of a neocon shaking an angry fist to the sky and fuming about those darn homosexuals  They really let folks with that kind of attitude act like mouthpieces for the party,1,cdo2npq,1rj3qy,politics,new,5,4
Mnementh,but the tea party isnt bigoteds  Seriously anyone else get the feeling theyre the modern day watereddown KKK,0,cdo81v4,1rj3qy,politics,new,3,3
lanadapter,gt Tea party leader says gay Republicans have taken over Florida httpstaticwikianocookienetcbgtawikiimagesbbGrumpyCatGoodjpgstart phase  of the agenda ,1,cdo0q0t,1rj3qy,politics,new,4,3
pyrodinium,I hear at their next tea party are going to talk about connecting Obama and anal probing aliens in an effort to steal Jesus powers,1,cdo3mp6,1rj3qy,politics,new,3,2
TexDen,Someone needs to inform the Tea Baggers that being gay is no longer a bad thing,2,cdo51ip,1rj3qy,politics,new,3,1
mesodude,My feeling is that gay people willing to whore their souls for the promise of low taxes and to only be around white people and bigoted tea party extremists deserve one another,1,cdo5q2o,1rj3qy,politics,new,3,2
taulepton,Fabulous fuckng fabulous,0,cdoohvv,1rj3qy,politics,new,2,2
creepydoll,gtLog Cabin Republicans Executive Director Gregory T Angelo issued the following statementgtAfter languishing in legislative limbo for  years ENDA has finally passed the United States Senate in a vote that would not have been possible had Republicans not provided the margin of victory on the critical cloture vote earlier in the weekAh yes We should praise these fantastic republicans for providing the margin of victory I guess we should also praise Justice Kennedy for every Supreme Court success since he is the glorious here providing that margin Of course all the other people voting for it are meaningless,1,cdo0uou,1rj3qy,politics,new,2,1
animatorguy,As a Floridian if you want to replace him Tea Party sociopaths you can,1,cdo159o,1rj3qy,politics,new,2,1
Cdresden,Danita Kilcullen is a real peach  Heres an article about her arresthttpblogsbrowardpalmbeachcompulpteapartyarrestkilcullenphp about  years ago with mugshot,2,cdo1iv6,1rj3qy,politics,new,2,0
Powdershuttle,I remember when the tea party was started by libertarians and we made fun of religious zealot constitutionalists  Sad turn of events ,0,cdo7dry,1rj3qy,politics,new,1,1
georgeo,And,0,cdo8iza,1rj3qy,politics,new,1,1
wagslav,Well Florida is the continental penis it should be fabulous ,0,cdofo9z,1rj3qy,politics,new,1,1
nickfromnt,Probably just a bunch of democrat republicans  No republican democrats,0,cdoig12,1rj3qy,politics,new,1,1
stunt,good,3,cdnzmcm,1rj3qy,politics,new,1,-2
Coriz,At this point I wish the gays would take over all levels of the US government  Maybe then they would get rid of all the ugly furniture adorning government offices,15,cdnrbbs,1rj3qy,politics,new,10,-5
tirednwired,Cut health protection for the working poor and give the money to a Pentagon that is the largest center of waste fraud and abuse in the federal government Or slash food stamps while fending off every effort to close the tax dodges that allow companies like General Electric to avoid paying any taxes The Republican war on poverty looks a lot like a war on the poorThat sums up the GOP pretty succinctly,0,cdnwdcw,1rj47r,politics,new,1,1
wwjd,Damn a Cheney with a functioning heart and a soul no lessWhod have thunk,0,cdnxaog,1rj4yl,politics,new,2,2
letdogsvote,See this is why programs like food stamps exist in the first place  Relying on the good will and kindness of strangers often ends you with way too little to help  If youre not willing to allow your own citizens to go hungry in The Greatest Nation on Earthtm then you provide them with programs to helpThe GOP for whatever reason wants to pretend that charity alone will do the job and cut the government social programs  All that does is make it even tougher for low income people to stay afloat let alone get ahead  Its an incredibly coldblooded sociopathic approach to fellow Americans  Its also utterly unChristian during the holidays from a party that loudly portrays itself as the party that knows the mind and will of God  Truly repulsive and reflective of a selfishness and lack of empathy that goes to the bone,3,cdnryy9,1rj51i,politics,new,5,2
Chadman,a little history is needed the food stamp programs started Because churches and charities couldnt coop with all the needy In the s,0,cdo3yxe,1rj51i,politics,new,1,1
fuckinghadit,After retaining rights they dont actually havehttpiimgurcomHibzxEjpg Im not surprisedTo be clear they have the right to refuse entry or ask me to leave if I dont let them search my person The idea of Hobby Lobby being able to search a car is a fucking joke If they suspect someone of shoplifting they have in some states the right to detain that person and conduct a reasonable investigation which doesnt include violating another private entitys personTLDR Fuck this place,0,cdns5oq,1rj5j4,politics,new,8,8
fellowkaintuck,If you ever go into a Hobby Lobby you can tell what kind of mind the owner has  One cluttered with kitsch  Crap and Junk   Nary a spot for a cognizant thought,2,cdnrvdl,1rj5j4,politics,new,8,6
FreedomsPower,I will not spend at dollar in their stores  I encourage everyone to boycott them,2,cdnuix1,1rj5j4,politics,new,7,5
Sigmorhair,in a  to  ruling,0,cdo6ep4,1rj5j4,politics,new,2,2
MrDactyl,If hobby lobby is a person do we get to try shareholders for slavery,0,cdou5j9,1rj5j4,politics,new,1,1
qazxsw,well dont work there besides a lot of are Trojan horses it is a strategy to get in the court Rosa Parks was a trojan horse,3,cdnzolw,1rj5j4,politics,new,1,-2
Phiarmage,This is sensationalism at its finest Its hardly raw but rather well cooked to appeal to womens emotions Raw Story sucks for this publication,10,cdnu86k,1rj5j4,politics,new,1,-9
fellowkaintuck,I expect the Supreme Court to say so and then I expect they should extend this line of thought to allowing the the use of the death penalty for the financial institutions that brought the world to its knees,2,cdnsjs8,1rj63s,politics,new,5,3
mindlessrabble,I want to see Hobby Lobbys certificate of baptism its church attendance records  How many church picnics did it attend  How can a corporation possibly have any deeply held ethical beliefs aside from its ownerThis only points out how absolutely ridiculous the decision saying corporations were people  It does not make since in the real world  The first decision and the further decision to say they had freedom of speech and that money was speech hold the Supreme court up to ridiculeNow the are stuck  If they go forward and agree with Hobby Lobby they show that this is the most partisan Supreme Court in history and just another army of the Republican Party  If they draw the line here they question becomes why here   ,0,cdnxaii,1rj63s,politics,new,3,3
pwnchalet,gtCitizens United taught us that corporations count as people when it comes to campaign speechHorsefeathers  Citizens United said no such thing  Can we please stop perpetuating this big lie,0,cdo1wcr,1rj63s,politics,new,3,3
riskybusinesscdc,I cant wait to see a corporation run for president ,0,cdo1liw,1rj63s,politics,new,2,2
OhpizzaFag,Corporations are people  Corporations have owners  People cant be owned that is slavery  Corporations can also be owned by multiple people  The courts would have to settle this fact if two equal owners have different views,3,cdnylb4,1rj63s,politics,new,2,-1
fellowkaintuck,Im sure the families of many of the people housed in Guantanamo Bay feel the same way  Many of them were just in the wrong place at the wrong time and were not a danger to anyone in the USBut the US politicians cant back down from claiming they were a danger  So nothing happens and people rot,2,cdnsg9q,1rj6d2,politics,new,5,3
plato,Lets just change it to a talking filibuster  If youre filibustering you better be wearing diapers and reading the phone book,0,cdo2730,1rj7x7,politics,new,4,4
FreedomsPower,as a Liberal I have a big issue with doing that    The rights of the minority party should not be erased The reasonable thing would be to make the filibuster hurtle  to  Senate votes on Legislation   That way there would still be a healthy majority of the Senate needed to pass closure on a filibuster,1,cdnveby,1rj7x7,politics,new,3,2
treedick,gt All sorts of good legislation supported by a majority of the nation also enjoyed majority support in the Senate but Reid was not able to muster  out of  votes and break GOPled filibustersChrist The senate is not a proportional representation legislative body The senate simply represents state interests The house of representatives is the most current and up to date representation of the people and they havent even mentioned gun control So this author is off to a resounding start of not knowing basic tenants of our government God damn lunatics like this are absolutely nuts A congress does not have to pass law to be doing their jobs They are only needed to take action as necessary Lastly you are out of your fucking mind to think that  get to tell the other  what to do The limits have been set so high as to establish a clear majority Think about it Lets say all it takes is  How many bad laws could be passed by brute force of a single party Lets say we drop this down to  and republicans recapture the senate in  They immediately start repealing obamacare banning abortions and shoring up anti gay laws Do you realize how many years it would take to over turn these laws At minimum six or more years to vote in new senators and more than likely a decade or more for it to wind its ways through the courts Thats the entire point of our constitution its set up to where youre pretty much guaranteed to have to cross the aisle to get help passing a bill Otherwise it is tyranny of the slimmest of majorities ,8,cdnsrjg,1rj7x7,politics,new,9,1
alexander,Rouhani is the one who deserves the peace prize for this one All Obama did was take yes for an answer,0,cdo2u6c,1rj8j2,politics,new,2,2
wattmeter,And to think all it took was to dismiss Netanyahu out of hand,3,cdnu48z,1rj8j2,politics,new,4,1
EllimistMeno,This is such crap He wanted war Tried to get us over their since they had supposedly crossed his red line we were just lucky this time he didnt do it With how many times hes committed fraud and trampled our rights the last thing this puppet president deserves is a peace prize Hes earned a noose in my book,1,cdo50m6,1rj8j2,politics,new,1,0
RUSKI,Obama is a joke He is destroying our country He deserves to be impeached and tried for treason,5,cdntshs,1rj8j2,politics,new,4,-1
wangbangerisatool,gtHeroic Diplomacy How Barack Obama Finally Earned That Peace PrizeLOLImagine if you will  A schoolyard bully harassing some timid kid for his lunch money  Obama strategy for peace  Tells the timid kid to give the bully all his money Wallah no more fighting peace at last  Heroic Diplomacy or capitulation,10,cdnwe92,1rj8j2,politics,new,7,-3
tyrusrex,John Cheese of Crackedcom has written several excellent articles about what its like to be poorhttpwwwcrackedcomblogthestupidesthabitsyoudevelopgrowinguppoorhttpwwwcrackedcomblogthingsnobodytellsyouaboutbeingpoorhttpwwwcrackedcomblogthingspoliticianswillneverunderstandaboutpoorpeoplehttpwwwcrackedcomblogcommonmoralsdesignedtokeepyoupoor,1,cdo1tf7,1rj8ty,politics,new,16,15
balancedattack,I was reading an article on forbes the other day about how most people who become billionaires often come from a family of millionaires  I think there is something to be said for that  In college I volunteered at a high school where the kids had the mindset of Im going to be poor the rest of my life so nothing really matters  Its really sad and in almost every case comes from the mindset of the parent  Why better yourself if youre going to stay in the situation youre in  Its all about accessibility whether to a solid education money whatever and for the poor its just not there  So many people go from nothing to something that we really dont understand just how freaking incredible hard it is to do it  Thats why sports are so appealing as a way out  Its a level playing field like no other  In high school I went to a private school I learned that the same freshman book we were using for math was the same book the high school seniors were using at the local public high school  Think about thatno matter how hard they study theyre getting a freshman level high school education at over simplistic but you get the idea  Its sad but these are the opportunities the poor has  I hope we can figure out a way to raise the opportunity level of the poor without decreasing opportunities for the middle and wealthy class,2,cdo0sxx,1rj8ty,politics,new,12,10
SpokeyDokey,Pretty much spot on I realize the mentality were told were supposed to have is that If you work hard you will succeed But I feel like a lot of people take that opportunity for granted They dont realize that some people dont just work hard Their life is hard It takes a lot out of you Is it irresponsible to spend five dollars at McDonalds when you could get so much more for your money at the grocery store Maybe it is But its a small luxury and believe it or not those small luxuries in life are what keeps you sane,1,cdo2hrz,1rj8ty,politics,new,8,7
fuckbitchesgetmoney,That sounds like one of the worse hells imaginable,1,cdnt82o,1rj8ty,politics,new,7,6
Astronautsmum,She is brave to talk about this I am so glad she has ,4,cdnth3h,1rj8ty,politics,new,9,5
purpledust,I hope this is real,3,cdnsub8,1rj8ty,politics,new,6,3
snowbyrd,Beware the Poverty Trance,0,cdnvacc,1rj8ty,politics,new,5,5
mitchrodee,It appears she is taking full advantage of her few minutes of fame She has raised over  with her gofundme account In the comment section below on gofundme she said she was raising her goal to k After she raised k she wrote a follow up piece explaining that this was not her story of living in a cycle of poverty but a compilation of sorts describing lots of bad luck and bad choices made by lots poor people Anyway she doesnt look destitute in any of her Facebook pictureshttpwwwgofundmecomyrak,0,cdoxf2r,1rj8ty,politics,new,1,1
Swiggy,She is going to school but she is convinced she will always be poor Must be going to culinary school,4,cdnuaz4,1rj8ty,politics,new,4,0
drive,Just started reading her bloghttpkillermartinissquarespacecommywordpressHard to put down  Ive read lots of similar blogs from those struggling but nothing quite as honest and introspective as this  She doesnt try to defend her poor decisions  Rather she pulls you in with her reasons for making them,2,cdo05k5,1rj8ty,politics,new,3,1
TheNoLifer,By believing you cant escape a situation you get rid of every chance you have to get out  When you accept where you are you lose the drive to get ahead and people dont get ahead without trying to get ahead  Im not saying that anyone can just try to advance their position and succeed but you miss  of the shots you dont take,7,cdo1czd,1rj8ty,politics,new,5,-2
boyrahett,People come to this country from Central America  walk across Mexico or ride on top of a train cross the desert carrying bottles of water  find jobs when theyre not white and cant speak English well if at all and they can make it here but she cant ,4,cdo5wig,1rj8ty,politics,new,3,-1
Idefixznd,I am going to be downvoted to hell by writing that but I cannot help but draw a parrallel with the generations of poor emigrants who worked their asses off so that their children could have a better life than theirs Are we made of less sterner stuff now My mom was one of those she raised  children singlehandedly working long day for a pitance just so that we would have a better life than she did,4,cdo5s54,1rj8ty,politics,new,2,-2
darthreuental,The worm from Dune makes for a nice touch Krugman continues to show off his love of scifi Back on topic a year from now Republicans wont be calling it Obamacare and theyll be saying it was their plan all along Which is technically true Maybe then we can fix up the loose end and tighten a few screws ,0,cdo04zv,1rj9wx,politics,new,5,5
wattmeter,So right now we are stuck with a twotier system for the working poor In states that are expanding Medicaid they will enjoy free or nearly free health care In states that arent they will remain uninsured and unable to get subsidies to buy private insuranceLet the rash of fingerpointing begin,2,cdnt61k,1rja3u,politics,new,4,2
