author,comment,downs,id,post,subreddit,type,ups,score
ReasonableInference,Ayatollah Khameini has been really consistent in claiming that building nuclear weapons is a violation of Islamic law If there is any evidence suggesting that these guys actually want a nuclear weapon other than vague claims that the US and Israel have intelligence suggesting that Iran is hiding something can you blame them I havent seen itTypically the US doesnt like the idea of a powerful nation that has made its ambitions to become a power broker in the Mideast known gaining any power or prominence Israel is in the same camp I havent seen anything suggesting that these talks arent just a tool to prevent Iran from gaining more political power which will come naturally if Iran is able to have a functioning economy Guess who else benefits from a crippled Iran Saudi Arabia a US ally This isnt a story about nukes Its a story about hegemony ,12,cdmzbh5,1rgebz,politics,new,47,35
nowhathappenedwas,The corollary to this would be Seymour Hersh constantly reporting that the US is on the verge of attacking Iran Journalist US planning for possible attack on IranhttpwwwcnncomALLPOLITICShershiran THE IRAN PLANS  Would President Bush go to war to stop Tehran from getting the bombhttpwwwnewyorkercomarchivefafact SHIFTING TARGETS  The Administrations plan for Iranhttpwwwnewyorkercomreportingfafacthersh PREPARING THE BATTLEFIELD  The Bush Administration steps up its secret moves against Iranhttpwwwnewyorkercomreportingfafacthersh Despite Intelligence Rejecting Iran as Nuclear Threat US Could Be Headed for Iraq Reduxhttpwwwtruthoutorgnewsitemseymourhershdespiteintelligencerejectingiranasnuclearthreatuscouldbeheadedforiraqredux,5,cdn1k0s,1rgebz,politics,new,37,32
uvcollect,Another tenet of the religion of Republicanism  Much like how Jesus is always coming back soon,10,cdmyust,1rgebz,politics,new,27,17
gokism,Watch  Someone on the Right will say why did Obama negotiate with Iran when theyre at least  years away from developing a nuke,5,cdmyxcj,1rgebz,politics,new,15,10
MrAnderson, Israeli parliamentarian Benjamin Netanyahu tells his colleagues that Iran is  to  years from being able to produce a nuclear weapon  and that the threat had to be uprooted by an international front headed by the UShttpwwwcsmonitorcomWorldMiddleEastImminentIrannuclearthreatAtimelineofwarningssinceIsraelpaintsIranasEnemyNoThere is no question whatsoever that Saddam is seeking and is working and is advancing towards the development of nuclear weapons No question whatsoever Benjamin Netanyahu testifying before the US Congress in September httpwwwyoutubecomwatchvfpQdgDJc,3,cdn57y2,1rgebz,politics,new,12,9
livecono,Netanyahu has been saying it since httpwwwcsmonitorcomWorldMiddleEastImminentIrannuclearthreatAtimelineofwarningssinceIsraelpaintsIranasEnemyNo,4,cdn4cpy,1rgebz,politics,new,12,8
tophatjones,The only time republicans think of the future is when they are talking about the boogie man Fuck those clowns,4,cdn31a4,1rgebz,politics,new,10,6
RantsAtClouds,There are a number of reasons why Iran hasnt achieved nuclear fruition First and foremost is international pressure They paused their program from  in the wake of US military action in Iraq It was restarted again when it became obvious that the US was not willing to risk another major venture into the Middle East quagmire This upset the Israelis because they had constantly said that Iran was the true danger in the Middle East and not Iraq despite Saddams bankrolling of Palestinian terrorism Because of the fact that military action was not possible at that time the Israelis and the Americans used far more covert means to stop Irans acquisition of nuclear weaponry This took the form of the funding of opposition groups in Iran and training them how to use weapons including exiles They would take them over to Kurdistan and teach them a number of different tricks of the trade When it was believed that this was taking too long the Israelis began to take a far more handson approach They began to assassinate Iranian nuclear scientists This began in  and has continued to this day That being said assassinations in Iran are often blamed on Israel and sometimes may be the work merely of opposition groups Whilst all of this was going on the NSA or CIA but most likely the NSA was working with an Israeli army unit called  This army unit specialises in SIGINT and attracts the brightest computer minds that Israel has to offer a huge amount of hitech startups in Israel have been formed by ex soldiers Over the course of a period of several years they developed a piece of malware called Stuxnet Stuxnet was one of the most complex pieces of malicious code ever assembled It also had a huge number of safeguards It would only activate if it was on a machine that had the specific operating system connected to specific hardware and was part of a specific network One computer security expert stated that The attackers took great care to make sure that only their designated targets were hitIt was a marksmans jobhttpwwwnytimescomworldmiddleeaststuxnethtmlramprefgeneralampsrcmeamppagewantedallamp All of this had the hallmarks of a professional statesponsored attack The worm was designed to spin centrifuges incredibly quickly whilst showing normal operations to the person who was looking over it However what OP and several commentators is implying is that conservatives have simply brought out Iran as a way to scare people into military action Theres some truth to that However theres also quite a bit of truth to the fact that Iran is heading towards nuclear weapons Iran has often said one thing and done another It has deceived the IAEA and openly acquired materials whose only use could be nuclear weaponryhttpwwwisisonlineorguploadsisisreportsdocumentsIAEAIranNovpdfAlong with this Irans continued sponsorship of proxy terror forces their relationship with AQ KhanhttpwwwwashingtonpostcomwpdyncontentarticleARhtml and their role in the Syrian nuclear program along with North Korea means that the immediate neighbours Israel and Saudi Arabia are becoming nervous at this deal They believe that with the sanctions lifted Iran will simply go ahead and continue working towards nuclear weaponry TLDR Theres truth that Iran is one more year away from nuclear weapons Covert actions in the form of assassinations and cyberwar have delayed the effort by several years Irans nuclear weapons program is far more likely to be an actual nuclear weapons program than Saddams ,7,cdna52j,1rgebz,politics,new,12,5
drh,Theyll get it right one of these years,2,cdn3foe,1rgebz,politics,new,5,3
Benatovadasihodi,Its ok guys I live in eastern europe For prorussian media here the US has been one month away from attacking Iran for over a decade,0,cdnbbnc,1rgebz,politics,new,5,5
badgerman,Well at least theyve gotten their moneys worth out of those talking points,0,cdn9857,1rgebz,politics,new,3,3
darwin,Maybe thats because they are  year of work from having it and that work has been interruptedhalted continuously through international efforts,3,cdn3ukk,1rgebz,politics,new,5,2
SabertoothFieldmouse,Most contemporary American conservatives are fatalists ,3,cdn797j,1rgebz,politics,new,5,2
sadmoviedave,man i loathe bret stephens in terms that are unquantifiable ,0,cdn3q6b,1rgebz,politics,new,1,1
bobcat,They also have a hardon for indefinite military presence on the Middle East  Not a coincidence,0,cdnax4r,1rgebz,politics,new,1,1
ValHallen,Meanwhile the world completely ignores North Koreas stated attempts at nuclear weaponsPerhaps if NK had been mentioned in the Bible people would pay more attention to them,1,cdnberk,1rgebz,politics,new,2,1
WildPepperoni,They are saying the same thing about North Korea too oh wait,2,cdnbolf,1rgebz,politics,new,3,1
StupidSloth,More like early s to the present,0,cdnckha,1rgebz,politics,new,1,1
HotRodLincoln,My favorite time was two years into Obamas presidency everyone kept sayinggtWeve accomplished nothing and Iran is  years closer to having a nukesWell yeah on the one hand everyone is  years closer to having nukes thats sort of how time usually works a linear progression of cause to effect,1,cdnfxtx,1rgebz,politics,new,2,1
adgflt,Netanyahu has personally been making this claim for at least  years,0,cdng1uo,1rgebz,politics,new,1,1
ApplesBananasRhinoc,They were saying that same type of shit in the s,0,cdnifj0,1rgebz,politics,new,1,1
bardwick,If left uncheckedLike if we did nothing about itWe did,0,cdnlifi,1rgebz,politics,new,1,1
YouthInRevolt,The real threats to our national security are everyone who just spoke in that video,0,cdnpxia,1rgebz,politics,new,1,1
guyonthissite,So did it not cross anyones mind that the reason they were close but unable to get there was because of sanctions and international pressure Now that those are gone we will see,3,cdnb8z5,1rgebz,politics,new,3,0
sadman,I think we should give them nukes and see what happens maybe they can wipe the whole Middle East off the map,2,cdnci7a,1rgebz,politics,new,2,0
OctopusPirate,Probably going to get buried but as a liberal who doesnt want to attack Iran I have to speak out Theyre right even though theyre misleading the public and scaremongeringIran is a year away from a bomb quite likely less now and has been for years  Japan is also a year to five away from a bomb and has been for decades  And were okay with bothWhat being a year away means is that if the Supreme Leader gives the final goahead and he has not and Iran raced full speed for a bomb they could have one in a year  Iran is currently building up stockpiles of  enriched uranium and other materials that could potentially be used for a weapon the process is not linear and it takes much less time for the final enrichment steps  Based on their stockpiles and available facilities we know how long it would take them to reach those points of no return  If Iran maintained current stockpiles and added no new facilities they will always be one year or so away from building a bombIf they increase stockpiles or capacity this time will be reduced  If they have more centrifuges and material available then they could reduce the breakout time to a month or weeks  And they could maintain that posture no bomb but have the ability to produce one if desired within a month  Our media would then say Iran is a month away from a bomb for a few years and they would be rightSo yeah  Even though they are scaremongering it isnt contradictory to say they are a year away from a bomb for years on end  Its a statement of how quickly Iran could produce a bomb if they chose to race for one at full speed  Not a timer of how long until they actually build one from today,2,cdnduwh,1rgebz,politics,new,2,0
akidinthequeen,How else are they going to scare people ,1,cdndx5e,1rgebz,politics,new,1,0
observare,NYT  conservative mediahttpwwwnytimescomworldmiddleeastprogressifmodestinholdingbackiransnuclearprogramhtmlpagewantedamprThe good news for the American negotiators is that if there are no hidden facilities it will take Iran several months to produce weaponsgrade fuel from its current stocks and perhaps a year or more to fashion that fuel into a usable weapon and shrink it to fit atop one of the countrys Shahab missiles ,3,cdnhjnt,1rgebz,politics,new,3,0
james,OK Pointing out that the official policy of Iran includes the murderformoney of a western novelist doesnt move those newly graduated from American colleges Guess those speech codes really were effectiveThis is from that rabid rightwing think tank The Brookings Institute httpwwwbrookingseduresearchtestimonyiranterrorismbyman  Heres from Wiki httpenwikipediaorgwikiIranandstateterrorism  Heres from the State Dept httpwwwbuzzfeedcomrosiegraystatedepartmentreaffirmsiranstatusasstatesponsoroft  And Hitchens httpwwwyoutubecomwatchvqrBVQjivS   The Iranian theocrats are not seeking peace,2,cdoaaqw,1rgebz,politics,new,1,-1
BeautifulCreampie,Fox News and Rush Limbaugh looking dumb and even a little Ron Paul plug thrown in at the end could this thread be any more reddit,4,cdnb7sa,1rgebz,politics,new,2,-2
VisIxR,Even a broken clock is right twice a day,12,cdmyvst,1rgebz,politics,new,4,-8
ridger,And for liberal media gun owners are a minor car accident away from a mass shooting,31,cdn3qcs,1rgebz,politics,new,2,-29
libsmak,For liberals the world is going to end in a manmade global warming meltdown within the next year or so Fearmongering is not confined to one ideology,47,cdn2juh,1rgebz,politics,new,9,-38
TwoGee,You mean a nonissue By this time next year the ACA will be cruising along and these past two months will be almost long forgotten,12,cdmyxf1,1rgelb,politics,new,24,12
TastyYams,AmenYou can feel the GOP desperation to keep this on the front pages growing already  Theyve started to resort to cheap publicity stunts like the guy who signed up his dogThe reality is setting in that only really about  of the population need to even go on the website  The vastvast majority of Americans are realizing they arent actually being affected by the ACA other than in a positive wayYou cant keep the doom and gloom media hysteria going over something that doesnt affect  of Americans  They have very short attention spansIf you venture outside r politics politico etc you will find that Obamacare has fallen off the front pages everywhere  Go look at Google news or Yahoo news ABC NBC CBS CNNOne of the great things about being president is your ability to change the subject to saya peace treaty with a former enemy immigration reform etc,6,cdmz1uz,1rgelb,politics,new,18,12
Rutawitz,you mean instead of a noun a verb and benghazi itll be a noun a verb and obamacare,1,cdn1hjo,1rgelb,politics,new,4,3
jpurdy,Did Issa ever take his boondoggle to Benghazi to root out all the cover ups ,1,cdn0wwc,1rgelb,politics,new,3,2
relaxlivelonger,It already has The people who hate Obamacare are the same people who have already been hating it they have just been louder lately Maybe in  months  Minutes will run an Obamacare investigation and get everyone riled up about nothing,2,cdn3hru,1rgelb,politics,new,4,2
wwjd,Obamacare will cause consulate deaths in a wartorn countryClearly magic negro stuffAt least millions of lives at home will be saved if that counts for anything,0,cdn82a7,1rgelb,politics,new,2,2
FortHouston,At the very least that heckler should be shouting at the Republicans who continuously obstruct immigration reform,4,cdmz3p4,1rgf7j,politics,new,6,2
Justvotingupordown,Goddamn it must be hard to be so calm and reasoned in the face of a person who you otherwise totally agree with screaming in your face I cant even deal with anonymous Redditors giving me shit Respect,2,cdmzkua,1rgf7j,politics,new,7,5
FApolitics,I heard the amount of methane being emitted from DC was off the charts,0,cdn3hsn,1rgh5m,politics,new,3,3
MrFlesh,Why not Thats what capitalism is,2,cdn0wbo,1rghkc,politics,new,4,2
nirad,Redistribution is an essential part of any economic system with longterm stability and growth Americas childish inability to deal with that fact is why the future of this nation is probably doomed We simply doesnt have the values to properly deal with st Century secular stagnation ,0,cdn3hn2,1rghkc,politics,new,2,2
damonslaysunicorns,The health law is redistribution of wealth Dont call it exactly what it is ,2,cdn1nzt,1rghkc,politics,new,3,1
shadowbanmeplz,The Obamacare hammer is coming in  to a Democrat near yougtRedistribution is a loaded word that conjures up all sorts of unfairness in peoples minds said William M Daley who was Mr Obamas chief of staff at the time Republicans wield it as a hammer against Democrats he said adding Its a word that in the political world you just dont use,7,cdmzxns,1rghkc,politics,new,7,0
shelbysfoot,Somebodys gonna be tagged as a RINO,0,cdn4302,1rgibu,politics,new,3,3
XiaomuWave,So are we for or against things being decided on the state and local level  I forget sometimes,0,cdn0n8n,1rgimf,politics,new,2,2
shadowbanmeplz,Meanwhile smoking a cigarette while drinking a beer on your front porch will still be allowed  No double standard there  Nothing to see here drugs r bad mmmkay move along,4,cdn08w9,1rgimf,politics,new,5,1
XiaomuWave,gt The former congressman made the case that the war on drugs often leads to wildly inconsistent punishmentsRon Paul isnt even against the drug war  Hes against the FEDERAL drug war  States still maintain the right to implement wildly different drug policies leading towait for itinconsistent punishments,0,cdn0m7d,1rgj84,politics,new,7,7
snowbyrd,And stop picking on the poor enrolling for benefits This has proven to be a horrible ROI for taxpayer dollars If you are going to drug test people that get benefits from the government start at the top with the lawmakers and the corporate CEOs asking for subsidiesYou know the people that actually impact our lives the most,0,cdn0fiw,1rgj84,politics,new,3,3
qmechan,Or the need to arrest Trey Radel,1,cdn08xp,1rgj84,politics,new,3,2
OmniStardust,All we can expect from this is some overt action by the oil billionaires aligned with US UK Saudi Arabia and others to commit some act to cause a war ,1,cdn2r9o,1rgk9z,politics,new,1,0
daraand,For a little backgroundRhythm amp Hues Studios won the Oscar this year for its work on Life of Pi That same month they laid off more than half of their staff due to increased subsidies from other countries notably Canada New Zealand and the UK Subsidies offered by these countries and some states has led to a number of layoffs in the film tv and vfx industries They are also money losers in generalThis website has been a focal point for many in the visual effectsfilm industry in highlighting the issues httpvfxsoldierwordpresscomWhile I understand its bias he does strive to highlight many of the problemshttpvfxsoldierwordpresscomstatefilmsubsidiesshowlosingstrategyOften the only defense is more subsidies which of course lose moneywwwdeadlinecomparamountexecblastscaliforniasincrementalfilmtvtaxcreditprogramPresident Obamas visit tomorrow to Dreamworks comes on the heels of some turbulent times in the past  months at Dreamworks and SoCal filmtvanimation in general The statement that SoCal is creating jobs in this field which I understand is what the President will highlight is seen as incorrect by many in the field,1,cdn0nwd,1rgka9,politics,new,3,2
portnux,Another reason for universal government provided health care,1,cdn1wmn,1rgohf,politics,new,5,4
nirad,Were worried that  per month is too much for someone who makes around  per month That seems pretty reasonable to me,0,cdn9ls9,1rgohf,politics,new,2,2
chuckcharger,Our wealthy overlords tighten their grip,1,cdn7h09,1rgr9l,politics,new,4,3
bpoag,Show me a public school system that doesnt treat children like assembly line widgets and Ill be happy to help you save it,5,cdnaltn,1rgr9l,politics,new,2,-3
Matthew,Excellent None of the nutjobs got elected in the statewide races this time Maybe VA learned its lesson,5,cdn36mp,1rgsg0,politics,new,16,11
WJMorris,gtUnder a littleknown state law the losing candidate after a recount can contest the results in the General Assembly In that case the final determination of the winner would be made by an unusual joint session of the Senate and House of DelegatesHow much you want to bet that the election goes to the General Assembly and Obenshain gets selected by a proGOP General Assembly,1,cdn8owt,1rgsg0,politics,new,4,3
onique,IT is a good deal More than any other president has gotten since they expelled us in after the shaw fiasco ,4,cdn4eqx,1rgspu,politics,new,6,2
moxy,Whenever I see Supreme Court in a headline these days I get a bad feeling in the pit of my stomach,2,cdn60m4,1rgtw7,politics,new,5,3
seanl,Thought Id post this because it proves how much of a joke the WSJ is,2,cdn3qwi,1rgun7,politics,new,7,5
onique,We dont grow coca in America There is no such thing as American cocaine ,6,cdn4dwk,1rgv7l,politics,new,7,1
rodram,I understand the outrage with Radel but where was the outrage when Filner D mayor of San Diego was caught sexually assaulting and harassing his female co workersThere wasnt a single thread on the front pages expressing any anger,2,cdnekc6,1rgv7l,politics,new,3,1
Eonisbanned,Here is how conservatives of Reddit are framing the issue Everything taken from rconservative frontpageObamaCare IS RedistributionhttpiimgurcomfRvDzjpgHouse Speaker John Boehner shocked as family health deductible tripleshttpwwwwashingtontimescomnewsnovjohnboehnershockedfamilyhealthdeductibletripThe economic case against ObamaCarehttptriblivecomopinionfeaturedcommentaryobamacarehealthinsuranceaxzzleWYCImMark Steyn Obamacare the greatest act of punitive liberalism Democrats have imposed on AmericahttpdailycallercommarksteynobamacarethegreatestactofpunitiveliberalismdemocratshaveimposedonamericaYoung Americans Not Receiving Promised Obamacare SubsidieshttpwwwbreitbartcomBigGovernmentPoorAmericansNotGettingObamacareSubsidiesAdminPromised,15,cdn6qtj,1rgv94,politics,new,72,57
NitroHedgehog,I used to think congress was evil The truth is much worse Congressmen are merely stupid people following orders This means if they ever decide to actually start listening to us they wont know how to fix this place Fuck,13,cdn4k8t,1rgv94,politics,new,51,38
TastyYams,Their desperation is growing  Theyve lost the front page to the IranUS nuclear treaty and immigration reformHope they enjoyed it while it lasted   But around  of Americans havent seen any real change to their health insurance  except you knowbetter coverageSo good luck keeping the outrage machine running,28,cdn4d50,1rgv94,politics,new,59,31
Splenda,Take a lesson lefties Attitudinal research testing and message discipline WORKEvery time some document like this turns up we are briefly amazed and then we return to nattering in a thousand directions at once,1,cdnd2xc,1rgv94,politics,new,23,22
shelbysfoot,The GOPuppets have their instructions,13,cdn3zfv,1rgv94,politics,new,24,11
DKRY,If you are very strong against free health care Id recommend studying how Danmark provides free health care to every citizen It comes at a economical price but it is definitely outweighed by the social benefit ,7,cdna8fw,1rgv94,politics,new,18,11
JohnnyBeagle,At least they are giving BENGHAZI a rest,2,cdndkt6,1rgv94,politics,new,10,8
Infiltraitor,Fearmongering towards the mentally weak has always been the Republican strategy,2,cdney80,1rgv94,politics,new,10,8
rickster,This is sad pathetic and awful Not least becausethis is a REPUBLICAN PLAN The reason they have a problem with it is because its being put into effect by a DEMOCRATIC PRESIDENT Ridiculous politicians will be the end of the US as we know it Sad but true,5,cdncp2y,1rgv94,politics,new,9,4
mdavwa,Ya can never tell reading online conservative posts whether one person is using several userids to parrot identical talking points or if there are in fact several persons using unique userids to parrot identical talking points One person pretending to be many or many people sharing one brain between themall sounds the same,2,cdnf106,1rgv94,politics,new,5,3
Bruins,Wait are you blaming them for using facts now  Are you implying that Ds dont have talking points about Obamacare They did not do this in Better title would be Politicians run marketing campaigns duh,4,cdnf67n,1rgv94,politics,new,8,4
NavinRJohnson,Doesnt matter Once the PharmaMedical EquipmentHospital alliance has sucked the last dollars out of our pockets the entire system will collapse and the government will be forced to step in and replace it with socialized health care or at least a way to clean up all of the dead bodiesSounds gloomy but the current system is unsustainable A critical point of medically fueled bankruptcies will occur and then the collapse will commence,3,cdnd5qt,1rgv94,politics,new,5,2
PurpleCapybara,Perfectly appropriate strategy for them  They know that if they repeat lies often enough their base will believe them,2,cdnfaub,1rgv94,politics,new,5,3
xdiak,The Exchanges May Not Be SecureThis is happening so i guess its more than a madeup storyhttpwwwbusinessinsidercomcyberexpertstocongressshutdowntheobamacarewebsiteuntilitssecureI hope it all works out for everyone i just dont see how forcing upon pain of fine young people to acquire insurance you know how young people love being forced to do anything is going to balance this mess Yes they will not be financially ruined if something comes up i understand ,3,cdngia4,1rgv94,politics,new,5,2
percenter,Well in a way they are right Its not to say thats a bad thing to bring health care to all but theres truth to those talking pointsMy insurance will cost me substantially more per year than what it did and it was already a goldplated plan Im sure Im subsidizing others,3,cdnhfut,1rgv94,politics,new,5,2
jsreyn,She isnt part of any political party and certainly didnt get orders from the RNC but my wife is an independent business woman who buys her own insurance   Her policy was cancelled and the new options offered were more expensive than what she hadThe republicans may be lying politicians or manipulative spin doctors but there are real world impacts to the ACA even if its well intentionedThe cheerleading and team red vs team blue stuff detracts from any kind of reasonable discussion,1,cdnjyiv,1rgv94,politics,new,4,3
moxy,Its great to see a semimajor media outlet running with this story,6,cdn5zol,1rgv94,politics,new,9,3
xxTin,Butis it true though,5,cdnb8lk,1rgv94,politics,new,5,0
BuddsMcGee,And so they pile it higher and deeper lying on top of lying and then some more as if that will in turn make it true When does law enforcement begin to get involved with this kind of behavior,3,cdnbr6x,1rgv94,politics,new,5,2
luke,to be fair talking points are nothing new and Id be extremely surprised if memos like this get passed around amongst democrats as well,3,cdndmia,1rgv94,politics,new,4,1
