author,comments,downvotes,id,score,selftext,title,upvotes
brycejongil,117,141,1e38qd,462,,What was it like to be AsianLatino in the segregated south Did the segregationist laws still apply to you,603
BetaPanda,379,84,yus78,459,Do you have a specific joke  Maybe a play  What did people from your field of expertise find funny,What is an example of humour from your periodregion of study,543
lost,170,117,19xrz5,461,Why didnt counties like France have laws like England where people had to practise every sunday,If the English longbow was so feared by the other great european powers why didnt they use longbows also,578
prometheus,66,107,16xw1q,461,Ive always been curious about this so in honor of his birthday celebration tomorrow Ill ask it here How quickly was it seen as one of the best speeches in American history as we see it today What did the political class think of it And those arguing for segregation,What was the immediate public reaction to Martin Luther Kings I Have a Dream speech,568
Uncontrollablellama,24,176,1pokrp,462,When reading about the history of monarchies I feel like Ive read a lot about regencies but not very much on how regencies come to be Was it usually just a matter of the more powerful members of the kings court sitting together and picking someone Or I imagine that if the kings death was not a surprise then he would be able to make personal arrangements for who would run the show after his death Id be interested if there are some documented examples of how a regent has been chosenMy second question is what is the justification for the almost doctrinal tendency throughout history to appoint the mother of a child monarch as the regent even in especially patriarchal and ancient monarchies where women are otherwise not allowed to rule under any other circumstances eg Cixi in China Marie de Medici in France Hatshepshut in Egypt though she eventually seized the throne for herself she started as a regent iircUnlike queens regnant who legally inherited their right to rule queen regents were not legally entitled to this appointment and many nations seemed to avoid female rulers at all costs yet time and time again we see these misogynistic courts freely deciding to choose a woman as a temporary ruler when they certainly have other options What givesMy best guesses are that  in the court of a child king the queen mother is the highestranking adult around in title So she was a natural deputy ruler But Im not sure how much weight rank really holds in these matters since queen consorts often had no political power whatsoever  The mother of the ruler is someone who can be trusted to have the best interests of the ruler in mind whereas other choices for regent may end up abusing the post for personal motivationsSo does anyone have some less speculatory explanations It is such a widespread and old custom that I feel like there must be a good reason for it,In monarchies with a newlycrowned child ruler who was responsible for determining Regency appointments Why was the rulers mother such a common choice,638
RyanGlavin,312,152,16jwz9,458,Little about myself Im currently a high school student in Michigan and am looking into colleges especially University of Michigan Ive been studying UBoats since I saw an Aces of the Deep poster in my dads office when I was six years oldEDIT Im off to bed Tomorrow I can answer more questions on the matter or you can PM me,AMA Hey Askhistorians Im RyanGlavin and I specialize in World War II UBoat Warfare Ask me anything,610
DJButtons,489,53,rk76c,458,Title says it all I am amazed at how many topics there are that fellow redditors are experts in some of them look very interesting like the pirate history person So I figured why not invite every reddit historian to share some of there expertise with rAskHistoriansrAskHistorians  ,To all the historians on here with a tagflair please give me one or two super awesome bits of history from your respective areas of expertise,511
TheAlaskan,239,135,1hpb6k,454,Hi there and welcome to the Alaska history AMA Im uTheAlaskan and Ill be fielding questions about Alaska history today and if I cant get to your question today just wait  Im bookmarking the page and if it gets too big Ill be working on itBut first a little about me My background is in journalism but I graduated from Virginia Tech with two degrees one in history and one in English I write extensively on Alaska history with topics ranging from the latest archaeological finds to modern Alaska Im currently working on a history of the Cuban Missile Crisis in Alaska and hope to present a preliminary paper at this falls Alaska Historical Society conference but Id also like to take this opportunity to promote  Kodiak Island and the worlds second largest earthquakeIts a new book Ive written and designed on behalf of Kodiaks Baranov Museumhttpwwwbaranovmuseumorg and the Kodiak Daily Mirrorhttpwwwkodiakdailymirrorcom Next year is the th anniversary of the Good Friday Earthquake the largest ever to hit North America The quake created tsunami that devastated communities throughout southcentral Alaska and even California Oregon and Washington stateThe book is scheduled to be released this fall in time for Christmas shopping and if youre interested in helping a small local museum and a local newspaper call   or click herehttpwwwkodiakdailymirrorcombookordernew and preorder itWith that ad out of the way ask me about Alaska,AMA Alaska from Prehistory to Present,589
austinwer,224,84,10pkg0,448,Im talking about anything the nazca lines stonehenge the pyramids great wall of china that tomb full of lifesize stone soildiers cant remember the name anything like that ,What ancient stuctures origin is the most puzzling,532
MorningRooster,4,124,1jr8bx,451,,The President of France and the Bishop of Urgell are CoPrinces of Andorra and have a number of powers under the Constitution Do the CoPrinces actually use this power and do French presidents take the head of state of Andorra role seriously,575
WileECyrus,125,195,1gxnvf,450,First its true that I am not a flaired user and could never hope to be  I am interested as an amateur in things like ancient Rome and World War Two and the crusades but I have no real training in those areas and dont feel I could contribute even a tenth as well as the users in this sub do already  Im just another unflaired user reading alongThat being said I like to think I know quality when I see it and the events of the last few days have shown that Im not alone in my opinion on this subjectIn the last few weeks rHistory has been having a series of AMAS from popular history podcasters  Some of them have been pretty okay but none of them have been up to the amazing standards that this sub has set for itself and it hurts to see them promoted  This has been especially frustrating with two of them in particular Mike Duncan of the History of Rome podcast did one herehttpnpredditcomrhistorycommentsfffghelloiammikeduncancreatorofthehistoryof  Rather than repeat my complaints check them out herehttpwwwredditcomrbadhistorycommentsfhjrhistorysusersarereallydefensiveabouttheir Ray Harris of the History of World War II podcast did one herehttpwwwredditcomrhistorycommentsgntgmiamrayharriscreatorofthehistoryofwarwar  It was even worse by any standard it was awful  This was like getting a guy who wasnt even smart enough to consult wikipedia properly to do an AMA  Ive laid out some specific complaints about it herehttpwwwredditcomrAskHistorianscommentsgsatfridayfreeforalljunecanfsdcontext in response to rHistorys top mods defending it but I was not alone  There were several flaired users in rAskHistorians who complained about it herehttpwwwredditcomrAskHistorianscommentsgsatfridayfreeforalljunecancws and on the day of the AMA herehttpwwwredditcomrAskHistorianscommentsgnusrayharriscreatorofthehistoryofworldwarii and who contributed really welcome challenges to the podcaster in his own thread too  Just scroll down and look for rusoved prufrock renoXD and there may be more too  To put it bluntly this podcaster spent the whole day providing absolute shit in response to really simple questions and theres not a single thing he posted in there that anyone should respect  Please go take a look and see for yourselfI know that these two subreddits need to get along because that have so much overlapping community and interests but the thing I love most about rAskHistorians is the high standards it sets for everything that appears here  Promoting this sort of thing seems to go against that and I am offering a formal complaintI hope its okay to make a thread like this  I searched up past METAS and it seemed like it would be but I can delete it if notEdit edit I had earlier said I thought I was banned from rHistory for this post but the ban actually came in a few minutes before I made it and I just hadnt noticed  It seems instead to have been because of thishttpwwwredditcomrAskHistorianscommentsgwlcqdayofreflectionjunethrdcaotxf based on the time stamps but no actual reason was given to me so I dont  knowEdit edit edit As of earlier this afternoon the ban has been lifted so that part of it at least seems to have been resolved  Thank you everyone who asked about this and protested  As far as the AMAS go I have said my piece and the people in rHistory can go ahead with the rest of them without worrying about me complaining any further,META Id like to seriously request that the rHistory AMAS stop being advertised in rAskHistorians,645
GESTICULATINGWILDLY,96,82,137hsp,455,For my Ceramics class Ive been assigned to make a themed chess set I thought it would be neat to replace the king with a Roman emperor but sadly nearly everything I know about Romes military I learned in Fallout from Caesars Legion so I dont have much to go on and would appreciate some helpWhat are some of the different ranks or types of soldiers that would correspond closely with a certain chess piece and what distinctive features did they each have I read somewhere that centurions sometimes had sideways helmet crests which I think would work well for one piece though I dont know which one I also thought a vexillarius would be an interesting one but I couldnt really find any visuals on them apart from what Ive seen in Fallout which Im sure embellished just a bit Thanks for any help you can giveEdit Wow many more extremely helpful answers than I know what to do with I dont have nearly enough time or skill to make everything listed here but hopefully all this info will help me pull something together I wont be able to upload any pictures of a finished product until the end of the semester and I probably wont finish until nearly then anyway but I should have some sketches of the final lineup done by tomorrow if anyone is interested Thanks again,Im making a chess set based on the ancient Roman military What ranks should be used for each of the pieces,537
bowseratediddy,102,103,10iqhm,447,Ive been reading a book that references Keplers Supernova but it really didnt go into much detail Ive done some google searching but I cant seem to find an answer to my questionI know there was a surge in scientific interest and knowledge in Europe at the time However Im interested to know what other cultures thought Did some cultures view it as a religious sign or did most cultures recognize it as a supernova,In  there was a supernova visible by the naked eye for several weeks What did cultures around the world think about this phenomenon,550
woodyallin,70,142,1df9h1,446,I watched a documentary that stated that the Greeks named them after a pyramid shaped food they ate So what did the ancients call these buildings or is the true name lost in history  And if we know the name what significance did it have for common ancient Egyptians,Do we know the name ancient Egyptians gave the Pyramids,588
skytorn,134,124,v5c42,447,I learned a lot about renaissance Italy and Istanbul including the entirety of my knowledge of the Borgias somehow from the Assassins Creed series Ignoring things like conveniently placed parkour handholds how similar are the Venice Florence and Rome depicted in AC to what we know of their th century historical counterpartsBonus similar question but for th century Istanbul and the Constantinnye of AC RevelationsThanks,How close were the cities of Assassins Creed  to their historical counterparts,571
WhatsAEuphonium,192,227,160pi1,447,Example Daenerys from Game of ThroneshttpilvhbocomassetsimagesseriesgameofthronescharactersdaenerystargaryenjpgObviously movies and art take a lot of artistic freedom and Game of Thrones is a fictional world but how wellkept would the people of this time have been even the royalty What things would have been used to clean themselves and how well did these things work compared to all of the products we have available today How was dental hygiene,Would the royal women of the medieval ages really have the flawless features that we see in movies,674
estherke,191,111,1oaimh,444,Welcome to this AMA which today features four panelists willing and eager to answer all your questions on Indias history from the British colonial era to Partition Our panelists introduce themselves to you umyrmecologist I focus primarily on the late th th and early th centuries that too largely in the British colonial context in South Asia uJJatt I specialize in Sikh History from the time of Guru Nanak Dev to Contemporary Ive done a tremendous amount of research into specifically Sikh Military history The ingenuity of creating an army of soldiers from all castes classes and backgrounds especially for the time period and location amazed me Being a Sikh my self I grew up hearing stories of great Sikh leaders and warriors I always admired them and their causes and wanted to learn as much about them as I could I also study quite a bit of Colonial South Asian history as a person of Punjabi descent the impact of colonialism really hits close The Punjabi people are one of the biggest examples of the lingering effects of Colonialism  uvonstroheimsmonocle  I can answer questions related to the armies which served the British Empire in India during the colonial period I will be focusing primarily on the th century however I can also answer questions related to Company and Crown armies in the th century and the beginning of the th century This includes questions related to troops campaigns organization and uniforms uTheWestern My expertise on India comes from my study of European Imperialism my focus is in World War II and Partitionera IndiaLets have your questions,AMA History of British India Colonial Era to Partition,555
DerpeseSimplex,47,101,1ep47k,445,,What did the Chinese and Indian rulers of the day think of Alexander the Great,546
whatamidoing,63,202,1ndi5s,447,Is the way we separate and categorize generations now just a product at how fast everything evolves and how tangible the differences could be,Did other decades experience cultural categorization like s kids In the s were newspapers referring to centennials or discussing how the s generation was different from the s generation,649
Shakedown,86,114,1et1qy,451,,What was society like in Arab Spain Was the European lifestyle left more or less intact while Islamic culture was left to the leading minority How much bilingualism and intermarriage was there Did villagers even know or care that their country was ruled by Muslims,565
elitistcantabrigian,36,127,1dla7n,447,,Were the Aztecs and Incas explorers Did they make maps Did they ever meet,574
eternalkerri,134,149,1hfbrl,444,Gettysburg was from  July  the Vicksburg Campaign ended on July  Gettysburg was the first great defeat for Lee while Vicksburg ended over a two years worth of campaigning and closed the Mississippi river to the Confederacy and cut them in halfSo why is one favored over the other in American lore,How did Gettysburg come to so greatly overshadow Vicksburg a battle that was fought at almost the same time,593
Cervezaporfavor,73,149,1b5986,446,And if olive oil was purchasable how much would a bottle cost me,I am a man of wealth in Han China would I be able to buy olive oil that came from the Roman Empire or did olive oil not reach that far down the silk road,595
TRB,226,106,1aa5p1,443,Hello all Through an odd twist of circumstances Ill be teaching a class pretty well outside my comfort zone this summer As a comparative rookie to the era what can I do to get myself ready for medieval EuropeHeres the books were using for classMedieval Europe A Short History by J BennettMedieval Europe A Short Sourcebook ed by C Hollister et alLife in a Medieval Castle by J GiesThe Poem of the Cid trans by L SimpsonThoughts on the books Suggestions All advice is welcomedEDIT Because It is a very good point and I forgot this its a survey course at the  level Thanks uleblanck,Ill be teaching Medieval Europe for the first time this summer What should I read what should I not What rookie mistakes can one make venturing into the medieval period,549
bargaho,142,138,181wsk,440,Ive heard before that the Spice Trade is ridiculously profitable However I want to know in particular just how valuable it is in real terms for that time period such as the house I can buy the lifestyle I can lead if I can buy a title and become a lord etcEDIT Thanks for your answers everyone I learned a lot more about the Spice Trade For those of you wondering I was thinking about the context of the Age of Exploration and the quest to find another route to the Spice Islands,If I were to find myself in Castile in  with kg of pepper how well would I live,578
Deggit,444,102,127pwu,446,Bonus points if you tell me something interesting about your chosen area that does NOT involve postBC Europe,History is more than battles and inventions If you could get the History Channel to air a documentary about world history in ONE topic that was neither military nor technological history what would you choose,548
wisgary,175,142,1lopwk,439,If I went back in time would I think things are delicious or bland If someone from the past came up and ate some of our food would they find it disgusting or just as good as what they ate in the pastEdit On a suggestion lets bring it down to a specific region Lets say were talking about the most advanced civilizations of old times so how about Europe Italy Germany the like,How different is food preparationtaste  years ago vs today,581
zq,103,109,1b1bk3,441,I understand that the Romans were ahead of their time by having toilets which drained ie waste was flushed away with water but Im not entirely clear about the whole picture Were toilets housed in their own separate building or would they have been a part of the baths Would the sewer system have been linear ie from the toilets to the riversea or would there have been branches disposing of rainwater and water from the baths as well Did the Romans have any form of wastewater treatment or did they just dispose of it into a natural watercourse riverseaThanks for your help  and if there are any sources youd recommend please do,How did the Romans deal with sewage,550
GnosticGnome,313,149,15099t,434,I am told that when most countries started creating permanent last names they would often start as the sawyer son of Eric or from Hamburg  Why are some professions so much better represented than others  Is it primarily that millers are better respected than cobblers and so millers would be more likely to use that as the last name while cobblers would be more likely to be son of Eric instead  Or were the names more evenly distributed originally  but through random chance the Cobbler families happened to have fewer sons  Something else,Why are there so many Smiths Millers Bowmans and Carpenters but so few Cobblers Soldiers Butchers and Farmers,583
eternalkerri,112,124,16r63g,437,Okay folks lets talkWe have seen a recent amount of sizable growth in the past few months with our repeated posting to rbestof and winning Best Large Sub from truebestof   We are flattered and excited by this growth but at the same time have seen some growing pains occurring so we wanted to go ahead and address themLately we have seen quite a few rules debates occurring around here  They have gotten so bad that they ended up exceeding the actual number of posts that actually addressed the issue  Its fine that you want to debate the rules however if you feel passionately enough about them contact the moderators and ask for a clarification or ask to take them to a meta thread  We are here to answer questions not bog down a thread with debates over the definition of isNow let me go ahead and clarify a few thing outright  The rules are the absolute bare minimum that must be metMost top tier posts fit these guidelines  However we have seen quite a few mediocre posts using those terms loosely  We prefer that you exceed the rules  Copy pasta of an article is lazy posting and spammySomeone the other day simply copy and pasted the text of a wiki article as their entire post  Firstly always assume that the OP has read the bare minimum of information to include Wikipedia  You can quote it in your answer but as your only answer its just spammy and lazy  This leads me to  Simply throwing a link up is also a bit lazy If you are linking to a web site or another raskhistorians thread that already answered this question please give a TLDR for the links    Dont post just to save for later  There is a save link feature to redditPlease use it  You are just spamming up the thread  If you cant answer now dont answerIf you do not have to the time to answer dont throw up a I know the answer but I cant answer now  Just wait until you can answer please  Its not a race to karma and even though your answer may not end up at the top you can still use it later to get your flair if that is what you are after  If your answer begins with Im guessing or I dont know but I think or god forbid I was told by a guy I once knew just dont postIf you are not  sure of your answer just dont bother  It spams up the thread  This isnt a test you are taking and its not a contest to answer  I myself have stopped halfway through more posts than I have finished here because I wasnt  sure of my answer  Quit guessing you arent being graded  Source PLEASE if asked especially if you are not flairedIf you are being asked for a source it completely behooves you to find something to back up your claims especially if you are not a flaired user  Flaired users have shown that they are reliable and are able to substantiate their claims  Nonflaired users should really substantiate their claims with a source  No it doesnt need to be a citation down to the page but something should be available if you are asked  You probably arent the only person to read that book so it allows people to check your work  In any debate the mods pretty much are the final wordUnlike many other subs the moderator team here are actual experts in their fields varying from college professors to grad students to published writers to highly read amateurs  We also spend much of the day debating back and forth about new policies new rules and the way controversial posts are handled  Very little is done arbitrarily by power tripping mods outside of elimination of posts that blatantly violate the rules  When a mod says the post is not good enough and deletes it and you want to object take it to mod mail  When a mod asks for a source they are doing so for a reason just give sources  If you have any problems send it to mod mail do not spam up a thread with your Braveheart style FREEEDOM TO POST speechAnd before you ask yes mods here have changed their minds about things after they have been clarified  UPVOTED FOR AWESOME  You rock etc are spam  Stop itNuff said  Let your upvotes speak  Two sentences does not an answer make  If you are going to answer the question give an in depth quality answerIf your answer is something like this exchange Q What did pirates really sound like A Pirates came from like all over and they really wouldnt have sounded like you think they do  Then you have given a bad answer  You need to explain yourself clarify things show why  Anyone can write a two sentence answer someone who actually cares writes a paragraph  Actually answer the question  Quit trying to redefine the question for them and obfuscate that you dont actually know the answer  Just bloody answer itLately I have seen a lot of hand waving that doesnt actually answer the question  For example I myself asked the other day How many members of a Roman Legion were from the upper classes  The response I got was telling me all about how you had to be a leader in the legions to gain high office  Yes thats nice and all but it doesnt answer the question  If someone asks Why did Hitler have a mustache dont answer with a bunch of half thought statements about the history of facial hair answer that specific question    Stop with the nonsequitors  Only post something that is relevantSimilar to   If OP asks about the history of Islam in the Philippines dont say something like Bangladesh is Muslim too  Its irrelevant and makes you sound like Ralph Wiggum,Meta Some reminders and clarifications about answers,561
mrjderp,88,123,1ft4gs,443,Or did they It seems to me that if hundreds or thousands of people are using one pool of liquid to bathe it would become very unsanitary very quickly,How did the Romans keep their public bathhouses sanitary,566
catcherguy,88,117,13pvak,432,,Serious question here  If all historians have to go on are historical texts and documents how does history as a discipline move forward assuming that very few relevant new texts are discovered each year  How is progress distinguished from pure speculation,549
