author,comments,downvotes,id,score,selftext,title,upvotes
blindingpain,355,146,1dxxob,598,Edit Thank you for the questions if anyone wants to add to questions here please just scan through the responses to see if its been addressedA little background on Chechnya and on myselfChechnya is nominally a part of the Russian Federation in the North Caucasus Chechnya first came under Russian control in the late th century and has essentially a part of the Russian Empire since thenThe Chechens fought a long war of independence in the th century and fought two more wars with Russia beginning in  and ending roughly in  The Chechens are historically Sufi Muslim Within Sufism there are several paths to the divine somewhat like denominations Sometime in the th century most Chechens followed the Naqshbandiyya path tariqa while today they are predominantly QadiriyyaThe North Caucasus are extremely diverse with hundreds of ethnicities and languages over the past few hundred years although the republic of Chechnya is one of the most homogenous countries in the area with a vast majority of ethnic ChechensThe issue of language in Chechnya is like nearly everything regarding contemporary Chechen culture extremely politicized and pregnant with the politics of history The native language of Chechnya is Chechen noxchiin mott in Chechen a Caucasian language in the NakhDaghestanian language family It is unique to the Caucasus and is spoken by the great majority of ethnic Chechens living in Chechnya Throughout Chechnyas history Cyrillic Latin and even Arabic alphabets have been used depending on the influence of Russification policies Islam or antiRussian nationalism in vogue at the time Like most other ethnic minorities in the Soviet Union though most Chechens throughout the twentieth century also spoke Russian In the early s all nonCyrillic alphabets were made illegal for use in the Russian federation and Chechen has since been written in the modified CyrillicI am not a linguist nor an expert in the language but I can answer basic questionsI received my degree in Russian History with a Thematic Specialization in Political Violence My dissertation was on the motivations behind Chechen terrorists particularly suicide bombers This AMA is a bit of a hybrid as I am willing to field questions on Chechnya and its history and also on theoretical terrorism suicide bombing and guerrilla warfare as it pertains to Chechnya I have published two peer reviewed articles on Chechnya one on the Russian counterinsurgency operation in Chechnya from  and the second on the Chechen insurgency and the development of terrorismI will not answer nor address any questions or comments with racist or hateful undertones This sub is for enlightened and educational historical dialogue not as a venue for bitter diatribes and hateful rhetoric Please be respectful I will not speak on the morality of terrorism I do not condone terrorism I recognize terrorism as a form of political communication Even so the ism ending on the word implies not only a communicative act but also an ideology and mindset of terror and so I recognize that terrorism comprises much more than a single act There is no universally agreed upon definition of terrorism so the definition that I use a combination of two common definitions one provided by Boaz Ganor and by Rhonda Callaway amp Julie HarrelsonStephensgt Terrorism is defined as any intentional act of violence against civilian targets that do not have the authority or ability to alter government policy with the purpose of attaining or furthering political aimsI will be here for several hours will be away for the weekend and will continue answering any leftover questions on MondayThere is such thing as a stupid question but you wont know until you ask So feel free to ask about the mundane as well as the complex its a littleknown country with a littleknown history so I dont mind questions many may regard as silly or stupid,Wednesday AMA Chechnya,744
halleasy,369,168,15wv6z,601,What was Arab religion society culture and all around general life like before the spread of Islam ,What was the Arab world like before Islam,769
atomicbolt,478,174,19elbj,597,Specifically not just the known diseases at the time  plague smallpox syphilis etc  but the diseasesmedical conditionsdisorders that wouldnt be discovered until much later that historians now believe a famous figure suffered from in hindsight,There are a lot of Famous historical figure actually had disease theories  which ones do historians agree are the most plausible,771
blueskies,107,169,1kcgjr,594,,During the Cuban Missile Crisis of the s what was going on at the Guantanamo Bay base in Cuba,763
texpeare,111,222,1eau3f,596,Bonus points Was someone there during the battle to treatevacuate me How much time passed between evacuation and treatment To what degree will I recover  Does it make a difference which side I am on  Does it make a difference which theatre I am in,US Military History I made it back alive but Ive been shot in the thigh What sort of medical attention do I receive and what are my chances for survival in     and ,818
mOnion,175,190,11ox73,597,,the last four months of the year all have incorrect numerical prefixes SEPTember OCTober NOVember DECember but they are not the thththor th month is there a historical reason for this,787
Daeres,225,176,1cjatl,596,Rules Post Part the FirstRecently there has been a growth in posts asking extremely general questions These questions often sound extremely similar and in particular many of them use the phrase in your area of expertise Though the questions themselves are wellintentioned we have received numerous complaints about them They encourage extremely short replies and often extremely bad answers This then often requires moderator intervention due to the large number of responses ignoring our guidelines and rules The subreddit is intended to be a source of indepth historical knowledge and these questions are not taking advantage of that  The mod team has therefore agreed that we want to take direct action much as we did previously regarding poll questions we are going to be removing these extremely general threads from now on The aim is twofold to have less generalised questions posted in the subreddit and to redirect those generalised inquiries to more appropriate places  For those seeking clarification about what more appropriate places means we have two weekly meta threads which suit more triviaoriented questions and answers the Tuesday Trivia thread and the FridayFreeforAll The former has a particular topic each week but the latter is explicitly designed to fit questions that dont quite fit elsewhereThese are the guidelines that we will be using when removing these kinds of questionsOne of our key principles regarding questions is that they should be as precise as possible we do not want threads that will attract only bad answers or are so generalised that they cannot be answered We will therefore remove questions that are seeking trivia rather than informed answersOur guiding rubric is if a thread can be summarised as tell me random stuff about X through history then it falls into this category of trivia rather than looking for indepth answers which are this communitys main focus Questions likely to be removed are those asking about all periods and all places at once If your question begins with the phrase In your area of expertise strongly reconsider posting it or consider making it more specific For example perhaps narrowing your question to a specific time period or area or focusing your topic to enable more informative answersRules Post Part the SecondFollowing our recent meta thread on the issue found here we have also decided to implement some measures regarding NSFW threads For anyone unfamiliar with the term we mean questions whose content can cause problems in nonprivate environmentsWe would like anyone asking a NSFW question to put the nsfw tag on their question after posting it and we would like them to make the title as SFW safe for work as possible If questions violate this they will be removed and we will message the OP about reposting that question with a changed title We are operating on a we know it when we see it principle regarding NSFW content in titlesThis is only ever likely to be relevant to a small number of threads as NSFW questions are not asked that often here But our aim is to help anyone browsing the subreddit for whom NSFW text may be a problem In addition our only concern here is the titles of threads When it comes to the actual posts within the thread we arent concerned about NSFW content at all These rules are about allowing people to a know that a thread has NSFW content before looking at the comments and b making sure noone gets in trouble for accidentally viewing a NSFW title,Meta A pair of rules announcements,772
ANigerianWarlord,156,192,1klpir,596,,When did the last significant melee battle take place between two military forces,788
whiteknight,174,236,1b8qjt,589,I have heard that there was actually a lot of nazi sympathy in the US  they werent seen as evil right away at least not by everyone Was there ever any serious diplomatic consideration about allying with the Axis Obviously this would have involved betraying key allies but I am just curious ,Did the United States government ever consider allying with the Axis powers in WWII,825
atmdk,167,170,18i9x1,589,How does todays American standard of fat or obese compare to what ancient Romans considered fat was When a roman author says someone is fat do they mean they were a rotund person or were they fat like people in todays society Were there    pound Romans ,How fat was fat in Ancient Rome,759
caesar,81,247,1iw1uy,590,Ive recently revamped rMiddleEastHistory with the help of a CSS wizard and would like to actually announce it here in rAskHistorians Basically were looking for contributors and readers who can participaterMiddleEastHistory is an allencompassing subreddit for anything involving the Middle East throughout history from Sumer to SykesPicot and beyond If it happened in the Middle East its fair game here Fair game  book and article recommendations maps primary sources pictures text posts archaeological findings paintings manuscripts sculptures architecture and discussion topics I bet Im missing something  The rules are somewhat similar to herehttpwwwredditcomrMiddleEastHistorywikirules but obviously submissions are open to anything  I direct all historical questions I get there to here in rAskHistorians,Announcingish rMiddleEastHistory,837
meowbark,154,179,14re3t,593,Seriously ,Who cleaned up the bodies on DDay,772
fernguts,101,207,1e7adh,588,,Weve all seen the unrealistic torches used in Hollywood movies but what were actual torches like during your period of speciality How were they constructed how effective were they and how long would they burn,795
xgeorge,119,176,1fi2b6,589,Dwarfs are obviously an important part of a lot of Norse mythology How did this affect their treatment or attitudes towards actual dwarfsEdit well this has been fantastic thank you very much everybody Its cleared up everything perfectly Askhistorians really is the best subreddit,How did the Norse treat people with dwarfism,765
elizinthemorning,82,177,178mq9,586,I just watched this videohttpwwwnytimescomopiniongospelofintolerancehtmlr that talks about evangelical Christianity and the violent antigay sentimentlegislation in Uganda It is very much not my intent to discuss current politics here but it got me wondering about the history of Uganda and other parts of AfricaWhat views were there about homosexuality in Uganda or elsewhere in Africa before Christian missionaries started coming from other parts of the world to convert people Were there African culturessocieties where being gaylesbiantransgender was acceptedSecond disclaimer I dont mean to imply by my question that I think all of Africa shared the same viewpoint I know that there are many different cultures on a very large continent However given that many African countrieshttpenwikipediaorgwikiLGBTrightsinAfrica outlaw samesex sexual behavior I was curious about other parts of Africa than just UgandaThanks in advance,How was homosexuality viewed in Africa before Christian missionaries,763
gyrfalcons,829,153,zliuz,583,As someone who studies primarily Southeast Asian history theres a lot I could go for but I generally find telling people that a good bit of the  Vietnamese Declaration of Independencehttpwwwfordhameduhalsallmodvietnamhtml was taken almost verbatim from the US a lot of fun Its my go to fact a lot of the time and allows me to segue into the colonial history of Vietnam and the varying perceptions that various people had of the Second Indochinese War Plus usually it gets people asking questions about why Ho Chi Minh would do that and I can also go from there into how communism was very far from standard everywhere and why the US cold war policy was not as UP DEMOCRACY UP FREEDOM as people generally wouldve perceived it to be So basically for me its a fact that gets people asking more into the topic and lets me talk about the complicated nature of history as opposed to HURR IN X YEAR Y HAPPENED which is generally what people seem to expect when asking that sort of question ,Whats a piece of knowledge from your area of historical study that you enjoy telling people about and why,736
meantforamazing,34,185,1f28fe,592,,Im a slave in the south and want to trek north via the Underground Railroad How did I learn of the Underground Railroad How did I participate,777
cdeesham,177,195,1dejgs,579,,Woke up with a massive sinus headache this morning While taking my allergy meds I got to thinking What did ancient cultures do to handle common medical problems like allergies heartburn etc,774
semihuman,107,149,190l1i,588,I was on the beach the other reading up on some Roman history and it crossed my mind that the beaches today were just as inviting for a dip and relaxation as they were a thousand years ago So my question is this is there any evidence that suggests that ancient peoples went to the beach to have a dip play their version of volleyball etc or was it too much of a hassle or against social customs of most peoples back then If they didnt when and who actually started the custom of going to the beachKind of a silly question I know but Im just as interested in the daytoday lives of our ancestors as the big events that tend to get the focus of historical study,Did ancient peoples go to the beach as we do today,737
bunabhucan,140,298,1bfjmp,578,There have been recent articles about changes brought by newly elected Pope Francis  washing the feet of women as well as menhttpwwwmyfoxchicagocomstorypopefranciswasheswomensfeetinbreakwithchurchlaw wearing simpler garments and so on This made me wonder what the practical limits of the power of the papacy areHistorically what have been the limits of the power of the pope within the church To pick one issue celibacy if a pope wanted to reverse the celibacy requirement for priests or make a similar major change would the pope be required to consult cardinalsbishops or could the change be just by decree On a practical level would a pope need to have a Vatican council type meeting before trying to implement such a change Have there been historical instances where changereform efforts by a pope met with enough resistance to demonstrate a limit to the popes power,Are there limits to the power of the pope within the Catholic Church Have there been historical instances of reform that were resistedthwarted by the rest of the catholic church,876
MrBimmler,706,172,11xux4,580,The mace sword axe or other I know its hard to compare but what advantages or disadvantages did the weapons have,Which medieval close combat weapon was the most effective,752
zaaakk,208,119,vs4d7,580,History often suffers from focusing too much on the most important people Im curious to know what life was like for the majorityEDIT For extra points write an example in a narrative of an average day for an average person,Can you describe the daily life of an average person in the period you specialize in,699
CranberryBogMonster,79,151,17mvv1,579,I ended up thinking about this question after seeing someone make a comment a few weeks back suggesting that for all the attention we give to the biggest multinational corporations today their size and influence actually pales in comparison to some of the commercial giants of the th through the th centuriesForgive me if Im not phrasing this well because obviously my formal understanding of economics is quite limited But I guess Im just curious how accurate this assertion is Im aware that the East India Company for example employed its own military forces which definitely seems out of the ordinary compared to the actions of companies today but Im also curious did these organizations control a substantially greater share of global trade and commerce than any of the largest companies today And if so how did they manage it Simply by being some of the first jointstock ventures and enjoying the advantage of getting there first so to speak Or is it more complex,How did the power and economic reach of premodern organizations like the British East India Company compare to modern megacorporations,730
johnw,629,200,176r19,581,It seems that everyone that held absolute power was a very terrible person Was anyone in the position of absolute power who was a good person that benefited his nation Sadly the best example I can think of was Tito and even he killed  people,Were there any good dictators at any point in history,781
ox,850,164,141qle,580,I dont really mean examples such as the British soldier who could have killed Hitler surely every terrible dictator could have been killed at some point before they took power Im thinking more like The Cuban Missile Crisis the US government coming ridiculously close to starting a nuclear war,What are hisorys greatest near misses Events that had they happened would have had drastically altered history,744
UraniumBomb,66,181,1lppfa,579,I was reading about Thomas Paine and The Age of Reason and I saw that the book was a best seller in America and caused a short lived revival of deism  Between that and several of the founding fathers being deist or at least supporting the ideas to some extent what caused the public to abandon the idea  Also would there have been people who identified as deists in the s or s  If so how would they be regarded,What happened to deism in the United States,760
craybatesedu,204,140,1k7ke3,579,,Has the Nobel Prize ever been awarded for something that later turned out to be completely bogus,719
yesanastasia,208,179,1iursk,573,What was the most common beverage of the early precolonial Native Americans Besides water did they ever drink fermented beveragesother drinksEdit Wow I have learned a lot from your answers Didnt know I would get such a great response Thank you everyone,What did ancient Native Americans drink,752
deleted,247,157,17t2cd,573,Ill start off with something relatively modern  a young schoolgirlshttpenwikipediaorgwikiSamanthaSmith letter to Yuri Andropov the leader of the Soviet Union at that time in gtDear Mr AndropovgtMy name is Samantha Smith I am ten years old Congratulations on your new job I have been worrying about Russia and the United States getting into a nuclear war Are you going to vote to have a war or not If you arent please tell me how you are going to help to not have a war This question you do not have to answer but I would like to know why you want to conquer the world or at least our country God made the world for us to live together in peace and not to fightgtSincerely  Samantha SmithAs you may read from the linked article the letter was published in a popular Soviet newspaper and while Andropov did not reply immediately he did respond with thisgtDear SamanthagtI received your letter which is like many others that have reached me recently from your country and from other countries around the worldgtIt seems to me  I can tell by your letter  that you are a courageous and honest girl resembling Becky the friend of Tom Sawyer in the famous book of your compatriot Mark Twain This book is well known and loved in our country by all boys and girlsgtYou write that you are anxious about whether there will be a nuclear war between our two countries And you ask are we doing anything so that war will not break outgtYour question is the most important of those that every thinking man can pose I will reply to you seriously and honestlygtYes Samantha we in the Soviet Union are trying to do everything so that there will not be war on Earth This is what every Soviet man wants This is what the great founder of our state Vladimir Lenin taught usgtSoviet people well know what a terrible thing war is Fortytwo years ago Nazi Germany which strove for supremacy over the whole world attacked our country burned and destroyed many thousands of our towns and villages killed millions of Soviet men women and childrengtIn that war which ended with our victory we were in alliance with the United States together we fought for the liberation of many people from the Nazi invaders I hope that you know about this from your history lessons in school And today we want very much to live in peace to trade and cooperate with all our neighbors on this earthwith those far away and those near by And certainly with such a great country as the United States of AmericagtIn America and in our country there are nuclear weaponsterrible weapons that can kill millions of people in an instant But we do not want them to be ever used Thats precisely why the Soviet Union solemnly declared throughout the entire world that neverneverwill it use nuclear weapons first against any country In general we propose to discontinue further production of them and to proceed to the abolition of all the stockpiles on EarthgtIt seems to me that this is a sufficient answer to your second question Why do you want to wage war against the whole world or at least the United States We want nothing of the kind No one in our country neither workers peasants writers nor doctors neither grownups nor children nor members of the governmentwant either a big or little wargtWe want peacethere is something that we are occupied with growing wheat building and inventing writing books and flying into space We want peace for ourselves and for all peoples of the planet For our children and for you SamanthagtI invite you if your parents will let you to come to our country the best time being this summer You will find out about our country meet with your contemporaries visit an international childrens camp  Artek  on the sea And see for yourself in the Soviet Union everyone is for peace and friendship among peoplesgtThank you for your letter I wish you all the best in your young lifegtY AndropovNoting the escalated tensions during that period it was a blessing for the Soviet leader once cast as a threat to world stability to declare straight that their main priority is not to wage war but instead to focus on economy The entire operation played a large part in humanising Soviets and Americans from each side and may have played a part in defusing aforementioned tensionsTheres also something else if you guys dont mind a second examplehttpenwikipediaorgwikiBerlinWallTheFall also from the sgtAfter hearing the news conference broadcast announcing relaxed border control between East and West Germany East Germans began gathering at the wall and at the six checkpoints between East and West demanding that border guards immediately open the gates The surprised and overwhelmed guards made many hectic telephone calls to their superiors about the problem At first they were ordered to find the more aggressive people gathered at the gates and stamp their passports with a special stamp that barred them from returning to East Germanyin effect revoking their citizenship However this still left thousands of people demanding to be let through as Schabowski said we cangtIt soon became clear that no one among the East German authorities would take personal responsibility for issuing orders to use lethal force so the vastly outnumbered soldiers had no way to hold back the huge crowd of East German citizens Finally at  pm the guards yielded opening the checkpoints and allowing people through with little or no identity checking As the Ossis swarmed through they were greeted by Wessis waiting with flowers and champagne amid wild rejoicing Soon afterward a crowd of West Berliners jumped on top of the wall and were soon joined by East German youngsters They danced together to celebrate their new freedomFeels good man,What is an example of a heartwarming tale from your researched point of history,730
roryfl,55,186,1ltw6j,573,When ever I see a picture of a crowd from around the turn of the last century forward it seems that literally every man is wearing a hat regardless of economic status or profession Why and when did this begin and end,When did men wearing hats become so universal and when did it cease,759
Jondare,281,118,1f3pc9,574,So saw thishttpwwwredditcomrAskRedditcommentsfwsdoesanyoneknowifadolfhitlereveractuallycae on Defaultgems and while he does use a lot of sources and so on i thought it would probably be a good idea to get the eyes of my favorite historians trained on itSo how accurate is the post Did Hitler actually do nothing wrongim so so sorry,How accurate is this Defaultgems submission concerning Hitlers stake in the holocaust,692
