author,comments,downvotes,id,score,selftext,title,upvotes
eternalkerri,350,1297,12wfcz,2553,In the past two days we have had two threads one about Puerto Rico statehood and one about Why is the South so ConservativeBoth threads were rather popular but both were full of empty answers stereotypes pun threads circlejerking outright bad information wild baseless speculation political soapboxing and outright awfulnessBoth threads have been nuked from orbitWe have had a massive influx of new users who apparently have not bothered to familiarize themselves with the culture of this sub  The top tierlower tier answer and casual comment rule is being wildly abused  Subjects are drifting WAY off topic  There is to many unsupportable answers  There is to much of getting up on a soap box to lecture the sub about your political beliefsSimply put it is being abused and the moderators are going to have to play Social Worker   Unless the jokes are relevant they will be removedand even that is getting pushed to the breaking point  Meta threads are really the only place where we are looser with the rules on this Stay on topic or relevant  Your trip to the gas station today or the pizza you ate today had better be relevant or it goes Keep it in rpolitics  No seriously Im not kidding  Any discussion of modern politics after the early s will be nuked  It has to be VERY RELEVANT to be allowed after that Posts had better start being backed up no more idle speculation  There are far to many posts that are just random wild guesses halfinformed or are based on what is honestly a gradeschool level of understanding of the material  This sub has grown massively based on its reputation and we are going to maintain it  You the user base has to help maintain that reputation downvote posts that are not fitting of this subs standards report spam and garbage posts and hold each other to a higher standard  The moderation team does not want to have to turn this completely into raskscience in its strict posting standards but if we cannot trust the user base to police itself we will have to continue to enact tougher and tougher standards until this sub becomes what is honestly an overly dry and boring place,Meta  Okay Im going to explain this for the last time,3850
Idratherbeeating,352,946,1247fn,2417,I find the idea of Law Enforcement fascinating  We take for granted that if a law is broken there will be a group of well funded motivated people to discover who is responsible and hand out justice  I know that a public police force is a relatively new development in history but also assume that most cultures have been against having friends and family killed  So what was the process to figure out who did it without the modern police  I assume most murders happen in private  If someone killed my brother Id want to know who was responsible  Its in everyones best interest to catch the person  Any special methods or rights given to investigatorsAny famous detectives throughout history even if they werent known as such at the time  Any famous killers that were never caught  Any insights would be appreciatedEdit  Front page  Damn  Ive arrived,Its year XXXX of your specialty  A dead body is discovered in the middle of a well populated area and the overwhelming evidence suggests he was murdered  Is anyone in charge of finding the killer  What is the attitude of the public and is there an expectation of justice ,3363
UTDoctor,485,447,1ekw2j,1868,,How did precolonization Midwest Native Americans deal with tornados Did they write any records of these types of storms,2315
MALON,282,838,1kwplu,1867,Im sorry if this is the wrong subreddit but you guys seem highly active and might actually care unlike AskReddit If a mod is going to remove this post can you recommend a good subreddit to ask in ThanksAlbumhttpimgurcomasGyI The wooden box was even nailed shut but he took it to an antique dealer to have it opened Antique dealer apparently wasnt sure what it was worth after verifying the contentsWhat should be done with itThanks for any suggestionsEdit So it seems I should not drink it No big deal probably wasnt going to anyway So what should we do with it,My uncle found an unopened almost gallon of government approved US Treasury tax stamped EverClear alcohol from prohibition times  when renovating part of the basement Whats the best thing we can do with it Museum Drink it Sell it Pics inside,2705
BoomFrog,238,833,1juvpx,1806,My wife found these on here Chinese equivalent of twitter  Are these pictures depicting something that likely really happened  What time period is this from  Or have I been duped and these are just some modern artist having a laugh  The only reason I even suspect authenticity is that the art styles are so variedhttpimgurcomatZ,NSFW What is up with these depictions of half naked Victorian era women fencing,2639
AirandSpaceExperts,393,596,1ihk4t,1799,On July   millions of people across the globe watched two men set foot on another world for the first time A panel of experts from the Smithsonian National Air and Space Museum is available to answer your questions about the first Moon landing mission Apollo  and other Apollo missions The panelists also have expertise in caring for a worldclass collection and know what its like working in one of the most visited museums in the world Questions on museum work are also welcomeThe panelists includeAllan Needell curator of human space flight in the Space History DivisionI will answer questions about the Museums Apollo artifacts and current plans to completely redo our exhibit on the early US Human Space flight programs through Apollo I am especially interested in what people want to see in a Smithsonian Apollo exhibit and what about that period is deemed most interesting and important and whyJennifer Levasseur museum specialist in Space HistoryI will address questions regarding small astronaut equipment including space food and hygiene equipment astronaut photography and cameras our postApollo spaceflight collection and acquiring objects from NASACathleen Lewis curator of international space programs and spacesuitsI will answer questions about the museums spacesuit collection and the history of spacesuit development  Lisa Young museum conservatorI will address inquiries pertaining to the conservation and preservation of the spacesuits at the Museum material analysis and identification of spacesuit hard and soft goods display and storage of spacesuits and conservation questions related to spacesuit materials found on related Apolloera objects in the National collectionProof httpimgurcomsVYThank you everyone for your wonderful questions Our experts need to go to their Apollo gallery planning meeting but they will try to answer a few additional questions later today,Were experts on the Apollo Program from the Smithsonian National Air and Space Museum Ask us anything,2395
DanCarlin,597,477,19hkqe,1682,,Hey EveryoneIm Dan Carlin host of the Hardcore History and Common Sense podcastsfeel free to Ask Me Anything,2159
blooregard,691,813,1j5nlr,1677,What did they do for protection,In early times where brothels and prostitutes were a part of everyday life how did the prostitutes avoid getting pregnant,2490
eternalkerri,1693,766,1bd62c,1659,Over the past year rAskHistorians has grown from a small community of historinerds to a subreddit that gets touted on rAskReddit as a musthave While the consistent influx of new subscribers K per month on average over the past  months has brought new contributors and new viewpoints it has also meant that a lot of the same historical ground gets covered recovered and covered againThe mods of rAskHistorians have attempted to contain this repetition by pointing questioners to our FAQ and many contributors to this sub have done the same for which we thank you This has not been enough though and certain topics get brought up so frequently as to drown out other areas of inquiry We mods have thought long and hard about how to handle this but have unanimously settled on the following rule changes as the only viable solution to the problem  No more questions about Hitler  We are constantly saturated by questions about what did Hitler think of cap and trade the infield fly rule Coke or Pepsi  It delves into the absurd at times and honestly blocks the access to better questions  Therefore in order to improve the quality of the sub we will spin all Hitler questions off into raskaboutHitler  A sub completely dedicated to the history of Adolf Hitler  Starting next week  rAskHistorians will no longer be accepting questions about World War II Those posted will be removed  This may seem like a drastic measure  we mods acknowledge this  but we also feel that it is the only way to keep our community asking fresh and interesting questions about history At this point there is simply nothing left to ask and answer about WWII in this subreddit everything has been covered already In the future we may phase out other topics that have been frequently and completely covered such as Rome and Vikings In the meantime make sure to visit the new queue and upvote intriguing and novel questions there Just not ones about Nazis  Please visit the future raskaboutWWII for your questions  Poll type questions will return with a twist  We removed poll type questions like Which General had the nicest uniform or Which King was the most Kingly because they were heavily subjective and full of bad information  However they were also immensely popular  So we decided to reallow them with a twist  If you want to ask a poll question as the OP you must now keep editing your post to keep a tally of all the answers and reasons within your top post  This allows people to keep from repeating answers  Jesus is real  End of story  After constant incessant and heated argument in order to prevent further discord we have decided to go with the majority opinion of the historical community and state that Historical Jesus is real  If he was the son of God is still debatable but it is outside of the purview of this sub  We will delete any further questions or assertions that Jesus did not historically exist  All first hand sources from Greece or Rome must be posted in the original language  Due to the heavily contentious nature at times of various translations and word usage only citations of Greece and Roman literature must be in the original language so that we may see and be able to interpret the wording that you are using  This allows us to further analyse the first person source  We will be partnering with rlinguistics to properly interpret these posts    Going forward all conspiracy nuts racists homophobes and sexists will be preemptively banned  Going forward AnOldHope Eternalkerri and AlgernonAsimov will begin going through sexist racist and biggoted subs collecting user names and preemptively banning those users before they can participate in this sub and try to sneak in bad history  Artrw will be stepping down as mod at the end of May  Art will be backpacking through Europe this summer and not have access to the internet regularly  This will leave me as the senior moderator on this sub  I know this might be a source of concern for you but I assure you all the other moderators support this and will usher in some major changes in the sub going forward  We will be allowing pictures from rhistoricalrage and Historic LOLshttproflrazzicheezburgercomhistory  People have often complained that we are to serious here so we will begin experimenting with allowing a few meme jokes  This will allow us to not be seen as such a stuffy and unfun sub  We want users to enjoy themselves and feel that these are relative comics and can serve a decent purpose here  Due to complaints from multiple users all dates must be cited in both Gregorian but culturally specific dates  This means all dates involving Muslims must be cited in the Muslim Calender Chinese the Chinese calender Jewish dates in the Jewish calender etc  We do not wish to offend any users culture and are doing this to accommodate them and bridge a cultural divide   Sports questions are exempt from the  year rule  Due to the growing disinterest in academic study of sports we are exempting all sports from the  year rule  This will hopefully increase the academic interest in athletics not only currently but in the study of the pastWe understand the gravity of these changes and understand that they will be contentious that is why they will not be implemented for a week  This will allow the community to adapt to these changes and discuss it amongst themselves  However they will not be subject to being disallowed the moderation team has discussed this heartily in back channels and agree that these changes are for the best for the subThank you and enjoy your Easter  God BlessEDIT  I know some of you are very pissed off about these changes but any impolite dissent will be removedEDIT   I know youre mad but an Inquisition isnt so badhttpwwwyoutubecomwatchvNUMkcBctEc,META Some Changes in Policies and Rules Please read,2425
whitesock,396,786,1biixd,1641,Nah Im just foolinJust in case anybody here didnt realize its a joke the new set of rules posted yesterday by ueternalkerri was an April Fools joke Yes I know us mods do have a sense of humor were just as shocked to hear that as you areSo meme posts and polltype questions are still banned theres no need to use the Hebrew calander when you ask questions about Judaism זה לא שאני בעצמי יודע מה התאריך העברי היום בכל מקרה Greek and Roman sources dont have to be presented in Greek and Latin and theres no actual ban on WW or Hitler related questions so if you see someone ask about Hitler he did nothing wrongSo thats it Keep asking new questions upvoting interesting questions and following the old rules See you all on the next mod post,META Even MORE Changes in Policies and Rules Please read,2427
bitterweasel,399,729,1qfzkg,1625,,I have just been recruited as a Japanese Kamikaze pilot How did I get to where I am and what will my life look like until my mission,2354
apoeticturtle,402,855,19isi7,1578,,Why did Europe become less religious over time and the US didnt xpost from raskreddit,2433
Glorin,215,824,1ov7s3,1572,How did Roman armies deal with soldiers who were out of commission for extended periods of timeI would imagine they had a moderately well structured system of dealing with the injured but I realized I had no idea what it was,You are a Roman solider marching a long distance Your leg breaks for whatever reason what happens,2396
omegasavant,126,465,1l86z3,1562,Wow this blew up fast Thank you everyone,Before the American Civil War did anyone sell slavefree cotton the way organic foods are sold today,2027
Woahbuzhidao,114,564,1owas7,1533,Saw thishttpwwwraviiolivinguspresidents in rdataisbeautiful and saw that there were  living former presidents in  What were the views of the other  on the war And more generally seeing as nowadays we have some former presidents who take a more public role than others what was the norm for former presidents back in the th centuryedit title should probably say the onset of the Civil War,There were  former presidents at the time of the Civil War What were their views on the war and were any of them especially public or conspicuously silent about it,2097
beancounter,183,488,1at0pc,1516,Around the time of Augustus how would you have met your SO Did you date or was it all arranged,What was dating like in ancient Rome,2004
deadletter,141,727,1mazju,1495,With pregnancies  what was the state of abortificants at the time Did people simply drop out of the scene if they got pregnantAlso is our perception of this skewed by the visibility of only a small slice of the community ,The roaring s are portrayed as extreme partying Were they as sexual active as the modern era and if so what happened with the pregnancies Also was this only a visible portion of the population,2222
KdogCrusader,217,566,1i9zdn,1487,I was looking to see if there are any historical accounts that take place in any time period where the leader gave a speech immediately before the battle started to raise moral,Do the speeches we often see before a battle in most literature and visual performances have any historical basis Did the kings and generals leading an army ever give a speech to rally the troops Or is this just a modern romanticism,2053
DBM,307,564,1nzz0t,1452,,Why did civilization originate only  years ago when anatomically modern humans have existed for  years,2016
toritosupremo,592,542,1o3uek,1443,httptheoatmealcomcomicscolumbusdayBasically its an infographic about how wrongly people remembers Columbus as a hero the negative stuff about his life says that they killed native refugees for sport and even fed them to their dogs and a small praise to Bartolomé de las Casas at the end,The Oatmeal just released this post about Christopher Columbus How historically accurate is it,1985
TheDeadSee,200,469,1m3p8n,1405,Im trying to get a sense of the evolution of the city over this half millenia and I figured this might be a fun thought experiment What would still be familiar to our time traveller and what would be strange and new not just in terms of architecture and sights but also in politics religion language and daily life,If you were to take an average citizen of Rome from BC and drop him into the Rome of AD what would surprise him and what would still be familiar,1874
ulfurmagnus,215,489,1i04cu,1391,,If sieges lasted for months what did the attackersdefenders do all day,1880
SystemicMystic,94,514,1bu8rt,1372,,Are the saloon doors in Western movies accurate If so why were they like that,1886
xaplexus,188,494,1ojixz,1372,,Have any elephant bones ever turned up in the Alps where Hannibal lost a few trying to cross into Italy,1866
fapper,367,441,1pl35a,1321,,How popular were War Hammers during the Medieval Period,1762
bigsid,278,455,1cxs9j,1308,It would seem plausible right Theyre just regular horses with long necks kind of I know this question isnt the usual what if hitler didnt,Serious question Is there any recorded data of humans riding giraffes,1763
bigmapblog,184,417,1j15ae,1304,,Is there any historical precedent for a premodern culture constructing elaborate mechanical traps as seen in many films such as Goonies or in various Indiana Jones films that are disarmable by an artifact or by a sequence of actions Where does this common film trope come from,1721
Vexzy,361,553,1muwb9,1307,,Did Neil Armstrong and Buzz Aldrin take suicide pills with them to the moon,1860
AddictedWeasels,176,490,1l44au,1292,,During slavery in the United States did any slaves attempt to flee south to Mexico instead of north to Canadafree states,1782
xitlhooq,122,362,14k1sx,1290,Here are the linksBest Big Community of the Year httpwwwredditcomrtruebestofcommentseccnominationbestbigcommunityccdmMod Team of the Year httpwwwredditcomrtruebestofcommentsennominationmodteamoftheyearccagThe mod team has really helped improve the quality of this subreddit Lately they had to face a whole lot of critics and nonetheless they are constant in their vision and continually defend their choices I think they deserve recognition for it and that this subreddit should be considered as a model for the entire reddit community Show your support and your gratefulness and upvote   Edit  This is great Nearly  hours later rAskHistorians is currently first for Best Big Community of the Year and the mod team is second  But your upvote is still needed  Thanks you are the best ,META TrueBestOf awards rAskHistorians has been nominated for Best Big Community of the Year and the mod team for Mod Team of the Year Show your support and upvote  links inside,1652
FuckinFucktard,360,479,1dp3cb,1283,,How much did slaves in America cost in todays money,1762
Ahuri,626,368,18u20t,1282,Its in the podcast show  Thors Angels at minute He says take and army from AD and put it in AD so  year leap instead of one thousandI know the armies numbers where nothing like they were in the roman era but would the technological advancements not shift the balance for the middleages europe Sorry if this has been asked before I searched and only found Rome vs Hanthreads,Dan Carlin claims that You could take the roman army at its height in history and send it  years forward drop it back in europe  and have it mop the floor with the greatest armies of the early middle ages relatively easily How true can we assume this is ,1650
Ozymandias,262,491,1o51l6,1260,,Why is there this new cult appreciation of Tesla Was he really as amazing as people make him out to be,1751
LiesAboutKnowingYou,266,438,1d0pfy,1259,My parents were born in the s so they had no real feed back on this and told me that it was not acceptable to drink in the workplace when they became professionals So Im curious is the level of drinking and drunkedness portrayed in Mad Men accurate,In the show Mad Men in a professional environment drinking occurs non stop Was it really socially acceptable in the s and s to be buzzed throughout the work day,1697
typedthisnow,179,468,1n0pnc,1258,TRAVELLING obviously sorryI was read the St Germain article on Reddit yesterday and it got me thinking how was he or anybody able to support himself financially whilst travelling in an era before telecommunications This is my first post here I hope this question is worth asking How did they verify status and wealth and so forth,How did wealthy travellers counts and dukes etc access their wealth whilst ravelling abroad,1726
centerde,335,493,1mf18y,1241,Several highly rated comments in this thread seem to be misinformed but I figured I would ask the experts here what urban legends and misinformation redditors are promotinghttpwwwredditcomrAskRedditcommentsmembknowledgableredditorswhataresomerratedfacts,What misinformation is being promoted in the Rrated history AskReddit,1734
subud,283,516,1lbeoa,1225,,what were the nazi plans with japan if they had won the war japanese are pretty far from aryans were there any plans on how to deal with them and other non desirable races around the world if germany won the war,1741
SOSyourself,213,395,1jen7z,1224,Did they just march massive armies on roads and use scouts until they found the enemy I find it confusing to think that thousands of men would just march around til they found the enemy military EDIT Wow I did not expect so many great answers Thank you all for taking your time to answer,How did large armies know where they would find one another in medieval times,1619
Spam,217,424,1dadk7,1209,Another question where did this practice startEdit By where did this practice start I meant the practice of depicting people with next to no body hair except for facial and hair on the head,How come in Renaissance style paintings and even further back with GrecoRoman art all the women who are nude are hairless Was it an attempt to just show purity or did higher class women shave their bodies,1633
BeerCzar,136,581,1of6nh,1200,Sorry if this is juvenile sounding question  I was reading about medieval hygiene and the article talked about chamber pots    I know that at least for nobility womens clothing was so elaborate that they needed help to put in on and off  What I want to know is how would a women use the restroom when they were dressed during the day in giant skirts and petticoats  Did they take some of the clothes off or were they helped by servants in some way Also what did people use instead of toilet paper,How did women historically go bathroom when they wore giant skirts with petticoats,1781
dehen,122,483,1pw0un,1193,It always struck me odd that the ancient Greeks has a whole class of gods that were replaced in their mythology Do the Titans represent some sort of theological shift or conquest Or were both the Titans and Olympians created wholecloth by the GreeksEDIT On my gods  Thanks These are great answers,Were the Titans the gods of a preGreek society that was supplanted,1676
