author,comments,downvotes,id,score,selftext,title,upvotes
wisewhiz,79,102,1cfbyr,315,Im of course asking about packaged presliced bread  Was it immediately accepted as a great invention per the phrase the greatest thing since sliced bread or were people skeptical about it at first,How was sliced bread first received by the general public Was it really considered one of the greatest inventions,417
oEnygmao,111,91,1365ia,313,I have heard this often before  And while I dont doubt that Washington rejected the idea Im curious how accurate the notion that he could have pulled it off is because I have to imagine its somewhat more complicated than the dominant narrative even if that one is most accurate at the end of the day,how accurate is the narrative that Goerge Washington could have become king if he had wanted,404
tigersharkwushen,88,94,1k4mgi,314,The Roman numeral system only seems to go up to the thousands  Do people from two thousands years ago ever have to write numbers in the billions or trillions,Whats the largest number ever found written down in pre CE texts,408
FallingwaterAdmin,51,70,1jf5h6,306,From  architect Frank Lloyd Wright designed and oversaw construction of a modernist home resting above a waterfall in the Laurel Highlands of Pennsylvania He named it Fallingwater and it remains one of Americas most visited and recognizable homes Two members of Fallingwaters senior staff have agreed to answer questions about Frank Lloyd Wright Modernism and preservation of Fallingwater The panel includesScott W Perkins Director of Preservation username FallingwaterPreserv I oversee preservation of Fallingwaters buildings and collections furniture artwork textiles books including the areas of landscape maintenance and museum housekeeping I am trained as a design historian and specialize in the history of interiors I am also a PhD candidate at the Bard Graduate Center currently writing my dissertation on the life and work of artistdesigner Eugene Masselink who also happened to be secretary to Frank Lloyd Wright Clinton Piper Museum Programs Assistant username FallingwaterAdmin I am a preservationist and architectural historian by training  I started working at Fallingwater as a tour guide during summer breaks and later took an administration position in which I work closely with Fallingwaters Director in general museum administration and numerous special projects including copyright and trademark issues the recent adaptive reuse of the Bear Run Barn at Fallingwater and other capital improvement projects  EDIT It looks like weve run out of the time we scheduled for the AMA so unfortunately we wont be able to answer anymore questions Thank you all for your questions and thanks to rAskHistorians for having us,Were experts on Frank Lloyd Wright and architectural Modernism from Fallingwater Ask us anything,376
anumati,257,106,1cg6e0,309,Edit Thank you all for your comments This is a subject I know almost nothing about to the point that I had to ask a really broad question in order to find out what specific questions I ought to be asking This thread has given me a lot to think aboutread up on,When and how did ethnic groups such as Irish and Italians become White,415
molingrad,176,76,16q243,306,I was thinking how GrecoRoman culture is considered to be the foundation for Western Civilization Does the East look to any one culture or heritage as the foundation for their civilization,The Western world considers Ancient Greece and Rome to be the foundation for our civilization Is there anything analogous in the East,382
vertexoflife,34,94,16xm0t,306,,The European conceptions of vapors and bad air eg malaria carrying diseases is wellknown and documented but how did Islamic Asian and other cultures of the era  portray or conceive of diseases and illnesses being carried,400
toiletghost,66,84,1fpw89,304,,In medieval times when people drank alcohol all day how were babies born healthy ie without fetal alcohol syndrome,388
eternalkerri,166,92,18sbnb,307,We are quickly approaching k users  This will make us one of the  largest subreddits on this site  This is going to present a few new challenges for us  Here they are with their answer  Default statusAskhistorians WILL NEVER BECOME A DEFAULT SUB IF WE HAVE ANY SAY SO  I believe the way we put it in moderator discussion was I would rather burn this sub to the ground than let it become a default sub  That was me I said that and everyone agreed  We have already set the system to not allow this sub to become part of the default set  More postersWe recognize that there are more people posting here  Therefore we have a few things in place  Firstly we will be contacting users we have singled out for their quality posting to become moderators  This will bring the team up to about  moderators  This will allow moderators to participate as well as moderate as it will take some of the stress off of them  Additionally we would like to direct you to the Panel threadhttpwwwredditcomrAskHistorianscommentskurwthepanelofhistoriansiv and the Quality Contributor threadhttpwwwredditcomrAskHistorianscommentshjgdmetaflaireduserslistqualitycontributorflair  If you feel that you would like to receive flair or nominate someone for flair feel free to use these links to nominate yourself or othersAdditionally more posters means more users unfamiliar with this subreddits rules and culture  So let me direct you again to OUR RULEShttpwwwredditcomrAskHistorianswikirules as well as our GUIDELINES FOR RULEShttpwwwredditcomrAskHistorianscommentsrgmetasomeremindersandclarificationsabout  Think of them like this the Rules  Constitution Clarification  The Laws  Both are enforceable and will beWe also request that you view the POPULAR QUESTIONShttpwwwredditcomrAskHistorianswikifaq thread before you askNow we need to also make a few of our rules clear to you guys again  These are the important rules   year rule  If it has occurred in the past twenty years it is off limits pending moderator review  NO RACISM SEXISM HOMOPHOBIA OR OTHER BIGOTED BEHAVIORI am so not kidding  Do not think you are being clever we have many historians in this sub who actually specialize in racial sexual or gender history INCLUDING A MOD  We have had more than enough experience in recognizing the behavior  Yes if you come here and post something racist and you are from one of the several racist or other biggoted subreddits we will not only thoroughly thrash your propaganda but we will also ban you  Yes we will read through your posting history to see if you have a history of bigotry  No soapboxing or speechifyingYou hate America  Fine go somewhere else  You a die hard college communist  Great  Go somewhere else  This is not the place to recruit to rabble rouse to instigate  At this point we have plenty of experience spotting that too  You will have your post removed  Copy Pasting ANY SOURCE as your only way of posting is VERBOTEN  People come here to receive quality in depth analysis from historians history students and history buffs  Please assume the OP of the question isnt a complete moron and has googled for the answer  Additionally this is raskhistorians not raskgoogle  Yes you can copy and paste a source and give a summary of that link and source  but simply throwing up a link or a wall of copied text is intellectually lazy and will result in the post being removed  On topic relevant humor only  No memes advice animals reaction gifs or funny videos are allowed  The humor cannot be top tiered comments  Humor is allowed to stray more off topic in meta threads only  Jokes otherwise must be relevant on topic and hopefully funny  I personally hate puns  Topic drift  The original Godwins Law stated that the longer a UseNet conversation went the more likely Hitler was to be brought up  It meant the thread was dead  Here we also avoid topic drift  A logical progression of topics being brought up is allowed but please dont let a thread on th Century agriculture end up about cow tipping Anecdotes are frowned upon  Unless you were there yourself at the event its probably not a strong enough source If you are guessing or you heard from something somewhere some time ago dont bother  We will delete with extreme prejudice Wikipedia is the worst possible source you can use  Its acceptable at times and in a pinch but it really isnt a good source  If you couldnt use it in a paper it probably wont work here Eternalkerri SeptemberIn light of the ever expanding number of users of course there will be cries of Eternal September  The moderation team can only do so much  We need the user base to assist us by flagging violating posts as spam  We also want you to understand we enforce rules here  If you have a problem with the rules address them to the moderation team but Braveheart style speeches do not endear us to your plight neither does calling us faggots after we ban you  The level of our enforcement and strictness of enforcement as well as our patience is directly inverse to the level of chicanery in the sub  The more the rules are violated the more people flagrantly violate them the more people thumb their noses at the mods the more likely we are to increase the intensity and harshness of our moderationThis is your sub we just enforce the rules  If your fellow users cannot police themselves and you are not willing to assist in helping them understand they are violating the rules then we will have to enforce the rules more and more strictly until we suck every bit of fun out of the sub,Metak users Eternal September Rules Moderators and a million other things,399
RemyTaveras,182,70,17uwaf,306,Ive never really understood what historians actually do Who hires you What do you do for them Do you just memorize events and dates No one has ever clarified this for meEDIT Thanks for the feedback everyone This really sheds some light on things,What does a historian do,376
