author,comments,downvotes,id,score,selftext,title,upvotes
spartanau,95,11,1r7up5,13,,Whats something that seemingly everyone does but you find strange or weird,24
monsoonorchid,23,3,1r7ihz,14,Most atheists are thinkers on some level if not on many levels  And when unthinking dogmabreathing people of faith try to convince them of the existence and importance of the divine the arguments those individuals put forth are unlikely to be at all convincing to the atheist they hope to convert  More often than not  theyre just driving more nails into the coffin of the atheists growing conviction that religious people are stupid  I think you know the kind of arguments Im talking aboutBut not all religious people are dullminded superstitious and antiscientific If you are an atheist what are some points a spiritualreligious person could make that might pique your interest or gain them your respectIf you are a believer what are some intelligentuniversal points you like to make when discussing the matter with people who do not share your convictions     ,What are some spiritual arguments that appeal to atheists,17
JacobButterStick,46,15,1r6yzh,12,,What will be Reddits demise,27
sillycaramel,23,0,1r6y99,14,No matter the source whats the best headline youve come across,What is the best headline funny or serious that you have ever read,14
EspressoMagic,91,7,1r6umy,14,,What is your favorite video game soundtrack,21
dehrmann,97,14,1r6ml7,12,,What brands do you judge people for wearingusing,26
GoDucks,28,6,1r5utc,15,,What is the worst disgusting funny dangerously stupid etc thing youve ever done on a dare,21
ThatKidYouKnew,61,21,1r508h,13,What store What were they purchasing,Cahsiers of Reddit what is the most you have ever seen someone spend in one transaction,34
scarletsaint,61,9,1r4suv,14,,Those who were bullied What would you say to your bullybullies right now if you could speak to them,23
greenkoala,12,1,1r4ddq,15, ,Redditors who work drivethru windows fast food banks etc whats the strangest thing youve seen in someones vehicle,16
ObtuseRightTriangle,43,3,1r451g,15,Only ,If you could become the best at one skill what would it be,18
BAHMonkeyman,43,6,1r3w06,14,,What sentencelong quote will make me rethink my life,20
astit,80,8,1r3jsz,15,Who is the biggest jerk  Who was the nicest  Any other thoughts,Who is the most famous person youve ever met and how was your interaction with them,23
selfishcoffeebean,25,22,1r33d3,14,I find it fascinating that someone can go from not believing in a higher power to having complete faith in one  Can you explain what it feels like to believe  Was there a major life changing event or did you want to fill an emptinessSpecific religion doesnt matter but it would be interesting if youd write which one you chose ,SERIOUS Former nonbelievers how did you find religion,36
kvnmahan,107,14,1r25hi,14,,The the chronically late redditors why are you always late,28
smitty,64,2,1r131g,15,Just looking for some ideas to brighten random peoples days ,Hey Reddit What are some simple awesome things I can do for random others to make their day,17
ABlackwelly,57,6,1r0p6c,15, ,What are the the most significant words in human history,21
slyg,9,3,1r0nlx,14,Im particularly interested in people who got reasonably far or got some tv time in talent shows But im not sure how many people on reddit from this type of show so i kept it broad So here are some of the things im interested inDid the show help your career Do you have any interesting stories related to being on the showDid you get many people recognizing you from the showIf you won some money what did you spend it on,Ex tv show contestants what was it like after you left the show Serious,17
MickeyRooneyy,112,17,1qzhhq,13,,What is a small opinion you have that no matter what anyone on reddit says youll never change,30
PallandoTheBlue,75,8,1qz8dc,16,,What were you known for when you were in school,24
YetiGuy,235,9,1qz88o,16,You know everytime you hear somebody pronounce a word you wonder why it is pronounced that way ,What pronunciation annoysbaffles you,25
Greenmaxn,64,9,1qypwy,12,,What is something you took for granted as a childteenager but now think is highly valuable as an adult,21
marvinnohomo,53,4,1qyayk,14,EDIT If you guys could post a youtube link with your post thatd be for the best,If you could choose what song you hear when you die what song would it be,18
ACForLife,23,5,1qy23y,12,,Reddit what was you biggest what have I done moment serious,17
mxo,52,4,1qxy52,13,,Whats the dumbest thing someones ever gotten mad at you for,17
fredburma,34,4,1qxb92,15,I love it when everything clicks at the last minute and the final piece of the jigsaw slots into place so perfectly but you have to invest a lot of time into these things and you often end up being disappointed  So really this is a cheat sheet where should I go for my plot twist fix,Whats the most satisfying plot twist youve ever seenheardread,19
mooreseen,40,8,1qwhwx,16,For example original comment is I dont like the color red And people respond trying to sway your opinion ,What is an opinion you have that you want debated,24
LightOfVictory,19,4,1qwd5d,14,Those pictures or GIFs that keep you up all night change your views forever Stuff like that,Reddit what picture or GIF brings fear to your heart,18
BRICG,14,9,1qv4ck,13,,how do you know if youre thinking too far ahead in a relationship,22
Magickoolaid,73,9,1quvdh,14,,Which fictional character would you mostly likely want to have give an AMA,23
basicshow,69,6,1quv8d,16,,When you were a kid what did you want to be when you grow up,22
fanggoria,70,7,1qurde,13,,What is the most tragic way someone you knew died,20
fourboobs,130,28,1qua1t,14,,Your username is now a cocktail How do you make it,42
butterflypn,178,18,1qu696,15,Dont downvote people because they put up a belief that might offend you Im trying to get some interesting answers and I dont want any rSRS butthurt downvoting,Selfproclaimed nonracists of Reddit what is a view you hold that might be considered racist,33
LordOfAllGays,38,13,1qu116,14,,What racial stereotypes does your country have that American wouldnt know,27
Nicopm,48,13,1qt55c,13,,What is something that is taboo but shouldnt be,26
captainzoobydooby,95,8,1qsz5p,15,,What is the worst possible pain you could ever imagine experiencing,23
syntheticidols,91,10,1qs0c4,15,,Whats your party drink,25
SheZowRaisedByWolves,51,8,1qrexc,13,Im talking about questions like what if your skin was replaced with snapple What if avocados exploded with a football field radius when peeled What if you could shit happiness,What is your best what if question,21
Deathproofer,28,6,1qrehb,14,,How would you hold up in jail,20
Jefflello,50,9,1qqyfl,15,Maybe its the anonymity but Ive noticed people are absolutely brutal in their comments here Racial slursobscene insults rude remarks Is everyone just an asshole on this site or what,Why is everyone so mean on reddit,24
remotectrl,51,6,1qqkg5,14,,Assuming it was ethical and sustainable which animal would you most like to eat,20
Sirusavath,90,4,1r8ubg,24,,What is a sound in a video game that youve grown to hate,28
giraffaclops,62,2,1r8u92,17,,What is something you have to buy but you absolutely hate to,19
megadodgerfan,41,2,1r8p7p,18,,What are the best music videos you know of,20
JeremyTheMVP,104,6,1r86v8,14,,MoviesTV that scared you as a child,20
therealraybeam,79,11,1r7k48,12,,How did you discover reddit,23
calym,38,1,1r7dvy,14,,What book have you read that changed you,15
EmilyamI,50,9,1r7d63,14,The obvious response here being touch his penis but what are some specifics that you enjoy that you think might elude women or that you wish more ladies would do in bed that contrast some of the ridiculous Cosmo suggestions,Men of Reddit If You Wrote A How to Make Your Man Go Crazy In Bed Article for Cosmo What Tips Would You Include,23
MissLexxxi,106,7,1r7cjx,12,,What late night snack are you craving,19
DarklyGlass,56,2,1r7bps,14,I mean what points of view will get systematically downvoted and therefore less likely to get exposure,What opinionspoints of view are forbidden on Reddit,16
YOUWENTFAR,99,11,1r79jz,14,,Growing up what did you believe about the opposite sexs anatomy that turned out to be extremely wrong NSFW,25
souperglen,67,17,1r4xiq,12,,What are some taboos in your country,29
ChinaCatSunfIower,29,1,1r3yiq,13,,What is the grossest thing that has ever entered your body,14
LoveForChrist,42,5,1r3sy0,12,Im thinking about how people on my campus work themselves up easily over just about everything and Im wondering if I were to hold up a sign on campus with a literal scientific fact what fact would make the most people angrythink I was a terrible person,What scientific fact do you believe people would find most upsetting,17
overexposedrebel,35,32,1r3ete,13,,Men who have had your significant other give birth Honestly are you as attracted to your partner now as you were before she had kids,45
filosophikal,41,5,1r21hc,13,,If you were allowed to pass one law that everyone would have to obey what would it be,18
phattykins,34,3,1r1v69,12,,If you were allowed to create a public holiday what would you celebrate or commemorate,15
shibalover,31,3,1r1lp5,13,,Whats the most innocent thing youve seen go wrong,16
zoobyshoe,127,2,1r1ld2,14,Havent seen a show as addicting as Breaking Bad in a while and I want o pick up another series to watch Been recommended theseAmerican Horror StorySix Feet UnderHomelandThe WireScandal,Just finished Breaking Bad Any other engaging series I should watch,16
TheRealDropBear,19,10,1r1kda,13,,Porn Stars of Reddit How has your career affected your sex life NSFW,23
ONYXROC,23,2,1r1jpz,13,,What is the most awkward situation youve awaken in after a night of getting wasted,15
EmersonikMusic,41,7,1r1gmg,13,,What is your favourite obscure quote,20
atomicrectum,62,4,1r1bmo,14,,Whats something you wish you were exceptional at but currently suck,18
LordVectron,46,6,1qzup8,12,There are a lot of comedy and parody musicians out there Tim Minchin Flight of the Conchords Tripod Axis of Awesome to name a few Some of their songs are just silly some are silly and amazing to listen to at the same time I wanna talk about those ones ,What are the most musically impressive comedy songs,18
Meatsause,9,3,1qzcpq,12,For someone who has social anxiety,Where are the best places to meet people socially,15
SaidNil,62,7,1qyokd,11,If youve decided that one or more of those things are not for you why Please be respectful of the opinions of others,What is your personal reason for abstaining from sexdrugsalcohol Serious,18
apple,40,6,1qyjur,12,, of the population is dead what is the first thing you do,18
echtav,35,3,1qyffv,12,Could be nostalgic or tragic Go,What do you miss most about your childhood,15
Blahty,54,14,1qydg1,12,,Males of reddit What do you do while you are receiving a blowjob NSFW,26
deadball,64,7,1qyc2z,11,,What did you decide to study in college and why did you choose it,18
RLWSNOOK,44,3,1qyaho,14,,How do you get rid of a hangover,17
Mithost,34,2,1qy5sn,13,,Hey Redditors what was the WORST Christmas gift you have ever received,15
qwerb,30,2,1qvut4,13,,What makes you happy Reddit,15
pattyperk,10,4,1qvq1m,12,As a twin I know there are a shitload of things that people believe but are simply not true Help me relate,Twins of reddit what are some major misconceptions about being a twin,16
IchabongCrane,66,3,1qvpz0,13,,Tell me about you Reddit If you had to describe yourself in one word what would it be and why,16
atumbleweed,73,5,1qvkpu,13,,What was your last text,18
fuaA,29,8,1qv9w2,12,,What is a quick and easy meal that everyone should know how to make,20
thepkmncenter,24,1,1qv9to,12,,What is one topic that you embarrassingly know very little about,13
BiscuitBrown,87,9,1quzhc,13,,Reddit how do you get to sleep,22
ntb,62,8,1quxsm,13,,What sound do you just hate with all you have,21
actuallyno,33,11,1quwf8,14,,Married people of Reddit how did you meet your significant other,25
AriesAviator,40,3,1qutjg,13,,Computer techs of reddit what are some simple tricks to help keep your computers running smoothly,16
mufromdeneb,69,5,1qur3g,14,,Reddit what is both your gift and your curse,19
WolfFather,26,9,1queoy,13,As a university student applying to internships and jobs I would love some advice ,Hey reddit how do I write a stellar resume,22
cookiesmasher,48,5,1qub81,12,,What simple thing fascinates you,17
coconutelectron,78,10,1qu11m,12,Good experiences would help us live vicariously through you bad experiences would help us feel less envious,Tall Redditors Whats an experience you can share so we short people know what its like to walk in your large shoes,22
kabukistar,20,5,1qt5lw,15,And not just things that are considered abhorrent by small bitter sectors of society like homosexuality  But something that almost everyone agrees is wrong,Reddit whats one thing thats considered morally abhorrent now that will be considered totally normal in the future,20
thecuriousduck,16,6,1qsypt,13,,Is it weird to like to help people but when its you that needs help do you have problems accepting it or asking for it  Is it your pride or just plain shyness ,19
mpghjacket,47,15,1qss7c,13,For scienceof course,How did you ask your significant other out,28
wintonhowzer,37,11,1qsr2m,11,Things like number of highfives given or cats petted ,If after you die you get to see a stat sheet of your life which five stats would you want to see,22
nickharl,62,2,1r8shi,19,,Whats a method or technology that seems incredibly dated but that we still currently use,21
JackedDown,15,6,1r7mgl,12,I only ask because me and my father have a very distant relationship Ive asked all that I can from him but it hasnt really struck a nerve yet I really want to open conversation with him beyond us beind drunk and shooting the shit He and my mother seperated when I was young and even though sharing some beers has given me some answers I still feel like I want to know him more So reddit I come to you Single fathers divorced fathers step fathers father in laws anything what do you think a son should ask you,Fathers of reddit what question do you wish your son would ask you but he hasnt yet,18
ffrancescah,30,4,1r7f39,13,And has your experience helped you help others,Everyones been bullied at some point whats your story,17
MrRansom,43,5,1r7c3e,12,,What is one thing in your life that youve lost and wish you could have back,17
megalojake,35,4,1r6s77,12,What are some phrases that people say in a bunch of movies but just do not workhave any affect IRL,What phrase works in movies but doesnt work in real life,16
DerHammer,61,8,1r6pnz,13,Be it horrible or hilarious whats your bathroom incidentEdit Possibly NSFW,Reddit whats your bathroom incident,21
NamenRoodles,92,31,1r6pkp,11,,Reddit whos one celebrity that you know for a fact is gay but hasnt come out of the closet yet,42
Coolspot,74,13,1r68t0,12,,What should you never say to the opposite sex,25
DaBahoo,86,15,1r6482,14,,What has been the most frustrating worst experience you have had on reddit,29
ColligeRosas,58,5,1r63wq,12,,Which TV show has opening credits that never get old Which shows credits do you always skip,17
ZatarainsFood,104,17,1r60gu,11,,Youre on your deathbed and can only say  words before passing What are they,28
StillLifeWithDog,7,4,1r5tqf,12,,Seniors of Reddit Tomorrow is the th anniversary of John F Kennedys assassination Where were you and what were you doing when you heard that President Kennedy had just been shot and killed How did you and those around you respond,16
Lolliee,67,4,1r4rnx,14,And makes you want to shake your booty,What song puts you in a super happy mood,18
cuckoo,48,9,1r4qln,14,,Whats your tip of making conversation with people,23
chickensaurus,41,8,1r4k71,11,Since we are just about to see the th anniversary of a tragic event that changed the course of this country  I would probably have to choose JFKs file  I think it may contain information that could possibly help the future of America,If you could see one classified government filedocument and keep a copy what would it be and why,19
ChannelSERFER,87,2,1r4fik,12,,If you could summarize your morning routine in three words what would they be,14
otpyo,35,2,1r46jy,12,,What types of foodsdrinks should you never combine together,14
BlakeIsBlake,54,9,1r45l9,11,,Whats a phrase that you could say today that would make no sense fifty years ago,20
jazir,7,1,1r415j,11,There was a story just today about the twin prime conjecture which made me ask what use is there for extremely large primes especially prime pairs,What use is there for extremely large prime numbers,12
colorinpink,28,3,1r407t,11,,What is the best advice that a teacher has given you,14
thenewleader,27,4,1r3u1w,11,,Pizza deliverers of reddit whats the weirdest thing thats happened to you while delivering pizza,15
DrFire,28,2,1r3oa7,10,,What is the biggest regret youve ever made regarding money,12
AnotherDrunkCanadian,131,6,1r37mb,12,,Whats the worst name youve ever heard,18
morlokispecs,17,2,1r1j2m,12,Never knew how it felt like I wish I can try it once,Whats the worst sleep paralysis you have ever experienced,14
BenKovy,17,1,1r1bul,13,,What is the ballsiest thing you have ever said to your parents boss etc and do you wish you could take it back,14
logs,3,3,1r0uf2,12,,Teachers of Reddit what is the one horrible situation you have seen your students in but been unable to help,15
nessabessa,79,4,1r0tlw,12,,Reddit What is the worst pain you have ever felt,16
MollyEvelyn,46,10,1qzsvm,11,,What are the three best Christmas movies and why,21
vandamage,41,5,1qze0r,12,,Are you unhappy with your job and if you are what kind of job do you do,17
teenpirit,78,16,1qzbre,10,,What movie title best describes your sex life,26
ProSchmo,62,3,1qzbbz,13,,What is the funniest stupid joke you know,16
mitchellalbertz,177,14,1qzage,11,,Serious Whats your ACTUAL unpopular opinion,25
PandaDerZwote,108,9,1qyuyu,12,Or in other ways not viable to have And what do you say if there are discussions about that very topic,What are some opinions you have that you could never mention to others because they are viewed as backwards,21
laurenisahokie,76,9,1qyl7o,11,,Why do you or why do you not believe in an afterlife,20
Steininger,40,2,1qy607,12,,What is a little known television show that is a must watch,14
SillyPickle,60,11,1qy3e8,11,,Whats the most useless skill that youre remarkably good at,22
hawthandle,30,5,1qxwy2,11,,What are your worst roommate stories,16
Chickenwang,37,1,1qxuqz,14,,What is an insecurity of yours and how do you deal with it,15
ImCelestial,69,10,1qxqg8,13,,What is the weirdest thing you have used to pleasure yourself,23
shma,20,10,1qx0jd,11,For example taking the time to come in and fill out the application right there instead of calling on the phone and asking if the store is hiring firm handshake community service etc ,Employers of Reddit what do you admire in an applicant that usually leads to them getting the job,21
SamuraiRoNiN,57,8,1qww2l,12,Kind of like how Dexter takes a little bit of blood from a cut,Dear Reddit if you were a serial killer what trophy would you take from your victims,20
TheRGood,80,7,1qwugy,14,,What is something that no matter how much it is explained you will never understand,21
vanheltsing,69,7,1qw84t,12,Maybe nsfw,What is your biggest achievement that isnt something you can brag about,19
thesquabroll,40,7,1qvgqa,14,,Extroverts who were introverts what happened,21
IgnoranceReductase,18,2,1qv6dy,11,,Hi Reddit what awkward moment have you had that still haunts you to this day,13
NomFRENCHTOAST,41,2,1qum23,11,,What do you just not understand,13
NeonFights,13,7,1qugpt,10,,Game show contestants of Reddit what show were you on and what was your experience like,17
thespacesinbetween,174,19,1qtjh1,12,Is there anything about England Britain or the UK that you do not understand or get such as words lifestyles or attitude,American Redditors what strikes you as odd about the UKBritain What do you not understand,31
AlexOrozcoo,58,5,1qtdlb,12,Im scared of rippingtearing my frenulum I heard it makes a pop sound when it does,What type of things do you fear happening during sex,17
kdwhodat,24,5,1qsyj0,12,,What malicious advice have you given that was actually followed,17
jrgallag,88,5,1qswjl,13,,What is the best RPG video game of all time,18
meganlizzie,58,6,1qsmb3,11,,Reddit whats the most expensive item you own,17
Wingull,44,8,1qr87p,12,,What were some of your fictional character crushes,20
Dodendans,48,8,1qr6fu,13,Do you have a recurring superpower in your dreams Im not talking about  your Dream Superpower but rather the one that is most prominent,What Superpower do you most often dream you have,21
Iamzecomicgal,12,1,1qqzjf,11,title speaks for itself I cant think of one right nowRedditors I leave it to you,What habits have you instinctively picked up over the years that makes everyday life easier that might be helpful to others,12
isyourself,22,3,1qqq3a,14,,Who is a not commonly known person who really influenced history,17
lacesoutdannnnn,24,33,1qqaxe,9,I havent,Have any of you had sexual relations with a wellknown pornstar before they were famous,42
disproportion,50,6,1r8t2y,16,Im a small person And it seems that no matter how slowly I pace myself I always end up with the spins puking and a hangover the next day Its a buzzkill no pun intended Any tips,How do you avoid hangoversgetting sick after a night of drinking,22
Coverthestory,36,5,1r8flw,11,,Serious When youre sad what do you do to cheer yourself up,16
InMortsJewCave,19,6,1r8f9v,11,Anything that has made you or someone else go What the hell is that It can be anything from a sexual tragedy or just a horrifying moment,People of Reddit what is your best Oh my God what the hell is that story,17
thedmob,57,7,1r8e4u,11,,What is the funniest movie you have ever seen,18
asimpleguy,73,14,1r7ocw,10,,Reddit what is one thing that consistently blows your mind if you think about it even for a second,24
FapstronautOC,11,5,1r6z6m,11,,SelfMade Millionaires of Reddit what is the one thing you know now that you wish you knew when you were starting out,16
nehalwa,41,9,1r6wmm,10,,What are your favourite lyrics from a song and why,19
altuslamia,22,5,1r6uli,11,,Whats the best White Elephant gift youve ever given or received,16
booness,51,5,1r6rff,12,I joined Reddit to ask this question For me I have a constant runny nose out of one nostril only my right one One doctor told me it was a common allergy problem and prescribed a nasal spray that didnt really help Another told me it could be a fungal infection and wanted to pass a scope up my nose which she warned would be painful I didnt do it At this point I just deal with it but its really annoying because I have to carry tissues with me at all times,What is something you live with that is not lifethreatening but really annoying,17
TownIdiot,30,5,1r5x7d,11,Yes Another one of these questions,What is the creepiest andor least successful yet funniest pickup lines you know Boy or Girl,16
chochkem,53,6,1r5p8b,11,,If you could change one thing about the time you lost your virginity what would it be,17
mrsobby,54,10,1r5g5r,11,,Reddit what angers you most about the world of today,21
DragonStriker,43,6,1r4x7d,12,Especially when theres no internet And theoretically all your battery powered gadgets are low on power,What do you guys do to pass the time during a power outage,18
sjsharkgirl,68,2,1r4hu6,12,,What is your favorite quote from a TV show,14
jw,43,9,1r4gu5,10,Mine always seem to revolve around disconnecting my mind from the situation just wondered if this was pretty standard and if not what else do you do,Males of reddit what tricks do you employ to help you last longer in bed NSFW,19
jessk,85,9,1r34m9,13,Two words to guide your past self ,If you could write a note to your younger self what would you say in only two words,22
thewrongpath,43,6,1r30wy,12,Edit I want an example of a good guy company not the definition,What is a good guy big company,18
norrischrism,77,4,1r2ndr,13,,What is your Nobody believes me when I tell them Moment,17
LethalJizzle,39,10,1r2ffo,11,GO,What ridiculously untrue fact can you make up on the spot that sounds convincing,21
ThePuddingRifle,19,6,1r1xsb,12,Met a customer who divorce his wife and remarried again when they met a few years later ,Couples who divorced and remarried again Whats your story,18
WIENERPOOP,19,15,1r1x2u,10,I work with a couple of autistic patients and I want to better understand their struggle,Autistics of Reddit can you help me understand autism,25
bidnessdeals,24,4,1r1tgk,13,Crashes highway ghosts a cow driving a bike etc Whos got the best,Reddit whats your craziest driving experience,17
jivins,23,4,1r1ovs,11,,If you were given  lives and had to use all but one what are some of the top ways you would choose to go out,15
SolidSilk,46,4,1r1cnh,13,,What would be your most mediocre superpower,17
ksuit,48,2,1r16py,11,,Serious Whats your age gender and what about you physically are you most self conscious about,13
Relic,40,5,1r0kar,11,,Out of anyone in the world who do you think should run the planet,16
XavsEatFerns,19,7,1r00h7,13,,What is the saddest story a stranger has told you,20
Ismellawesome,68,11,1r00d1,11,,Whats the worst concert youve ever been to,22
GramatiklyCorrekt,63,6,1qzlxh,11,,Do you have any quirks or irrational things you feel you just HAVE to do,17
Grabsy,17,5,1qyz09,10,Thank for all your replies guys ,What was the post that made you fall in love with reddit,15
CuriouslyBaked,23,2,1qxwey,12,,If you could take any fictional film and make it a part of real world history what would it be,14
Music,60,2,1qxvy9,11,,What food do you REFUSE to eat without condiments,13
opheliadernt,52,4,1qxv1s,12,,What Television commercial do you hate the most,16
Czechmate,79,11,1qxetv,11,Like hawking loogies or something,Redditors What is the least attractive nonsexual thing a person can do,22
