author,comments,downvotes,id,score,selftext,title,upvotes
lordt,22,26,1qus40,41,I just saw a video of a wedding where the bride threatened to cry if the photographer didnt leave her alone This made me wonder what is the most dramatic wedding youve ever attended ,Wedding photographers of reddit what is the biggest wedding drama youve ever witnessed,67
StateSt,115,14,1qzzkh,42,,Question for retail workers What is one thing that us shoppers can do during the holiday season to make your day better,56
aaaahhh,52,16,1qqk82,42,,What was the exact moment when you realised you were in love for the first time,58
JumboSmooth,207,17,1qzf93,39,,What was your most expensive meal and was it worth the money,56
ThincNgKap,247,39,1qz205,42,,Whats on your Bucket List How attainable is your list Whats currently stopping you from doing what you want to do Can you help a fellow redditor achieve their dreams,81
schmoker,276,49,1qxlqr,39,,NSFW Where did you lose your virginity,88
basicshow,286,28,1qsjdv,40,,What is the worst name to choose for your child Why,68
thepraff,177,25,1r8mg4,73,For instance if it rained cats and dogs infrastructure would crumble ,Which idiom if taken literally would cost the most damage to humanity,98
swaginabag,149,45,1r3j2r,37,,What are your favorite pointless websites,82
techie,219,33,1qysfk,35,,If you could have an extra body part what would it be and why,68
loveiscloser,66,30,1qu7y4,38,,Deaf people of Reddit  whats the sound you wish you could hear the most,68
charlotts,195,27,1r5dr6,39,,What is the worst advice you were ever given,66
babystripper,148,28,1r44bb,40,,What is the weirdest thing that has ruined your date,68
DrDarling,181,30,1qv7r6,34,,What is the one thing you wish to hear from your ex,64
TyrRev,132,17,1r0v0i,36,Inspired by this comichttpwwwqwantzcomindexphpcomic and this bookhttpwwwbarnesandnoblecomwmachineofdeathryannorthcmmmcgoogleplabooktoqampcmmmcaplaampeanampisbnampr and this bookhttpwwwbarnesandnoblecomwthisishowyoudieryannorthean,There is a machine that tells you how you are going to die  but cryptically What would be the worst prediction to get,53
macflys,93,43,1qwxmo,36,I look around and see beautiful women somedays and occasionally a girl will look a certain way that I want to compliment how well she looks What is the best way for a male to do this without you assuming I want to get in your pants,Women of Reddit What is the best way to compliment you on your appearance without it coming off as being hit on,79
InfiniteAmbiguity,184,21,1qwoq9,36,A few years ago NPR had a national competition with this question  If I recall correctly the winning entries were  Bachelor party youtube video wedding canceled    For sale  baby clothes  never worn  So how would you describe your life in  or fewer words,How would you describe your life in  words or less,57
Ihopenoseethis,200,25,1qwhs3,41,,If you can have one TV dad be your dad who would you choose,66
IPlei,122,10,1qv2w4,37,,Whats the unhealthiest thing youve consumed this week,47
oscarjrs,190,14,1r7v3q,39,In other words a celebrity who is practically impossible to hate,Which celebrity dead or alive has the highest ratio of fans to haters,53
googe,163,17,1r6lns,37,,If everyone had to wear a shirt stating  facts you should know before meeting them what would your shirt say,54
wheelchairpilot,209,48,1r3xap,33,,Whats the worst experience youve had during sex NSFW,81
keeganlol,296,16,1qx80p,33,,What is your most extreme political view,49
btcowlishaw,10,16,1qt24e,37,Do you still or did you ever believe in their innocence ,Parents whose kids ended up being serious criminalsfelons how do you cope,53
essteeeeveeeeen,166,19,1r8j6m,44,,What do you feel bad about doing all the time but not bad enough to stop doing it,63
pacificcoasthighway,159,14,1r8ag9,45,,Whats the best thing youve said to a celebrity youve met,59
donnielehmkuhl,248,13,1r18gk,35,,What simple action or thing turns you off completely ,48
Pync,123,18,1qsuvd,34,Or may have had in the past I need some new time killers,Reddit what is the most entertaining game you have on your phone,52
MarkNutt,101,26,1qr4iy,33,,What is the most damage you have done to your body without realising,59
c,269,24,1r7oko,35,,Which country would you like to live in the most and why,59
sharksnax,101,23,1r5kej,34,,Whats the most bizarre thing to ever happen to you,57
dfoolio,110,15,1r387m,33,People who suffer from depression in your own words what does it feel like,People who suffer from depression in your own words what does it feel like,48
NamenRoodles,436,34,1r0slr,34,,In  words or less can you explain your first sexual encounter,68
QuotableIowa,4,14,1r0rsd,36,, operators of Reddit whats the most haunting call youve ever answered,50
GodRaine,15,18,1qv9s8,36,This hasnt happened to me but Ive always wondered if its ever happened to anyone else Usually a rejection to a proposal of marriage is final  meaning that not only is the person saying they wont marry you but implicitly the relationship is over  right in that moment Has anyone ever decided mutually obviously that it wouldnt be over yet either because one person wants more time or for another reason,Reddit have you ever continued dating a person that said no to your proposal of marriage What happened,54
Tigolovesbacon,126,21,1qsq0u,38,Protips advise on how to behave what to look out for while Im still young things I shouldnt fuck up or just a lovely story about your teenage years anything is appropriated Reddit showed me anything is possible and I have no idea where my life is going Maybe Im just getting a little paranoid hahaEDIT I knew I shouldnt have made this thread before going to sleep  in the morning already Ill check back in a few hoursEDIT EDIT Damn Thanks guys I couldnt have wished for better advise Ill try to do all of this,Any tips for a teen on how to become successful in life,59
corneliuswjohnson,51,11,1r3y5i,35,,Teachers how would you fix education,46
FutureAlcoholic,129,30,1r35ua,34,Most commercials just annoy people Fortunately theres a rare bird that comes along every once in a while and is absolutely wonderful Lets see em,What is your alltime favorite commercial,64
guessmyagenda,139,24,1r1yn2,32,,What would happen if everybody in the world was like you,56
Jabberminor,138,18,1r1v21,32,,What is one nonharmful habit youre trying to get out of,50
ItsTeaTimeBro,32,11,1r10rl,33,Paramedics of Reddit whats the most horrific thing youve encountered on the job,Paramedics of Reddit whats the most horrific thing youve encountered on the job,44
BigSackMoneyBag,98,14,1r1004,34,,Redditors that have shit themselves Whyhowwhere did it happen,48
JMANTAM,135,14,1qxzfs,30,,What would be the most terrifying thing if it became invisible,44
squidavenger,81,24,1qx6sb,33,So basically a quote that sounds good but doesnt make sense,Whats the most inspirational but nonsensical quote you can think up,57
VirulentWalrus,39,23,1qreyb,29,,What would you do to your favorite adult film R to turn it into a childrens movie while keeping the plot relatively close to what it is now,52
Gameface,132,14,1r3scl,34,,If you could give advice to the next person that dates one of your exes what would you tell them,48
batgirl,151,10,1qxr99,33,Specifically experiences during your high that freaked you out etc,Reddit what was your most uncomfortable drug experience NSFW,43
Agooddayforabaddeal,84,19,1qvgsz,34,,Reddit what movies will make you feel better about life,53
juliasbs,140,27,1qt3pj,28,,Men of reddit what is a scent that really turns you on,55
KnightSniper,61,22,1qstlr,33,It can be appropriate or not just list some good onesI E Bought the Farm for Diedand Beat the Bishop for masturbate,What is your favorite Euphemism NSFW,55
jumbycoke,104,19,1qssq7,34,Secrets behaviors things people,What do you keep from your SO,53
startingagainn,60,21,1qsdus,31,Im a veteran out of school for over  years going back in January  In high school I didnt care or try so now I have no idea what to do I literally have no idea what to expectany advice would be helpful  Study tips what towhat not to buy what to expect in the classes how older people get treated how to takes notes on a lecture how to organize a binderIm so scared Im going to mess this up I have two kids and theyre relying on me to be successful  Any advice helpsThanks,What do I need to do to be a successful student,52
PillDickles,250,18,1qrqzl,34,,What are you genetically cursed with,52
JBSchwab,48,12,1qroek,34,,Reddit what is your bad trip story,46
Simbrian,100,21,1r6fq5,30,,What single book if sent back one thousand years in time would have the greatest effect on the world,51
VerukoA,150,16,1r5nug,31,To clarify a name recognized by the general public not just casually mentioned in a textbook,Is there anyone who is alive today that will be remembered in  years,47
Urisk,37,19,1qs2gs,32,,What is the best way to handle parents that wont discipline their children in public when avoiding or ignoring them is impossible,51
ryanrows,104,15,1qqjd7,30,Lets assume you arent a protagonist but a regular person,What is the worst fictional book video game movie etc universe to live in,45
SteamApunk,63,15,1r5u12,32,,Does Reddit have any cool Hitchhiking stories,47
redread,216,44,1r509q,33,We can all hug it out after,Whats a scene from a movie or a tv show that never fails to make you tear up,77
deleted,200,10,1r1r4b,30,,What are some common misconceptions about your job,40
mrbojangos,183,27,1r4epa,25,Combine  words and make a terrible thing Edit no answer in post,What is the grossest  word combo,52
canadianclub,177,12,1r47j1,33,,Whats your never again drink,45
bigups,76,22,1r4264,27,,If countries had official video games like they have official birds and what not what would each countries official game be,49
ToMockAKillingBird,162,10,1r2n4c,30,,Whats something that your hometownregioncountry is known for that you really REALLY wish it wasnt,40
linzphun,8,6,1r12mh,28,,Craigslist Missed Connections users of Reddit have you ever succeeded in connecting with someone What happened,34
jezcrossland,104,10,1r0rw2,28,,What was the worst job in history,38
OcelotWolf,145,11,1qwmu4,29,,What situations make you feel very uncomfortable,40
skeezybeezy,241,37,1qufn1,31,,Reddit whats your favorite smell,68
Idonttkknow,49,9,1qsr50,33,Any philosophical redditors out there,Who is your favorite philosopher and what do you consider their most inspiring quote,42
Lepetitebunnie,29,13,1qsip5,33,Im about to start interviewing for jobs and I figured this could help some other people out as well Plus chance for good stories ,Hiring managers of Reddit what did the last person you interviewed say that made you decide to hire or not hire them,46
ZabCos,118,32,1r53ao,27,,Whats your best fake quote from someone,59
miurace,162,8,1r18et,28,Is there a reason for it Past experiences,What is your greatest fear,36
pfootie,89,23,1qrr89,32,People are so divided on the topic of nuclear energy What is your position on nuclear energy and why do you feel that way,People of Reddit what is your position on nuclear energy,55
SirHenry,38,20,1qr5nk,32,Were all so good and tolerant towards gay people how about transsexuals Also what happened to the serious tag I loved some of the more popular tagged conversations but seems that people stopped upvoting them,Serious What kind of prejudices do transsexual people face today,52
allymacster,96,10,1r88em,34,,Retail workers of Reddit what is the most pathetic complaint you have ever heard from a customer,44
ChairmanMeowza,76,2,1r79jf,29,,reddit what mistake do you keep making,31
adriannamanda,99,26,1r52ei,26,,Whats your favorite Disney movie and character,52
myrugwasstolen,51,34,1r4204,25,,What shower argument did you win in your head today,59
thatoneguyoverthere,123,12,1r1ztj,26,,What smell takes you back to your childhood,38
ModernDayRevolution,50,6,1qybq1,26,,What are the unwritten rules for dating Serious,32
Reperalib,93,12,1qxh9z,25,,If aliens ever were to visit us what would be the hardest to explain to them,37
neilfeeney,89,17,1qvfsh,27,Its starting to become a bit generic isnt it Survivors band together have power issues look out for raiders try to find food etc How would you change up the genre to make it a bit less cliché and shake things up a bit ,Hey Reddit how would you change up the zombie genre,44
sugarwaterpurple,171,23,1qrd83,25,,What do you hear right now,48
otherwiser,157,17,1qqusq,28,,What is one thing all your friends love but you are just not into whatsoever,45
veridiantrees,96,15,1r7dhj,27,We all have things that we need to let go of but have nobody to fall back on Ill try to help as best I can,What have you been dying to tell someone,42
ThisIsGabe,185,17,1r4blt,26,,What foreign luxury do you most wish you could have in your own country,43
kpressley,99,11,1r2773,27,,Serious What is something you do to lift your spirits when youre down in the dumps,38
bowlnspoon,147,6,1r267f,27,,Whats the one thing you refuse to compromise on,33
thebageljew,108,11,1r0i5j,25,,What is the scariest book you have ever read,36
letstacoboutyomama,45,14,1qt4jh,26,,What was the most fun you had with a person you only saw that one time,40
shwayze,94,10,1qrb2j,26,,What is your personal hell,36
,229,17,1r8q60,51,Maybe the studios disregard helmets on important cops because its inconvenient to have your star behind a helmet Maybe its the jargon in a scene is completely different from what you know from your job,What do TVmovies get wrong that bothers you,68
wvfan,129,16,1r5h14,26,I like hearing all of the stories behind them And who knows maybe someone here could help Life has a weird way of working,What is your biggest regret in life,42
kantoking,20,20,1r56zj,26, ,SOs of people who commited suicide how did their death affect you serious,46
sapperdeboere,82,11,1r4vt4,28,Many plots rely some part on technology As technology advances things can be done more easier so logically some moviesepisodes would be over quickly,Which realistic movie or tv plot would be very short or nonexistant if theyd use current technology,39
rupenscoop,62,4,1r19k8,25,,Reddit what is the oddest thing someone has said while you were having sex with them NSFW,29
tthlesstiger,96,11,1r0sb4,27,,Reddit what movies sounded promising in its premise but flopped or performed poorly at the box office,38
TheDrunkenSniper,84,10,1qy6wl,29,Edit Thanks for the quick replies Me and my friend are having a little debate about it ,Reddit do you believe in aliens Why or why not,39
romds,123,8,1qxpsu,24,,What is your favourite TV showMovie that is not from your country,32
Damoo,69,10,1qvlru,23,,What seemingly impossible to win things have you won,33
literatecaveman,22,11,1qrd39,24,,What was your funniest incident involving the police,35
RhythmRug,47,15,1qqegf,28,A childhood friend of mine is currently serving in Afghanistan and Id like to send a care package to him that would be useful in addition to letting him know were thinking of him,Iraq and Afghanistan Veterans of Reddit what are some things to include in a care package to a current serviceman that civilians wouldnt be aware of,43
UncertainAnswer,230,47,1r4zx2,25,,You wake up in front of your computer with amnesia what do you think when you see your reddit username,72
MuhdHazim,70,27,1r4tx2,21,,In your opinionWhat is the best Youtube video,48
Ezma,49,9,1r3iws,25,how long would we last,What would happen to America if the internet went down nation wide,34
kyhe,79,18,1r3730,28,,Why is your best friend your BEST friend,46
nyomythus,51,16,1r365i,22,,Restaurant workers when you go out to eat what are some tell tale signs that most people dont notice that make you thinkum maybe Im not going to eat here after all,38
FappetteThrowaway,130,22,1r3653,28,,Reddit what is the weirdest sexual thing youve ever doneseenbeen asked to do NSFW,50
TheNaud,164,14,1r2v48,23,,What invention has hurt society the most,37
MISTERCLEAN,105,16,1r055g,25,Absolutely ANYTHING is fair game,If you could change ONE thing about the human body what would it be and why,41
creativelybrownish,137,17,1r025g,24,,What do you love,41
GoTigers,24,17,1qz5xz,27,For those who have worked in the Cruise industry or even those who went on a cruise for vacation share your crazy stories from your time at sea,Cruise ship workers and passengers too What crazy stories can you share from your time at sea,44
ViralPandemic,247,33,1qxd2n,25,,If you got teleported anywhere in the world based on your username where would you be,58
yourchildhood,37,6,1qv81a,26,,What does love feel like,32
LoLShiroi,87,10,1qu8m5,26,,What are some things that are common knowledge for you that others commonly dont know but should know,36
shipallthethings,257,19,1qsxvo,27,,If you died right now what were the last words you spoke out loud,46
mrtuber,138,16,1r6nbn,26,,What is something you do that most people frown on but you dont give a damn,42
vishalvc,73,8,1r5fzl,23,,Which song gets you nostalgic and why,31
cptmerica,99,11,1r58af,23,,What subtle change would you make to a great movie to make it shitty,34
hollowneedle,132,11,1r41ey,22,,Reddit what are your unusual fears,33
bluebush,101,10,1r3s43,23,,What is your proudest video game achievement,33
MissLexxxi,127,6,1r1lvx,23,Im watching a pretty damn disturbing movie right now Im bored and Im curious,What is the most disturbing movie youve ever seen and what was so disturbing about it,29
EnsonAmata,105,15,1r020j,25,,Whats the best song to play at a bar that will encourage everyone to sing along,40
sumsum,142,11,1qwdkg,23,,What fact myth or belief are you afraid that people will associate with you,34
cptmerica,93,11,1qrplg,21,,What are some things people frequently say but never actually mean,32
MmathersIII,75,11,1qqx76,24,,Reddit what is an everyday item that needs to be improved,35
hbnoodles,129,11,1r8o3s,41,Was there some kind of personal experience that made you believe what you do or something else,Redditors who dislike police officers why do you have this view,52
Bridger,111,13,1r8lrt,27,,If you suddenly got switched to the opposite sex and abided by normal customs for that gender what would you miss most about your current sex,40
SunMoonTruth,68,8,1r83uo,24,,What is the worst or best gift youve ever received,32
ShermanMelonBalls,43,5,1r7e5t,21,,SERIOUS What has been the most surreal moment of your life so far,26
holdingmyheart,63,5,1r7apg,22,,What would be the funniestweirdestcreepiest thing to say to someone next to you at a urinal,27
Theriley,18,14,1r6yl6,23,,Redditors who have been kidnapped what is your story,37
jram,96,20,1r6vmb,21,,Whats the weirdest thing youve done with someone you just met NSFW,41
Graham,167,12,1r6s1m,24,,What is something about American culture that really freaks you out,36
wtfjen,47,9,1r6ihz,22,The surveillance camera has a direct stream back to present day and goes unnoticed,If you could go back in time and install a single surveillance camera where and when would you place it,31
radministator,83,20,1r4yh4,22,,What book have you read that was so inspiring that it had a transformational effect on your life,42
TheSheepGuy,79,9,1r3x8x,20,What fantasy job did you want as a kid How close have you come to achieving it,Reddit what did you want to be when you grew up,29
WorldsTallestMidget,48,18,1quxem,22,,What moment from your teenage years do you look back on and think damn I was an asshole,40
StarrkDreams,22,11,1quw2l,20,Edit God damn it guys stop the amnesia jokes already ,People of Reddit whove had amnesia how was it like temporarily losing your memories,31
SUICIDEORDIE,115,18,1quv6s,24,,Reddit what is the most useless object in your home right now,42
CG,69,9,1qu1bj,22,A weird accident or disease that lead to an awkward or strange trip to the doctorORStrange behavior by the hospital staff that made for a weird or funny visitEdit Your,What was you weirdest trip to the hospital,31
NinjaPirate,36,19,1qt1ou,24,Anything good weird or both,Fast food and cafe workers of Reddit whats on your secret menu,43
theflyingderp,180,31,1qsbep,24,,How do American people perceive Welsh people,55
jv,71,10,1qrlwh,23,I just realised  most of my internet time is spent on FB and reddit S ,If reddit facebook or twitter didnt exist What site would you spend the most time on,33
StellarView,128,14,1qr6ui,23,Any type of game video games playground games board games,Reddit whats a game that you miss playing,37
mattpiv,125,6,1qqtbg,22,Its weird the way our society holds onto nostalgic things from our distant past,Hey Reddit whats one thing in our society thats completely outdated and you wonder why we still use it,28
CF,27,20,1r8ii9,33,,Redditors who remember the JFK assasination what was hearing the news like Where were you What were peoples reactions,53
Rompeben,76,11,1r2f94,21,,If you were sent back in time a thousand years what could you contribute to society,32
cephalopodsandrum,22,4,1r0pjo,22,Particularly those who were adopted as very young childrenbabies how did you react How do you feel towards your adopted parents about when they told youEdit biological parentsrather than real Sorry,Adopted children of reddit how did you find out your adopted parents werent your real parents How did you feel after finding out,26
IMAMenlo,26,14,1qzzbw,19,I was asked to be the best man in a wedding last night It isnt until October of  but am curious other than planning a bachelor party and making sure the groomsman are getting fitted for their suits are there more responsibilities I should know about Any books I need to read Or good checklists or resources I am excited but also want to do a good job Thanks ,Best Men of Reddit what are some good tips for a first timer,33
pandapooping,155,11,1qyl56,20,,Whats the next big thing youre going to buy once you have the money to,31
McMier,183,17,1qxmzq,22,,What is a popular trendfad that has occurred during your lifetime that youre proud to say you didnt take part in,39
thenakedone,70,13,1qvqhb,21,,Serious What can you say that will ease my mind about death,34
trekbette,20,22,1qv8n8,20,,Have you found something weird about someone you know from Googling them,42
bctp,95,24,1quir9,21,What are some awkward situations youve been in with an unintentional or intentional boner,Guys whats the most awkward situation youve been in with a boner,45
KaBooYa,79,9,1qticb,22,,If you had the power to remove bad side effects from an object what would the object be,31
TailsGetsTrolled,55,9,1qrvck,21,,What is the most serious problem facing humanity right now,30
bigmackdaddy,5,4,1qqts3,23,Ive heard in some instances of other Indians treating members of lower castes differently even though they live in other countries besides India How seriously do Indian immigrants and the offspring of immigrants take the caste system Are members of lower castes less likely to live abroad ,Indian redditors from lower castes living in Europe and North America do other Indians from higher castes discriminate against you,27
Brokensoul,140,12,1r7xua,25,Past shows of course,Which television show do you feel had the perfect ending,37
Adog,136,15,1r6jwr,20,Could be anything interesting or cool about really anything in your state city or country D ,What are some cool facts about your state city or even country,35
deleted,40,8,1r693z,20,NSFW obv,Whats the most NSFW present youve gotten for Christmas,28
riginalPoser,74,13,1r59em,21,,When you were a kid what is something that you thought was magic,34
caalas,73,7,1r54sg,22,,If you could live in any city from a movie or book what would it be,29
speathed,24,16,1r2ufp,22,Some context on this question Yesterdays Whats your biggest I dodged a bullet momenthttpwwwredditcomrAskRedditcommentsqzwhatsyourbiggestidodgedabulletmoment got me thinking of an incident that happened in my youth Whilst perhaps not exactly dodging a bullet at that precise moment it brought back memories of when I met a monster When I was about  my high school started a boys after school sports club I lived out of town and had been home before so asked my father for a liftWe arrived about  minutes late and the first thing that struck me was that all the boys were running about with no tops on I headed for the changing rooms but wasnt too comfortable with the idea It was definitely not the norm at my school for thisAfter finally arriving at the changing rooms with my father the man running the club followed us in My father knew I wasnt comfortable with what appeared to be a very weird guy getting kids to run about half naked so he spoke to the man for a few minutes  Shortly after he returned and told me to get ready as we were leavingIm not sure what was said in their exchange but my father was creeped out He specifically told me not to attend the class as there was something not right with the guy running it This didnt matter in the end as the class only ran onceHis name was Thomas HamiltonhttpenwikipediaorgwikiDunblaneschoolmassacre and about  months later he walked into another school about  miles away and shot dead sixteen young children and their teacher,Serious Reddit have any of you guys ever met a serial killer or person who later committed a horrific act of atrocity before they became infamous What was your experience like,38
IAmAnAssassin,131,9,1r238w,19,,Which supporting actor or actress made a movietv show better,28
lolalodge,82,12,1r1x6o,19,,What is your accidental Whoops Im asshole moment,31
jesterK,59,10,1r1cks,18,,What goes through your mind when you ejaculate,28
Superbad,65,18,1r0i09,19,Please share your tips or experiences to help depressed redditors,What was the main reason you recovered from depression Serious,37
Masterfuzzfuzz,88,12,1r09py,19,Did a similar one about shows and thought games would be appropriate ,Whats the WORST thing about your favorite video game,31
SFWBryon,24,8,1qzn36,19,Not BPs Oil Well,What has the coolest or most clever FailSafe,27
callmeval,248,41,1qz75c,22,,For the guys of Reddit what is something that girls do that turn you off,63
