author,comments,downvotes,id,score,selftext,title,upvotes
Nerdikki,11734,8247,1qv6q6,2688,Collated list top  CPRhttpwwwredditcomrAskRedditcommentsqvqseriouswhatisaskillthatmostpeoplecouldcdgur Basic cooking skillshttpwwwredditcomrAskRedditcommentsqvqseriouswhatisaskillthatmostpeoplecouldcdgvp Routine car maintenancehttpwwwredditcomrAskRedditcommentsqvqseriouswhatisaskillthatmostpeoplecouldcdgts SwimminghttpwwwredditcomrAskRedditcommentsqvqseriouswhatisaskillthatmostpeoplecouldcdgutr How to type properlyhttpwwwredditcomrAskRedditcommentsqvqseriouswhatisaskillthatmostpeoplecouldcdguiz Basic economicshttpwwwredditcomrAskRedditcommentsqvqseriouswhatisaskillthatmostpeoplecouldcdgtz Basic lock pickinghttpwwwredditcomrAskRedditcommentsqvqseriouswhatisaskillthatmostpeoplecouldcdgvuex How to tie knotshttpwwwredditcomrAskRedditcommentsqvqseriouswhatisaskillthatmostpeoplecouldcdgy How to build a PChttpwwwredditcomrAskRedditcommentsqvqseriouswhatisaskillthatmostpeoplecouldcdgtyzi How to properly tie a tiehttpwwwredditcomrAskRedditcommentsqvqseriouswhatisaskillthatmostpeoplecouldcdgvml How to drive stick shifthttpwwwredditcomrAskRedditcommentsqvqseriouswhatisaskillthatmostpeoplecouldcdgutzf Good communicationhttpwwwredditcomrAskRedditcommentsqvqseriouswhatisaskillthatmostpeoplecouldcdhlg Effective use of Google searcheshttpwwwredditcomrAskRedditcommentsqvqseriouswhatisaskillthatmostpeoplecouldcdgyfz How to make one good cocktailhttpwwwredditcomrAskRedditcommentsqvqseriouswhatisaskillthatmostpeoplecouldcdgwlnr Cunnilingus ಠಠhttpwwwredditcomrAskRedditcommentsqvqseriouswhatisaskillthatmostpeoplecouldcdgum Learning to learnhttpwwwredditcomrAskRedditcommentsqvqseriouswhatisaskillthatmostpeoplecouldcdgzqc How to listenhttpwwwredditcomrAskRedditcommentsqvqseriouswhatisaskillthatmostpeoplecouldcdgui Recognizing basic logic rules and fallacieshttpwwwredditcomrAskRedditcommentsqvqseriouswhatisaskillthatmostpeoplecouldcdgybnx Sewing httpwwwredditcomrAskRedditcommentsqvqseriouswhatisaskillthatmostpeoplecouldcdhe How to be a good liarhttpwwwredditcomrAskRedditcommentsqvqseriouswhatisaskillthatmostpeoplecouldcdgy How to budgethttpwwwredditcomrAskRedditcommentsqvqseriouswhatisaskillthatmostpeoplecouldcdhgpe Critical thinkinghttpwwwredditcomrAskRedditcommentsqvqseriouswhatisaskillthatmostpeoplecouldcdgzozq How to talk to new peoplehttpwwwredditcomrAskRedditcommentsqvqseriouswhatisaskillthatmostpeoplecouldcdgzczs OrganizationhttpwwwredditcomrAskRedditcommentsqvqseriouswhatisaskillthatmostpeoplecouldcdgvxa Basic gun safetyhttpwwwredditcomrAskRedditcommentsqvqseriouswhatisaskillthatmostpeoplecouldcdgxgsx Knowing your rights during a police stophttpwwwredditcomrAskRedditcommentsqvqseriouswhatisaskillthatmostpeoplecouldcdgxgsx Basic mathhttpwwwredditcomrAskRedditcommentsqvqseriouswhatisaskillthatmostpeoplecouldcdgyhg Microsoft OfficehttpwwwredditcomrAskRedditcommentsqvqseriouswhatisaskillthatmostpeoplecouldcdgyc How to play  basic chords on guitarhttpwwwredditcomrAskRedditcommentsqvqseriouswhatisaskillthatmostpeoplecouldcdgzr Basic programmingscriptinghttpwwwredditcomrAskRedditcommentsqvqseriouswhatisaskillthatmostpeoplecouldcdgwx,Serious What is a skill that most people could learn within a matter of days that would prove the most useful,10935
holdingmyheart,24984,6410,1qr47w,2488,,What did you always assume was normal until you found out it wasnt,8898
callux,12217,7233,1qwcdl,2390,,Whats the luckiest thing thats ever happened to you,9623
StrikeAnywherePanda,16780,8043,1r21h6,2313,,What is something you wish you could experience again for the first time,10356
bigboy,10851,6805,1qz709,2314,,Whats your biggest I dodged a bullet moment,9119
caitlynne,7172,7281,1qr9hf,2290,Super late but obligatory edit Holy front page I was hoping for maybe  replies tops Thread turned into mostly bitching about siblings but I enjoyed reading everyones stories and sympathize ,Parents of Reddit when did you realize it wasnt just teenage hormones your kid is a legitimate asshole,9571
ThorsFather,3320,2639,1r28kb,2273,Your favourite drink  EDIT  Wow more responses I could have hoped for Ill be busy for the next months thanks for all the suggestions,Bartenders of Reddit Whats the best drink weve never had ,4912
BattleSausage,15608,3601,1r20ug,2259,Please add any alternatives you might recommend over the brand that lost its luster,What brands or products no longer have the quality they were once known for,5860
dDeoxyribo,10570,7680,1r7lxf,2253,,What is your favorite paradox,9933
minecraft,16794,14032,1r506o,2226,,What is the best quote you have ever seen read and or heard,16258
CaptainWatermelons,15025,5000,1qtm2h,2088,,What is the most noteworthy thing an ancestor of yours has done,7088
killerontheloose,13387,6612,1r2b9l,2162,,whats the most insulting thing you ever said to somebody,8774
bartha,14232,3640,1r57m0,2152,,What university degree do you have and what job position do you now hold,5792
JeffreyJackoff,10129,5485,1r3tf9,2126,I hate you all,Which sitcom from any era had a serious episode that particularly stood out to you,7611
KarmicCosmonaut,10029,5549,1qw43c,2079,,Redditors in a relationship what white lies do you tell your SO and why,7628
kkkisbad,8216,11320,1qu6is,2053,,SERIOUS Reddit what are stories about picture perfect families who do fked up stuff behind closed doors,13373
YogaButt,7739,10652,1r034d,2049,SERIOUS replies onlyEdit Thanks for up voting this to the front page guys And for all your creepy stories Even if youre all lying its still great entertainment Youre the best I feel like Im experiencing the greatest episode of Unsolved Mysteries ,Alien abductees of reddit or people who have claimed to see a UFO whats your story,12701
hitmanzulu,15963,11413,1r15p9,2032,,What is the most fucked up shit youve seen at a party,13445
JEZTURNER,13359,13439,1qyxjx,1982,EDIT Wow front page Did not expect this especially as this askreddit is only slightly different to one I did a few months ago Thanks everyone And a few people getting gold too nice ,Whats the most amusing new film we can come up with by adding a letter to an existing title,15421
Coolspot,4630,2216,1quekx,1961,,Who in your opinion has died the most horrible death in history,4177
Bhighkin,7259,6883,1qs3yr,1951,Obviously Im not asking for names of rock stars but I was thinking that if we hear stories about how many hundreds and even thousands of women these rock stars had sex with then there have to be some with a story or two  Im going to go ahead and make this NSFW to be on the safe side,Former groupies of Reddit what was your experience NSFW,8834
GiroudWheresMyCar,4846,4558,1qtdm0,1921,Front Page would like to dedicate this to Tom Giles for his continuing support and advice in all reddit related matters  ,Teachers of Reddit what is a teacherparent meeting that will haunt you for life,6479
Xinthose,6538,3045,1r2jz4,1797,,What is the most WTF thing you have seen in real life NSFW,4842
wixom,1978,1391,1qrvqx,1773,Wow thanks for all the feedback Ill have fun not sleeping tonight after reading them all,Whats the creepiest Wikipedia article youve ever read,3164
SerbuSauce,5891,12058,1qxr57,1735,Huh never knew about pansexuality TIL ,If sexual orientation was a choice what would be some of the recruitment slogans for each side,13793
smellsofrichmahogany,9625,7591,1qsz1j,1733,,Girls of reddit whats something guys think they do sneakily but you always notice,9324
clydesmooth,9431,5260,1qwcyt,1705,From basic etiquette to more obscure EDIT Obligatory front page edit I honestly didnt expect this to blow up First time on the front page ,What are some sex etiquette rules that you think everyone should be aware of,6965
aoifesuz,9385,2235,1qw707,1687,,What is a commonly said phrase that you consider to be complete bullshit,3922
freckleface,2158,1926,1qr8ps,1667,Honestly I should have probably asked this question in some people still write checks though right ,Bank Tellers of Reddit what is the funniest or most odd thing youve ever seen written on the for line of a check,3593
fokclown,1291,999,1qv6w0,1661,,What is the best answer for why should we hire you in a job interview,2660
peppermint,5553,2093,1r6176,1639,Edit My SO is going to be so surprised the next time were bored and I make a suggestion on what to do Im glad all of you found your quirky other half ,Whats the weirdest thing youve ever done with your SO NSFW,3732
jeremytatton,3874,1399,1qzatw,1637,,Bartenders of Reddit How do you deal with busting an under with a fake IDWhat is your funniest experience while taking one,3036
daphnebluestrat,6158,1725,1r2iy9,1608,This could be a zombie outbreak a nuclear holocaust whateverthefuckhappenedinTheRoad alien invasion whatever  What valuable skill or possessions do YOU have that would help a merry band of refugees surviveEdit Okay weve got zombie survival stuff down But what about if the world looks like it does in The RoadEdit ITT a lot of leaders And people with guns Thanks for playing all,In a postapocalyptic scenario what do YOU bring to the table,3333
gbpackers,5372,1982,1r7unf,2007,EDIT Wow front page Keep them coming guys ,What was a great idea until you actually did it,3989
ohrashid,2253,1308,1qw7oz,1536,,What are your stories of surprise parties gone wrong,2844
Gunski,2087,1702,1qtubn,1530,,What are some romantic things a guy can do for his girlfriend,3232
douchetree,8006,1948,1r4t8m,1525,Thanks for all the responses guys Im wiping away the tears as we speak,Whats your saddest video game moment,3473
jehoshua,3798,1355,1qus9v,1420,,What is something that you would never do even for billion,2775
literatecaveman,9437,1990,1qrpg4,1408,,If a man with a knife barged into where you are right now with the intention of murdering you whats something within  feet of you that you could use as a weapon,3398
phattykins,3079,1703,1r4xp5,1345,,If you were to sum up a famous movie plot for a five year old how would it go,3048
myers,2643,936,1r6hwg,1284,I always see posts about facts What are your best false facts This could be the most believable the most interesting the most ridiculous etc,Whats the best false fact you can come up with,2220
cmifsud,3694,3238,1qqir9,1268,Specifically hair in the pubic region,Women of Reddit what are your views on male body hair NSFW,4506
volleyballbenj,1550,1208,1r59ii,1261,,Teachers with  years of experience How have kids changed,2469
csamhane,2573,951,1qr6o1,1235,,If you died right this second how long would it take for anyone to realize that you are gone,2186
crackala,2127,615,1qro2j,1206,,What is the most awkward party you have ever attended,1821
ItsGamesDean,6395,1211,1r57br,1148,EDIT In the title replace of with or my thumbs are too fat for the phone,What is a gender stereotype male of female that really sets you off,2359
HOTDAWG,4998,3209,1qu80i,1134,,Men of Reddit if there is one other liquid you could ejaculate other than semen what would it be,4343
Jankub,1603,643,1r5172,1074,,What traits do you find admirable in other people,1717
turtleneck,5494,788,1r45xs,1066,,What is one discontinued product youd like to see brought back,1854
cherieish,2233,655,1qwgte,1049,,Men of Reddit help the ladies out  what do you think would be awesome to receive in your holiday stocking,1704
TheNaud,3210,766,1r7ynr,1335,EDIT Thank you all for your posts so far I am enjoying the stories and memoriesEDIT You guys just keep it rolling You honestly have my gratitude EDIT Alright guys Ive tried to upvote all posts that have come across with a story Thank you again for the entertainment today Stay cool or frozen for my midwesterners,What was your biggest I dont belong here moment,2101
ScootOverNao,1156,774,1qqwxr,995,I dont want to sound creepy not my intention at all Tagged serious because its a genuine curiosity of mine Moms what is it like seeing your sonsDads what is it like seeing your daughters ,Parents with older kids what is it like seeing your kids mature sexually and be sexually attractive serious,1769
nerfherdingcat,3330,577,1qww0h,974,Edit Wow I wasnt expecting so many comments thank you,Whats something an ex has said to you that still effects you,1551
dontcallmedavey,3329,413,1qzo9y,943,,Whats a word or phrase you cant believe people say with a straight face,1356
PotatoPataato,3057,597,1qz9lt,941,,What can you not just have one of,1538
jesterfraud,3449,672,1qr9me,941,A genie appears and grants everyone on earth a superpower provided noone else wishes for the same power What do you choose to gain an advantageEDIT Its not about being first its about being unique,Everyone on earth gets to pick a superpower but it must be unique What do you choose,1613
Unluckydragonborn,1039,530,1r6o32,959,,What is the funniest oneliner you have ever heard or read,1489
graaahh,2682,507,1qwe6g,935,,You can pick any superpower but everyone gets it not just you What do you choose,1442
bhizzel,3990,463,1r2mlo,933,,Reddit what is a product that cost entirely too much for what it is,1396
Magnesia,2352,463,1r2d90,923,,What are some of the nicknames you give people that you always see but dont know,1386
throwaway,2748,549,1r3dy0,915,,If you could choose any fictional job what would you be,1464
HighOnKarmajuana,2061,521,1r5g36,915,,What was the greatest lie ever told,1436
thewildslayer,1924,826,1r2xrf,912,If the show was offlimits with the content they are allowed to broadcast,What NSFW myth would you liked to see the Mythbusters test,1738
Bodangzz,2908,616,1r4ym2,895,Anything that really amazed you ,What is something that blows your mind,1511
neuronsynapse,1771,326,1qtr2t,846,,Whats a cheap amp stressrelieving hobby you would advise anyone to try,1172
ProSchmo,3421,428,1qtof3,783,,What is your most irrational pet peeve,1211
TheGuv,2590,354,1qxw2h,795,,If you were to wake up and realize that overnight you had become a billionaire what is the first thing you would do,1149
stonedstudent,2602,405,1r22g6,786,,In what ways do you notice yourself getting older How do you feel about that,1191
Monkeyboobler,624,562,1qtit3,712,Before I get downvoted into oblivion I am not a homophobe I am pro gay marriage gays giving blood but gays adopting worries me as I think society in some countries isnt ready which will effect the child growing upWere you bullied at school and did it effect youAny events that you and your parents went too were there obvious funny looks from people that didnt know youHonestly did you wish you had a male and female parentChildren with female parents do you think you needed a male role model in the household And vice versaWhen you were going through puberty were there certain things happening that you felt awkward asking your parents about ie Female child with  male parents having your first monthly visitorThe inevitable sex chat what was that likeEDIT Ok was not expecting so many comments on this and all pretty awesome and interesting to read  From what Ive read it seems to be all mainly positive with a few exceptions and your usual family bullshit  Any issues that people do have are mainly down to society and religion when people actually get to know the parents and how well their children are being raised they can accept it This has been mentioned a couple of times but worth a watch httpwwwyoutubecomwatchvFSQQKVufQIm assuming the majority of this is coming for the USA would be interesting to know if anyone has any experience of this in UK Europe and rest of the world,People who were brought up by gay parents male or female what was it like,1274
SpenserHire,3007,304,1qzfwr,688,Since we all seem to talk about video games that waste our time in a bad light What games have you played that your proud to have wasted your time,What video game were you proud to waste so much of your time in,992
Gordonacus,1106,380,1r7qgi,769,After watching the Washington Tornado video it made me realise how recent footage such as that is possible Before we had smart phones very few would load up a video camera and film an oncoming tornado going straight for their houseSo what events in history would be incredible to see through the camera of a normal person ,Serious If society had handheld cameras for the entirety of history which event would be incredible to witness through the camera of a normal person,1149
Secres,754,388,1quecq,679,,Officers of Reddit have you ever pulled over any famous people How did that turn out,1067
adviceanimorph,1239,233,1r4vs7,677,Were talking about real events things that happened to you short stories creepypastas anything really Cmon reddit make us not want to sleep tonightEdit Woohoo Reading material for days Those are GOOD,What are the creepiest scariest stories real or not youve ever heard,910
boonz,1844,380,1r1tj4,650,,What is the greatest Comeback youve ever come up with on the spot,1030
adversarial,3741,405,1qrgnu,653,Should be selfexplanatory but looking for something that is true that our society denies is true through taboos or other means of determining what is socially acceptable to say,Whats something thats true but not socially acceptable to say,1058
arztokal,1385,510,1qupge,619,,If you could replace one thing in history with a dildo what would you replace,1129
randoh,2083,281,1qzbi8,618,edit THANKS for so many hilarious responses There is such a vast number of different jobs of redditors Thanks for commenting Upvotes for all you wonderful peopleedit  Holy crap there are a lot of jobs here It an interesting cross section of the world seeing what you all do and how your job is viewed by you and your fellow workers Thank you so much for sharing I havent gone through all the comments but I think Im up to date on all the replies,If your occupation had a motto or tagline that was painfully truthful what would it be,899
austin,3128,544,1r0twb,608,,Men of Reddit whats the most annoying part about being a guy,1152
DudeWithAHighKD,1875,387,1r53nr,589,,What is your I should be dead story,976
ClownPornFanatic,1951,395,1qvz1w,587,,Who do you think the opposing sides will be in World War ,982
TheDuskDragon,1686,224,1qyl09,576,,What dark history lies within the neighborhood you live in,800
Iamsandonut,1186,252,1r03f2,565,,If it could rain any object occasionally what would be the most inconvenient weather report to hear in the morning,817
tyroneking,2332,401,1qwr9f,568,,Foul spoken redditors Whats your favourite swear word or phrase,969
brovanz,2695,270,1qqgh8,562,,Hey Reddit  what are you genetically gifted with,832
jordosaur,3786,530,1r3mg0,560,,Whats a double standard you hate,1090
LSasquatch,697,150,1quf6k,532,,When has your real excuse been so unbelievable that you had to make up a fake one anyway,682
NXTNaVi,3206,320,1r83gq,776,,Whats the most common way you see people waste money,1096
BouncingDBoobs,1183,453,1r57e0,505,I have heard horror stories about Detroit and the crime rate there Its so bad that I refuse to choose that citys airport even for transit I am just wondering if scenes like those in the movie Robocop where they brutally murder the cop are actually true or is it all fiction Of course this pertains to any city and not just Detroit in generalEDIT  As someone pointed out I left out military personnel in the title Stories from military people are relevant to the topic I just wasnt thinkingEDIT  Since pointed out over and over I now understand that the Detroit airport is not actually in Detroit and it is one of the nicest airports some of the redditors have been to Thanks for the clarification EDIT  Thanks all those who responded I really appreciate you taking the timeAlso a point of clarification It was not my intention to compare degrees of gruesome as might have come across in one of my comments about crimes committed by Jeffrey Dahmer I have lived through some pretty horrible stuff myself and seen and heard  even worse Though I do agree that I shouldnt have described some crimes as worse than what Jeffery Dahmer did just that I have heard enough to build some kind of immunity towards horrible crimes I am still scared but there is too much bad in this world that new things unfolding sometimes dont have that much of an adverse affect as they used to Its a coping mechanism and I dont want to go into too much detail but I felt like I should have clarified on this point,Cops FBI Agents and other law enforcement agents what are some of the most gruesome crimes that you have witnessed NSFW,958
FetusSoup,2261,348,1r29qa,487,Edit You guys are awesome really cheered me up a lot ,At this very moment how is your life going,835
HS,1969,187,1qrfuh,491,,What is your best contrary to popular belief fact,678
Dungeon,1585,228,1qw869,485,Just because Im sure most of us would say a loved ones voice or some sort of music,What is your favorite sound not made by the human voice or a musical instrument,713
ANALPOPCORN,3029,423,1r1r5h,445,,Reddit why do you have that scar,868
zipzap,1335,197,1qzwv7,450,,If all food was free and equally good for you what would you eat,647
indiannajnes,855,234,1r6koz,446,,Whats the most embarrassing thing youve done in the heat of the moment,680
umdmatto,1233,386,1qrwdc,431,,What famous movie line would be the worst to say after sex,817
austin,1191,349,1r3hyy,414,Edit Something really shitty other than just being fired,Whats something really shitty that happened to you while you were at work,763
Knoah,1389,455,1r1fsr,411,The student could be serious or joking,Sex Ed teachers of Reddit what is the weirdest question a student has asked,866
bluemoon,799,179,1r58nc,399, Have there been any reported problems  incidents involving Marijuana consumption More or less Marijuana consumption by young adults than before Is there still a stigma attached to smoking weed has it been lessened since the legalization took effect,Redditors living in Colorado how is legalized Marijuana working out,578
tookmytime,1272,182,1qtn8b,392,It will be more impressive if you were sober but all answers welcome ,What is the loudest biggest most crazy thing you have slept through,574
Usernameisntthatlong,2506,268,1r22i7,387,From boardgames to physical games to video gamesEDIT Lots of video games huh  ,What old game would once again be awesome if remade,655
peepingtm,521,260,1r6qp9,391,,People that have posted pictures of themselves on NSFW subreddits has anyone IRL mentioned that they saw your picture online what did they say and how did you react,651
hoyebr,1717,162,1qziy2,381,,What skill used to be common knowledge but has been dying out recently,543
sweetdeoderant,945,243,1qub7h,375,This weekend I witnessed a man and woman get into an altercation because the man accidentally spilled a bit of his drink onto her They both obviously had a bit to drink so you can imagine it got out of hand fastHe kept trying to leave and ignore her but out of drunken rage she wouldnt let him leave One thing led to another and she started smacking him He pushed her off of him and she fell to the ground easily because of the heels she was wearing It quickly turned into a huge scuffle between the two parties How can a guy get a violent woman off of him without hurting her,How should a male properly respond to a female physically attacking him,618
motherlover,503,248,1qture,376,,Former prostitutes of Reddit have you ever turned down a customer and why,624
helloimrory,1399,241,1qthoz,370,,What is something that isnt taught in schools that you feel should be,611
CapAmerica,3335,349,1r7vvs,467,Just because we are men doesnt mean we cry what was yours,Men of Reddit What movie made YOU cry,816
AThirdFoot,1047,416,1qwqkg,365,,What is the one question you can ask someone to find out if theyre a Redditor without referring to Reddit,781
chiteed,622,178,1qs7zt,365,,Teenagers of Reddit whats the worst most embarrassing thing your parents have done around your friends,543
Asdyc,1494,160,1qtgq6,361,,What is a personality trait that you have that piss a lot of people off,521
austin,809,210,1qqkn8,352,,What inventions are so great that theyll still be used  years down the line,562
Geschichtenerzaehler,361,144,1r4x20,338,,Teachers of Reddit what was the most intelligent most profound thing a student of yours ever asked or replied,482
MothaFuckinMrRogers,1463,149,1qysgn,328,And if you dont know a lot about any one thing in particular weep with me at the realization that you and I have wasted a lot of time in our livesedit wow youre all losers keep them coming,What is something that you know very much about but nobody else seems to know anything about,477
MrAdventures,651,236,1r2lai,318,,Whats one thing you would do for  but not ,554
SiriusLeeSam,1093,133,1r7n6u,342,,What otherwise boring movie is totally worth its ending ,475
SeargentMcTarget,1098,146,1qtg63,311,,What is the most random fact that you know and will never forget,457
ICheifCiggarettes,1482,240,1r51yy,307,Everybody hates advertising But what is the most annoying thing you hate about it,Whats do you hate most about advertising,547
Deceptolon,1579,234,1r7l1q,309,,Whats a threeword sentence you would never want to hear,543
CueTheTrumpets,1073,113,1qz8mj,289,What song no matter how stressed or sad or whatever you are makes you happy and feel better,What is your Everything is going to be fine song,402
ifoundmolly,1614,149,1r3orn,288,,What is the funniest name youve ever heard,437
chrisxcore,1008,594,1qx6k7,282,,Women of Reddit what are the sources of your most unconventional orgasms NSFW obviously,876
Copywrites,1205,115,1r05cf,270,,What is one aspect of internet culture that you cant stand,385
shlongvinoveritas,647,348,1qtodp,266,,Reddit Strippers What do you think of guys who are alone at the strip club,614
dakamon,1171,164,1r4hif,267,I wake up and its on the front of askreddit Thanks guys,What is the scariest truth in ten words or less,431
smellysk,324,106,1qww6z,262,,Redditors what is the best job interview tip you have,368
Scubadude,1099,133,1qwgs0,260,,What angers you most about society,393
billion,405,107,1qul65,247,How did you find out,Parents what secrets does your childteenager keep that you know about,354
