author,comments,downvotes,id,score,selftext,title,upvotes
ActionDan,113,15,1qyw7w,20,As someone who enjoyed the movies but never read the books What do you feel was missing from the movies that would have added either story or character development ,Harry Potter Fans Whats missing from the movie series,35
vmfillpot,53,7,1qyvhv,19,Weve been thinking about having children within the next few years but I want to make sure I can do everything possible to give our children the best possible chances in life,What can a person do to ensure their child grows up to be the best person they can,26
augspreadhead,14,16,1qyj71,20,,Parents of Reddit who have male and female children which were harder to raise and why,36
mchughtai,62,4,1qy1hl,21,,Reddit whats your best insult,25
dancingmonkey,171,13,1qxzm2,21,,What is something in your household you have an excessive amount of,34
lookupdiscover,30,11,1qva8q,20,I have always wondered this due to the emphasis placed on a mans sex drive  Womens sex drives are barely spoken of in the media society and in general Its not taboo for women to want sex as much as a man ,Women of Reddit how do you deal with a significant other with low libido,31
ItsNotMe,18,1,1quwpb,20,,EMTs of Reddit what is your least favorite type of call to have to respond to,21
AgentBeige,76,28,1qtm91,18,Im thinking besides the obvious discovery of a SOs handle or someone telling you their nickname ,Have you ever realized a post was made by a Redditor you knew If so what gave them away and did you let them know,46
Kennyh,51,5,1qtdpk,21,,What worldwide problem is the most significant,26
aMANescape,145,12,1qt70t,21,,How did you get your scars,33
TheAnemicOne,102,46,1qt361,20,So what if pokemon were real and they were used to fight wars with other countries What would be the most brutal attack to use on enemies,If pokemon were used for warfare what would be the most brutal attack to use on enemies,66
benxxrd,108,14,1qs97y,21,Can be anything Movie person country ANYTHING,Whats something that you wish didnt exist,35
Agent,83,13,1qs7z0,18,,What is something common that people should know but they dont,31
KoloheBird,64,9,1qrt5s,22,My husband and I are both gamers but because we have totally different tastes skills and skill levels there arent many games where we can play togetherSo what often happens is we watch each other play rather than playing together usually the one watching will be doing some other task on the sofa while the other is playingWe even help each other out by being a second pair of eyesWhat are yours some of your favorites and why,What is your favorite video game to WATCH someone else play,31
Spudgunhimself,83,14,1qr4wq,20,,What is a profession that could never possibly get replaced by robots in the future,34
Bouganvilla,26,2,1qqwsf,22,,Parents of reddit did you immediately love your child when they were born Or do you begin to love them over time Did you want kids,24
CaptainDirtyHook,96,11,1r8qrl,38,,What movie would make the worst musical,49
gingerpheonix,23,2,1r7h1d,21,,What did you get taught about being an adult when you were a kid that was complete bullst,23
drtreadwater,70,3,1r6yyt,19,,If your pet could suddenly talk to you tomorrow whats the first thing it would say,22
Discardodo,177,13,1r4c84,20,,Whats the best tv show that only lasted one season,33
condorama,29,9,1r45aa,18,I have no clue if anyone can answer this and it may very well be pointless conjecturing Sometimes the mind just wanders,If a human could live indefinitely how long if ever would it take for the brain to run out of capacity for new memories,27
YeahYeahNo,135,13,1r2m0w,21,,What is something you love to brag about but never get the chance to,34
catpat,77,19,1r1te6,20,Example An American urologist bought Napoleons penis for ,Reddit What is the most unusual fact you know,39
bloodycyclist,31,5,1r1s0z,19,,Whats the scariest dreamnightmare youve ever had,24
opticalpower,47,1,1r1ams,19,Context Never had pets growing up parents said no and now i have two kids teen and near teen and I feel theyre missing outIm afraid that Ill mess it up or not know what to do I dont want to hurt the dog through ignorance at the same time I feel scared about another life Id be responsible for,Dog Owners What one thing would you tell a person whos never owned a dog but wants to get one to be wary about,20
JeepGuy,35,13,1qzsxz,19,I am not musically talented in anyway shape or form so I am curious to know what a musician is feeling or thinking when they are singing on stage and close their eyes during a high note or a part of the song they feel strongly about I know there is a ton of emotion attached to the musiclyrics and I always wondered what a person was feeling that they would have to close their eyes to hit that line just right even when they are infront of a crowd of thousands ,Musicians of Reddit Why do you close your eyes periodically when singing on stage or hitting your high note,32
Cameramanmanman,150,12,1qwyd2,20,,If you could enter into any video game world which would you choose,32
plowerd,104,9,1qvvdc,18,,What is some small pointless thing that you get unusually proud of,27
JoseNotHose,63,18,1qveg9,18,What happened How did it go as in putting the dime in her jukebox,How awkward was your first time nsfw,36
ShinryuLives,22,4,1qvar5,21,Messed up title i ment to say do IN public Sorry folks,Whats the craziestweirdest thing youve seen someone do it public,25
thenevz,66,11,1qv9lq,20,,If you could replace your fart noise with any other noise what would it be,31
weezerluva,4,12,1qtjmm,19,,People of reddit with terminal illnesses how did your views of the afterlife or religion in general change after you accepted your diagnosis,31
DoctorWaluigiTime,106,12,1qrdao,19,,What word have you always pronounced in your head incorrectly until someone told you otherwise,31
Ifishyy,47,13,1qr3gq,19,What is something frowned upon in your culture but not so much in other cultures,What is something frowned upon in your culture but not so much in other cultures,32
JJean,152,19,1r8tj2,39,I have noticed that as I have gotten older the number and quality of books that I have read that dropped substantially  There are several thing about myself that I want to changeI do not even want to be recognizable as the same person by the end of next yearI want to know what your absolute favorite book is  It can be about any topic at all with the sole exception of religion there is just no interest there at all  In fact it does not even have to be your favorite book  Did you write a book that you are especially proud of  If I can find it I want to read itMy goal is to read every book that gets listed  Hopefully there will be a lot of responses and it will take me a while to get through them all  That would be a good problem to haveEdit  Thanks so much for all the suggestions so far  Keep em coming,What is your favorite book of all time,58
RedHeadedWonderChild,88,7,1r8ply,33,,What uncommon misconception did you have as a child that went uncorrected for an embarrassingly long time,40
larrythemariachibear,133,8,1r6q6e,19,,What bothers you more than it should,27
BladesofChaos,72,11,1r590y,18,,Programmers of Reddit how would you sum up a movie in just a few lines of fake code,29
hereiamhello,100,28,1r4qdf,15,,Reddit what is your holy crap this is a small freaking world moment,43
errorcode,71,7,1r42p1,18,Not including electronic devices such as cell phones ipods tablets etc,What is  thing that  years ago people would never thought of as cool or popular,25
LordBitington,44,5,1r1mp8,20,Some might have a completely different meaning if youre a male or femalesome might not Feel free to remove your pants or someone elses repeatedly as you read throughA couple I enjoy to kick things offTheyre little footballsor Its alive its aliiive,Whats a great movie quote to say while removing your pants,25
countryskyglow,109,4,1r1dqy,18,,What was your favorite book as a kid,22
TyBenschoter,71,13,1qzfg9,17,List your best and worst and your rationaleEdit Wow weve got nearly the whole globe covered Im suprised Canada did so well,What would be the best and worst countries to live in during the zombie apocalypse,30
TakeTheFuckingGum,98,9,1qz8wb,17,,Which is the saddest lyric you have ever heard in a song,26
videosmash,43,8,1qyl5f,19,,Whats your best cheesy joke,27
justinabsentia,62,12,1qxqdd,16,,Retail employees of reddit what is it like to work on black Friday,28
wdswds,41,10,1qx5p4,17,,Redditors in relationships whats something youve been wanting to tell your SO but have been too afraid to tell them,27
Gonadsoldier,60,8,1qw7to,17,,What is your favorite trailer for a moviegame,25
gatorly,73,8,1qw0k5,19,Irrational Unwarranted Plain silly I want to hear about it ,What is the dumbest thing you are worried about,27
ajlamoreau,47,16,1qv63v,17,Chicken fish cows None really stand out to me as my first choice to eat Is mankind missing out on something,Strictly based on appearance what animal would you guess to be most delicious And why,33
fionacinderella,5,5,1quw0s,18,,Doctors of reddit when did you start to feel like an actual doctor not just a med student,23
coppolapsu,35,20,1qsmf0,19,,Longshot but has anyone ever faked their death Howd it go,39
apartmentpantss,37,6,1qqzn2,19,Both my boyfriend and I have not lived with any significant relationships before each other He is  I am  What is your experience and advice for someone in this situation,What are your challenges of living with your SO,25
littlechristine,83,9,1qqwiz,18,,If you could jump into a giant bowl of anything what would it be,27
TheHeroicZ,92,5,1r7gbi,17,,What is your movie guilty pleasure,22
ArtichokeBatter,55,6,1r6jqx,19,,What is a concept that is impossible for you to wrap your brain around,25
nightpanda,86,8,1r5w0e,16,,If you could reset your life back to any point just once and retain all the knowledge you have acquired where would you go and why,24
SlothmanProphecy,51,13,1r54pl,17,,Reddit your life is to be condensed to one sentence how does it read,30
abenyishay,112,18,1r4sxc,18,,Whats the best piece of advice youve been given,36
Chrono,115,8,1r3i9r,17,,If you could be instantly good at one thing what would it be,25
ImmaGrownAssPigeon,71,11,1r3f1s,19,I dont necessarily believe that anything will happen after death but I think the idea of reincarnation seems be pretty neat I like the idea of getting another chance at life getting a new identity and everything It just sounds awesome unless you are reborn as a cockroach or somethingWhat would you like to happen after death,Reddit what would you like to happen after death,30
yeahLCD,91,22,1r3a0m,17,Go on then give us a story,Males of Reddit what typicallyfemale activity have you tried,39
ScottyFromScotland,84,6,1r35xk,18,,What is your favorite Saturday Night Live skit ever,24
ObviousBicycle,121,7,1r2526,17,,Which scene from which movie always always makes you tense upcry,24
stemh,54,7,1r22p1,19,,What great film has lost its charm because youve watched it too many times,26
LaxesGlasses,62,5,1r1p6e,18,,Reddit what do you think about at night,23
EarwaxPanties,79,4,1r1gij,18,,Whats a movie scene that gives you the chills no matter how many times you see it,22
kotula,55,4,1r1aow,18,,Whats the worst experience you had with racism,22
Throwaway,56,12,1r0r49,16,Edit Additionally how did you discover them,Reddit what are your strangest fetishes,28
DarwinDanger,64,5,1r0p4j,17,,What is a phrase you could say today that wouldnt have made any sense whatsoever just  years ago,22
Grabsy,92,9,1r0676,16,Be as descriptive as you likeEdit Thanks for all the replies guys keep them coming,What is the most pain youve ever been put through,25
dasfooksy,91,11,1qzz3e,15,,What is something you have experienced that was incredibly hyped up before you did it only to be meh,26
LonigroC,184,17,1qzmkz,21,,Whats one stereotype that you actually agree with,38
reckless,69,4,1qzj3w,19,,If you would own a classic car which one would you own,23
doorsdown,80,14,1qz78u,18,,What is one cool internet trick you know,32
trevics,75,14,1qypcj,16,This has likely been asked several times in the past but Ill ask again and start Ive done a lot of things Im my life that Im not proud of and have often times found myself in a tremendous funk because of it Ive owned a lot of animals in the past but after a particularly dark period in my life I adopted a dog that literally saved my life and became my best friend When I met my wife she had two large dogs as well and after an initial getting to know you period they all became a good pack One day after we had all moved to a new state  two of the dogs started fighting viciously but we were able to separate them  The third time this happened the fight was so bad that our kitchen looked like a murder scene  At one point as we struggled to pull them apart one had the other by the nose and punctured him near the eyes so that it was bubbling out My wife ended up with a broken finger due to the ordeal We loved those dogs like they were our children but she said mine had to go All of the shelters in LA were full and he was so injured that I couldnt find anyone to take him The vet reluctantly agreed to put him down  but I was so distraught I couldnt be in the room with him for it TLDR I wasnt able to be there for the dog who saved my life and I regret it more than anything every day ,Reddit what is the one thing you most regret doing in your life,30
buttholeballs,78,7,1qy6ad,16,,What is something you cant unseeunhear,23
DarkxAngel,130,14,1qy5ia,17,,Reddit if you were given an unlimited supply of your favorite food or beverage and there were no negative side effects from consuming your favorite food or drink what would it be,31
HippieIsHere,68,9,1qxbxe,17,Answer is in comments,What is the hardest thing for you to NOT do,26
Deathproofer,116,11,1qwk5p,15,,What will instantly make me unpopular in your country,26
mandywydnam,70,17,1qwerj,15,Some stores are opening earlier and earlier on Thanksgiving Day  Do you camp out overnight to hit the early morning sales,What are your thoughts on Black Friday shopping,32
seeyouinvancouver,40,6,1qwe11,17,,What is something that you unknowingly had in your possession which you had a hard time explaining to someone,23
Freeeshooter,128,13,1qvyyx,15,,What song is stuck in your head right now,28
pgabra,72,7,1qvrnv,17,,Who in your opinion is the greatest human being to walk on this earth,24
zsalloum,59,11,1qv8cm,19,,Reddit whats the ONE thing that you were tricked into doing that you will never do again,30
fuzzygoo,11,10,1qv40t,15,,Cops of reddit have you ever pulled over an off duty cop What was it like,25
goranistan,52,6,1qu833,19,Long ago a friend said to me The truth comes out when youre drunk just kinda in the middle of a sentence when we were at a bar To this day it pops in my head every time I witness drama on a night out drinking What are some eyeopening things people have said without even thinking much about that has made a difference in your life,What did someone say to you in passing that stuck with you your whole life,25
KFC,57,13,1qtjbq,19,,what is the funniest insult you know,32
rossallen,180,13,1qt9bt,17,,Girls of Reddit What items of clothing instantly turn you off a guy,30
NDepths,137,7,1qt4hg,18,Name only the quote ,Whats a quote from a movie you know in which others would have a tough time guessing,25
Thor,53,12,1qsk9v,17,,Reddit what is the best response in a job interview to the question What is your biggest weakness,29
pepsiguy,65,11,1qsix0,16,Fun things to do historical significance naturewildlife,Reddit what is the coolest thing about where you live,27
Elias,10,20,1qs95u,15,,in what way does a deaf person think,35
rkarwecki,54,6,1r8es6,21,,What song would have a completely different meaning if it was sung by a different artist,27
THallewell,69,4,1r7394,17,Sometimes people claim some experiences seem to slow time Has this happened to you If so what was the longest feeling  seconds of your life,What was the longest  seconds of your life,21
jeffreywriter,40,9,1r6n07,17,For example I was looking up a word in my dictionary and stumbled across sinistral which of course sounds dark and scary but just means lefthanded or on the left Etymology is definitely interesting  its derived from words like sinister meaning evil or unlucky  but current meaning isnt too sexy ,What is a word that sounds interesting but has a mundane definition,26
Hoggzeh,53,8,1r6jva,18,,What do you think is the single most influential decision of the th century,26
DeacanCheese,30,1,1r45pr,18,If so is it in positive or negative ways Please if any of you are still with your first loves Id love to hear your stories,Regardless of your love life right now do you ever still think about your first love,19
BenevolentTruculent,61,23,1r3q2w,17,,Men have you ever almost lost your genitals,40
Weed,146,9,1r3ky1,17,,What is the absolute worst movie you have watched in its entirety,26
Quartzee,67,10,1qz7ce,16,So you guys havent seen Brewsters Millions so here are the rules You cannot have any assets to show for the  million You cannot just waste the money in any wayIf you can follow those rules you will inherit  million,How would you spend  million in  days if you couldnt tell anyone about what you were doing aka Brewsters Millions,26
Haze,32,4,1qyleu,16,,What are the small acts of kindness that occur occasionally and make you smile,20
Chazele,115,17,1qy7ic,16,,What is the WORST superpower,33
DeEenhoorn,71,13,1qwis6,16,Someone always has a better story to tell but every one probably has this one story that cannot be beaten,What oneup category have you always won and with what story NSFW,29
doorsdown,67,15,1qwimf,15,,You can write a  sentence note to your past self from any point in your life What do you write and why,30
exotool,8,11,1qwhr5,18,Is there a trend in makes or models,Tow Truck Drivers What vehicle do you tow the most due to mechanical failure,29
Signitupben,81,7,1qwhgt,18,In a single word or sentence how would you describe or identify the person youve becomeThink outside the box,How would you identify yourself,25
AnalyticLunatic,113,9,1qwabs,15,,Reddit what is on your Christmas List,24
Cocainesamurai,159,11,1qvy60,15,,What is something that society frowns on that you think is acceptable,26
Eeclipse,7,4,1qvqe4,18,If you have won a substantial amount of money let us know when and what you did with it and if you still have any left ,Redditors that have won a substantial amount of money what did you do with it and do you still have any left,22
zippo,55,14,1qvjag,14,,Reddit what is your favorite movie quote of all time,28
missheatherfair,22,6,1quibt,16,,Is there a time where you absolutely did the right thing in a situation but regret it to this day,22
karmacomic,90,5,1qui6z,15,Lets hear it ,What is the one song or artist you absolutely hate and why,20
McLovinIt,102,12,1qu4dk,16,,What is something that you feel should be illegal but is completely legal to do,28
NamenRoodles,41,12,1qu183,18,,Reddit they are making a movie based on your life what actor plays you and why,30
invertedmatrix,40,17,1qtoqs,15,,Prison guards of reddit whats the craziest thing youve ever seen an inmate do,32
miladystark,49,16,1qtliu,16,,How do you cope from a breakup,32
Puz,50,5,1qt6gr,17,,What was your biggest what the fuck am I doing here moment,22
loganrunjack,80,11,1qsnxh,15,personally to name a few I would go with aliens shawshank redemption and the first ninja turtles movie,movie fans of reddit whats a movie you could watch over and over again no matter how many times youve seen it,26
roastedbagel,22,4,1qsm8t,15,,Serious Whats the smallest gesture that had the most profound effect on you,19
jjmastersword,31,5,1qs6bs,15,,Whats the sketchiest thing youve donesituation youve been in,20
Neosantana,79,9,1qrysr,16,The serious tag was just to avoid the inevitable Baby dont hurt me no more posts,Serious What is your personal definition of love,25
SteamySpoon,33,2,1qqyq8,16,,What is something a friend of yours does that you think they should feel guilty about but dont,18
derpydayz,47,2,1r8vlz,23,Doesnt matter wether or not you will be alive at the time,What is something you are NOT looking forward to in the future of mankind,25
Taybyrd,64,12,1r7opz,16,Assume there is an unlimited amount of material at your disposal Go,Whats the first thing you would make if you had a D printer,28
Hexodus,67,8,1r73fn,15,,What was the stupidest thing your SOex got mad about,23
redditoija,119,19,1r5rap,15,,Time travel is possible What band are you going to go see play live and why,34
EmersonikMusic,51,3,1r5jj1,16,,What is something you never see on Reddit,19
scarletsaint,128,13,1r4s8g,15,,What is the most insulting thing someone has said to YOU,28
JoeTuck,133,26,1r4j46,16,,Whats your favorite nonsexual feeling,42
CheifKief,42,2,1r3n6a,15,Just a general question of curiosity Maybe some people here can even help you out,Reddit what are you trying to get better at,17
DanMcallen,104,12,1r3lc6,17,,Men of Reddit who are your biggest man crushes,29
gogiroux,74,3,1r1beq,16,,Reddit what would you do if you caught an intruder in your house,19
Dubstyles,50,3,1r1236,15,,If you were to become a dinosaur what kind would you be and why,18
SDGuy,36,8,1r0xpq,15,My fiance said she would prefer it if I was cut Im considering it because I love her Tell me about it,Anyone been circumcised as an adult How was that,23
throwawaygult,44,10,1qzqn3,17,Hello seeing as I frequent this sub a lot I decided to give this question a try using a throwaway in no small part due to being ashamedIve been having a lot of issues as of a year or so when it comes to being a decent human being I dont like people at times I even despise them The only people I like are gone or unavailable to me Before things got like this however I was also a part of the herd doing stupid things without thinking of consequences I hurt someones feelings many years ago for no reason and never apologised for it The guilts been haunting me over this in particular next to a wall of other things for so long its almost always on my mind which is why I tend to keep busy in any way possible gotten to the point where Id rather do anything than think about the pastHeres my issue  apologising would fix nothing in my opinion Shes better off without me and Im not really a part of her life any more only a past thats irrelevant Opening up contact right now would do her no favours and I have no intention of causing her any more grief because shes a nice person unlike meTLDR Obvious solution to guilt is asking for forgiveness not an option available How do you  keyboard warriors gentlemen scholars and ladies  cope with your guilt no matter what the cause behind it Im having a tough time being a human being and could use a lesson,How do you get rid of guilt,27
pynchme,33,4,1qyz3o,16,This is a chance to share the wisdom of the ages,Do you have any pieces of wisdom that you gained from a parent or grandparent,20
SingOneForMe,22,5,1qyawu,14,,What is the best way youve found to make new close friendships posthigh school,19
RegretDesi,71,12,1qy4hc,15,If you dont have a pet cat pretend you doEDIT You do remember the dream and what it was like to be a humanEDIT PART TWO Dammit all of these make me want to be a cat Does anyone know where I can sign up,You suddenly wake up to find out that you are actually the pet cat of the person you believed to be yourself What is the first thing you do,27
killerontheloose,44,6,1qy42i,14,,What fictional situations do you put yourself in while thinking to yourself,20
noodletune,74,7,1qxysw,14,Preferably one that is available on Netflix or Amazon Prime ,What TV series do you and your SO watch together and both enjoy,21
kalifadyah,30,4,1qxuuk,16,,Have you ever had a near death experience,20
Selifa,49,6,1qxeqv,16,I have been reading askreddits all week and there are a lot of messed up stories about incest molestation sexual experimentation etc Do any of us get out of childhood unscathed ,Did Any One Out There Have A Happy Normal Childhood,22
tendsforgetstuff,30,15,1qwx75,15,,Why should lurkers stop lurking on Reddit and join in,30
Gfnation,35,3,1qwjms,14,,What is something weird that you do when youre nervous,17
CiliaMoss,61,4,1qvnyu,15,,Nonsmokers of reddit what do you think of people who smoke,19
Cshock,77,6,1qvhbg,15,I think Breakout Kings is what comes to mind for me I need new shows so lay em on me,What is the most underrated television show that you know of,21
GoopyChild,74,7,1qv7s3,16,,In  words or less what can you say to make someone punch or slap you,23
AzazelTheFox,31,6,1qv65h,15,Throwaways welcome as usual just be serious  Interested in what people consider to be their worst personal action and whether or not they feel regret,Serious What is the worst thing you have ever done and got away with,21
nateoroni,58,12,1qv5nt,16,Everyone has things about then that sucks,Whats the worst thing about yourself,28
slowwber,39,3,1qv08u,15,Most of your country will be watching you doing something famous but at the very end of your time on TV you have the chance to promote a particular product By doing so you get an unlimited supply of it for the rest of your life What would it be,You have  seconds of national TV time what product would you endorse so you get it free for life,18
durnsquiddly,38,9,1qsyig,14,,If we all threw our problems in a pile and saw everyone elses wed grab ours back Reddit whats your problem,23
Walnutterzz,24,5,1qs7ro,13,,Married redditors what is something youve done that you would never think about telling your SO,18
SpartasGreatest,25,5,1qrxev,14,Whether in public or when they thought no one was watching,What is the weirdest thing youve seen someone do,19
arshbot,49,19,1qrfpt,17,,What is the most fucked up thing youve ever accomplished in your life NSFW,36
ellendeclitoris,157,40,1r8mwd,14,Could be between you and a teacheretc,Reddit what is the most obscene dirty thing that a teacher you know of has been involved it NSFW,54
