author,comments,downvotes,id,score,selftext,title,upvotes
vertexvortex,2,0,1r90aa,4,Every example that I looked up seemed to refer to a displacement of heat energy as the conversion point.,Does a heat engine always require a heat differential? Or are there engines that work on ambient heat energy?,4
Magnaozi,3,0,1r8w0j,6,"Or are 50% of red blood cells ""sickle""?
And how does this help fight against the malaria plasmodium?","If someone is heterozygous for sickle cell anemia, are 50% of the Hb molecules in red blood cells ""sickle"" Hb?",6
WhatIfImIntoThat,6,3,1r8tbm,11,"Sources:

http://en.wikipedia.org/wiki/File:World-Population-1800-2100.svg

http://www.scientificamerican.com/article.cfm?id=fact-or-fiction-living-outnumber-dead

""And the U.N. predicts the world population will stabilize at 10 billion inhabitants sometime after 2200. At this rate, the living will never outnumber the dead.""

","Why is the the global population predicted to stabalize at ~10 billion when it has more than doubled in the last 50 years, and quadrupled in the last 100?",14
trevmiller,8,2,1r8r2g,9,"An article I recently read on the Mayo Clinic website states, ""Pregnancy stresses your heart and circulatory system. During pregnancy, your blood volume increases by 30 to 50 percent to nourish your growing baby. The amount of blood your heart pumps each minute also increases by 30 to 50 percent."" This leads me to believe that the circulatory systems of mom and baby are intertwined somehow. Is this true? Secondarily, if mom's blood is flowing through baby, what happens when, say, mom is Type A and baby is Type O?","Is a pregnant woman's circulatory system pumping blood through the baby? And if so, how does the body handle different blood types between mom and baby?",11
Zoolates05,4,1,1r8p24,1,,When DNA is copied where do the new nucleotides that create more DNA come from?,2
Penjach,4,2,1r8phn,6,"Right now, I am studying citric acid cycle, oxidative phosphorylation and other energy related cell mechanisms.  

Googling about, I realized that bacteria have evolved to harvest almost all conceivable energy sources. Furthermore, scientists have been able to modify some strands to ""eat"" some compounds they were not able before.  

Because the final step to all those processes is making local electrical potential difference that is then used to make ATP, I wonder if direct voltage, induced by a couple of electrodes, could be used by bacteria for their energy needs?  

Of course, I guess some nutrients like amino-acids and iron ions would be included in the substrate, but not glucose or fatty acids, except in very small quantities for cell membrane production etc.",Bacteria are able to harvest many compounds for energy. But are there bacteria that can live from electrical energy?,8
TechBuddha,0,2,1r86rk,0,How much can the stomach stretch? How can the digestive system handle a giant mass of food? What kind of bowel movements can you expect to have? Are there risks of blockages or dehydration? I'm curious how everything works. ,how does competitive eating work?,2
kirizzel,5,1,1r87g0,2,,"How come bitcoin can be anonymous, but peer-to-peer data sharing is not (really)? Can there be a data sharing platform, that is as anonymous as bitcoin?",3
kasihliyana,2,2,1r8crw,0,,How can using a steam bath rather than hotplate can cause an error in an experiment?,1
conogarcia,4,2,1r8fth,4,,What does knife sharpening at a molecular level?,6
josh95mx,2,0,1r8g1s,5,"With the addition of another Mud Volcano forming in recent weeks, could the eventual displacement of mud and earth cause or create the necessary environment to cause a tsunami should there be a collapse of the volcano? 
Just a though I had this morning on my way into work. Thank you for any input. ",Could a Mud Volcano's displacement of earth cause or create the means necessary to cause a Tsunami in the future?,5
BluthiIndustries,0,3,1r8hem,6,"Is there any distinctively unique neurological pattern of activity for recognizing one's own face (when seen in a mirror or some other reflective surface, or in a picture) as opposed to seeing someone else's face? Are different areas of the visual cortex active, or is it much the same as seeing a face that is not your own?",Do people have unique neurological activity when perceiving their own faces?,9
hmiemad,3,0,1r8gmf,5,"I know that gamma rays do not interact and go through most materials, except lead for instance. That's my silly question, thx.",[Physics] Is it possible to have a photon so energetic that it doesn't interact with any material we know?,5
Masquerouge,7,1,1r8gcu,1,"Let's have someone standing 50 feet away from me. It will be extremely easy for me to talk to that person and be understood. However, it would be impossible for me to blow air hard enough for that person to sense it.

Both sound and breath are interacting with the air; why are sound waves much more efficient at it?
",Why does our voice carry much farther than our breath?,2
clitbeastwood,5,4,1r88ue,4,"States that a colder body won't give up heat to a warmer body spontaneously.  Is it true because is hasn't been demonstrated false?
Statistically there is some probability of this happening though, right?

Studying made me think.",Why is the clausius statement true?,8
Kaphox,7,2,1r8ayj,10,,"Why can't ""normal"" televisions display 3D programmes and what do 3D televisions have that most non-3D TVs don't?",12
insertacoolname,6,1,1r8bbn,0,"We measure speed compared to things, a car relative to the Earth, but the Earth is orbiting the sun, which is orbiting the galactic core, but entire galaxies move. So how do we know if something is moving or not?",How do we know if something is moving?,1
anonymat,4,2,1r8bxo,5,"Also, why am I able to drive on a highway and have my GPS say I am 7 or 8 meters below sea level? Shouldn't that be covered by water? For what it's worth, I am located and drive throughout New Brunswick Canada, very near the coast. ",How is 'sea level' measured?,7
evildexter,2,0,1r8c16,6,I know that the input to the speaker is also responsible but i want to know the physical aspects.,What's the difference in the construction of a speaker that creates more bass and one that creates less?,6
FrogusTheDogus,8,0,1r8b8y,5,Or is it just birds? Thanks!,Are alligators and crocodiles actually living dinosaurs? Or did their ancestors just exist at the same time as dinosaurs?,5
octopodesrex,29,103,1r8ake,255,"According to the Wikipedia article crows exist all over the world except South America. Why is this when they and other corvids thrive everywhere else? Is there a predator, competitor or ecological reason they cannot live here? Did farmers exterminate them? I've always wondered!",Why does the range of crows not extend into South America?,358
anonymat,3,5,1r8apk,10,Does the gust stretch from ground to sky? ,What would a cross section of a gust of wind look like?,15
IKSSE3,8,0,1r89ry,6,"Sorry if this is a stupid question. I'm a freshman chemistry student, and we learned about the double slit experiment and the de Broglie equation not too long ago. Since matter also has wave properties, however minute, does this mean you could use destructive interference on matter like you can do with light or sound? If so, what would happen? ",Can destructive interference be used on matter?,6
ShaggyScri,1,1,1r8ahf,0,"Hey folks.

When you first start smoking, it's terribly uncomfortable. After a while it's no different than breathing air. What is actually happening in your throat? Do you just ""get used to it"", or does it damage nerves? Does it cause physical damage/scarring? I'm wondering because I know quite a few people that have quit for a anything from a few weeks up to a few years and when they start smoking again, they aren't coughing/hacking like when they first started. They get the rush like the first time, but their throats can still handle it. Is your throat permanently changed after you've smoke for a year or two? 

Short Version - Why does it get easier to smoke? What happens in the throat to make it easier? And how long do any changes/damage in the throat last from smoking?",What does smoking do to your throat?,1
Thepostman54,0,1,1r7wig,0,"I've been doing alot of research on 3D printers and came across a DLP printer. I understand they project an image of each layer per print at specific frequency of light but why are they so expensive? Why do they have to use DLP projectors? And how do they ""print"" each layer exactly? ",Howdo DLP 3D printers work?,1
surrealisticsense,10,9,1r7w97,6,"
The atmosphere is 78% Nitrogen and only 21% oxygen. So why is it that animals have evolved to breath oxygen, when there is more nitrogen to be had? There are some tree's that fix nitrogen through their roots, but are there any animals that are nitrogen dependent?",why do we breath Oxygen and not Nitrogen?,15
Dissentologist,229,475,1r7v5g,921,"I've recently been asked to donate blood... and was wondering why exactly we have different types... and what other than name, are the tangible differences?",Why do humans have different types of blood? And what do these differences actually mean?,1396
titsmcgee852,1,2,1r7s9w,4,,How did scientists work out that CFCs were the cause of the hole in the Ozone layer?,6
muscle3000,2,1,1r7rep,1,Are they derived from the poison/venom? What is the process like?,How are antidotes to venoms and poisons discovered?,2
Zeds_dead,2,0,1r7qtk,4,"I'm writing a paper arguing in favor of GMOs and Norman Borlaug's story is a great one but I don't understand whether what he did was just considered artificial selection and hybridization and what that has to do with the Genetic engineering we do now. 

[""Over the next three decades, geneticists developed techniques for extending Borlaug's work by altering crops at the genetic level, resulting in what are known as GMOs, or genetically modified organisms.""](http://www.nature.com/scitable/spotlight/gmos-6978241) - an article found on Nature.com
","How was Norman Borlaug's work on developing wheat related to what we now consider ""Genetic engineering""?",4
Soluble_Fish,11,44,1r7q41,125,I'm very curious about this and information wasn't forthcoming after some internet searches.  Can any behaviorists or geneticists weigh in?  How is it that genes code for the instincts present in new offspring or what is our current level of understanding?  ,What is the genetic basis for instinct? What do we currently know about how genes influence innate behavior?,169
Marduk28,0,2,1r7o3s,4,"So I read that caramel colors used in food are categorized into 4 categories:

* Class I Caramel Color (no additives low sulfites) · 
* Class II Caramel Color (sulfite additives very high sulfites) · 
* Class III Caramel Color (ammonia additives low sulfites) · 
* Class IV Caramel Color (sulfite and ammonia very high sulfites)

I am having a hard time finding information about what the Sulfite and Ammonia do in classes II to IV. 

I read something vague about them changing the flavor and being used in different food applications, but I was hoping to know more about what they do chemically. 

**TL;DR:** Why add Sulfite or Ammonia to caramel color? What is the purpose? ",Question about caramel colors in food.,6
m0nkeyface_,3,2,1r7hch,4,I know that was poorly worded but I can't think of a better way to word it so I'll hopefully explain better here. I found out a long time ago that the asteroids making up the asteroid belt are actually incredibly sparse and nothing at all like I initially imagined them. Can the same be said for the rings of planets like Saturn?,How sparse are the rings of Saturn?,6
Mercfh,4,0,1r72is,4,"Like.....I for some reason have always had this paranoia of having a rectal prolapse. Why? I honestly have no idea. I don't really have constipation or diahreeha although I strain sometimes but not like often at all.

But what exactly is preventing me from basically pooping out the last part of my intestine? and what causes this to weaken?

Also why do women suffer prolapses more?

Thanks",What holds our Rectum up when we use the bathroom? How are we not just pooping them out?,4
SadBrontosaurus,3,6,1r847u,7,"One specific example is skin color and eye color. If someone black and someone white reproduce, their child will have light skin. But if he has blue eyes, and she has green eyes, the kid doesn't have turquoise eyes.","Some traits mix, some don't. Why?",13
jimustanguitar,4,3,1r845k,6,"It is my understanding that light always travels at the same speed, and not only that, but it is always observed at the same speed regardless of the observers speed (time and space shift instead)...


If that is true, how is it that we can observe the phenomena of Red Shift and know that our Universe is expanding?


I'm not questioning any of these facts, I accept them all as scientific truth, I just don't understand how the wavelength of the observed light changes if there isn't a change in speed.


Any way to wrap my head around this one?",Speed of Light vs Red Shift?,9
SkyDolphin99,10,30,1r841l,35,"How would they be placed in a circuit and what effect would they have on that circuit? Could anyone also give me a good idea of a circuit that would demonstrate a capacitor? I'm just don't know what this component really does. I know that it stores charge, but that's about the limit of my knowledge on capacitors.

Help please?",How do capacitors work?,65
thephoenix5,3,4,1r833i,0,"When a bottle cap is very tightly sealed, often the bottle can go from ""This is never getting opened, get the power drill."" to ""my grandmother could open that"" by simply placing a thin towel over the bottle cap. Why? Is this due to increased friction giving a better grip? The minuscule additional thickness acting as a lever? What's going on? I feel like if it was the former my grip should be slipping, (which it isn't) and the towel seems far too thin to make much of a difference in the latter case. Any ideas?
",Who do towels make bottles easier to open?,4
mizzoudavis,8,1,1r7xrc,3,"In light of the FCC changing its rule on cell phone use in-flight: as a frequent traveler I've forgotten to power down my phone many times and I never receive a signal when I'm in mid air. If I'm 35,000 feet in the air, shouldn't I still get a signal from the ground towers? ",Why don't I receive a cell phone signal when I'm on a plane?,4
zwirlo,68,122,1r7mfl,269,"Otherwise, if E=mc^2, then does mc^2 =E?

It would take an enormous amount of energy to create sufficient amount mass, obviously, if the equation's inverse was true.

I've heard of [Planck Temperature](http://en.wikipedia.org/wiki/Planck_temperature), when the wavelength of energy is equal to Planck length. According to that, laws of physics don't say you can't have that much energy, even though any more would be shorter than the shortest possible distance. Now for the relevance...

Could it be possible, if there is that much energy, that it creates mass? That was a far-fetched theory that is very much improbable that I concocted, but I might as well suggest every slight possibility, right? I'm sure this question has been inquired before though, I'd still like to get an answer.",If energy is created from a slight loss in mass. Can a lot of energy be used to create mass?,391
AngryFinn,7,2,1r7qcs,1,"I messed up the title, sorry. You are standing in the back of the boat. I got the question from a contest in school and I don't know the answer for it. We got first though.","If you throw a ball upwards on a moving boat and with no air resistance, where will it land?",3
Witvviky,2,2,1r77hw,10,".gif related (Warning: mild gore): http://25.media.tumblr.com/aa12293fcd1af68b578aaf86e2c4cb8c/tumblr_mw8zrhxdQ51qga4pio2_400.gif

Breathing out as hard as you can, how much can a human being deflate their lungs? Can we deflate them 100%, to the point where there is absolutely no gas remaining in the lungs? Or is it impossible to squeeze them any smaller past a certain point?
",To what degree can a human being intentionally deflate their lungs?,12
DoctorProfessorson,9,6,1r7hb8,20,"These functions, like again for the normal function, do have a derivative right? Doesn't that imply there should also exist an integral? Will we ever able to solve these in the future?",Why is it that we cannot analytically solve some integrals like for the normal function and have to do it numerically?,26
GVDB,14,27,1r7ivu,36,"I am under the understanding that the moon is tidaly locked to earth, what does that mean and why has this arisen?",What does it mean to be tidal locked to something?,63
the_hypotenuse,14,12,1r7l11,16,"Because it conducts heat so well, I would expect it to 'receive' the heat energy from the air far more readily than other materials such as wood and plastic, yet wood and plastic feel warmer to the touch than a piece of metal in a 20°C room. Why is that?","A property of metals is that they conduct heat. If that is the case, why do they feel cold at room temperature?",28
proBICEPS,4,2,1r7i1w,1,Im just curious what happens on a molecular level when a living body is exposed to really cold temperatures.,"If temperature is just the amount of ""jiggling"", then why are negative temperatures so detrimental to living matter?",3
waveform,11,6,1r75ya,25,,"The ""MAVEN"" Mars mission is going to try and detect methane in the Mars atmosphere. Why can't we do that from here with spectrography?",31
matiasve,11,8,1r7cxp,11,,"Why can dogs be (fed) vegan (food), but cats can't?",19
The_Brutally_Honest,32,21,1r7e4c,37,Is it better in all situations (off road vs snow vs ice vs etc.)?,Why is rear locking differential better than four wheel drive?,58
trainxtrain,4,1,1r737x,1,,Why can't humans raise the hair on their head like animals raise their fur?,2
bunguin,5,3,1r7531,19,"When we receive signals with our sensory neurons it has to go through a number of steps, so does that mean everybody's senses are universally delayed? Does this time lapse differ from person to person?","Since the transmission of body signals isn't instaneous, does that mean everything we experience is slightly delayed.",22
iorgfeflkd,3,0,1r74bj,2,"In classical mechanics, we have Bertrand's theorem proving that the only stable orbits are for a harmonic or Coulombic potential. In quantum mechanics, the only non-trivial potentials for which a closed form solution can be written are the harmonic and Coulombic. Are these related?",Is Bertrand's theorem related to solvable solutions of the Schrodinger equation?,2
verticalsport,4,3,1r734s,8,"Hello askscience, I am a chemistry undergrad in an analytical/instrumental chem course, and just learned about one of my professor's research topics that is a method with detection limits theoretically in the parts per quadrillion, which got me thinking.

 I was wondering: what is the most accurate measurement technique out there? In terms of detection limit, or measurement uncertainty, or whatever. 

I realize that I'm asking a question that could be taken several ways, as you can have accuracy in looking for a concentration, a distance, or a whole host of other things, but I feel like it would be really cool to hear about things from a variety of fields. Thanks all!",What is the most accurate measurement?,11
TheUnoriginalPoster,3,1,1r7118,2,,What exactly causes bubbles to burst? Heat? Contact with another surface? I want to know!,3
_loki_,17,17,1r72ls,39,,Humanity's dominant sense is vision - why then does a significant proportion of the population have poor eyesight?,56
Browngrocerybag,5,2,1r72q2,7,,"If there earth was flat, there were no objects in my way, and no haze, how far would I be able to see?",9
BABYMak3r69,2,2,1r72q9,3,Why does you neck make cracking sounds when you stretch it?,Why does you neck make cracking sounds when you stretch it?,5
ibs_q,30,64,1r72qt,127,"Edit^2 : *Was not seeking medical advice. Sorry mods.* **What I mean to ask is... if antibiotics taken for sickness were to disrupt digestive processes, what effects might be seen on digestive processes? For example, why might digestion get worse, or why might digestion get better?**  ","When people take antibiotics for sickness, does it also clear their gut fauna and disrupt digestive processes? Do they still digest food?",191
doomybear,2,1,1r70u0,7,"I know that this is a kind of weird question to ask, but I thought I would at least give it a go. I know that birds tend to eat seeds and kernels. This makes sense: Complex carbohydrates are high in energy density and offer nutrition over a longer period of time than simple sugars (although hummingbirds make better use of nectar, apparently), and as far as I can suppose, it's not advantageous to be weighed down by heavy foods or fat storage when birds have to fly.  
  
  I'm finding it a lot harder to find information about other mammals and their consumption of starch. If it's not a bird, complex carbohydrate consumption seems to be opportunistic instead of a dietary staple. I think pigs seems to be okay with a starchy diet. Do omnivores, in general, have the adaptations to eat starch regularly?  
  
  The other question is about what happens to other animals if they are put on a complex carbohydrate diet. The only studies I know concern corn-fed cows, in which the trade-off is from grass to corn. Just from wikipedia.org, corn-fed cows have a more acidic digestive process, leading to a more virulent strain of E. Coli surviving in their intestinal tracts. Corn-fed cows are also fatter. Would other herbivores suffer comparable complications? How about frugivores and carnivores? What about reptiles, amphibians, and fish?  
  
  Thanks in advance!",Complex carbohydrate consumption in non-humans: What other animals have high starch diets? What happens when you introduce high starch diets to animals whose usual diet does not contain significant complex carbohydrates?,8
mynameishere,6,7,1r70oa,5,,What was the speed of sound through the material comprising the universe in the first moments of the big bang? Could it have been faster than light?,12
Jtwelv,15,1,1r6ymz,7,"Electric heat blankets to transmission lines. As far as my understanding goes emf is produced from alternating current. That said, dc power sources should have no such effect.

Also there are advertisements for anti-radiation pads, yet I was taught nothing could interrupt emf waves. ","Electromagnetic radiation and its alleged negative health effects. A hoax, or legitimate.",8
Hunterlanier03,2,0,1r6xvg,2,"For example Carbon can be in a crystal structure that forms graphite but an other will form a diamond to change the structure of graphite to that of diamonds you need 45-60 kilobars of pressure (aprox. 834,000 psi) and the temp of the graphite to reach 900-1100°C . Would doubling the temperature to 2200°C haft the required pressure to 23-30 kilobars?",Can you change the crystal structure of an mineral to another minerals structure when you dont have enough pressure but more than enough heat?,2
TheGreggors,3,3,1r6hfl,0,"I recently watched an episode of House (Season 5 finale, episode 24, Both Sides Now) and there's a lot of discussion of what the left hemisphere controls/does, versus the right hemisphere.

I was just curious what each hemisphere does and how it affects an individual with said hemisphere being dominant.

(Not sure whether to label this as Psychology or Neuroscience. Sorry.",What does the right hemisphere of the brain control? What about the left brain?,1
Fourgot,97,506,1r6u2f,972,,"If ""fracking"" causes small earthquakes, and if small earthquakes can relieve some of the stress at a plate boundary, can fracking be developed as an earthquake mitigation technique?",1478
KiwiDalaiLama,15,7,1r6xdz,22,"So, this probably sounds a bit odd. When we stare at the sun, we are looking at light from 8 minutes ago. The sun could explode and we wouldn't know until 8 minutes. So with this understanding, is it possible to see so far out into space, where the light would take 13.8 billion years to reach us? Or is the universe not that big? I know this all in theory, but my mind loves to wander like this. Just the concept of it blows my mind.
Edit: minor grammatical changes","Is it possible to see so far into space, you can see the big bang?",29
nhomewarrior,1,0,1r6kn2,2,"If the two planets in question are orbiting each other in a binary system with extremely low periapsis (several hundred kilometers or less), low enough that their atmospheres collided but their surfaces did not, what would happen?

Would they just shed off gasses into the surrounding space? Would they create friction on each other? How would they interact in such a situation?","If two planets, similar in size and both with dense atmospheres, were to come close enough in their orbit that their atmospheres passed through each other, what would be the outcome?",2
PirateGloves,5,0,1r6e8s,3,"This was really tricky to put succinctly in the title.

I did a search but didn't quite find what I was looking for.

Okay, so from what I've read we're hurtling through the universe at 370 kilometers per second relative to CMBR and from what I understand time moves slower the closer you get to the speed of light. So, given that we're moving, how slowly are we experiencing time, relative to an observer who is stationary to CMBR?","At what rate are we experiencing time, relative to CMBR?",3
