author,comments,downvotes,id,score,selftext,title,upvotes
AlbirdEinstein,1,2,1qjuqi,8,"I know there are bacteria which prefer acidic environments (helicobacter) and that bacteria maintain an almost neutral ph regardless, but do we see bacteria ever favoring a high ph?",Are there any bacteria that primarily live in a basic environment?,10
mknlsn,4,2,1qjze8,7,"When I view LED lights in my rearview mirror, they appear to be bouncing almost as if they're attached to springs. Incandescent and HMI bulbs don't seem to have this effect.",Why do LED lights on cars appear to bounce around in my rearview mirror?,9
helixar,4,1,1qkbx9,5,I have always been wondering this. What is the cause of it? Is it a condition since birth or something developed? Can it get fixed through surgery or treatment? Do people with cross eyes see clearly?,What causes people to be cross eyed?,6
ujustdontgetdubstep,4,4,1qkbfe,22,Is the water pressure at a given depth in a tall narrow cylinder the same as the water pressure at the same depth in the ocean?,Is water pressure at a given depth a function of the size of the body of water?,26
aljady,1,2,1qjmhy,2,"Going back in the history of the Earth at which point would geologists say ""not my field anymore, go ask an astronomist/astrophysicist""?

In general how is the study of the point at which a planet becomes a planet and not just a bunch of rocks flying around organized? Do you need a background in geology, astrophysics, both, any? Is it the kind of area of study where you find a lot of interdisciplinary collaboration or on the contrary conflict?",At which point in the history of the Earth does geology begin?,4
roboguy12,2,3,1qjo5n,3,"I saw in a video that cats use their tails to provide rotational inertia which allows them to land upright, but is there any evidence that supports why other animals have tails, and why certain others (such as humans) don't?","What (if any exist) are the evolutionary advantages of tails, and why do some animals not have/don't need one?",6
DogOfSevenless,11,5,1qk0v9,27,,Would it be possible to have an ocean so deep that the sheer pressure forces the water at the bottom to freeze?,32
GooberCity,1,0,1qk4uj,5,"Is it possible to pass a laser, UV wave or visible spectrum wave through, lets say, an imperfect, inelastic sphere full of 99% water, 1% varying solutes and measure the pressure inside of it? 

If you had a 'normal' sphere at 'normal' pressure, could you at least find a relative difference between that sphere and spheres of different pressures?  

Does the index of refraction change in a liquid that is almost negligibly more pressurized? Maybe the degree of light scattering?

I'm talking pressure differences between, lets say, 10 and 15 mmHg.  Small stuff.  

Part 2 of the question: what if the solute concentration correlated to the increase in pressure.  I would have to assume that light absorbance would change and thus a relationship could be formed this way? 

Thank you for your borrowed and infinite wisdom friends-",Measuring pressure change with light,5
toomanycans,11,1,1qk2h2,6,,"If water boils and evaporates at 100 degrees Celcius, how do my clothes dry on the washing line at a much lower temperature?",7
TitansBastard,1,1,1qk4l7,7,I want to know what dimension of rotor size and rpm is most optimal for a small helicopter that weighs around 50-60kg (110-130lb). I am also curious to know if its better to have more rotors kind of like a quadcopter for stability and if you are able to have the same stability with only two rotors.,How does one calculate the required rotor sizes of a helicopter?,8
Danwest123,22,41,1qkalu,59,"I read somewhere that one puff of smoke contains about 10^15 free radicals including Nitrogen monoxide and dioxide. Is it the free radicals that causes the mutations, or am I just overthinking it?",How do cigarettes cause cancer?,100
ItchyCephalosaurus,31,46,1qkb2r,98,"I was reading an article on fusion, specifically about MIT's Alcator C-mod reactor. It mentioned how they use plasma to prevent the walls from melting under the intense conditions and gave this:

&gt; Indeed, Nobel laureate Richard Feynman once described confining plasma within a tokamak as trying to hold Jell-O with rubber bands: it's possible, but it's taxing and you'll probably lose at least part of the Jell-O.

I realize plasma is it's own type of matter, but I'm curious why it's particularly difficult to work with as it is essentially an ionized gas, correct? I looked at a design picture of a tokamak and it seems like it's a donut shaped vacuum tube, so I was failing to see why that couldn't trap a gas..though I suppose it isn't technically a gas.

Thanks for any information provided!",Why is plasma hard to work with?,144
gregory1234,3,3,1qk5ru,14,"I recently learned about memory B cells and how they're stored after an infection for future use, possibly in the bone marrow. But how does the body know how and where to store those cells? Also, how are they then summoned again to fight future infections?",How are memory B cells stored once they've been created after an infection?,17
ApostropheD,6,3,1qk79s,10,"Reptiles like aligators and snakes live down south, I'm just wondering what lives up here with me. ","Since swamps in the Northern US are relatively cold and swamps in the Southern US aren't, what type of animals live in them?",13
Justicles13,470,1673,1qk9l4,1964,"With the atmosphere constantly changing, how far back would you have to go before it is unbreathable to humans?

From [this](http://www.yale.edu/ynhti/curriculum/units/1991/6/91.06.04.x.html#c) article, it says that our atmosphere has been ""maintained"" more or less since the atmosphere became oxygen rich about 1.4 billion years ago.

Also, I am aware that during the carboniferous period, the Earth had a much higher oxygen concentration, and that ended ~300 Million years ago, but I'm not sure if that means it's too high for humans 

Edit: thanks for all the replies everyone!! ","Theoretically, what's the farthest back in time a human could travel and still safely breathe the Earth's atmosphere?",3637
supah,32,22,1qk88k,56,"By ""we"" I mean first scientists who would confirm it, cause it's fairly obvious that public would be informed much later about it.
","If there's an asteroid on course that will surely hit the Earth, causing mass extinction, how soon before the impact will we know about it for sure?",78
LolYoureAGrape,4,4,1qk7qy,2,"Do the pros outweigh the cons at the time, for every action or decision we make? ",Do we only make rational decisions?,6
flameboy050,9,6,1qk7ln,14,"I know this might be a stupid question ,but why does food need to rotate  in a microwave ? If the principle is to use radiation to heat the food shouldn't it work while the object is stationary ?","Does food need to constantly rotate in microwaves ? If so ,why ?",20
garrettj100,1,4,1qk7kc,0,"A *Great Circle* I already know is a circle which circumnavigates the Earth.  Put another way, it's a circle with the same diameter of the Earth, **on** the Earth.  Obviously, there will be times that clinical definition falls apart due to changes in elevation:  Sometimes it'll hover above Death Valley or Everest or whatever.  But enough about what I **do** know.  Here's what I **don't** know:

*What Great Circle circumnavigates the Earth while staying over land for the longest fraction of the time?*

To make it simpler, you can forget lakes and tides:  Lakes and rivers are just land and the tides we assume just to be wherever they average out.",What Is the Dryest Great Circle on Earth?,3
BesottedScot,4,2,1qk7by,0,"I guess what I'm wondering is that if humans are mammals why couldn't a doctor operate on other mammals?

It might be a stupid question but I'm curious.","If humans are mammals, could a doctor theoretically work on another mammal? Why must you be a vet?",2
TheMagicHorsey,17,6,1qk79r,34,"Imagine you have two individuals A and B, and you have the complete DNA for each.  Can you tell if its the case that A is the father of B, or that B is the father of A, only from the DNA?","If you know two individuals A and B are related, where one is the father and one is the son, can you tell by looking at the DNA which of A and B is the father?",40
puffmonkey92,10,14,1qjrod,55,,"Can Iron exist in the ""steam"" or ""vapor"" state? Can Helium be frozen solid? Is there enough energy to do either of these things?",69
Chemfan,7,1,1qju7h,15,Are these jets just made up from matter that moved away just before it crossed the event horizon? And why are they always alongside its axis?,How does a black hole create jets?,16
midsprat123,9,3,1qk5mw,4,"I play KSP and live in Houston so I love space and aeronautics. I realize my question is probably almost impossible to achieve but this is always on my mind when I see posts about docking. 

What would happen if a ship on a ballistic trajectory, i.e. not in a stable orbit but just reaching apogee were to somehow dock to a vehicle that is in orbit. Would they both be pulled down or would the ships just rip apart",What would happen if two ships were to dock if one is in orbit while the other is on a ballistic trajectory,7
Saminthu,2,1,1qk5ke,15,"OK, so, I admit I don't know much about the Panama canal. I just know that it opened up a shortcut through South America when ships once had to sail all the way around It. But this makes me wonder about the marine life. I would assume the ecosystems on either coast would be extremely different from one another since they have been separated for so long. So when this new passageway opened, allowing sea life to freely travel to the other side, did this cause any devastating environmental effects? Were new invasive species introduced? Sorry if it's a dumb question, bear with me. Thanks.",Did the Panama canal cause a strong environmental impact?,16
Samus_,9,4,1qjnuo,0,"I've read that it's not possible to determine an absolute static position* due to the fact that every speed measurement is relative to the observer.

\**it seems to be called ""absolute reference frame"" according to some other posts*

I've also read that speed and time operate as a 4D vector of constant length (for unknown reasons) and that the faster you move in space the slower you move in time.

would it be possible to measure the difference between time dilations for different speeds/directions and determine some values for *x*, *y*, *z* that maximize *t* which in turn could be considered the absolute reference frame? if not then what is it? does such thing even exist?

the answer is probably way over my head but I'll ask anyway :) thank you.",what is the velocity for which time passes the fastest?,3
medsteven86,3,1,1qjp06,14,,What are the long term effects of positive pressure ventilation as opposed to the normal negative pressure used to inflate the lungs?,15
AnDan28,3,0,1qjp2w,6,"Or, how did the circulatory system come about through evolution?",what were the first organisms to develop a circulatory system?,6
barkrawr,11,15,1qjs4p,41,,"If a door has three hinges, are the forces on each hinge (top, middle, and bottom) identical?",56
ecneralc,1,1,1qjqyv,6,,Is there an easy way to determine if a reaction will be Sn1 or E1? How do you rate leaving groups and nucleophiles?,7
ZadocPaet,6,7,1qiqfu,0,"Second part of the question. Right now, we classify binary TNOs as a TNO + a satellite, (whichever is smaller gets the latter designation), however, if the above described scenario were found to be true, wouldn't we need to reclassify several objects as binary objects, where two bodies are really one? Logos-Zoe comes to mind, as does Pluto-Charon.  ",Would it be possible for a binary Trans-Neptunian object to have a natural satellite that orbits the center of gravity of both objects?,4
Poddster,3,0,1qja8u,8,"When explaining the concept of number bases other than decimal to someone else (e.g. binary, octal, hex), I suddenly thought about the notion of *bitwise operators* and if they exist in other number systems. Naturally I didn't let that thought be part of the explanation, as I didn't want to confuse. 

So now I get to confuse you, ask science. 

3 examples of bitwise operators are `AND`, `OR` and `XOR`.  An example of their use:

|AND | 0 | 1  |
|---|--|---|       
| 0 | 0 | 0 |
| 1 | 0 | 1 |       

|OR | 0 | 1  |
|---|--|---|
| 0 | 0 | 1 |
| 1 | 1 | 1 |

|XOR | 0 | 1  |
|---|--|---|
| 0 | 0 | 1 |
| 1 | 1 | 0 |

(similar to a multiplication table or an addition table).


The question is: Does such a concept of bitwise (or I suppose digit-wise) operator exist in other base systems? Are there any operations in decimal that operate across pairs of digits in equal-length numbers? What about any other exotic bases?

Note: I'm not talking about doing something you might see in programming languages, e.g. in C `244 | 1` or `0x100 &amp; 0xFFF`, as those decimal and hexadecimal literal operands are still operated on in terms of binary bitwise operators, rather than in terms of decimal or hexdecimal digitwise operators. They're simply 'converted' to binary first (in as much as they're never not binary in a computer system, but I hope you get my drift)

So in decimal:

|??? | 0 | 1 | 2 | 3 | 4 | 5 | 6 | 7 | 8 | 9 | 
|----|---|---|---|---|---|---|---|---|---|---|
| 0  | ? | ? | ? | ? | ? | ? | ? | ? | ? | ? |
| 1  | ? | ? | ? | ? | ? | ? | ? | ? | ? | ? |
| 2  | ? | ? | ? | ? | ? | ? | ? | ? | ? | ? |
| 3  | ? | ? | ? | ? | ? | ? | ? | ? | ? | ? |
| 4  | ? | ? | ? | ? | ? | ? | ? | ? | ? | ? |
| 5  | ? | ? | ? | ? | ? | ? | ? | ? | ? | ? |
| 6  | ? | ? | ? | ? | ? | ? | ? | ? | ? | ? |
| 7  | ? | ? | ? | ? | ? | ? | ? | ? | ? | ? |
| 8  | ? | ? | ? | ? | ? | ? | ? | ? | ? | ? |
| 9  | ? | ? | ? | ? | ? | ? | ? | ? | ? | ? |

What would go in place of the question marks? 



",Do bitwise (or digitwise) operators exist outside of binary?,8
treeMan1618,1,6,1qj31m,11,,What are the long-term psychological effects of corporal punishment (according to research)?,17
ObviouslyAltAccount,34,8,1qj3nv,18,"I was thinking about this due to the post the other day about the caloric content of alcohol. If it really contains 7 calories per gram, then wouldn't hardcore alcoholics be morbidly obese? Say they drink a gallon or even half a gallon of vodka per day, for 80 proof vodka that's either ~8000 calories for a gallon or ~4000 for half a gallon, and for 40 proof that's ~4000 calories for a gallon or ~2000 for half a gallon.  

So, maybe if you drink half a gallon of 40 proof vodka and don't eat anything else, you won't get morbidly obese, but anything more than that and it seems you'd be getting a lot of calories. I mean, calories are calories and will be converted to fat regardless of the source, right? 

EDIT: For those who think half a gallon to a gallon is too excessive, for reference look at this guy: http://www.huffingtonpost.com/2012/12/31/drugged-high-organs-hurt-vodka-video_n_2386452.html. He drank 3 pints of vodka a day, nearly half a gallon, for apparently 4 years. I would be surprised if he's the worst alcoholic ever as well, so I don't think it's a stretch to say that some **severe** alcoholics could drink half a gallon to a gallon a day. ","If severe alcoholics drink a lot every day, why aren't they morbidly obese? Does alcohol really contain a lot of calories?",26
MrQuinnLord,6,3,1qj4wj,5,"If reflection of light has to do with the objects Work Function being extremely low, allowing photons to remove electrons, them subsequently falling back to the nucleus thus releasing the same Light.

And transparency is a high work function such that the photons cannot match it, and thus pass through.
How can glass be both?
(These are my understandings, I may be completely wrong)
Sub question, if you changed the frequency of an electro magnetic wave, would the colour of the object change to an on lookers perspective?",Isn't reflection and transparency mutually exclusive? (what's glass's deal?),8
EchoECMO,24,2,1qjamw,9,"If someone is in Cardiac Arrest, they're dying due to lack of ventilation and circulation due to their heart not pumping. Lets say a huge MI caused the onset of arrest. Why can't they hook them up to ECMO or bypass and allow them to live that way until they can fix the MI that threw off electrical conduction in their heart? Surgeons stop hearts all the time for heart operations as well as heart transplants. ",Why isn't ECMO / Bypass used for resuscitation in Cardiac Arrest?,11
bearwithwidecanyon,0,2,1qjbxx,5,"Why is the effect of Taylor dispersion (i.e. an increased effective diffusivity due to shear flow) more pronounced with a higher Peclet number?  This seems a bit counter-intuitive to me, since the Peclet goes as 1/D.  ",A question about Taylor dispersion.,7
datcrazybok,1,1,1qjc1g,7,"In Arizona, we have the Petrified Forest, where the trees have turned into stone. At least, to my simple understanding. Why didn't they fossilize instead? Can stuff other than trees, like animals, or other plants, petrify? 

",What is the difference between turning into a fossil and petrifying?,8
YettiRocker,1,2,1qjd4i,5,What do experts expect to see once the effects of the 11-year polarity flip reach the Voyager probes? How will it differ from what we saw 11 years ago?,What changes in the Heliosphere/pause will Voyager 1 &amp; 2 observe once the Sun's polarity flip is complete?,7
Shaneypants,108,256,1qjdbr,610,"Here's a diagram of the [visible part of the electromagnetic spectrum](http://www.pl.euhou.net/docupload/files/Excersises/WorldAroundUs/Spectroscope/Spectra/VisibleLightSpectrum2.jpg). And here is a [""color wheel""](http://i.stack.imgur.com/apXPF.jpg), like one you would look at when mixing paint. Why do I perceive violet as ""reddish""? It seems to me like it would be better if my eyes and/or brain perceived them as completely different colors!","Why does red look like violet? -- The color spectrum is linear, moving from red as the longest visible wavelength to violet as the shortest, so why do we see red and violet as similar, like in a color wheel?",866
vernes1978,1,0,1qj87s,6,"[This article](http://gizmodo.com/scientists-have-made-bullets-out-of-light-1462977639) talks about a shaped lightpulse which maintains focus due to a ring of light around it.  
What mechanism causes this ring to help maintain the pulse's focus?",What mechanism causes this light pulse to maintain focus due to the 'ring' around it?,6
James_Ch,7,2,1qj5px,8,"Why is it that sometimes when you are moving, let's say in a vehicle for example, when the vehicle stops, and you look at a stationary reference point such as the ground, you feel like you keep moving when in fact both you and your reference point are standing still.I know that it has something to do with a liquid in your ear but I need more information, thanks.",Feeling of movement when stationary? Ex. in a moving car which stops.,10
sashebalchev,34,17,1qj7y1,45,Since I was in school I was wondering this - if you are strong enough can you break your own bones by just flexing your muscles? What I mean is when you stretch your out and keep pushing you can feel a lot of tension in the elbow. Is it possible to break this joint just by stretching your arm hard enough?,Can you break your own bones using only muscle strength?,62
chadderbox,167,655,1qj9pa,486,"I was just reading the deep sea gigantism thread, and there was a comment which mentioned that water is not very easy to compress compared to other things like air.  I've found other sites via search engine which suggests that water being polar has a bearing on it, but it doesn't get very specific beyond saying so.  The site I found also suggests that polarity is why water expands in volume when in ice form, but again doesn't really elaborate which I'm hoping someone here can do.  Thanks!

Edit for grammar, and also to clarify that **I understand the difference in compressability between a liquid and a gas (very poor question wording on my part!)**, but **I'm more specifically interested in what sets water apart (if anything) compared to other liquids and why it expands when it becomes a solid while other liquids don't.**  ",Why is water so incompressible compared to air?,1141
defaultpath,54,95,1qj8us,128,"I'm seeing reports pop up that a patent filing indicates that aspartame is (at least partly) derived from the waste of E. Coli, so of course everyone that sees it is jumping on this ""you're eating bacteria poop!!!!"" bandwagon. Can someone put this in perspective for me? Are there lots of other things - medicine, food additives, etc. - that are similarly made? I understand E. Coli itself winds up in pretty much everyone shortly after birth, hangs around in our intestine and actually helps us, but otherwise I'm less-than-informed about this topic.

EDIT: Sorry if I categorized this wrong; wasn't quite sure what to pick.",Aspartame made from E. Coli waste? Is this as bad as it sounds?,223
cheline3,11,18,1qizy5,28,,What stops a battery from being recharged forever?,46
yetifaerie,16,26,1qiwk3,59,"I saw this [YouTube video](http://www.youtube.com/watch?v=oJfBSc6e7QQ) via /u/Kopirefuto's comment. If that were accepted as fact, what would cause all that water to cover as much of the planet as it currently does? It looks like initially, there was not very much water on earth. Now, the oceans are huge and so deep. Where did all that water come from? Some sort of chemical reaction in the atmosphere? ",Where did all the water on earth come from?,85
howbigis1gb,5,23,1qiv81,51,"I don't know why - but that just doesn't seem right to me. 

I've been taught that each ring corresponds to a year, but is it true? Are there variations? What's so special about a year? How would seasons affect it?",Do tree rings always correspond to a year?,74
Matti_Matti_Matti,49,86,1qirc6,155,"EDIT: Also, videos look terrible, too. Is that for the same reason?","When I watch a TV programme from the 70s or 80s on my HDTV, it's blurry almost to the point of unintelligibility. Is that how it looked back in the day? Am I misremembering my youthful TV experiences? Did we not notice the blurriness?",241
thismaynothelp,10,6,1qikhc,18,"To clarify, [this is the picture—GORE warning, obviously](http://www.antimicrobe.org/new/printout/e12printout/e12diag/e12the17.jpg)—that got me wondering. Does something else go in there, around all that?","Surgery question: When a patient is opened and then sewn back up, what happens to any air that is left inside? Or does the surgeon make sure there isn't any?",24
calalah,22,2,1qi3se,7,"For example, 0.012 is two significant figures by what my teachers and textbooks have said, but in my head, 0.012 can't somehow be the same as 7.812, just with less significant figures. Sorry if my description of my point of view is bad.

Logically in my head, the leading zeroes still define what the first part of a number is, since the significant figures should start at the largest digit and move down from there. Can anyone explain how this idea of significant figures works?","In significant figures, why are leading zeroes not included?",9
duncanispro13,4,1,1qi1l8,3,"In chemistry we were talking about the PT, and metals and non-metals. But what I'm wondering is what constitutes a metal? On a chemical level?",What makes something a metal?,4
talkstojeebus,7,1,1qhufm,6,I got into a discussion with a friend about Glutamine's potential role in [anxiety related to alcohol withdrawal](http://science.howstuffworks.com/life/human-biology/hangover5.htm). he became concerned about his use of the supplement L-Glutamine. I tried to tell him they are very much NOT the same thing. But I'm no scientist. Can someone help me to explain?,Can someone explain the differences between Glutamine and L-Glutamine?,7
honkaboy,3,1,1qhs1z,6,"Conductors in a coil typically exhibit inductance.  Why isn't this an issue for wound capacitors?  I've got a guess but I wanted to see if anybody knew for sure.

My guess: the two plates are wired such that the magnetic field generated by the current flowing into the positive plate is roughly cancelled by the magnetic field generated by current flowing *out* of the opposing plate.",Why don't wound capacitors have significant inductance?,7
charliemcdougal,4,2,1qht1v,9,,"Are the ""ropes"" of lightening that appear brighter and thicker carrying more voltage than the smaller ""ropes""?",11
astrong621,5,3,1qhvhp,1,,How does a sandbag stop a bullet when other things can't?,4
George_E_Hale,16,40,1qhwe5,89,"There are small versions for cars, home versions about the size of a space heater, and even, here in Japan, mini-versions you can carry around with you in your hand. My bullshit meter goes off with these things yet they continue to sell. I don't think most people buying them know anything about what a ""plasmacluster"" is even supposed to be.","How effective/ineffective are ""plasmacluster"" or ""ion generator"" machines which claim to purify the air?",129
OldRedditorNewTricks,9,3,1qhpt6,3,"Not distinguish between faces, but recognize that its a face. Similar to how we usually look at animals in the eyes, do they do the same thing? I'm mostly talking about wild animals, like deer or squirrels. Whenever I feed the chipmunk or squirrels in my yard, they seem to look up at my face before taking any food. Is it just them looking at how tall this strange creature giving them food is, or do they recognize that this creature has a face?",Do animals recognize human faces?,6
aRealMathAddict,2,10,1qhokw,10,Is it even my stomach making the noise?,"What is the cause of the rumbling sensation and noise when my stomach ""growls"" from hunger?",20
