author,comments,downvotes,id,score,selftext,title,upvotes
nilhaus,364,3558,15in05,3227,"Example: I have huge bookshelves full of books. If you blind folded me, and went through asking me did I own book X, I could tell you with 95-100% accuracy. You could even fake books, or ask me about books I don't own, I'd be able to tell you yes or no. However, if you asked me to list all my books and write it on a piece of paper, I'd be lucky to get 25% of them before running out of steam. 

Furthermore, when prompted with the book name, I could tell you the general plot of the book, list characters, describe the physical book, and maybe even when and where I got it. 

Why is this information only accessible one way, and not another? For lack of a better description, why can't my brain search by ""Books owned"" tag and return a list? The information is clearly there! 

I stumbled on this strangeness when someone asked me to list all 50 states. I could get about 75% of them before I started repeating, and only when I sketched a map was I able to fill in the rest. But when I had a map I could easily label every state. 

Edit: I don't know which category tag to use for this, Neuroscience, or Psychology?","Why can't I list every book I know, but I can tell you if I own it?",6785
[deleted],489,3036,1mk7wt,2569,,Have we taken flying insects into space? Do they fly any differently?,5605
calicoJill,602,2228,11i9nv,2558,"If life has started more than once on Earth, do we know what happened to it? and if it hasn't, do we know why not?

**Edit:** Sorry, I wasn't more clear. I was wondering if life has occurred more than once and died out or maybe it still exists but on a small scale in certain parts of the Earth. Because I find it hard to believe that with a world so perfect for sustaining life, that it could only pop up once in billions of years. I was curious if we knew anything about any other life forms that have ever started on Earth that aren't related to us that may or may not still exist.","Is absolutely every organism on Earth related, or has life started on Earth more than once?",4786
Ruiner,770,3932,w0qgf,2410,"In a few hours, we will have an official announcement from the CERN teams about the searches for the Higgs boson. I'll update this afterwards.

(You should also check [the previous Higgs thread](http://www.reddit.com/r/askscience/comments/naxmk/the_everything_you_need_to_know_about_the_higgs/) where many of the common questions were answered)

For many reasons, this is a very exciting moment for everyone in the community. Many of the older folks spent their life constructing all the building blocks of what we now know as the ""standard model of particle physics"", and the discovery of the Higgs ends this big chapter in our understanding of nature. For us younger physicists, this might be the first and only occasion in our lifetimes in which we get to witness a major experimental discovery in particle physics. 


The LHC was built because we were **sure** that something would be found, since the theory for electro-weak interactions without the Higgs becomes completely unpredictive once we cross this energy range. Since [W bosons](http://en.wikipedia.org/wiki/W_and_Z_bosons) are massive, they carry an extra degree of freedom - while light has 2 polarizations, both transverse to the direction of propagation of the light beam, W are also polarized in the direction parallel to their propagation. This longitudinal degree of freedom is troublesome, since it makes the probability of collision of W bosons collide grow very fast with the energy, so fast that it crosses the ""unitarity scale"", meaning that the sum of all the probabilities of different ways in which W bosons interact no longer add to 1.


When this happens, we need to ""resolve"" the interactions. This means that, while at large distances what we see is two W colliding, at short distances the Ws can also produces a particle and this particle again decays into Ws. Summing up all these contributions, we have again something finite. (Check the last 3 of these [diagrams](http://www.hep.lu.se/atlas/thesis/egede/thesis-img191.gif))


The Higgs - or whatever particle is in there at 126GeV - is very heavy and decays almost immediately into some lighter particles, so we cannot really produce it as a final state, thus we need indirect ways of detecting it. Check the above diagrams again: you see that the presence of the Higgs changes the ways in which the W bosons can scatter, so we can look for these signals. W bosons are also too heavy to be produced as a final state, so we need something else. We start by shooting protons against each other, and these protons contain 3 quarks each. The quarks can emit W bosons, and the W can also collide and produce a Higgs, as can be seen in this [diagram](http://4.bp.blogspot.com/-HGd0kIqlg9c/TzHA08T1kSI/AAAAAAAAAk4/oCfwX1eseKQ/s1600/vbf.png). Once the Higgs is produced, it will immediately decay into some light final state such as photons or quarks. What we really observe is an excess in the production of any of these final states when compared to the predictions of the same scattering without the Higgs. And in order to determine if the Higgs is really the Higgs, we compare the ""branching ratios"" of the theory with the experiment, which means that it has to produce just the ""right ammount"" of each final state.  


So is this guy also responsible for giving a mass to all the particles? Yes and no. In the real construction, the Higgs particle is part of something called the Higgs mechanism. In this mechanism, the energy is minimized once the Higgs field fills the whole space with a Higgs condensate: the field has a ""vacuum expectation value"", and the actual Higgs boson are just the excitations of this field, like ripples on the water. Almost every particle interacts with this field, and by this interaction they become massive.



* What changed since the last announcement?

Now they have more data and it's possible to say with a lot more certainty that there is in fact some particle with a mass of around 126 GeV. We'll have to wait until the announcement to know exactly how certain it is, but it's likely to be already above 5 sigma, so we can celebrate.

edit: 
now we have

from CMS: 125.3 +/- 0.6 GeV @ 4.9 sigma

from Atlas: 126.5 Gev @ 5.0 sigma



* Is it the Higgs?

It's needed more data. But their result seems to be compatible with the standard model Higgs.


* What now?

If it's really a Higgs, then we need to solve the Hierarchy problem or abandon the idea of naturalness. The problem is that the Higgs is ""unaturally light"", since quantum corrections would ""naturally"" make the Higgs mass as big as the Planck scale (10^19 GeV compared to the 126) and to make it light we need a an arbitrary cancellation that is heavily fine-tuned. The best candidates were supersymmetry and large extra dimensions, but it seems that both are very unlikely now.

If it's not a Higgs, then we probably will see more signals in the future, and the greatest theoretical challenge will be to figure out what exactly it is!",The official Higgs announcement thread.,6342
CriticalOfAllPosts,340,2722,1o32gn,2389,"Edit: Wow, terrific responses. Thank you.","If I steep two tea bags in hot water, rather than one, will there be double the ""tea"" (and hence caffeine), or is there some sort of saturation point?",5111
JaseAndrews,424,2861,1mbftz,2323,"Can, for example, an ant see things such as bacteria and other life that is invisible to the naked human eye?  Does the small size of the ant help it to see things that are smaller than it better?

Edit: I suppose I should clarify that I mean an animal that may have eyesight close to that of a human, if such an animal exists. An ant was probably a bad example to use.  ",Can creatures that are small see even smaller creatures (ie bacteria) because they are closer in size?,5184
Coloneljesus,299,2140,1894b8,2303,,Why is glass so chemically stable? Why are there so few materials that cannot be handled or stored in glass?,4443
BornAgainSkydiver,561,2556,1hhzcn,2259,"We have domesticated dogs, and they come in very different shapes and sizes, but all the domestic cats are (roughly) the same size and almost all look alike (at least, their differences are much less noticeable than between dogs races). Evidently, there ARE felines that are much, much bigger than cats, but I've never seen a domestic cat that size... Is there a reason besides the fact that they're dangerous? after all, an alaskan malamute could kill you in a heartbeat, but they choose not to, couldn't the same apply to big domesticated cats?

EDIT: Wow, frontpage! =...) thanks AskScience for a very interesting discussion! now, back to study, I have a test in a couple hours (it's grad school, God forbid you people think I'm a teenager and start a downvote festival)",Why do we have different sized dogs but all the domestic cats are (roughly) the same size?,4815
surreal-reality,397,2178,1n84ms,2258,"At the moment, 3rd top post this month? And 20th top post this year?? I know /r/askscience isn't about upvotes and being a karma whore, but wow. I love this community and everyone's love for science.",The Mars rover found that Martian soil is composed of about 2% water. How significant is this number? What about compared to the Sahara? What else should we expect after finding this water on Mars?,4436
rotgutbill,146,2038,1k7wgq,2230,,"If air is mostly nitrogen and dirt is mostly carbon, why do plants get all their nitrogen from the soil and all their carbon from the air?",4268
fauno15,568,2262,1icgyf,2220,"I mean things like islands, rivers, etc. I assume that most, if not all landmasses were discovered before satellites, but I'm curious if there are any notable places that we didn't know about before we could see the whole world from above!",Are there any places on Earth that were undiscovered before the advent of satellite imaging?,4482
Zhankfor,221,2024,1eyso3,2220,,"Did the insects with queens (bees, ants, wasps, termites) all evolve from a common ancestor with queens, or is their social organization an example of convergent evolution?",4244
jigsaw488,363,2031,1nzle1,2195,,"When i cut my finger does it cut the cells, or are they just clumped to different sides?",4226
just_saiyan_bro,756,3215,108nvt,2196,Does it get absorbed into matter? It does it just disappear into nothingness?,"This may be a dumb question, but when I turn off my lights, where does all the light go?",5411
tieyourson,496,2470,1hsx3i,2187,"When Europeans came to the Americas the diseases they brought with them wiped out a significant portion of natives, but how come the natives disease weren't as deadly against the Europeans?","Why did Europeans have diseases to wipeout native populations, but the Natives didn't have a disease that could wipeout Europeans.",4657
joshhinz,180,2336,1ej954,2180,I wasn't sure how to categorize this. But I now realize that this is truly a physics question. Not biological. Or so it appears...,"My eyes can focus on an object that is roughly as small as 1/20,000th my body length. Can a small insect's eyes do the same? Could an insect see bacteria?",4516
Stuck_In_the_Matrix,246,1824,1iqpb8,2180,"Assuming I could charge myself by plugging into a wall outlet (American wall outlet), how long would I need to stay plugged in to get the same amount of energy as from eating a full day's worth of food.",How long would I have to plug myself into a wall to get the equivalent energy to eating a full day's worth of food?,4004
MrTripper,790,4267,xtqq5,2166,,"What if we put a mirror in space, 1 light year from earth and we pointed Hubble at it would it be possible to see two years into earths past?",6433
entillthedeathofme,216,1895,13qki4,2152,"Also, are there many other plants that produce caffeine that may not be edible or that are less common?","Did cocoa trees, coffee plants, and tea plants all evolve the production of caffeine independently, or do they share a common ancestor that made caffeine?",4047
Srirachachacha,382,1822,127tb4,2111,"Hurricane Sandy is obviously a big storm that is making landfall during a period of rare meteorological conditions in the Northeastern U.S.  As such, I would assume that this event is a prime target for media inflation and exaggeration.

I'm wondering if anyone in askscience can talk about the potential course and impact of the storm in that level-headed manner we love so much on this subreddit.

[NOAA link for those interested](http://www.nhc.noaa.gov/)

Much appreciated!

**Update Edits:**

A number of users have posted fantastic information and resources.

 [Hamsterdave](http://www.reddit.com/r/askscience/comments/127tb4/hurricane_sandy_would_anyone_mind_discussing_its/c6svz5x) writes:

&gt;...when that wind covers an area of hundreds or thousands of square miles, instead of tens, you get some new challenges. The shear scale of this relatively moderate damage makes restoring power and opening roads a major task that can take days
&gt;
&gt;You aren't looking at hundreds of square miles of buildings flattened like we saw with Katrina and Andrew. Just a lot of people without power, possibly without water. The most destructive wind will generally start to wane within about 100 miles of the storm coming ashore, especially with a weaker storm like Sandy.
&gt;
&gt;...it boils down to this. This is not going to be a Katrina caliber storm. There's a hell of a lot of infrastructure in the region that is going to ensure a rapid response from emergency workers and the government. They've got a lot of warning. Katrina intensified rapidly right before landfall, Sandy isn't likely to. Also, the area isn't apt to flood and then stay flooded like New Orleans did.
&gt;
&gt;You're going to see a huge chunk of real estate without power, probably in to the weekend, but it should rapidly recover after that. You're going to see a huge chunk of real estate under water, but it should subside by Thursday

[Birdbrainlabs](http://www.reddit.com/r/askscience/comments/127tb4/hurricane_sandy_would_anyone_mind_discussing_its/c6svpla) provided a great link:

A blog posting written by Dr. Chris Martucci of the EPAWA - [*The Great Halloween Hybrid Named Sandy*](http://epawablogs.com/the-great-halloween-hybrid-named-sandy-2/)",Hurricane Sandy:  Would anyone mind discussing its impact in a manner free of fear-mongering and media sensationalism?,3933
Cammylamingtons,911,2525,1kjp6z,2084,Does gravity travel at the speed of light or is it faster than light? (By disappeared I mean replaced with the standard empty space make-up),"Does gravity travel at the speed of light? If the sun suddenly disappeared, would we still orbit it for a while?",4609
juliachildcia,349,1639,1p2cki,2072,"I'm tempted to assume the Myers Briggs personality test is complete hogwash because though the results of the test are more specific, it doesn't seem to be immune to the Barnum Effect. I know it's based off some respected Jungian theories but it seems like the holy grail of corporate team building and smells like a punch bowl.

Are my suspicions correct or is there some scientific basis for this test? ",How scientifically valid is the Myers Briggs personality test?,3711
[deleted],436,2646,14315q,2056,"Hoping someone can answer this. I imagine diarrhea is the body's way of flushing out something very quickly, but if it's happening under an hour from when we ate the food, what could it possibly be flushing out since the food is just starting the digestive process?

Thanks!","If the digestive process takes 24-72 hours, why do we feel sick/have diarrhea seemingly immediately after eating ""bad"" food?",4702
billydelicious,172,1831,1iib7a,2014,"Does the change in gravity and atmosphere effect sound waves, and could we approximate what it would sound like? Would it be flat or sharp or way way off?","If I took my piano to Mars and played a C major chord, (which would be in tune on Earth), what would it sound like?",3845
tyroncs,483,1978,1owp09,2014,"We are always told at school that using oil is unsustainable as it takes millions of years to be made, so what is a sustainable amount we can use each year so that it gets remade for the next year. I apologize if this sounds confusing","If oil takes millions of years to be made, how much of it is made each year?",3992
mistahowe,376,1561,1b293c,2005,,"If I were to take all the energy I get from eating in a day and converted that energy into an explosion, how big would said explosion be?",3566
ShesGotSauce,443,1911,1q16hw,2000,"Have all original molecules in my body from birth been replaced by now or do some remain?  If they've all been replaced, approximately how often does this occur in a human lifespan, rendering one a completely different physical being from who we once were aside from the ties of continuity?","I'm 32. Is there a single cell, or even molecule, left in my body that was there when I was born or am I a completely physically different organism from who I was as an infant?",3911
TheJMoore,377,2174,1mfo7n,1972,"I just bought a steadicam for my DSLR and it got me thinking. How is it that the body acts like a natural steadicam for my eyes?

ELI5 if necessary. ","When I'm walking or running, how is it that what I see isn't all shaky like when I try the same thing with a video camera?",4146
Justicles13,471,1675,1qk9l4,1963,"With the atmosphere constantly changing, how far back would you have to go before it is unbreathable to humans?

From [this](http://www.yale.edu/ynhti/curriculum/units/1991/6/91.06.04.x.html#c) article, it says that our atmosphere has been ""maintained"" more or less since the atmosphere became oxygen rich about 1.4 billion years ago.

Also, I am aware that during the carboniferous period, the Earth had a much higher oxygen concentration, and that ended ~300 Million years ago, but I'm not sure if that means it's too high for humans 

Edit: thanks for all the replies everyone!! ","Theoretically, what's the farthest back in time a human could travel and still safely breathe the Earth's atmosphere?",3638
Jokkerb,207,1571,1jshui,1958,"Say I want to draw a dog.  In my head I can see the dog and descriptions of the dog simultaeniously, but when I tell my arm and hand to start drawing the resulting image is barely a shadow of what I saw.  So what's stopping me from becoming art famous?   oh yea, my hand has no idea what's on.",Why can I not draw exactly what I visualize in my mind?,3529
knudow,463,2178,11olhj,1963,"I've been wondering this for a while. I've always thought that your body was recharging energy when you were asleep and it automatically wakes up when you are 100% charged, but when I sleep with no alarm clock, I usually sleep 10-12 hours, so now I'm not so sure about this theory of mine.","If you sleep with no alarm clock, do you sleep the exact amount of time your body needs, or do you oversleep?",4141
kirizzel,572,2232,16om4s,1962,"I was just watching a documentary about space time and the fourth dimension. They said, that we cannot sense the 4th dimension, but it still exists. That's where i started to reason and came up with my question.","If I was an organism in a 2D world, would there be any experiment I could conduct, in order to prove whether there is a third dimension or not?",4194
CopaceticlyCollinear,336,1431,1p4bug,1959,Ha! There is no ground. Jokes on you. Seriously though... how does that work. ,How would you ground electronics in the space station?,3390
77_65_65_64,304,1755,11erzc,1955,.,"When someone grows up in a cold weather climate and can ""take the cold"" is there something physiologically different about their metabolism or is it more mental?",3710
DJSlambert,334,1988,1dh979,1948,"The question might be confusing.   Feel free to ask me to clarify.

","When you graph your family tree (parents, parent's parents, parent's parent's parents, etc), it's an ever expanding graph. But humans started from a very small pool of people. Would the graph end up looking like a diamond? At what point would the graph start getting ""smaller""",3936
cleverless,477,1957,1jho3k,1947,,"If an obese person and a thin person were stranded on a barren island with plenty of water, but no food, would the obese person live longer due to stored up body fat? What other factors would need to be considered?",3904
Waldamos,476,4206,p4vlp,1945,"Edit: To clarify, no fossils.  Of course a fossil would show the trunk impression.  My reason for asking this question is to understand when only bones are found of animals not alive today or during recorded history how scientists can determine what soft appendages were present.

Edit 2: from a picture of an elephant skull we would have to assume they were mouth breathers or the trunk attachment holes were the nose.  From that we could see (from the bone) that muscles attached around the nose and were powerful, but what leads us to believe it was 5 foot long instead of something more of a strong pig snout?

Edit 3: so far we have assumed logically that an animal with tusks could not forage off the ground and would be a herbivore.  However, this still does not mean it would require a trunk.  It could eat off of trees and elephants can kneel to drink provided enough water so their tusks don't hit bottom.

Edit 4: Please refrain from posting ""good question"" or any other comment not furthering discussion.  If this gets too many comments it will be hard to get a panelist up top.  Just upboat so it gets seen!

Edit 5: We have determined that they would have to have some sort of proboscis due to the muscle attachments, however, we cannot determine the length (as of yet).  It could be 2 foot to act as a straw when kneeling, or it could have been forked.  Still waiting for more from the experts.

**Edit 6:** I have been told that no matter if I believe it or not, scientist would come up with a trunk theory based on the large number of muscle connections around the nose opening (I still think the more muscles = stronger, not longer).  **Based on the experts replies: we can come to this conclusion with a good degree of certainty.  We are awesome apparently.**","If no elephant was alive today and the only record we had of them was their bones, would we have been able to accurately give them something as unique as a trunk?",6151
tomandhisjones,398,1267,1kb8sd,1940,"I normally get 6 to 8 hours of sleep a night, but sometimes have fits of insomnia. If I slept for 12 hours a day for a few days, would I be as rested as if I had gotten the normal amount of sleep?",Can a person ever really catch up on sleep?,3207
DiGva,521,2120,1cj5eo,1934,,"If I throw a baseball at 90 mph, does that mean my hand must be travelling at 90mph before it releases the ball?",4054
discharge,549,1639,1kx892,1919,"I don't know if I was really clear in the title, but I guess what I want to know is how quickly do serums act from injection to effect.","In Dexter, he pokes people in the neck with a syringe full of some agent and they fall unconscious almost instantly. How accurate is this; how quickly would the serum actually reach the brain and have its effect?",3558
RedJohn451,529,2037,1new3i,1919,"I remember my physics professor saying how you could hold onto a piece of carbon 14 and feel it start to get warm in your hand and that it was harmless. I was wondering if it was possible (and safe) to use radioactive substances in building materials, specifically to keep the sidewalk and driveway warm enough in the winter so that snow would not collect. 

Edit: Thanks for all of the great responses! I hadn't considered the cost of the radioactive material or that the cement would eventually wear out and contaminate everything around it. Clearly not one of my best ideas. ",Is there a safe radioactive substance that you could mix into cement so that your driveway and sidewalks naturally melt snow in the winter?,3956
Spidooshify,418,2584,1hbd86,1914,"My college physics professor asked us this a few years ago and I can't remember the answer. The only thing I remember is that the answer didn't make sense to me and she didn't explain it. So I'm coming here to finally figure it out!

Edit: Fuck Yeah front page. I'm the most famous person I know now.","You have three cookies. One emits alpha radiation, one emits beta radiation and one emits gamma radiation. You have to eat one, put another in your pocket and put a third into a lead box. Which do you put where? Explain.",4498
noodlenugget,339,2002,x4tdu,1884,"I noticed one day while stirring my coffee in a ceramic cup that while tapping the bottom of the cup with my spoon, the pitch would get higher as the coffee slowed down. I tried it at different stages in the making of the cup and it seemed to work regardless if it was just water or coffee, hot or cold. I have shown this to other people who are equally as puzzled. [What IS this sorcery?](http://www.youtube.com/watch?v=IZT9GQS3EA8&amp;feature=plcp)

EDIT: 19 hours later and a lot of people are saying the sugar has something to do with it. I just made my morning coffee and tried stirring and tapping before and after adding sugar. I got the exact same effect. I also used a coffee mug with a completely different shape, size, and thickness.","Askscience, my coffee cup has me puzzled, so I captured it on video and brought it to you. Is there a name for this? Why does it do this?",3886
Infinitax,173,2045,1dqdul,1878,,"When we step on the ground, does the pressure kill any microscopic organisms?",3923
[deleted],385,1615,1g51b1,1861,"Saw a post on the front page of /r/wtf regarding some green water ""looking radioactive."" What is the basis for that association? ",Why is radioactivity associated with glowing neon green? Does anything radioactive actually glow?,3476
itzdallas,637,1640,1kt88j,1848,,Is 0 halfway between positive infinity and negative infinity?,3488
