author,comments,downvotes,id,score,selftext,title,upvotes
pockets_007,384,1005,14hx8l,1380,"Ok, so my understanding of the universe is as follows: ""normal"", predicable physics is used to explain the universe we can see and interact with, and quantum physics is used to explain the universe of the scale that particles interact with each other. My question is this: at what point does conventional physics break down and quantum physics take over?
The obvious answer is that quantum physics takes over when u reach the quantum scale, by i was wondering if there was some overlap of physical rules as the scale approaches the quantum? or is there a hard line of measurement where very slightly smaller is quantum rules, and very slightly above this limit is standard physics?

i am also completely amazed that the universe can operate with 2 (or more??) sets of rules that are incompatible with each other. How could these differing sets of rules both be describing the same events so differently? One example that springs to mind is throwing a ball against a wall. As i understand it, quantum physics says that there is a probability that the ball may end up on the other side of the wall, but standard physics says the ball MUST hit the wall and return to where it was thrown. how can BOTH be operating at the SAME TIME?","At what point does ""normal"" physics break down to follow the rules of quantum physics? And how can the universe operate on 2 completely incompatible sets of rules??",2385
MooseV2,205,857,1k3dlf,1377,"With our vast knowledge of how nearly all elements and chemicals react, why is our common battery repository limited to a few types (such as NiMH, LiPO, Li-Ion, etc)?

^(Edit: I'm not sure if this would be categorized under Engineering/Physics/Chemistry, so I apologize if I'm incorrect.)",What's stopping the development of better batteries?,2234
senorcool,223,1434,tlqq3,1382,"When I was growing up, ""Save the Rain Forest"" was everywhere; on TV, billboards, magazines, etc. Now that I don't hear about it anymore, I was wondering what the impacts were from that huge push for rain forest preservation. Was it successful, semi-successful, not productive at all, or did worse things come from it. ","Growing up, I remember a huge movement to ""Save the Rain Forest"". Being that it's about 15+ years later, how did that movement impact the environment and specifically rain forest? What was achieved and/or lost?",2816
MiniCoop475,354,990,1iejky,1367,I have noticed after finishing running when I drink ice cold water I feel more hydrated than when I drink lukewarm water.  Is it more of a mentality with the colder water or does the temperature difference help the body cooler faster? ,Is there something about drinking cold water that is physiologically more hydrating as opposed to drinking lukewarm or hot water?,2357
Iquitelikemilk,1199,1928,qk58k,1366,"Basically I understand that the universe is ever expanding, but do we have any idea what it is we're expanding into? what's on the other side of what the universe hasn't touched, if anyone knows? - sorry if this seems like a bit of a stupid question, just got me thinking :)


EDIT: I'm really sorry I've not replied or said anything - I didn't think this would be so interesting, will be home soon to soak this in.

EDIT II: Thank-you all for your input, up-voted most of you as this truly has been fascinating to read about, although I see myself here for many, many more hours! ",What is 'Space' expanding into?,3294
charisfu,361,1048,1qc26b,1370,"In many recent news stories about the violence in Mexico, it's always mentioned that there are beheadings among the other terrible things happening down there.  In one particular video, a member of one of the groups uses a serrated knife to decapitate a victim. Being the victim, how long would it take for you to black out while experiencing this, and how much of it would you actually feel?",How soon into the process of a decapitation would a victim lose consciousness/black out?,2418
eyeeyecaptainfly,344,827,1n11f9,1360,Edit: Thanks for the fascinating discussion. I'm learning a lot. Still reading.,"How is it that the human body, which is full of bacteria and germs, can produce sterile fluids? For example, I've heard that the fluid inside blisters is sterile and so is urine.",2187
kbz2007,188,795,1big70,1360,"I'm specifically interested in if something that's forgotten can always be recovered by focus and memory. Or, is there ever a certain point when that memory is forgotten or obscured to the point of never being recovered?",Are memories ever truly forgotten or are they always buried in your brain somewhere?,2155
wianno13,237,952,18qzxa,1355,,"How do we know that elementary particles aren't composed of smaller particles, the same way we used to think atoms were indivisible?",2307
Unlucky13,686,986,154l3a,1359,"I'm referring to this report: http://www.guardian.co.uk/science/2012/dec/19/habitable-planet-discovered-tau-ceti

If we were to send some kind of probe or satellite or even a lander of some kind, how long would it take us to 

1) get something there

2) begin receiving data on that objects findings

Obviously it would take 12 years at the speed of light, and we're no where near capable of reaching those speeds (right?). ","After hearing the news about the ""habitable"" planet 12 light years away, I'm curious to know how long it would take us to get there given today's technology.",2345
Zaxdrique,186,1135,16y0q6,1356,"From what I learned, common cold mutates regularly, why is it that it always produce the same response from the immune system? What prevents it from mutating a new symptom, and from becoming a more potent disease?","If common cold regularly mutates, why does it always have the same symptoms?",2491
Ectriccs,194,1902,wp16w,1356,,"Why is it ""painful"" to witness awkwardness? ",3258
lauralouhoo,425,1189,1lzdie,1344,"I'm thinking of like Battlestar Galactica and Star Wars, all space movies/tv shows in which they go to battle and shoot lasers at the enemies. Sometimes they miss. Does the laser keep going until it hits something? For how long? ","If a laser is shot in space and it doesn't hit it's target, what happens to the laser?",2533
aldreban,272,1133,10c6dh,1350,"For example, can you some how ""pop"" the seed of a strawberry, orange or sunflower, like you would a corn kernel? What makes corn the ideal candidate to actually ""pop"" compared to other seeds? I read once it was something to do with the moisture and/or starch contained in a corn kernel, but I thought r/askscience could give me a specific answer!","If popcorn is the ""popping"" of corn kernels, can any other type of seed be ""popped""?",2483
Shovelbum26,258,1013,1ja3ls,1347,"I have a cat (though, since I'm on Reddit, that's almost an unnecessary statement), and I've had dogs often in the past.  Both animals, and many other mammals, use their tongues to clean themselves after defecation.  Dogs will actively eat the feces of other animals.  

Yet humans have a strong disgust reaction to fecal matter, as well they should since there are tons of dangerous diseases we contract through it.  Even trace contamination of fecal matter in water or food is incredibly dangerous to humans.

So, what gives?","Is there something different about the human digestive system that makes fecal matter so dangerous to us, while other mammals use their tongues for hygiene?",2360
JadnidBobson,517,1143,11sor5,1344,"I mean, in order for our body to function properly, we need food containing vitamins, minerals, fat, etc, while many animals eat only one type of food. 

Take the koala, for example, with a diet of practically one thing -  eucalypt leaves. Where do koala bears get the protein and minerals their bodies need? What makes humans unable to survive on just one type of food?

**EDIT** Thanks for all the great answers and discussions, I really learned a lot and I'm sure others did too! :)",Why do humans need such a varied diet whereas other animals don't?,2487
MFORCE310,201,734,1nyuqs,1339,"Basically, what caused underwater dinosaurs to die specifically? ",What caused all the giant underwater reptiles to die out at the Cretaceous Mass Extinction but not other ocean life?,2073
Demeter_of_New,283,835,1m1nsy,1347,,Why is the LADEE robotic explorer going to take a month to get to the moon when the Apollo missions took a few days?,2182
pandaclawz,323,1142,zerth,1339,,"If it gets continually harder for Voyager to transmit images back to Earth, can we send a series of other spacecrafts after it to ""leap frog"" the information back?",2481
PeopleWithoutMatches,134,1120,19uek6,1333,"Is there a particular organ that perceives fluids?

Ie: when you are hungry, you eat something, maybe 20 minutes later, you feel full. When you are thirsty, you drink a glass of water and you know immediately whether you need to drink another one or not.","Why does it take a while for your body to register that you have eaten enough, but you know almost immediately when you have drunk enough water.",2453
I2ichmond,538,1062,1c14fj,1331,"http://theoatmeal.com/comics/mantis_shrimp

I like The Oatmeal, but I feel the need to verify stuff like this, since the author seems to be assuming diversity of color receptors = diversity of colors. 

Aren't we *aware* of the full EM spectrum? Even if our eyes aren't sensitive to certain parts of the spectrum, couldn't we roughly determine their visual properties based on their known wavelength/frequency, etc.? (for example, wouldn't ultraviolet, normally invisible, really just appear to be violet if our eyes could detect it?)

Thanks!",Is it true that animals with more types of color receptive cones can see colors we cannot conceive of?,2393
Palikk,415,1513,uzw84,1335,,Why don't mosquitoes spread HIV?,2848
Hmez,235,882,1qra44,1328,,How does our body know/learn not to 'wet the bed' as we grow older?,2210
Travdog,218,1223,11ue41,1330,,What causes the bend in a banana? Why don't they grow straight?,2553
SkinnyHusky,327,1160,1cghsp,1319,,"When a tree engulfs a metal sign or fence, does the metal do any damage to the tree? i.e. Is this process safe for the tree?",2479
TokenRedditGuy,411,1215,r93i6,1323,Folding@Home has been going on for quite a while now. They have almost 100 published papers at http://folding.stanford.edu/English/Papers. I'm not knowledgeable enough to know whether these papers are BS or actual important findings. Could someone who does know what's going on shed some light on this? Thanks in advance!,Has Folding@Home really accomplished anything?,2538
ultraStatikk,265,816,11te6j,1320,"I was messing around with this picture in photoshop and noticed when I changed the hue/saturation the illusion became nonexistent. Why is that? What is going on to cause the illusion in the first place?


[Illusion](http://i.imgur.com/imXTN.jpg)


[No Illusion](http://i.imgur.com/unniY.jpg)",Why do colors affect this optical illusion?,2136
nukemod,269,835,1ofca6,1316,"Basically, there is no mammal that comes close to a bird of paradise, a milk snake, a clownfish or a jewel beetle in terms of coloration. Why?","Why do mammals usually have dull coloration when compared to some birds, reptiles and fish?",2151
ScrubForLife,291,1147,162dri,1308,"If I consumed toxic Windex or something, why shouldn't I immediately try to get the chemicals out of my body as soon as possible through vomiting?",Why do some poisonous chemical labels advise not to induce vomiting when swallowed?,2455
chocolate_on_toast,351,1364,1608fd,1311,"We were talking about how space is really empty and my kid cousin asked us this great one:

**""If all the mass in the universe is spread evenly across all the space, how much stuff would be in my bucket?""** (a 10 litre container)

We then got talking about how small he wanted the particles so he followed up with:

**""If all the mass in the universe was in the form of marble-sized bits like pebbles, how far apart would the bits be from each other?""**

It's awesome he's so interested, but my partner and I have no idea how to go about answering him! I'd love to supply him with some information though, to keep him interested so I was hoping you guys could help!","8 y/o cousin's questions about mass in the universe had us stumped, can you guys help?",2675
superblinky,231,752,1jfy2z,1312,,Why does a laser spot look grainy?,2064
deterra,506,1014,1dzk17,1311,"And a corollary question: what is the estimated frequency of antisocial personality disorder among the general population?

**EDIT:**

Thanks for all the replies!  I am still catching up, reading them.

A summary (shoot me a PM if I've erred in this!):

It has been pointed out many times that ""Psychopathy"" and ""Sociopathy"" tend to be used interchangably, while ""Anti-Social Personality Disorder"" is considered to be quite different, based on behaviour rather than personality.  I think I recall reading that the DSM only focuses on ASPD.

There seems to be some disagreement on the subject of whether Psychopathy is inborn or not, and relatedly, whether it is something a person can be ""a little bit of"".  I had always thought it stemmed from a structural difference in the brain.  I haven't read anything so far which would suggest this.  I have asked /r/askscience if it was heritable before, but received no consensus.  (ASPD, however, seems to be at least partially, if not fully, based on learned behaviour.)

Perhaps unsurprisingly, the general consensus tends to be that psychopaths may recognize that they are different than others, but few of the estimated 1% of people who are thought to be psychopathic would go out of their way to actually get themselves diagnosed.  Typically such a diagnosis is not important except in the case of delinquency, which blurs the line between psychopathy and ASPD, as explained above.",Does the average psychopath know they are a psychopath?,2325
Rullknufs,407,751,1der30,1314,"Me and a fellow classmate started discussing this during a high school physics lesson.

A photon is emitted from an atom that is not moving. The photon moves away from the atom with the speed of light. But since the atom is not moving and the photon is, doesn't that mean the photon must accelerate from 0 to the speed of light? But if I remember correctly, photons always move at the speed of light so the means they can't accelerate from 0 to the speed of light. And if they do accelerate, how long does it take for them to reach the speed of light?

Sorry if my description is a little diffuse. English isn't my first language so I don't know how to describe it really.","When a photon is emitted from an stationary atom, does it accelerate from 0 to the speed of light?",2065
[deleted],235,929,1bl3tm,1310,"EDIT: I love this. I got the answer I was looking for during the first 10 comments, and now there are almost 200! You guys are awesome",Do dimmer bulbs use less electricity when dimmed?,2239
niklaskronwalled,226,1492,sy43v,1305,"Kind of a strange question, I'm not sure if it makes sense, but I'll do my best to explain...

I know that, theoretically, if an observer were to exist in time and space right outside the event horizon of a black hole, and they were there for a year, for example, this year to them would actually be several years to an observer here on earth.  When an observer is close to a lot of matter, or when it is moving at very high speeds (or both), time moves more slowly than it otherwise would.

Also, as I understand it, we believe that the Big Bang happened 15 Billion years ago because we see the speed with which the Universe is expanding, and we can calculate that it must have been expanding for 15 billion years from a central point.  I'm not exactly sure how they calculate the ""age"" of the Universe, but I think this is the 'jist' of it.

With these things in mind, is it possible that the *actual* age of the Universe is far greater (possibly infinitely) than the 15 billion year consensus?  I imagine the first couple nano-seconds of the Big Bang, and I know that there is a great deal of mass moving with tremendous velocity.  Is it possible that time has a telescoping effect as we move further back in time, closer and closer to the moment of ""origin""?  That what we currently calculate as the first ""second"" of the Universe actually lasted millions of years **in those moments** due to the seemingly elastic nature of time?

**Edit - [NJerseyGuy seems to have the most popular answer so far](http://www.reddit.com/r/askscience/comments/sy43v/time_slows_down_near_large_mass_and_at_high/c4hz0wp), and his answer is ""No"".  Not to say he's right, but his answer is compelling**","Time slows down near large mass and at high speeds.  Is it possible that the first ""seconds"" of the Big Bang lasted billions of years because of this?",2797
GeneralGonzo,391,1379,s39v7,1301,,"When we die of old age, is there any part of us that persists from when we were born?",2680
OrbitalPete,651,722,1lpfif,1301,"**EDIT - OK ladies and gents, 10 hours in I'm burnt out and going to call it a night. I know the US is just getting their teeth into this, so I'll come back and have a go at reposnses again in the morning. Please do check the thread before asking any more questions though - we're starting to get a lot of repeats, and there's a good chance your question has already been answered!  Thanks again for all your interest, it's been a blast.   ZeroCool1 is planning on doing an AMA on molten salt reactors on Friday, so keep your eyes out!**

**FYI, the pee and vulcan questions have been asked and answered - no need to ask again.**

I'm an experimental volcanologist who specialises in pyroclastic flows (or, more properly pyroclastic density currents - PDCs) - things like [this](https://www.youtube.com/watch?v=Cvjwt9nnwXY) and [this](http://www.youtube.com/watch?v=7h5XOS7uaWA&amp;t=4m53s).

Please feel free to ask any volcano related questions you might have - this topic has a tendancy to bring in lots of cross-specialism expertise, and we have a large number of panellists ready to jump in. So whether it's regarding how volcanoes form, why there are different types, what the impacts of super-eruptions might be, or wondering what the biggest hazards are, now's your opportunity!

About me: Most of my work is concerned with the shape of deposits from various types of flow - for example, why particular grading patterns occur, or why and how certain shapes of deposit form in certain locations, as this lets us understand how the flows themselves behave. I am currently working on the first experiments into how sustained high gas pressures in these flows effect their runout distance and deposition (which is really important for understanding volcanic hazards for hundreds of millions of people living on the slopes of active volcanoes), but I've also done fieldwork on numerous volcanoes around the world. When I'm not down in the lab, up a volcano or writing, I've also spent time working on submarine turbidity currents and petroleum reservoir structure.",AskScience AMA: Ask a volcanologist,2023
JakeLV426,296,1599,xyazh,1306,"Are flies made of Adamantium? Or, more likely, is there some kind of weight/mass/size measure that reduces the force of my (to a fly) gigantic hand delivering an epic smack? 

Edit: Thanks everyone for offering your expertise, I feel much more enlightened on mass and inertia, as well as the proportional durability of insect exoskeletons. Moving forward, I will be annihilating flies with a machine gun. 

Edit 2: I'm once again reminded how many people know way more science than me. This has been incredibly interesting conversation, thanks to all of you! 

Edit 3: I can't believe this goof question got to the top of /r/askscience!! All you brilliant minds out there answering and discussing are amazing.

Edit 4: To all the people saying I should just hit them harder, or use a rolled up magazine, or a salt gun....Yes, I understand. I know HOW to kill a fly...I have killed many and am capable of fly murder...I was just curious about the science of a fly shaking off a swat and what's involved in size/mass/velocity proportions, etc.. But thank you for the advice, I am now armed with about a hundred methods of swatting flies. 

Edit 5: [Apparently a lot of you can punch and kill flies in midair.](http://i0.kym-cdn.com/photos/images/newsfeed/000/200/420/BRTky.jpg?1321408042)","How come if I smack a fly in mid-air (not smashing him against a wall) it seems to be completely ineffective? If I were flying around, and a proportionally larger creature smacked me, I imagine I'd be reduced to liquid. ",2905
carboniferousP,158,775,1holpq,1302,"I recently heard about a ""[bubble of bacteria](http://www.reddit.com/r/science/comments/1gq9ux/scientists_discover_the_earth_is_surrounded_by_a/)"" found ten kilometers above the earth and I found it quite intriguing. I've also heard that insects can be found [more than five kilometers high.](https://www.youtube.com/watch?v=-QxfOYhpjro) It got me wondering how saturated Earth is with living things.

Do we find bacteria and other life all the way up to the top of the atmosphere? Is there life on the highest mountain peaks?

I've seen footage of crazy-looking organisms found in the deepest depths of the oceans... I've also heard that archaebacteria can be found coming out of hydrothermal vents! Is this true? How deep into the rocks beneath us can life be found?",How saturated is Earth with life? Is there life as far as the atmosphere is high? And how far does it extend into the Earth?,2077
ecafyelims,222,1537,16k04k,1296,"Reference: http://news.yale.edu/2013/01/11/new-qubit-control-bodes-well-future-quantum-computing

How are entangled particles observed without destroying the entanglement?",Yale announced they can observe quantum information while preserving its integrity,2833
