author,comments,downvotes,id,score,selftext,title,upvotes
bantesting666,198,1003,y3b77,1090,,"If NASA was to find fossil remains of plants, dinosaurs or insects on Mars how would they go about testing them to find out how long they had been there for?",2093
ryan-a,227,578,1ogymm,1086,,"What are the oldest species that we could (in theory) bring back from extinction, given the half-life of DNA?",1664
Quawalli-fied,198,656,1lkr98,1087,"Maybe its a silly question but its what I have been led to believe from a documentary I was watching. The exact line was something close to ""It's says a lot about the temperature of earth during its early years when you consider that the core is still 4'500 years today""

Thanks reddit ","The Earth's core is an estimated 4'500 °C. Is this heat the remnants of the temperature of Earth during the Hadean eon? To put it simply, is the core still cooling down 4'000'000'000 years later?",1743
jzoidbergj,323,1113,yuoxl,1088,,"Is breakfast really the most important meal of the day?  Why/Why not?  How long after waking is the ideal ""breakfast time""?",2201
tclayson,583,805,1ercvn,1084,"I'm trying to understand what we know and what we don't know. Is the ""observable universe"" just what we can see at the current time? Is it therefore reasonable to assume that there is more of our universe outside the observable universe? We just don't have the ability to view and map it yet?

Or does ""observable universe"" mean what we are able to see in its entirety? i.e. we know there is nothing outside of the observable universe that we should be able to see? e.g. if there were more galaxies, stars and planets past the perimeter of the observable universe we should be able to see them, therefore because we can't see them we know (to the extent of our current knowledge) that there is nothing there?

Thanks!","What is beyond the edge of the ""observable universe""?",1889
ElectronicSamurai,296,977,z3lkd,1089,"Are there any physiological effects of being hit by an EMP pulse, or is the human body completely unaffected?  If an EMP weapon were secretly fired with no electronics nearby, would there be any effect?","If you were hit by an EMP pulse, would you notice?",2066
inspired221,489,967,ritt6,1080,,"If energy cannot be created or destroyed, is it a fact that the universe has always existed as some form of energy?",2047
DullDieHard,143,614,1klm7z,1087,,When will we be able to industrialize graphene and when will the consumer likely see graphene in household products such as computers?,1701
MikeMacAllan,399,1305,176l5k,1086,Or was Ice a recent invention?,"Could you make Ice, before the invention of the freezer?",2391
therationalparent,483,1386,11av3j,1081,"In other words, is an ants apparent strength only due to its tiny size?

(Bonus question - who would win in a fight, an elephant or an elephant-sized ant?)","If you scaled an ant up to the size of an elephant, would it still be able to carry an object five times its own body weight?",2467
Romgosch,226,1043,xdzcj,1078,"Edit: After reading a bit about cosmic time I think Coin-coin answered my question in the point I was looking for. Thank all you guys for your contribution, didn't expect that much feedback.","We say the universe is roughly 13,75 * 10^9 years old. Given that time is relative, from what perspective is this measured?",2121
alphanovember,251,949,1642e4,1085,,"How did sexual reproduction triumph over asexual, since it requires two variations of an organism rather the just anyone? How did it even get started at all?",2034
[deleted],200,793,13zkcd,1077,,Would the sun's core be pitch black as it is too hot for the visible spectrum? ,1870
mazterlith,86,667,1f3uz2,1082,"I know in Elizabethan times the spelling used to indicate how the word was pronounced, and that pronunciation differences has to do with how culturally isolated/insulated you are, but wouldn't standardization slow down gradual drift?",Has standardization in spelling slowed down tonal shifts in languages?,1749
xxfreedomxx,320,667,1fyt7m,1074,,"Why does the word ""mama"" so often mean mother in different languages, even in languages that aren't closely related?",1741
Graeth,304,635,14zx3s,1075,"Wouldn't it be better to operate on different frequency's due to these both being household appliances and the resulting interference? 
Is this because the technology for one already existed (easily accessible) and was therefore used? 

edit: Thanks all of you for the answers! Nice to know it sparked such a discussion.",Why do microwave ovens and wireless routers operate on the same frequencyrange (~2.4GHz)?,1710
vandykjd,184,627,156ijs,1080,,"Does the way a person sleeps(on back, side or chest) effect bone growth and/or bone shape?",1707
thisamericanlife,215,820,ra4ki,1074,"I recently watched a documentary where they discussed the archaeological digs on an ancient city. In this particular place they found 25 different city 'layers', each from a different period of time. I remember in my travels to older cities in Europe this also occurs, especially in Rome. 

However, I find the fact that ancient cities developed in this way puzzling because in modern cities we re-purpose or demolish buildings leaving the base level intact. How exactly does this ancient layering form?

Edit: Sorry I have been out for the day, thanks to everyone for these responses. Fascinating!!",How does the 'layering' of old cities occur?,1894
Fapotheosis,147,683,1a20ls,1075,"I know mitochondria may have evolved from bacteria, but what about blood?  I've heard of a protohemocyte, but was there an initial cell that differentiated into a RBC like we have in modern humans that can we trace? ",How did blood evolve?,1758
phuck,341,1438,wrhb4,1075,,"I once heard that if you wore glasses that turned your vision upside down for about 3 days and you took it off, you would see the world upside down. Is this even possible?",2513
gregthegeek1,154,690,1b3udx,1075,"The chemistry teacher just says that the biology teacher is wrong, but there has to be a reason why it's taught.","Why does my biology teacher tell us that the formation of bonds between atoms stores energy and the breaking of them releases it, when my chemistry teacher tells us the opposite?",1765
lex007,189,835,12fybf,1074,"e.g. over Earth's history, having permanent ice at the poles is an anomaly, not the norm (receding from it's peak where ice reached as far south as Ohio at the height of this ice age).

From my understanding, we are technically at the tail end of the last ice/glacial age.

Losing ice at the poles is inevitable, is it not? 

The Earth has had ice free poles over the majority of history that life has existed, true?

Am I missing something? ",Aren't we technically still in an ice age?,1909
Pastatower,614,1042,piahx,1073,"Does sleep even provide ""energy"" for the body or does it just help us focus? 
**What happens during those 8 hours that appears to give us energy?**","What happens during sleep that gives us ""energy""?",2115
yupko,144,569,1orhw6,1072,Or does sleep deprivation only affect cognitive ability in the short term?,Can chronic sleep deprivation permanently decrease cognitive ability?,1641
Studybuddies,363,1444,pmbbj,1076,"Is there a specific plant that is best at the process of creating oxygen?

Edit: 
Factors for a specific scenario:  

Unlimited access to water and sunlight (source of energy) The soil has all necessary nutrients. (Optimal conditions)

An average male at 80 kilos at 180 cms and age 20. 
The person has no threats that will cause them to need to increase their consumption but the risk should still be considered ensuring a few extra plants are in the room.

( These are factors I assume change oxygen production and consumption, I could be wrong)",How many plants would I need to have in a sealed room with me to never run out of oxygen?,2520
Tio76,203,1167,sgf6p,1069,"I have noticed throughout my life that at times the urge to urinate can be quite severe, yet when I finally am able to relieve myself the volume urine expelled can be relatively small. However, other times the urge may be less severe yet the subsequent urine production be voluminous. What are the factors that influence the severity of the urge to urinate? Is it more than simply the volume of urine in the bladder? ",Why is the severity of the urge to urinate not always correlated with the subsequent volume of urine? ,2236
BlackGingerMilton,90,775,1qvy7q,1065,,It is known that having immense size like Andre the Giant is ultimately hard for the heart. What about their brain? what is the effect of having such bone mass on the brain?,1840
PigeonCoo,254,911,1h1lf1,1065,I got the idea to ask this question from [this thread](http://www.reddit.com/r/AskReddit/comments/1h1bi6/reddit_whats_something_that_people_use_everyday/capv32m).,Do hand dryers counteract the act of washing one's hands by blowing bacteria onto one's hands?,1976
dtkb,239,789,1gwuar,1061,What happens if we were to break the sound barrier underwater?,Have we broken the sound barrier underwater?,1850
theclaw,389,830,13xyho,1060,"I live in a region (Bavaria :-).) where it's a no-brainer when, for example, an 8-year-old child takes a sip from a beer. There are a lot of people who think this is a no-go and devastating for a child of course, but is there any scientific evidence that this is actually the case?

Is alcohol in very small amounts harmful in any way for children?",Are *really* small amounts of alcohol harmful for children?,1890
[deleted],296,998,y7fym,1058,"We all have this perception of the body being connected and everything having its appropriate place. I just realized however I never found an answer to a question that has been in the back of my mind for years now.

What exactly keeps or organs in place? Obviously theres a mechanism in place that keeps our organs in place or they would constantly be moving around as we went about our day.

So I ask, What keeps our organs from moving around?",What holds our organs in place?,2056
firefall,291,1211,w9ure,1059,"Does it boil down to the # of frames they see compared to humans or is it something else? I know if I were a fly my reflexes would fail me and I'd be flying into everything, but flies don't seem to have this issue.",Do flies and other seemingly hyper-fast insects perceive time differently than humans?,2270
HiDef90,249,1025,ps7kw,1065,"Olympus Mons has been measured at 22km high. How? From where?

Thanks :)

UPDATE: Thanks heaps for all the comments and interesting answers!!!

I shouldn't have gone to bed, could've ridden that train all the way home!!!","How do we measure mountains on Mars without a level for zero? Ie, our sea level.",2090
hardwarequestions,427,1002,pchg8,1061,"last i heard they had resumed efforts to reach the lake, were very close to breaching it, but the team hadn't been heard from in almost a week.

correct? thoughts on the matter? did they find Predator and were all massacred?

EDIT: wow everyone, I didn't expect this to be such a popular post. You all are just so generous with your votes :)",what's the current status of that 20 million year old untouched lake dig happening in antarctica?,2063
jaycure,194,713,1qtwue,1058,"Just wondering; when along the line did animals begin to possess the power of venom for attack and/or defense? What is the oldest fossilized venomous creature that they've uncovered?

EDIT: Wow! Didn't expect this question to spark so much curiosity! Many thanks to the scientists sharing their time and knowledge with us!!!",When and how did animals evolve to use venoms?,1771
QuickSaintPat,225,767,1cm309,1063, I thought alcohol was the only active ingredient in liquor. Yet people I know claim that alcohol X has effect Y on them. Is their any truth behind this? Or is it a coincidence that they were drinking X while feeling Y?,"""Whiskey makes me an angry drunk."" Do different types of liquor have different effects?",1830
ultrafilthy,160,756,129zwx,1057,"http://www.youtube.com/watch?v=qGGabrorRS8
This machine turns plastic waste into oil. Is there an ecological catch which is preventing this machine from spreading across the world? Why is this not spreading like wildfire? ",What is the catch on this machine. Why is it not flourishing? ,1813
talkingzero,189,799,u1tyq,1053,.,Why is an elevated heart rate good when caused by exercise or sex but bad when caused by stress at work or driving in traffic?,1852
sileegranny,318,1202,qct1e,1054,,"Given that there are plenty of liquids more dense than water, is it likely that the deepest crags of the ocean are filled with liquids other than water?",2256
farty_mcfly,313,779,10fpsf,1051,,Why doesn't your beard go bald?,1830
krevency,208,793,y26ta,1052,,"If you're in the space between galaxies, is every dot in the background necessarily a galaxy? Are there free-floating stars or bodies that aren't a part of a galaxy?",1845
joshhinz,653,716,1pmi1o,1045,Edit: Wow so many responses. It seems like the general consensus is a 12V car battery will not kill a person. Thanks for all the responses.,"Why is a 12V household battery virtually harmless, but a 12V car battery potentially deadly?",1761
glaughtalk,230,795,1agrzu,1049,,Would the exterior of a massive rapidly spinning disc detach from the interior because it was advancing forward in time?,1844
dk00111,177,1162,16h93p,1044,"I know that the room goes dark when all of the photons are absorbed by the wall, but how does the color/material of the walls affect how fast the light is absorbed? Assume that the rooms are sealed and are in the shape of a cube. Since the light bulb can absorb the light too, assume it disappears instantly after it's turned off.

My guess would be that the black room would go dark first, but how about the other two? Does the fact that white paint scatters the light affect the rate that it's absorbed?

Side Questions: 

1) How about non-black/white colors. Would the times be different between a red and yellow room?

2) Does shape affect the time? Would there be any difference between a black, cubic room and a black, spherical room?

Edit: For some clarification, assume that all sides of the room (walls, floor, and roof) are made of the same material. There are no windows, fixtures, molding, carpet etc.

Edit 2: Good point about the absorption through air. Assume the rooms are a perfect vacuum.","Say you have three rooms: One painted white, one painted black, and one made of mirrors. A shining light bulb is turned off simultaneously in each room. In what order do the rooms go dark?",2206
Boccard,207,734,1f9het,1045,"EDIT: I should be more specific with my second question:

If a person who drinks coffee regularly in the morning suddenly stops, would he experience a decrease of the normal process that wakes people up as opposed to that person having never drank coffee regularly in the morning? Is that process a sort of ""standard"" that exists constantly, or does it fade away when you attain a new process that wakes you up, like drinking coffee?","Is there a ""natural"" way that the human body wakes itself up in the morning? If so, does drinking coffee in the morning lessen the effect of that process?",1779
enjoiglobes2,897,1397,qilid,1044,"Forgive me if this is a question that has been addressed before, but I was thinking about it last night before bed. I didn't think one could be feasible because of the Earth's rotation and the fact that it would have to be anchored to something orbitting the planet. Would it be possible to synchronize the orbitting anchor to the rotation of the planet? Wouldn't this be extremely variable?","Is building a ""space elevator"" even feasible?",2441
LivingDaylight,271,986,ovypg,1045,"There are three bulbs in the light, each nominally 60 watts, and I turn it down to roughly the same brightness as 3 40 watts.

I assume I would notice the 60 watts of heat coming from the dimmer, so I'm guessing it actually uses less electricity.

**Edit:** Thanks for all the responses and upvotes!  This is my first frontpage post!  More importantly, I have learned a great deal.  Thanks!","When I turn down the dimmer switch on my lights, do I actually use less electricity, or is the difference between the bulb's nominal wattage and the actual wattage vented as heat by the dimmer?",2031
brilisk,111,792,z7wdl,1043,,"When your foot falls asleep, why does it tingle so much and why is it so sensitive when it comes in contact with anything else?",1835
HiImGarrett,322,1082,wuflq,1047,,"If the moon is pulling away from the Earth at approximately 1-2 inches each year, how long would it take for it to lose orbit with us? Also, what affects would that have on the Earth?",2129
amap100,366,1131,uipz2,1039,,why do most of the planets revolve around the same plane?,2170
DrShenandrew,207,959,uh6y4,1040,"a picture of my fence here: http://i.imgur.com/OO2Fb.jpg

A little background info to prevent confusion:

* I live in Minnesota, not near any large bodies of water

* This picture was taken an a sunny 75 degree day

* I'm assuming that it is a metal fence with some kind of rubber/plastic coating(do not know for sure)

* and the fence is probably well over 10 years old



So r/askscience, what causes this to happen? And what makes them go in such designs? I'd really love to know.

EDIT: Another side note, on some parts you can peel it off, and it sort o reminds me of something like dried wood glue or something. Could it possibly be some sort of resin from when they put the coating on or glued the coating onto the fence?

**EDIT:**
**Answering some frequently asked questions**

* No, it isn't from the pine needles. Well, it may be in that certain section, but also occurs on parts of the fence that aren't even near any plants I'll upload pictures of different parts of the fence that aren't near any plants at all when i get the chance

* No, the fence is not anywhere near an: open pit mine, large body of water, stone working company, cement company, plaster casting, metal blasting, salt storage, busy road, farm etc I live in a normal suburban neighbourhood.

* We don't have a sprinkler system, basically the only time the fence gets wet is from the rain

* Also just thought I'd say that the residue type stuff has been there for a long time, it hasn't just recently occured

Additional questions that others have asked:

&gt; An additional question- Why is the pattern so intricate and regular? I notice that it's only on one side of the fence, and there seems to be wide variation in the pattern.","Well, r/pics got my curiosity up, what is this stuff on my fence?",1999
[deleted],495,1226,q3u4y,1040,"I've always been fascinated by the existence of an inner monologue.

At what age do people first ""realize"" they have this? Is it a part of the subconscious? What if a person is raised without having been taught a language, how do they ""hear"" their internal voice?


**Edit** I've never thought this thread would raise such interest. Thanks for frontpaging this Reddit. And thanks for the awesome answers.","Is it known if any other species have an inner monologue? How does the human mind recognize the inner monologue as its own thoughts, and not as external stimuli?",2266
chase_what_matters,109,745,1h6uce,1034,,I have a sunburn. Why is there a 3-5 second delay between the moment I scratch it and the moment I feel pain?,1779
Raptor69,443,766,180c5h,1040,"As far as we know antimater is unstable in the presence of matter. But space is quite empty, could an antimater star exist? Could we identify it? How?

I am more interested in the 3rd question, could we somehow distinguish the radiation coming from an (antistar?) From the radiation of a normal one?

Havent found this question easily so i hope wasnt asked before ;)

edit: woa thanks for the answers really nice thanks guys!",Could antimater stars exist?,1806
cleverless,227,628,17k5mo,1039,,"How do surgeons reattach bones, nerves, and blood vessels?",1667
Tmbgkc,412,664,14s9bt,1034,I'm 6 feet 4 inches and 220 pounds.  Why is my tylenol dose the same as for a 110 pound woman?,"Why is Tylenol dosed by weight for children, but not adults?",1698
Hansfishberg,182,650,1cliwn,1039,"Hey guys, been wondering this for a while, why for example will a ship made of metal creak and make noise when under high strain? ",Why do Metals make noise when they strain?,1689
Harkzoa,187,566,1nt589,1033,,There are thousands of pigeons in central London. They don't seem to be eaten by birds of prey. What's preventing predation?,1599
Sparkade,381,894,1acezd,1035,,"If I were moving at the speed of a bullet and shot a bullet backwards, where would the bullet end up?",1929
---,336,882,yim6z,1035,,Is there anything that a human  can take to rebuild their teeth?,1917
[deleted],381,1101,rnbgb,1029,"I know this is not the case for every girl and every boy.

I am assuming this is a totally cultural-relative thing. But still, how do they initially form their distinctive hand writings? Do they copy others, is it the way they are taught, etc.?

By ""girl and boy hand writings"" I mean the stereotypical hand writing girls have; curved, ""bubbly"" letters, while boys usually have fast, messy hand writing.

Thanks!

Oh and I am saying ""girl"" and ""boy"" instead of ""woman"" and ""man"" because this question revolves around when people are young and that is when they (usually) start to write in this society, therefore ""girl and boy"" is more relative than ""woman and man.""
","How do girls develop ""girl hand writing"" and boys develop ""boy hand writing""? ",2130
warheat1990,242,453,19tjl9,1033,"I mean, there are ton of script around. How does antivirus detect if a file is a virus or not?",How does Antivirus software work?,1486
graaahh,114,814,13e5fx,1028,"Even when it's warm, I can't sleep as well without a blanket, and I don't think I'm alone there. Why are they so comforting to us psychologically? ",Why are humans psychologically satisfied by blankets? ,1842
playblu,120,798,yprvd,1026,,"When a child receives an organ transplant (heart, kidneys, etc.), does the transplanted organ grow along with them as they get older? How does it know what speed to grow at?",1824
IVIilitarus,311,1222,t1ehq,1026,"To clarify, this would be the galaxy's crappiest ion drive equivalent. Since ion drives eject ions to generate thrust, the force generated is tiny, but will continuously accelerate an object in the vacuum, I want to know how long a flashlight ejecting photons would do the same, since it does have a tiny amount of force that's exerted onto the flashlight when the photons are ejected, being Newton's Laws and somesuch.

To make it simpler - Any weight of flashlight and luminosity can be used, but I'd rather not have some kind of super light flashlight with ultra-luminosity. Just a flashlight that you can pull off of a shelf in a store.

The batter weighs as much whatever batteries are used in the model of flashlight, but do not change in mass as they run and do not run out.

The environment is a perfect vacuum with as little gravitational influence as possible.

How long would it take to accelerate this flashlight to 350m/s? (approx. the speed of sound in dry air)

How long will it take to accelerate the flashlight to near-lightspeed?

How long will it take to accelerate to 120km/h? (highway speed)

I read about it somewhere that no matter how heavy a spacecraft is, if there is no outside influence heavier than a flashlight, then pointing a flashlight out the ass end will eventually cause acceleration, even if it's millenia from now. It's not meant to be practical. Just to make people go ""Cool"" that a flashlight could theoretically propel a spacecraft.

I'd do this myself, but I flunked math.","If I had a flashlight in a zero-G vacuum environment, infinite battery and switched it on, how long would it take before the ejected photons generate movement?",2248
cheline3,219,693,1kq2el,1022,I'm wondering if the light waves or photons somehow combine to make a wave of a different color.,When you cross 2 different colored lights they make a different color. (ex: red + green=yellow). Is this due to a physical effect or just due to how our eyes are made?,1715
KeoneShyGuy,384,889,122dhp,1025,,"Is the recording of my voice really what my voice sounds like? Why does it sound more ""nasally"" than when I hear my voice directly?",1914
typewriters305,178,1577,zdxj6,1020,"[For instance](http://i.imgur.com/CDzkd.jpg) (that link is the NSFW part, btw). I'm just wondering what is happening that causes such a loss of control.

EDIT: added warning for link.",What exactly is happening (physio-chemically speaking) during a convulsive orgasm?,2597
[deleted],170,1039,s0pfo,1024,,Why can't our bodies limitlessly produce vital cells such as brain cells but we can practically infinitely produce more or less useless cell types like body hair?,2063
HowToPaintWithFerret,241,947,15cg2w,1027,"If the DNA's identical, is there any other way to tell?","If a woman has slept with identical twins during the same time period, and becomes pregnant, is it possible for her to tell who the father is?",1974
AlphaMarshan,104,797,ythbg,1017,,"Is there any evidence that constantly waking up in a panic (such as a loud alarm) is more detrimental in the long run to one's health than waking up more ""peacefully"" or ""naturally""?",1814
