author,comments,downvotes,id,score,selftext,title,upvotes
odnacs,103,367,12c2vh,853,"Given the properties of our planet, what is the biggest possible hurricane that could form?

EDIT: Also, what about wind speed?",What is the biggest a hurricane could get on Earth?,1220
peniscockdickboner,115,472,1o71vb,848,,How do chemicals like capsaicin and menthol trick the tongue into feeling hot or cold?,1320
Ninsha,374,806,v5y0k,842,"I was having this discussion with a friend, who's argument was that drinking water burns calories because it cools the body, which is then forced to reheat itself...so IF that were the case, wouldn't being in a cold environment cause the body to burn more calories in heat?

Edit: Front Page?  You are too kind,  truly.","Does cooling the body (ie cold shower, standing in a cooler) burn calories as the body re-heats itself?",1648
[deleted],383,1099,rhj9l,848,,"Why is it that animals can drink from streams and lakes without harm, while humans can get violently ill?",1947
dragodon64,198,460,18q3zm,846,"Let's group all possible metabolism in a 2x2 of (met. by human, not met. by human) x (met. by flora, not met. by flora).

1. If it can't be metabolized by anything, well that's the end of that.

2. If it's metabolized by humans and not any of the flora, we know how that'll end up.

3. If it's metabolized by flora, but not humans, then the human can't possibly lose any potential energy there, but has a chance of getting some secondary metabolites from the bacteria that may be metabolized by the human.

4. If both can metabolize it, then, assuming a non-zero uptake by the flora, we'd have to be losing some energy there.

I'm wondering if the potential benefits of the 3rd interaction outweigh the potential losses in the 4th scenario.

Thanks!",What percentage of the calories that a human consumes is actually consumed by intestinal flora?,1306
i_lick_my_knuckles,479,980,rz8r0,837,"I'm looking for peer-reviewed studies that examine links between cannabis use and mental illness in human adults.

I'm not interested in the ""500ml of delta-9 THC injected into brain stem of cat causes headache"" style of ""research"".  I am specifically looking for representative cannabis use (probably smoked) over a period of time.

As far as I am aware, there is not yet clear evidence that cannabis use causes, does not cause, or helps to treat different kinds of mental illness (although I would love to be wrong on this point).

From what little I already know, it seems that some correlation may exist between cannabis use and schizophrenia, but a causative relationship has not been demonstrated.

If I am asking in the wrong place, please suggest somewhere more suitable and I will gladly remove this post.

Thanks for your time.

*Edit: I am currently collecting as many cited studies as I can from the comments below, ~~and will list them here~~.  Thanks to everybody so far, particularly for the civil and open tone of the comments.*

*Edit 2: There are far too many relevant studies to sensibly list here.  I'll find a subreddit to post them to and link it here.  Thanks again.*
",Cannabis and mental illness,1817
kgros004,263,558,10gfsj,838,"I was working at the Bloodmobile today, and I was wondering why we can't synthesize human blood.  There is always such a need for whole blood, plasma, and platelets, especially during times of crisis.

We can synthetically create so many things in a laboratory, that it seems strange that blood isn't one of them.  Or is it that we can produce it, but it isn't safe for humans to use.

Edit:  Correction","Can we synthesize human blood?  If not, why is it that we can't?",1396
magiccheese,433,877,ojd68,835,"Does it have to do with the Lorentz factor?

Or does it have to do with the wave-particle duality of light? 

I believe the latter is the key, but I'd like a clearer explanation. Perhaps my question boils down to, ""When does light act as a particle, and when does it act as a wave?"" (the answer to which I believe is, ""When it is observed/not observed,"" but I still don't see how that resolves the initial question). ","Given E=mc^2, if the mass of photons is zero, why does light have non-zero energy? ",1712
Mayafoe,116,345,1cyizs,836,"Was just wondering- if we had much greater amounts of energy available then desalination on an agricultural scale would be possible, helping the billions who are potentially going to lose their watersources in India and China as the Himalayan glaciers, which feed all their rivers, melt away. Anyway, was curious about this...","If all the salt in the oceans was removed and made into a single cube, how big would the cube be?",1181
flyingmike,109,434,1b8xmu,832,"I have seen several news reports that talk about a quicker route or new technology but no elaboration.

Thanks",How was the Soyuz able to get to the ISS in 6 hours instead of 2 days?,1266
r0ckaway,593,537,ko638,838,"Source: http://www.forbes.com/feeds/ap/2011/09/22/science-eu-breaking-light-speed_8695154.html

*at CERN!","If the particle discovered as CERN is proven correct, what does this mean to the scientific community and Einstein's Theory of Relativity?",1375
Gamma_Blaze,206,441,1dgnxp,835,"This is mainly referring to surgeries done in places with typically more body fat, such as stomach or chest area.","How does obesity affect the procedure of surgery? If the patient carries excessive body fat, how much does it hinder the surgeon?",1276
oliv3r,290,484,158oxh,835,,"In laymen's terms, why does splitting an atom release so much energy? ",1319
KingOfGingers,117,774,xjdd6,836,,"Why is smiling (teeth-baring) considered friendly in human behavior, but seen as a hostile gesture to certain animals?",1610
mrshenryplease,333,650,qsup8,834,"In the U.S. northeast (not sure about other locations), we've had an exceedingly mild winter.  Crops, plants and animals, allergies, and future weather patterns this year are all affected by this, but how? and in what way?",How does a mild winter affect the rest of the seasons?,1484
mnLIED,140,528,14j9lz,829,"Of course, it would differ from species to species, but have we been able to date bones? Or are we only able to compare them to modern reptiles/birds...",Do we know the general lifespan for dinosaurs?,1357
Farstucks,371,962,vuj4x,837,,"If childbirth is one of the most painful experiences one can go through, how come it does not render the person unconscious as when having other forms of pain inflicted?",1799
elchip,152,527,18wb5z,833,"Caramelization of sugars and the maillard reaction, responsible for the browning and crisping of food, is associated with temperatures in excess of ~300 degrees F.  Since water at atmospheric pressure boils at ~212 degrees, caramelization and the maillard reaction don't occur and the food gets neither brown nor crispy.

But what if I had a pressure cooker that could raise the boiling point of water above the requisite temperature?  Would it get brown and crispy, effectively frying it?  Or would something else (likely unpleasant) happen, such as the food getting brown but waterlogged/soggy?","If I had a pressure cooker that could raise the boiling point of water above 300 degrees F, could I fry food in water?",1360
Philip_of_mastadon,283,627,xn5bf,834,"Has the effectiveness of whitening toothpastes improved measurably in recent (or not so recent) years, or is it all hype? What, if any, ingredients are responsible?","Have whitening toothpastes improved measurably in recent years, or is it all hype?",1461
csihar,173,688,u4cq7,828,,"What is happening on the cellular level when you rub lotion into your skin, and why is it good for you?",1516
Swarthily,225,562,t7kyy,836,"My friend is convinced that microwave radiation destroys the nutrients in food or somehow breaks them apart into carcinogens. As an engineering physics student I have a pretty good understanding of how microwaves work and was initially skeptical, but also recognize that there could definitely be truth to it. A quick google search yields a billion biased pop-science studies, each one reaching different conclusions than the previous. And then there are articles such as [this](http://www.health.harvard.edu/fhg/updates/Microwave-cooking-and-nutrition.shtml) or [this](http://www.nytimes.com/2006/10/17/health/17real.html?_r=1) which reference studies without citing them...

So my question: can askscience help me find any real empirical evidence from reputable primary sources that either confirms or refutes my friend's claims?",My friend is convinced that microwave ovens destroy nutrients in food. Can askscience help me refute or confirm this?,1398
katinacooker,815,977,uplu1,831,"Inspired by this : http://www.leasticoulddo.com/comic/20120607

At first i thought normal guns would be more effiecent in space, as there is no drag/gravity to slow it down after it was fired. But then i realised that there is no oxygen in space to create the explosion to fire it along in the first place. And then i confused myself. So what would happen?",Would a normal gun work in space?,1808
PotatoPotahto,163,827,17sqfw,827,"Apparently there's a big difference between gender and sex, I meant sex, the physical aspects of the body, not what one identifies as.","If everything evolved from genderless single-celled  organisms, where did genders and the penis/vagina come from?",1654
outlandish77,287,765,mv2od,832,"Yes I have seen the scumbag brain posts, and tried reading up Wikipedia, but what I don't understand is why can't we sleep at will. On more than one occasion we all end up tossing and turning around in the bed when sleep is all we need, so why?

Edit 1: Thank you mechamesh for answering everyone's queries. ",Why can't we sleep at will?,1597
morphogenesis28,168,789,1ljy4q,828,,"Is female ejaculation or ""squirting"" just urine or is it something else?",1617
RagingAlien,187,502,1pclz5,825,"If the cells of our body are constantly renewing themselves, how are there permanent tatoos and scars? Wouldn't they eventually fade and disappear when the cells that were part of them got renewed by other cells? Why would the mitosis of the old cells carry along things like color? And why would the body not just renew the skin underneath the scar like it happens with most cuts?",How are there permanent tatoos and scars?,1327
ArSlash,367,945,1awros,826,So I saw [this](http://www.youtube.com/watch?v=jrje73EyKag&amp;t=10s) video. What if you built a huge mirror and focussed the light on the bottom of huge water tank? The water would vaporise and the steam could move huge turbines thus creating energy. Isn't this effective?,Why aren't we using mirrors and sunlight to make energy?,1771
mozuk87,629,901,nl526,825,,"Is mathematics a universal language? If so, how could we use it to communicate with another civilisation after initial contact?",1726
Machrus,272,2789,ps7rt,818,,Why do people pee whilst pooping?,3607
happles_the_hero,240,682,wt99s,814,"Aerographite is the lightest solid on earth

aerographite = 0.18mg/cm^3  
air = 1.275 mg/cm^3

*sources:*  
http://en.wikipedia.org/wiki/Aerographite  
http://www.wolframalpha.com/input/?i=density+of+air+in+mg",Aerographite is less dense than air. Why does it not float upwards?,1496
gnomee99,292,538,1hwqdp,822,"There was another ask science post that mentioned the two types of beta decay and how a neutron decays into a proton, electron, and electron antineutrino, but a proton doesn't turn into a neutron by capturing the other two, instead it emits a positron and neutrino.  Since the capturing a particle and emitting the antiparticle seems to have the same effect, I was wondering if there are any serious scientific theories that suggest antimatter is just matter moving backwards through time?  As a secondary question, if so, does it help explain the abundance of normal matter?",Are there any theories that posit antimatter as just normal matter going the other direction through time?,1360
dannyswift,99,465,16eu22,818,"It's frequently in warm locations/not necessarily that far down, but they haven't even eaten the accessible oil","Oil is a huge potential source of energy, so why haven't bacteria been eating it all?",1283
Dropbear81,194,687,sid8i,820,"When I go to sleep, I get really strong urges to lie a certain way - on one side, on the other side, on my stomach, on my back.  It's not always the same way.

What's going on to make someone toss and turn like this, and how does the body/mind decide what the best sleeping position is?

Also, how do our brains stop us falling out of bed while we're asleep?

**Edit**  Wow, I never expected so many responses! Many of the replies below are fascinating, so please keep them coming.",How does the body (or mind?) choose the best sleeping position?,1507
TurtleCracker,162,519,1iwz1m,819,,"Are researchers who work with viruses like HIV at risk for infection? If so, how do they safeguard themselves against it?",1338
mthiem,94,586,iinja,819,"Just came across this subreddit and it's already easily my favorite. To all who are passing on knowledge of their fields, kudos on making reddit a better place.",Just a huge thanks to all who answer questions here.,1405
Punk-A-Doodle,143,495,1crk2t,813,"Don't they both just heat the food up or is there something i'm missing?

Edit: Thankyou for all the brilliant and educational answers :)",Why does microwaving food (example: frozen curry) taste different from putting it in the oven?,1308
LoveGentleman,182,571,y4vmz,820,"Say Buzz Aldrin and that other guy (fun right?) happened to be stranded and ate the cyaniade outside the lunar lander, how would their body decompose? In the suit.","How long would bodies be preserved on the Moon? If astronauts died there, what would happen to their bodies?",1391
ItGotRidiculous,209,859,udqnv,813,,Why do I have to close my eyes to go to sleep?,1672
pmac135,287,863,tgm3e,816,,"What causes teeth to go yellow, and how can the discoloration be safely reversed? ",1679
OliverTheWanderer,205,513,1pbara,815,"I've come across the statement in quite a few different articles and papers that during normal childbirth, the mother transfers intestinal bacteria to her new born by way of essentially poo. This bacteria is supposed to colonize the child and help with immune system development and a number of other things. By having a c-section, the child is deprived of this initial bacteria boost which appears to be a bad thing. How much of this is true?",Bacteria Transfer During Childbirth,1328
Just_got_stoned,282,459,13w14h,811,,"What are the differences between 16, 32, and 64 bit programs? ",1270
deterra,150,420,191pw2,816,"That is: does depression cause a feedback loop neurologically?  I have been coming across a lot of defeatist depressed people who, explaining that their condition is biological, say that their depression is unescapable.  If it works like a feedback loop, would that be partially refuted?

I am more interested in the neuroscience than in the psychology of this question, but either perspective interests me.

This question can apply both to circumstantial depressive episodes and to Major Depressive Disorder (I'm interested either way!).

*EDIT:* Thanks for all the thoughtful responses!",Regarding altered brain chemistry in depression: Does the altered brain chemistry alone cause the depression or does depression itself alter the brain chemistry?,1236
Geologitize,180,560,z9cre,812,"With the 35th anniversary upcoming of Voyager 1, I've been doing some casual reading on the two spacecraft, they've fascinated me.

/

How much further can we expect the two Voyager's to continue transmitting? (Barring unexpected failure of components)


/

And as a secondary question, if we built a spacecraft today with a similar mission, How would our current communications technology impact transmission distances to these new spacecraft? Would they work for significantly further distances, or is there some other limiting factor?

Thanks!

Edit: Found an answer to question 1

Edit 2: Removed Question 1 Strikeout, different, but related post [here] (http://www.reddit.com/r/askscience/comments/xn18q/how_long_will_nasa_be_able_to_communicate_with/). Thanks for the clarification.",Voyager 1 and 2 are still communicating today; How much further will they transmit for?,1372
ramblerandgambler,164,753,1ih44w,812,,"If one calorie, when burned produces enough energy to raise the temp of a litre of water by one degree. If I burn 100 calories, could I boil that same litre?",1565
SonOfSatan,101,730,171mp2,808,"How is it that our body stops us from retching every time we try to eat? And why do we still mostly puke when trying to eat things not identified as 'food'?

**EDIT:** Guess this is my first front page post. W00t.",Why doesn't eating stimulate our gag reflex?,1538
Vidyogamasta,405,830,phmbj,808,"I don't know why I randomly thought of this. My premise may be wrong, but I'm fairly certain electricity is a fairly recent (past few hundred years) discovery. I'm sure there were many cases where rubbing cloths and furs and touching something metal occurred. People then were sure to receive a small shock.

Was this something that was largely ignored? Or was it explained away somehow? Did anyone at that time try to figure out what caused it? I'm tired and studying electromagnetism for a test tomorrow, so I got curious =P","Before electricity was discovered, static shock must have still existed. How was it explained thousands of years ago?",1638
Dvout_agnostic,259,1053,p3b53,812,"How does your body regulate blood volume?  When you give a pint of blood to the red cross, your body makes up the difference over the next few hours.  How does it know how much to produce (or more to the point: how does it know when to stop?)  If I had my leg amputated, is the equivalent volume of blood in said leg physiologically subtracted from my total blood volume norm?",Do amputees maintain the same volume of blood they had before they became amputees?  ,1865
pancakepancakes,138,493,1mrdi1,811,"Hey, mathematicians, physicists, computational whateverists, I have a question.

A while ago I stumbled across a website that detailed how one could employ mathematical techniques to 'switch' the perspectives of the light source and the camera in a photograph. E.g. A beach ball photographed from the front and illuminated from the left becomes a beach ball photographed from the left and illuminated from the front.

The paper I read claimed that it could be done with any image with a defined light source, but I've lost the paper! And I don't know how it works or how it's even possible.

Could I have either a link to a relevant paper or a description of the process?

Thanks!!",Is there a mathematical technique for switching the perspective of the camera and the perspective of the light source in a photograph so that the camera is looking from where the light source was and the light source is where the camera was?,1304
FrostyPlum,208,393,1nmbvv,810,"So I understand that the p and s suborbitals can only hold a total of 8 electrons. My question is: why 8, and not 7? Or 10, or any other number. Is there math that explains this?

EDIT: wow that is a lot of answers.

Note that while I am a high (schooler? scholar?) school student, I have a bit of a mundane physics background so don't dumb anything down too much.",Why do atoms prefer to have 8 valence electrons?,1203
[deleted],166,723,xfng2,815,,"If you were in a coma from ages 9-19, how much would your body grow and mature?",1538
Teedy,1001,504,tpwob,803,"Hello Everyone,  

I've decided to do an AMA today, literally, most of the day to answer all the questions you normally don't get to ask about medicine and physicians in general.  I *will* get to your question, sooner or later.  It may take me a week to catch up on them, depending on how busy this gets, but I promise I will do my best!

I practice in one of the largest trauma centers in North America, with a full pediatric emergency suite as well.  I've dabbled in a few other areas of the hospital, and occasionally cover some ICU positions if others require time off.

I'm especially familiar with ventilators and mode selection and treatment of asthma and respiratory illness in general.

The rest of our green panelists have graciously offered to help answer the questions I can't here, so please be gracious towards them as well if I can't answer for you.

**While this is an AMA I want to keep it science focused.  I'll answer a few questions off-topic here and there, but let's try and keep this focused for the most part**

**MEDICAL ADVICE IS NOT PERMITTED ON REDDIT, PLEASE DO NOT ASK FOR IT**

~~*I'm quickly making myself some lunch, I'll be right back if I don't reply quickly. 12:50PM MTN*~~ Back

**Alright guys, It's been a boatload of fun doing this, it was a lot more work than I expected too.  Feel free to send me a pm, or post a top level question here.  I won't get them to right away as I'm going camping for a few days, but I will reply, so long as they're appropriate and can be answered when I return.  Thank you to EVERYONE who participate, for the great questions, for everyone else who helped answer, and for all of you for being gracious and patient when I was slow to respond, this has been a hell of a lot of fun!**",AskScience AMA Series: Emergency Medicine,1307
rohanman,131,410,100to0,806,"I struggled in college with higher math. However, I made it through. Today I work in engineering and still struggle. I figure I am probably not alone with my challenges. I read a lot of technical papers and find that many writers tend to ""write with math"". This is horrifying to me every time I turn the page to see no words - just endless equations. Usually following these equations is a declaration of ""...in conclusion, you can clearly see that..."". I also hate it when authors neglet to define variables. 

My question is, what is your process for reading these equations? I tend to look for familiar similar equations and get the context but that is about all I do before getting bored and moving on. Please help me get better at reading math. Was there a course that you took that taught these skills that I slept through?

EDIT:Wow…great suggestions. Thanks so much. Here are the most helpful comments: 
Take notes, decompose the equation, read it over slowly again and again…take your time. The equations are there for precision, words (prose) are there to introduce, conclude. Practice. Practice. Practice. Understand the variables. Run the equations with the variables at 0, infinity, etc to find out what happens.

It seems that engineers suck at writing. I would humbly suggest that perhaps we should try to improve that in the engineering field. 

This is really good helpful paper on this topic: http://web.stonehill.edu/compsci//History_Math/math-read.htm

Thanks all, this has been a great learning opportunity!",The process of reading math,1216
ammcurious,228,495,zrsmo,814,"EDIT 9/18: For those interested, I just found this article, which has been pretty enlightening... http://www.crai-ky.com/education/reports-cem-hazards.html","I once heard a rumor that archaeologists digging at Five Points NY (basis for ""Gangs of New York"") contracted 19th century diseases. Is this true? If so, is this the only instance of an old disease becoming new again?",1309
reidhoch,137,577,z4r1u,812,"I'm mostly interested in modern human burial with an embalmed person in a casket, but I'd like to hear about other forms of burial also.",What effect does human burial have on the environment?,1389
cpmpal,94,474,1qx8zd,803,"I am currently studying transistors in school, and have come to a bit of a mental impasse trying to make a model for them in my head. I've read through some of the material on wikipedia and my professor's notes about band gaps, but I have a basic question of how current flows at a subatomic level: would current moving through a regular metal be like each electron appearing in the closest neighboring orbital, as a chain reaction, when a voltage is applied to the metal?

Extra question: what does applying a voltage look like at a quantum level?",What does current look like on a quantum level?,1277
blueblarflubar,84,476,19i8k6,805,"I am fairly certain that if mammoths were to be cloned, the first one would be crippled age wise, but would offspring of that mammoth have full telomeres?","If we cloned a mammoth, would that mammoth and all resulting mammoths that spawned from that mammoth have extremely short lifespans due to telomere length?",1281
cattoss,118,402,1cocxg,801,"Mobile as in creatures that actively move around in a controlled manner, not those which travel and replicate through spore-like methods.","Are there any mobile, multi-cellular organisms that utilize Chlorophyll?",1203
baconboy007,204,426,1c4p1i,806,"For example if our solar system was USA and earth was DC have we passed the beltway, Manassas, Chicago or are we still one foot in the door of the white house?",How far out into space have we sent something physical and had it return?,1232
