author,comments,downvotes,id,score,selftext,title,upvotes
nudelkopp,40,40,1qsnvr,16," I just heard this somewhere but I can't remember where. 

If all available number combinations are available in PI, that would mean that everything would be there, represented in binary code, right? All the music, all the movies, everything that can be saved to 0's and 1's?

In theory, if we had enough of pi, instead of storing individual files, could we have references to indexes of pi? As in, this song starts at decimal 28k and ends at 280k?

This might be useless info or maybe I've misunderstood this but shit guys; I'm fired up.","Given that PI is infinite, is it possible that all possible number combinations are available in it's decimals?",56
grogmaster,27,7,1qsmys,25,"I have a mediocre understanding of Noether's theorem, and I've gathered that conservation of information also appears to be a fundamental property of the universe.  Is there a correlated symmetry or does the conservation of information come from a completely different place/idea?",Is there a symmetry associated with the conservation of information?,32
SwagMasterPimpNigga,9,4,1qrrw3,1,Would it?,"If you were to fall at terminal velocity in the sky and another person is above you close enough to kick you, would the kick make you fall faster?",5
Itshardtofindnames,6,2,1qrjo6,6,"So if I lay down to sleep with my cheek on the pillow and breathe at a steady pace, where does my exhaled air go before I inhale fresh air?",Why don't we breathe in the air we just exhaled?,8
bzzzzzzlightyear,6,16,1qrihw,34,,do you still have the same fingerprint after the superficial skin is cut off?,50
DanmCanIJustComment,6,5,1qrfkr,0,What am i missing in this theory?,Why can't we bring plants to mars and put them in a Co2 chamber and wait for them to make enough Oxygen to create an living atmosphere?,3
______maybe______,5,2,1qrgip,6,,Why can we treat AIDS but not cure it?,8
dfrankow,7,3,1qrnoi,2,"[This article](http://www.bloomberg.com/news/2013-11-14/oil-producers-overtaking-refiners-on-flood-of-u-s-shale-energy.html) says shale oil is booming. Why now? I feel as if retail gas prices rose years ago, and haven't risen any further recently. Is this just the market catching up?
",Why has shale oil taken off in the last few years?,5
Ericthemighty,2,3,1qrp17,0,"Two quotes from an ask reddit thread inspired the question for me:
&gt; 
&gt; Dogs and cats and pigs and cows and bears and humans will taste different based on what they are fed.
&gt; 
Bears who feed on salmon taste like mud. Bears who eat blueberries taste delicious. This is why cattle and pigs are fed grain and/or corn. A pig raised on table scraps will taste bad.


2
&gt; I don't see how this make sense biochemically/metabolically. It all gets broken down into the same stuff and then reassembled based on that animals genetics.


..is it because of fat and blood content?",Why do animals taste different based on what they are fed?,3
ThomasGullen,5,0,1qrbwe,5,"Or on mars, with no atmosphere what are the odds a meteorite will hit the rover and destroy it?

Is this risk something they consider?  Or is it too rare to care about?  

Regarding satellites and space stations, surely taking damage from them isn't that rare!",What are the chances meteorites hit satellites and space stations?,5
Croftonto,8,7,1qrcna,24,,Do you get dizzy if you're spinning in space?,31
Jenovacell,15,29,1qro8w,41,"Just watched [this](https://www.youtube.com/watch?v=9U8CZAKSsNA&amp;feature=youtube_gdata_player) video, showing the world has detonated over 2,000 nuclear devices. Could all of that testing have lead or helped lead us to where we are now with global warming? What precautions were taken in regards to animal safety in the oceans, if any? Just watched it and it got me curious! Thanks in advance.",How much (if any) effect did atomic testing have on the environment and weather?,70
skommareddy,11,8,1qrpla,5,I know that they test a lot of them every year but where? How can you just have an explosion of that size safely?,How do they test nuclear bombs?,13
_Toby__,6,3,1qrqss,0,"I noticed that toucans and parrots have similar feet, and also seem to have similar personalities; a toucan at a pet store let me pet its head and seemed very friendly, much like a parrot. I was wondering how recent their common ancestor is.",How closely related are toucans and parrots?,2
JugaBoo,6,6,1qro1p,0,"Seeing a previous post saying that there are three times as many atoms in a teaspoon of water than there are teaspoons of water in the Atlantic ocean (sorry if that is not correct, I'm not sure how to link posts on the mobile app)  it really blew my mind. But then I thought, if atoms are so small,  how do we even know they exist and what they are made of.

Just going to say now, if the answer is obvious, I'm sorry. Never really been good at science and I just can't seem to wrap my mind around it.",How do we know atoms even exist?,6
jawn317,2,5,1qraab,16,"From what I've been able to gather:

1) All animals that exhibit blinking behavior blinks with both eyes at the same time.

2) Some of those animals (like us) have stereoscopic vision, while others (like rabbits) have a rather small stereoscopic field of vision.

3) It is possible for us to voluntarily blink only one eye at a time (e.g. a wink).

Why, then, do we not have involuntary winks?  Wouldn't it be more efficient to be able to clean each eye independently?

At first, I thought it might have something to do with stereoscopic vision, but why, then, would rabbits also have involuntary blinks?","Why do we have involuntary blinks, but not involuntary winks?",21
MissBelly,5,0,1qrft8,7,"We are introducing a purified protein from the mycobacterium and observing for an inflammatory reaction that indicates dermal T cells are already sensitized to the antigen, or in so many words, that you've had previous TB exposure. Why doesn't the introduction of the purified protein in the test sensitize T cells like true exposure would, and cause subsequent false positive tests?

Is it that the amount of antigen in the test is not enough to produce a memory response, and in a year you are technically antigen naiive again. Or is this, as I've been taught, a delayed hypersensitivity reaction like poison ivy, and you may eventually convert a skin test FROM skin tests with enough exposures?

My main question is why doesn't the antigen in the PPD sensitize T cells like a true exposure would and cause my annual TB skin test to be positive?",Why doesn't an annual PPD skin test for TB cause a subsequent one to be positive?,7
Jota-Pe,4,1,1qqorl,1,,If the Sympathetic Nervous System Causes Bladder Relaxation Then Why Do You Pee When Really Afraid?,2
Hmez,234,887,1qra44,1330,,How does our body know/learn not to 'wet the bed' as we grow older?,2217
hand_sanitizer_gel,8,1,1qqt8q,5,"I've never seen hypothyroidism be treated with T3 and whenever I talk to someone being treated for hypothyroidism they always report suffering a lot of fatigue and ""don't feel like themselves"" since their hypothyroidism became an issue and the T4 treatments don't seem to help them. The physicians always cite the TSH being within normal limits but, in this case, does normal = optimal?","For hypothyroidism, why is it always treated with levothyroxine (T4) instead of liothyronine (T3)?",6
Apiperofhades,6,3,1qr0zn,2,,Why do old people become incontinent when they get older?,5
idris_kaldor,11,21,1qr9q6,29,"There seems plenty of raw material in the belt, and presumably the standard ideas of planet formation still apply, so why didn't it form a rocky planet/planets? Is it something to do with the region, or other gravitational fields nearby? Side question, is it possible to have more than one planet with similar orbital periods etc, but 180 degrees apart so they never interact?","Why didn't the asteroid belt coalesce into a planet, like elsewhere in the solar system?",50
discordianizer,2,1,1qqllb,1,"I understand that they don't retain energy, but is it such a problem? Are they so inefficient that they're pretty much useless for all practical applications? Can't I just pour more sugar into my batter when it runs out of power?","Biobatteries have existed for a few years now. Why exactly aren't they ""a thing"" already? What's their problem?",2
contemplato,3,2,1qqhkb,3,,"Given a perfectly still body of water, above it a machine that pours water endlessly, evenly, and at equal rate, will the splash patterns be the same throughout?",5
orwhux,17,3,1qquy6,7,,If someone had every element on the periodic table could they in theory create any compound through a series of reactions?,10
Claclink,12,7,1qqvup,4,"So if a ball was kicked and we assume the non-centered kicking impact is non-elastic and the ball deforms, becomes assymetrical, and stretches and it imparts spin into the ball.  There is no air outside of the ball.  The inside of the ball has air. I feel like the path trajectory might wobble, but is there any way it could curve?",Can a soccer ball kicked in a vacuum have a curved trajectory?,11
1thief,5,3,1qqxin,3,"If you don't know, mirror neurons are regions in the brain that activate when performing a task but also when watching someone else perform that task. When two people talk, do mirror neurons play a role? Do they activate, do they activate more or less for different people, is there any connection with ""empathy"" and mirror neuron activation? How about when listening to an audio recording of someone - does mirror neurons behave the same way? What about reading dialogue from a book, or reading a description of someone performing a task are mirror neurons still activated? ",Mirror neurons and social interaction?,6
EssMyBees,10,10,1qqyyu,15,,"What is the process that drives osmosis? If it is not energy driven, why does it happen?",25
Aristocrack,3,3,1qqx2x,1,"I came across this comment on r/wtf/ 

http://www.reddit.com/r/WTF/comments/1qp2bd/cat_lungs_inflating_x_post_from_rgifs/cdf7cu4?context=3 

and got to thinking - Why does human lungs have 5 lobes, compared to other animals that have 7? 

Also, why is the number of lobes different for the right lung and the left lung? 

I'm guessing that this has something to do with the placement of the heart but I'm not entirely sure why.",Why do human lungs have five lobes?,4
anotherkeebler,6,13,1qr0n2,4,"I was looking through [this rather amazing gallery](http://imgur.com/a/QrDTe) of snowflake pictures and I realized I have no idea how a snowflake like [this one](http://i.imgur.com/Zy199dp.png) could have the same intricate shapes at the ends of six different tips. The [Wikipedia article](http://en.wikipedia.org/wiki/Snowflake#Symmetry) says that only one snowflake in a thousand is highly symmetrical, but even that strikes me as high odds. Can someone please enlighten me?","How do snowflakes ""know"" to be symmetrical?",17
Railsico,7,1,1qqj3v,4,The title pretty much explains it. Can anyone show a math proof that it is either possible or impossible to win a race but have an average lower velocity. ,Is it mathematically possible to win a race but have a lower average velocity.,5
thammaknot,5,1,1qqruk,3,"If so, how do the cells maintain such condition when they divide?
If not, how do cells not adjacent to the vessel get food?",Does every cell in our body touch a blood vessel?,4
chaosconundrum,1,2,1qqka2,8,,"Is ""summer gas"" still an efficient/fair emission-reducing alternative to modern exhaust filtration systems?",10
japko,4,7,1qqe9b,10,,Will globular star clusters eventually collapse under the gravity of all the stars in them? What will happen then? [Astrophysics],17
notsure_if_learning,6,2,1qqegs,3,"I understand the concept of piezoelectric compression and how it translates to electricity.

[I've also read this patent on for a piezoelectric ignitor] (http://www.google.com/patents/US4302181) but what keeps escaping me is how after the spring compresses to a certain point the striker springs forward and hits the element.

[I've taken them apart before and they look pretty simple.](http://www.eldensengines.com/Otherstuff/Piezospark/03-15-13-01.jpg) 

Can anyone explain to me how this works? Maybe this question belongs in one of the engineering sub-reddits but I thought I would start here. Like I said I read the patent but I still can't visualize how the mechanical compression can only go so far and then spring forward. 

Visualizing mechanical processes is a weakness of mine so the best I could hope for is maybe a drawing on top of the above pic that illustrates what is inside the chamber that allows for this transient mechanical action. Any other kind of picture or drawing would also be most helpful.",How does the mechanical part of a grill starter work?,5
cGxvd21hbg,8,7,1qqhbm,10,"This is for a fairly low-pressure application such as an air cannon.  It seems intuitive that if the convergent and divergent nozzles are exactly the same, then there wouldn't be much loss of pressure, although there must be some loss, and I'm not sure how negligible that would be.","When pressurized air enters a symmetric convergent-divergent nozzle, should the output pressure be the same as the input pressure?",17
vivalafaerie,4,14,1qqhl0,22,"I don't know if my question makes sense. I guess I was thinking about it in terms of how it seems that if a large enough group is singing together, anything discordant isn't really audible. Actually, I don't even know if that's true. Is it? Please help? ","When you hear a choir, are you hearing the average of all the singer's voices?",36
TheJMoore,6,2,1qq7y1,4,How is it that this cools off my food? What's happening atomically?,What is actually happening when I blow on my food to cool it off?,6
viveleroi,7,2,1qqdrc,3,"I'm trying to refresh my understanding of genetics because a game we're developing incorporates them.

We can pretty much say with certainty that pending any mutations, my offspring will have two eyes like I do, and my parents did, and theirs, etc. 

What is it that allows the ""eyeball count"" to be so stable, and yet the color so variable? Surely having ""two eyeballs"" isn't just a single genetic trait, it's got to be a much more hard-coded pattern somewhere.

I designed the game to pass certain abilities via genetic traits, but am finding that sometimes creatures lose vital abilities (like eating..., which tick off our players) when the inheritance rules are giving the offspring 50% chance of getting the trait...

","If qualities like eye color depend so heavily on genetics, how can genetics essentially guarantee us all two eyes?",5
numquamsolus,2,3,1qqedz,13,"In Will and Ariel Durant's ""History of Civilization"", they explain that Egyptian priests were accurate, often to the day, in their predictions when the Nile would flood, and that their predictions were based on the calculated appearance of the star Sirius. 

Others have asked similar questions regarding the timing of the flooding of the Nile, but their focus was on the timing exclusively (which is adequately explained by the appearance of Sirius) and not why the Nile would flood so consistently given what I would assume to be a wide year-to-year variations in climate in the upstream catchment areas.  I find it curious that the degree of the flood was indeed variable but the timing of the flooding was consistent.  Can someone explain this? ",Flooding of the Nile: Timing consistent despite variable upstream climate,16
GrumpleKelkins,6,2,1qqeld,3,,What would happen to a plane if it tried to leave the atmosphere?,5
th3buhs,8,1,1qq9vb,9,"To my knowledge, when we drink salt water, the salt in our blood causes water to leave our cells to try and reach equilibrium. Why doesn't salt just enter our cells? Would it be bad if salt did just enter our cells?",Why does water leave our cells when we drink salt water?,10
Sarial,2,1,1qqb23,3,"Working on some stuff about hemoglobin oxygen dissociation curve, and I'd just like some fact-checking on my understanding.

1) As you vary the amount of Hgb in the blood (like from 10g to 15g of Hgb) you wouldn't change the shape of the saturation curve (pO2 vs % Hgb saturation), but you would change the overall amount of oxygen that the person can store in their blood (higher maximum on ml O2 vs 100 ml blood), while retaining the shape. Correct?

2) Having 30% carboxyhemoglobin would result in the same maximum on a graph of pO2 vs % O2 saturation, but it would lose the sigmodal shape and be left-shifted (more affinity for O2 as the CO2 will not unbind, allosteric interaction keeps O2 bound).

3) While in #2 the level of saturation would remain the same, in a graph of pO2 vs ml O2/100 ml blood, the maximum amount of O2/100 ml would only be 70% that of someone with the same amount of Hgb in their blood.

Asking the questions is about as hard as getting your head around all the moving parts here, so if any of that is unclear, I'll definitely try and clarify. Appreciate any help!",Oxygen-Hemoglobin questions - Quantity of Hgb effect and effect of CO on saturation curves.,4
gravesville,2,3,1qpwzh,2,I distinctly remember being taught in grade school how to use Boolean operators to optimize search results in AltaVista and other search engines. Because back then (late 90's?) without proper syntax you would likely get the wrong results or no results. So when did this change and how did it change?,When did search engines become so optimized and how did it happen?,5
Jhaawk,6,1,1qpvw6,8,"Would that person only experience the positive effects of adrenaline and be more focused, stronger, faster, etc. or would there be extreme negative consequences over time?",What would happen to the body if it continuously produced Adrenaline for a long period of time?,9
Prezombie,9,1,1qpwg7,7,"I found this website when I was looking for a quick reference to find the nth Fibonacci number.

http://www.maths.surrey.ac.uk/hosted-sites/R.Knott/Fibonacci/fibtable.html 

I noticed a rather interesting quirk in the factorization.

Besides 3 being the fourth Fibonacci number, every prime Fibonacci number listed has a prime number on the sequence.

Of course, the last one listed is the 137th Fibonacci number. I looked at the longer list, and the next prime Fibonacci is 431st and 433rd. The deep double twins is rather intriguing.

Has this idea been contradicted, proved, or merely survived the current depth of the search?",Are all prime Fibonacci numbers !=3 at a prime numbered spot on the sequence?,8
The_Fro_Bear,3,2,1qpvml,6,"I understand that asphalt and concrete are used as road surfaces due to their durability, availability, and affordability and that rubber tires are used due to their low coefficient of rolling friction and high coefficient of kinetic friction.  What combination of driving surface and tire material would be physically ideal?",What would the ideal combination of driving surface and tire material be if construction and manufacturing constraints were not an issue?,8
ignorant_,9,5,1qqar4,8,"I was thinking about how photons do not experience time at their internal frame of reference. Since time is one of the four spatial dimensions, it got me wondering of there could be particles that do not experience other spatial dimensions. This of course reminded me of action at a distance. So has anyone done any work regarding the possibility of particles that simple exhibit properties of not experiencing the normal 3 spatial dimensions? I would expect that such a particle could interact with others at any location instantaneously regardless of distance. 

edit: I love trying to answer my own questions and reading up on the early work with action at a distance gives me a wonderful ""down the rabbit hole"" feeling :)","Could ""spooky action at a distance"" be the result of particles that do not experience spatial dimensions?",13
robyncsis,8,2,1qpyw6,5,"Is this even remotely possible? If so, what would the effects be? Would they be just a normal mutation?","In RNA, is it possible to have thymine instead of uracil?",7
zugzugdabu,6,5,1qq0y5,5,,"If there's very harmful bacteria and stuff in poo, why doesn't it harm us while it's in our body to begin with?",10
SadBrontosaurus,4,5,1qq6gw,7,"I steamed up my bathroom and shined the laser. You could clearly follow the beam to its destination, unless I shined it on the mirror. The beam would go to the mirror, and there'd be a reflection on the wall, but no beam to that final destination.

http://i.imgur.com/u2NMdR8.jpg

Edit: No clue what flair to use. Engineering?

Edit 2: Thanks for setting my flair!",What happens to a laser beam after it hits a mirror? [Picture],12
quantically_trivial,3,3,1qpvtv,8,"I was under the impression that there was a global net increase of forest biomass.

It's years since I read about it, but I'm pretty confident I read that the vast areas of taiga/boreal forest has such a large increase in biomass that it makes the global net positive. I read it in an old biology text book.

http://www.sciencemag.org/content/342/6160/850

This study says otherwise, though, and tells of decrease all across the board.

Are we in a period where deforestation is a problem no matter where we look, and not just in the tropical regions? If so, is this a recent development?",Is there a global net decrease or increase in forest biomass?,11
JustACynicalAsshole,94,225,1qpp16,414,"I've heard astronauts say that it is more of a challenge to keep the ISS from overheating than it is to keep it from freezing. I could see it being incredibly easy to heat it up, with a lot of old electronics and warm bodies and not a lot of molecules outside for heat to leave, how do they keep it from getting too hot?",How is the temperature of objects like the ISS or a space walking astronaut regulated without anything to transfer heat to.,639
NeedhelpMed,4,32,1qpnvf,29,What is the main biochemical mechanism behind it?,Why does thiamine deficiency cause beriberi?,61
Lallii,250,1344,1qpbb6,1750,"I guess I'm asking how the does water stay above the ground and not seep in? Does it have to do with the water table?
 
 
 
Thanks for all the great answers everyone! ","Why doesn't the water in rivers, streams and lakes just go into the ground?",3094
zSilverFox,21,28,1qpedy,43,"When a load of photons bombard an atom but don't have sufficient energy to excite any of its electrons, what happens to the photons? Do they simply not collide with electrons or are they re-emitted without change?

Thanks!",What happens when a photon hits an electron but doesn't excite it?,71
vladh,19,40,1qpegr,31,,"How does digestion work when you're upside-down? If hung upside-down, would you eventually starve, even if you had food?",71
Pictokong,10,29,1qplni,15,"I have been playing KSP for a while and this came up recently:
How does the NASA get into orbit around mars or jupiter (for example)? To save fuel i imagine they aerocapture, but is it common? Also, is there a limit on how much stress we can put the spacecraft in the atmosphere?",How can NASA get in orbit around other planets?,44
TheMadSun,45,114,1qpfzu,175,"All I've learned is that it's a number used in a bunch of formulas. What exactly is it, and for that matter, how did scientists find it?",What exactly is the Gravitational Constant?,289
So-Krates,34,101,1qpidc,205,,"How do black holes fit into the scheme of ""heat death"" or max entropy.",306
twizlinq,55,56,1qpccj,111,"so my understanding so far on the universe, and its particles, is for each particle, there is an anitparticle, now the photon is not an particle, however does it still have an antiparticle, or something which can be related to antiparticle",Does the photon have an antiparticle?,167
Higuy1234,17,20,1qp2p0,2,"In a normal space,oil and water don't mix,so would they in a vacuum??",Will oil and water mix in a vacuum?,22
marcm6246,5,2,1qof15,8,Why into a muscle and not into the bloodstream?,Why are flu shots injected into a muscle (the deltoid)?,10
TheBlueShrike,7,12,1qoker,21,"This is one science-y question for which I haven't been able to find a satisfactory answer. Most of my personal research has yielded the ""nobody really knows"" thing, but there have *got* to be *some* theories out there as to why this happens. ",Why do viscous liquids like honey coil when poured?,33
Dra9i,9,2,1qoqw8,8,"The only explanation I could think of is that although the electrical axis of repolarization is of opposite direction than depolarization, the flow of ions through the membranes is opposite as well (positive ions go inside the cell during depolarization and outside during repolarization). So it's like double negative. Is that right? And, if it is, can you please specify the exact mechanism of how does this flow affect the ECG? I just feel it could be right, but can't support it with any logic.","Why is T wave on ECG (in most leads) of same polarity like QRS complex, despite having the opposite vector?",10
MrZap,5,1,1qos8t,6,"Hi, just saw this [video](http://isupportorganic.blogspot.nl/2013/11/how-to-heat-room-for-less-than-15-cents-per-day.html). It's about a double wall convection heater which works with cheap candles.

I know some traditional heaters have double walls, so there is probably some solid physics behind this, but can anyone explain in laymen's terms why this is more efficient at heating a room then just putting the candles out?

",How does the double-walled heater in this video work?,7
KingOfAllDownvotes,8,17,1qoua9,26,Thanks.,"If the sky is blue due to Rayleigh scattering, why can we see the moon in its ordinary colours?",43
Saint_Oliver,13,19,1qovsz,38,"I've always been curious as to how this data is gathered. Do ice core samples contribute (I know they can be used to measure past CO2 levels)?

How reliable are these methods? How far back can they make measurements?",How do climate scientists make measurements of prehistoric temperatures?,57
