author,comments,downvotes,id,score,selftext,title,upvotes
soujiro89,12,13,1qzjrl,34,"So I was walking on a cloudy day and I noticed that before raining, most of the times, I feel the slightest amount of water. This is so tiny I cannot see it, but my skin does sense it. 

What would be the smallest quantity of atoms our epidermis can feel? 

Note: I have a general understanding that our skin has different sensitivity in different areas, so I would propose the question with the most common skin parts to be bare in the air (ie: hands, arms, neck, face). ",What is the smallest particle our skin can feel?,47
RedBeardedRob,7,0,1qzc7u,1,"I've always wondered if there is a universal ""Universe time"" versus a Earth time.  Meaning that we know 1 year is the length of time it takes our Earth to circle our Sun 1 time.  But this can't be what the universe uses to measure time.  As there are other planets circling stars, but would take much longer to complete 1 revolution than our Earth circling our star.

So, when we say that the universe is 14(ish) billion years old, it's only 10(ish) billion years old to another planet.

Has anyone measured time based on a different set of planet/star combinations?
",Earth Time versus Universe Time?,1
QuestionForAskPhysic,9,1,1qzfqb,1,"If we look at the probability of a particle in the ground state using the Shrodinger wave equation, it makes sense that the particle is most likely found in the middle.

However, if we look at the n=1 state, we see that if we square the wave equation, the particle cannot exist in the middle of a potential well. Why is this true?",Shrodinger Wave Equation Probability for Non-Ground State,2
smellydookie,8,2,1qzb91,13,,"Is mammal hibernation comparable to sleeping, a coma, or death for 3 months?",15
KineticSolution,22,67,1qz3mf,121,I understand that Mars has had volcanic activity in the past. Why don't we currently see volcanoes erupting or lava flowing from time to time now? ,Why don't we see any current volcanic activity on Mars?,188
Nameraser,1,0,1qyrst,1,"I've been making Alginate beads by dropping a 2% Sodium Alginate solution into a 2% Calcium Chloride solution. I was taking a look at them using a microscope and realized that there were a decent amount of deformities, although the overall sphericity of the beads were good. I was just wondering what might cause these irregularities.",What causes Alginate beads to be irregular?,1
warlockx77,3,0,1qyy8r,2,,Why can't TEM waves propagate through rectangular waveguides,2
dminge,5,0,1qz3jz,1,"http://www.bbc.co.uk/news/world-europe-24996292

I didn't think there were the right conditions to create cyclones in the med, shouldn't it only be a cyclone if it's in the Indian ocean?

The name would suggest it's the third this year",Is Cyclone Cleopatra in the med a real Cyclone?,1
BobSlydelsTongue,7,0,1qz402,2,,Why does running water over a burn make it feel better?,2
qoou,4,13,1qz517,23,"I think a single pin hole through a metallic barrier would work, but; could a grid of holes make a lens for X-rays? What size would the holes have to be to make such a thing? ",Could a pinhole arrangement in a metal be used to make an x-ray lens?,36
applesnsmoke,5,2,1qybkw,0,,Can do different types of bugs produce offspring? And/or can two different species of one type of bug (such as a beetle) produce offspring? Are there mutt bugs (if that makes sense?),2
Warhawk444,5,2,1qyjyy,0,"So I understand the basic mechanics of how atoms work, I know an atom contains protons and neutrons. I get that electrons are negatively charged particles that ""orbit"" around the cluster of positively charged protons and neutrons (which are neutral). What I'm looking for is a bit more in depth, what actually causes an electron to ""orbit"" the atom? Is is a form of gravitational pull just like an orbital body orbiting a star or is it some form of electric field created between the positive and negative particles or is it possibly a mixture of the two? I also understand that electrons have different orbits labeled S,P,D,F where S is a simple circle but the others look like clovers, or hourglasses. How and why do these different orbits form?","What causes electrons to ""orbit"" atoms?",1
allforthekarma,0,1,1qyk7h,0,Say you have a surface on which water makes a ~80 degree contact angle(&lt;90). Can you increase the contact angle to above 90 degrees by only changing surface roughness. I feel you couldn't for as far as I know roughness tends to enhance wetting characteristics making a hydrophilic surface more hydrophilic and a hydrophobic surface more hydrophobic. ,Can surface roughness be employed to rendered a hydrophilic surface hydrophobic?,1
AnnoyingFaecbookGirl,15,2,1qyupv,2,,How can carbon and nitrogen bond together into cyanide if it doesn't complete a full electron shell?,4
imnotdarthvader,2,1,1qyxr6,1,"The transitions between different states of matter take a lot of energy compared to just heating a solid, liquid or gas. What is the reason behind that?",Why is so much energy needed for phase transitions?,2
jottow4,4,5,1qz4pb,0,"This morning, i saw the moon in the sky with the sun, and it wasn't full. How does this work?","If the moon and the sun are in the sky at the same time, shouldn't the moon be full?",5
AxXiBaxXi,7,3,1qz6fm,4,,What factors affect the voltage of a electrochemical cell? Please explain how they affect them too!,7
katrahn,12,4,1qz13p,1,Why isn't out solar system (or our galaxy for that matter) sphere-shaped instead of disc-shaped? ,Why do planets and other orbiting bodies tend to lie on a plane?,5
blueblarflubar,7,6,1qyt1z,7,"It just appears as though nearly every deep sea predator attracts its prey using some form of light generation. It should then follow that prey that are attracted to the light are killed off, while those that are not attracted remain viable. So why is it then that prey species are still attracted to the light that will most likely kill them? ",Why are deep sea prey attracted to bioluminescence from predatory fish? Wouldn't evolution select for individuals that avoid the light?,13
floatingurboat,3,2,1qysak,1,"Between launching satalites and the like(for the purpose of this question we are launching garbage and random stuff to hit a magic number) at what point have we removed enough mass to make a noticeable change to earth(hours in a day, days in a year, the tides? I donno I came here to ask you folks)and what would we notice first?",How much stuff can can we throw into space before not having it here makes an impact on us?,3
joeflux,5,5,1qys8x,0,"One of the most interesting discoveries in science, to me, is that the more we learn the more we find out how inflexible the equations are to modification.

For example, in Newtonian Mechanics, if instead of F=ma  we thought it might actually be   F = ma + 0.000001N   then the theory remains logically valid.

But with Quantum Field Theory if you try to modify the formulas in a similar way, you end up with something logically invalid.

I've seen this mentioned various times in popular science books, but I can't find the right search terms to find anything on the web about it.  Does anyone have any more information regarding it please?

Thanks
",What is it called when a theory can't be changed slightly without making it logically invalid?,3
jb200,2,1,1qyip9,1,Related [site](http://www.nasa.gov/mission_pages/swift/bursts/ison.html),Why does comet ISON's path curve as seen in the night sky from the point of view of Earth as seen in this [NASA image](http://www.nasa.gov/images/content/738138main_ISON_track.jpg)?,2
nenake,2,0,1qyi8i,1,,How were canyons shaped over time?,1
lorty,3,0,1qygpc,2,,"I know that super hot stars show more Helium and Hydrogene spectral lines and that colder stars show more metal elements (Ca,Mg,Fe) ... but why?!",2
naughty_pudding,4,0,1qyd2k,1,"I read an article on BCC I believe and it talked about NASA launching a new probe that is going to survey the atmosphere of Mars. It said that since there is clear evidence of water once existing on Mars that there had to be an atmosphere to support it. So my question is, if we figure out how it disappeared, could we potentially recreate the atmosphere? 

Do we have to technology to do such a thing? How could we even go about it? I know the article mentioned something about Mars not having a magnetic field and that is why is can't protect itself. Could we make one? Or in the near future will we have the technology to do so? 

I think exploring Mars is a great idea for the expansion of knowledge and space for man kind. ",Is it possible to recreate the Martian atmosphere if we figure out how it eroded?,1
Roflmoo,3,2,1qybou,5,"Specifically, let's say there was a mixture of hydrogen and oxygen that could sustain combustion, laid out in an infinite trail, where one end of the trail is hot, and the other end is cold. A flame is introduced at the ""hot"" end, and the temperature slowly (or immediately, if necessary) decreases as the flame travels along the trail of gases. Where would the temperature become so cold that the flame could no longer burn the gases?

I do understand that the temperature drop would eventually turn the gasses to liquids, and then solids, if it become cold enough. Please mention these changes if they would need to occur, since I'm unfamiliar with the temperature requirements, and would have to look them up separately. 

I'm not a science guy, so I can clarify the... rather geekish backstory... if needed. I hope I've provided everything required. ",How cold does it need to be for combustion to become impossible?,7
FrenchMuffinsOui,4,0,1qy87w,1,,What would a meteor look like from space passing through the Earth's atmosphere?,1
are_politics_funny,8,4,1qyihv,2,Might be a dumb question. I don't recall hearing about them outside of the US really. That could say more about American media than anything else...,Are there tornadoes in Europe?,6
takingphotosmakingdo,1,0,1qylwu,2,"Hi AskScience,
Long time lurker here back with a long past image of nexrad.
During a really bad storm that I believe was also part of ""snowmageddon"" in 2011 I noticed this artifact.

It's the large circle just north of Montgomery, AL.

link to gif - http://imgur.com/F9otLZF

I haven't been able to find any documentation with my google foo on what causes this type of glitch.

Any and all comments thanks!",Weather Radar reboot?,2
Roth1,2,1,1qymma,5,,Is the rate of expansion of the universe constant in all regions or does it vary?,6
partiallogic,14,1,1qypga,2,"Sorry for the ambiguous ""performance"" factor but I was shown a graph over time showing that processor performance increases almost linearly but RAM performance is almost flat.

It's something to do with the fact that we're doubling the ram capacity which doubles the transistor count and this makes it hard to fit it all in the same size and increase performance.

But doesn't the transistor count in the processor often double each generation?",Why does processor performance increase faster than RAM performances?,3
tobiasnash,3,0,1qypjq,5,"If you could have a radioactive element in a condensate state, and it was all in phase and acting like one giant atom, would it radiate neutrons at random like how the half-life model describes or would it all radiate out in a flash or something?",Would a radioactive quantum condensate still radiate randomly?,5
teqtom,5,2,1qyq5k,0,"Everything we see from earth looking into space is a glimpse into the past going as far back as about 13.4 billion years.  Since the universe itself moves faster than light,  would it be hypothetically possible to see the light from an extremly old object in its Infancy, say a few billion light years away, while being next to that object in present day?  If not, under what conditions, if any, would this be possible?  

I saw a picture of the universe an extremely short time after the big bang and it made  me wonder if that picture included the ingredients for our galaxy, solar system and even our planet. It has to, right?  So I was wondering more specifically about individual objects as well. Sorry if this is confusing. ",Astronomy question,2
sleap101010,2,1,1qypmp,2,"In a number of documentaries they say there's evidence that liquid water was once abundant on Mars. That there are river beds that seem to go nowhere suggesting they've entered an ocean. Not to mention round pebbles found by Curiosity.

My question is this: How do they know these were rivers and oceans of specifically water and not some other liquid, or for that matter solid glaciers? Also how do they know the rivers entered oceans instead of simply evaporating?",Rivers and oceans of water on Mars,3
bobes_momo,5,3,1qymea,2,"I am trying to understand how it is possible for attractive and repulsive forces to exist. I know we probably don't have the exact answer yet but, respectfully, how do YOU think the smallest particles communicate? Even if it isn't conclusive I would be interested in a hypothetical explanation. Thank you.",How do particles sense eachother across a vacuum gap?,5
Afftus,4,3,1qykuu,4,"If you were to model the orbit of a planet around the sun by placing a coin on a turntable/record player you would find that as the radius at which you place the coin increases, so does the velocity at which it travels.

But as the radius from the sun increases, planets move slower.  Why is this the case?","Why does orbital velocity decrease with distance from the planet/sun, but velocity around a turntable increases with an increased radius.",7
grandballoon,4,7,1qy5mz,11,,"What determine the quality of someone's singing voice? Why are some voices just ""better"" than others?",18
somesillynerd,3,0,1qy5nn,2,"This last storm mess triggered a question.

I live in West Michigan, and we were warned about the storm and how dangerous it would be - but our state had close to nothing in terms of actual severe weather (Winds, some rain, a baby tornado), especially in comparison to the neighboring state of Indiana. 

This seems to happen with every large storm system that has to pass over Lake Michigan, in every season. 


Why is this? How does it change the structure (?) of the storm?",Why do weather systems seem to become less severe as they pass over a large lake?,2
VirulentWalrus,3,3,1qy5rp,2,,"Why is the Standard Hydrogen Electrode used as the baseline for the SRP table, instead of more a more reactive (Fluorine) or nonreactive (Platinum) element?",5
zildjiandrummer1,7,0,1qyi5k,3,"Specifically, how do combinations of A,T,C, and G form information? Is it basically a base 4 system? I just find it amazing how combinations of single molecules can contain a mind blowing amount of information. Also, how do these combinations translate to ""This person will have brown hair""? There are probably hundreds of steps in between, but a nice overview would be good. Thanks.",How is the information in DNA actually read?,3
propsie,3,0,1qy62g,3,"So if you use aperture synthesis form several telescopes can combine their signal to increase resolution. My main question is whether it would be possible to take a single telescope, point it at an object in space, then wait six months for the Earth to complete half an orbit around the sun, then point the telescope at the same target, using the very long distance between these two observations as a proxy for having two telescopes around 2AU apart.

if not, would it be efficient to have pairs of telescopes at L1 and L2, or L4 and L5?",Is it possible to use a single telescope as an interferometer?,3
YoungNorthEastern,1,3,1qy6rg,0,"For example, Central Park. Is going to a city park pretty much a modern day time machine?",Are parks located in big cities accurate representations of the land in its natural state?,3
vashp2029,5,0,1qy845,2,"I'm doing a virology assignment and I can't figure this out for the life of me. I want to say that it is possible to remove the genome of the MERS virus and replace it with a harmless genome and then watch the entry into cells. I assume this would leave the virus unable to replicate into a MERS virus since the genes have been changed but it would suffice for the study of entry right? 

If I'm wrong, let me know. If I'm right, I'm wondering how we can go about changing viral genomes. For example, for bacteria, we use viral vectors to introduce plasmids into the cell. How would you introduce new genome (and remove old genome) from a virus, all the while leaving it in tact for cell entry?","How can dangerous viruses be ""dumbed down"" to a lower biosafety level for their entry method (into the cell) to be studied (i.e MERS)?",2
noburg75,2,0,1qyb5l,3,,"What external area of the body is the most sensitive to stimulation(excluding face, genitalia, and the palms of your hands)?",3
gamerman217,7,6,1qybcz,4,,"Imagine English is my first language. When I learn another language, will I forever be translating it to English to be able to understand it, or can I eventually reach a point where I understand it the same way I understand English?",10
gwyddoniaeth,1,0,1qyb7u,1,"Say you have X moles of Chlorine gas and react it with excess Fluorine gas. However, Chlorine has oxidation states of -1,+1,+3,+5, etc. Unless I am mistaken, theoretically, the products of the reaction would be a mixture of ClF, ClF3, CLF5, etc. Is there any way to directly control the reaction so only a specific product , perhaps ClF3, is produced? Or am I missing something?",Is it possible to control product yield of reaction given variable oxidation states?,1
bigdookie,1,1,1qyc3x,1,,Why do different cloth material require different steam levels on the iron,2
evergladesbro,5,0,1qydow,3,"Under what conditions would a planet have warm enough poles for people to live there comfortably? Is this even possible? 

The reason I ask is I saw a photo of the aurora borealis over barren arctic terrain and imagined a cityscape in the background. One thing led to another and here I am wondering about this. I know ""inhabit comfortably"" is a vague description, but I do seek a broad range of answers (if this is, in fact, possible).",Could the poles of a planet ever be warm enough to inhabit comfortably?,3
elecki,5,1,1qydk6,0,"The retina has a number of cell layers ([for reference](http://en.wikipedia.org/wiki/Retina#Anatomy)). The photoreceptors, which are responsible for detect photons, are behind several layers of cells. They are in fact the second to last layer--which seems like a strange place to put your photon detectors. Plus, it results in the blind spot from the optic nerve poking it's way back through to the brain.

So my question is: is there a reason for sticking the photoreceptors in the back? Like, hypothetically would it not work if the photoreceptors were in the top layer of the retina? Or is this organization just a byproduct of evolution?",Why are photoreceptors on the back of the retina instead of the front where they'll catch the most light?,1
ilovesoju,2,2,1qyfli,3,,Is there a limit on how big a terrestrial planet can get?,5
kountrykerbear,1,2,1qxuip,2,"Goosebumps are caused by the contraction of the hair follicles in our skin, so why don't we get them on the back of our hands, feet, face and other areas, where there are hair follicles?","As humans,why don't we get goosebumps on our hands and feet?",4
lolthisisfunny24,0,0,1qy3df,1,"I'm not sure if this is the right place to ask this question, but it seems the most fit.

Essentially, since I am a part of a group hosting one soon, I want to know. Not that Oxfam isn't truthful, but oftentimes their descriptions sound too elaborate/decorative. 

Moreover, is there any important fact/stat I should mentioned: like sometime that you feel like most people always leave out during hunger discussions?",[Hunger/Oxfam Am/Intl] How close does Oxfam's Hunger Banquet represent the true food inequality across First and Third Worlds?,1
anonymous-coward,0,3,1qxpi4,2,"This is what I think I know:

1. Na and K are both about 0.035% atomic percent of the human body.

2. Na and K both make up about 2.5% of earth's crust; in atomic percent, sodium is more common because it is much lighter.  

3. The oceans have about 25x more Na than K by mass, apparently because sodium compounds are more soluble and get leached out more.

4. A banana has 500 mg of K and just 1 mg of Na.    Other plants have similar numbers.  So Na is harder to get from plant foods.  K plays an [important role](http://en.wikipedia.org/wiki/Potassium_deficiency_\(plants\)) in plant biology.


So do we want to eat salt so much just simply because plant biology favors potassium, so we don't get it in a plant-based diet?






","Why do animals desire sodium (salt) so strongly, but they don't have a similar desire for potassium?",5
kurtrw,7,2,1qy4xr,2,Are any of these similar to what happens when we are concussed?,"Chemically speaking, what happens to our bodies when we overdose that causes death?",4
144627,8,1,1qy5pe,4,Shouldn't blowing increase the volume of oxygen that passes through the flame allowing it to burn brighter?,Why does blowing at a candle/wind extinguish the flame?,5
mnemonicpear,7,0,1qxqf8,9,"You would need some sort of framework to be able to use modern coding languages, but how would they have created this framework in the first place? If there is no system in place, how would you input data?",How was the first electronic computer programmed?,9
shinrikyou,8,0,1qxqmw,3,"I'm looking for clarification on this topic, while doing research on the subject as a whole I came across the 0.05-0.08% numbers on male-female infection rates. I cannot understand if these published numbers are numbers on the actual change of contracting HIV in each unprotected sexual encounter, or something else entirely. I found this information in many places, including these:

* http://www.cdc.gov/hiv/policies/law/risk.html
* http://jid.oxfordjournals.org/content/191/9/1403.full
* http://www.catie.ca/pif/summer-2012/putting-number-it-risk-exposure-hiv

Now, the last link kind of answers my question but it doesn't make sense. We've always been taught that unprotected sex with a partner whose been exposed to the virus results in an infection, which is true technically but these rates seem way, way low, and I cannot wrap my head around it. Shouldn't any contact with an infected woman's mucus result in getting the HIV into several ""weak spots"" on the man's penis, resulting into it's dissemination into the body? Likewise, in contact with infected sperm? Is it really like I'm reading it, even if all goes wrong and two people have an unprotected encounter with each other, does the healthy person have to be THAT unlucky to become infected given the &lt;0.1% chance of infections mentioned or am I missing something here? And what about someone who left the latent period and has full blown AIDS?

I was gonna post this in AskReddit but I figure it'd be better suited on AskScience, so I'd love have some kind of clarification on the subject... Many thanks!","The likelihood/percentage of HIV transmission per each coital act, enlightenment on this subject...",3
confederacy,5,0,1qxtyn,4,"From my understanding, Power is voltage x amperage, so why is there power loss when transmitting at varying this ratio?

P.S. I don't know how to tag this post with Physics, this should be in the FAQ, no?",Why are there losses when transmitting high current vs high voltage if the power is the same?,4
emafl,5,2,1qxwuy,2,"If I have a linear transformation that maps the unit square to a 2-unit by 2-unit square, the area will increase by a factor of 4. Because the transformation is one-to-one and onto, it maps every point from the unit square to every point in the 2X2 square. The set of all points in the unit square has an infinite number of elements, but doesn't the set of all points in an ordinary 2X2 square have a larger infinity of elements? Is every point of an ordinary 2X2 square actually represented in the mapped 2X2 square?",Linear algebra and infinity,4
Ryan949,3,1,1qy0jh,1,,If red blood cells have no nucleus how can a blood stain be identified as a specific person's blood?,2
auviewer,4,1,1qy17k,4,"So, [gluons](http://en.wikipedia.org/wiki/Gluon) contribute to most of the mass of baryon not the quarks. 
The Wikipedia is pretty vague about this but the reason for mass 'coming out of a baryon' is due to special relativity. 

Does this mean gluons are 'moving' within the nucleus at close to the speed of light and gain mass? Could someone clarify where this mass comes from?
",If a photon has zero rest mass why does a gluon have a zero rest mass? yet gluons are responsible for most of the mass in a baryon.,5
naturesbitch,3,0,1qxzmb,3,"Medically, what is happening to your body when you become addicted? And what defines addiction? ","I understand what the mental aspects of addiction, but what is actually happening as addiction develops?",3
mxlrd,1,1,1qxyx3,1,"I was going to ask this as an ELI5 but I realized 5-year olds don't really want to hear an explanation about dogs dying. To elaborate on my question: I was once told that the larger the animal the greater the life span, but that seems like a skewed statistic since mice will get eaten before they have a chance anyway. Does it have to do with heart rate or metabolism? Thanks for any responses!",Why do dogs die young while tortoises can live over a century?,2
nilestyle,6,1,1qxw1j,1,"Is it theoretical, or we do we have visual/empirical proof that is conclusive?","How exactly do we know the Universe is expanding and how do we know there is an ""edge"" to it?",2
boomer95,0,3,1qxvxm,7,,Do people that develop gray hair early in life tend to die younger?,10
