author,comments,downvotes,id,score,selftext,title,upvotes
ScorpioEverlast,19,25,1qsyl3,46,"So, there I was just sitting on a bench at my local mall minding my own business. Partaking in one of my favorite hobbies of people-watching.
about 10 minutes in a black prob 17-20 y/o set down not next to me but within conversational distance. After about 5 more minutes, a few of his friends came and chatted with him about Lebron vs Kobe, shoes, weed, ect ect ( typical black guy conversations ). Not 2 minutes after his friends left, he spoke up and asked me: ""Hey man, you wouldn't happen to have change for a $50 would you""? I replied without hesitation: ""IDK, let me check"".  

Now for some background. I usually am pretty quick-minded with situations. I pay attention to my surroundings. I often eves-drop into conversations taking place around me. And usually always keep myself out of precarious situations. BUT NOT TODAY!

I knew I had just cashed my payroll check a few hours ago and kept some cash on me. I knew I had a few $20s but didn't know if I could make the remaining $10. After a quick check in my wallet, I had the money in hand. 2 $20's, a $5, and 5 $1's. We traded bills and immediately I knew the bill wasn't right. The feel was wrong. So instantly placed it up against another bill and it was smaller in dimension. I then checked for the watermarks and there were none to be found. I instantly said to him: ""NO, I believe this bill is fake and I want my money back"". what took place next was a slow but steady escalation right in the middle of a crowded mall. 

He stood up and stated: ""Its not fake, I just got it from a store in change and need to break it to pay a friend back."" I stood up and blocked his progress of walking away. when we both stood up I realized what I was up against. This kid was a good 6 inches taller than me, easily 50lbs on me and at this point, angry that I had confronted/trapped him. 

Now I new that @ this point he was NOT getting out of my presence, NO MATTER WHAT! I also knew that it was his word against mine but that if worse came to worse, that we were or at least should be being recorded via CCTV.  

I again stated: ""this bill is fake and I want my money back NOW and you can walk away or I am calling security"". He then said: ""go ahead, you have the bill. Its your word against mine. You think they are going to believe me because I'm black and you're white?"" At this point I was getting pissed but had to keep my calmness or shit could get out of hand fast!

Immediately I yelled in a stern voice ""SECURITY"". We were within Earshot of the guest services booth thankfully and I know at least a half dozen people were watching at this point. He said: ""Hey man, I just got that. I didn't know it was fake. Let me go get them."" I said, No, its too late. I gave you the chance and you passed"". and Yelled ""SECURITY"" once more.

By this time, he was very nervous and trying numerous times to leave but i had him partially cornered between the bench we where on, a kiosk selling hair supplies, and the wall. I glanced over his shoulder and seen a very large man in a suit walking our way. The gentleman asked: ""what seems to be the issue"" and the kid tried to split once more and I sternly said: ""Do not let him leave!"" 

by this time a few more ""mall cops"" arrived and separated us and got both stories. I repeated what had happened while he still attempted to leave again. The man on the suit told him he was being retained and called for local PD. Not a minute later I repeated the incident to the officer. The officer then spoke with the kid. He obtained the bill from me and looked it over and stated it was def a fake. The kid tried to play dumb not knowing about the water marks and such. 

The officer didn't buy it, obtained the kids ID, spoke on his radio, then asked me how I would like to proceed. I told him that I gave him the option to get out of it and he passed. I asked the officer if he had the right to search the kid. He said NO. I then stated that he could have more bad bills on him. The officer then went back to the kid and asked for consent to search him. Like a scared kid, he said yes. The officer did a quick scan then took his wallet and sure enough. 4 more FAKE $50's! needless to say, the ball is in my court!

The officer immediately arrested the kid and read him his rights! HE was pissed!! cussing and yelling obscenities at me. 

It was at this time that a was flooded with different emotions. Knowing I fucked up by trying to be a good patron. The potential for the situation to end way worse for me. And the overwhelming feeling that I did right by standing my ground and busting this asshole!

I immediately went and got a soda to cure my crazy cotton mouth and left the mall. Now, a few hours later. looking back, The way I handled the situation has given me a great deal of confidence in my ability to handle a situation with a stranger. I do know this feeling could very well one day make things worse for my but for now, I feel great! but I still FUCKED UP!

TL;DR: Offered to make change for a fake $50 for a stranger @ the mall. realized immediatly. Security and Police busted kid for Fake bills!! Day made!  ",TIFU by making change for a FAKE $50 @ the local mall. Still won!,71
a_burning_throwaway,11,6,1r658d,45,"I work in a research lab, en route to getting my master's degree. It's a biochemical lab, so there's not too much that's very dangerous, and overall it's a pretty relaxed place to work. Despite official policy pretty much nobody wears lab coats or goggles, shorts abound in the summer, and gloves are mainly to keep from contaminating your sample rather than protecting your hands. It can be easy in this environment to sort of forget that safety is still important sometimes. 

Yesterday I got to the lab at 8:30 am and was there until about 8 pm, having had a lot of work to finish up. Most of my days that run that long include a lot of downtime, but on this occasion I was actually doing work for most of it. Tedious, monotonous, soul-crushing work, involving repeated treatments with a base, that left me exhausted and brain-dead at the end of the day.

I leave the lab and breathe a sigh of relief, and take a much-needed urination break before heading home. I enter the washroom, zip down, and grab my donger, as is man's sacred right. Suddenly, I feel a sort of itch. I ignore it and continue as I was, but before long the itch intensifies. And then it transforms into a burning. The burning is gentle at first; it does not remain so. Soon it feels as though a scornful fire elemental is attempting to blow me and I am trying very hard to stay still so as not to piss all over myself, despite the fiery waves of pain that now crash upon my pubic shore.

When it becomes too much to bear, I am thankfully nearly done but still manage to splatter some on my pants as I am forced to let go, doubling over with my pants half-down before I finally recover somewhat from the pain. The supernova heat has die down to a much calmer, smaller nova, and I force the thing back into my pants.

I evidently forgot to wash my hands after working with the base all day. It wasn't that concentrated, so it didn't hurt my hands or anything like that, but as soon as I touched my sensitive wang-flesh it made its wretched presence known. Looking at it once I got home, my dangler was redder than that of the devil himself and covered in delightful blisters. It still hurts like a bitch.

**TL;DR:**

&gt;There once was a man in a lab

&gt;In the washroom his penis he grabbed

&gt;When suddenly, pain,

&gt;Like his dick was in flames,

&gt;So bad he'd have rather been stabbed.",TIFU by forgetting to wash my hands,51
BurpleNurple,11,19,1qtvp2,41,"Okay, this was actually last week. But I was too busy fucking up other things to put my initial fuck-up into words.

It was Veterans Day at my school. Each year, we celebrate by inviting any parents/grandparents/great-grandparents/you-get-the-point to come to the ceremony. We sing some dramatic ***fuck yes America*** songs, have a few snotty middle schoolers speak, and give a slideshow on all the most recent wars in which the U.S. has been fighting.

So, the elementary school kids were all getting up from the bleachers to stand in front of us and sing a song. They walked single file behind their teachers. They looked like little ducklings with an insatiable eagerness in their eyes, an eagerness to sing about our country. Just kidding. They were really cute, though.

The kindergarten kids were walking up last, since they are obviously the cutest. Some kept getting distracted by the crowd, stopping to gaze upon the numerous high schoolers staring at them, having to be gently nudged by their teachers to keep walking.

This one girl, though. She was trying to walk in a straight line while simultaneously staring at the scary high schoolers. Needless to say, hilarity ensued. The girl fell RIGHT OVER on her face. I'd say you had to have been there, but I swore in that moment it sounded just like a giant 50-pound pancake belly-flopping into a pool of pure liquefied giggles. Just... FLOP. PLOP. SMACK. That girl went DOWN.

Unfortunately for me, this occurred at a rather unfortunate time: the kids had been walking up to sing while one of said snobby middle schoolers was reading off statistics about WWI. There were graphic pictures on the screen, too.

I started *dying*.

Shit is so much funnier when you're not supposed to be laughing at it, too.

After the initial burst of uncontrollable laughter, I kept snorting little giggles during the subsequent slide on WWII each time I thought about how I wasn't supposed to be laughing about that fucking kid. It sounded like I was giggling over how many casualties we had in WWII. Gah.

***TL;DR: I fucked up by being unable to control my laughter over a child who tripped during a Veterans' Day ceremony.***",TIFU by laughing at a WWI powerpoint.,60
NiceRideMan,3,11,1r79fs,41,"Preface: I live in a semi-detached house, so we share our driveway with our neighbors. There's enough room in the driveway for a total of 4 cars. They're a rather sizeable family, so they have 3 cars and pack them all into the driveway. We never did mind because we only have 2 cars, and if they park the 3rd car a little on their lawn and partially in the driveway, we can fit 5 cars. Although I didn't mind, I still found it annoying at times since it was a tight fit leaving me less room to maneuver.

The neighbors are a really nice Muslim family. Most of the reason I didn't mind them squashing 3 cars into the driveway was because they did things for us frequently. Here in Ontario, it snows a lot sometimes. If they saw that our driveway hadn't been cleaned, they'd do it for us a lot of the time. And they'd bring over leftover food from feasts, and it was so fucking good. So over those 10 years, I never said anything about their 3 cars.

Preface over, here's what happened. A couple of days ago I was at university, and my mom texted me saying the neighbor had passed away. Keep in mind this was a large family. There was an 80 year old with his wife, 2 of their kids (Both mid-30s, who had wives and kids of their own.) 10 people total. The 80 year old man passed away because his kidney failed.

When I arrived home that day, one of the deceased man's sons was in the driveway. I walked on over to him and expressed my condolences. OUT OF FUCKING NO WHERE, and I mean in no way did I mean to say this but for whatever reason did, I proceeded to say ""Haha, guess you won't need that [third] car anymore."" Probably something subconscious. Fucking Freudian slip. Needless to say, I felt terribly awkward and just ""Oh man dinner is ready'd"" away.",TIFU my opening my mouth,52
lhwang0320,8,14,1qwto6,40,"Was working at home and calling in to a teleconference. During the call I was walking around my condo, and decided it would be a good idea to multitask  and feed my fish. So I go ahead and put the phone on top of one of my tanks. I have two 10-gallon tanks and the filtration systems are really loud. 

All of a sudden, awkward pause on call. 

My boss: Oh god...is one of you pissing in the men's room right now?

All of us: Nope, not me!

**awkward silence**

Me: Oh god....I'm standing by my aquariums, guys. Those are the filters!

Laughter all around.

",TIFU by standing next to my aquariums during a teleconference,54
ismileicrazy,8,2,1qxbt9,39,"I work as a server/manager at a fine dining Italian restaurant.  One of our regulars, a barfly really, always told me she wanted to do something with my hair.  I am a guy btw, never put any colour in my hair etc.  Our bartender, basically a fuckbuddy of the barfly, repeatedly told me ""Yeah, yeah, do it.  She's good! She makes a living cutting hair from home."" Finally I give in.  ""Sure, I'm growing out my hair a bit, but you can put a few light highlights in my hair to lighten it up.""

The next day I call her up and arrange to meet her at her place.  I arrive, its a ground level apartment.  She greets me, we go inside.  Filthy carpet, the tv had what I could only imagine a stream of dried jizz dripped down it.  ""Okay"" I think to myself. ""She does this for a living, its all good.""  She takes me to her ""chair"".  It was literally a broken down lawn chair. ""Fuck! I can't even back out of this now."" I sit down, she pulls out a tube of something and a plastic fork.  She gets to work.  My head is feeling heavy at this point.  I reiterate to her that all I wanted was some nice blending in highlights.  ""Oh yeah! I totally understand.  Don't worry! I know what I'm doing!"".  I'm basically shitting myself at this point in time.  She throws a plastic shopping bag on my head and has me sit there.  I start frantically texting my fiancee. ""What the fuck did I do?"" ""Why did I do this?!?""  Finally she comes back.  ""Time to rinse it out!"" We enter her bathroom.  She had me kneel beside her filthy toilet and put my head under the tap in her bathtub.  At this point all I can think of is ""Get this shit off of my head! I don't even care that I'm kneeling beside her disgusting toilet!""  She appraises her job and decides she need to put more bleach or whatever on.  Keep in mind I am yet to see a mirror.  ""Its okay, I'm sure it's..."" I feel more bleach on my head. ""FUCK!"" Okay, bag, rinse, repeat.  She's done! She shows me the final job.  I want to die.  Giant chunks of white blonde at the front (I have a Don Draper like 50's style to my hair) Throughout the rest, orangey blonde, dark blonde, white blonde, any colour of blonde you can imagine.  And she is looking at me, with a look of insane pride on her face. ""Do you love it? OMG! It looks amaaaaazing!""  All I could say was ""Umm, its neat.""  She asks for $25.  I leave.  I look for the hidden cameras.  No luck, this actually happened, I wasn't on Candid Camera or anything.

I get one block away and call a coworker.  Luckily I had a hat with me.  I ask her to meet me, I need to show her something and I need her to tell me I'm overreacting.  We meet up.  I take off the hat.  She bursts out laughing. ""Who did this to you??? Why did you let it happen??""  We make an emergency appointment with her hairdresser.  I get there, she looks at me, holding back laughter and says ""Did you lose a bet or something?"" followed with ""Wow, she must really hate you.""  She matched my original colour, puts the dye in, we let it sit. 3 times we had to do that as the dye wouldn't hold.  I can't wash my hair for like a month or this will wash out and I'll have a head of fucked up blonde chunks. And now I have to break this shitty hairdressers heart when she comes in the restaurant next.

**TLDR - I paid $125 to have my hair look exactly as it had earlier that day because I trusted the fuckbuddy of my bartender to dye my hair.**","TIFU by getting my hair ""highlighted"" by a customer of mine.",41
emopanda18,8,10,1qsr70,40,"I will preface this by saying that I currently live with other people. And we were in the living room.
 
Today my boyfriend came over to hang out and watch TV. Nothing out of the ordinary until things start to get heated. Eventually I decide that I want to give a blowjob. The best way to do it was to unzip and pull it out. I begin to get to work when suddenly I hear a key in the door. Shit. Someone is home and about to walk in on said blowjob. I did the logical thing and try to put it away. I think its in and rush to zip his pants. 

It stopped.

All I heard was ""You bitch!"" as he cupped himself and tried to zip up properly. 

Didn't get caught. At least there wasn't blood... just the tip. 

I later made up for it with a proper blowup.  

TL:DR: rushed to zip his pants up to avoid getting caught in the middle of a blowjob, zipped up his dick. 

Edit: to avoid some comments... we use the phrase ""you bitch"" jokingly... I think he was just surprised and trying to make a joke.

TIFU",TIFU by trying to zip my boyfriend's penis.,50
immediatefracture,6,10,1r2hp9,34,"Super long story short, shit in my life is a little rough right now. With my horrible inability to deal with large amounts of stress at one time, naturally I started to fall behind on school work a bit. 

But today, today I had a revelation. Today I said I would do well. 
Only had I not forgotten that something has always got to give.

Anyway. So I'm in Calculus, getting ready to start a quiz when prof asks if anyone has any questions, and I remember that I don't quite remember how to do something. So I promptly raise my hand and begin to try to explain what concept it is exactly that I am not grasping. 
Word vomit at it's best. It comes out something like ""I can't.. remember how to do one of the things you assigned last week for homework and and uhhhh I just... can we go over it?""
With which she so rightly responds ""What the hell are you talking about.""

Now, this woman is no fucking joke. Very fuck you personality and extraordinarily obvious when she's judging you.  

So there I am, freeeeeeeeaking out because she's staring into my soul and I can't be at ease really because she's intimidating me and i'm scared, I start to blurt out something along the lines of, ""RIGHT, BUT I JUST DON'T KNOW HOW TO DO IT."" Maybe only, two or three octaves below the frequency only fucking dogs can hear. 

It gets better. 

I hear a light chuckle from someone behind me, as my professor begins to start going over I guess what she could only assume was the issue I had. I get all ashamed and shit, and interrupt her with ""Oh, I get it now."" 
She shoots me a look that could make Jackie Chan shit his pants, and continues reviewing a problem that I had later realized was not the problem I was struggling with at all. 

Failed the quiz anyway, along with any social composure I had before 8am this morning.

tl;dr ate a stale french fry and cried about it later.","TIFU by desperately trying to succeed, but instead convincing a large group of people that I am a fuck face.",44
nunyabeans,45,40,1r57kd,36,"Well at my school you have to use HID key cards and if you don't have yours you get detention. Well i lost mine and i don't feel like missing lunch for not having it so i made a fake one. But my principle is a bitch and decided to test mine and now may send me to the honor council which if i got in trouble would have to be reported to the college i already got into.
                                 Tl;DR: used fake keycard got caught might effect possible college choice",TIFU by using a fake key card at school.,76
dudusan,5,7,1r3xde,37,"I occasionally go for a swim during the weekend and always top it off with some time in the spa. Whilst in the spa, I sat on a side that had broken jets. So only half the people in the spa had their jets working. When one occupant left, this 70 something year old man signalled me to come sit next to him, where the other person had just got up from. The old guy, I'll call him Peter, was a bit familiar. I had seen him at the spa a few times before. I started chatting with Peter. He was rather funny. He kept commenting on the women who were entering the spa. It was funny to me considering his age. We also spoke about other things such as my wife, his wife, his kids etc.
During the chats, when Peter was making and a joke...he would pinch me in the abdominal area. It was a bit strange but just thought, whatever, its probably just a greek gesture etc (Where Im from, we kinda clap hands whilst laughing). This goes on for about 4-5 times. When I told him i was leaving, he asked me to stay for another 5 mins. In my mind, I thought perhaps he is just a lonely man who just wants to chat. I stayed for another 5 and left. 
In the changing room, i realised someone had pinched my tshirt. Was frantically looking for it when peter walked in. He got dressed whilst I doing rounds looking for my shirt. He even assisted me by taking me to the ""lost/found"" area. I decided to just ride my bike topless and gave up looking for the shirt.  As peter was leaving too, we walked out of the complex together. As i went to my bike, Peter asked if i would like to go for a drive. I agreed and really thought that perhaps this guy has something to get off his chest or is depressed etc. Also thought wont hurt to listen to a guys issues/cries for help etc. So i got into his car and he drove to the other side of the car park. He then began talking about porn movies and i was laughing all the while. It was seriously funny that a guy his age was talking about shit like that. he then asked me why all african guys have big dicks. Now, nothing weird here....as we get this question countless times once we venture into those types of conversations. Peter then asked me if i had a big dick. Again, i laughed this off and just kinda said ...normal type. Peter then puts his hand on the back of my neck and my mind started racing. I just thought, well, if i move or reach for my shoelace, he will let go. So i did that and he let go. He then asks me if i had ever had sex with a man. At this point, i was now feeling fucking awkward and now had suspicions. So i categorically/vehemently said no and that I would never do that as I am not that way. He then reached out and pinched my nipple!  At this point I told him i had to leave. He asked if I was sure that i wanted to leave. So I left.

Thing is, I felt dirty when this guy did this. I was actually innocently thinking i'm just chatting with this guy, whilst he obviously had other intentions. I also, through this experience, know what it feels like for the waitresses who have sexual innuendo left right and centre just because they smiled at a male customer etc.

Its taken me a few days to get over this. Im certain he thinks I am playing hard to get as I did not exactly say NO to his advances (I realised it too late). To him, I got in his car, kept laughing whilst he was pinching me etc and these are signs of someone interested. Im sure I will meet him again at the spa. I will have to be stern with him.",TIFU - Unknowingly led on a gay geriatric,44
tapittuco,13,23,1qsa0l,29,"I know, you've never heard that before...Anyway, it was last night, my wife got a promotion and we decided, ""Friday night, why not get drunk?"". So that was the case.

I think it was about 1 A.M. (maybe 1:30 ish A.M.), and we stumble up the stairs to our new apartment, first thing I go do is take a piss, naturally. As I open the door there she is, just a shirt on, and through my blurred vision, I make out what appears to be something around her waist...her strap-on.

She starts pushing me back into the bed with supernatural strength and pushed me backwards onto the bed and ripped off my jeans, and-fucked me like never before...without any lube. I felt like Jonah Hill (only less fat) in ""This is the End"", now there's usually nothing wrong-but once again, **she didn't use any lube**, no spit either.

After she had her way with me, I lied on that bed, writhing in pain because she treated my ass like no man I've been with (oh, I'm bisexual if you haven't picked that up yet, but I do know of some straight men who let their girlfriends/wives peg them) and at the same time in a ""the best orgasm I've had in my life [*so far*]"" coma. I fell off the bed and was lying on the cold floor when she threw a towel at me and said: ""Use this to clean up you filthy whore.""

The next thing I remember is stumbling to my truck and heading off to work. When I got there some friend who lives below us (unfortunately) was teasing me and bothering the shit out of me (HA! Not likely, oh the burning...) to tell the two other guys in the office why I was walking so weird when I shouted (without the knowledge of my boss entering right behind us) ""OKAY! MY WIFE FUCKED ME RAW!""

A quick reprimand later^and^an^icepackthatisn'tprovingtohelp, I'm here sharing my dilemma with beautiful redditors of the world who might find this entertaining.

edit: i dont know how i forgot but i did anyway, i do remember that i hurled before i passed out last night. ~~cant wait to get home to clean that up.~~",TIFU by having drunk sex.,52
