author,comments,downvotes,id,score,selftext,title,upvotes
phailcakez,5,0,1r68uz,7,"the short of it is, I am not officially registered for this class at all. Due to an agreement between myself and the prof, i would be able to attend class, read the material and participate in discussion, but not be actually registered for the class at all, even as an auditor. I didn't need the credits at all, so this would allow me to save some money and still take a class I was interested in and as an added bonus, I didn't have to write any papers.

 This was all going fine until today when i went for advisement. I am due to graduate this December, but found out that I cannot due to a three hour credit shortage in my major field. The kicker is that if I had been registered for the class, everything would have been fine. So, I did actually need the class...

The only reason I didn't think I needed the class was because my advisor and I went over my records this spring and he insisted that everything was good to go and I was on track to graduate with just my registered classes.

I don't even really believe that I fucked up here, but I guess i did somehow.

Now I am stuck for another semester of class paying out the wazoo. My husband is REALLY unhappy about it, as he is the one paying and I feel like I did what I was supposed to do and it still went wrong. My energy toward attending the non-credit class also just flew out the window because now I'll just be stewing over the fact that I should have been doing it for credit.",TIFU by unofficially auditing a class to save money.,7
Doctor_Reynolds,8,7,1r2bnn,6,"My history teacher has a strict ""no pencil"" rule. I completely forgot during the test and he took off 12 points.",TIFU by writing in pencil on a test instead of pen and it changed my 95 to an 83.,13
JustAnotherLondoner,2,0,1r05d2,7,"I Googled ""practical driving test"" and clicked a link, thinking it was the direct website of the examinations. The usual price is £62; it was only after I had filled everything in that I re-checked my bank account online and saw that £95 had been taken out of it. I only had £100 in there, and had some books to buy for school as well as a little left over for a birthday present for my dad. I now have £5 left as I didn't read the website I went on properly, and had been charged an extra £33 for 'service charge' and a free resit if I fail. I'm pretty confident I won't fail.. so i have just wasted £33 which could have been put to much better use elsewhere. I'm an idiot. ",TIFU by not ensuring the driving test booking website I was on was the right one.,7
l3radrocks,7,2,1r6lt9,7,"   To really understand this story, you need to know a little about my school. I live in a metropolitan area in the South. Being in the south, most adults have absolutely zero clue of how computer work or function. That included my Digital Tech teacher. I had planned originally to take computer ed classes my whole high school career, but the was already stopped my freshmen year because my High School forces us to take Health and P.E our freshmen year, and I took Spanish as my second elective. So this year I was naturally excited when I finally got to sign up for my computer class. Growing up, there was never any real adult that could teach me about anything related to computers so I was interested in what I would learn in this class. I hoped that it would be a lot. I was dead wrong. Put quite simply, my teach is an idiot.
   
Now, I usually don’t mind teachers even if I personally don’t like them, but this teacher is fully honestly an idiot, and frankly the whole class is idiotic. A perfect example was our first project. We were charged with choosing parts to build our computer. I thought that this would be an easy A and breezed through it. Here’s the good part, I failed it epically. First of all, she took of TWENTY points for not including a FLOPPY DRIVE. Yes, my teacher still believes that floppy drives are still regularly used.  As I stood there baffled by this, she tells me that she is going to take ANOTHER TWENTY points off for using Pcpartpicker.com instead of an excel spreadsheet, when she explicitly told us that we could do the list any way we wanted. Not wanting to cause a scene, I bit my tongue.
  
 Fast forward an excruciating four months of me correcting her pretty much daily on most things she says about computers. For a week now she has been saying that our next project will involve making a game and programming it ourselves. I dance with joy thinking that I might learn something useful finally, after getting through topics such as “Digital Safety”, and “Good online citizenship”. Well fuck was I wrong. She announces a day later that we will be using Scratch.com. If you aren’t aware of what scratch.com is, it is pretty much a program intended for elementary school kids to teach them how to program. Don’t get me wrong, it’s great but I was expecting something actually interesting. So we weren’t supposed to start this project until next week, but I usually do 2 weeks’ worth work daily in that class, seeing as how it is 99% busy work (She has only stood and lectured us once). So the next day, I get started in the Scratch project. I decide to just make a simple space shooter, a lot like Galactica. Finished in in two days, and it worked perfectly. Had 2 weeks’ worth of work done in 2 days. I was free to sleep and read in that class for 2 whole weeks.

This morning, she starts yelling at the class for playing games and being on sites they aren’t supposed to, and said that she had already written some of us up for playing games; all the whole staring at me with a smirk on her face. Of course, the first thought that pops to mind is that she is going to write me up for playing my own project. I already knew she hated me. There is no question about it, everyone in the class knows it. I tried to no get on her bad side even after floppy drive incident, but it did inevitably happen. I don’t purposely aggravate her, her whole experience in our class is a lot like one of those days when nothing ever goes your way. I don’t mean it to be like that, but it is. 
 
  Now to the inevitable. I spent all day today freaking out whenever they called on the intercom, expecting them to say “Mrs.OP, can we have l3radrocks to the administrative offices please.” To my surprise it never happened. I got home today relieved, thinking that it was another blank threat like she always gives me, or that I was just imagining the whole thing. 
 
  My county has this whole website that you login into with your student ID, and they have online textbooks and your grades posted there. And to my horror, in big bold letters – “This student number has been suspended”. 
   
What my school does whenever you are disciplined for computer incidents, they suspend your student Id and in turn, your computer privileges. Right now I am waiting for the inevitable call tomorrow to the administrative offices, ruining my perfect disciplinary record. 

tl;dr - I make a scratch game as a project for my class, and get written up for it.",TIFU by Making a Scratch Game,9
DeputyyNasty,2,2,1r5nvz,6,"So I walked into my English class and saw my friend who sits next to me had left his gatorade on his seat and gone to talk to somone else. Me being the ass-cheek that I am, I decided I'd steal a sip or two. So I stealthily take of the cap and have a swig, and my friend turns around just as I'm putting the cap back on. He does the natural thing and calls me a dick. Then, suddenly, we both realized something. He is STILL getting over a case of mono. Right now I'm hoping I don't get it :( And not even from kissing anyone...",TIFU by possibly getting mono- and not the good way.,8
youareneo,5,10,1qz9a6,6,"Well the history started with me going to have lunch one day. I was by myself and decided to eat on a new japonese restaurant near home. After eating 5 pounds of food i went to pay my shit and then i met this girl. She was really beautiful and kind. I kept thiking on her after this moment and i thought about going back there and asking her number. 

After 2 days i went back there, i walked directly to the place where she used to work. So i started explaining myself and talking about how nice would it be to know her number. Well this is where the history start to get strange. She said she didnt remember me and i found this very strange since she was extremely open and smiled a lot while we talked. She even gave me some gift from the restaurant. So after i explained myself she just said she was married with the owner of the restaurant. At the time i just knew i asked the wrong girl's number, but at the same time they were really alike. Same skin, same hair, same height. Fuck, even the same face. Welp at the best of the situations they can be sisters. I suck.

 ",TIFU by asking the phone number of the mother of the girl i would like to know,16
blackcoffeecyclist,3,4,1qt9pp,6,"1. Be a valet.

2. Reverse into another car.
(1st ever offense-very minor damage)

3. Boss's boss angry over recent influx of wrecks.

4. Job is on the line.
(According to my boss I'll probably lose it.)

BEST PART

Getting married in 53 days and my fiance and I are paying for our wedding.",TIFU by getting into a fender bender.,10
JazzyFinnie,1,7,1qqw7a,5,"A few days ago I nose my septum pierced. Today I got really, really high and puked, it got in the hole and on my nose ring. I cleaned my nose and everything really well. It hurts and I don't know if it is because it is pierced or because of me puking. ",TIFU Getting A Nose Ring and Puking.,12
reziful,3,1,1r8nq3,3,"We've had this assignment for about a week, and I've been sick for about 3 days. The other members of my group decided to just film it and have me edit it so I don't get 0% on the project.

My friend said he would send me the footage, but he didn't get home to send me it until late. I was in bed early due to being sick, so I wasn't on the computer to see his messages. Now he is pissed off at me because I didn't edit it, and the rest of my group won't talk to me.

Also, I don't think anyone in the group is a very good video editor, so they were counting on me.

TL;DR: Forgot to edit class project, no one wants to talk to me.",TIFU by forgetting to edit a video for a group project in school,4
saybackp4ck,5,8,1qqv1k,3,"So today I had to go to my former school to request transcripts of my grades. So I wake up and get my shit ready, I plug in my iphone into the living room speakers and listen to some songs while I go take a shower. I get out the shower and get dressed up leave home. This is were I fucked up, I dont know if I had my phone when I left, so now i'm at school getting something printed when I realize I dont have my phone in my pockets. I'm panicking at this point and go home hoping that my phone is still plugged into the speakers at home. Open the door and it's not there, so I most likely dropped it on the way to school. So now I have no phone and I dont know if I should be mad or sad. I tried calling the phone as well and its ringing but no one is answering. Cousin told me that if someone wanted to steal it they would've turned it off and or taken the sim out. Did I mention I dont have the Find my Iphone app? I live in the Philippines, that phone is prolly being sold to some buyer and is going to be in those stalls that sell phones. Imma go cry now.",TIFU by losing my phone.,11
DeloreanFanatic,6,6,1qywz8,1,"I really wasn't trying to target him or his race and I am usually smarter than this but he got very offended.  I tried so hard to apologize,  but I'm terrible at confrontations and I am pretty sure it sounded fake and like I really didn't give a shit when I tried to profusely apologize...  I feel absolutely terrible.",TIFU showed a coworker a pic from r/funny not realizing until too late that it was quite racist.,7
IAskAboutPorn,11,3,1qw410,0,"On the glans, apparantly the friction from rubbing the skin must have caused a small cut to let it bleed..

Very little amount though, I don't think it's anything huge but.. WTF..",TIFU When my penis started bleeding while masturbating.,3
Virakis,5,3,1r3jah,0,"I'm not a morning person, and neither is my girlfriend, but her 16 year old sister is, and she also has an annoying habit of showing up at her place randomly when she's bored.

This morning I was in bed and my girlfriend was in the shower, and as usual she decided to just waltz right into her room. Noticing me in bed, she started off in a shrill harpy 'whyareyoustillinbeditssolate blah blah' bullshit, but I ignored her and turned over. Then she opened the blinds and started tugging on my blankets and shit, like I'm a fucking child.

I sat up a bit, looked at her and said groggily, but still rather sharply ""Stop fucking with me and let me sleep you stupid fucking bitch."" 

She immediately froze and gave me the deer in the headlights look, and then started bawling and ran out of the room. Now my girlfriend is busy consoling her and starring daggers at me.

Sigh. ",TIFU by calling my girlfriend's sister a bitch.,2
acejesa,4,5,1qunxv,0,"So this happened yesterday not today.

I went to a party with some friends from my old school to catch and there i see one of my old friends- talking to a girl (who had just moved into my former school) so i walk up to them
 and talk to them for like half an hour before making a couple rpunds to meet other people, turns out he was trying to get her to go out with him or at least hook up with her and i totally ruined that shit for him.I feel like such a fucking ass hole and have no idea how to apologize.",TIFU by cockblocking my friend,4
themior,3,4,1r1jwq,0,"I received an email from our customer asking for the sender's (our company's) copy of the shipment waybill. I scanned and emailed it to them without realizing the actual shipping fee of 9,400 yen was clearly written on it when the shipping fee I had quoted was 28,000 yen. It was a small box so I could tell them packaging cost 5,000 yen but still the total wouldn't add up to the quoted price. I just hope they won't call to ask me about the difference in price.",TIFU by disclosing the actual shipping fee to our customer which was much less then quoted.,2
mattstorm360,9,5,1qxioa,0,"Over the weekend, my parents were at a wedding, so i was in charge. My mom gave me emergency money, plus $25 for my sister's car.

We used some of the emergency money for Red robin and arcade games. My sister convinced me to give her the rest, I also had to sleep in my parents room with my brother in case something happened and i didn't, and one of my dogs tore some things up making a mess on my parents bed.
","""TIFU"" This weekend i was in charge.",2
Water_liker,0,6,1r3qpe,0,"I'm stuff piecing things together. I count about 5 vodka bottle. Small ones, though.

I hadn't drinken in a while and was proud of myself. So on Friday I got some beer and vodka. When I woke up today, I was pretty sure it was Monday... no, Tuesday. Oh, shit.

I had at least one midterm and I think one other assignment.

The worst part is what my girlfriend and brother must think.

I had a bit of contempt for my brother, which is probably part of the reason I drink.",TIFU by getting drunk and missing school.,2
id10t_pen15,0,6,1r8yt2,0,"The typical off my chest sub about some girl who gets the shit beat out of her by bf and not knowing what to do blah blah blah. So I post whether or not they had sex, knowing full well she is still with him for whatever excuse/reason. There were even posts of herself saying she's scared that the guy's family won't like her if she says anything. She can't go to the hospital even though she shows signs of needing medical attention, not wanting the staff to question what happened. Basic stupid bitch problems which off my chest is all about, I know, but I was feeling risque so I answered accordingly. Now I am banned from making comments on the sub. Oh the Iron E.....",TIFU by letting my opinion out on off my chest...,1
Sorrow27,4,10,1qvxqs,0,It had been a while since I had seen porn and I feel that my wife and I were reconnecting. We had recently had sex again and it was better than I could have hoped. But something in me wondered as it did when I was a teenager and I looked at porn again. I had planned on telling her that it happened but she saw a saved pic before I could say anything. ,TIFU when I slipped up after a while,5
teotown,4,9,1qwkhg,0,"I'm waiting for the bus with 3 friends, 2 of them and I are invited to this birthday party for our mutual friend. Now this third friend waiting with us was participating in the conversation on what we should get our mutual friend for a birthday gift. 
(Note: the third friend and the mutual friend are complete strangers to each others)
I fucked up by interupting the conversation with, ""why can't we bring (the third friend)"". The third friend accepted but the other 2 friends got pissed off. Then they had a huge argument on why we can't bring the third friend which ended with one friend flipping off the other. 

...How to resolve this?
",TIFU by inviting a friend of mine to my other friends Birthday party,5
soshitimadeausername,5,14,1qu75t,0,FUCKKKKKKKKKKKKKKKKKKKKKKKKKKKKK,TIFU by shagging a random girl without realising she'll start working the same place I do next week...,8
frenzix,4,17,1qu7cj,0,"We were both into it and have never gone this far. She was guiding the ship in the night and decided it was going to port south. Me being the romantic went along for the journey, always up for a new experience. Well it was right in there and I was going hammer and tongs. Next day she's not feeling too good and will have to go to the DR for a checkup - me feel bad now.",TIFU By having first time Anal with my wife and breaking her bits. NSFW,10
MrMaxMax,3,11,1qs9lr,0,Asked if she could give me a BJ with her butt. Didn't know she was on the phone with her mom. Currently single. Yay!,TIFU by asking my girlfriend for a BJ.,4
MouseShank,182,998,1qzfcz,1857,"This morning, I was using a bathroom in the airport while waiting for my flight to board. I did my business, cleaned up, and turned around to take a look at what I had created. After a moment, I pressed the manual flush button, and instead of flushing, the toilet water began to rise rapidly. When the water level was about 1/2 inch below the rim, it stopped. After a moment of relief, I turned around to leave. As I turned around, I triggered the automatic flush. 

I heard another guy freak out as pieces of poop were riding a tidal wave of toilet water in his direction. 

I ran away like a little pussy.",TIFU by using the manual flush button on an automatic toilet.,2855
Futurames,161,523,1r2jqb,1224,"Just a short bit of context. Where I work, we have uniform shirts and I wear mine over another plain t-shirt. Every day when I leave I go to my locker, take off my toolbelt and work shirt and go home, pretty much in that order. 

Well today for some reason, I decided to take off my work shirt before reaching my locker. Then, out of habit, once I reached my locker, my brain demanded that clothing be removed. So, I proceed to take off my regular shirt and am standing there in my bra for a good three and a half seconds before I felt a breeze and realized what I had done. 

This all happened in front of my entire group of male coworkers as well as a bunch of customers. Keep in mind that this is a hardware store so the customer base is largely men. I don't think they all processed exactly what they had just seen. 

Hope you enjoyed the show boys. 

tl;dr: a bunch of guys at the hardware store got a good look at my nuts and bolts.",TIFU by stripping on front of all of my coworkers.,1747
fourfingerdeafpunch,178,682,1qwh67,1223,"This happened last night, my sister said my dad would tame a mountain lion and then I, thinking I was on reddit, blurted out ya I would mount a tame lion. Needless to say I am now the butt of everyone's joke. I woke up this morning with a bottle of lotion and pictures of cats and dogs next to my bed.",TIFU: I told my family I would have sex with a lion.,1905
banginchoonz,678,749,1qu6v1,1215,"Context: she and I have a weird friendship where we exchange filthy innuendos and whatnot all the time.

We were at a nightclub last night. She walked up behind me and grabbed my crotch. I don't mean a light squeeze, she full-on went in there.

I, thinking we were just joking, returned the favour, and grabbed her breast.

She freaked the fuck out. She slapped me, and now refuses to speak to me. I immediately apologised, again and again, but she just blanked me. Her friends said 'you pig, you pervert' etc.

Again, I tried to apologise to her, but all she said was 'don't *ever* do that again,' and I've not heard from her since.

**Edit:** Thanks for the support guys (and especially gals.) I know this story reads like something straight out of /r/circlejerk, but it is 100% true.

An update, for those who've asked. We still haven't spoken, and I doubt we will. We live far apart - she lives in the UK, I live in France; I was just back for the weekend to catch up with friends - and so we don't really see each other often. Losing her as a friend means two things: a 80% drop in sexy banter on Facebook, and one less person to see whenever I visit home.

Again, thanks to you all, especially the ladies. Everyone who got Gold deserved it. &lt;3",TIFU By touching my friend's boob after she grabbed my crotch.,1964
gozenurhole,99,392,1qshu3,1197,"So my boyfriend and I are getting ready to lay down and he tells me to make the bed. (Because I move around a lot in my sleep and mess up the bedding.) The lights are already off and I go to make the bed. As I am moving the covers around, I notice what looks like a small box, a small RING box. My heart stops, and he says ""what IS that?"" I'm all ""I don't know..."" and I pick it up, full of emotions, about to cry. ...It's the charging port to his phone charger. Apparently he thought I was going to propose to him too because he really didn't know what it was. I'm an idiot.

TL;DR I mistook a phone charging port for an engagement ring box and got emotional for nothing.",TIFU By thinking my boyfriend was proposing to me.,1589
