author,comments,downvotes,id,score,selftext,title,upvotes
drevo,16,16,1qygsp,54,While ringing up a foreign customer He was buying a lot of items at our retail store Hes total was over  When I swiped his card the registers somehow it was read as cash I wasnt thinking clearly so I entered his amount as the tender total which means the registers thought I was putting in his total amount The reason I didnt think something was wrong was because he was using a foreign card which our systems do accept but apparently not this time At the end of the day the register was short over  the exact amount that the gentleman has had spent Now the higher ups are looking into this and apparently bulk buyers are extremely frowned upon to the point where I might lose my job over this The reason being is cause they take our merchandise and sell it in their countryI learn the outcome of everything tomorrow ,TIFU and lost the store over ,70
quistodes,8,22,1qyqmi,54,So theres me a young cyclist finally deciding to shave my legs for whatever reason no one actually knows why Hair so thick that I buy some hair removal cream to helpAnyway come pm Im dehairing myself bit by bit involving hopping in and out of the shower and I prop the door to the showerroom open to let some cool air in cos its getting pretty hotImportant detail I live in halls block of several shared flatsThe fire alarms in this building are really sensitive and keep getting set off my steam from the showersSo Im partway through the job when suddenly the alarm goes off the system by the door tells you who set it off so everyone knows it was meI quickly throw on some clothes and run outside with only half of one leg shavedUnfortunately I couldnt then go back in the shower so as not to arouse suspicion So I was left with   hair legs and the disapproval of all my flatmatesHereshttpiimgurcombkHsjpg a picture of what I was left with ,TIFU by shaving my legs,76
Basoran,21,15,1r811b,57,Late at night and  beers in shoping some images selecting areas with wand marquee lasso or ctrlato select all  After I am  done with the selection ctrld deselects the areaMeanwhile I am  ogling my  movie collection wondering which to watch I ctrla to select a picture on the other monitors photoshop and instead select all of my movies  No problem ctrld to deselect Ladies and gentlemen  you no longer have  to take your right hand off your mouse or move your left hand to delete TB of data  With a simple two stroke key command you can rush to the  web and download  EVERY FILE RECOVERY TOOL YOU CAN FIND IN HOPES OF SALVAGING YEARS OF COLLECTINGTo Day I Fucked UpeditIve managed to recover my files to another drive  However  of  recovery tools saved the data but not the file name  Now I get to play Movie Quiz in real life  Im the only opponent there is no time limit google is an option there are  files all starting with edit Oh sweet merciful monkey milk  which of the  james bonds is this one and WHAT YEARedit I do not recall owning any henti ow that is just The Guyver one wierd sceen anime not the mark hamil remake,TIFU by photoshoping my movies drive,72
trowaway,29,19,1qu2pu,48,Not a big problem right it is when your mom sees it and I was downstairs So I got a message on whatsapp Do you watch often porn from her I am freaking out right now no idea what to send back or say We just ate and it was uncomfortable Suggestions are appreciated,TIFU by leaving porn open on my pc,67
DizzyLola,10,12,1qzqqu,43,Okay so this happened just now obviously a few minutes after we finished having dinner My older brother by only  months was eating lasagne opposite me and blowing on a bit of it on his forkThis would have been okay but he was breathing so loudly I waited a few seconds before he took in a deep breath and did it again me getting more and more pissed Its not that hot I complained to him resulting with him looking up and saying You try eat a piece from the middle Ysee Reddit this is where I fucked upOkay easy challenge right No Dear God no I took a big bite of it right from the middle and began chewing it maintaining eye contact I ignored the burning sensation and stopped myself from making any face to show how it didnt burnFinally the lava was successfully eaten I took a drink and excused myself letting the victory show My tongue is burnt and Im pretty sure Ive killed my tastebudsTLDR I won a challenge set by my brother to eat hot justoutoftheoven lasagne resulting in a badly burnt tongue,TIFU and tried to be a tough younger sister,55
fuzzyblackyeti,4,9,1qy38q,45,So in my British Literature class today we were having an online discussion Our teacher set up an Google Site and we post about the books we are reading and he posts different discussions that we comment on and suchSo here I am typing away about how I think I could adapt to living in another part of the world and a woman comes up to me and asks quite nicely Do you like this better than in class discussionsI for one dont really like in class discussion because I cant always find the words and I generally dont like talking to people in my class because a few of them arent very nice or have opposite opinions to mine and I dont want to start a huge argumentSo I answer YesShe then follows up with WhyA very logical question succeeding my answerBut I answer instantly without thinking Because I dont like talking to peopleShe just walks away awkwardly I didnt realize until about  seconds after that Wow she thought I meant her Im an assholeI felt so bad But thats not the final blow of my awkward Guess who she was guys Just guess Too bad you arent allowed It was our superintendentGuys I made a goof I made a goof Help,TIFU by trying to talk to someone interested in what I was doing,54
ScorpioEverlast,19,24,1qsyl3,47,So there I was just sitting on a bench at my local mall minding my own business Partaking in one of my favorite hobbies of peoplewatchingabout  minutes in a black prob  yo set down not next to me but within conversational distance After about  more minutes a few of his friends came and chatted with him about Lebron vs Kobe shoes weed ect ect  typical black guy conversations  Not  minutes after his friends left he spoke up and asked me Hey man you wouldnt happen to have change for a  would you I replied without hesitation IDK let me check  Now for some background I usually am pretty quickminded with situations I pay attention to my surroundings I often evesdrop into conversations taking place around me And usually always keep myself out of precarious situations BUT NOT TODAYI knew I had just cashed my payroll check a few hours ago and kept some cash on me I knew I had a few s but didnt know if I could make the remaining  After a quick check in my wallet I had the money in hand  s a  and  s We traded bills and immediately I knew the bill wasnt right The feel was wrong So instantly placed it up against another bill and it was smaller in dimension I then checked for the watermarks and there were none to be found I instantly said to him NO I believe this bill is fake and I want my money back what took place next was a slow but steady escalation right in the middle of a crowded mall He stood up and stated Its not fake I just got it from a store in change and need to break it to pay a friend back I stood up and blocked his progress of walking away when we both stood up I realized what I was up against This kid was a good  inches taller than me easily lbs on me and at this point angry that I had confrontedtrapped him Now I new that  this point he was NOT getting out of my presence NO MATTER WHAT I also knew that it was his word against mine but that if worse came to worse that we were or at least should be being recorded via CCTV  I again stated this bill is fake and I want my money back NOW and you can walk away or I am calling security He then said go ahead you have the bill Its your word against mine You think they are going to believe me because Im black and youre white At this point I was getting pissed but had to keep my calmness or shit could get out of hand fastImmediately I yelled in a stern voice SECURITY We were within Earshot of the guest services booth thankfully and I know at least a half dozen people were watching at this point He said Hey man I just got that I didnt know it was fake Let me go get them I said No its too late I gave you the chance and you passed and Yelled SECURITY once moreBy this time he was very nervous and trying numerous times to leave but i had him partially cornered between the bench we where on a kiosk selling hair supplies and the wall I glanced over his shoulder and seen a very large man in a suit walking our way The gentleman asked what seems to be the issue and the kid tried to split once more and I sternly said Do not let him leave by this time a few more mall cops arrived and separated us and got both stories I repeated what had happened while he still attempted to leave again The man on the suit told him he was being retained and called for local PD Not a minute later I repeated the incident to the officer The officer then spoke with the kid He obtained the bill from me and looked it over and stated it was def a fake The kid tried to play dumb not knowing about the water marks and such The officer didnt buy it obtained the kids ID spoke on his radio then asked me how I would like to proceed I told him that I gave him the option to get out of it and he passed I asked the officer if he had the right to search the kid He said NO I then stated that he could have more bad bills on him The officer then went back to the kid and asked for consent to search him Like a scared kid he said yes The officer did a quick scan then took his wallet and sure enough  more FAKE s needless to say the ball is in my courtThe officer immediately arrested the kid and read him his rights HE was pissed cussing and yelling obscenities at me It was at this time that a was flooded with different emotions Knowing I fucked up by trying to be a good patron The potential for the situation to end way worse for me And the overwhelming feeling that I did right by standing my ground and busting this assholeI immediately went and got a soda to cure my crazy cotton mouth and left the mall Now a few hours later looking back The way I handled the situation has given me a great deal of confidence in my ability to handle a situation with a stranger I do know this feeling could very well one day make things worse for my but for now I feel great but I still FUCKED UPTLDR Offered to make change for a fake  for a stranger  the mall realized immediatly Security and Police busted kid for Fake bills Day made  ,TIFU by making change for a FAKE   the local mall Still won,71
aburningthrowaway,11,8,1r658d,42,I work in a research lab en route to getting my masters degree Its a biochemical lab so theres not too much thats very dangerous and overall its a pretty relaxed place to work Despite official policy pretty much nobody wears lab coats or goggles shorts abound in the summer and gloves are mainly to keep from contaminating your sample rather than protecting your hands It can be easy in this environment to sort of forget that safety is still important sometimes Yesterday I got to the lab at  am and was there until about  pm having had a lot of work to finish up Most of my days that run that long include a lot of downtime but on this occasion I was actually doing work for most of it Tedious monotonous soulcrushing work involving repeated treatments with a base that left me exhausted and braindead at the end of the dayI leave the lab and breathe a sigh of relief and take a muchneeded urination break before heading home I enter the washroom zip down and grab my donger as is mans sacred right Suddenly I feel a sort of itch I ignore it and continue as I was but before long the itch intensifies And then it transforms into a burning The burning is gentle at first it does not remain so Soon it feels as though a scornful fire elemental is attempting to blow me and I am trying very hard to stay still so as not to piss all over myself despite the fiery waves of pain that now crash upon my pubic shoreWhen it becomes too much to bear I am thankfully nearly done but still manage to splatter some on my pants as I am forced to let go doubling over with my pants halfdown before I finally recover somewhat from the pain The supernova heat has die down to a much calmer smaller nova and I force the thing back into my pantsI evidently forgot to wash my hands after working with the base all day It wasnt that concentrated so it didnt hurt my hands or anything like that but as soon as I touched my sensitive wangflesh it made its wretched presence known Looking at it once I got home my dangler was redder than that of the devil himself and covered in delightful blisters It still hurts like a bitchTLDRgtThere once was a man in a labgtIn the washroom his penis he grabbedgtWhen suddenly paingtLike his dick was in flamesgtSo bad hed have rather been stabbed,TIFU by forgetting to wash my hands,50
BurpleNurple,11,18,1qtvp2,39,Okay this was actually last week But I was too busy fucking up other things to put my initial fuckup into wordsIt was Veterans Day at my school Each year we celebrate by inviting any parentsgrandparentsgreatgrandparentsyougetthepoint to come to the ceremony We sing some dramatic fuck yes America songs have a few snotty middle schoolers speak and give a slideshow on all the most recent wars in which the US has been fightingSo the elementary school kids were all getting up from the bleachers to stand in front of us and sing a song They walked single file behind their teachers They looked like little ducklings with an insatiable eagerness in their eyes an eagerness to sing about our country Just kidding They were really cute thoughThe kindergarten kids were walking up last since they are obviously the cutest Some kept getting distracted by the crowd stopping to gaze upon the numerous high schoolers staring at them having to be gently nudged by their teachers to keep walkingThis one girl though She was trying to walk in a straight line while simultaneously staring at the scary high schoolers Needless to say hilarity ensued The girl fell RIGHT OVER on her face Id say you had to have been there but I swore in that moment it sounded just like a giant pound pancake bellyflopping into a pool of pure liquefied giggles Just FLOP PLOP SMACK That girl went DOWNUnfortunately for me this occurred at a rather unfortunate time the kids had been walking up to sing while one of said snobby middle schoolers was reading off statistics about WWI There were graphic pictures on the screen tooI started dyingShit is so much funnier when youre not supposed to be laughing at it tooAfter the initial burst of uncontrollable laughter I kept snorting little giggles during the subsequent slide on WWII each time I thought about how I wasnt supposed to be laughing about that fucking kid It sounded like I was giggling over how many casualties we had in WWII GahTLDR I fucked up by being unable to control my laughter over a child who tripped during a Veterans Day ceremony,TIFU by laughing at a WWI powerpoint,57
NiceRideMan,3,11,1r79fs,39,Preface I live in a semidetached house so we share our driveway with our neighbors Theres enough room in the driveway for a total of  cars Theyre a rather sizeable family so they have  cars and pack them all into the driveway We never did mind because we only have  cars and if they park the rd car a little on their lawn and partially in the driveway we can fit  cars Although I didnt mind I still found it annoying at times since it was a tight fit leaving me less room to maneuverThe neighbors are a really nice Muslim family Most of the reason I didnt mind them squashing  cars into the driveway was because they did things for us frequently Here in Ontario it snows a lot sometimes If they saw that our driveway hadnt been cleaned theyd do it for us a lot of the time And theyd bring over leftover food from feasts and it was so fucking good So over those  years I never said anything about their  carsPreface over heres what happened A couple of days ago I was at university and my mom texted me saying the neighbor had passed away Keep in mind this was a large family There was an  year old with his wife  of their kids Both mids who had wives and kids of their own  people total The  year old man passed away because his kidney failedWhen I arrived home that day one of the deceased mans sons was in the driveway I walked on over to him and expressed my condolences OUT OF FUCKING NO WHERE and I mean in no way did I mean to say this but for whatever reason did I proceeded to say Haha guess you wont need that third car anymore Probably something subconscious Fucking Freudian slip Needless to say I felt terribly awkward and just Oh man dinner is readyd away,TIFU my opening my mouth,50
lhwang,8,14,1qwto6,37,Was working at home and calling in to a teleconference During the call I was walking around my condo and decided it would be a good idea to multitask  and feed my fish So I go ahead and put the phone on top of one of my tanks I have two gallon tanks and the filtration systems are really loud All of a sudden awkward pause on call My boss Oh godis one of you pissing in the mens room right nowAll of us Nope not meawkward silenceMe Oh godIm standing by my aquariums guys Those are the filtersLaughter all around,TIFU by standing next to my aquariums during a teleconference,51
ismileicrazy,8,6,1qxbt9,37,I work as a servermanager at a fine dining Italian restaurant  One of our regulars a barfly really always told me she wanted to do something with my hair  I am a guy btw never put any colour in my hair etc  Our bartender basically a fuckbuddy of the barfly repeatedly told me Yeah yeah do it  Shes good She makes a living cutting hair from home Finally I give in  Sure Im growing out my hair a bit but you can put a few light highlights in my hair to lighten it upThe next day I call her up and arrange to meet her at her place  I arrive its a ground level apartment  She greets me we go inside  Filthy carpet the tv had what I could only imagine a stream of dried jizz dripped down it  Okay I think to myself She does this for a living its all good  She takes me to her chair  It was literally a broken down lawn chair Fuck I cant even back out of this now I sit down she pulls out a tube of something and a plastic fork  She gets to work  My head is feeling heavy at this point  I reiterate to her that all I wanted was some nice blending in highlights  Oh yeah I totally understand  Dont worry I know what Im doing  Im basically shitting myself at this point in time  She throws a plastic shopping bag on my head and has me sit there  I start frantically texting my fiancee What the fuck did I do Why did I do this  Finally she comes back  Time to rinse it out We enter her bathroom  She had me kneel beside her filthy toilet and put my head under the tap in her bathtub  At this point all I can think of is Get this shit off of my head I dont even care that Im kneeling beside her disgusting toilet  She appraises her job and decides she need to put more bleach or whatever on  Keep in mind I am yet to see a mirror  Its okay Im sure its I feel more bleach on my head FUCK Okay bag rinse repeat  Shes done She shows me the final job  I want to die  Giant chunks of white blonde at the front I have a Don Draper like s style to my hair Throughout the rest orangey blonde dark blonde white blonde any colour of blonde you can imagine  And she is looking at me with a look of insane pride on her face Do you love it OMG It looks amaaaaazing  All I could say was Umm its neat  She asks for   I leave  I look for the hidden cameras  No luck this actually happened I wasnt on Candid Camera or anythingI get one block away and call a coworker  Luckily I had a hat with me  I ask her to meet me I need to show her something and I need her to tell me Im overreacting  We meet up  I take off the hat  She bursts out laughing Who did this to you Why did you let it happen  We make an emergency appointment with her hairdresser  I get there she looks at me holding back laughter and says Did you lose a bet or something followed with Wow she must really hate you  She matched my original colour puts the dye in we let it sit  times we had to do that as the dye wouldnt hold  I cant wash my hair for like a month or this will wash out and Ill have a head of fucked up blonde chunks And now I have to break this shitty hairdressers heart when she comes in the restaurant nextTLDR  I paid  to have my hair look exactly as it had earlier that day because I trusted the fuckbuddy of my bartender to dye my hair,TIFU by getting my hair highlighted by a customer of mine,43
emopanda,8,10,1qsr70,41,I will preface this by saying that I currently live with other people And we were in the living room Today my boyfriend came over to hang out and watch TV Nothing out of the ordinary until things start to get heated Eventually I decide that I want to give a blowjob The best way to do it was to unzip and pull it out I begin to get to work when suddenly I hear a key in the door Shit Someone is home and about to walk in on said blowjob I did the logical thing and try to put it away I think its in and rush to zip his pants It stoppedAll I heard was You bitch as he cupped himself and tried to zip up properly Didnt get caught At least there wasnt blood just the tip I later made up for it with a proper blowup  TLDR rushed to zip his pants up to avoid getting caught in the middle of a blowjob zipped up his dick Edit to avoid some comments we use the phrase you bitch jokingly I think he was just surprised and trying to make a jokeTIFU,TIFU by trying to zip my boyfriends penis,51
immediatefracture,6,9,1r2hp9,37,Super long story short shit in my life is a little rough right now With my horrible inability to deal with large amounts of stress at one time naturally I started to fall behind on school work a bit But today today I had a revelation Today I said I would do well Only had I not forgotten that something has always got to giveAnyway So Im in Calculus getting ready to start a quiz when prof asks if anyone has any questions and I remember that I dont quite remember how to do something So I promptly raise my hand and begin to try to explain what concept it is exactly that I am not grasping Word vomit at its best It comes out something like I cant remember how to do one of the things you assigned last week for homework and and uhhhh I just can we go over itWith which she so rightly responds What the hell are you talking aboutNow this woman is no fucking joke Very fuck you personality and extraordinarily obvious when shes judging you  So there I am freeeeeeeeaking out because shes staring into my soul and I cant be at ease really because shes intimidating me and im scared I start to blurt out something along the lines of RIGHT BUT I JUST DONT KNOW HOW TO DO IT Maybe only two or three octaves below the frequency only fucking dogs can hear It gets better I hear a light chuckle from someone behind me as my professor begins to start going over I guess what she could only assume was the issue I had I get all ashamed and shit and interrupt her with Oh I get it now She shoots me a look that could make Jackie Chan shit his pants and continues reviewing a problem that I had later realized was not the problem I was struggling with at all Failed the quiz anyway along with any social composure I had before am this morningtldr ate a stale french fry and cried about it later,TIFU by desperately trying to succeed but instead convincing a large group of people that I am a fuck face,46
nunyabeans,45,41,1r57kd,32,Well at my school you have to use HID key cards and if you dont have yours you get detention Well i lost mine and i dont feel like missing lunch for not having it so i made a fake one But my principle is a bitch and decided to test mine and now may send me to the honor council which if i got in trouble would have to be reported to the college i already got into                                 TlDR used fake keycard got caught might effect possible college choice,TIFU by using a fake key card at school,73
