author,comments,downvotes,id,score,selftext,title,upvotes
BurpleNurple,11,18,1qtvp2,39,"Okay, this was actually last week. But I was too busy fucking up other things to put my initial fuck-up into words.

It was Veterans Day at my school. Each year, we celebrate by inviting any parents/grandparents/great-grandparents/you-get-the-point to come to the ceremony. We sing some dramatic ***fuck yes America*** songs, have a few snotty middle schoolers speak, and give a slideshow on all the most recent wars in which the U.S. has been fighting.

So, the elementary school kids were all getting up from the bleachers to stand in front of us and sing a song. They walked single file behind their teachers. They looked like little ducklings with an insatiable eagerness in their eyes, an eagerness to sing about our country. Just kidding. They were really cute, though.

The kindergarten kids were walking up last, since they are obviously the cutest. Some kept getting distracted by the crowd, stopping to gaze upon the numerous high schoolers staring at them, having to be gently nudged by their teachers to keep walking.

This one girl, though. She was trying to walk in a straight line while simultaneously staring at the scary high schoolers. Needless to say, hilarity ensued. The girl fell RIGHT OVER on her face. I'd say you had to have been there, but I swore in that moment it sounded just like a giant 50-pound pancake belly-flopping into a pool of pure liquefied giggles. Just... FLOP. PLOP. SMACK. That girl went DOWN.

Unfortunately for me, this occurred at a rather unfortunate time: the kids had been walking up to sing while one of said snobby middle schoolers was reading off statistics about WWI. There were graphic pictures on the screen, too.

I started *dying*.

Shit is so much funnier when you're not supposed to be laughing at it, too.

After the initial burst of uncontrollable laughter, I kept snorting little giggles during the subsequent slide on WWII each time I thought about how I wasn't supposed to be laughing about that fucking kid. It sounded like I was giggling over how many casualties we had in WWII. Gah.

***TL;DR: I fucked up by being unable to control my laughter over a child who tripped during a Veterans' Day ceremony.***",TIFU by laughing at a WWI powerpoint.,57
NiceRideMan,3,11,1r79fs,39,"Preface: I live in a semi-detached house, so we share our driveway with our neighbors. There's enough room in the driveway for a total of 4 cars. They're a rather sizeable family, so they have 3 cars and pack them all into the driveway. We never did mind because we only have 2 cars, and if they park the 3rd car a little on their lawn and partially in the driveway, we can fit 5 cars. Although I didn't mind, I still found it annoying at times since it was a tight fit leaving me less room to maneuver.

The neighbors are a really nice Muslim family. Most of the reason I didn't mind them squashing 3 cars into the driveway was because they did things for us frequently. Here in Ontario, it snows a lot sometimes. If they saw that our driveway hadn't been cleaned, they'd do it for us a lot of the time. And they'd bring over leftover food from feasts, and it was so fucking good. So over those 10 years, I never said anything about their 3 cars.

Preface over, here's what happened. A couple of days ago I was at university, and my mom texted me saying the neighbor had passed away. Keep in mind this was a large family. There was an 80 year old with his wife, 2 of their kids (Both mid-30s, who had wives and kids of their own.) 10 people total. The 80 year old man passed away because his kidney failed.

When I arrived home that day, one of the deceased man's sons was in the driveway. I walked on over to him and expressed my condolences. OUT OF FUCKING NO WHERE, and I mean in no way did I mean to say this but for whatever reason did, I proceeded to say ""Haha, guess you won't need that [third] car anymore."" Probably something subconscious. Fucking Freudian slip. Needless to say, I felt terribly awkward and just ""Oh man dinner is ready'd"" away.",TIFU my opening my mouth,50
lhwang0320,8,14,1qwto6,37,"Was working at home and calling in to a teleconference. During the call I was walking around my condo, and decided it would be a good idea to multitask  and feed my fish. So I go ahead and put the phone on top of one of my tanks. I have two 10-gallon tanks and the filtration systems are really loud. 

All of a sudden, awkward pause on call. 

My boss: Oh god...is one of you pissing in the men's room right now?

All of us: Nope, not me!

**awkward silence**

Me: Oh god....I'm standing by my aquariums, guys. Those are the filters!

Laughter all around.

",TIFU by standing next to my aquariums during a teleconference,51
ismileicrazy,8,6,1qxbt9,37,"I work as a server/manager at a fine dining Italian restaurant.  One of our regulars, a barfly really, always told me she wanted to do something with my hair.  I am a guy btw, never put any colour in my hair etc.  Our bartender, basically a fuckbuddy of the barfly, repeatedly told me ""Yeah, yeah, do it.  She's good! She makes a living cutting hair from home."" Finally I give in.  ""Sure, I'm growing out my hair a bit, but you can put a few light highlights in my hair to lighten it up.""

The next day I call her up and arrange to meet her at her place.  I arrive, its a ground level apartment.  She greets me, we go inside.  Filthy carpet, the tv had what I could only imagine a stream of dried jizz dripped down it.  ""Okay"" I think to myself. ""She does this for a living, its all good.""  She takes me to her ""chair"".  It was literally a broken down lawn chair. ""Fuck! I can't even back out of this now."" I sit down, she pulls out a tube of something and a plastic fork.  She gets to work.  My head is feeling heavy at this point.  I reiterate to her that all I wanted was some nice blending in highlights.  ""Oh yeah! I totally understand.  Don't worry! I know what I'm doing!"".  I'm basically shitting myself at this point in time.  She throws a plastic shopping bag on my head and has me sit there.  I start frantically texting my fiancee. ""What the fuck did I do?"" ""Why did I do this?!?""  Finally she comes back.  ""Time to rinse it out!"" We enter her bathroom.  She had me kneel beside her filthy toilet and put my head under the tap in her bathtub.  At this point all I can think of is ""Get this shit off of my head! I don't even care that I'm kneeling beside her disgusting toilet!""  She appraises her job and decides she need to put more bleach or whatever on.  Keep in mind I am yet to see a mirror.  ""Its okay, I'm sure it's..."" I feel more bleach on my head. ""FUCK!"" Okay, bag, rinse, repeat.  She's done! She shows me the final job.  I want to die.  Giant chunks of white blonde at the front (I have a Don Draper like 50's style to my hair) Throughout the rest, orangey blonde, dark blonde, white blonde, any colour of blonde you can imagine.  And she is looking at me, with a look of insane pride on her face. ""Do you love it? OMG! It looks amaaaaazing!""  All I could say was ""Umm, its neat.""  She asks for $25.  I leave.  I look for the hidden cameras.  No luck, this actually happened, I wasn't on Candid Camera or anything.

I get one block away and call a coworker.  Luckily I had a hat with me.  I ask her to meet me, I need to show her something and I need her to tell me I'm overreacting.  We meet up.  I take off the hat.  She bursts out laughing. ""Who did this to you??? Why did you let it happen??""  We make an emergency appointment with her hairdresser.  I get there, she looks at me, holding back laughter and says ""Did you lose a bet or something?"" followed with ""Wow, she must really hate you.""  She matched my original colour, puts the dye in, we let it sit. 3 times we had to do that as the dye wouldn't hold.  I can't wash my hair for like a month or this will wash out and I'll have a head of fucked up blonde chunks. And now I have to break this shitty hairdressers heart when she comes in the restaurant next.

**TLDR - I paid $125 to have my hair look exactly as it had earlier that day because I trusted the fuckbuddy of my bartender to dye my hair.**","TIFU by getting my hair ""highlighted"" by a customer of mine.",43
emopanda18,8,10,1qsr70,41,"I will preface this by saying that I currently live with other people. And we were in the living room.
 
Today my boyfriend came over to hang out and watch TV. Nothing out of the ordinary until things start to get heated. Eventually I decide that I want to give a blowjob. The best way to do it was to unzip and pull it out. I begin to get to work when suddenly I hear a key in the door. Shit. Someone is home and about to walk in on said blowjob. I did the logical thing and try to put it away. I think its in and rush to zip his pants. 

It stopped.

All I heard was ""You bitch!"" as he cupped himself and tried to zip up properly. 

Didn't get caught. At least there wasn't blood... just the tip. 

I later made up for it with a proper blowup.  

TL:DR: rushed to zip his pants up to avoid getting caught in the middle of a blowjob, zipped up his dick. 

Edit: to avoid some comments... we use the phrase ""you bitch"" jokingly... I think he was just surprised and trying to make a joke.

TIFU",TIFU by trying to zip my boyfriend's penis.,51
immediatefracture,6,9,1r2hp9,37,"Super long story short, shit in my life is a little rough right now. With my horrible inability to deal with large amounts of stress at one time, naturally I started to fall behind on school work a bit. 

But today, today I had a revelation. Today I said I would do well. 
Only had I not forgotten that something has always got to give.

Anyway. So I'm in Calculus, getting ready to start a quiz when prof asks if anyone has any questions, and I remember that I don't quite remember how to do something. So I promptly raise my hand and begin to try to explain what concept it is exactly that I am not grasping. 
Word vomit at it's best. It comes out something like ""I can't.. remember how to do one of the things you assigned last week for homework and and uhhhh I just... can we go over it?""
With which she so rightly responds ""What the hell are you talking about.""

Now, this woman is no fucking joke. Very fuck you personality and extraordinarily obvious when she's judging you.  

So there I am, freeeeeeeeaking out because she's staring into my soul and I can't be at ease really because she's intimidating me and i'm scared, I start to blurt out something along the lines of, ""RIGHT, BUT I JUST DON'T KNOW HOW TO DO IT."" Maybe only, two or three octaves below the frequency only fucking dogs can hear. 

It gets better. 

I hear a light chuckle from someone behind me, as my professor begins to start going over I guess what she could only assume was the issue I had. I get all ashamed and shit, and interrupt her with ""Oh, I get it now."" 
She shoots me a look that could make Jackie Chan shit his pants, and continues reviewing a problem that I had later realized was not the problem I was struggling with at all. 

Failed the quiz anyway, along with any social composure I had before 8am this morning.

tl;dr ate a stale french fry and cried about it later.","TIFU by desperately trying to succeed, but instead convincing a large group of people that I am a fuck face.",46
nunyabeans,45,41,1r57kd,32,"Well at my school you have to use HID key cards and if you don't have yours you get detention. Well i lost mine and i don't feel like missing lunch for not having it so i made a fake one. But my principle is a bitch and decided to test mine and now may send me to the honor council which if i got in trouble would have to be reported to the college i already got into.
                                 Tl;DR: used fake keycard got caught might effect possible college choice",TIFU by using a fake key card at school.,73
dudusan,5,10,1r3xde,33,"I occasionally go for a swim during the weekend and always top it off with some time in the spa. Whilst in the spa, I sat on a side that had broken jets. So only half the people in the spa had their jets working. When one occupant left, this 70 something year old man signalled me to come sit next to him, where the other person had just got up from. The old guy, I'll call him Peter, was a bit familiar. I had seen him at the spa a few times before. I started chatting with Peter. He was rather funny. He kept commenting on the women who were entering the spa. It was funny to me considering his age. We also spoke about other things such as my wife, his wife, his kids etc.
During the chats, when Peter was making and a joke...he would pinch me in the abdominal area. It was a bit strange but just thought, whatever, its probably just a greek gesture etc (Where Im from, we kinda clap hands whilst laughing). This goes on for about 4-5 times. When I told him i was leaving, he asked me to stay for another 5 mins. In my mind, I thought perhaps he is just a lonely man who just wants to chat. I stayed for another 5 and left. 
In the changing room, i realised someone had pinched my tshirt. Was frantically looking for it when peter walked in. He got dressed whilst I doing rounds looking for my shirt. He even assisted me by taking me to the ""lost/found"" area. I decided to just ride my bike topless and gave up looking for the shirt.  As peter was leaving too, we walked out of the complex together. As i went to my bike, Peter asked if i would like to go for a drive. I agreed and really thought that perhaps this guy has something to get off his chest or is depressed etc. Also thought wont hurt to listen to a guys issues/cries for help etc. So i got into his car and he drove to the other side of the car park. He then began talking about porn movies and i was laughing all the while. It was seriously funny that a guy his age was talking about shit like that. he then asked me why all african guys have big dicks. Now, nothing weird here....as we get this question countless times once we venture into those types of conversations. Peter then asked me if i had a big dick. Again, i laughed this off and just kinda said ...normal type. Peter then puts his hand on the back of my neck and my mind started racing. I just thought, well, if i move or reach for my shoelace, he will let go. So i did that and he let go. He then asks me if i had ever had sex with a man. At this point, i was now feeling fucking awkward and now had suspicions. So i categorically/vehemently said no and that I would never do that as I am not that way. He then reached out and pinched my nipple!  At this point I told him i had to leave. He asked if I was sure that i wanted to leave. So I left.

Thing is, I felt dirty when this guy did this. I was actually innocently thinking i'm just chatting with this guy, whilst he obviously had other intentions. I also, through this experience, know what it feels like for the waitresses who have sexual innuendo left right and centre just because they smiled at a male customer etc.

Its taken me a few days to get over this. Im certain he thinks I am playing hard to get as I did not exactly say NO to his advances (I realised it too late). To him, I got in his car, kept laughing whilst he was pinching me etc and these are signs of someone interested. Im sure I will meet him again at the spa. I will have to be stern with him.",TIFU - Unknowingly led on a gay geriatric,43
tapittuco,13,21,1qsa0l,32,"I know, you've never heard that before...Anyway, it was last night, my wife got a promotion and we decided, ""Friday night, why not get drunk?"". So that was the case.

I think it was about 1 A.M. (maybe 1:30 ish A.M.), and we stumble up the stairs to our new apartment, first thing I go do is take a piss, naturally. As I open the door there she is, just a shirt on, and through my blurred vision, I make out what appears to be something around her waist...her strap-on.

She starts pushing me back into the bed with supernatural strength and pushed me backwards onto the bed and ripped off my jeans, and-fucked me like never before...without any lube. I felt like Jonah Hill (only less fat) in ""This is the End"", now there's usually nothing wrong-but once again, **she didn't use any lube**, no spit either.

After she had her way with me, I lied on that bed, writhing in pain because she treated my ass like no man I've been with (oh, I'm bisexual if you haven't picked that up yet, but I do know of some straight men who let their girlfriends/wives peg them) and at the same time in a ""the best orgasm I've had in my life [*so far*]"" coma. I fell off the bed and was lying on the cold floor when she threw a towel at me and said: ""Use this to clean up you filthy whore.""

The next thing I remember is stumbling to my truck and heading off to work. When I got there some friend who lives below us (unfortunately) was teasing me and bothering the shit out of me (HA! Not likely, oh the burning...) to tell the two other guys in the office why I was walking so weird when I shouted (without the knowledge of my boss entering right behind us) ""OKAY! MY WIFE FUCKED ME RAW!""

A quick reprimand later^and^an^icepackthatisn'tprovingtohelp, I'm here sharing my dilemma with beautiful redditors of the world who might find this entertaining.

edit: i dont know how i forgot but i did anyway, i do remember that i hurled before i passed out last night. ~~cant wait to get home to clean that up.~~",TIFU by having drunk sex.,53
BorneTM,11,6,1r3j91,28,"So here I am. The ending of 3rd period math. As you know, the last couple of minutes in class everybody stands up and lines up at the door to get ready to go. I am no exception. Occasionally, I grab the back of my backpack to ensure my phone is still there (long story). I did just that. However, unbeknownst to me, there was a girl with semi-large tits speed walking to the door (I was facing the other way). Swinging my hands back, unknowingly that the girl was coming, I accidentally grabbed a handful of her left tit. This has to be the most awkward experience I have experienced in a long time.


tl;dr: Was going to check phone, accidentally grabbed a left tit.",TIFU by accidentally grabbing a girls left tit,34
whatshalike,7,12,1r1zh1,27,"Red Eye from LAX to PHL. The guy sitting next to me arrives, an escort holding his bag. Never seen that before. He pays the escort a few bucks—kinda just gives him a handful. I get up and he takes his time squeezing by. He’s a big big guy, wrap around Gucci shades. He gets settled, mumbling about Grimace, the big purple autistic guy from McDonalds. “You don’t know who Grimace is?” I don’t know how to respond so I give a half chuckle, then realize that he’s on his Bluetooth. He mumbles into in until the moment the plane is airborne. He’s taking up some of my seat, but I don’t say anything. No sense confronting him about something out of his control (in the short run, arguably).  I can hear his music through his Beats By Dre. Fine. I’m washed and pretty drunk so I fall asleep within minutes of take off. 

I wake up after a couple hours. The guy sitting next to me is on his laptop—looks like a music program, FL Studio or something—and even though his screen is tilted down, it’s on full bright. I can easily hear his music through his headphones. I put my headphones on and try to fall back asleep, but between the light and sound coming off of this guy, there’s no chance. I consider saying something but settle on a passive aggressive turn away from him. A half hour passes—nothing. My back is aching and my eyes are clenched shut but I’m wide awake, and getting mad. I’m thinking about calling him out: I would, all calculated, rip off my headphones, turn to him and say “Will you give it a rest?!” He’d either apologize, deferring to my obvious rightness, or say “Hey man I’m just doing my thing/I gotta work/something to this effect,” and I’d snarkily say “Well can you do it without keeping everyone else on the damn plane up?” Yeah, I’m awesome, I’m a hero. I settle on the non-confrontational route and think about asking the attendant for a sleep mask. When I open my eyes, the “call attendant” light it blinking. What happened? Is someone else gonna call this guy out? Does this airplane respond to passive-aggressive thoughts? The attendant comes over to our three-person row and waits for one of us to ask him for something, but no one does. He stands there for a beat, unspeaking, and I shrug at him without taking off my headphones. 

Let me be clear. I didn’t chicken out. I did chicken out. But I didn’t call the guy. I couldn’t just swoop in on someone else’s call.  Maybe something else was going on, something more pressing. Gremlin on the wing, et al. Then I just look like an asshole. Attendant leaves and I follow, ask him for a sleep mask cause the guy next to me has been on his laptop the whole damn flight. He tells me there’s only an hour or so until we land. Also we don’t have sleep masks. Fair enough. Head back to my seat and decide to get on my own laptop, with my f.lux lighting set to “candle—super dim.” That’ll show the fucker who’s courteous.  I organize documents, pictures; bury porn that I’d lazily saved straight to my desktop. The guy next to me pushes the attendant button. Well that solves that. Attendant comes over and the guy next to me is unaffected, looking straight ahead, absorbed by his music. I’m not about to help him so I pretend not to see the attendant. He only stays for a couple seconds this time. 

Getting near Philadelphia, tray tables go up. Guy next to me calls the attendant a third time. The light blinks for about five minutes, no doubt while the attendant decides how he’s gonna tell us off. He comes over and launches right into it, I take off my headphones. 

“…third time I’ve been over here…” 

I elbow the guy next to me, kinda hard. He jumps, takes off his Beats and looks up. 

“…even acknowledge me.” 

Guy next to me says “Sorry, I can’t see.” No shit, it’s dark and you’re wearing Gucci shades over half your face. 

“Well what do you want?” 

“Can I get a glass of water, no ice?” 

The attendant already has one in his hand. “Here, take it.” We land. Guy two rows ahead of me asks to help grab his bag from the overhead bin. Guy next to me is doing that awkward half stand of someone trying to join the sovereign people of Aislestandistan, but I’m boxing him in. His head is right in front of the bin I need to open. “Hey, watch your head,” I ask a little too softly, like I do. “Hey excuse me can you watch your head?” People are looking. Guy sitting on the other side of him taps him and he realizes what’s going on, ducks. I grab the guys bag and pass it forward. I ask the same favor of someone sitting two rows behind me. We stand for a few minutes while the uppermiddle class deplane. I do that thing you do when you’re awkwardly close to a group of strangers for an awkwardly long time—my eyes half dart around, half look down at my sweater. Get caught looking at that blonde girl twice. I notice that the guy sitting next to me has a stack of short tubes in his hand, the length of straws and the width of fingers. The hell is that? People clear up and I’m finally about to get off the plane when the guy sitting next to me stands up right in front of me and starts feeling around at the overhead bin across the aisle. A woman behind us sees this and taps me, gesturing towards him “can you…” Can I? Can I what, help him? Why should I help…mother fucker. I am the dumbest person I know.

TL;DR: Sat next to a blind guy on my flight and was mad at him for being a dick, didn't realize he was blind and totally not a dick. ",TIFU by being a dick to a blind guy on a plane.,39
DJDemyan,4,5,1qw25y,26,"I work for a temp agency. Yesterday, I woke up feeling like shit and contemplated calling in sick, but instead decided to show up for work anyway. I only feel progressively worse, as though I'm cooking inside of my clothes. Sweat was dripping off my face. Oh, shit. I'm running an awful fever! I work in about 30-40 degrees Fahrenheit, so there is no reason for me to feel this hot. I talk to management and use my last ""point"" to go home and rest. Today I woke up feeling exponentially better, ready to get through the day. About half an hour into work, one of the bosses pulls me aside and says he needs to talk to me, telling me to follow him. He leads me all the way through the facility to the locker room, where he tells me they received an email from my temp agency saying that they've ended my assignment; AKA I got fired. He escorts me out of the building and tells me to go home and call the agency for details, as he has no clue the reason behind my assignment's termination. I imagine the reason is my going home sick and using my last point, although this SHOULDN'T be a reason because I still had that point to use. I will call them when the office opens, and keep you all posted. Nonetheless, I'm pretty sure that Yesterday, I Fucked Up.",TIFU - Going Home Sick (YIFU Edition),31
