author,comments,downvotes,id,score,selftext,title,upvotes
MouseShank,182,1002,1qzfcz,1852,"This morning, I was using a bathroom in the airport while waiting for my flight to board. I did my business, cleaned up, and turned around to take a look at what I had created. After a moment, I pressed the manual flush button, and instead of flushing, the toilet water began to rise rapidly. When the water level was about 1/2 inch below the rim, it stopped. After a moment of relief, I turned around to leave. As I turned around, I triggered the automatic flush. 

I heard another guy freak out as pieces of poop were riding a tidal wave of toilet water in his direction. 

I ran away like a little pussy.",TIFU by using the manual flush button on an automatic toilet.,2854
Futurames,161,520,1r2jqb,1229,"Just a short bit of context. Where I work, we have uniform shirts and I wear mine over another plain t-shirt. Every day when I leave I go to my locker, take off my toolbelt and work shirt and go home, pretty much in that order. 

Well today for some reason, I decided to take off my work shirt before reaching my locker. Then, out of habit, once I reached my locker, my brain demanded that clothing be removed. So, I proceed to take off my regular shirt and am standing there in my bra for a good three and a half seconds before I felt a breeze and realized what I had done. 

This all happened in front of my entire group of male coworkers as well as a bunch of customers. Keep in mind that this is a hardware store so the customer base is largely men. I don't think they all processed exactly what they had just seen. 

Hope you enjoyed the show boys. 

tl;dr: a bunch of guys at the hardware store got a good look at my nuts and bolts.",TIFU by stripping on front of all of my coworkers.,1749
fourfingerdeafpunch,178,681,1qwh67,1219,"This happened last night, my sister said my dad would tame a mountain lion and then I, thinking I was on reddit, blurted out ya I would mount a tame lion. Needless to say I am now the butt of everyone's joke. I woke up this morning with a bottle of lotion and pictures of cats and dogs next to my bed.",TIFU: I told my family I would have sex with a lion.,1900
banginchoonz,678,745,1qu6v1,1220,"Context: she and I have a weird friendship where we exchange filthy innuendos and whatnot all the time.

We were at a nightclub last night. She walked up behind me and grabbed my crotch. I don't mean a light squeeze, she full-on went in there.

I, thinking we were just joking, returned the favour, and grabbed her breast.

She freaked the fuck out. She slapped me, and now refuses to speak to me. I immediately apologised, again and again, but she just blanked me. Her friends said 'you pig, you pervert' etc.

Again, I tried to apologise to her, but all she said was 'don't *ever* do that again,' and I've not heard from her since.

**Edit:** Thanks for the support guys (and especially gals.) I know this story reads like something straight out of /r/circlejerk, but it is 100% true.

An update, for those who've asked. We still haven't spoken, and I doubt we will. We live far apart - she lives in the UK, I live in France; I was just back for the weekend to catch up with friends - and so we don't really see each other often. Losing her as a friend means two things: a 80% drop in sexy banter on Facebook, and one less person to see whenever I visit home.

Again, thanks to you all, especially the ladies. Everyone who got Gold deserved it. &lt;3",TIFU By touching my friend's boob after she grabbed my crotch.,1965
gozenurhole,99,395,1qshu3,1189,"So my boyfriend and I are getting ready to lay down and he tells me to make the bed. (Because I move around a lot in my sleep and mess up the bedding.) The lights are already off and I go to make the bed. As I am moving the covers around, I notice what looks like a small box, a small RING box. My heart stops, and he says ""what IS that?"" I'm all ""I don't know..."" and I pick it up, full of emotions, about to cry. ...It's the charging port to his phone charger. Apparently he thought I was going to propose to him too because he really didn't know what it was. I'm an idiot.

TL;DR I mistook a phone charging port for an engagement ring box and got emotional for nothing.",TIFU By thinking my boyfriend was proposing to me.,1584
DontJustStare,350,357,1r5y5m,744,"Usually, I don't eat breakfast, but that didn't matter because my crush was working at the cafe this morning rather than tonight, so that meant I was going to buy breakfast. *(Don't ask how I knew he had a morning shift this morning. I'm not a stalker; I'm just ..observant and resourceful.)*

Before I left I was sure to apply a little foundation and mascara; probably the amount of makeup a normal girl would wear. Usually, I don't bother as I am not the spend-forever-getting-ready kinda girl. Although he has always been friendly and nice, he has never done anything to give me the impression that he was interested, yet I always make the effort to look nice whenever I know I will be going to the cafe. (I know, kinda pathetic) 

Business was slow--probably because it had just opened and normal people aren't up so early, so it was basically just us two and his other coworker. I have liked this guy for the longest and we have hardly spoken other than about the food and other short chats, nothing personal, but this morning that finally changed. He initiated a conversation, and we wound up talking for a bit, including plans for this weekend. I was beginning to think he was going to actually ask me out! But then business started to pick up. He asked for my number, so we could talk more later. I played it cool on the outside, but on the inside I was doing a [dance](http://25.media.tumblr.com/tumblr_lu6b99ng2s1qew6kmo1_500.gif) . 

So, I reach for my bag to get a pen and paper to give him my number since he didn't have his phone on him. Being a little too eager and naturally clumsy, I knocked over my book bag, causing some of the items to fall out. **FUCK ME** Guess what pops out... My fucking dildo.

What can I say? I am a horny girl and it's been 6 months, hence my thirstiness for this guy. I had spent the previous two nights away from home, and I had to rush to pack this morning because I took so long to get ready and prettify myself. In haste, I stuffed whatever I could in the other bags and just so happened to place Sparky in the bag I carry around with the intention of removing it once I got home. 

My eye balls nearly pop out of the sockets in disbelief, and I hurried up and shoved it back in the bag as if that would make him unsee it. I knew it was too late; he undoubtedly saw my 8inch faux cock. *fuck, fuck, fuck, fuck*. 

I expected him to say he had to hurry and get back to work and try to get out of the situation, so I tried to make it less awkward by just telling him, ""Sorry, I don't have any paper. Maybe next time,"" I said in a nervous voice and got out of there. I don't think the situation could have been any more awkward. I just didn't know what to say. My face was down, avoiding eye-contact out of embarrassment most of that time, so I'm not entirely sure how he reacted, but he was probably thinking *WTF, I knew this bitch was weird, but damn*.

I am always cock-blocking myself by being a werido. Well, looks like it's just me and sparky tonight. :( *Forever alone*. 

**TL;DR: My crush for the longest finally gave me the chance to get the D and I cock-blocked myself by dropping my dildo.**


**EDIT:** A couple of points I want to clarify as it seems I was not clear. I do not carry this dildo around on a daily basis. I had brought it with me while I was away from home in a couple of nights. I was rushing to make it to the cafe as well as check out by a certain time, so I just threw my things in my bags. 

*(Sidenote: I clean my dildo before and after each use to prevent UTIs so even if I was carrying it around &amp; ret-ta-go at any time, it would not put me at any risk)*

Also, the cafe he works at is not Starbucks. I took the photo of inside my book bag (listed in a comment below) later that day in Starbucks to *prove* I was not making this up.

Lastly, the dildo came fully out, so it's not like there is a chance he could not have seen it. After it came out, I pretty much avoided eye contact or looking at him at all, so I don't know what he was thinking. 

Now that I have read each comment, it seems like nearly every person is saying the same thing, which is that he doesn't think I'm a weird freak. There is a chance that I may have been over-thinking this situation with my typical skewed, negative perspective. Perhaps, in a few days, I will revisit the cafe without bringing it up and give him my number (I liked this idea more than apologizing as it avoids making it more awkward IMO). I am just terrified of rejection, so I don't know if I will or not. If I do, I will definitely update!

**References:**

[This submission](http://redd.it/1qzppg) explains some of my ""gone wild"" (as some of you put it) photos. 

[This comment](http://www.reddit.com/r/tifu/comments/1r5y5m/tifu_by_dropping_my_dildo_in_front_of_my_crush/cdjxncj) includes the photo uploaded to *prove* this isn't a fake post.",TIFU by dropping my dildo in front of my crush,1101
MSciCSI,78,140,1qrzde,486,"So today I was in Costco buying supplies for a family party I was to attend later in the day. I passed by the tyre section of the shop and noticed a beautifully presented case of windscreen wipers. They were good quality ones, Bridgestone, compared to the worn 'imported' eBay ones currently on my car. My current ones were ok, they were a bit noisy but I had no reason to change. I figured I could put something decent on her for once and splurged the £13 ($35) for a set of two. 
I got her home and figured I would fit them right away! This is the point when I remember that life isn't fair and no matter what youre doing you'll be able to find a way to fuck it up. So, the first wiper went on no issue.  I began on the second. It was a bit more difficult to get off but I got there in the end.
I left to get the new wiper. 
There was a light breeze of wind. 
The wiper arm fell back down. 
My windscreen smashed. 

Yeah her £13 upgrade turned into an £80 new windscreen. 

The wipers suck too. 

TL;DR;  don't let gremlins near your car. ",TIFU by being nice to my car,626
Bareback112,38,112,1r4ehu,473,"I was round at a party of a girl who I had had previous sexual relations before. So i felt pretty confident I would get sex again at this party. We drank all night and her little brother who has just started drinking as he's young came out and got high with us. It was a great night and me and the girl end up going to bed earlier.
Round 1 was great, round two was better. Two used condoms I wish I had deposed of properly...
I get up in the morning and go and make some coffee, as we're friends and had known each other for years. So it was OK to help myself.
Next thing I hear is a shout and a fall.
What had happened was when I went downstairs to get coffee, I left the bedroom door open. The dog went in, into the bin and extracted one of the used condoms...
He then took the condom into the hall and left it at the top of the stairs...

The little brother... hearing I was awake and probably wanting coffee too decides to come downstairs. He steps on the condom, it sticks to his foot and he proceeds to fall down the stairs....


TLDR: Had sex at a girls house, evil dog steels used condom to plot attack on her little brother....",TIFU - By not closing the door...,585
puddlesofblood,92,111,1r7ueq,409,"Okay, so I'm in my Leadership Advisory class and I was just on my front page. Of course, this is a class where I can just do whatever on the computer.

My teacher was walking around, checking to see what we were working on. 

She came up behind me, and in an effort to quickly click away, I accidentally clicked on an image of a girl in latex, fully spread.

Shit.

She saw and when I tried to exit out, guess what I got???

THE SPINNING WHEEL OF DEATH! 

YAAAAYY!!

Now my teacher thinks I'm a complete nymphomaniac woman!",TIFU by accidentally opening /r/ShinyPorn on reddit in school on a mac.,520
Treetrunksgoespop,47,80,1qxh24,196,"Well. here it goes. I work alone, selling mattresses. I spend 10hrs a day surrounded by comfy beds waiting for someone to come in, its alot of down time. Mostly I spend it watching Netflix and reading reddit and every now and again when things get slow I rub one out. 

It was a slow *slow* day. No one was even parked in the parking lot so I decided why not, im coved up by the big desk that faces the wall of windows, and Im wearing a dress, so its not like anyone would see right? Wrong. I closed my eyes for a few seconds, enjoying my dirty time and was on the edge of cumming, ohh god I was *right there* when I open my eyes and see a group of high school boys looking through the windows on theyre bikes with looks of awe and disbelief, noses pushed up on the glass. 

No ""instant mood killer"" it was too late, It was a mix of pleasure, shame, and guilt. I instantly jumped up and hid in the back room, face beet red with embarrassment vowing to never to touch myself again(at work). At least those boys got a nice show :/  

",TIFU by masturbating at work.,276
poopypoopypoopypoopy,78,78,1qr0a6,179,"^^There ^^will ^^be ^^a ^^TLDR ^^at ^^the ^^bottom ^^^^teehee

I love my ass. It's a ton of fun to play with. You put things in, you take things out, this makes your 'me' time is so much better. As a guy, it's the only way to get in touch with your inner self and I think it's fascinating to say the least.

But today, this was the reason I was mentally preparing a makeshift will. I'm only 18 and I pretty much have nothing to do all day unless I'm working. Obviously if you have the house to yourself, you start to get creative with what you jerk to/with/how. Living at home still trying to get to school or something, I work odd hours. Today I was going to be working 1:30 to 10:00.

I felt particularly kinky today and decided that I wanted to test my colon's absorption ability.

I've gotten drunk once before, and had a beer or two maybe six other times. I clearly don't know how my body handles alcohol very well, let alone unfiltered anus liquor.

But this doesn't cross my mind. I just want to get a bit of a buzz this morning.

Warning: unfiltered ass play ahead
-------------

10:30a I have my shot of vodka in one of those tiny rum bottles and a straw.

I know my plan: create fart, insert bottle and swap fart for shot.

But things aren't perfect. The straw is tearing my asshole a new asshole. It's not that bad though, so I just tough the initial pain out and bend over on my knees and let gravity pull some air in.

Then I replace my straw for the bottle while standing and get back on my knees. Watching my reflection in our full length mirror I shove my ass almost perpendicular to the floor and both legs spread to see the view. I relax my abs and suddenly the bottle is now empty.

Wow. I feel nothing. I expected a little bit of a tingle or burn, but there's nothing. That is, until I take the bottle out. My anus seems to be the only thing that realises what a bad idea this is and screams a signal of pain on contact with the alcohol. Not cool. But whatever; I'm just gonna let the rest of it get absorbed so it won't touch my anus any more! Foolishly I want to jerk something fierce. A small shampoo thing gets to spend quality time with me. In it goes and off I get.

Unfortunately it slips out and a splash of anus burning liquid follows before I clamp shut. It burns. That's not good. ^^Oh. This probably wasn't a great idea. [I'm out.](http://cdn.chud.com/1/1f/295x221px-LL-1f759989_Jerry-Seinfeld-Leaving1.gif)

I'm getting to the toilet and feel the pressure of the leftover makeshift fart coming on. Apparently I took in more air than I thought.

Do you remember the burning of diarrhoea? Only having a shot worth of this is fantastic, because every drip leaving feels like letting satan poke my pink. Followed immediately after is a 20 second fart that feels like heaven. But all is not well in colon town. Head office has noticed a disturbance. An off balance. Some huge negative feedback loop starts the process of removing this foreign substance from my digestive tract, and starts doing some natural laxative shit to me.

Now I'm feeling waves of discomfort as my bowels rustle and shimmy shit at breakneck speeds to the throne. I'm now a hot mess of shit, vodka, and worry.

But the first wave is over and I'm feeling a little off but okay. So I lay down and rest a bit and think about what I've done.

My mind jumps to the idea of liver failure and within seconds I'm googling the symptoms. But I'm pretty much okay. I rest until I'm ready to go to work and for at least another 30 minutes I'm okay.

But the shits start again when I get to work. More gurgles and stuff make me run for the toilet every little while. I also started feeling a bit bloated, making me think that my liver was backing up and being problematic.

To make a long story shorter, a super fart after many mucusy damaged anus poops made me feel on top of the world. For the four hours there, though, I was certain I shocked my liver to failure or something.

Never doing that again.

TL;DR
---------
I like my butt so I put vodka in my butt. My butt didn't like that and shot it and everything in my poop tubes straight out. I started convincing myself that I triggered super fast acute liver failure and was just waiting for jaundice to be my tell tale doctors trip note. Let a fart out hours later and I'm not dead.",TIFU by taking a shot of vodka with my anus,257
Maleus21,17,32,1r1h9k,142,"This actually happened a while back, but I just found this sub, and since all of my friends love this story, I might as well share it with everyone here.

So a while back, my friend and I worked together on 2nd shift. We normally got off work around 10pm, and it was customary for us to stay up late after work, since we didn't need to be in until late afternoon. So this day, my friend asks me to help him get a weight bench he is getting off of craigslist after work. I didn't have anything else going on, so I gladly offered a helping hand. 

The house we were going to was around 45 minutes away, so while getting gas before heading that way, I went in the gas station and picked up a king size Reeses cup and a large Red Bull to give me some energy after work. This was to be my undoing, because little did I know at that time, I am severely lactose intolerant (I never put 2 and 2 together, and didn't have insurance at the time, so I just thought I had stomach issues). 

So on the way there, we are just idly talking, I finish my 4 peanut butter cups and don't think a thing about them. About 15 minutes later, I feel a slight rumble in my stomach, since stomach problems are normal for me at this time, I pass it off, because I know Ill be home within a couple of hours. About 15 minutes later, the rumbling is more intense, and realize that my friends bathroom will probably receive the brunt of my soon to be coming anal assault. A little while later, we are in the person's neighborhood, and I'm starting to think that a gas station on the way home is inevitable. 

Finally we get to dude's house. He is a nice guy, weight bench is in his garage, but unfortunately it is fully assembled (it is one of those huge all in one machines). Well I haven't told my friend about my stomach, and he and the seller are finalizing the deal, then begin talking about how we are going to secure it in the back of my truck. At this point, I am almost in a cold sweat, my ass cheeks are so clenched so tight, you couldn't fit a needle between them. 

We have now finished loading the weight bench, I am giving myself pep talks and saying a prayer for every step I am taking. I do not want to ask a complete stranger whom we just met off of craigslist to use his bathroom obviously, but things are getting bad. That's when it happens... We are exchanging pleasantries, saying thank yous, and about to get in the truck. I am scouring my brain trying to think of the nearest gas station that I saw on the way there, and decide to let a tini-tiny little bitty poot out just to relieve some of the pressure, as my insides feel as though I am about to explode. Well ladies and gents, when you are in that condition, never ever trust a fart.

It broke the ass seal that my cheeks had welded together, and out comes a torrential down-pour of shit. I could feel it coming, I did my best to squeeze my ass together as tight as I could, which ended up resulting in ass cramps along with the spasms of my intestines wanting so desperately to empty, going against every ounce of my soul trying to stop it. The result was excruciating pain, which resulted me kneeling down, screaming in agony. 

Keep in mind, I had not let on to either of these guys that my stomach was even remotely upset, and I'm sure the sweating was mascaraed by the fact that this was taking place during the summer. So to them, it looked as if I just became possessed and began screaming. So now I am kneeling on the ground, my underwear filled up like a babies diaper, my friend is freaking out,  and the guy from craigslist is no doubt regretting every second of this transaction by now.

I slowly stood up, gathered what I could of myself, and kindly asked the seller if I could use his bathroom. His response was simply ""Umm sure dude, in and to the right, last door on the left"". I slowly walked in the house, praying that no small shit nuggets fell out onto their carpet on my way there. After I got in the bathroom, I took a look at the damage, it was irreparable. Now I had to make a decision, walk outside holding underwear, leave a pair of shit pants in his garbage, or option 3. I emptied as much as I could into the toilet, took out my pocket knife, and cut the massive shit stain out of my underwear. This was obviously was a much smaller piece of cloth, which allowed me to wrap it up in a massive amount of toilet paper and stick it in my pocket. I then cleaned my ass as much as possible (I didn't want to shower in his house also, I was already mortified). Put my holy boxers back on, walked outside, went straight to my truck thanking him as I walked by, got in and immediately drove off. Down the street I threw the shit wad out of the window, and began explaining the story to my now laughing so hard he cant breathe friend. 

I asked my friend if the guy had said anything when I went in his house. His reply to my friend ""Its just a hunch, but I think your friend needs to shit"".

edit: spelling",TIFU by helping a friend get a weight bench and shitting myself NSFW (language)(long read but probably worth it),174
ratmftw,52,28,1r115g,130,"
This actually occurred a little under two years ago but anyway.

Every year during the long summer holidays my family have a tradition of heading up to go camping on the East coast of the North Island (NZ). The spot where we go is seriously a fairy tale place: a huge bay with golden sweeping sands, constant sunshine, warm water, big waves, few people, reefs to explore, you get the idea. This year I happened to know that there was a girl there I'd met the previous year who was quite into me. As you can imagine, I'm well keen. The morning after we arrive, virtually as soon as I get up, she bounds over and says she's taking me for my first swim, right now. I'm all about it so we head out into the blue to get wet (me hoping other things may get wet later on). I dive into the water and that's where things begin to take a turn for the unexpected.

As soon as I come up I realise the left side of my face is numb and I can't speak. 

Yep, you guessed it. Brain hemorrhage. 

Ended up spending two weeks in hospital, three months off school and two years later I still can't attend school 5 days a week because I get too tired. I haven't had any luck with the ladies since then either, may or may not be related. 

TL;DR went for a swim with a girl, got brain damaged. ",TIFU by going for a swim with a girl I like.,158
theobi,26,24,1qv8by,123,"I have been dating my girlfriend for over two years. We have a very close group of friends, and she has always been jealous of one other girl (we'll call her Katie). There have been several episodes, usually while drunk, where she breaks down because she thinks I like Katie. Last night we were hammered drunk at a party, and it happened again. After a long time convincing her that I don't have feelings for Katie (which is not completely true, but I would never do anything about it), we made up and went upstairs. In the middle of sex, my dumbass yells out ""Oh Katie!"" I was not even thinking about Katie during sex, it just slipped out. I don't completely remember what happened after that, but we woke up this morning and acted like nothing happened. I'm not sure if she remembers or not since we were both pretty drunk, but I hate myself for doing that. ",TIFU by calling my girlfriend the wrong name in bed.,147
