author,comments,downvotes,id,score,selftext,title,upvotes
anusicecream,10,12,1qtow9,13,So this wasnt actually today but about a month ago I was talking to this girl and we agreed to go to homecoming together We were getting along well and things were going nicely and I was excited about going with her Shes very attractive and I figured I had a good chance of getting laid Sorry for being crude but Im in high school can you really blame me So anyway the night progresses and we have our dances and its time to go to a friends house for a small get togethersleepover There are five of us myself my date her friend her gay friend and her other friend We start playing Truth or Dare to be as cliche as possible and my date and I are the only ones doing dares I see her talking to her friend and the next time her friend dares her to do something it is this I dare you to show us the photos in the locked part of your phone Yeah buddy I was the only straight male there so she just gave it to me Titties they were pictures of her titties and they made me feel happy inside Now this isnt a story about how I got a raging hardon and looked like an idiot This is the story of how I didnt realize that she was trying to get the point across that she wanted to have sex All the signs were there flirting kissing everything but I just couldnt convince myself that she was ready Today is when I found out how much I fucked up We decided to just be friends because things kinda fizzled out shortly after homecoming and yesterday we were talking pretty seriously She told me that she really wanted to do it that night and couldnt understand why I wasnt willing to make a move I felt like such an idiot and I realize that I blew a big opportunity TLDR I am not a smart man,TIFU and missed a chance to have sex with the girl I was seeing,25
BananaPeelSlippers,6,13,1r0bon,16,Sorry this isnt about sex I work and live downtown and the bank my office is with just happens to be connected to my apt Its pretty nice because a couple times a week i get to bring banking and go have a nice long lunch at home with my pups Today i did the banking my boss got me to grab him  in cash along with the usual deposits I have lunch and then have to go grab my car to pick up stuff from court Some asshole parked like six inches from my car i had to squeeze to get in I take off run to court park the car and am just walking into work when i realize the envelope is no longer in my pocketAt this point i am freaking out where did i put the envelope where have i been what have i done im fired for sure My mind is moving at the speed of light as i play out all of the terrible things that are gonna happen I check the car not their Fuck i felt so low they arent gonna believe i lost it im so fucked fuck fuck fuck Its then that i remember the squeeze i walked back to the spot i was previously parked in and much to my delight there sat the envelope looking a little rough but otherwise intact and fully funded Boy was i giddy walking back to work I dropped off the envelope but decided it would be best if i didnt mention almost losing the envelope Oh and im pretty sure i took a dump after that whats a rtifu post without a shit,TIFU by trying to squeeze in,29
PineappleDreams,2,8,1qwmzi,15,Not today but more or so last month  I woke up on a Sunday and had this urge to do something productive After a little cleaning I moved on to do laundry I put all of my clothes in the wash except the the pair of pajama pants that I was wearing It was still around noon when I got done and whats a better way to start off the day than breakfastSo going through the fridge I spot a pack of bacon  Being hungry and it being breakfast I couldnt really say no to bacon  Within moments I was frying bacon on the stove with nothing on but pajama pants  Very quickly I started to get second thoughts but I was already too far in and couldnt back down to my tasty foe It was just then when a big blob of bacon grease popped up and landed just on the right side of my right nipple Jesus fucking Christ it felt like ten thousand suns just went supernova all over my nip  I ended up not wanting to burn the fingertips of my precious gaming fingers and let the searing blob torment my nippleThe aftermath made the betrayal of my tasty friend seem like a breeze  My nipple would rub against every single shirt I would wear and bandaids didnt help at all  It was a long week The physical scars have left but the mental scars will follow me forever TLDR sold my first born child for magic nipple powers,TIFU by trying to be productive,23
argabagarn,3,17,1r4id2,15,So today me and my classmates were working on translating some of shakespeares sonettes in our swedishclass im swedish We always present on a projector so i needed to upload a picture of my sonette to my dropbox so that i could show the class the text as i readI plugged in my computer and opened the picture I couldnt figure out how to put on fullscreen so my friend said press the button in the middle which turned out to be the slideshowbuttonApparently i uploaded the picture in the same folder as my bongpics and suddenly my bong was covering the x meter screen My whole class knows that im a stoner so they all burst out like AAAAAAAAAHAHAHAHAhAh Great way to start a presentationI kept my stonerface and was like woops and changed back picture and started to present i was in chock and shaked like hell I was scared as fuck and so ashamed i didnt dare to watch my teachers reactionWhen i was finished i took my laptop and sat downAs soon as i sat down i asked my friend how our teacher reacted and suddenly i feel a hand on my shoulder Its my teacher with a smile on his face and he goes like You dont have to worry my son lives in Amsterdam and i usually visits him as gave me a wink all my mates were talking so they didnt hear him say this I couldnt believe what i heard and all i can say is i am so happy these kind of people existI just had to share my story this was the most shocking scary awkward and funny weedrelated thing ever happen to me,TIFU by flashing my bong on my school presentation xpost from rtrees,32
MadameQuiggles,14,12,1r4chx,13,Today when I went to put away the laundry for my mother I found out that she was upset at me because I didnt hear the buzzer go off I continued to fold the laundry so there wasnt much to get in trouble for but out of no where my mother starts yelling You never do anything unless I get mad or unless its on your damned computer Wow Okay that was totally out of the blue and I know that if I say anything back it will just be wrong so I just continue and finish folding the clothes and fall back to my bedroom after Im done GET YOUR ASS OUT HERE  what did I do now I continue to walk out in to the kitchen where my mother waits impatiently for me and then screams to sit down at the kitchen table YOU NEVER DO ANYTHING I ASK AND YOU DONT CARE ABOUT ME YOU ONLY SIT ON YOUR COMPUTER AND PLAY SHITTY GAMES AND WANT TO BE WITH YOUR FRIENDS AND YOU NEVER DO ANYTHING HELPFUL AROUND THE HOUSE ANYMORE WHY DONT YOU JUST GO LIVE WITH YOUR GRANDMOTHER AND GET THE FUCK OUT OF HERE IM FUCKING DONE All of this followed by my mother stomping out of the front door and slamming both the main door and the screen door Unable to really control my tears seeing as how I was just told how worthless I was and to get the fuck out of my home I continued to pick up the glass jar she smashed against the kitchen floor and put away the laundry I was busy with before this ordeal broke out I figured I might as well take this as the time to try to move out Im eighteen and in college My homelife has gone downhill very fast since my mother had been diagnosed with a specific type of bone cancer She feels horrible every day and I try my hardest to please her but I suppose this was the chance I needed to take to have at least a week to calm both of ourselves down until we can talk about a compromise of our feelings I addressed this idea to my brother and father and both of them told me to do as I felt was best but of course my father wanted me to stay at home and just ignore it until she was calm Nearly impossible When my mother got home again I asked in a very nice way if I could spend a few days over at my friends house this friend had been there through the entire thing and was planning on leaving that day anyways Mother was very unhappy No No Because I said no No No you will not Well I did anyways because Im eighteen and I suppose Ill have to learn from my experiences and this will be one of them whether I made a huge mistake or not My mother went on another tantrum and started hitting things off of the walls and blurted out IM LEAVING slammed the door and left in the truck I was told to leave everything behind but we all know we cant survive with nothing I took whatever I could and had my friend help me pack I had her mother on the way to help us get to the McDonalds to activate my old WalMart phone online when I realize that I cant do that until the batterys charged So here I am sitting at the shitty fast food restaurant at  PM with no phone or anything really I decided to go to my boyfriends which no one expected and was able to contact my grandmother I am now sitting at my grandmothers house which I guess is now my home  Today was truly my biggest fuck up of my eighteen years on this planet EDIT So I went to try to confront my mother about a possible agreement as to how we could settle our issues and just let things slide back down the pointy slope until we were okay again That went HORRIBLY I came back with my grandmother after receiving a text stating my mother was starting to gut out my room Which had roughly a grand worth of money of electronics if not more still inside that I couldnt get in my rushed exit  My mother was breaking down in tears on the porch when we arrived which tore me apart and my grandmother and I tried to talk with her but all we got was that she wasnt over it and she didnt want to talk I gathered what I could all of my expensive items and got out After I transported all of my items my grandmother decided it might be a good idea to open up my own bank account my original one was attached to my fathers account So we went to do that but had to postpone it due to my lack of ID that I forgot that morning in a scrambled mess to get my items On the way BACK to the bank the second time my grandmother received a text stating that my mother couldnt take it and she just wanted to hug and hold me again We decided the bank could wait When I got back to the house I came inside and I told my mother I was there for her and that everything was okay I comforted her as best as I could and eventually i got out of her that she didnt want me to move out and that she wouldnt scream anymore and that she was sorry for her actions She for some reason was convinced I wouldnt move back in and told me to take the white car so I could get to college and back every day on my own sweet but I dont think Id be able to take the car if it was at my grandmothers and I was at home In the end My mother needed to rest so my grandmother and I fixed supper for everyone and served her what she felt she could eat she helped me to reactivate my cell phone so I could have a means of communication again I brought my stuff back over and told my mother that I would stay but eventually she will have to come to terms that I am not her and I do not see everything she thinks needs to be done every day And that she couldnt have been so upset over dirt that she would be THAT upset something else must have been really pulling her down but I would be there for herSo here I am at  PM posting on Reddit laying in my own bed wishing this entire thing would have just never happenedTLDR FUCK YOU FOR NOT READING IT TOOK ME FOREVER TO TYPE THIS Real TLDR Yesterday I got kicked out and now Im back woop family issues im so depressed,TIFU by folding laundry,25
tayaravaknin,4,3,1r3ksf,12,Already having a bad day I try to take my dog to get groomed The appointment is for AMAs Im driving she decides Hey now must be a great time to bark So of course she does As Im turning around startled I dont notice the person in front of me stopping and rearend themDid I get hurt or do much damage No Is she probably going to sue for bodily injury on some claim because she has back problems that she mentioned Probably And you know what maybe she does have back problems Either way there goes more insurance moneyAnd did I mention that when I got to the groomers they had gone out to lunch I was late which means not only did I manage to end up getting into a car accident and completely fucking up by getting my insurance to likely go through the roof but I did so and still didnt manage to make it to the pet groomersTodaytoday Im going to lay in bed and do nothing All day Yeah this wasnt spectacularly bad but it feels good to write it somewhere,TIFU by having a moviestyle caraccident,15
me,2,5,1qynf2,11,I work at a local Italian place washing dishes and cooking You know the family run place that mostly hires younger kids looking for a first job We had just finished one of  total morning shifts each week where we have a buffet During these shifts once the last customer leaves we get to lock the doors and take a roughly  minute break and eat whats left of the buffet There are only  of us working these shifts because they are slow  in backusually guys and  servers ad a hostor hostess up front Because there are so few of us we all go on break together and hang out while we eat so we are all pretty good friends Anyway the front workers are done preparing the restaurant for the night shift and the two of us are finishing up the dishes As the last server leaves out the back door the  of us talk a little and someone brings up how the way the boss asked if she could pick up an extra shift next week could be misinterpreted to ask if she was a stripper Now we all have a chuckle at this and being the type of person to always try to make people laugh I thought I would follow up with a joke              I shouldnt haveWhat was meant to be a funny remark about giving up this job to become a stripper turned out to be even though Ive never pictured it awkward chuckle here I bet you would make an amazing stripper After making this remark and immediately regretting it she gives me the most you are weird as fuck look I awkwardly fast walk around the corner she leaves and the other guy proceeds to give me crap for it the rest of the day Not exactly sure how Im going to be able to talk to her now It might help after I turn  in  weeks and can get drunk first MaybeTLDR tried to make my friend laugh ended up essentially saying I picture her being a stripper,TIFU by telling my coworker she would make a good stripper,16
igstheiguana,5,7,1r87xz,11,sigh I left my bike locked outside our house because I couldnt be bothered to bring it in It had been out for a couple of weeks already but  last night the unthinkable happened Someone stole it  Now I know its not the best bike in the worldBut it was mine and had been for the last  or so years we shared many stupid moments together and also many injuries This was also my grown up bike xD I would really appreciate it if guys in England could keep an eye out for a silver Diamondback DBM from Southampton thanks P,TIFU by leaving my bike outside,18
Dropoutcylinder,2,3,1quc26,10,I got my coffee to go as the weather is getting colder and I had to walk for a bit so its always nice to have a hot cup of coffee I arrived to an intersection and was waiting for my time to cross the street when I decide to have a sip and the coffee lid open on one side so as I drank coffee kept leaking on me I didnt realise right away as being cold and all I had a thick sweatshirt  All of this happened on one of the main streets of my city so there were plenty of cars around enjoying my fuck up while waiting for the light to turn green,TIFU By spilling coffee all over me while waiting to cross the street,13
kayserasarah,5,5,1qqhs4,13,I should say A month ago I fucked up by forgetting I had bananas Now before you think Im just a pig I have a decent sized kitchen with hardly any cabinets so I have a big metal shelving unit in the corner that has boxed appliances and dishes stacked all over it Apparently when I was cleaning the table I moved the fresh bananas onto a shelf mostly out of view figuring Id put them back and then never did Worse than forgetting I had bananas I had placed them in a really cool looking aluminum casserole holder from the s which has no bottom to it Over the course of the last month the bananas dissolved into the aluminum ruining the finish on the dish and worst of all I have many fruit flies over in that corner which I hadnt noticed because they were all hanging out on the bananas but now that I disposed of said fruit theyre basically flying everywhere in my kitchen trying to find food time to go kill some flies,TIFU by forgetting I had bananas in my kitchen,18
drevo,5,2,1r8otb,10,Dont know what Im talking about See last post if not thenTLDR credit card transaction was rang up as cash card was not charged customer paid nothing for  worth of merchandiseIm sorry for not getting this out sooner if anyone did actually want to know the outcome of my fuck up but it turns out that Im only getting a write up since it was a mistake Loss prevention team came in checked the cameras to see if it was on purpose or not it wasnt and basically just said dont let it happen again Its great knowing Im not getting fired over my costly mistake ,TIFU Update I lost the store ,12
Addrian,12,5,1qv0i1,9,Cute girl told me it would be badass if I stood in the fire Id had a few beers and was feeling invincible an lo and behold I am but the dare was for  seconds and before I knew it shed left Im still fire proof But I never even got her name,TIFU by standing in a bonfire on a dare,14
NietzscheSolo,2,6,1qqwcj,11,So regularly after work I have some drinks  Its a normal occurrence for me to do and Ill admit I overdo it sometimes and wind up having a blackout  Today though was something that Im both completely embarrassed about and slightly fearful of  I was told that after I had fallen asleep I got up and walked out of my room completely buck naked in front of my house mates and sat down at my computer desk in what would be a dining room area  I picked up an empty paper bag and proceeded to piss in it  My house mates looked on in awe at just how boldly I pissed in said paper bag and my SO tried guiding me to the bathroom but I wouldnt hear it  Thankfully she cleaned it all up and my housemates are cool about it just getting a laugh out of it  I have sleep walked occasionally once maybe every  years but this is the first time Ive done anything like this  I feel so fucking stupid I didnt know where to place it so Im dropping it here,TIFU By Sleepwalking While Drunk,17
guyinthebushes,3,0,1r3scn,9,So a lot of people see my friend as intimidating and critical  This is because she is extremely smart and hard working  Now I always like to try to see what others think about me so that I can improve my attitude and be a better person and all that jazz  I thought I might try to help her out with that  That was were I fucked up  I mentioned to her today that I had noticed a lot of people find her to be critical  Now Tact has never been my strong suit but today was especially badI was trying to make it seem like a bytheby comment but she really took it to heart and questioned me like she was a Grand Inquisitor  She thought or maybe thinks that I was trying to start shit between her and a few other people  I can see that I was being a gossip but that wasnt my intention  So shes pissed off at me for being a bitch and I likely just lost a good friend  Well shit  I fucked that up,TIFU by trying to give a friend advice,9
phifeiras,14,4,1qy7up,7,I posted this  months ago and thought this guy was trolling me  I didnt even other reading up about bitcoin because I thought this guy was just trying to scam meThe Fuck UphttpwwwredditcomrAskRedditcommentsafwhowshouldiinvestccz,TIFU Thought someone was trolling me and ended up giving up the opportunity of a lifetime,11
grubas,5,2,1qti3l,9,Been getting treated for IBS and GERD since it went insane recently  My doctor put me on new meds I had one pint of cider and have spent the entire night shitting my brains out and nauseated to the point where I cant sleep  When I sit up I dry heave when I poop I dry heave  I am having epic farts that smell so bad they make me gag  Havent eaten since noon yesterday  He told me not to drink I figured one pint couldnt hurt  It hurts it very much hurts  ,TIFU by having a pint,11
NCK,1,10,1qvfwx,8,I was sitting here at my computer table watching The Tommy Wiseau QampA at the University of TennesseehttpyoutubeAoDGvbos video About half way through I decided to smoke another bowl Earlier today I saw a video of a guy drinking smoke out of a glass I decided it would be a good idea for me to try it I lifted the bong above my open mouth expecting smoke to pour into my mouth Nope Just bong water ,TIFU by drinking dirty bong water,18
ohcrapitsthatguy,4,1,1r6acx,8,So I took a Chemistry  university exam which you needed a calculator without my calculator I had a study session before going to the exam and once I got to the exam room I realized my calculator was no longer in my backpack I figured the professors werent going to look too kindly upon my situation cause you know college so I thought fuck it whats the worse that could happen and took the test After walking out of the large auditorium I feel an odd lump on the side of my backpack Wouldnt you know it my calculator decided to chill on the side of all my stuff instead of staying at the top like it normally does In my haste freaking out searching for it I only checked the top and bottom of my stuff not the sides ,TIFU by taking a chemistry exam without my calculator,9
phailcakez,5,0,1r68uz,7,the short of it is I am not officially registered for this class at all Due to an agreement between myself and the prof i would be able to attend class read the material and participate in discussion but not be actually registered for the class at all even as an auditor I didnt need the credits at all so this would allow me to save some money and still take a class I was interested in and as an added bonus I didnt have to write any papers This was all going fine until today when i went for advisement I am due to graduate this December but found out that I cannot due to a three hour credit shortage in my major field The kicker is that if I had been registered for the class everything would have been fine So I did actually need the classThe only reason I didnt think I needed the class was because my advisor and I went over my records this spring and he insisted that everything was good to go and I was on track to graduate with just my registered classesI dont even really believe that I fucked up here but I guess i did somehowNow I am stuck for another semester of class paying out the wazoo My husband is REALLY unhappy about it as he is the one paying and I feel like I did what I was supposed to do and it still went wrong My energy toward attending the noncredit class also just flew out the window because now Ill just be stewing over the fact that I should have been doing it for credit,TIFU by unofficially auditing a class to save money,7
DoctorReynolds,8,7,1r2bnn,6,My history teacher has a strict no pencil rule I completely forgot during the test and he took off  points,TIFU by writing in pencil on a test instead of pen and it changed my  to an ,13
JustAnotherLondoner,2,0,1r05d2,7,I Googled practical driving test and clicked a link thinking it was the direct website of the examinations The usual price is  it was only after I had filled everything in that I rechecked my bank account online and saw that  had been taken out of it I only had  in there and had some books to buy for school as well as a little left over for a birthday present for my dad I now have  left as I didnt read the website I went on properly and had been charged an extra  for service charge and a free resit if I fail Im pretty confident I wont fail so i have just wasted  which could have been put to much better use elsewhere Im an idiot ,TIFU by not ensuring the driving test booking website I was on was the right one,7
