author,comments,downvotes,id,score,selftext,title,upvotes
MouseShank,182,1002,1qzfcz,1852,This morning I was using a bathroom in the airport while waiting for my flight to board I did my business cleaned up and turned around to take a look at what I had created After a moment I pressed the manual flush button and instead of flushing the toilet water began to rise rapidly When the water level was about  inch below the rim it stopped After a moment of relief I turned around to leave As I turned around I triggered the automatic flush I heard another guy freak out as pieces of poop were riding a tidal wave of toilet water in his direction I ran away like a little pussy,TIFU by using the manual flush button on an automatic toilet,2854
Futurames,161,520,1r2jqb,1229,Just a short bit of context Where I work we have uniform shirts and I wear mine over another plain tshirt Every day when I leave I go to my locker take off my toolbelt and work shirt and go home pretty much in that order Well today for some reason I decided to take off my work shirt before reaching my locker Then out of habit once I reached my locker my brain demanded that clothing be removed So I proceed to take off my regular shirt and am standing there in my bra for a good three and a half seconds before I felt a breeze and realized what I had done This all happened in front of my entire group of male coworkers as well as a bunch of customers Keep in mind that this is a hardware store so the customer base is largely men I dont think they all processed exactly what they had just seen Hope you enjoyed the show boys tldr a bunch of guys at the hardware store got a good look at my nuts and bolts,TIFU by stripping on front of all of my coworkers,1749
fourfingerdeafpunch,178,681,1qwh67,1219,This happened last night my sister said my dad would tame a mountain lion and then I thinking I was on reddit blurted out ya I would mount a tame lion Needless to say I am now the butt of everyones joke I woke up this morning with a bottle of lotion and pictures of cats and dogs next to my bed,TIFU I told my family I would have sex with a lion,1900
banginchoonz,678,745,1qu6v1,1220,Context she and I have a weird friendship where we exchange filthy innuendos and whatnot all the timeWe were at a nightclub last night She walked up behind me and grabbed my crotch I dont mean a light squeeze she fullon went in thereI thinking we were just joking returned the favour and grabbed her breastShe freaked the fuck out She slapped me and now refuses to speak to me I immediately apologised again and again but she just blanked me Her friends said you pig you pervert etcAgain I tried to apologise to her but all she said was dont ever do that again and Ive not heard from her sinceEdit Thanks for the support guys and especially gals I know this story reads like something straight out of rcirclejerk but it is  trueAn update for those whove asked We still havent spoken and I doubt we will We live far apart  she lives in the UK I live in France I was just back for the weekend to catch up with friends  and so we dont really see each other often Losing her as a friend means two things a  drop in sexy banter on Facebook and one less person to see whenever I visit homeAgain thanks to you all especially the ladies Everyone who got Gold deserved it lt,TIFU By touching my friends boob after she grabbed my crotch,1965
gozenurhole,99,395,1qshu3,1189,So my boyfriend and I are getting ready to lay down and he tells me to make the bed Because I move around a lot in my sleep and mess up the bedding The lights are already off and I go to make the bed As I am moving the covers around I notice what looks like a small box a small RING box My heart stops and he says what IS that Im all I dont know and I pick it up full of emotions about to cry Its the charging port to his phone charger Apparently he thought I was going to propose to him too because he really didnt know what it was Im an idiotTLDR I mistook a phone charging port for an engagement ring box and got emotional for nothing,TIFU By thinking my boyfriend was proposing to me,1584
DontJustStare,350,357,1r5y5m,744,Usually I dont eat breakfast but that didnt matter because my crush was working at the cafe this morning rather than tonight so that meant I was going to buy breakfast Dont ask how I knew he had a morning shift this morning Im not a stalker Im just observant and resourcefulBefore I left I was sure to apply a little foundation and mascara probably the amount of makeup a normal girl would wear Usually I dont bother as I am not the spendforevergettingready kinda girl Although he has always been friendly and nice he has never done anything to give me the impression that he was interested yet I always make the effort to look nice whenever I know I will be going to the cafe I know kinda pathetic Business was slowprobably because it had just opened and normal people arent up so early so it was basically just us two and his other coworker I have liked this guy for the longest and we have hardly spoken other than about the food and other short chats nothing personal but this morning that finally changed He initiated a conversation and we wound up talking for a bit including plans for this weekend I was beginning to think he was going to actually ask me out But then business started to pick up He asked for my number so we could talk more later I played it cool on the outside but on the inside I was doing a dancehttpmediatumblrcomtumblrlubngsqewkmogif  So I reach for my bag to get a pen and paper to give him my number since he didnt have his phone on him Being a little too eager and naturally clumsy I knocked over my book bag causing some of the items to fall out FUCK ME Guess what pops out My fucking dildoWhat can I say I am a horny girl and its been  months hence my thirstiness for this guy I had spent the previous two nights away from home and I had to rush to pack this morning because I took so long to get ready and prettify myself In haste I stuffed whatever I could in the other bags and just so happened to place Sparky in the bag I carry around with the intention of removing it once I got home My eye balls nearly pop out of the sockets in disbelief and I hurried up and shoved it back in the bag as if that would make him unsee it I knew it was too late he undoubtedly saw my inch faux cock fuck fuck fuck fuck I expected him to say he had to hurry and get back to work and try to get out of the situation so I tried to make it less awkward by just telling him Sorry I dont have any paper Maybe next time I said in a nervous voice and got out of there I dont think the situation could have been any more awkward I just didnt know what to say My face was down avoiding eyecontact out of embarrassment most of that time so Im not entirely sure how he reacted but he was probably thinking WTF I knew this bitch was weird but damnI am always cockblocking myself by being a werido Well looks like its just me and sparky tonight  Forever alone TLDR My crush for the longest finally gave me the chance to get the D and I cockblocked myself by dropping my dildoEDIT A couple of points I want to clarify as it seems I was not clear I do not carry this dildo around on a daily basis I had brought it with me while I was away from home in a couple of nights I was rushing to make it to the cafe as well as check out by a certain time so I just threw my things in my bags Sidenote I clean my dildo before and after each use to prevent UTIs so even if I was carrying it around amp rettago at any time it would not put me at any riskAlso the cafe he works at is not Starbucks I took the photo of inside my book bag listed in a comment below later that day in Starbucks to prove I was not making this upLastly the dildo came fully out so its not like there is a chance he could not have seen it After it came out I pretty much avoided eye contact or looking at him at all so I dont know what he was thinking Now that I have read each comment it seems like nearly every person is saying the same thing which is that he doesnt think Im a weird freak There is a chance that I may have been overthinking this situation with my typical skewed negative perspective Perhaps in a few days I will revisit the cafe without bringing it up and give him my number I liked this idea more than apologizing as it avoids making it more awkward IMO I am just terrified of rejection so I dont know if I will or not If I do I will definitely updateReferencesThis submissionhttpredditqzppg explains some of my gone wild as some of you put it photos This commenthttpwwwredditcomrtifucommentsrymtifubydroppingmydildoinfrontofmycrushcdjxncj includes the photo uploaded to prove this isnt a fake post,TIFU by dropping my dildo in front of my crush,1101
MSciCSI,78,140,1qrzde,486,So today I was in Costco buying supplies for a family party I was to attend later in the day I passed by the tyre section of the shop and noticed a beautifully presented case of windscreen wipers They were good quality ones Bridgestone compared to the worn imported eBay ones currently on my car My current ones were ok they were a bit noisy but I had no reason to change I figured I could put something decent on her for once and splurged the   for a set of two I got her home and figured I would fit them right away This is the point when I remember that life isnt fair and no matter what youre doing youll be able to find a way to fuck it up So the first wiper went on no issue  I began on the second It was a bit more difficult to get off but I got there in the endI left to get the new wiper There was a light breeze of wind The wiper arm fell back down My windscreen smashed Yeah her  upgrade turned into an  new windscreen The wipers suck too TLDR  dont let gremlins near your car ,TIFU by being nice to my car,626
Bareback,38,112,1r4ehu,473,I was round at a party of a girl who I had had previous sexual relations before So i felt pretty confident I would get sex again at this party We drank all night and her little brother who has just started drinking as hes young came out and got high with us It was a great night and me and the girl end up going to bed earlierRound  was great round two was better Two used condoms I wish I had deposed of properlyI get up in the morning and go and make some coffee as were friends and had known each other for years So it was OK to help myselfNext thing I hear is a shout and a fallWhat had happened was when I went downstairs to get coffee I left the bedroom door open The dog went in into the bin and extracted one of the used condomsHe then took the condom into the hall and left it at the top of the stairsThe little brother hearing I was awake and probably wanting coffee too decides to come downstairs He steps on the condom it sticks to his foot and he proceeds to fall down the stairsTLDR Had sex at a girls house evil dog steels used condom to plot attack on her little brother,TIFU  By not closing the door,585
puddlesofblood,92,111,1r7ueq,409,Okay so Im in my Leadership Advisory class and I was just on my front page Of course this is a class where I can just do whatever on the computerMy teacher was walking around checking to see what we were working on She came up behind me and in an effort to quickly click away I accidentally clicked on an image of a girl in latex fully spreadShitShe saw and when I tried to exit out guess what I gotTHE SPINNING WHEEL OF DEATH YAAAAYYNow my teacher thinks Im a complete nymphomaniac woman,TIFU by accidentally opening rShinyPorn on reddit in school on a mac,520
Treetrunksgoespop,47,80,1qxh24,196,Well here it goes I work alone selling mattresses I spend hrs a day surrounded by comfy beds waiting for someone to come in its alot of down time Mostly I spend it watching Netflix and reading reddit and every now and again when things get slow I rub one out It was a slow slow day No one was even parked in the parking lot so I decided why not im coved up by the big desk that faces the wall of windows and Im wearing a dress so its not like anyone would see right Wrong I closed my eyes for a few seconds enjoying my dirty time and was on the edge of cumming ohh god I was right there when I open my eyes and see a group of high school boys looking through the windows on theyre bikes with looks of awe and disbelief noses pushed up on the glass No instant mood killer it was too late It was a mix of pleasure shame and guilt I instantly jumped up and hid in the back room face beet red with embarrassment vowing to never to touch myself againat work At least those boys got a nice show   ,TIFU by masturbating at work,276
poopypoopypoopypoopy,78,78,1qr0a6,179,There will be a TLDR at the bottom teeheeI love my ass Its a ton of fun to play with You put things in you take things out this makes your me time is so much better As a guy its the only way to get in touch with your inner self and I think its fascinating to say the leastBut today this was the reason I was mentally preparing a makeshift will Im only  and I pretty much have nothing to do all day unless Im working Obviously if you have the house to yourself you start to get creative with what you jerk towithhow Living at home still trying to get to school or something I work odd hours Today I was going to be working  to I felt particularly kinky today and decided that I wanted to test my colons absorption abilityIve gotten drunk once before and had a beer or two maybe six other times I clearly dont know how my body handles alcohol very well let alone unfiltered anus liquorBut this doesnt cross my mind I just want to get a bit of a buzz this morningWarning unfiltered ass play aheada I have my shot of vodka in one of those tiny rum bottles and a strawI know my plan create fart insert bottle and swap fart for shotBut things arent perfect The straw is tearing my asshole a new asshole Its not that bad though so I just tough the initial pain out and bend over on my knees and let gravity pull some air inThen I replace my straw for the bottle while standing and get back on my knees Watching my reflection in our full length mirror I shove my ass almost perpendicular to the floor and both legs spread to see the view I relax my abs and suddenly the bottle is now emptyWow I feel nothing I expected a little bit of a tingle or burn but theres nothing That is until I take the bottle out My anus seems to be the only thing that realises what a bad idea this is and screams a signal of pain on contact with the alcohol Not cool But whatever Im just gonna let the rest of it get absorbed so it wont touch my anus any more Foolishly I want to jerk something fierce A small shampoo thing gets to spend quality time with me In it goes and off I getUnfortunately it slips out and a splash of anus burning liquid follows before I clamp shut It burns Thats not good Oh This probably wasnt a great idea Im outhttpcdnchudcomfxpxLLfJerrySeinfeldLeavinggifIm getting to the toilet and feel the pressure of the leftover makeshift fart coming on Apparently I took in more air than I thoughtDo you remember the burning of diarrhoea Only having a shot worth of this is fantastic because every drip leaving feels like letting satan poke my pink Followed immediately after is a  second fart that feels like heaven But all is not well in colon town Head office has noticed a disturbance An off balance Some huge negative feedback loop starts the process of removing this foreign substance from my digestive tract and starts doing some natural laxative shit to meNow Im feeling waves of discomfort as my bowels rustle and shimmy shit at breakneck speeds to the throne Im now a hot mess of shit vodka and worryBut the first wave is over and Im feeling a little off but okay So I lay down and rest a bit and think about what Ive doneMy mind jumps to the idea of liver failure and within seconds Im googling the symptoms But Im pretty much okay I rest until Im ready to go to work and for at least another  minutes Im okayBut the shits start again when I get to work More gurgles and stuff make me run for the toilet every little while I also started feeling a bit bloated making me think that my liver was backing up and being problematicTo make a long story shorter a super fart after many mucusy damaged anus poops made me feel on top of the world For the four hours there though I was certain I shocked my liver to failure or somethingNever doing that againTLDRI like my butt so I put vodka in my butt My butt didnt like that and shot it and everything in my poop tubes straight out I started convincing myself that I triggered super fast acute liver failure and was just waiting for jaundice to be my tell tale doctors trip note Let a fart out hours later and Im not dead,TIFU by taking a shot of vodka with my anus,257
Maleus,17,32,1r1h9k,142,This actually happened a while back but I just found this sub and since all of my friends love this story I might as well share it with everyone hereSo a while back my friend and I worked together on nd shift We normally got off work around pm and it was customary for us to stay up late after work since we didnt need to be in until late afternoon So this day my friend asks me to help him get a weight bench he is getting off of craigslist after work I didnt have anything else going on so I gladly offered a helping hand The house we were going to was around  minutes away so while getting gas before heading that way I went in the gas station and picked up a king size Reeses cup and a large Red Bull to give me some energy after work This was to be my undoing because little did I know at that time I am severely lactose intolerant I never put  and  together and didnt have insurance at the time so I just thought I had stomach issues So on the way there we are just idly talking I finish my  peanut butter cups and dont think a thing about them About  minutes later I feel a slight rumble in my stomach since stomach problems are normal for me at this time I pass it off because I know Ill be home within a couple of hours About  minutes later the rumbling is more intense and realize that my friends bathroom will probably receive the brunt of my soon to be coming anal assault A little while later we are in the persons neighborhood and Im starting to think that a gas station on the way home is inevitable Finally we get to dudes house He is a nice guy weight bench is in his garage but unfortunately it is fully assembled it is one of those huge all in one machines Well I havent told my friend about my stomach and he and the seller are finalizing the deal then begin talking about how we are going to secure it in the back of my truck At this point I am almost in a cold sweat my ass cheeks are so clenched so tight you couldnt fit a needle between them We have now finished loading the weight bench I am giving myself pep talks and saying a prayer for every step I am taking I do not want to ask a complete stranger whom we just met off of craigslist to use his bathroom obviously but things are getting bad Thats when it happens We are exchanging pleasantries saying thank yous and about to get in the truck I am scouring my brain trying to think of the nearest gas station that I saw on the way there and decide to let a tinitiny little bitty poot out just to relieve some of the pressure as my insides feel as though I am about to explode Well ladies and gents when you are in that condition never ever trust a fartIt broke the ass seal that my cheeks had welded together and out comes a torrential downpour of shit I could feel it coming I did my best to squeeze my ass together as tight as I could which ended up resulting in ass cramps along with the spasms of my intestines wanting so desperately to empty going against every ounce of my soul trying to stop it The result was excruciating pain which resulted me kneeling down screaming in agony Keep in mind I had not let on to either of these guys that my stomach was even remotely upset and Im sure the sweating was mascaraed by the fact that this was taking place during the summer So to them it looked as if I just became possessed and began screaming So now I am kneeling on the ground my underwear filled up like a babies diaper my friend is freaking out  and the guy from craigslist is no doubt regretting every second of this transaction by nowI slowly stood up gathered what I could of myself and kindly asked the seller if I could use his bathroom His response was simply Umm sure dude in and to the right last door on the left I slowly walked in the house praying that no small shit nuggets fell out onto their carpet on my way there After I got in the bathroom I took a look at the damage it was irreparable Now I had to make a decision walk outside holding underwear leave a pair of shit pants in his garbage or option  I emptied as much as I could into the toilet took out my pocket knife and cut the massive shit stain out of my underwear This was obviously was a much smaller piece of cloth which allowed me to wrap it up in a massive amount of toilet paper and stick it in my pocket I then cleaned my ass as much as possible I didnt want to shower in his house also I was already mortified Put my holy boxers back on walked outside went straight to my truck thanking him as I walked by got in and immediately drove off Down the street I threw the shit wad out of the window and began explaining the story to my now laughing so hard he cant breathe friend I asked my friend if the guy had said anything when I went in his house His reply to my friend Its just a hunch but I think your friend needs to shitedit spelling,TIFU by helping a friend get a weight bench and shitting myself NSFW languagelong read but probably worth it,174
ratmftw,52,28,1r115g,130,This actually occurred a little under two years ago but anywayEvery year during the long summer holidays my family have a tradition of heading up to go camping on the East coast of the North Island NZ The spot where we go is seriously a fairy tale place a huge bay with golden sweeping sands constant sunshine warm water big waves few people reefs to explore you get the idea This year I happened to know that there was a girl there Id met the previous year who was quite into me As you can imagine Im well keen The morning after we arrive virtually as soon as I get up she bounds over and says shes taking me for my first swim right now Im all about it so we head out into the blue to get wet me hoping other things may get wet later on I dive into the water and thats where things begin to take a turn for the unexpectedAs soon as I come up I realise the left side of my face is numb and I cant speak Yep you guessed it Brain hemorrhage Ended up spending two weeks in hospital three months off school and two years later I still cant attend school  days a week because I get too tired I havent had any luck with the ladies since then either may or may not be related TLDR went for a swim with a girl got brain damaged ,TIFU by going for a swim with a girl I like,158
theobi,26,24,1qv8by,123,I have been dating my girlfriend for over two years We have a very close group of friends and she has always been jealous of one other girl well call her Katie There have been several episodes usually while drunk where she breaks down because she thinks I like Katie Last night we were hammered drunk at a party and it happened again After a long time convincing her that I dont have feelings for Katie which is not completely true but I would never do anything about it we made up and went upstairs In the middle of sex my dumbass yells out Oh Katie I was not even thinking about Katie during sex it just slipped out I dont completely remember what happened after that but we woke up this morning and acted like nothing happened Im not sure if she remembers or not since we were both pretty drunk but I hate myself for doing that ,TIFU by calling my girlfriend the wrong name in bed,147
