author,comment,distinguished,downs,id,post,subreddit,type,ups
Flavored_Crayons,"In large part Nazi's experienced a warm welcome from Austrians when they invaded and occupied their country. The Anschluss occurred at a perfect time. Austrians were in an economic depression and had a relativity ineffective and paralyzed government. Due to this they welcomed Nazi occupation with open arms and the warm welcome surprised many Nazi's as they had anxieties of how they would be received. Bruno Hahnek a longtime Nazi supporter described the situation,"" During my 10 years at party conferences or at rallies with Adolf Hitler, I had certainly witnessed my share of enthusiasm, but the degree of enthusiasm that was prevalent in Austria at that time was not only surprising to us, but also quite unbelievable."" 

Source: Rees, Laurence,*Hitlers Charisma*,(New York: Pantheon Books, 2012), 126-127.",null,0,cdpvxfh,1rpuzw,askhistorians,top_day,1
idjet,"I think you are perhaps getting hung up on labels and definitions, and we should clarify these so that you can understand.

'*Capitalism*' is very strictly defined as an economic system in terms of how economic value is created and stored, profit is a byproduct of that. Capitalism is generally viewed as having its origins in the late medieval period when we begin to see the creation of broad markets for labour and goods through the transformation of serfdom and bartering economy to monetary economy.

It's true that there has always been something for sale, whether armour, houses and castles. However, if we look closely at what was for sale in the European medieval period, we would see the list of things bought and sold is short and very infrequently transacted. The greater portion of the economy was what we would roughly call *bartering* - this was at the rural and village level. In fact even 'taxes' were paid 'in kind', often as part of the harvest. Remember that medieval society was predominantly agricultural. Yes, someone with money could by anything - but money was relatively rare. For example there were whole regions of Southern France in year 1000 where there were no mints creating coin - ie, money. (note: bartering is used loosely here to allow a short response - some will complain).

As such, from a modern financial perspective, the financial transactions were 'stunted', they have no accumulating value. To explain: as a farmer, or as the noble who en-serfed the farmer, I could not store my wheat for several years waiting for an increase in the value of the commodity and trade it for charcoal or building limestone a year later - I had to trade it within its life or it goes mouldy. I could not speculate in value and make a profit on the difference between my production costs and my sale value when wheat supplies were low. Or, as an blacksmith I would be working directly in the castle of the lord for whom I work, but I am not paid in cash. I am fed, clothed, I have a small home or just a room in the compound. As a blacksmith I might also do some metal work for the local farmers, because they are tending the lands owned by the noble I work for. But I am not paid and neither are they. There were large towns where money might be used, but the overwhelmingly rural medieval population did not engage economically with cities in substantive cash.

So how did this economy change to capitalism?

The general idea held in economics is that the transition from feudal economics to capitalism was through the transformation of [manorial serfdom to free holding tenant](http://en.wikipedia.org/wiki/History_of_capitalism#Prehistory_of_capitalism). This is a point of argument for some, and you may see responses to this post which argue differently. But, the point is still important: this was the moment where the medieval serf-farmer no longer paid *in kind* with his crops, but he rented his land from landlord for cash and he could sell his crops at market for cash. The landlord could evict him from the land for a higher paying tenant, and the farmer could sell his crops for more to those who were willing to pay. The farmer could invest in his farm so that it was more productive. The landlord could take the cash and invest it where he likes, perhaps in speculating in other lands, or in other assets. It's labour and assets that begin to have value, not the crops themselves.

And this is where we begin to see the fundamentals of capitalism: in large scale lending, in speculation, in transforming serfdom and bartering into labour-for-wage relationships. These things did not exist at large scale until after the medieval period. 

None of this happened fast - there were many places in Europe that remained unaffected by early capitalism for several hundred years. And there were transformations in forms of capitalism such as [mercantilism](http://en.wikipedia.org/wiki/Merchant_capitalism) before we get to modern capitalism as we know it.

The essence is that economic relationships transformed into an exchange of capital, and capital is abstractly related to 'actual value'. And this completely overtook all other economic relationships from 1400 - 1800.

Source: Das Kapital, Karl Marx (1867)

",null,0,cdpumwf,1rpw94,askhistorians,top_day,9
Canadian_Ambassador,"I just wrote an undergrad paper about the history of interest/usury and can maybe help shed some light on this. 

In Ancient Greece, Aristotle was against any form of interest. Interest is the cost of borrowing money. His reasoning was that because money had no value in itself and was a medium of exchange between two commodities, it should not be hoarded. Money by itself was not considered wealth. It was the physical goods bought that dictated how wealthy a person was. This viewpoint has been debated though as being idealistic, and not how life actually operated in ancient Greece. 

Aquinas follows in similar tradition with Aristotle, except adds the Christian charity idea to the mix. Due to the nature of money, hoarding it is bad and unnatural. You cannot have a capitalist society without leftover money to fund and invest. This was backed up by the Catholic Church. Again, this viewpoint was challenged by specific people, but the Catholic Church stood by it's stance. 

Big changes didn't start to occur until the Reformation. Both Luther, after some prodding, and Calvin, after no prodding, both accepted that interest was an acceptable risk that the lender takes over the borrower. 

Prior to the Reformation, interest was an unnatural way to create wealth by the scholastics and the Catholic Church. Now, that is for loan payments. Venture Capitalism was not frowned upon and was one of the ways that people who were looking for investment circumvented the sin of usury. 

The Romans did have some forms, but usury has always been condemned under the Old testament. I did actually ask a question related to this, but it has also yet to be answered. 

I am not a historian by any means, but I am taking a class on the History of Classical Economics. Basically, the economics of the world until Marx. The reason I don't address Rome and Roman influences is because from what I found the majority of their contributions were in law, not economics, and therefore, out of the scope of my paper. 

To answer the question though, if I was being bold and banking (ha) on the history of venture capital, probably the 13th century is when you could find the beginnings of modern capitalism. That is mostly me talking out of my ass. 

From what I read in regarding interest, I would put the timeframe at, or during, the Reformation. The backlash that the ban on usury caused the Church to lighten it's stance in the 18th century, but the Protestants had been okay with it, officially, for 200 years prior. 

The important thing to remember is that capitalism requires surplus money to invest. If you put restrictions in place stopping the borrowing process, it makes it significantly tougher to engage in capitalist procedure. 

Hope that makes sense. I am a couple beers in because I am finally done essays and slightly celebrating. Sources will be provided upon request. ",null,2,cdpqycx,1rpw94,askhistorians,top_day,4
null,null,null,4,cdps1fj,1rpw94,askhistorians,top_day,1
Reedstilt,"At the time of Old World Contact, there were three major polities in Florida and several smaller ones. 

**Calusa**

The southern half of Florida was under the control of the powerful and expansive Calusa. The core Calusa region was center on Charlotte Harbor in southwest Florida, with their eponymous capital Calos currently identified as the [Mound Key site](http://en.wikipedia.org/wiki/Mound_Key_Archeological_State_Park), but their influence spread eastward to encompass the Mayaimi who lived around Lake Okeechobee, the Tequesta of the Keys and modern-day Miami, and the Jaega near modern-day Palm Beach. The Ais, who lived on the east coast from Cape Canaveral southward to the Jaega (who may have been part of the Ais as well) were either subjects or allies of the Calusa - the relationship is a bit unclear. Additionally, Taino refugees from Cuba (and likely from elsewhere in the Caribbean since earlier refugees had fled to Cuba first) had established communities in southern Florida under the protection of the Calusa dominion, before the Spanish arrived on the mainland. Until the Spanish negotiated a peace in 1567, the Calusa were at war with Tocobaga who lived around Tampa Bay.

The Calusa were led by three men. First was the paramount chief, called the 'cacique' by the Spanish after the Taino title for a similar political position. The Calusa word for this rank is probably *certepe*, but that's uncertain as it could refer to village chiefs as well. The paramount chief received tribute from Calusa village chiefs and from the leaders of his non-Calusa subjects. He also had several wives, one each from his non-Calusa subjects for example as well as having a ""sister-wife"" according to Spanish chroniclers, which probably meant he had one wife from his own clan, rather than literally marrying his own sister.

The other two men were the war captain who command the Calusa's military specialists and militia on behalf of the paramount chief and the chief priest who oversaw the temples, organized important rituals, and attended to the religious needs of the paramount chief's family (which he was usually part of). 

The Calusa built canals, earthworks to keep their homes above the water during floods, and large communal houses and temples. The ""king's house"" in Calos was said to be large enough that 2,000 people could comfortably gather there for councils. 

What makes the size and structure of Calusa society especially interesting is that they made no use of domesticated plants or animals, though there ancestors a few centuries earlier probably engaged in some farming. The bulk of their diet was composed of seafood, though some wild plants were gathered and they made a type of bread from [coontie](http://en.wikipedia.org/wiki/Coontie), a cycad native to the Southeast. Deer were relatively rare in the region and Calusa traded their seafood with people to the north for venison and deer hides. In 1600, the Spanish reported that the Calusa (or their Tequesta subjects)  travelling to Havana to sell fish, ambergris, fruits, turtle shells, [cardinals](http://en.wikipedia.org/wiki/Cardinal_(bird\)), and other items. Such trade likely existed in Pre-Columbian times between south Florida and Caribbean as well.

**Timucua**

Most of northern Florida (minus the panhandle) and a large portion of southern Georgia was the realm of the Timucua. Unlike the Calusa, the Timucua were not unified into a single cohesive nation. Instead they had several powerful village and alliances of villages, which at the time of Contact were vying among themselves for dominance. 

Each village had its own chief, called *holata* or *utina* in various Timucua areas. For simplicity, I'll use *holata* here. The title of *holata* was inherited matrilineally within the White Deer Clan. Clans were ranked, and while the White Deer was at the top among the Timucua, the relative ranking of the other clans (Panther, Bear, Fish, Earth, Buzzard and Quail) differed between the Timucuan districts. 

The *holata* had several prominent subordinates. The *inija* was the most important of these, who severed as the *holata*'s spokespeson and communicated the *holata*'s orders to others and gather information for the *holata*. The *inija* was also chosen from the White Deer Clan. The *holata* was also served by two ranked *anacotimas* and the *afetema*, who seem to have been advisers chosen from the elders of the village. Women became *holata* regularly, and when they did so, their subordinates were also women. The *holata* oversaw both the secular and religious affairs of the Timucua; war, however, fell to the *irriparacusi*, the war chief (also known as the *uriutina* and possibly just *paracusi*). The *irriparacusi* had his own entourage of officials: *ibitano*, *toponole*, *bichara*, *amalachini*, and *itorimitono*, though their duties are unfortunately unknown. The *irriparacusi* likely inherited their rank as the *holata* did, but that's not certain.

Like the Calusa, the Timucua fished and harvested wild plants. But they also hunted and cultivated maize and other domesticated plants--though not to the extent of their Mississippian neighbors to the north and west. Famously, the Timucua wore [deer disguises](http://media-3.web.britannica.com/eb-media/13/70213-004-110FA638.jpg) when hunting. Unlike the Calusa, however, they were quick to adopt Spanish agricultural tools and plants.

The surplus of their hunts were trade south to the Calusa, but the most important trade routes went north and west to the Mississippians. These trade routes brought down copper, greenstone, and argillite from the mountains. The Timucua also controlled an important chert outcropping in northern Florida which was vital for the production of tools and weapons. Chief Utina and his alliance largely controlled this outcropping and the most important trade routes, which made him an enemy of other major Timucuan alliances. In the 1600s, the Timucua would become important middle-men, controlling the trade between St. Augustine and the nations of the interior.

**Apalachee**

The Apalachee were a small but powerful Mississippian chiefdom located between the Ochlockonee and Aucilla Rivers. The Timucuan-speaking Asile who lived east of the Aucilla River were subjects of the Apalachee. The Apalachee had two major towns. Ivitachuco was the dominant town in the east, while Anhayca (modern-day Tallahassee) dominated the west and served as the capital of the whole chiefdom. Historically the two towns were ruled by brothers. Later in the 1600s, political power would shift to Ivitachuco, at which time the Apalachee were at war with the Timucua (again the Spanish negotiate a peace treaty between the two).

*Nico* seems to be their word for paramount chief.  Interestingly *holata* refers to subsidiary chiefs.  The Apalachee *holatas* oversaw major towns which controlled districts and satellite towns within the larger chiefdom. The *nico* and the *holatas* were the spokespeople for their respective dominions and oversaw ceremonies within them. The Apalachee *nico* was also served by an *inija*, though his role here was to oversee the *nico's* guards, farmland, and to serve as a sort of court historian, as well as handling trivial day-to-day business of the chiefdom. The *holatas* seem to have had *inija* of their own, and the *inija* were apparently relatives of the *holatas*. Finally, the *nico* had an *atequi*, a translator whose duties extended over other areas where such language skills were important.

The land of Apalachee was an important stop on the trade routes heading west out of the Timucua regions to the Mississippians, and was famous throughout Florida for its agricultural productivity. That fame was used as bait by other Florida peoples to lure the de Soto's expedition out of their area and encourage them to keep moving onto Anhayca, where de Soto's expedition spent its first winter, living maize, beans, squash, and other plants cultivated or harvested in the region, as well its ample stores of dried venison. They grew three types of maize for different purposes: a small fast-growing maize used to quickly replenish their granaries in spring, a yellow maize used for hominy, and a white maize used for flour. They also made flour from a root known as *ache* which the Spanish said was indistinguishable from flour made from wheat in both versatility and taste. Both *ache* root and the flour made from it were important exports from the area.

**Sources**

* [Handbook of North American Indians, V. 14, Southeast](http://books.google.com/books?id=3JH-TPFjLk4C)
* [The Timucua](http://books.google.com/books?id=gLN7Y7XFFU8C)
* Hann, John H. *Apalachee: The Land Between the Rivers*. University of Florida Press. 1988.",null,0,cdpu1om,1rpx63,askhistorians,top_day,7
VioletPop,"Florida had several pre-Columbian tribes- the Calusa and Timucua jump to mind. There are a ton of primary sources that cover them, but for a good overview, Michael Gannon's New History of Florida is tops. I don't recall a lot of specifics of their economies. They did have slaves and a fair amount of inter-tribal raiding. ",null,0,cdps0g9,1rpx63,askhistorians,top_day,2
sambeau,"The origins of Professional Sumo wrestling started in the early 1600s around the time that the Shogun (Ieyasu) brought peace amongst the warring families of Japan by using a hostage system: the wives and children of the provincial War Lords were required to live in the capital. Soon the lords themselves build giant mansions there too. 

The peace brought a need for entertainment and a surplus of Samurai. The previous ruler (Hideyoshi) had (in 1590) frozen social class so it was forbidden for a warrior to return to peasanthood and as such the place was overrun with bored warriors. Thus the samurai started wrestling for entertainment.

Originally the wrestling was fairly Ad Hoc: street-corner shows of Martial Arts skills (tsuji-zumo) without a proper ring and the woodcuts from these times show fairly lean Wrestlers. Once the ring was added and the force-out rule established the woodcuts show a noticeable bulking-up of wrestlers. 

By the late 1600s the wrestlers in the woodcuts look pretty much like a classical Sumo wrestler does. 1684 is when official permits were established for Sumo.",null,5,cdpw3hy,1rpxi4,askhistorians,top_day,70
TokyoBayRay,"Sumo is not especially unique- there are traditional wrestling forms in china, Korea and notably Mongolia that have similar rules. In Mongolia, wrestling along with horse riding and archery is deemed one of the most important skills a man traditionally should learn.

What makes sumo different is the element of Shinto ritual. For the uninitiated, Shinto is the indigenous religion of japan- a kind of synthesis of spiritualism and polytheism that is very unique. Prior to a match, the wrestlers purify the ring with salt and an elaborate ritual is performed where the wrestlers don special aprons and pray in a circle around the referee. 

The origins of sumo are unclear; it has been around for almost as long as japan itself- much like Mongolian wrestling it probably originated as an amateur folk sport performed on holidays. Over time it became more organised- in the 16th century, a tournament held by the daimyo Oda Nobunaga is credited with introducing the formal ring. By the Edo era (17th century) sumo was a professional sport and it is here that modern elements emerge like the banzuke (the official ranking lists of the wrestlers) and the training regimens followed by wrestlers. The sport's popularity really exploded in the Meiji era, but in recent years match fixing scandals and the rising prominence of foreign born wrestlers have cause it's fan base to wane.

Sumo is really fascinating. If you're ever in Tokyo I highly recommend a trip to Ryogoku and the sumo museum there. You can pick up the guidebook that formed 90% of this post, and if you're lucky you might even see some of the wrestlers milling about in the evening.",null,2,cdpwc7e,1rpxi4,askhistorians,top_day,22
Kilbourne,"I don't know how it started, but I do know that because the goal of the bout is to remain within the ring, and to remove your opponent, if one is very heavy it makes it more difficult to be moved from the ring. Sumo (wrestlers) are fat, yes; but they are also very strong, so that they can move the other very large sumo from the ring. Much of the sport is open-hand strikes to knock the opponent off-balance, and then throw them either from the ring or to the floor by way of grabs to the joints or to the loincloth.",null,13,cdpuikm,1rpxi4,askhistorians,top_day,24
churakaagii,"In outlying islands in Okinawa, sumo wrestling is not a professional affair.  It is more a folk-wrestling kind of thing; everyone is amateur and nobody is fat unless they just happen to be fat.  These days, it's a kind of nostalgic custom.  久米島 (Kumejima) is pretty famous for it.

Back in the day, it was a kind of spiritual observance: You wrestled for the sake of the local god.  These days, nobody really believes that sort of stuff anymore.",null,0,cdpx8s1,1rpxi4,askhistorians,top_day,10
sambeau,"The origins of Professional Sumo wrestling started in the early 1600s around the time that the Shogun (Ieyasu) brought peace amongst the warring families of Japan by using a hostage system: the wives and children of the provincial War Lords were required to live in the capital. Soon the lords themselves build giant mansions there too. 

The peace brought a need for entertainment and a surplus of Samurai. The previous ruler (Hideyoshi) had (in 1590) frozen social class so it was forbidden for a warrior to return to peasanthood and as such the place was overrun with bored warriors. Thus the samurai started wrestling for entertainment.

Originally the wrestling was fairly Ad Hoc: street-corner shows of Martial Arts skills (tsuji-zumo) without a proper ring and the woodcuts from these times show fairly lean Wrestlers. Once the ring was added and the force-out rule established the woodcuts show a noticeable bulking-up of wrestlers. 

By the late 1600s the wrestlers in the woodcuts look pretty much like a classical Sumo wrestler does. 1684 is when official permits were established for Sumo.",null,5,cdpw3hy,1rpxi4,askhistorians,top_day,70
TokyoBayRay,"Sumo is not especially unique- there are traditional wrestling forms in china, Korea and notably Mongolia that have similar rules. In Mongolia, wrestling along with horse riding and archery is deemed one of the most important skills a man traditionally should learn.

What makes sumo different is the element of Shinto ritual. For the uninitiated, Shinto is the indigenous religion of japan- a kind of synthesis of spiritualism and polytheism that is very unique. Prior to a match, the wrestlers purify the ring with salt and an elaborate ritual is performed where the wrestlers don special aprons and pray in a circle around the referee. 

The origins of sumo are unclear; it has been around for almost as long as japan itself- much like Mongolian wrestling it probably originated as an amateur folk sport performed on holidays. Over time it became more organised- in the 16th century, a tournament held by the daimyo Oda Nobunaga is credited with introducing the formal ring. By the Edo era (17th century) sumo was a professional sport and it is here that modern elements emerge like the banzuke (the official ranking lists of the wrestlers) and the training regimens followed by wrestlers. The sport's popularity really exploded in the Meiji era, but in recent years match fixing scandals and the rising prominence of foreign born wrestlers have cause it's fan base to wane.

Sumo is really fascinating. If you're ever in Tokyo I highly recommend a trip to Ryogoku and the sumo museum there. You can pick up the guidebook that formed 90% of this post, and if you're lucky you might even see some of the wrestlers milling about in the evening.",null,2,cdpwc7e,1rpxi4,askhistorians,top_day,22
Kilbourne,"I don't know how it started, but I do know that because the goal of the bout is to remain within the ring, and to remove your opponent, if one is very heavy it makes it more difficult to be moved from the ring. Sumo (wrestlers) are fat, yes; but they are also very strong, so that they can move the other very large sumo from the ring. Much of the sport is open-hand strikes to knock the opponent off-balance, and then throw them either from the ring or to the floor by way of grabs to the joints or to the loincloth.",null,13,cdpuikm,1rpxi4,askhistorians,top_day,24
churakaagii,"In outlying islands in Okinawa, sumo wrestling is not a professional affair.  It is more a folk-wrestling kind of thing; everyone is amateur and nobody is fat unless they just happen to be fat.  These days, it's a kind of nostalgic custom.  久米島 (Kumejima) is pretty famous for it.

Back in the day, it was a kind of spiritual observance: You wrestled for the sake of the local god.  These days, nobody really believes that sort of stuff anymore.",null,0,cdpx8s1,1rpxi4,askhistorians,top_day,10
null,null,null,3,cdppytt,1rpxwc,askhistorians,top_day,9
