author,comment,downs,id,post,subreddit,type,ups,score
mormengil,The Pilgrims and the Indians are thought to have eaten Turkey at the first Thanksgiving so it became a traditionThe Pilgrims had a good harvest and felt safe going into their second winter because the Indians had taught them how to grow New World crops like corn and hunt New World game like turkeys  The Pilgrims were urban types not very knowledgeable about farming or wilderness survival skillsTraditionally the main Thanksgiving foods Turkey Cranberries Potatoes Sweet Potatoes Corn Pumpkin Pie are all New World foods unknown in Europe before the Columbian exchange  ,0,cdpjipg,1rpb7h,askhistorians,top_day,2,2
DatKaiser,The BBC made a really great fourpart documentary called Inside the Medieval Mind which analyzes and explains the medieval mindset from  to ,0,cdpj3z3,1rpbpz,askhistorians,top_day,1,1
Bakkie,I dont know what the front man on the right is holding but the men holding their swords by the blade are offering fealty to the king on the left They may be  giving an oath using the swords as a symbol of the Cross,0,cdpshb6,1rpcdf,askhistorians,top_day,2,2
rocketsocks,Theres a quite famous experiment about this in fact Louis Pasteur httpenwikipediaorgwikiLouisPasteur created special swan neck flasks which prevented dust and so forth from easily entering the flask he would then fill the flasks with broth boil them and observe their development over time Unlike ordinary containers of boiled broth the contents of the swan neck flasks did not develop moldPasteur theorized that the spoilage of food was due to the growth of microorganisms and that therefore it was possible as shown to kill off microorganisms in a sample and then seal it from contamination from outside sources of such organisms This became the basis of pasteurization The adoption of pasteurization and of the idea of the germ theory of disease as well supplanted entirely previous ideas of spontaneous generation,0,cdpsqh9,1rpctg,askhistorians,top_day,3,3
pqvarus,First of all The Berlin Wall was constructed in  and at this point there wasnt any war in Germany unless you are refering to the cold war as the warAnyway The wall was erected extremely quickly during a period of a few days and East Berlin was closed off completely in one night th to th of August  As a result of this mot of the population was caught offguard especially as the officials stated before that Nobody is planning to build a wall Niemand hat die Absicht eine Mauer zu errichten However there were some areas of the city where the border was basically located in the middle of a street as in the case Bernauer Straße The houses on the one side of the street belonged to the West the ones on the other side to the east These houses were eventually seized and cleared by the east German authorities however quite a lot of dramatic escapes took place here Theres a big memorial at the site nowadays wich is reminiscent of the wall in general and the escapes of Bernauer Straße in particular They also habe a websitehttpwwwberlinermauergedenkstaettedeenthehistoricalsitehtml with additional info and pictures,2,cdpiv3y,1rpcx8,askhistorians,top_day,30,28
shuboyboy,This is a good book on the topic httpwwwamazoncoukgpawdrefpdawsbspiSLSYA thing to note is that The Wall evolved over the  years it existed from some simple rows of barbed wire to a big wall to two massive walls with a Death Strip filled with guard towers booby traps etc This meant that the rate and means of escape changed greatly over the years with fewer and fewer happening towards the end of its existence There are some really interesting stories about individual escapes as well as some great footage on YouTube,0,cdpq7zs,1rpcx8,askhistorians,top_day,1,1
koenigvoncool,While Im certainly not qualified to answer anything in this subreddit I would suggest looking into the story of the colony of SagallohttpsenwikipediaorgwikiSagallo As far as Im aware this was Russias only move in the scramble for Africa Perhaps somebody more well versed could follow up on this,4,cdpjwo2,1rpfwp,askhistorians,top_day,21,17
Striker,Not really Simple answer is Russian colonialism was the Russian continent Furthermore the Russian economy didnt have the strength anywhere near the European states Finally access to get to the colonies in Africa the Russians would have to get from Vladivostok all the way from the Pacific Murmansk frozen Arctic for  months or the Baltic can be hard to access due to North Sea or Skagerrak naval blockade No sources right now but they seem to be the main reasons Cant source the ports stuff Sorry But the other stuff is interesting and relates belowEDIT Okay As I said  no sources at the time Was posting off of a phoneThere are some great points about the Russians in California and Djibouti But these arent where the efforts of the government were truly focusedFirst a diagram This one is sourced off Wikipedia but it delivers the idea best httpuploadwikimediaorgwikipediacommonscRussiagifAs you can see the th century saw Russia expand in two ways Firstly into the Caucuses under Alexander I then into Central Asia and the Amur area  the area around Vladivostok I had gotten my ports confused much better with thcentury Russia regarding MurmanskArchangelsk and VladivostokOkhotsk Now how serious was this expansion Firstly it was serious enough that the British developed defence plans for India in the late th century as the Russians knocked on the door of Afghanistan While the Russians did not in fact plan for an advance against India the British were thoroughly concerned regardless But more importantly it was a heavily investedin expansion Russia used the language of colonization similar to what Western European states used for Africa but used it internally Here is where it becomes interesting Russian internal colonization used language which spoke of the American spread the romantic ideas suggested something similar to the spread of people throughout the territory of the Louisiana Purchase and the west of what is now the US For the British concerns regarding IndiaRA Johnson Russians at the Gates of India Planning the Defence of India  The Journal of Military History vol  no  July  pp For the discussion about the spread within Russia see Alberto Masoero Territorial colonization in late imperial Russia stages in the development of a concept Kritika vol  no  Winter  pp  Theres other bits and pieces about which I cant find sources for though Things like the ports and stuff Dont have access to much in terms of academic goodies right now to help with the others,11,cdpjs4c,1rpfwp,askhistorians,top_day,24,13
LMcL,I was reading on this the other day The Russian Empire was based on a single continuous stretch of land stretching from Poland to Canada At their peak they had the third largest empire of all time only smaller than Britain and the Mongols Because of this they didnt really see the benefits of colonialism as opposed to the likes of Britain and France who were powerful but relatively small nationsA single instance was in  when Russian adventurer Nikolai Achinov attempted to establish a Russian colony in what is now Djibouti The French who already were a major colonial power quickly stopped this happeningTo put it bluntly unlike Britain and France Russia had a large base nation and preferred to expand from than colonise which simply wasnt an option for Western European nations,0,cdpny69,1rpfwp,askhistorians,top_day,11,11
drizzl,They did make it all the way down to the bay area of California Fort Ross and the Russian River Valley near Sonoma They also created the RussianAmerican Company like the Dutch East India CompanyhttpenwikipediaorgwikiFortRossCaliforniahttpenwikipediaorgwikiRussianAmericanCompany,0,cdprzpk,1rpfwp,askhistorians,top_day,6,6
HawmQuinzy,I am almost positive that its a jest at one of the political parties as women in Ireland at the time did not receive partial suffrage until ,0,cdplusm,1rpgek,askhistorians,top_day,5,5
BeondTheGrave,The answer is really simple so dont be upset if this is a brief answer But  Shiloh is so important for Grant because he almost lost See the battle happens over two days and on the first day the Union forces were thoroughly beaten by the Confederates Grant should have accepted his loss and pulled his troops back its what every other general did during the war need I bring up panicky McClellan But instead he consolidated his forces and fought again on the second day where he turned the tables and inflicted a defeat on the Confederate forces a defeat which allowed the Union to keep all the gains it had made across the Mississippi river I should add This showed Grant to be a tenacious and capable commander It didnt prove that he was a great general that would come in  but it proved he was willing to continue fighting when by all measures he was actually beaten Also its interesting to look at the battle of Shiloh in the context of the Overland Campaign During Overland Grant suffered major defeats at every engagement if we use the same ruler we use for every other Civil War battle which doesnt quite fit the OC Ill admit But US Grant kept turning Lees flank and continuing south Whereas every general before him had retreated after losing to Lee Grant just kept going Thats another reason why Shiloh is so critical to US Grant  Edit Did you delete your comment Anyway get Russell F Weigleys A Great Civil WarhttpwwwamazoncomGreatCivilWarPoliticaldprefsrieUTFampqidampsrampkeywordsRussellWeigley which is really a classic ,0,cdpk2qy,1rpiji,askhistorians,top_day,4,4
Astrogator,Its definitely not Dönitz The officer there is a Korvettenkapitän corvettecaptain roughly equivalent to Lieutenant Commander a rank Dönitz only held in the early s  Above his stripes is a star which marks him as a sea officer as opposed to technical medical or bureaucratic officers and that letter and the postcard are signed Stabszug  AFK Stabszug is the staff platoon and  AFK stands for  AusbildungsAbteilung für Kriegsschiffneubauten the nd trainingdivision for newly constructed warships stationed at Wilhelmshaven I could find not much information on it online besides thishttpwwwaxishistorycomaxisnationsgermanyaaustriakriegsmarinegermanykriegsmarinekriegsmarineersatztruppenteileundschulenausbildungsabteilungfuerkriegsschiffneubauten If that information is correct it seems well sourced that man could be Hans Gunderloch or Georg Gerhard Neumann prior to his promotion to Fregattenkapitän depending on the date of the photo,1,cdpkils,1rpkgl,askhistorians,top_day,5,4
Hubinator,The last sentence on the post card in your album appears to translate toIch habe ein nettes Früchtchen Really old expression for girl hier kennen gelernt Das kann so bleibenI met a nice girl  over here Things can remain this wayI wasnt able to read the rest of the text but I think that the person who wrote it was stationed somewhere with a group of soldiers  mit der GruppeI hope this is helpful,0,cdpkpzh,1rpkgl,askhistorians,top_day,2,2
Doe,If I can piggyback on this question would a slave in the situation described by uFuglewarrior be more likely to learn standard English thats probably not the right way to describe it but I cant think of a better term or some sort of pidgin or creole language that combined African languages with English  I imagine this would vary based on location time and the intended use of said slave but Im curious,7,cdplwk1,1rpl4t,askhistorians,top_day,33,26
LordSariel,It has an extremely high variance depending on what kind of environment youre in Atlantic World Historian Ira Berlin has said something to the effect of To know a person is a slave is to know only their legal status And I stand by this from my own research in the Atlantic World The experience of slaves cannot be so easily generalized even within the very clear lens of British Colonial North America Even there a number of different crops were grown between  and  and slaves were subjected to different legal and social privileges that effected their socialization and cultural melding with the settler populationAs predominantly mentioned in Berlins book Many Thousands Gone The First Two Centuries of Slavery in North America the question of language has many factors The most prominent of these factors is how many captured Africans spoke your same language This would effect the actual sales pool upon reaching the Colonies Beyond that the geographic region in which you arrive in which in time you arrive further has a huge effect on your cultural integration Urban slaves generally had more autonomy and were required to socialize faster because they were usually in extremely small numbers in close quarters with settlers Rural farmers could still have    slaves from many diverse regions forcing them to learn a common language usually English Large planters largely in the southern states that had a yearround climate for agriculture could have anywhere from    slaves even in the Early Colonial years and they would be less likely to develop any kind of propensity for English in the first generation In other areas of the Caribbean the native language of the slaveholding class was much less adopted because in places like Brazil Haiti etc slaves were imported in such mass numbers and less care was given to their survival Generally speaking these areas has a much larger population of native Africans at any times This differs from British Colonial North America in that the class of African Americans rose much sooner out of the imported populationFor more information read Ira Berlins book He goes into much more detail based on Geographic region type of work type of crops grown as well as the politics of the time Its a beautiful mix of social political and economic history that transcends national boundaries to give you an exhaustively thorough look into what slavery was like everywhere in British Colonial North AmericaI can elaborate a bit more later but for now I have to shoot out for errands Sorry for the quick and dirty response Expect some clarifying edits later,7,cdpp97v,1rpl4t,askhistorians,top_day,28,21
RamblinRambo,Id like to answer this from a personal experience point of view Sure enough the world has changed and there are a lot of new resources out there but the main principle of learning by doing hasnt changed Ive moved countries a few times and Ive never learned a language through class Ive learned it by listening pointing asking and picking up words as you go And I know a good few others that have done the sameIt is important to note that for some people it takes longer and for some it takes less time Some are just simply much more talented in picking up and understanding new languages Exactly like some people are more skilled in maths than others some are more skilled in athletics and so onIf you try and are completely surrounded by a new foreign language Id say it takes on average  year to learn an acceptable level to be able to speak and converse If the language is close to another language you already know then it might take less than six months But if we analyse it from the perspective of being completely different it takes at least a year Once you get the basics youll learn fasterOne universal thing Ive noticed is that people understand each other very well through basic sign language It is actually amazingMy grandfather moved as a  year old boy with his brother to a country where they did not know a single word It was back in the day when english wasnt a common denominator as it is in much of the world today I remember a story from him on how he agreed to rent an apartment pay rent found a job etc with just basic sign languageAnd Id argue that nothing has changed since early history to today if you take away classes and education If you set out to learn a language by doing youll go through the exact same process Ive done this myselfOnly thing we need to think of when it comes to slaves is their ability or freedom to communicate with others that spoke english If they were heavily tied to one owner and their farm then it might have taken  years instead of one It all ties in with exposure to the language So Id expect heavy correlation with exposure to the language and it will have been case specific Also if there were a lot of slaves that spoke a common language it might mean that some of them never learned the new language You can see this in any areas even today where you have a lot of immigrants from the same part of the world Say china towns that have people that dont speak a word of english even if theyre been in an english speaking country for years,0,cdq593u,1rpl4t,askhistorians,top_day,1,1
jetboyterp,From the Franklin Institutehttpwwwfiedufranklinbirthdayfaqhtmla letter from Benjamin Franklin to his daughtergtFor my own part I wish the Bald Eagle had not been chosen the Representative of our Country He is a Bird of bad moral Character He does not get his Living honestly You may have seen him perched on some dead Tree near the River where too lazy to fish for himself he watches the Labour of the Fishing Hawk and when that diligent Bird has at length taken a Fish and is bearing it to his Nest for the Support of his Mate and young Ones the Bald Eagle pursues him and takes it from himgt gtWith all this injustice he is never in good case but like those among men who live by sharping amp robbing he is generally poor and often very lousy Besides he is a rank coward The little King Bird not bigger than a Sparrow attacks him boldly and drives him out of the district He is therefore by no means a proper emblem for the brave and honest Cincinnati of America who have driven all the King birds from our countrygt gtI am on this account not displeased that the Figure is not known as a Bald Eagle but looks more like a Turkey For the Truth the Turkey is in Comparison a much more respectable Bird and withal a true original Native of America He is besides though a little vain amp silly a Bird of Courage and would not hesitate to attack a Grenadier of the British Guards who should presume to invade his Farm Yard with a red Coat onFranklin didnt seem a fan of the bald eagle as the national symbolbut he only held up the turkey to compare to the eagles character,64,cdpn6jh,1rplq1,askhistorians,top_day,282,218
Jabbawookiee,Caleb Rossiter wrote The Turkey and the Eagle The Struggle for Americas Global RoleIn it it is explained that it is not true that Franklin proposed the wild turkey in  but later  castigated the decision by the Congress of the Confederation to adopt the bald eagle as the symbol of the United States  He believed the eagle lived by Sharping amp Robbing  However Franklin did suggest the turkey as the national symbol in tongueincheek fashionTexthttpbooksgooglecombooksidigCYgxRUCamppgPAamplpgPAampotsuxzbomocampfocusviewportampdqfranklinturkeyampoutputhtmltext,26,cdpn2hd,1rplq1,askhistorians,top_day,111,85
tinyshadow,This is one of my favorite pieces of American history Benjamin Franklin wrote his daughter about using the eagle as the symbol for America in  Now the eagle had been chosen to be on the Great Seal since  when Congress officially adopted it ujetboyterp has the letter below You can also find this letter reprinted everywhere nowadays but one of the earlier places that Ive found it in the New York Literary Gazette from  herehttpbooksgooglecombooksidFTkZAAAAYAAJamppgPAamplpgPAampdqFormyownpartIwishtheBaldEaglehadnotbeenchosentheRepresentativeofourCountryampsourceblampotsczKBZOGUrampsigNXnAiSQjjnDISDdYNttVGJAamphlenampsaXampeiKMuYUvOrAHzoASmmoCgBwampvedCEQAEwBgvonepageampqFormyownpartIwishtheBaldEaglehadnotbeenchosentheRepresentativeofourCountryampffalseIn all my research Ive never come across this notorious turkey vs eagle vote What actually seems to have happened is that in June  Congress asked  Charles Thomson the Secretary of the Continental Congress for eight years to design the Great Seal of the United States He took advice from the committees within Congress and first described the seal as such On a field       Chevrons composed of seven pieces on one side amp six on the other joined together at the top in such wise that each of the six bears against or is supported by amp supports two of the opposite side the pieces of the chevrons on each side alternate red amp white The shield born on the breast of an American Eagle on the wing amp rising proper In the dexter talon of the Eagle an Olive branch amp in the sinister a bundle of Arrows Over the head of the Eagle a Constellation of Stars surrounded with bright rays and at a little distance clouds Motto In the bill of the Eagle a scroll with these words E pluribus unum  Source You can find this many places but one of them is The History of the Seal of the United States from httpbooksgooglecombooksidjUZmAAAAMAAJamppgPAamplpgPAampdqOnafieldChevronscomposedofsevenpiecesononesidesixontheotherampsourceblampotsCyEbyriampsigAcKqiIxYwQfXEbDhTPwIamphlenampsaXampeiNKYUrjCBceEoQTopHADwampvedCDAQAEwAgvonepageampqOnafieldChevronscomposedofsevenpiecesononesidesixontheotherCampffalseThe important parts for this question are the repeated use of eagle By  Americans had already established the importance of the eagle to the colonies The Magazine of American History suggests that as early as  that John Adams had chosen the eagle to be Americas emblem  In the autumn of  John Adams was sent to England to negotiate for peace Among the eminent people whom he met was Sir John Prestwick a baronet of the north of England a friend of the Americans In a discussion of the subject of the national coat of arms so long awaiting decision Sir John suggested an escutcheon bearing thirteen perpendicular stripes repeating the idea of the national banner He proposed according to the narrative cited that in order to give it consequence it should be placed on the breast of the displayed American eagle without supporters as emblematic of selfreliance  Source Magazine of American History from httpbooksgooglecombooksidvxIAAAAYAAJamppgPAamplpgPAampdqChevronscomposedofsevenpiecesononesidesixontheotherjoinedtogetherampsourceblampotsFeEelbehampsigXcJgrxKhkVfLJyiGifyqBimAamphlenampsaXampeibMyYUsYsNygBOyTgfAFampvedCDAQAEwAQvsnippetampqeagleampffalseWhile there are any number of reasons why the colonies chose the eagle all in all it may come down to a positive association with the bird and other already existing emblems After all the eagle was commonly used in Europe as a symbol in coat of arms at the time Also  when the Society of Cincinnati formed in  the eagle became its most popular symbol According to the Societys museum website Designed by Pierre LEnfant the first Eagles were made in Paris in  by Duval and Francastel and sent to America for the Society The museum collections include more than thirtyfive examples foremost among them the Diamond Eagle which French naval officers commissioned for George Washington in  and became the badge of office of the Societys president general  Source The Society of Cincinnati Archives and MuseumhttpsocietyofthecincinnatiorgcollectionsmuseumcollectionssotcIts not surprising that as soon as the eagle came into the imagery of the United States of America that it was often repeated and with great respect The new nation was being forged out of disparate peoples and needed such symbols to reinforce their separation from England as well as unify the colonies into statestldr  The showdown choice between turkey and eagle did not happen Instead the eagle appears to have emerged as the frontrunner for several great emblems before being chosen in the Great Seal and thus America In the s the eagle was on the mind of many Americans except Benjamin Franklin who called it a scavenging lazy coward,10,cdpnodj,1rplq1,askhistorians,top_day,83,73
FakestAlt,NoThe Eagle was first used as an official national symbol with the adoption of the Great SealhttpenwikipediaorgwikiGreatSealoftheUnitedStates There was no Eagle v Turkey vote in this process It went through several committees which expanded on the original idea and after years developed a symbol which was approved by Congress Congress was never presented a turkey alternate nor am I aware of or can I find anything suggesting one of these committees ever considered a turkey While its true that Frankling penned some negative wordshttpwwwamericanheraldryorgpagesindexphpnMMMTurkey about the eagle this was not in regards to a national bird or the Great Seal The quotes come from a  letter to his daughter not a public campaign against the eagle ,6,cdpn4rb,1rplq1,askhistorians,top_day,25,19
Canadairy,Im not a historian however this part seems suspect Why would an English military commander refer to the Indian rebellion or the Sepoy Mutiny Sepoy Rebellion Great Revolt etc  take your pick as an uprising of freedom It reads rather like an antiBritish propaganda piecegtwere not part of the  uprising of freedom I will release all of you the moment I hear just one of you affirming this,2,cdpp91j,1rpnl2,askhistorians,top_day,7,5
