author,comment,downs,id,post,subreddit,type,ups,score
LotoSage,Benjamin HarrisonhttpswwwyoutubecomwatchvpUgGELcg ,2,cdp84o3,1ro73k,askhistorians,top_day,16,14
Axon,A little while agohttpwwwredditcomrAskHistorianscommentsozbwhowasthefirstuspresidenttohavehisccxmecontext I talked about the first photograph of a sitting US President You can see some links in that postThe earliest surviving photo of a president in office is of James K Polk There are a couple undated photos of him so the order is unclear but they were almost certainly taken while he was in office because he died just three months after leavingThose are the earliest surviving in digitized form youd be surprised what you can find in books photos of a sitting President Yet there is a mysterious photo of John Tyler Wikipedia says that Polk was the first to be photographed in office without citation but has in its article a photo of Tyler purportedly taken by Anthony Edwards amp Co A press release from March   in the New York Herald talks about an exhibition of pictures taken by Anthony Edwards amp Co and mentions a portrait of exPresident John Tyler The portrait is not described and neither is the date on which it was captured Another press release mentions the gallery on March  implying that it was a multiday event Tyler only left office on March  It is possible that a photo of Tyler was indeed taken while he was still in office Further corroborating this is a brief blurb here at the Encyclopedia Virginia which mentions an advertisement from  from Anthony Edwards amp Co claiming to have photographed Tyler It is as yet unclear when exactly the existing daguerreotype of Tyler was taken though I conclude that it is certainly possible for him to have been photographed in officeHere on the other hand is the largely undisputed first photograph of any US President John Quincy AdamshttpuploadwikimediaorgwikipediacommonsbJohnQuincyAdamscopyofPhilipHaasDaguerreotypejpg ,2,cdpcwce,1ro73k,askhistorians,top_day,11,9
rosemary,This question has a had a couple of OK discussions in the past Ill settle for posting the links rather than copyandpasting a post I made in one of them Was the Bronze Age Collapse caused more by invasions and migrations or climatic eventshttpwwwredditcomrAskHistorianscommentsobagwasthebronzeagecollapsecausedmoreby Why were the Phoenicians spared the ravages of the Bronze Age collapsehttpwwwredditcomrAskHistorianscommentseqjwhywerethephoenicianssparedtheravagesofAnd theres a section in our FAQ on the Sea PeopleshttpwwwredditcomrAskHistorianswikiantiquitywikiseapeoplesAwhoweretheyCwheredidtheycomefromF  theres no real reason to bring them into the question though X happened in one part of the world within a century of Y happening somewhere else doesnt imply that X and Y are causally related Its just that the scarcity of evidence sometimes leads people to assume that theyre somehow connectedEdit By the way the normal interpretation of the Palestinians in the Merneptah inscription not Ramesses III his runin with peoples from the sea was a few decades later is that the Peleset later settled in what subsequently became Palestine not that they came from there,0,cdp7hiq,1ro87w,askhistorians,top_day,5,5
anotherkeebler,Id be grateful if someone could comment on the assertion that since bronze required trade since its composed of two different metals whose ores are rarely found in the same location and iron did not trade routes weakened promoting isolationism by removing commercial and other interdependencies,0,cdpbkdz,1ro87w,askhistorians,top_day,1,1
davratta,That  would  be  Klucks  infamous  left  turn  He  was  supposed  to  keep  marching  west  and  encircle  Paris  but  Kluck  and  his  superior  Molke  were  both  very  concerned  with  the  gap  between  the  First  and  Second  Army  A  French  observation  plane  noticed  this  change  in  direction  of  Klucks  army   Joffre  was  able  to  order  the  BEF  to  advance  into  this  gap  while  attacking  Klucks  flank  with  French  troops  from  Paris              However  you  can  blame  Hemulth  von  Molke  for  detaching  two  corps  from  the  first  army  to bolster  the  German  Eighth  army  in  east  Prussia   You  can  also  blame  Molkes  tinkering  with  the  Schiliffen  plan  He  augmented  the  fourth  and  fifth  armies  and  made  the  center  of  his  line  stronger  The  Italians  did  not  declare  war  and  did  not  send  the  six  corps  that  were  suppossed  to   join  the  German  seventh  army  that  guarded  the  Rhine  river  So  Kluck  went  into  the  battle  of  the  Marne  with  fourteen  fewer  divisions  than  Schiliffen  intended  Molke  did  not  keep  the  right  wing  strong  and  ignored  the  dying  words  of  the  plans  developer   The  two  corps  Molke  detached  from  the  first  army  were  to  late  for  the  decisive  battle  of  Tannenburg  but  did  help  the  Germans  kick  butt  at  the  battle  of  Masurian  Lakes  two  weeks  latter  These  two  major  victories  stopped  the  Russian  steam  roller  and  destroyed  Russias  Second  army     Sources  DJ  Goodspeed  The  German  Wars   and  Barbara  Tuchman  The  Guns  of  August    ,0,cdp7ww5,1roaf9,askhistorians,top_day,3,3
AllanBz,Chariots did not require large horse breeds charioteers could yoke together a team of smallbreed horses to pull a chariotA chariot would have a driver and a warrior One person could focus on driving one on spear or arrow work instead of dividing a single persons attention among horse work and fighting,0,cdphbjf,1roeck,askhistorians,top_day,5,5
BeondTheGrave,The pacts were really aimed at Nazi Germany so the Soviet invasion which was a complete surprise didnt really trigger the alliance But because of Poland and the later invasion of Finland the British and French were very interested in bombing the Soviets and possibly even providing troops to support the Finns One of the early plans for the intervention into Norway which was planned before the Nazis invaded btw was to deploy troops across Norway which would serve as a bridgehead for deploying troops into Finland Actually the biggest reason why these plans fell through was the collapse of the Finnish resistance But the Brits and France were really keen on attacking the Soviets Of course that all changed when the Norway was invaded and later when France was attacked ,1,cdpd6ww,1rog7o,askhistorians,top_day,2,1
johnandrewsmith,The short answer to your question is no All of these occurrences were isolated incidents that happened for various reasonsThe long answer is well complicated I dont quite like covering Russia with broad generalizations since their society is so unique but I think in this case it might work Russia is a steppe country whose borders are very long and open making it vulnerable to the various horse tribes of the steppe In order to counter this Russian rulers tend to militarily expand in order to eliminate possible threats from the steppe They also tend to consolidate and centralize power using terror and violence when necessary This is not so different from other European monarchs at the time although it can be argued that the Russian methods were more thorough And then sometimes the ruler was just plain mad as it can be with any monarchy Ivan the Terrible for instance was starting to go crazy at the time he killed his son He didnt intentionally do it and afterwards he  held his son in his arms cryingIts important to understand the situation many czars were in order to understand their actions They were often threatened by war rebellions and coups Sometimes this necessitated harsh policies Peter and Catherine were certainly great rulers but they ruled Russia with an iron fist Peter brutally stamped out opposition to his western policies and Catherine either manipulated or killed anyone who was a threat to her Ivan the Terrible created the Oprichniki which was the original secret police These rulers were keenly aware of the political situation and did this not only to hold onto power but to save their own skin So now were at Peter the Great Peter asks his son to start preparing to become czar while his son wants nothing to do with that Peter had another son but he needed to make sure that after he died that Alexei wouldnt get powerhungry and go after the throne anyway He demands that Alexei become a monk if he wants to be czar one day to join the army Alexei flees from Russia to Vienna This causes quite a stir among the nobility and Peter suspects his son of treason He convinces his son to return on the false pretense of safety After Alexeis return Peter starts his inquisition to root out all the traitors in Alexeis circle His son is convicted then sentenced to death He is instead tortured to death in an attempt to get more informationStalins situation is also unique He was also very concerned about the political atmosphere in Russia He was also in the middle of a devastating war and while it did give him some leverage among the general population he could no longer afford to eliminate political threats in the military Stalins son was captured by the Germans Hitler offered to trade him for Field Marshall Paulus and Stalin replied I will not trade a Marshall for a Lieutenant While we can speculate on the various reasons Stalin abandoned his son it is claimed by his daughter that Stalin believed his son deliberately surrendered and was therefore a traitorThe very long answer to your question is that Russian leaders might not have cultural background for killing their heirs but they do have a history of autocracy and paranoia Hopefully this answers your question,10,cdphgz4,1roiae,askhistorians,top_day,35,25
farquier,I should make people aware that the limits of Jared Diamonds Guns Germs and Steel have been extensively discussed in the following section of the FAQs although of course we always welcome new and insightful contributionshttpwwwredditcomrAskHistorianswikitheorywikihistoriansviewsofjareddiamondsgunsCgermsCandsteel,0,cdpcwre,1rok9r,askhistorians,top_day,6,6
Searocksandtrees,A popular question Check out related posts in this section of the FAQ for previous responsesCivilizations of the AmericashttpwwwredditcomrAskHistorianswikinativeamericanwikicivilizationsoftheamericassee the popular questions link on the sidebar or the wiki tab above,0,cdperz4,1rok9r,askhistorians,top_day,4,4
Angiras,Maybe you  should get the word out to university departments for editing work I always got department emails on translation and this kind of stuff  I dont see a professor leaping for this opportunity unless it aligned with his or her present research goals Grad students are more likely to be interested for compensation Edit What do you exactly want This is purely an oral history from an exsoldier Is this supported by documentation of any kind like a personal diary or letters If its an autobiography maybe you should just contact a ghost writer to hammer out the narrative,0,cdpi8vo,1roncz,askhistorians,top_day,1,1
caffarelli,Try contacting the Veterans History Project from the Library of Congress who may be able to put you in contact with someone doing an oral history in your area  Your local archives are also a good resource usually there is someone on staff trained in doing oral history If youre really stuck shoot me a PM We also have an oral history section in the links pages on our wiki ,0,cdprvpx,1roncz,askhistorians,top_day,1,1
WhenTheRvlutionComes,Mao ruled for a really long time  almost  years  besides perhaps an intermediate period after the great leap forward and before the cultural revolution in which he held little real power The famine associated with the Great Leap Forward simply The Great Chinese Famine lasted only for years Shocking as the  million death toll may seem in terms of Chinas  million population at the time it was a drop in the bucket Population levels soon rebounded As for the Cultural Revolution it was proportionally a much smaller affair Its very simple honestly A quarter of a million mothers happened to spit out a billion or so children Mao wouldve had to of killed a lot more people to outrace the birthrate  hundreds of millions obviously And surprising as it may seem Mao wasnt personally responsible for the majority of deaths on the period Plenty died for banal reasons like a heart attack or the MeaselsOne thing in particular about Maos term was that he encouraged mothers to have large broods of children as he believed that a large population was good for the country The consequent effects of rampant overpopulation in subsequent generations of course prompted the CCPs about face after Maos death towards the one child policy,0,cdpi8uz,1ropf0,askhistorians,top_day,3,3
macroclemys, Sundry items like first aid kits could be attached to it for handsfree carrying Twigs and leaves could be inserted to help with camouflageSource World War II Tactical Camouflage Techniques by Gordon Rottman page ,89,cdpd9vb,1roqf1,askhistorians,top_day,605,516
OldRosieOnCornflakes,I have a followup question related to armed forces headgear In a few films most obvious I can remember is The Guns of Navarone and at HMS Belfast in London Ive seen costumed forces dummies in Belfasts case wearing like a plain cloth cap that covers the head and shoulders over their standard uniform when in battle What is this for It seemed to be particularly artillery operators in movies but on Belfast I think there were some men wearing them in one of the battle computer rooms Am I right in thinking its some means of shielding the probably expensive uniform from smoke exhaust fumes dust etc when firing large weaponry Not at home so cant get a screenshot of the film sorry,7,cdpixu7,1roqf1,askhistorians,top_day,21,14
sillycheesesteak,Two reasonsThe covering on the helmet was a camouflage of sorts defeating glare off of helmets and breaking up the outline of the helmet More importantly it was to attach local foliage grass etc to your helmet that would help you blend in The Japanese were the best at this being quite adept at jungle warfare ,0,cdpo6uu,1roqf1,askhistorians,top_day,5,5
revdon,White fixtures and dress in the kitchen were meant to openly display the cleanliness of the establishment as opposed to the greasy spoon diner White is hard to keep clean in a dirty kitchen and so became a symbol of nothingtohide and trustworthiness Putting White in the name puts passersby in mind of same Hey that place has must be a safe place to eat because its implied in the name,0,cdq3hdh,1rornx,askhistorians,top_day,1,1
HallenbeckJoe,For citizens of East Germany it was relatively easy to go on a vacation in other Warsaw Pact nations but it depended on the nation and sometimes on your record Up to a million East Germans went on vacation in Warsaw Pact nations esp to Czechoslovakia Hungary and the USSR each year Starting with the early s you didnt need a visum to got to Poland and Czechoslovakia For other countries your visitvacation needed to be granted by the GDR not the state you were going to which it was most of the time Visiting the USSR individually was a bit more difficult but possible too ,3,cdphzrq,1rorqw,askhistorians,top_day,10,7
MrMysterious,Depending on the period The restrictions were always present but they eased up in the s In some countries they had internal passports which were used to monitor your presence within the countryLimited tourism was often popular and Crimea Romania and Yugoslavia were popular holiday destination for the rich For the slightly poorer but still welloff organized package tours were preferred both for the ideological reasons and that very few Soviet subjects had cars before the s For many a trip abroad even to a fellow communist nation meant profits from smuggling,1,cdpi04s,1rorqw,askhistorians,top_day,7,6
UrsusMontorum,In the s my Polish parents were able to go to Turkey and buy jeans for black market sale  They also drove to USSR itself Moscow I believe  My father went to work in East Germany and Austria in s According to him  the opportunity to travel was there but few people actually took it Unrelated but somewhat pertinent  my grandma emigrated to the USA in the s but her circumstances might have been abnormal as she had a family history of US citizens Typed on mobile and still Im turkey coma so apologies for bad English ,0,cdpplgn,1rorqw,askhistorians,top_day,4,4
youbeian,I dont know much for the general populace but for university students yes Im Mongolian and during the s the norm was for good high school graduates to go to the USSR for study People with higher connections parents in the high echelons of the party or governors were able to go to East Germany Poland Hungary etc as these were considered to be more desirable In Moscow at least where my mother studied students from most thencommunist countries were represented from the Eastern Bloc SouthEast Asia Africa etc,0,cdpwlxa,1rorqw,askhistorians,top_day,1,1
panties,my grandmother was fairly high ranking in the local party circles in USSR and she traveled to North Korea once  my parents have been to East Germany in the s  also saw someone mention internal passport  indeed and still the case in Russia at least you have an internal passport that has your registration address propiska and your kids writtenin you use that to vote and to prove your identity to police and then you have whats called a foreign passport colloquially zagran passport thats the one you get your visas in and show at the airport its two different processes to get each one everyone has an internal passport but you dont get an external one until you plan to travel  ,0,cdpxhce,1rorqw,askhistorians,top_day,2,2
itsallfolklore,I would ask you  as I would have asked myself decades ago  what do you want to write about Thats where you start Then you develop a good question around that So what do you want to write about,0,cdpdncr,1rou83,askhistorians,top_day,6,6
DonaldFDraper,When I took my senior seminar it was a subject seminar on the Late Roman Empire I didnt know exactly what I wanted to do but I was always interested in what made a Roman a Roman so I ended up doing a paper on Roman identity during the Late EmpireI did it but it was terrible the professor wouldnt let me reference Early Empire or Republican era concepts despite my constant arguments that Late Imperial Roman identity was based on the Late Republican ideals Be careful with the professorSo from this I recommend this What is your interest in history for youFor me its the French Revolution and the Napoleonic Wars Why are you interested in this subjectI love the romantic aspect of the wars LaSalle predicting his death Oudinots Grenadiers Davout fighting the best of the Prussian army with his single Corp romantic stories that are rooted mainly in fact with some embellishments  What do you want to know about the subject that you loveIve been interested in the French Way of War so Ive studied much on the tactics and the army construction of the French army so a paper concept I have for my own free time is this how did a cartridge get made and make its way to the front lines Can you do the researchThis is a VERY important step are you able to research it on your own without having to go into archives that youre not allowed into yet Do you have access to the materials that allows you to make this paper possible My paper about cartridges is impossible for me as an undergrad but possible for someone working on a Doctoral thesis Know your limits Do you REALLY like your topicAre you willing to fight for it if push comes to shove and your ideas get shot down Can you defend it and your analysisFinally  Be sure youre willing to spend the time on itIf its a subject that you like make sure that youre willing to get to the nitty gritty of the subject You may find things that you may not like or even find that you dont like the topic that you are doing So do preliminary research into the topic long before you propose itGood luck in doing this Im more than willing to guide you along with it,1,cdpeolb,1rou83,askhistorians,top_day,6,5
sonnyclips,I studied media comms in undergrad and did my thesis on the gangsterism and newspapers in the early th century  The Circulation Wars loomed large as did the gambling wire services that were owned by Moses Annenberg It was fun and my advisors enjoyed it as much as I did ,0,cdpfobx,1rou83,askhistorians,top_day,2,2
TimberBeast,I simply picked a topic that Id researched for a previous class That gave me a good startingpoint for my thesis,0,cdphhia,1rou83,askhistorians,top_day,1,1
IrishWaterPolo,You may be referring to the augurs of Ancient Rome which served as a kind of mystical priest that took the auspices The Auspices literally refers to studying the flights of the birds and interpreting the will of the gods I do believe that the augurs also studied animal kidneys but to what degree Im not exactly sureObviously this is way out of my area of expertise but I wanted to offer a suggestion that may point you in the right direction Some of our Mods have excellent backgrounds on Ancient Rome and Ancient Religions you may have better luck messaging them Good luckDid a bit more digging uCelebreth uDaeres uMarcusDohrelius and uWhoHin may all be able to answer this question much more in depth than I have,0,cdpgwi7,1rouzw,askhistorians,top_day,2,2
vonadler,The conquest of Anatolia was not so much a conquest as it was a migration of several seminomadic Turkish tribes of the Great Seljuk Empire after the Eastern Roman defeat at Manzikert  While they became the majority or plurality ie the largest group but not above  of most of Anatolia they did not completely displace the local population There were large groups of Greeks Armenians Kurds and Jews living in Anatolia up to the early s when both Greece and Turkey ethnically cleansed their territories in a population exchange and those Armenians and Greeks that remained in Turkey were forced to take Turkish names and speak Turkish the Pontic Greeks were forcefully assimilated this waySo first of all Anatolia was not as Turkish as you may think it was during the days of the Ottoman Empire Secondly the Turks moved there  years before Osman founded the Ottoman Empire and thirdly the Balkans were far more muslim than you might think before the ethnical cleansing condicted after the RussoOttoman war of  and the First Balkan War  and finally the GreacoTurkish War The term Turkish during the days of the Ottoman Empire was more used as a slur than anything else Turcik people on the countryside were referred to as Turks which meant something like a simpleton or a hillbilly The elites called themselves OttomansThe Balkans did have large groups of Turks or various Balkan groups that had converted to muslims and were by the time considered more or less Turks despite their ethnicity being something elseOverall ethnicity and religion is very intermixed and before the age of nationalism it could be hard to tell who was what  people identified more along the lines of the rulership being Ottoman or religion than they did along the lines of ethnicityHere are a few maps that can help explain how intermixed things wereEthnic makeup of the Balkans httpuploadwikimediaorgwikipediacommonsfRizMapjpg As you can see there are large groups of Turks in the Balkans especially in Romelia today part of northeastern Bulgaria and southeastern RomaniaAnother map of ethnic makeup of the Balkans from httpuploadwikimediaorgwikipediacommonsCarlSaxETjpg As you can see muslims and Turks are viewed pretty much as the same and there are large groups of themAn ethnic map of Anatolia from httpmediaevalmusingsfileswordpresscompxasiaminorjpg As you can see large groups of Greeks and Armenians and some othersAbout  milion muslims were forced to flee from the Caucasus and Balkans with another  million killed in the   and the  war sourcehttpwwwiegegoeuenthreadseuropeontheroadforcedethnicmigrationbernapekesenexpulsionandemigrationofthemuslimsfromthebalkans and there still are large groups of muslims in BulgariaBottom line Anatolia was less Turkish than you think until  and the Balkans were more Turkish than you think until  Still there was a migration of Turkish tribes preOttoman Empire into Anatolia that did not happen into the BalkansEdit Put in Kurds as one of the groups in Anatlia as per the remark of uGComstock,4,cdpglia,1rox3z,askhistorians,top_day,17,13
