author,comment,downs,id,post,subreddit,type,ups,score
TheWinStore,Botched intelligence and botched communication within the Kennedy administration contributed a great deal to the failure of the Bay of Pigs Yet the catastrophe was entirely avoidable Just for some essential background information during his first few months in office JFK was immediately confronted with the question of what to do about Cuba In  Castro had taken control of the country and Castro wanted to free Cuba from its dependency on the USthe US bought  of Cubas sugar at subsidized prices and owned the major oil refineries sugar plantations and utilities Castro wasnt a communist when he took over but his brother Raul was and so was Che Guevara Both pressured Castro to draw closer to the SovietsOn November   about a week after his election JFK was briefed on a CIA plan to send an invasion force of  Cuban exiles to invade Cuba President Eisenhower told JFK that the antiCastro plan was proceeding well and that it would be his responsibility to see it through That advice left a big impression on JFK who greatly respected Ikes military background   So what intelligence and bureaucratic failures doomed the Bay of Pigs and why did they developFailure  the Joint Chiefs The Joint Chiefs studied the CIA plan and correctly concluded it would fail without largescale popular uprisings in Cuba meaning the people of Cuba would have to rise up against the government The Joint Chiefs also correctly concluded that there was no evidence the Cuban people would do so Unfortunately the Joint Chiefs obfuscated their conclusions For example they concluded that the CIA plan had a fair chance of success But does fair mean good or bad Its very ambiguous language What the JCs really meant was that there was a  chance of failure which are pretty poor odds relatively speaking But when JFKs advisors read the memo they werent aware of this probability Additionally all the Joint Chiefs reservations about the plan were buried in the back of the long memo Failure  obsession with secrecy A series of meetings were called in the White House to discuss the CIA plan One of the first issues that arose was the disposal problem which was raised by Allen Dulles who was still head of the CIA as a holdover from Ikes administration He said that if the invasion were called off the Cuban exiles who had been training in Guatemala would come to the US and risk leaking the plan making JFK look weak and indecisive In March  JFK approved the plan provided US involvement was kept secret He wanted the plan to be free of traces of US fingerprints Whether this was even feasible was another question entirely But secrecy was desirable at the time because the US was still engaged in sensitive negotiations with the Soviets over Laos JFK also wanted a more benign relationship with Latin American countries and a US invasion of Cuba would make the US look bad Unfortunately JFKs desire for secrecy led to the invasion site being moved from Trinidad Cuba to the lessexposed Bay of Pigs This decision would have substantial consequences As far as intelligence goes JFK approved the plan with the assumption that even if the invasion failed the Cuban exiles could flee to the mountains and conduct guerrilla warfare there There was a minor snag howeverwhereas the original invasion site at Trinidad was close to the mountains the Bay of Pigs was not It seems that no one took the time to look at a map and point this out to JFK Oops Excessive secrecy was a problem even within the process of administrative decisionmaking At every meeting for example the CIA would hand out copies of the latest plan and then confiscate the plans at the end so that none of JFKs advisors could leave the room with them This prevented the administration from consulting outside experts at the State Department and so forth Failure  erroneous assumptions The Bay of Pigs plan was based on numerous erroneous assumptions For example it was assumed that the invasion would set off an uprising in the Cuban underground against Castro But after the air strike Castro just rounded up all the members of the Cuban underground and chucked them into prison The antiCastro forces were weak disorganized and lacked clear leadership No Cuban underground even existed Another poor assumption was that US involvement could be kept a secret  clearly implausible given the extent of US involvement And finally there was the assumption that even a failed invasion would allow a flight to the mountains which never occurred Failure  newbies Typically bad intelligence can be checked by thorough careful decisionmaking However JFKs advisors were reluctant to speak out against the plan The advisors were in place only  days were new to each other and were not used to blunt discussion They were afraid to challenge the CIA on the premises of the plan especially because the CIA was headed by Allen Dulles who had overthrown governments in Guatemala and elsewhere There was no real discussion where advisors were allowed to debate the issuesthe administration simply deferred the plan to the CIA and so the outcome was extremely poorFailure  bureaucratic politics The CIA and the Joint Chiefs were much more concerned about their own parochial interests than national interests The CIA withheld critical information from the president such as the known weakness of the antiCastro underground and the low morale of the Cuban exiles when they learned US would provide direct support The CIA also had no evidence of strong antiCastro forces on Cuba The CIA was not the only culprit The Joint Chiefs did not effectively warn JFK that the operation was not militarily feasible They failed to warn him that Castros air force had to be totally destroyed for the invasion to have any chance of success And the Joint Chiefs did not make their other reservations known to the administration Why They thought if the plan started to fail JFK would have to deploy US troops to salvage the mission which would conveniently serve the Joint Chiefs interests And if the invasion did fail they assumed the CIA would take the blame not them  All of these reasons contributed to the failure of the Bay of Pigs Would a USflagged invasion have succeeded Perhaps but JFK would never have approved such a plan If the intelligence had been properly handled the correct decision would have been to take no action Fortunately JFK learned a few lessons from the Bay of Pigs First dont trust the bureaucracy Second dont be awed by experts And third encourage frank discussion and debate JFK would draw on all of these lessons during the Cuban missile crisisso in a way failure in  laid the groundwork for success in    Source Deborah Welch Larson lecture University of California Los Angeles ,0,cdphovk,1roy5r,askhistorians,top_day,4,4
mormengil,Have a look at the small city of Uzes in Gard in the South of France  The center of the city is still laid out much as it was in Medieval times  The city has  people today  Perhaps  in the th century  in The city was surrounded by a defensive wall now gone and replaced by a road  Inside the city were three great defensive towers still there The Tour Bermonde the keep of the Seigneurs de Uzes  first recorded in  AD who later became Viscounts and then Dukes The Tour du Roi built by the town guilds as a counter power to the Seigneurs and the Bishop  later taken over by the Kings of France and the Tour de lEveche The tower of the bishops palaceThere was a bishop of Uzes since at least  AD  There was a cathedral there in the th century but it has been rebuilt twice since then and the current one is from the th century  Its Tour Fenestrelle however has survived from the th century  There are also several other churchesIn the center of town is the Place aux Herbes which is where the market was and still is heldBuildings in the city are of stone with Roman tiled roofs  Domestic buildings are most typically three or four stories high  They frequently have a vaulted ground floor used for workshops or storage or shops with living quarters on the two or three upper floors  There were a mixture of apartment buildings single family homes and the city mansions of rich merchants or feudal knights from the surrounding countrysideThe main industry in the town probably since the th century was the manufacture of cloth But it was also a center of government church law courts and commerce for the surrounding area  The bishops had the right to mint coins in the th century so there was a mint  On the outskirts of the town were several large monasteries   The town was surrounded by the hunting preserve of the Seigneurs and by farmlands and small villages each with its own small castleThe agriculture of the area then as now was vines olives sheep fruit vegetables and grainIf you search for images of Uzes you will get a pretty good idea of the nature of the medieval city  Though the surviving buildings generally date from the  th century or later rather than the thThe street pattern and building footprints inside the trace of the old walls are all the same as they would have been in Medieval times,0,cdq13i4,1rp0tz,askhistorians,top_day,2,2
Bezant,gtJust outside Athens Pisistratus cut himself and his mules about the body then drove into town claiming that hed been attacked by his political enemies The people gave him bodyguards who followed him around armed with clubs Pisistratus then took the Acropolis by force with the help of his new bodyguardsThis one I dont think is particularly hard to believe  The main point is that he overrode the traditional Athenian objections to an armed bodyguard  Once he had say a handful of men the precedent was set and as a powerful political figure he was able to expand his guard further over timegtPisistratus was later driven out of Athens His plan to get back into power is described by Herodotus as the silliest trick which history has to record He found a tall woman called Phye Φύη and dressed her up as Athena He taught her some goddesslike moves then rode into Athens on a chariot with her standing next to him The Athenians fell for this ludicrous ruse and he returned to power Herodotus himself is incredulous about this storyMy Greek history professor suggested that rather than being taken in by the ruse it was never intended seriously and the Athenians just went along because they appreciated a good show  The entire show was secondary to the political context that allowed him to return and be welcomed by the citizens  I find that a more reasonable assessment than the Athenians being complete idiots  for fun if you calculate Phyes height she was about gtAfter being chucked out of Athens for a second time Pisistratus gathered an army and made for the city On the way a soothsayer wandered by and told him some nonsense about fish being caught in nets Pisistratus ordered his army to advance at that exact time the Athenians were having lunch or playing some dice or having an afterlunch snooze So Pisistratuss army walked into Athens unopposed This strikes me as the fairly common practice of random oracles and divine acts being thrown in  The thing that makes Herodotus different from the people that wrote about history before him is he incorporated human agency rather than divine  A common feature of his work is explaining the human side and  the supposed divine side of any historical event but what really makes it history is they basically function without the divine bitsWhat we know is that during his exile he built contacts throughout the Greek world raised a pretty big army which he marched back to Athens with and won the battle of PalleneAlso keep in mind he was not just some nutter gaining power through crazy tricks  He was an important political leader with a large base of support among the Athenians as well as a skilled and competent ruler  So it wasnt very absurd that he rose to power  As to whether people believed the more fanciful parts of the story probably not at first but as the time passes and the events grow more distant the authority of remaining sources gets stronger so until more serious criticism of historiography emerged Herodotus version was likely widely believed,16,cdphf7u,1rp2ge,askhistorians,top_day,113,97
lngwstksgk,While not intended to stop further answers this section of our popular questions pagehttpwwwredditcomrAskHistorianswikidailylifewikilifeatuniversity may be of interest to you,0,cdphaqm,1rp3ug,askhistorians,top_day,6,6
khosikulu,Only in a few places did various Europeans have the power to generate conflict directly andor raid for slaves even then they had African auxiliaries like Portugal in the area of northern Angola today  So some involvement by Africans of various standings and origins had to exist and did the mixedheritage Eurafrican trading class that grew from the s onward was also a crucial part of factoring slaves into the Atlantic trade  But one must always remember that only certain African societies took part and only certain leaderships under varying conditions usually connected to other existing political objectives  African rulers didnt have to give consent because the majority of people taken into slaveryand certainly the majority of fightingage menwere captured in war or surrendered as tribute  Under the older system however those people remained in the region the export trades removed them entirely  Except for civil war important in Kongo and occasionally the sale of condemned criminals African rulers were not putting their people into the trade but normally their enemies or other strangers  The acquisition cost was effectively pretty low so this was pure profit for the individual captorThe getting guns thing was not quite as important as you suggest in part because a number of societies had other things Europeans wanted too and sometimes they wanted other things from Europeans  Asante for example not only actually imported slaves on the coast but also had gold and could buy firearms It wasnt alone  Arms traffic in West Africa wasnt restricted to those who engaged in slave trafficking  It wasnt just leaders either a lot of traders were pretty independent and simply gathered slaves from the major markets  Slaveoriented states like Dahomey were late developments on the wholeThe Atlantic trade was something of a magnitude unknown in the intraAfrican trade or generally in the African experience of slavery  Chattel slavery required a lot of people to pretend they werent doing anything wrong the massive expansion of the slave trade required the same  In effect answering the question of whos at moral fault is impossible because everyone involved in the trade from the point of capture to the final destination was in some way responsible for the trade  The morality of the slave trade is another matter because of the prospect of presentism but we can certainly recognize analytically that the machinery of the export slave trades worked helically growing and deepening as it went one step at a time involving people of all sorts with a lot of different motivations across three continents and a whole ocean  A search for particular blame is not really relevant here and its honestly not good history to frame a complex  year long commercial trajectory that wayHave a look at John Thorntons Cultural History of the Atlantic World  or his earlier Africa and Africans in the Making of the Atlantic World  He gets at some of this in there  One important warning thoughthe agendas in play when people talk about the blame game or the related numbers game are a mile wide on many sides,4,cdphq5f,1rp6v4,askhistorians,top_day,26,22
mormengil,Moral culpability is a very tricky subject for historians to get intoWe really should not anachronistically reflect our own moral values or todays moral values back into the past and use them to judge historical peopleIf we think that it is immoral to conquer other people does that mean we should go back in history and declare that Alexander and Caesar and Muhammad and Genghis Khan were evil and morally culpableInstead if one of the goals of history is to deeply understand the past and the people in it we should try to understand how the people themselves or their contemporaries thought about the morality and how they might have judged themselves or been judged AT THE TIMEAt the time of the early Atlantic slave trade in the s slavery had been a long standing institution in Africa and the slave trade in the Indian ocean had been going on for a long time  I dont think we know of any sources indicating a moral objection to the slave trade within African societiesThere was also little or no moral objection to slavery from Europeans in  It wasnt until late in the s that the abolitionist movement and men like John Wesley and William Wilberforce in England and colonists in Northern Colonies like Vermont and Massachusetts began to be a strong voice against the morality of slaveryAfrican rulers were certainly heavily engaged in the slave trade but whether they or their contemporaries considered them morally culpable for this engagement seems dubiousBy the late s there were enough people in Europe mostly England and the Americas who thought that slavery was immoral and were vocal enough about it that most Europeans were aware that the subject had been opened for debate  Whether or when any of this debate occurred in Africa I dont think we know,1,cdpjwy3,1rp6v4,askhistorians,top_day,5,4
GHboy,The moral culpability of African rulers is a loaded and subjective question whose answer depends on perspectiveIts a complex interplay of the two European powers specifically set up forts on coastal areas to purchase slaves However they could not have purchased slaves without a sellerIn addition to buying slaves from freelance slave catchers Europeans also bought slaves who were POWs and refugees from kingdoms such as the Ashanti KingdomhttpenwikipediaorgwikiAshantiEmpireConsidering the extreme profitability of the slave trade in the Americas it was in European interest to have Africans fighting as it supplied a steady stream of slaves It was in the Africans interest to sell slaves as to acquire guns so as to not be enslaved by their enemiesIf an African kingdom had refused to cooperate and sell slaves the European powers would have simply armed the competing tribekingdom So the Africans had to play ball whether they wanted to or not and some states like the expansionary Ashanti empire definitely wanted to play ballSecondly tribes never actually sold their own people They sold other tribes from further inland So Im not sure if consent is even applicable Its fairly easy to consent to you enslaving my enemy,5,cdphw56,1rp6v4,askhistorians,top_day,4,-1
Moorkh,In India there is a concept called Bhookh Hartal literally hunger strike When people go on strikeprotest they sometimes declare that they wont eat food until their demands are met This is essentially negotiatingblackmailing with a gun to your own head It is supposed show how dedicated the person is to the goal even willing to give up hisher life for it Gandhi did essentially the same thing The example i can think of is the time he went on a fast unless the hindus and muslims stopped the riots in Kolkata  The hindus and many muslims venerated him and would not have wanted him to die and the separatist muslims were probably scared of the backlash his death would have created he was thus able to bring peace to a riot hit and communally charged place by threatning self harm,0,cdpjrgm,1rp7oh,askhistorians,top_day,2,2
MathuinRua,Its quite simple CE amp BCE common era before common era have no religious connetations in comparision with the religion heavy BC and AD Before Chtist and Anno DominiIt was developed in westren culture and to avoid potentially having to change all dates when converting from AD to CE the same refrence point in time was used It creates a standard which can be used world wide in history circles regardless of religious calender usedSource httpwwwreligioustoleranceorgceinfohtmEdit western culture not a western,0,cdpnbx4,1rp8oa,askhistorians,top_day,11,11
Daeres,This is a topic that has come up a number of times before in the subreddit At the risk of bigging myself up one of the comments in this thread is my own this threadhttpwwwredditcomrAskHistorianscommentskbhavehistoriansofficiallyswitchedtothebcece had quite an extensive discussion of the topic This threadhttpwwwredditcomrAskHistorianscommentstabjisbceceorbcadmorepopularamongcontemporary also turns out to have a comment by me It is an older thread and moderation of comments was not quite as effective as it is now Nonetheless it also contains a number of interesting discussions on the issueMy answer to you specifically is that the BCECE system is precisely intended as a secularised alternative to BCAD that doesnt confuse current dates  is still  whether it has AD or CE after it This means that switching from one to the other would not confuse anybody But this also means that for some people like me there isnt a big difference either way and I if I were reading an essay you had written would simply want you to remain consistent one way or the other But there are others who feel much more strongly about the issue one way or the other I have not found that this is truly standardised across history as a discipline as much as many academics believe it to be but as I said in one of the linkedto threads there is no unifying constitution for history and any new approaches are adopted piecemeal rather than consistently,3,cdpo2xk,1rp8oa,askhistorians,top_day,12,9
lucaslavia,It depend on where you draw the line for philosophy because to me there are no Egyptian philosophers Pythagoras and Thales are both alleged to have had Egyptian teachers by Diogenes Laertius who is less than reputable Diogenes writes in rd century c years after Pythagoras and c years after Thales In this time Egyptian religion was still running but as an esoteric and pagan mystery That said Egyptian priests were revered by Greeks as sources of wisdom and knowledge Herodotus is a good example so its not inconceivable  although it would require a great deal of wealth to travel to Egypt for trainingNow Egyptian philosophy the closest area of Egyptian text worth looking at  the moralising didactic texts known as instructions  These dont conform to what western tradition Greeks et al considers philosophy The instructions are moral codes written in line with the state ideology of Maat theres no discussion or any form of exegesis around them theyre more like an etiquette handbook for men Some of these texts like the Instructions of Ptahhotep or Kagemni or Amenemhet became really popular and were repeatedly copied in a manuscript tradition There is a debate over the extent to which it was the state encouraging the repeated copying of these texts and whether they actually designed by the state in the first place as part of an intellectual campaign to reinforce state ideology in every aspect of a literate Egyptians lifeif you should be one of those sitting as guests at a table of someone who is greater than you accept what he serves when it is placed in front of youand do not state at himfor to force yourself upon him is an irritation to his spiritif you are a man entrusted with responsiblitybe meticulous in your duty when he sends you and deliver his message as he dictates itobserve the truth and do not surpass itA relief fragment the Daressy fragment from the New Kingdom shows several of these authors being venerated particularly the so called dead sages names in P Chester Beatty  Neferti wrote the Prophecies of Neferti Khety instructions of Khety Ptahhotep Hordedef instructions of horededef Imhotep unknown Kaires possibly loyalist teaching and Khakeperreseneb lamentation These are being venerated as pinnacles of knowledge and wisdom of the world was to be studied consumed and obeyed,2,cdpjxba,1rp98a,askhistorians,top_day,17,15
backmarkerSE,Yes there were wars between Aboriginal Australians  We have some evidence for this  The existence of wooden shields  Shields only exist in order to block the weapons of others and do not have utility for hunting unlike knives and clubs so therefore demonstrate that fighting was taking place Australian rock art dating back at least  years depicts fighting scenes using weaponry Research by anthropologists since the midth century has witnessed wars between Aboriginal Australian tribes  Not only did wars take place over hunting territory or ownership of wells but also over the abduction of womenThese conflicts between tribes often resulted in longrunning feuds as a result of payback law whereby a raid will cause retaliation from the other tribe  These could be devastating  anthropologist TGH Strelow witnessed a three year conflict that killed  of the population of the tribes conducting the warI am no anthropologist myself so you might get a better response from  rAnthropologyhttpwwwredditcomrAnthropology but as far as I understand it Aboriginal Australian tribes did not structure themselves in such a way that would result in a kingslordssubjects relationship and war was not fought for these reasons  Aboriginal Australian tribes were led by the elders of the group and they fought to defendgain hunting landaccess to waterwomen not to subjugate other people  But as I say rAnthropologyhttpwwwredditcomrAnthropology may know better than meSource Azar Gat War in Human Civilization pp ,10,cdpibt0,1rpacu,askhistorians,top_day,44,34
randomcharacters,There is evidence that on French Island in Victoria one tribe massacred the other off the island,3,cdpjacn,1rpacu,askhistorians,top_day,7,4
ThurgoodMarshall,Going off this is there any area of significant size where people didnt fight over resources I certainly cant think of any,0,cdpm5rv,1rpacu,askhistorians,top_day,3,3
