author,comment,distinguished,downs,id,post,subreddit,type,ups
Doe22,"If I can piggyback on this question, would a slave in the situation described by /u/Fuglewarrior be more likely to learn ""standard"" English (that's probably not the right way to describe it, but I can't think of a better term) or some sort of pidgin or creole language that combined African language(s) with English?  I imagine this would vary based on location, time, and the intended use of said slave, but I'm curious.",null,7,cdplwk1,1rpl4t,askhistorians,top_day,33
LordSariel,"It has an extremely high variance depending on what kind of environment you're in. Atlantic World Historian Ira Berlin has said something to the effect of ""To know a person is a slave is to know only their legal status."" And I stand by this from my own research in the Atlantic World. The experience of slaves cannot be so easily generalized, even within the very clear lens of British Colonial North America. Even there, a number of different crops were grown between 1500 and 1700, and slaves were subjected to different legal and social privileges that effected their socialization and cultural melding with the settler population.

As predominantly mentioned in Berlin's book, *Many Thousands Gone: The First Two Centuries of Slavery in North America* the question of language has many factors. The most prominent of these factors is how many captured Africans spoke your same language. This would effect the actual sales pool upon reaching the Colonies. 

Beyond that, the geographic region in which you arrive, in which in time you arrive, further has a huge effect on your cultural integration. Urban slaves generally had more autonomy, and were required to socialize faster because they were usually in extremely small numbers in close quarters with settlers. 

Rural farmers could still have 1 - 10 slaves, from many diverse regions, forcing them to learn a common language (usually English). Large planters, largely in the southern states that had a year-round climate for agriculture, could have anywhere from 10 - 200 slaves (even in the Early Colonial years) and they would be less likely to develop any kind of propensity for English in the first generation. 

In other areas of the Caribbean, the native language of the slave-holding class was much less adopted because in places like Brazil, Haiti, etc. slaves were imported in such mass numbers, and less care was given to their survival. Generally speaking these areas has a much larger population of native Africans at any times. This differs from British Colonial North America in that the class of ""African Americans"" rose much sooner out of the imported population.

For more information read Ira Berlin's book. He goes into **much** more detail based on Geographic region, type of work, type of crops grown, as well as the politics of the time. It's a beautiful mix of social, political, and economic history that transcends national boundaries to give you an exhaustively thorough look into what slavery was like everywhere in British Colonial North America.

I can elaborate a bit more later, but for now I have to shoot out for errands! Sorry for the quick and dirty response. Expect some clarifying edits later.",null,7,cdpp97v,1rpl4t,askhistorians,top_day,28
RamblinRambo,"I'd like to answer this from a personal experience point of view. Sure enough the world has changed and there are a lot of new resources out there but the main principle of learning by doing hasn't changed. I've moved countries a few times and I've never learned a language through class. I've learned it by listening, pointing, asking and picking up words as you go. And I know a good few others that have done the same.

It is important to note that for some people it takes longer and for some it takes less time. Some are just simply much more talented in picking up and understanding new languages. Exactly like some people are more skilled in maths than others, some are more skilled in athletics and so on.

If you try and are completely surrounded by a new foreign language I'd say it takes on average 1 year to learn an acceptable level to be able to speak and converse. If the language is close to another language you already know then it might take less than six months. But if we analyse it from the perspective of being completely different it takes at least a year. Once you get the basics you'll learn faster.

One universal thing I've noticed is that people understand each other very well through basic sign language. It is actually amazing.

My grandfather moved as a 16 year old boy with his brother to a country where they did not know a single word. It was back in the day when english wasn't a common denominator as it is in much of the world today. I remember a story from him on how he agreed to rent an apartment, pay rent, found a job etc. with just basic sign language.

And I'd argue that nothing has changed since early history to today if you take away classes and education. If you set out to learn a language by doing you'll go through the exact same process. I've done this myself.

Only thing we need to think of when it comes to slaves is their ability or freedom to communicate with others that spoke english. If they were heavily tied to one owner and their farm then it might have taken 3-4 years instead of one. It all ties in with exposure to the language. So I'd expect heavy correlation with exposure to the language and it will have been case specific. Also, if there were a lot of slaves that spoke a common language it might mean that some of them never learned the new language. You can see this in any areas even today where you have a lot of immigrants from the same part of the world. Say china towns that have people that don't speak a word of english even if they're been in an english speaking country for years.",null,0,cdq593u,1rpl4t,askhistorians,top_day,1
Doe22,"If I can piggyback on this question, would a slave in the situation described by /u/Fuglewarrior be more likely to learn ""standard"" English (that's probably not the right way to describe it, but I can't think of a better term) or some sort of pidgin or creole language that combined African language(s) with English?  I imagine this would vary based on location, time, and the intended use of said slave, but I'm curious.",null,7,cdplwk1,1rpl4t,askhistorians,top_day,33
LordSariel,"It has an extremely high variance depending on what kind of environment you're in. Atlantic World Historian Ira Berlin has said something to the effect of ""To know a person is a slave is to know only their legal status."" And I stand by this from my own research in the Atlantic World. The experience of slaves cannot be so easily generalized, even within the very clear lens of British Colonial North America. Even there, a number of different crops were grown between 1500 and 1700, and slaves were subjected to different legal and social privileges that effected their socialization and cultural melding with the settler population.

As predominantly mentioned in Berlin's book, *Many Thousands Gone: The First Two Centuries of Slavery in North America* the question of language has many factors. The most prominent of these factors is how many captured Africans spoke your same language. This would effect the actual sales pool upon reaching the Colonies. 

Beyond that, the geographic region in which you arrive, in which in time you arrive, further has a huge effect on your cultural integration. Urban slaves generally had more autonomy, and were required to socialize faster because they were usually in extremely small numbers in close quarters with settlers. 

Rural farmers could still have 1 - 10 slaves, from many diverse regions, forcing them to learn a common language (usually English). Large planters, largely in the southern states that had a year-round climate for agriculture, could have anywhere from 10 - 200 slaves (even in the Early Colonial years) and they would be less likely to develop any kind of propensity for English in the first generation. 

In other areas of the Caribbean, the native language of the slave-holding class was much less adopted because in places like Brazil, Haiti, etc. slaves were imported in such mass numbers, and less care was given to their survival. Generally speaking these areas has a much larger population of native Africans at any times. This differs from British Colonial North America in that the class of ""African Americans"" rose much sooner out of the imported population.

For more information read Ira Berlin's book. He goes into **much** more detail based on Geographic region, type of work, type of crops grown, as well as the politics of the time. It's a beautiful mix of social, political, and economic history that transcends national boundaries to give you an exhaustively thorough look into what slavery was like everywhere in British Colonial North America.

I can elaborate a bit more later, but for now I have to shoot out for errands! Sorry for the quick and dirty response. Expect some clarifying edits later.",null,7,cdpp97v,1rpl4t,askhistorians,top_day,28
RamblinRambo,"I'd like to answer this from a personal experience point of view. Sure enough the world has changed and there are a lot of new resources out there but the main principle of learning by doing hasn't changed. I've moved countries a few times and I've never learned a language through class. I've learned it by listening, pointing, asking and picking up words as you go. And I know a good few others that have done the same.

It is important to note that for some people it takes longer and for some it takes less time. Some are just simply much more talented in picking up and understanding new languages. Exactly like some people are more skilled in maths than others, some are more skilled in athletics and so on.

If you try and are completely surrounded by a new foreign language I'd say it takes on average 1 year to learn an acceptable level to be able to speak and converse. If the language is close to another language you already know then it might take less than six months. But if we analyse it from the perspective of being completely different it takes at least a year. Once you get the basics you'll learn faster.

One universal thing I've noticed is that people understand each other very well through basic sign language. It is actually amazing.

My grandfather moved as a 16 year old boy with his brother to a country where they did not know a single word. It was back in the day when english wasn't a common denominator as it is in much of the world today. I remember a story from him on how he agreed to rent an apartment, pay rent, found a job etc. with just basic sign language.

And I'd argue that nothing has changed since early history to today if you take away classes and education. If you set out to learn a language by doing you'll go through the exact same process. I've done this myself.

Only thing we need to think of when it comes to slaves is their ability or freedom to communicate with others that spoke english. If they were heavily tied to one owner and their farm then it might have taken 3-4 years instead of one. It all ties in with exposure to the language. So I'd expect heavy correlation with exposure to the language and it will have been case specific. Also, if there were a lot of slaves that spoke a common language it might mean that some of them never learned the new language. You can see this in any areas even today where you have a lot of immigrants from the same part of the world. Say china towns that have people that don't speak a word of english even if they're been in an english speaking country for years.",null,0,cdq593u,1rpl4t,askhistorians,top_day,1
jetboyterp,"From the [Franklin Institute](http://www.fi.edu/franklin/birthday/faq.html#21)...a letter from Benjamin Franklin to his daughter:

&gt;“For my own part I wish the Bald Eagle had not been chosen the Representative of our Country. He is a Bird of bad moral Character. He does not get his Living honestly. You may have seen him perched on some dead Tree near the River, where, too lazy to fish for himself, he watches the Labour of the Fishing Hawk; and when that diligent Bird has at length taken a Fish, and is bearing it to his Nest for the Support of his Mate and young Ones, the Bald Eagle pursues him and takes it from him.
&gt; 
&gt;With all this injustice, he is never in good case but like those among men who live by sharping &amp; robbing he is generally poor and often very lousy. Besides he is a rank coward: The little King Bird not bigger than a Sparrow attacks him boldly and drives him out of the district. He is therefore by no means a proper emblem for the brave and honest Cincinnati of America who have driven all the King birds from our country…
&gt; 
&gt;“I am on this account not displeased that the Figure is not known as a Bald Eagle, but looks more like a Turkey. For the Truth the Turkey is in Comparison a much more respectable Bird, and withal a true original Native of America… He is besides, though a little vain &amp; silly, a Bird of Courage, and would not hesitate to attack a Grenadier of the British Guards who should presume to invade his Farm Yard with a red Coat on.”

Franklin didn't seem a fan of the bald eagle as the national symbol...but he only held up the turkey to compare to the eagle's character.",null,64,cdpn6jh,1rplq1,askhistorians,top_day,282
Jabbawookiee,"Caleb Rossiter wrote The Turkey and the Eagle: The Struggle for America's Global Role.

In it, it is explained that it is *not* true that Franklin proposed the wild turkey in 1776, but later, 1782, ""castigated the decision by the Congress of the Confederation to adopt the bald eagle as the symbol of the United States.""  He believed the eagle lived by ""Sharping &amp; Robbing.""  However, Franklin did suggest the turkey as the national symbol in ""tongue-in-cheek"" fashion.

[Text.](http://books.google.com/books?id=ig_CYgxRU68C&amp;pg=PA8&amp;lpg=PA7&amp;ots=u5xzbom7oc&amp;focus=viewport&amp;dq=1776+franklin+turkey&amp;output=html_text)
",null,26,cdpn2hd,1rplq1,askhistorians,top_day,111
tinyshadow,"This is one of my favorite pieces of American history! Benjamin Franklin wrote his daughter about using the eagle as the symbol for America in 1784. Now, the eagle had been chosen to be on the Great Seal since 1782 when Congress officially adopted it. /u/jetboyterp has the letter below. You can also find this letter reprinted everywhere nowadays, but one of the earlier places that I've found it in [the New York Literary Gazette from 1827 here.](http://books.google.com/books?id=FTkZAAAAYAAJ&amp;pg=PA57&amp;lpg=PA57&amp;dq=For+my+own+part+I+wish+the+Bald+Eagle+had+not+been+chosen+the+Representative+of+our+Country&amp;source=bl&amp;ots=czKBZOGUr_&amp;sig=NXnAiSQ39j6jnDIS5DdYNttVGJA&amp;hl=en&amp;sa=X&amp;ei=KMuYUvOrA5HzoASmmoCgBw&amp;ved=0CE0Q6AEwBg#v=onepage&amp;q=For%20my%20own%20part%20I%20wish%20the%20Bald%20Eagle%20had%20not%20been%20chosen%20the%20Representative%20of%20our%20Country&amp;f=false))

In all my research, I've never come across this notorious turkey vs. eagle vote. What actually seems to have happened is that, in June 1782, Congress asked  Charles Thomson, the Secretary of the Continental Congress for eight years, to design the Great Seal of the United States. He took advice from the committees within Congress and first described the seal as such:

* On a field       Chevrons composed of seven pieces on one side &amp; six on the other, joined together at the top in such wise that each of the six bears against or is supported by &amp; supports two of the opposite side the pieces of the chevrons on each side alternate red &amp; white. The shield born on the breast of an American Eagle on the wing &amp; rising proper. In the dexter talon of the Eagle an Olive branch &amp; in the sinister a bundle of Arrows. Over the head of the Eagle a Constellation of Stars surrounded with bright rays and at a little distance clouds. Motto In the bill of the Eagle a scroll with these words E pluribus unum. 
* (Source: You can find this many places, but one of them is [The History of the Seal of the United States from 1909](http://books.google.com/books?id=jUZmAAAAMAAJ&amp;pg=PA34&amp;lpg=PA34&amp;dq=On+a+field+Chevrons+composed+of+seven+pieces+on+one+side+%26+six+on+the+other,&amp;source=bl&amp;ots=C87yE2byri&amp;sig=A97cKqiIxYwQfXE3bD80h2T2PwI&amp;hl=en&amp;sa=X&amp;ei=4NKYUrjCBceEoQTop4HADw&amp;ved=0CDAQ6AEwAg#v=onepage&amp;q=On%20a%20field%20Chevrons%20composed%20of%20seven%20pieces%20on%20one%20side%20%26%20six%20on%20the%20other%2C&amp;f=false).)

The important parts for this question are the repeated use of ""eagle."" By 1782, Americans had already established the importance of the eagle to the colonies. The Magazine of American History suggests that as early as 1779 that John Adams had chosen the eagle to be America's emblem. 

* In the autumn of 1779, John Adams was sent to England to negotiate for peace. Among the eminent people whom he met was Sir John Prestwick, a baronet of the north of England, a friend of the Americans... In a discussion of the subject of the national coat of arms so long awaiting decision, Sir John suggested an escutcheon bearing thirteen perpendicular stripes, repeating the idea of the national banner. He proposed, according to the narrative cited, that in order to give it consequence it should be placed on the breast of the displayed American eagle without supporters, as emblematic of self-reliance. 
* (Source: [Magazine of American History from 1893](http://books.google.com/books?id=v0xIAAAAYAAJ&amp;pg=PA482&amp;lpg=PA482&amp;dq=Chevrons+composed+of+seven+pieces+on+one+side+%26+six+on+the+other,+joined+together&amp;source=bl&amp;ots=FeEelb4e_h&amp;sig=XcJ6grxKhk53VfLJyiGifyqBimA&amp;hl=en&amp;sa=X&amp;ei=bMyYUsYs0NygBOyTgfAF&amp;ved=0CDAQ6AEwAQ#v=snippet&amp;q=1779%20eagle&amp;f=false).)

While there are any number of reasons why the colonies chose the eagle, all in all, it may come down to a positive association with the bird and other already existing emblems. After all, the eagle was commonly used in Europe as a symbol in coat of arms at the time. Also - when the Society of Cincinnati formed in 1783, the eagle became its most popular symbol. According to the Society's museum website:

* Designed by Pierre L'Enfant, the first Eagles were made in Paris in 1784 by Duval and Francastel [and sent to America for the Society.]
* The museum collections include more than thirty-five examples, foremost among them the Diamond Eagle, which French naval officers commissioned for George Washington in 1784 and became the badge of office of the Society's president general. 
* (Source: [The Society of Cincinnati Archives and Museum](http://societyofthecincinnati.org/collections/museum_collections/sotc).)

It's not surprising that as soon as the eagle came into the imagery of the United States of America that it was often repeated and with great respect. The new nation was being forged out of disparate peoples and needed such symbols to reinforce their separation from England as well as unify the colonies into states.

tl;dr - *The showdown choice between turkey and eagle did not happen. Instead, the eagle appears to have emerged as the frontrunner for several great emblems before being chosen in the Great Seal and thus America. In the 1780s, the eagle was on the mind of many Americans... except Benjamin Franklin, who called it a scavenging lazy coward.*",null,10,cdpnodj,1rplq1,askhistorians,top_day,83
FakestAlt,"No.

The Eagle was first used as an official national symbol with the adoption of the [Great Seal](http://en.wikipedia.org/wiki/Great_Seal_of_the_United_States). There was no Eagle v. Turkey vote in this process. It went through several committees which expanded on the original idea and after years developed a symbol which was approved by Congress. Congress was never presented a turkey alternate nor am I aware of, or can I find, anything suggesting one of these committees ever considered a turkey. 

While it's true that Frankling [penned some negative words](http://www.americanheraldry.org/pages/index.php?n=MMM.Turkey) about the eagle this was not in regards to a national bird or the Great Seal. The quotes come from a 1784 letter to his daughter, not a public campaign against the eagle. ",null,6,cdpn4rb,1rplq1,askhistorians,top_day,25
null,null,null,13,cdprh01,1rplq1,askhistorians,top_day,5
jetboyterp,"From the [Franklin Institute](http://www.fi.edu/franklin/birthday/faq.html#21)...a letter from Benjamin Franklin to his daughter:

&gt;“For my own part I wish the Bald Eagle had not been chosen the Representative of our Country. He is a Bird of bad moral Character. He does not get his Living honestly. You may have seen him perched on some dead Tree near the River, where, too lazy to fish for himself, he watches the Labour of the Fishing Hawk; and when that diligent Bird has at length taken a Fish, and is bearing it to his Nest for the Support of his Mate and young Ones, the Bald Eagle pursues him and takes it from him.
&gt; 
&gt;With all this injustice, he is never in good case but like those among men who live by sharping &amp; robbing he is generally poor and often very lousy. Besides he is a rank coward: The little King Bird not bigger than a Sparrow attacks him boldly and drives him out of the district. He is therefore by no means a proper emblem for the brave and honest Cincinnati of America who have driven all the King birds from our country…
&gt; 
&gt;“I am on this account not displeased that the Figure is not known as a Bald Eagle, but looks more like a Turkey. For the Truth the Turkey is in Comparison a much more respectable Bird, and withal a true original Native of America… He is besides, though a little vain &amp; silly, a Bird of Courage, and would not hesitate to attack a Grenadier of the British Guards who should presume to invade his Farm Yard with a red Coat on.”

Franklin didn't seem a fan of the bald eagle as the national symbol...but he only held up the turkey to compare to the eagle's character.",null,64,cdpn6jh,1rplq1,askhistorians,top_day,282
Jabbawookiee,"Caleb Rossiter wrote The Turkey and the Eagle: The Struggle for America's Global Role.

In it, it is explained that it is *not* true that Franklin proposed the wild turkey in 1776, but later, 1782, ""castigated the decision by the Congress of the Confederation to adopt the bald eagle as the symbol of the United States.""  He believed the eagle lived by ""Sharping &amp; Robbing.""  However, Franklin did suggest the turkey as the national symbol in ""tongue-in-cheek"" fashion.

[Text.](http://books.google.com/books?id=ig_CYgxRU68C&amp;pg=PA8&amp;lpg=PA7&amp;ots=u5xzbom7oc&amp;focus=viewport&amp;dq=1776+franklin+turkey&amp;output=html_text)
",null,26,cdpn2hd,1rplq1,askhistorians,top_day,111
