author,comment,distinguished,downs,id,post,subreddit,type,ups
LotoSage,[Benjamin Harrison](https://www.youtube.com/watch?v=pU4gGEL5c8g) ,null,2,cdp84o3,1ro73k,askhistorians,top_day,16
Axon350,"[A little while ago](http://www.reddit.com/r/AskHistorians/comments/1ozb35/who_was_the_first_us_president_to_have_his/ccx9me5?context=3) I talked about the first photograph of a sitting US President. You can see some links in that post.

The earliest surviving photo of a president in office is of James K. Polk. There are a couple undated photos of him, so the order is unclear, but they were almost certainly taken while he was in office because he died just three months after leaving.

Those are the earliest *surviving* (in digitized form, you'd be surprised what you can find in books) photos of a sitting President. Yet there is a mysterious photo of John Tyler. Wikipedia says that Polk was the first to be photographed in office (without citation) but has in its article a photo of Tyler, purportedly taken by Anthony, Edwards, &amp; Co. A press release from March 17, 1845 in the New York Herald talks about an exhibition of pictures taken by Anthony, Edwards, &amp; Co. and mentions a portrait of 'ex-President John Tyler'. The portrait is not described and neither is the date on which it was captured. Another press release mentions the gallery on March 13, implying that it was a multi-day event. Tyler only left office on March 4. 

It is possible that a photo of Tyler was indeed taken while he was still in office. Further corroborating this is a brief blurb here at the Encyclopedia Virginia which mentions an advertisement from 1844 from Anthony, Edwards, &amp; Co. claiming to have photographed Tyler. It is as yet unclear when exactly the existing daguerreotype of Tyler was taken, though I conclude that it is certainly possible for him to have been photographed in office.

Here, on the other hand, is the largely undisputed [first photograph of any US President, John Quincy Adams.](http://upload.wikimedia.org/wikipedia/commons/1/1b/John_Quincy_Adams_-_copy_of_1843_Philip_Haas_Daguerreotype.jpg) ",null,2,cdpcwce,1ro73k,askhistorians,top_day,11
LotoSage,[Benjamin Harrison](https://www.youtube.com/watch?v=pU4gGEL5c8g) ,null,2,cdp84o3,1ro73k,askhistorians,top_day,16
Axon350,"[A little while ago](http://www.reddit.com/r/AskHistorians/comments/1ozb35/who_was_the_first_us_president_to_have_his/ccx9me5?context=3) I talked about the first photograph of a sitting US President. You can see some links in that post.

The earliest surviving photo of a president in office is of James K. Polk. There are a couple undated photos of him, so the order is unclear, but they were almost certainly taken while he was in office because he died just three months after leaving.

Those are the earliest *surviving* (in digitized form, you'd be surprised what you can find in books) photos of a sitting President. Yet there is a mysterious photo of John Tyler. Wikipedia says that Polk was the first to be photographed in office (without citation) but has in its article a photo of Tyler, purportedly taken by Anthony, Edwards, &amp; Co. A press release from March 17, 1845 in the New York Herald talks about an exhibition of pictures taken by Anthony, Edwards, &amp; Co. and mentions a portrait of 'ex-President John Tyler'. The portrait is not described and neither is the date on which it was captured. Another press release mentions the gallery on March 13, implying that it was a multi-day event. Tyler only left office on March 4. 

It is possible that a photo of Tyler was indeed taken while he was still in office. Further corroborating this is a brief blurb here at the Encyclopedia Virginia which mentions an advertisement from 1844 from Anthony, Edwards, &amp; Co. claiming to have photographed Tyler. It is as yet unclear when exactly the existing daguerreotype of Tyler was taken, though I conclude that it is certainly possible for him to have been photographed in office.

Here, on the other hand, is the largely undisputed [first photograph of any US President, John Quincy Adams.](http://upload.wikimedia.org/wikipedia/commons/1/1b/John_Quincy_Adams_-_copy_of_1843_Philip_Haas_Daguerreotype.jpg) ",null,2,cdpcwce,1ro73k,askhistorians,top_day,11
rosemary85,"This question has a had a couple of OK discussions in the past; I'll settle for posting the links rather than copy-and-pasting a post I made in one of them:

* [Was the Bronze Age Collapse caused more by invasions and migrations, or climatic events?](http://www.reddit.com/r/AskHistorians/comments/1oba8g/was_the_bronze_age_collapse_caused_more_by/)

* [Why were the Phoenicians spared the ravages of the Bronze Age collapse?](http://www.reddit.com/r/AskHistorians/comments/10eqj3/why_were_the_phoenicians_spared_the_ravages_of/)

[And there's a section in our FAQ on the Sea Peoples](http://www.reddit.com/r/AskHistorians/wiki/antiquity#wiki_sea_peoples.3A_who_were_they.2C_where_did_they_come_from.3F) -- there's no real reason to bring them into the question, though. ""X happened in one part of the world within a century of Y happening somewhere else"" doesn't imply that X and Y are causally related. It's just that the scarcity of evidence sometimes leads people to assume that they're somehow connected.

**Edit.** By the way, the normal interpretation of the ""Palestinians"" in the Merneptah inscription (not Ramesses III; his run-in with ""peoples from the sea"" was a few decades later) is that the *Peleset* later settled in what subsequently became ""Palestine"", not that they came from there.",null,0,cdp7hiq,1ro87w,askhistorians,top_day,5
anotherkeebler,"I'd be grateful if someone could comment on the assertion that since bronze *required* trade (since it's composed of two different metals whose ores are rarely found in the same location), and iron did not, trade routes weakened, promoting isolationism by removing commercial and other interdependencies.",null,0,cdpbkdz,1ro87w,askhistorians,top_day,1
rosemary85,"This question has a had a couple of OK discussions in the past; I'll settle for posting the links rather than copy-and-pasting a post I made in one of them:

* [Was the Bronze Age Collapse caused more by invasions and migrations, or climatic events?](http://www.reddit.com/r/AskHistorians/comments/1oba8g/was_the_bronze_age_collapse_caused_more_by/)

* [Why were the Phoenicians spared the ravages of the Bronze Age collapse?](http://www.reddit.com/r/AskHistorians/comments/10eqj3/why_were_the_phoenicians_spared_the_ravages_of/)

[And there's a section in our FAQ on the Sea Peoples](http://www.reddit.com/r/AskHistorians/wiki/antiquity#wiki_sea_peoples.3A_who_were_they.2C_where_did_they_come_from.3F) -- there's no real reason to bring them into the question, though. ""X happened in one part of the world within a century of Y happening somewhere else"" doesn't imply that X and Y are causally related. It's just that the scarcity of evidence sometimes leads people to assume that they're somehow connected.

**Edit.** By the way, the normal interpretation of the ""Palestinians"" in the Merneptah inscription (not Ramesses III; his run-in with ""peoples from the sea"" was a few decades later) is that the *Peleset* later settled in what subsequently became ""Palestine"", not that they came from there.",null,0,cdp7hiq,1ro87w,askhistorians,top_day,5
anotherkeebler,"I'd be grateful if someone could comment on the assertion that since bronze *required* trade (since it's composed of two different metals whose ores are rarely found in the same location), and iron did not, trade routes weakened, promoting isolationism by removing commercial and other interdependencies.",null,0,cdpbkdz,1ro87w,askhistorians,top_day,1
davratta,"That  would  be  Kluck's  infamous  left  turn.  He  was  supposed  to  keep  marching  west  and  encircle  Paris,  but  Kluck  and  his  superior,  Molke,  were  both  very  concerned  with  the  gap  between  the  First  and  Second  Army.  A  French  observation  plane  noticed  this  change  in  direction  of  Kluck's  army.   Joffre  was  able  to  order  the  BEF  to  advance  into  this  gap,  while  attacking  Kluck's  flank  with  French  troops  from  Paris.        
      However,  you  can  blame  Hemulth  von  Molke  for  detaching  two  corps  from  the  first  army  to bolster  the  German  Eighth  army  in  east  Prussia.   You  can  also  blame  Molke's  tinkering  with  the  Schiliffen  plan.  He  augmented  the  fourth  and  fifth  armies  and  made  the  center  of  his  line  stronger.  The  Italians  did  not  declare  war  and  did  not  send  the  six  corps  that  were  suppossed  to   join  the  German  seventh  army  that  guarded  the  Rhine  river.  So  Kluck  went  into  the  battle  of  the  Marne  with  fourteen  fewer  divisions  than  Schiliffen  intended.  Molke  did  not  keep  the  right  wing  strong  and  ignored  the  dying  words  of  the  plan's  developer.   The  two  corps  Molke  detached  from  the  first  army  were  to  late  for  the  decisive  battle  of  Tannenburg,  but  did  help  the  Germans  kick  butt  at  the  battle  of  Masurian  Lakes  two  weeks  latter.  These  two  major  victories  stopped  the  Russian  steam  roller  and  destroyed  Russia's  Second  army.     
Sources  DJ  Goodspeed  ""The  German  Wars""   and  Barbara  Tuchman  ""The  Guns  of  August""    ",null,0,cdp7ww5,1roaf9,askhistorians,top_day,3
AllanBz,"Chariots did not require large horse breeds; charioteers could yoke together a team of small-breed horses to pull a chariot.

A chariot would have a driver and a warrior. One person could focus on driving, one on spear or arrow work, instead of dividing a single person's attention among horse work and fighting.",null,0,cdphbjf,1roeck,askhistorians,top_day,5
null,null,null,3,cdp8p1x,1roeck,askhistorians,top_day,1
BeondTheGrave,"The pacts were really aimed at Nazi Germany, so the Soviet invasion (which was a *complete* surprise) didnt really trigger the alliance. 

*But*, because of Poland and the later invasion of Finland, the British and French were very interested in bombing the Soviets, and possibly even providing troops to support the Finns. One of the early plans for the intervention into Norway (which was planned *before* the Nazis invaded, btw) was to deploy troops across Norway, which would serve as a bridgehead for deploying troops into Finland. 

Actually, the biggest reason why these plans fell through was the collapse of the Finnish resistance. But the Brits and France were really keen on attacking the Soviets. Of course, that all changed when the Norway was invaded, and later when France was attacked. ",null,1,cdpd6ww,1rog7o,askhistorians,top_day,2
john_andrew_smith101,"The short answer to your question is no. All of these occurrences were isolated incidents that happened for various reasons.

The long answer is, well, complicated. I don't quite like covering Russia with broad generalizations, since their society is so unique, but I think in this case it might work. Russia is a steppe country, whose borders are very long and open, making it vulnerable to the various horse tribes of the steppe. In order to counter this, Russian rulers tend to militarily expand in order to eliminate possible threats from the steppe. They also tend to consolidate and centralize power, using terror and violence when necessary. This is not so different from other European monarchs at the time, although it can be argued that the Russian methods were more thorough. And then sometimes the ruler was just plain mad, as it can be with any monarchy. Ivan the Terrible, for instance, was starting to go crazy at the time he killed his son. He didn't intentionally do it, and afterwards he  held his son in his arms, crying.

It's important to understand the situation many czars were in order to understand their actions. They were often threatened by war, rebellions, and coups. Sometimes this necessitated harsh policies. Peter and Catherine were certainly great rulers, but they ruled Russia with an iron fist. Peter brutally stamped out opposition to his western policies, and Catherine either manipulated or killed anyone who was a threat to her. Ivan the Terrible created the Oprichniki, which was the original secret police. These rulers were keenly aware of the political situation and did this not only to hold onto power, but to save their own skin. 

So now we're at Peter the Great. Peter asks his son to start preparing to become czar, while his son wants nothing to do with that. Peter had another son, but he needed to make sure that after he died that Alexei wouldn't get powerhungry and go after the throne anyway. He demands that Alexei become a monk; if he wants to be czar one day to join the army. Alexei flees from Russia to Vienna. This causes quite a stir among the nobility and Peter suspects his son of treason. He convinces his son to return on the false pretense of safety. After Alexei's return, Peter starts his inquisition, to root out all the ""traitors"" in Alexei's circle. His son is convicted then sentenced to death. He is instead tortured to death in an attempt to get more information.

Stalin's situation is also unique. He was also very concerned about the political atmosphere in Russia. He was also in the middle of a devastating war, and while it did give him some leverage among the general population, he could no longer afford to eliminate political threats in the military. Stalin's son was captured by the Germans. Hitler offered to trade him for Field Marshall Paulus, and Stalin replied ""I will not trade a Marshall for a Lieutenant."" While we can speculate on the various reasons Stalin abandoned his son, it is claimed by his daughter that Stalin believed his son deliberately surrendered, and was therefore a traitor.

The very long answer to your question is that Russian leaders might not have cultural background for killing their heirs, but they do have a history of autocracy and paranoia. Hopefully this answers your question.",null,10,cdphgz4,1roiae,askhistorians,top_day,35
john_andrew_smith101,"The short answer to your question is no. All of these occurrences were isolated incidents that happened for various reasons.

The long answer is, well, complicated. I don't quite like covering Russia with broad generalizations, since their society is so unique, but I think in this case it might work. Russia is a steppe country, whose borders are very long and open, making it vulnerable to the various horse tribes of the steppe. In order to counter this, Russian rulers tend to militarily expand in order to eliminate possible threats from the steppe. They also tend to consolidate and centralize power, using terror and violence when necessary. This is not so different from other European monarchs at the time, although it can be argued that the Russian methods were more thorough. And then sometimes the ruler was just plain mad, as it can be with any monarchy. Ivan the Terrible, for instance, was starting to go crazy at the time he killed his son. He didn't intentionally do it, and afterwards he  held his son in his arms, crying.

It's important to understand the situation many czars were in order to understand their actions. They were often threatened by war, rebellions, and coups. Sometimes this necessitated harsh policies. Peter and Catherine were certainly great rulers, but they ruled Russia with an iron fist. Peter brutally stamped out opposition to his western policies, and Catherine either manipulated or killed anyone who was a threat to her. Ivan the Terrible created the Oprichniki, which was the original secret police. These rulers were keenly aware of the political situation and did this not only to hold onto power, but to save their own skin. 

So now we're at Peter the Great. Peter asks his son to start preparing to become czar, while his son wants nothing to do with that. Peter had another son, but he needed to make sure that after he died that Alexei wouldn't get powerhungry and go after the throne anyway. He demands that Alexei become a monk; if he wants to be czar one day to join the army. Alexei flees from Russia to Vienna. This causes quite a stir among the nobility and Peter suspects his son of treason. He convinces his son to return on the false pretense of safety. After Alexei's return, Peter starts his inquisition, to root out all the ""traitors"" in Alexei's circle. His son is convicted then sentenced to death. He is instead tortured to death in an attempt to get more information.

Stalin's situation is also unique. He was also very concerned about the political atmosphere in Russia. He was also in the middle of a devastating war, and while it did give him some leverage among the general population, he could no longer afford to eliminate political threats in the military. Stalin's son was captured by the Germans. Hitler offered to trade him for Field Marshall Paulus, and Stalin replied ""I will not trade a Marshall for a Lieutenant."" While we can speculate on the various reasons Stalin abandoned his son, it is claimed by his daughter that Stalin believed his son deliberately surrendered, and was therefore a traitor.

The very long answer to your question is that Russian leaders might not have cultural background for killing their heirs, but they do have a history of autocracy and paranoia. Hopefully this answers your question.",null,10,cdphgz4,1roiae,askhistorians,top_day,35
farquier,"I should make people aware that the limits of Jared Diamond's _Guns, Germs, and Steel_ have been extensively discussed in the following section of the FAQs, although of course we always welcome new and insightful contributions:
http://www.reddit.com/r/AskHistorians/wiki/theory#wiki_historians.27_views_of_jared_diamond.27s_.22guns.2C_germs.2C_and_steel.22",null,0,cdpcwre,1rok9r,askhistorians,top_day,6
Searocksandtrees,"A popular question! Check out related posts in this section of the FAQ* for previous responses:

[Civilizations of the Americas](http://www.reddit.com/r/AskHistorians/wiki/nativeamerican#wiki_civilizations_of_the_americas)

*see the ""popular questions"" link on the sidebar, or the ""wiki"" tab above",null,0,cdperz4,1rok9r,askhistorians,top_day,4
Angiras,"Maybe you  should get the word out to university departments for editing work. I always got department emails on translation and this kind of stuff. 

 I don't see a professor leaping for this opportunity unless it aligned with his or her present research goals. Grad students are more likely to be interested for compensation. 

Edit: What do you exactly want? This is purely an oral history from an ex-soldier? Is this supported by documentation of any kind like a personal diary or letters? If it's an autobiography maybe you should just contact a ghost writer to hammer out the narrative.",null,0,cdpi8vo,1roncz,askhistorians,top_day,1
caffarelli,"Try contacting the Veterans History Project from the Library of Congress who may be able to put you in contact with someone doing an oral history in your area.  Your local archives are also a good resource, usually there is someone on staff trained in doing oral history. If you're really stuck shoot me a PM. We also have an oral history section in the links pages on our wiki. ",null,0,cdprvpx,1roncz,askhistorians,top_day,1
WhenTheRvlutionComes,"Mao ruled for a *really* long time - almost 30 years (1949-1976, besides perhaps an intermediate period after the great leap forward and before the cultural revolution in which he held little real power). The famine associated with the Great Leap Forward (simply ""The Great Chinese Famine) lasted only for years. Shocking as the 30 million death toll may seem, in terms of China's ~600 million population at the time, it was a drop in the bucket. Population levels soon rebounded. As for the Cultural Revolution, it was, proportionally, a much smaller affair. It's very simple, honestly. A quarter of a million mothers happened to spit out a billion or so children. Mao would've had to of killed a lot more people to outrace the birthrate - hundreds of millions, obviously. And, surprising as it may seem, Mao wasn't personally responsible for the majority of deaths on the period. Plenty died for banal reasons like a heart attack, or the Measels.

One thing in particular about Mao's term was that he encouraged mothers to have large broods of children, as he believed that a large population was good for the country. The consequent effects of rampant overpopulation in subsequent generations, of course, prompted the CCP's about face after Mao's death, towards the one child policy.",null,0,cdpi8uz,1ropf0,askhistorians,top_day,3
null,null,null,4,cdpebox,1ropf0,askhistorians,top_day,1
macroclemys,"1. Sundry items like first aid kits could be attached to it for ""hands-free"" carrying
2. Twigs and leaves could be inserted to help with camouflage.

Source: World War II Tactical Camouflage Techniques by Gordon Rottman, page 1939",null,89,cdpd9vb,1roqf1,askhistorians,top_day,605
OldRosieOnCornflakes,"I have a follow-up question related to armed forces headgear. 

In a few films, most obvious I can remember is The Guns of Navarone, and at HMS Belfast in London I've seen costumed forces (dummies in Belfast's case) wearing like a plain cloth cap that covers the head and shoulders over their standard uniform when 'in battle'. What is this for? It seemed to be particularly artillery operators in movies, but on Belfast I think there were some men wearing them in one of the battle computer rooms. 

Am I right in thinking it's some means of shielding the (probably expensive) uniform from smoke, exhaust fumes, dust etc when firing large weaponry? 

Not at home so can't get a screenshot of the film sorry.",null,7,cdpixu7,1roqf1,askhistorians,top_day,21
sillycheesesteak,"Two reasons:

The covering on the helmet was a camouflage of sorts, defeating glare off of helmets and breaking up the outline of the helmet. 

More importantly, it was to attach local foliage, grass, etc to your helmet that would help you blend in. The Japanese were the best at this, being quite adept at jungle warfare. ",null,0,cdpo6uu,1roqf1,askhistorians,top_day,5
null,null,null,6,cdpcjrd,1roqf1,askhistorians,top_day,6
null,null,null,1,cdpkoea,1roqf1,askhistorians,top_day,2
macroclemys,"1. Sundry items like first aid kits could be attached to it for ""hands-free"" carrying
2. Twigs and leaves could be inserted to help with camouflage.

Source: World War II Tactical Camouflage Techniques by Gordon Rottman, page 1939",null,89,cdpd9vb,1roqf1,askhistorians,top_day,605
OldRosieOnCornflakes,"I have a follow-up question related to armed forces headgear. 

In a few films, most obvious I can remember is The Guns of Navarone, and at HMS Belfast in London I've seen costumed forces (dummies in Belfast's case) wearing like a plain cloth cap that covers the head and shoulders over their standard uniform when 'in battle'. What is this for? It seemed to be particularly artillery operators in movies, but on Belfast I think there were some men wearing them in one of the battle computer rooms. 

Am I right in thinking it's some means of shielding the (probably expensive) uniform from smoke, exhaust fumes, dust etc when firing large weaponry? 

Not at home so can't get a screenshot of the film sorry.",null,7,cdpixu7,1roqf1,askhistorians,top_day,21
sillycheesesteak,"Two reasons:

The covering on the helmet was a camouflage of sorts, defeating glare off of helmets and breaking up the outline of the helmet. 

More importantly, it was to attach local foliage, grass, etc to your helmet that would help you blend in. The Japanese were the best at this, being quite adept at jungle warfare. ",null,0,cdpo6uu,1roqf1,askhistorians,top_day,5
null,null,null,6,cdpcjrd,1roqf1,askhistorians,top_day,6
null,null,null,1,cdpkoea,1roqf1,askhistorians,top_day,2
null,null,null,2,cdpk6qg,1rornx,askhistorians,top_day,5
revdon,"White fixtures and dress in the kitchen were meant to openly display the cleanliness of the establishment as opposed to the ""greasy spoon"" diner. White is hard to keep clean in a dirty kitchen and so became a symbol of nothing-to-hide and trustworthiness. Putting ""White"" in the name puts passersby in mind of same. ""Hey, that place has must be a safe place to eat, because it's implied in the name.""",null,0,cdq3hdh,1rornx,askhistorians,top_day,1
null,null,null,2,cdpk6qg,1rornx,askhistorians,top_day,5
revdon,"White fixtures and dress in the kitchen were meant to openly display the cleanliness of the establishment as opposed to the ""greasy spoon"" diner. White is hard to keep clean in a dirty kitchen and so became a symbol of nothing-to-hide and trustworthiness. Putting ""White"" in the name puts passersby in mind of same. ""Hey, that place has must be a safe place to eat, because it's implied in the name.""",null,0,cdq3hdh,1rornx,askhistorians,top_day,1
HallenbeckJoe,"For citizens of East Germany, it was relatively easy to go on a vacation in other Warsaw Pact nations, but it depended on the nation and, sometimes, on your record. Up to a million East Germans went on vacation in Warsaw Pact nations (esp. to Czechoslovakia, Hungary and the USSR) each year. Starting with the early 70s, you didn't need a visum to got to Poland and Czechoslovakia. For other countries, your visit/vacation needed to be granted by the GDR (not the state you were going to), which it was most of the time. Visiting the USSR individually was a bit more difficult, but possible too. ",null,3,cdphzrq,1rorqw,askhistorians,top_day,10
null,null,null,0,cdphn0y,1rorqw,askhistorians,top_day,5
