author,comment,downs,id,post,subreddit,type,ups,score
idjet,I think you are perhaps getting hung up on labels and definitions and we should clarify these so that you can understandCapitalism is very strictly defined as an economic system in terms of how economic value is created and stored profit is a byproduct of that Capitalism is generally viewed as having its origins in the late medieval period when we begin to see the creation of broad markets for labour and goods through the transformation of serfdom and bartering economy to monetary economyIts true that there has always been something for sale whether armour houses and castles However if we look closely at what was for sale in the European medieval period we would see the list of things bought and sold is short and very infrequently transacted The greater portion of the economy was what we would roughly call bartering  this was at the rural and village level In fact even taxes were paid in kind often as part of the harvest Remember that medieval society was predominantly agricultural Yes someone with money could by anything  but money was relatively rare For example there were whole regions of Southern France in year  where there were no mints creating coin  ie money note bartering is used loosely here to allow a short response  some will complainAs such from a modern financial perspective the financial transactions were stunted they have no accumulating value To explain as a farmer or as the noble who enserfed the farmer I could not store my wheat for several years waiting for an increase in the value of the commodity and trade it for charcoal or building limestone a year later  I had to trade it within its life or it goes mouldy I could not speculate in value and make a profit on the difference between my production costs and my sale value when wheat supplies were low Or as an blacksmith I would be working directly in the castle of the lord for whom I work but I am not paid in cash I am fed clothed I have a small home or just a room in the compound As a blacksmith I might also do some metal work for the local farmers because they are tending the lands owned by the noble I work for But I am not paid and neither are they There were large towns where money might be used but the overwhelmingly rural medieval population did not engage economically with cities in substantive cashSo how did this economy change to capitalismThe general idea held in economics is that the transition from feudal economics to capitalism was through the transformation of manorial serfdom to free holding tenanthttpenwikipediaorgwikiHistoryofcapitalismPrehistoryofcapitalism This is a point of argument for some and you may see responses to this post which argue differently But the point is still important this was the moment where the medieval serffarmer no longer paid in kind with his crops but he rented his land from landlord for cash and he could sell his crops at market for cash The landlord could evict him from the land for a higher paying tenant and the farmer could sell his crops for more to those who were willing to pay The farmer could invest in his farm so that it was more productive The landlord could take the cash and invest it where he likes perhaps in speculating in other lands or in other assets Its labour and assets that begin to have value not the crops themselvesAnd this is where we begin to see the fundamentals of capitalism in large scale lending in speculation in transforming serfdom and bartering into labourforwage relationships These things did not exist at large scale until after the medieval period None of this happened fast  there were many places in Europe that remained unaffected by early capitalism for several hundred years And there were transformations in forms of capitalism such as mercantilismhttpenwikipediaorgwikiMerchantcapitalism before we get to modern capitalism as we know itThe essence is that economic relationships transformed into an exchange of capital and capital is abstractly related to actual value And this completely overtook all other economic relationships from   Source Das Kapital Karl Marx ,0,cdpumwf,1rpw94,askhistorians,top_day,9,9
CanadianAmbassador,I just wrote an undergrad paper about the history of interestusury and can maybe help shed some light on this In Ancient Greece Aristotle was against any form of interest Interest is the cost of borrowing money His reasoning was that because money had no value in itself and was a medium of exchange between two commodities it should not be hoarded Money by itself was not considered wealth It was the physical goods bought that dictated how wealthy a person was This viewpoint has been debated though as being idealistic and not how life actually operated in ancient Greece Aquinas follows in similar tradition with Aristotle except adds the Christian charity idea to the mix Due to the nature of money hoarding it is bad and unnatural You cannot have a capitalist society without leftover money to fund and invest This was backed up by the Catholic Church Again this viewpoint was challenged by specific people but the Catholic Church stood by its stance Big changes didnt start to occur until the Reformation Both Luther after some prodding and Calvin after no prodding both accepted that interest was an acceptable risk that the lender takes over the borrower Prior to the Reformation interest was an unnatural way to create wealth by the scholastics and the Catholic Church Now that is for loan payments Venture Capitalism was not frowned upon and was one of the ways that people who were looking for investment circumvented the sin of usury The Romans did have some forms but usury has always been condemned under the Old testament I did actually ask a question related to this but it has also yet to be answered I am not a historian by any means but I am taking a class on the History of Classical Economics Basically the economics of the world until Marx The reason I dont address Rome and Roman influences is because from what I found the majority of their contributions were in law not economics and therefore out of the scope of my paper To answer the question though if I was being bold and banking ha on the history of venture capital probably the th century is when you could find the beginnings of modern capitalism That is mostly me talking out of my ass From what I read in regarding interest I would put the timeframe at or during the Reformation The backlash that the ban on usury caused the Church to lighten its stance in the th century but the Protestants had been okay with it officially for  years prior The important thing to remember is that capitalism requires surplus money to invest If you put restrictions in place stopping the borrowing process it makes it significantly tougher to engage in capitalist procedure Hope that makes sense I am a couple beers in because I am finally done essays and slightly celebrating Sources will be provided upon request ,2,cdpqycx,1rpw94,askhistorians,top_day,4,2
Reedstilt,At the time of Old World Contact there were three major polities in Florida and several smaller ones CalusaThe southern half of Florida was under the control of the powerful and expansive Calusa The core Calusa region was center on Charlotte Harbor in southwest Florida with their eponymous capital Calos currently identified as the Mound Key sitehttpenwikipediaorgwikiMoundKeyArcheologicalStatePark but their influence spread eastward to encompass the Mayaimi who lived around Lake Okeechobee the Tequesta of the Keys and modernday Miami and the Jaega near modernday Palm Beach The Ais who lived on the east coast from Cape Canaveral southward to the Jaega who may have been part of the Ais as well were either subjects or allies of the Calusa  the relationship is a bit unclear Additionally Taino refugees from Cuba and likely from elsewhere in the Caribbean since earlier refugees had fled to Cuba first had established communities in southern Florida under the protection of the Calusa dominion before the Spanish arrived on the mainland Until the Spanish negotiated a peace in  the Calusa were at war with Tocobaga who lived around Tampa BayThe Calusa were led by three men First was the paramount chief called the cacique by the Spanish after the Taino title for a similar political position The Calusa word for this rank is probably certepe but thats uncertain as it could refer to village chiefs as well The paramount chief received tribute from Calusa village chiefs and from the leaders of his nonCalusa subjects He also had several wives one each from his nonCalusa subjects for example as well as having a sisterwife according to Spanish chroniclers which probably meant he had one wife from his own clan rather than literally marrying his own sisterThe other two men were the war captain who command the Calusas military specialists and militia on behalf of the paramount chief and the chief priest who oversaw the temples organized important rituals and attended to the religious needs of the paramount chiefs family which he was usually part of The Calusa built canals earthworks to keep their homes above the water during floods and large communal houses and temples The kings house in Calos was said to be large enough that  people could comfortably gather there for councils What makes the size and structure of Calusa society especially interesting is that they made no use of domesticated plants or animals though there ancestors a few centuries earlier probably engaged in some farming The bulk of their diet was composed of seafood though some wild plants were gathered and they made a type of bread from coontiehttpenwikipediaorgwikiCoontie a cycad native to the Southeast Deer were relatively rare in the region and Calusa traded their seafood with people to the north for venison and deer hides In  the Spanish reported that the Calusa or their Tequesta subjects  travelling to Havana to sell fish ambergris fruits turtle shells cardinalshttpenwikipediaorgwikiCardinalbird and other items Such trade likely existed in PreColumbian times between south Florida and Caribbean as wellTimucuaMost of northern Florida minus the panhandle and a large portion of southern Georgia was the realm of the Timucua Unlike the Calusa the Timucua were not unified into a single cohesive nation Instead they had several powerful village and alliances of villages which at the time of Contact were vying among themselves for dominance Each village had its own chief called holata or utina in various Timucua areas For simplicity Ill use holata here The title of holata was inherited matrilineally within the White Deer Clan Clans were ranked and while the White Deer was at the top among the Timucua the relative ranking of the other clans Panther Bear Fish Earth Buzzard and Quail differed between the Timucuan districts The holata had several prominent subordinates The inija was the most important of these who severed as the holatas spokespeson and communicated the holatas orders to others and gather information for the holata The inija was also chosen from the White Deer Clan The holata was also served by two ranked anacotimas and the afetema who seem to have been advisers chosen from the elders of the village Women became holata regularly and when they did so their subordinates were also women The holata oversaw both the secular and religious affairs of the Timucua war however fell to the irriparacusi the war chief also known as the uriutina and possibly just paracusi The irriparacusi had his own entourage of officials ibitano toponole bichara amalachini and itorimitono though their duties are unfortunately unknown The irriparacusi likely inherited their rank as the holata did but thats not certainLike the Calusa the Timucua fished and harvested wild plants But they also hunted and cultivated maize and other domesticated plantsthough not to the extent of their Mississippian neighbors to the north and west Famously the Timucua wore deer disguiseshttpmediawebbritannicacomebmediaFAjpg when hunting Unlike the Calusa however they were quick to adopt Spanish agricultural tools and plantsThe surplus of their hunts were trade south to the Calusa but the most important trade routes went north and west to the Mississippians These trade routes brought down copper greenstone and argillite from the mountains The Timucua also controlled an important chert outcropping in northern Florida which was vital for the production of tools and weapons Chief Utina and his alliance largely controlled this outcropping and the most important trade routes which made him an enemy of other major Timucuan alliances In the s the Timucua would become important middlemen controlling the trade between St Augustine and the nations of the interiorApalacheeThe Apalachee were a small but powerful Mississippian chiefdom located between the Ochlockonee and Aucilla Rivers The Timucuanspeaking Asile who lived east of the Aucilla River were subjects of the Apalachee The Apalachee had two major towns Ivitachuco was the dominant town in the east while Anhayca modernday Tallahassee dominated the west and served as the capital of the whole chiefdom Historically the two towns were ruled by brothers Later in the s political power would shift to Ivitachuco at which time the Apalachee were at war with the Timucua again the Spanish negotiate a peace treaty between the twoNico seems to be their word for paramount chief  Interestingly holata refers to subsidiary chiefs  The Apalachee holatas oversaw major towns which controlled districts and satellite towns within the larger chiefdom The nico and the holatas were the spokespeople for their respective dominions and oversaw ceremonies within them The Apalachee nico was also served by an inija though his role here was to oversee the nicos guards farmland and to serve as a sort of court historian as well as handling trivial daytoday business of the chiefdom The holatas seem to have had inija of their own and the inija were apparently relatives of the holatas Finally the nico had an atequi a translator whose duties extended over other areas where such language skills were importantThe land of Apalachee was an important stop on the trade routes heading west out of the Timucua regions to the Mississippians and was famous throughout Florida for its agricultural productivity That fame was used as bait by other Florida peoples to lure the de Sotos expedition out of their area and encourage them to keep moving onto Anhayca where de Sotos expedition spent its first winter living maize beans squash and other plants cultivated or harvested in the region as well its ample stores of dried venison They grew three types of maize for different purposes a small fastgrowing maize used to quickly replenish their granaries in spring a yellow maize used for hominy and a white maize used for flour They also made flour from a root known as ache which the Spanish said was indistinguishable from flour made from wheat in both versatility and taste Both ache root and the flour made from it were important exports from the areaSources Handbook of North American Indians V  SoutheasthttpbooksgooglecombooksidJHTPFjLkC The TimucuahttpbooksgooglecombooksidgLNYXFFUC Hann John H Apalachee The Land Between the Rivers University of Florida Press ,0,cdpu1om,1rpx63,askhistorians,top_day,7,7
VioletPop,Florida had several preColumbian tribes the Calusa and Timucua jump to mind There are a ton of primary sources that cover them but for a good overview Michael Gannons New History of Florida is tops I dont recall a lot of specifics of their economies They did have slaves and a fair amount of intertribal raiding ,0,cdps0g9,1rpx63,askhistorians,top_day,2,2
sambeau,The origins of Professional Sumo wrestling started in the early s around the time that the Shogun Ieyasu brought peace amongst the warring families of Japan by using a hostage system the wives and children of the provincial War Lords were required to live in the capital Soon the lords themselves build giant mansions there too The peace brought a need for entertainment and a surplus of Samurai The previous ruler Hideyoshi had in  frozen social class so it was forbidden for a warrior to return to peasanthood and as such the place was overrun with bored warriors Thus the samurai started wrestling for entertainmentOriginally the wrestling was fairly Ad Hoc streetcorner shows of Martial Arts skills tsujizumo without a proper ring and the woodcuts from these times show fairly lean Wrestlers Once the ring was added and the forceout rule established the woodcuts show a noticeable bulkingup of wrestlers By the late s the wrestlers in the woodcuts look pretty much like a classical Sumo wrestler does  is when official permits were established for Sumo,5,cdpw3hy,1rpxi4,askhistorians,top_day,70,65
TokyoBayRay,Sumo is not especially unique there are traditional wrestling forms in china Korea and notably Mongolia that have similar rules In Mongolia wrestling along with horse riding and archery is deemed one of the most important skills a man traditionally should learnWhat makes sumo different is the element of Shinto ritual For the uninitiated Shinto is the indigenous religion of japan a kind of synthesis of spiritualism and polytheism that is very unique Prior to a match the wrestlers purify the ring with salt and an elaborate ritual is performed where the wrestlers don special aprons and pray in a circle around the referee The origins of sumo are unclear it has been around for almost as long as japan itself much like Mongolian wrestling it probably originated as an amateur folk sport performed on holidays Over time it became more organised in the th century a tournament held by the daimyo Oda Nobunaga is credited with introducing the formal ring By the Edo era th century sumo was a professional sport and it is here that modern elements emerge like the banzuke the official ranking lists of the wrestlers and the training regimens followed by wrestlers The sports popularity really exploded in the Meiji era but in recent years match fixing scandals and the rising prominence of foreign born wrestlers have cause its fan base to waneSumo is really fascinating If youre ever in Tokyo I highly recommend a trip to Ryogoku and the sumo museum there You can pick up the guidebook that formed  of this post and if youre lucky you might even see some of the wrestlers milling about in the evening,2,cdpwc7e,1rpxi4,askhistorians,top_day,22,20
Kilbourne,I dont know how it started but I do know that because the goal of the bout is to remain within the ring and to remove your opponent if one is very heavy it makes it more difficult to be moved from the ring Sumo wrestlers are fat yes but they are also very strong so that they can move the other very large sumo from the ring Much of the sport is openhand strikes to knock the opponent offbalance and then throw them either from the ring or to the floor by way of grabs to the joints or to the loincloth,13,cdpuikm,1rpxi4,askhistorians,top_day,24,11
churakaagii,In outlying islands in Okinawa sumo wrestling is not a professional affair  It is more a folkwrestling kind of thing everyone is amateur and nobody is fat unless they just happen to be fat  These days its a kind of nostalgic custom  久米島 Kumejima is pretty famous for itBack in the day it was a kind of spiritual observance You wrestled for the sake of the local god  These days nobody really believes that sort of stuff anymore,0,cdpx8s1,1rpxi4,askhistorians,top_day,10,10
MapsMapsEverywhere,The Bahamas and some of the surrounding area was relatively safe for pirates and their crews including Port Royal and TortugaColin Woodard covers exactly this and more in his book The Republic of Pirates Being the True and Surprising Story of the Caribbean Pirates and the Man Who Brought Them DownhttpwwwamazoncomTheRepublicPiratesSurprisingCaribbeandpX I highly recommend this book It is very easy to read and follows three pirates and piratehunter Woodes Rogers during the golden age of piracy which Woodard argues as  The only thing that irks me about this book is the way Woodard cites his sources Instead of using endnotes in the text he simply lists page numbers and where he got the information in the his bibliography at the back of the bookThis is near my period of study so I may be able to answer more questions depending on what or how specific they are,0,cdptn1k,1rpxwc,askhistorians,top_day,2,2
TheCountryJournal,In March  Rear Admiral Stewart sent a report to London that Santiago de Cuba was the most prolific hotspot for missing ships with many having fell prey to piracy It seems that the Spanish guardacostas were turning a blind eye and sometimes helping pirates to hinder British trade Many captured vessels were taken to Curaçao which Stewart remarked as inhabited chiefly by these pirates I also recall reading that in an earlier period pirates were becoming so bold unchecked and numerous in their settlements in the west corner of Santo Domingo Hispanolia that King Louis XIV had to dispatch a task force to eradicate them,0,cdpokoo,1rpxwc,askhistorians,top_day,2,2
Searocksandtrees,theres a section in the FAQ on shaving youll need to scan the posts but there are a few references to Rome On the history of facial hair and the shaving thereofhttpwwwredditcomrAskHistorianswikihealthwikionthehistoryoffacialhairandtheshavingthereofsee the popular questions link on the sidebar or the wiki tab above,2,cdpoedl,1rpxxl,askhistorians,top_day,5,3
Spinoza,Paris is the largest and most influential French speaking city and the Notre Dame is its cathedral And the church is probably the most famous gothic building in the world thanks to Victor Hugos Hunchback of the Notre Dame which features the building extensivelyedit IurisprudenciahttpwwwredditcomuserIurisprudencia makes a good point I suspect for native French speakers the direct link between Notre Dame and the Notre Dame de Paris is much weaker,3,cdppz0s,1rpy8v,askhistorians,top_day,19,16
iliketeaalot,It is difficult to say that anything in history is impossible On the other handEarly communists believed that communism was the natural and inevitablehttpenwikipediaorgwikiCommunism next phase of society and economics Some not obviously insane people continued to think that into the s And capitalism wasnt necessarily looking too great for many people around the time of the Russian Revolution So it was natural for a new communist country to want to help other countries advance the way it hadAn authoritarian subphase the dictatorship of the proletariathttpenwikipediaorgwikiDictatorshipoftheproletariat which would precede communist utopia had been predicted by Marx The people who managed to get the job of er identifying and implementing the interests of the proletariat didnt turn out to mind too much that that authoritarian subphase didnt seem to be coming to an early endSo the notion that the Soviet Union should want to create as many client communist states which would turn out to be repressive to a greater or lesser extent as possible seems very natural to me And that the United States should want to counter that expansion also seems very natural to me,0,cdpyoah,1rpynz,askhistorians,top_day,1,1
xxxdarkhorsexxx,Coca cola became intensely popular in WWII It became a  patriotic drink to remind soldiers of home Coke only charged  cents per drink enough to cover the bottling cost When the ten million or so soldiers returned from overseas it was a favourite drink of theirs and increased in popularity httpwwwcocacolaconversationscomcokeandtheushtml,1,cdpzpns,1rq17x,askhistorians,top_day,6,5
david,Logistically Sure There are bigger armies that have travelled more such as the Mongols and their AsianRussiaIran conquests Golden Horde had around k warriors The Russians beat the Tartars with an army of k to k Timur also had a huge army Some modern accounts the Persians army that lost at Thermopylae in the kk range as well including war elephants and other stuff Hannibals journey to Italy started with around k man he left kk in Spain as garrison tho Supposedly the Arabs had around k soldiers in the siege of Constantinople in the s Actually many ArabByzantine wars included armies in the high s thousands for each side according to some histories So yeah its plausible and its logistically possible While not many technological improvements were made in those ages if Xerxes the s Arabs and Hannibal were able to move those kind of troops one can assume Barbarossa probably fielded something around those numbers maybe less ,7,cdpyn5d,1rq1gt,askhistorians,top_day,10,3
