author,comment,downs,id,post,subreddit,type,ups,score
Dongo,The way I heard this wasSo was she beautifulI dont know couldnt find her head,2,cdmbe90,1rcg2l,jokes,top_week,3,1
TheyCallMeHero,am i stupid i dont get it,3,cdm3u1r,1rcg2l,jokes,top_week,3,0
ilikewtfwaytoomuch,runexpected,2,cdm5s47,1rcg2l,jokes,top_week,2,0
NiceMeetingYou,Its too bad because the head was watching him from the distance with its mouth wide open,10,cdm0ajo,1rcg2l,jokes,top_week,4,-6
ambatman,When I read that last line I felt the burn,19,cdltd53,1rcg2l,jokes,top_week,7,-12
JP,,0,cdlte2t,1rchan,jokes,top_week,1,1
Excaliber,How high are you,1,cdltqj4,1rchan,jokes,top_week,2,1
jimrob,Thuuuuuper Glue  Lol,0,cdlvzfa,1rchan,jokes,top_week,1,1
jeets,you do realize one degree is like absolutely nothing youre pretty much walking TOWARDS it,0,cdmdme1,1rcmvp,jokes,top_week,2,2
Escalade,That dude is stupid he becomes rich and THEN wishes not to work what a wasted wish,0,cdpqmng,1rd0x1,jokes,top_week,1,1
AmirZ,Okay that was unexpected,2,cdm4a7n,1rd2or,jokes,top_week,7,5
fritzheatbunnie,None of them The married one has a headache and didnt get any ice creamSource Ive watched sitcoms,38,cdm5ase,1rd7fv,jokes,top_week,182,144
naghallac,ah little johnny jokes they never get old i heard a similar one to this yet this still made me chuckle,6,cdm1etz,1rd7fv,jokes,top_week,19,13
Roseredgal,Everybody knows that when a woman gets married shes not going to need that skill anymore,2,cdm99oz,1rd7fv,jokes,top_week,12,10
JJaypes,I figured it was the one that bit into the ice cream,3,cdmadn7,1rd7fv,jokes,top_week,10,7
joebob,Wonder how she came to that conclusion,3,cdm6spv,1rd7fv,jokes,top_week,10,7
razezero,Thats horrible,0,cdnrgx4,1rd7fv,jokes,top_week,2,2
alester,She blew it,2,cdm3s35,1rd7fv,jokes,top_week,3,1
sicnarfj,Aziz Ansari,1,cdmb41p,1rd7fv,jokes,top_week,2,1
trevpcb,L,0,cdmnndl,1rd7fv,jokes,top_week,1,1
AmirZ,This is really a joke you should hear when youre drunkStill giggled anyway,0,cdm48rk,1rda7e,jokes,top_week,6,6
CANZIGZAG,He must be deaf I thought I heard the other one call out WATCH trOUT,7,cdm6789,1rda7e,jokes,top_week,2,-5
CANZIGZAG,Quite the CHUM,1,cdm6cbm,1rdlt7,jokes,top_week,2,1
russianhipster,They all showed up on the same day,2,cdmjry6,1rdmq4,jokes,top_week,16,14
ClemsENT,So His wife never came home Theres a problem,5,cdmbqqe,1rdmq4,jokes,top_week,13,8
jblue,Thats a good one Thanks for one I havent heard before,6,cdmdgd0,1rdmq4,jokes,top_week,5,-1
TheGrammarCop,You must have something good going for you,0,cdm6lwi,1rdoet,jokes,top_week,1,1
CANZIGZAG,ooooohhhhh  The suspense is killing me,1,cdmaceg,1rdoet,jokes,top_week,2,1
CANZIGZAG,gtMake like a babyAs in a party POOPER,3,cdmajvg,1rdpct,jokes,top_week,3,0
DuncanJJewell,Its cheaper ,0,cdmxv7t,1rdpd4,jokes,top_week,2,2
IveShatMyPantsMum,No just lazier,1,cdm8e71,1rdpd4,jokes,top_week,2,1
tee,Its the Friday when no one goes to work,0,cdm8fk2,1rdpd4,jokes,top_week,1,1
vfcascaes,How do you go back to a regular Friday once youve done a Black Friday,2,cdmbkiu,1rdpd4,jokes,top_week,3,1
CANZIGZAG,Is that not the day everyone stops shops,2,cdmam0k,1rdpd4,jokes,top_week,2,0
carmabound,Brace yourself,4,cdm8mun,1rdqi0,jokes,top_week,18,14
BingotheBrainyPup,Only read it to see if the gag hinged on the fact that shed heard the dentists name was Phil McCavity Glad to be disappointed ,1,cdmix89,1rdqi0,jokes,top_week,6,5
arthur,retainer,1,cdmkocc,1rdqi0,jokes,top_week,1,0
CANZIGZAG,flatulenceCome on we all know most of us get a little gas from that kind of food,2,cdmar03,1rdtjb,jokes,top_week,2,0
Excaliber,Because they are inanimate objects,112,cdmaa5g,1rdxt4,jokes,top_week,430,318
AdamSnipeySnipe,Girl asks her mom hey mommy does Barbie come with KenNo sweetie Barbie only comes with GIJoe she has to fake it with Ken,57,cdmfd42,1rdxt4,jokes,top_week,261,204
Rikkushin,So Ken had a cumbox,27,cdmf35u,1rdxt4,jokes,top_week,122,95
KosherKrusader,They used to make themhttpusatodayusatodaycommoneyindustriesretailpregnantdollxhtm,23,cdmdijx,1rdxt4,jokes,top_week,114,91
badboycalvin,Because Ken has the weird lumpdick thing going on  Plus Im pretty sure they just friends anyway,13,cdmedqv,1rdxt4,jokes,top_week,36,23
Jonette,Ken is gay ,7,cdmex7i,1rdxt4,jokes,top_week,18,11
FoppaSmash,Because she has bulimia and became infertile,2,cdmhclr,1rdxt4,jokes,top_week,14,12
Zbailey,I think the Badum Tiss was the best part of the joke,1,cdmnfqc,1rdxt4,jokes,top_week,9,8
CodenameRedeemer,Because Ken always use a rubber ,0,cdmh2xd,1rdxt4,jokes,top_week,8,8
UCanCallMeDuckey,Ken and Barbie are wincest to the maxBarbie and Kens HistoryThe toy company Mattel gave birth to Barbie and Ken in  The entire idea span from Ruth Handler wife of Mattel cofounder Elliot Handler Ruth began production of Barbie who she named after her daughter Barbara That same year Ken was produced and introduced as Barbie companion Ken was named after the Handler son KennethThere you have it Ken and Barbie are brother and sister,4,cdmiqnj,1rdxt4,jokes,top_week,11,7
HairyBouy,There was no far ken going on  Help me out here someone ,7,cdmf0c0,1rdxt4,jokes,top_week,11,4
drew,Because Barbie has no vagina,15,cdmd7hk,1rdxt4,jokes,top_week,21,6
Farisrk,I heard this joke when I was much younger I never realised the double entendre I thought it was just like lol they cant have sex ,0,cdmhgjn,1rdxt4,jokes,top_week,5,5
BiddyCavit,Ken doesnt even have a dick,0,cdmokcw,1rdxt4,jokes,top_week,4,4
Jonette,Its a marriage of convenience ,1,cdmexag,1rdxt4,jokes,top_week,4,3
BIGSEXYBALLS,I would have guessed that the answer is because no man has ever succeded in taking her underwear of,0,cdmlx65,1rdxt4,jokes,top_week,3,3
Whoneedsyou,Isnt she too skinny to menstruate or something ,1,cdmj5g3,1rdxt4,jokes,top_week,3,2
woodysback,Because she was only the head nurse,0,cdml5vs,1rdxt4,jokes,top_week,2,2
AbsurdPlatypus,rcumbox ,0,cdmw7s8,1rdxt4,jokes,top_week,2,2
arcainic,Wasnt Ken originally intended to be gay,0,cdmhgwj,1rdxt4,jokes,top_week,1,1
Zombiz,All I can think of is that guys cum shoebox,2,cdmia92,1rdxt4,jokes,top_week,2,0
CarlosDangerWeiner,Actually she did She just had a lot of abortions ,0,cdmijwn,1rdxt4,jokes,top_week,1,1
twatmunchies,,0,cdmis8x,1rdxt4,jokes,top_week,1,1
TX,httpwwwyoutubecomwatchvbcYppAsZdI,0,cdmixzd,1rdxt4,jokes,top_week,1,1
zomgitsduke,Why is it every time I forget about the box for more than a week theres a mention of it,0,cdmj8fy,1rdxt4,jokes,top_week,1,1
moondizzlepie,rnotadadjoke,0,cdmjy5x,1rdxt4,jokes,top_week,1,1
sirramen,Eating cereal Not anymore,0,cdmk4kd,1rdxt4,jokes,top_week,1,1
WroteItThenReddit,Suckers walk money talks But barbie cant touch his three lock box,0,cdmknkm,1rdxt4,jokes,top_week,1,1
Nebula,I heard this once with Because Ken only came with Skipper which made it really creepy,1,cdmlkk7,1rdxt4,jokes,top_week,2,1
Clappalachian,Reminds me of the greatest bar trivia team name Ive ever heard hermaphrodite Barbie comes in her own box,0,cdmm97f,1rdxt4,jokes,top_week,1,1
evhoch,Something something cumboxTips fedora,0,cdmw93w,1rdxt4,jokes,top_week,1,1
partidwin,httpbadumtishcom,0,cdo96lt,1rdxt4,jokes,top_week,1,1
peaceandlovehomies,Kinda feel sorry for Barbie  getting cheated on and all,3,cdmhv0q,1rdxt4,jokes,top_week,2,-1
LookDeeper,because nether her nor Ken have genitals,18,cdmd4vf,1rdxt4,jokes,top_week,16,-2
fenixfire,Because she is made of fucking plastic,15,cdme5ce,1rdxt4,jokes,top_week,10,-5
TSKmemphis,Obligatory thread cumbox,17,cdmej0a,1rdxt4,jokes,top_week,10,-7
stricknacco,I like that this has a reference to that redditor who came in a box ,35,cdmbpz0,1rdxt4,jokes,top_week,17,-18
Monso,The longer version goes along the lines of the lady having silent amp odourless farts  She farts and farts and none of them smell or make any noise  She farted a dozen times in the waiting room and nothingThe doctor gives her pills she goes home and comes back when the bottle is done  She says now her farts smell but they still dont make any noiseThe doctor says Now that weve cleared up your sinuses lets work on your hearing,0,cdmncxr,1re06s,jokes,top_week,2,2
IAmAnObvioustrollAMA,Her farts are silent and odorless Dr gives her pills to help She returns to Dr Lady Ive still got silent farts but now they smell terrible Dr good now that your sinuses are clear we can work on your hearing Lady faints ,10,cdmbw08,1re06s,jokes,top_week,8,-2
CANZIGZAG,and where does said gassy cowboy liveSomewhere out on the wild fartier,3,cdmb23i,1re1c0,jokes,top_week,9,6
Redditisquiteamazing,These jokes belong in Fallout New Vegas,0,cdmgv51,1re1c0,jokes,top_week,1,1
thehedgemon,Indecent exposure I thought it was pretty decent,0,cdmqjnd,1re4mi,jokes,top_week,2,2
ToastyXD,Something better than Bud Light I hope,1,cdmpb07,1re5io,jokes,top_week,21,20
curvedbanana,Not sure if Bud Light counts as beer,1,cdn4lbf,1re5io,jokes,top_week,3,2
Vamm,Champion among men,1,cdn5t19,1re5io,jokes,top_week,2,1
jussiadler,Change it to somewhere in africa because water  ,4,cdmtc1c,1re5io,jokes,top_week,1,-3
Jalil,fuckithaveanupvotejpg,10,cdmls76,1re5io,jokes,top_week,2,-8
Shleebear,As long as you do it better than Miley Cyrus,6,cdmf5r7,1reemh,jokes,top_week,4,-2
catherder,Oh all right  Ill have some deer nuOh no you dont Youre not getting me like that again,1,cdmjcdz,1regj0,jokes,top_week,4,3
MyUnsernameIsTooLon,i dig it,0,cdmrrsi,1reht0,jokes,top_week,5,5
thepenmen,Ummsomeone mind explaining me this lol For some reason I dont seem to understand jokesat allWhy did the voice say to bash it in the head of the chief but when he did it it was wrong,0,cdmsk2g,1reht0,jokes,top_week,4,4
Bacore,kudos ,1,cdmrgos,1reht0,jokes,top_week,3,2
spacecadet,awesome,0,cdn06kp,1reht0,jokes,top_week,2,2
alester,He should have ordered thishttpamzncomBDRY to defend himself,15,cdmglvy,1reht0,jokes,top_week,9,-6
Beastybeard,Flattery will get you nowhere,0,cdmnsp6,1reoae,jokes,top_week,20,20
Mobythenarwahle,I dont get it  ,0,cdmmjah,1reoae,jokes,top_week,4,4
thedirt,Looks like somebody got themselves into quite the dicey situation,2,cdmpbp5,1reos6,jokes,top_week,3,1
iratam,Bad joke Bad bad joke,0,cdmuuvq,1retv0,jokes,top_week,2,2
carmabound,A  pencilright,0,cdmjxxd,1reue5,jokes,top_week,2,2
ParkerM,If you fiddle with Come on bro you can do better than that Instead it should be something about raising imaginary problems or something Otherwise the joke reads like something something something imaginary and real have two meanings,3,cdmriyp,1reure,jokes,top_week,8,5
ZMush,Actually i   not i,4,cdndh0k,1reure,jokes,top_week,3,-1
Mobythenarwahle,Woah DudeMindBLOWN,7,cdmmsue,1reure,jokes,top_week,5,-2
scooterreddit,Its actually  though not ,21,cdml1v6,1reure,jokes,top_week,9,-12
Xenophyophore,    jane  woman    janemakesandwich,1,cdn1wlo,1reuyn,jokes,top_week,12,11
hacksoncode,Treat her like a subject instead,3,cdmqs9o,1reuyn,jokes,top_week,7,4
stewartr,Better to treat her as a verb Active voice future perfect with a complementary proposition,2,cdmupj2,1reuyn,jokes,top_week,5,3
sudhirjob,If you want to treat her like an object than it best be a special object like one of a kind object ,0,cdmwgz7,1reuyn,jokes,top_week,2,2
NyQuil,It puts the lotion on its skin,3,cdmu24i,1reuyn,jokes,top_week,5,2
Finrodtheawesome,Yeah Bitches hate that,0,cdn274e,1reuyn,jokes,top_week,2,2
alester,Sign at a bar  We dont serve women here  Bring your own,0,cdnis27,1reuyn,jokes,top_week,2,2
rockmediabeeetus,Wow such edge,25,cdmpeuz,1reuyn,jokes,top_week,11,-14
freggle,Thats funny ,0,cdmk8x6,1rextf,jokes,top_week,3,3
dmnhntr,Seriously,0,cdmptlb,1rf0mb,jokes,top_week,1,1
walfredoprimavera,high balls on me,0,cdmzw4b,1rf2ou,jokes,top_week,3,3
ToastyXD,Wasnt this posted a couple of days ago,1,cdmpa64,1rf8r6,jokes,top_week,1,0
DoctorCocktor,Brilliant,5,cdmohnr,1rfec0,jokes,top_week,22,17
DirtySingh,Me laughed,1,cdmtpot,1rfec0,jokes,top_week,11,10
bartonar,One day the circus is in town A little man walks up to the ringmaster and asks to be put in the show for the circus The ringmaster skeptical that this short little man can do anything asks the man Show me what youve gotThe little man starts running around the circus tent flapping his arms wildly Soon enough he starts flying through the air He zips around doing all sorts of flipsHe finally comes to a rest next to the ringmaster Completely out of breath he asks the ringmaster So Whatd ya thinkThe ringmaster looks at him and says Is that all you do Bird imitationsThough admittedly over the internet I can neither convey Hawkeyes actions nor BJs lilt,5,cdn6b82,1rfec0,jokes,top_week,10,5
ZincHead,Such a simple joke yet so effective ,2,cdmv3rw,1rfec0,jokes,top_week,4,2
stillbatting,I thought it was going to be about clowns given your username good joke though,0,cdmvnn3,1rfec0,jokes,top_week,1,1
BaldBeachApe,The joke works better with the mustache,1,cdn09lk,1rfec0,jokes,top_week,1,0
ThatsMeowthRight,Good joke Although I believe the word you might be looking for is Ringmaster,0,cdn4jof,1rfec0,jokes,top_week,1,1
lawlshane,,0,cdnd0mi,1rfec0,jokes,top_week,1,1
CANZIGZAG,I am guessing he left in a flap,3,cdn2zzu,1rfec0,jokes,top_week,1,-2
jaymar,Haha Good impression,4,cdmpkhf,1rfec0,jokes,top_week,1,-3
jerkusQ,Is it bad if i dont understand Is it funny that he flew away or is it something else that i just dont see,6,cdmvf92,1rfec0,jokes,top_week,2,-4
sciencebrony,it is as fuunt as my butt,24,cdmrswr,1rfec0,jokes,top_week,5,-19
DrNoobSauce,Colin said this on Whose Line once,36,cdmslwc,1rfkud,jokes,top_week,270,234
guitarfull,Cheeeeeese louise  Have an upvote,35,cdmrm77,1rfkud,jokes,top_week,203,168
loyalone,Pappy I dun broke my arm in three places Well son you gotta learn to stay outta them places,51,cdmwfa2,1rfkud,jokes,top_week,193,142
sanghoon,Non native english speaker here can somebody explain,8,cdmt08o,1rfkud,jokes,top_week,65,57
Kongo,Q Why didnt anyone laugh at the gardeners jokes A Because they were too corny Q How did the tomato court the corn A He whispered sweet nothings into her ear Q What did the corn say when he got complimented A Aww shucks Q What does chuck norris do when he wants popcorn A He breathes on Nebraska Q What does moldy corn flakes have in common with Charles Manson A They are both Cereal Killers Q Why shouldnt you tell a secret on a farm A Because the potatoes have eyes and the corn has ears Q How is an ear of corn like an army A It has lots of kernels Q What do you get when a Corn cob is runover by a truck A Creamed corn Q What do you call the best student at Corn school A The Acorn Q What do Corn cobs call their father A Pop corn Q What do corn use for money A Corn Bread Q What did the baby corn say to the mom corn A Where is my pop corn Q What has ears but cannot hear A A field of corn source httpwwwjokesuscommiscellaneousjokesfoodjokescornjokeshtml,9,cdmtuci,1rfkud,jokes,top_week,49,40
nomyourmom,omg Im calling my dad right now and telling him this joke Thank you,5,cdmsspi,1rfkud,jokes,top_week,32,27
jelvinjs,gtCorniest jokeNot a joke about a corn at all,5,cdmvjlv,1rfkud,jokes,top_week,27,22
Yaifrog,A frog walks into a bank and up to the first teller he sees who greets him with a strong Irish accent Good day sir me names Paddy what can I do fer youThe names Michael Michael Jagger Jr and Im here to apply for a loan replied the frog through his enormous lipsRightio sir Ill just need some indentification said PaddyAt this the frog pulled out a small porcelain doll in his likeness Will that doThis caused a bit of a hubbub as Paddy didnt feel he could accept it and tried repeatedly to tell the increasingly angry frog Eventually Paddys supervisors voice boomed down the hall MACK Whats going on over thereMr Jagger here wants to apply for a loan with only this as identificationIts a knickknack Paddy Mack give the frog a loan His old mans a Rolling Stone,4,cdn0wej,1rfkud,jokes,top_week,12,8
SeriesofAccidents,Reminds me of this oneOnce in a land far far away there lived a group of people called Trids The Trids were happy except for the huge ogre that lived on the mountain The ogre would periodically terrorize the TridsThe Trids tired of the ogre and sought to reason with him They thought one of their religious leaders would be a good intermediary So a group of Trids and their minister went up the mountain and before they could even say one word the ogre kicked them down the mountain Not being dismayed the Trids thought that maybe the ogre was Catholic so they sent another delegation this time led by the local priest But alas as they approached the ogre he once again kicked them all down the mountainThe Trids were upset until they thought that perhaps the ogre was Jewish Unfortunately no Trids were Jewish so they wrote to the people of another land and asked them to send a Rabbi to help them with the ogre The Rabbi arrived and led a delegation of Trids up the mountain The ogre saw them coming and kicked all of them except for the Rabbi down the mountain The Rabbi having been told of the previous expeditions wondered why he alone had not been kicked down the mountain so he asked the ogre The ogre laughed and repliedSilly Rabbi kicks are for Trids,1,cdn0nla,1rfkud,jokes,top_week,7,6
scottcmu,Ty Cobb Now theres a corny guy,2,cdmufgx,1rfkud,jokes,top_week,6,4
KaptainMurrica,Lold,2,cdmr8vp,1rfkud,jokes,top_week,5,3
AllAboutGamers,I was expecting a joke about corn I was disappointed,1,cdmx8sj,1rfkud,jokes,top_week,5,4
ZoomasterEddie,My corniest joke and the first joke I remember from when I was youngWhat happens if a duck flies upside downIt will quack upI am  and I still laugh at it,0,cdn4m6r,1rfkud,jokes,top_week,4,4
mrsasbury,Q Where does the president keep his armiesA In his sleevies,0,cdn8m9y,1rfkud,jokes,top_week,4,4
Zhyl,An inuit drowned recently after setting fire to his kayak in an attempt to stay warmJust goes to show you cant have your kayak and heat it too,0,cdnbbx9,1rfkud,jokes,top_week,3,3
mike,Groan,1,cdmw9z8,1rfkud,jokes,top_week,3,2
habbathejutt,I thought corn was going to be involved Im sad now,0,cdn1ufp,1rfkud,jokes,top_week,2,2
TrainwreckStation,Two peanuts walked into a bar  One was assaulted,0,cdn431z,1rfkud,jokes,top_week,2,2
soulcaptain,A scientist working with porpoises stumbled across and amazing discovery he could keep them alive and immortal as long as he fed them a special diet  The diet mostly consisted of Myna birdsThe scientist soon depleted his areas Myna bird population so he needed to travel to where there were more Myna birds  So he went to Africa and hunted lots of the birds  One day coming back from a hunt and carrying a lot of Mynas he saw a lion in his path  There was no way to go around and luckily the lion was asleep so the scientist quietly gingerly stepped over the lionwhen suddenly a big group of African soldiers popped out of the jungle and arrested himThe charge  Carrying Mynas over a stayed lion for immortal porpoises  ,0,cdn4yvv,1rfkud,jokes,top_week,3,3
peterbrownrod,Q Why did the scarecrow win a Nobel PrizeA Because he was out standing in his field,0,cdn6gic,1rfkud,jokes,top_week,2,2
ShazMaz,Not gonna lie I was expecting a joke about corn I suppose thatd be too corny,0,cdn8u9c,1rfkud,jokes,top_week,2,2
sleeper,holy shit,0,cdnaqpk,1rfkud,jokes,top_week,2,2
tjesters,A man walks into a psychiatrists office wearing nothing but Saran Wrap  The Doctor looks at him and says I can clearly see your nuts ,0,cdndupb,1rfkud,jokes,top_week,2,2
eManifonsREDDIT,Corniest joke I knowin my head I thought the punchline maize surprise you,1,cdmyci2,1rfkud,jokes,top_week,2,1
mlambert,Q Why shouldnt you tell a secret on a farm A Because the corn has ears,0,cdmym5b,1rfkud,jokes,top_week,1,1
XLQ,I need some Pepto Bismol now ,0,cdmymbi,1rfkud,jokes,top_week,1,1
drceverettkoop,I do a much more brutally long winded version that doesnt involve hugh hefner but the same punch line its a killer,0,cdmzacj,1rfkud,jokes,top_week,1,1
SammyYammy,I dont think the area around the playboy mansion is zoned for commercial use ,0,cdmzxoi,1rfkud,jokes,top_week,1,1
MFDoomed,This is wonderful,0,cdn0p9t,1rfkud,jokes,top_week,1,1
onefinedjentleman,Corniest joke I know What did the farmer say when he lost his tractor    Wheres my tractor,1,cdn1g1z,1rfkud,jokes,top_week,3,2
RockoBro,What did Jamal say to the guy that dropped the soap in jailBend over,0,cdn53e6,1rfkud,jokes,top_week,1,1
mike,Addressing the corniness of your jokeThats as old as my grandmothers foot and twice as corny,0,cdn5aaw,1rfkud,jokes,top_week,1,1
Shnitzuka,At a summer camp the counselors told a super long version of this Hugh was not hugh heff I dont remember the details But it was hella long and ended with this ridiculous pun They told another one that was just this big dramatic story about a mushroom who had no luck in love and it all built up to I dont understand Im a fungifun guy,0,cdn7l6n,1rfkud,jokes,top_week,1,1
RubyBlye,A scientist worked for many years to genetically modify corn Eventually he took the seeds to Monsanto to see if they would market them Do they yield a larger crop The executive at Monsanto asked him No he answered Are they pest resistant No he answered again Does the corn taste better Again No Just what is the modification asked the executive And the scientist enthusiastically answered The cob vastly improves the experience of cornholing,0,cdnaen0,1rfkud,jokes,top_week,1,1
ytayj,httpiimgurcomWqtIypHgif,0,cdnaw5n,1rfkud,jokes,top_week,1,1
kimstr,i dont get itwho is Hugh Hefner,1,cdnc9mk,1rfkud,jokes,top_week,2,1
Zbailey,Its Badum tiss,0,cdnd6jk,1rfkud,jokes,top_week,1,1
PetriHatesHumans,This joke gave me cancer,0,cdniz10,1rfkud,jokes,top_week,1,1
MyMegaGame,Why do people post their jokes in the comments Submit a text post,1,cdn1sdn,1rfkud,jokes,top_week,1,0
AwsomeRedditor,This is so bad it gave me cancer,1,cdn45i8,1rfkud,jokes,top_week,1,0
fasching,Homophonic puns are gay,3,cdn5unr,1rfkud,jokes,top_week,3,0
malvae,Why did the chicken cross the roadTo get to  the other side,1,cdnaf73,1rfkud,jokes,top_week,1,0
Patel,Huh I dont get it whats a friar and whos Hugh hefner,3,cdmz8zh,1rfkud,jokes,top_week,2,-1
Satme,God is dead FredFred is dead God,2,cdmzav1,1rfkud,jokes,top_week,1,-1
hacksoncode,As old as monasteries That said its better to not mention the name Hugh until the punchline Just talk about the Playboy Mansion and Mr Hefner Anyone that doesnt have enough cultural background to get it with that much prompting doesnt deserve to,10,cdmsfc7,1rfkud,jokes,top_week,4,-6
iratam,Precious ,1,cdmur2l,1rfllm,jokes,top_week,1,0
CANZIGZAG,Personally I will never give up booze but then again Im a bit of a whinner,3,cdn33ds,1rfm4b,jokes,top_week,5,2
bitterdisappointment,i love this joke first time i heard it i nearly shat laughing,0,cdmrpbw,1rfoaa,jokes,top_week,16,16
floydster,httpimgurcomfPI,0,cdmzb5e,1rfoaa,jokes,top_week,10,10
ZincHead,I think it would be better off without the thick accents It doesnt lend much to the joke by making me struggle to get through those couple pieces of dialogue Also relevanthttpiimgurcomfPIgif,0,cdmv8no,1rfoaa,jokes,top_week,2,2
iratam,INCREDIBLE  A funny joke I did not know  Thank you  Merci  Grazie ,1,cdmukp2,1rfoaa,jokes,top_week,2,1
MadScientist,This is beautiful,0,cdmxmnr,1rfoaa,jokes,top_week,1,1
Kevadimundi,Everyone read the scotsman part  and thought immediately of Groundskeeper Willie,1,cdn8sje,1rfoaa,jokes,top_week,2,1
KTBFFHblues,Down vote because of reading,12,cdmubht,1rfoaa,jokes,top_week,2,-10
Excaliber,Not bad ,0,cdmuu08,1rfpd4,jokes,top_week,2,2
CANZIGZAG,Even with cold water,1,cdn35bl,1rfpd4,jokes,top_week,2,1
slce,The moon doesnt cut its hair it waxes,12,cdmtejf,1rfq4x,jokes,top_week,76,64
ableman,It doesnt Its been  years since its had a Buzz,14,cdmuwme,1rfq4x,jokes,top_week,67,53
strategolegends,How often does it change its style Once in a blue moon,2,cdn2rxe,1rfq4x,jokes,top_week,4,2
Thatisafilthylie,Isnt the moon female though,2,cdn4pr2,1rfq4x,jokes,top_week,2,0
girkuss,I might change it to how does the man in the moon cut his hairNice one tho,1,cdngzxv,1rfq4x,jokes,top_week,1,0
gthang,technically the turist shouldve said No I came here yesterday,0,cdn096p,1rfrn9,jokes,top_week,3,3
Excaliber,Why is a cup yelling at a tourist,0,cdmut8k,1rfrn9,jokes,top_week,1,1
iratam,Good one m ,0,cdmutx6,1rfrn9,jokes,top_week,1,1
PRWN,Im guessing this is told with one of them red neck accents,0,cdnadnj,1rfrn9,jokes,top_week,1,1
CANZIGZAG,just leave it alone,1,cdn38ip,1rfxnt,jokes,top_week,1,0
CANZIGZAG,Grilled cheese Personally  I camembert thinking about this,1,cdn3don,1rg5nm,jokes,top_week,1,0
madeyouangry,Im glad Janice is deadThat miserly old bag was holding John back in lifeI hope she landed on a cactus,3,cdmx76z,1rg7ef,jokes,top_week,29,26
CANZIGZAG,MORE COWBELL,2,cdn3qsi,1rg8ac,jokes,top_week,3,1
LittleJohnny,Groan,0,cdntxw7,1rg98k,jokes,top_week,1,1
jasonwaterfauls,if you got hit in the peter with a pan youd fly too,0,cdpuk0j,1rg98k,jokes,top_week,1,1
CockAuVin,They wood give him planty of love and never leaf him aloneOr maybe they just get him trunk,3,cdmzdre,1rg9tu,jokes,top_week,9,6
SlugsNotDrugs,Whats the difference between a hormone and an enzymeYou cant hear an enzyme,0,cdnemk8,1rg9tu,jokes,top_week,5,5
avagadro,How can you tell the gender of a treeYou give it a sap smearSifl amp Olly,0,cdnjmah,1rg9tu,jokes,top_week,4,4
jamberie,They leaf it alone,0,cdpjdz8,1rg9tu,jokes,top_week,1,1
CANZIGZAG,I thought that photosynth made them green with envy,4,cdn3ul5,1rg9tu,jokes,top_week,4,0
Deadmauhreck,ZING,1,cdmz5ek,1rgbiu,jokes,top_week,3,2
TheDarkShadows,I dont get it,4,cdn31ke,1rgdlz,jokes,top_week,4,0
Feenominal,Mexico is in North America,0,cdmz9gw,1rgfk0,jokes,top_week,10,10
freggle,These are getting worse,1,cdn02z2,1rgify,jokes,top_week,4,3
banjokester,Bro its with girls and the third is a blonde,1,cdn2ef5,1rgify,jokes,top_week,2,1
Enigmutt,Hes obviously a dad,2,cdn17au,1rgkz9,jokes,top_week,2,0
CANZIGZAG,I am guessing that after Rudolph was hit he made a complete nosedive ,5,cdn4vn1,1rgkz9,jokes,top_week,3,-2
