author,comment,downs,id,post,subreddit,type,ups,score
DarthOpto,I admit I lold probably harder than I should at work,0,cdodda0,1rklmr,jokes,top_week,1,1
vladtheimpalor,Bent over  fairy Wish is wish,0,cdojhiu,1rklmr,jokes,top_week,1,1
FistBomb,Because it would smell like frog crap,0,cdon9to,1rklmr,jokes,top_week,1,1
souricecream,man this has rdadjokes all over it ,0,cdoohlo,1rklmr,jokes,top_week,1,1
catherder,TIL that toads have tools,0,cdou749,1rklmr,jokes,top_week,1,1
Boognish,Badger badger badger badger badger badger badger badger badger badger badger badger,3,cdog6yi,1rklmr,jokes,top_week,2,-1
NyQuil,gtpaper route,43,cdo77kg,1rkq2r,jokes,top_week,148,105
gluteusvolcanicus,Just in time for Thanksgivikkuh,2,cdobchm,1rkq2r,jokes,top_week,15,13
peedrink,Once again doing nothing to disprove the myth about the German sense of humour,0,cdo7mhv,1rks8e,jokes,top_week,6,6
BurnAtlanta,Me three is an Americanism  A humorous way of the third person concurring  I like Scarlett Johanssens boobs  Me too  Me three  Doesnt mean poor knowledge of English,1,cdo7xdv,1rks8e,jokes,top_week,5,4
pocodot,God here I made that joke up before I created the universe ,16,cdob717,1rkuwg,jokes,top_week,52,36
Timefun,I know this is in contention for the oldest joke in the world but its amusing  I like the version where Superman goes on and on about some sciency stuff about the wind resistance and draft and magnetic fields bs,0,cdoi4os,1rkuwg,jokes,top_week,9,9
lesbois,be a real dick more like convince someone to commit suicidestill laughed though,4,cdojz5r,1rkuwg,jokes,top_week,3,-1
Petrocrat,classic correlation  causation,8,cdo9i4y,1rkuwg,jokes,top_week,6,-2
thetracker,,7,cdocjcc,1rkuwg,jokes,top_week,4,-3
Vladym,Fusion may help you better than fission,1,cdodyno,1rkvh1,jokes,top_week,7,6
jerrymatthewmorris,Come on in uxkcdtranscriberhttpxkcdcom,0,cdogc7j,1rkvh1,jokes,top_week,4,4
mrrandomman,I dont like this new thing where people see a joke on rjokes and then just repost it three days laterhttpwwwredditcomrJokescommentsrbgadidyouhearaboutthatnewmoviecalled,5,cdoajrh,1rkwls,jokes,top_week,9,4
jussiadler,When I was talking InstagramLast thing you wanted was your picture snapped   jay z How much does a hipster weigh An instagram ,0,cdobcnt,1rl02n,jokes,top_week,3,3
PiercingGoblin,rdadjokes,2,cdoijev,1rl02n,jokes,top_week,1,-1
catherder,Wait  youre not even married yet and youre already seeing a marriage counsellorI see a bad moon rising,0,cdoujui,1rl06b,jokes,top_week,2,2
gehenom,I dont get it,3,cdodmbe,1rl06b,jokes,top_week,4,1
mightyfine,Why is it not funny ,6,cdoc5jd,1rl06b,jokes,top_week,5,-1
chandetox, because username,0,cdplwbv,1rl1qb,jokes,top_week,1,1
GoatmanEvil,Paddy died in a fire and was burnt pretty badly So the morgue needed someone to identify the body His two best friends Seamus and Sean were sent for Seamus went in and the mortician pulled back the sheetSeamus said Yup hes burnt pretty bad Roll him overSo the mortician rolled him over Seamus looked and said Nope it aint PaddyThe mortician thought that was rather strange and then he brought Sean in to identify the bodySean took a look at him and said Yup hes burnt real bad roll him overThe mortician rolled him over and Sean looked down and said No it aint PaddyThe mortician asked How can you tellSean said Well Paddy had two arseholesWhat He had two arseholes asked the morticianYup everyone knew he had two arseholes Every time we went into town folks would say Here comes Paddy with them two arseholes,0,cdoc3mr,1rl64p,jokes,top_week,31,31
hugmenexttime,Reminds me of a joke not sure if it is makes sense when translatedWhich is the only animal that has its asshole one the side A police dog,0,cdp90z8,1rl64p,jokes,top_week,1,1
deltopia,I like my women like I like my coffee In large cups,0,cdobrcv,1rl6jn,jokes,top_week,15,15
slayerofpotatoes,I like my women like I like my coffee without a penis,0,cdofc3y,1rl6jn,jokes,top_week,14,14
Ravyn,I like my women like i like my scotch  years old with a bit of coke,3,cdoe184,1rl6jn,jokes,top_week,12,9
gehenom,In comments to separate joke postings,0,cdodrk8,1rl6jn,jokes,top_week,5,5
FponkDamn,Tied up in a sack and thrown on the back of donkey by Juan Valdez,0,cdof244,1rl6jn,jokes,top_week,6,6
Ravyn,I like my women like i like my coffee ground up and in the freezer,1,cdoe0ie,1rl6jn,jokes,top_week,5,4
TheArgonaut,I like my women like my coffee strong black and proudMIB,0,cdon16f,1rl6jn,jokes,top_week,4,4
BadleeGuy,I like my women like my coffee HOT,1,cdopjcc,1rl6jn,jokes,top_week,5,4
londonboy,I like my women like I Like my Science Hands on,0,cdoql3g,1rl6jn,jokes,top_week,2,2
kaosdaklown,i like my women like i like my eggs lightly beaten ,0,cdpct8m,1rl6jn,jokes,top_week,3,3
ayresian,I like my women like I like my weight going down,0,cdp74re,1rl6jn,jokes,top_week,1,1
Ulrich,I like my women how I like my pudding with their tops off and my penis in them an ulrich original,0,cdpcf4l,1rl6jn,jokes,top_week,1,1
Eclipz,AlternativelyWhat should I wearDoesnt much matter Its just going to be the two of usDoesnt hint at the numbers until the punch line hits,0,cdoxi7u,1rl6n6,jokes,top_week,6,6
CANZIGZAG,Kinda apeeling ,0,cdon8e1,1rlaja,jokes,top_week,1,1
srhrobhudsrh,I like Metallica but damn you that sucked,0,cdoj8c9,1rlcm2,jokes,top_week,1,1
SnoopDaddy,Having the inlaws over can be tough,0,cdosgju,1rlnv9,jokes,top_week,3,3
tniggle,The hardest part of going to family reunions is my erection ,0,cdp6ihl,1rlnv9,jokes,top_week,1,1
carmabound,They should have thrown the book at him,0,cdojpjg,1rlnvi,jokes,top_week,7,7
jakielim,OG Loc ,0,cdphgd8,1rlnvi,jokes,top_week,1,1
catherder,He was confused by all the words so he gave up rap and became a real musician,4,cdoub3h,1rlnvi,jokes,top_week,1,-3
Bodymaster,So what youre saying is rappers  black  steal stuff,20,cdohcxb,1rlnvi,jokes,top_week,2,-18
chandetox,D,0,cdpm5xg,1rlo1s,jokes,top_week,2,2
manewto,An oldy but a goody,8,cdom7h4,1rlok2,jokes,top_week,51,43
murpux,Classic  I use Brick  Rolls off the tongue a bit easier,1,cdordi2,1rlok2,jokes,top_week,27,26
buscoamigos,Why do you ask twodogsfucking,4,cdoqn59,1rlok2,jokes,top_week,14,10
son,This was and still is my alltime favorite joke,2,cdoovly,1rlok2,jokes,top_week,6,4
thepepi,The first time I heard this was when I was working at a summer and a  year old told me this,2,cdoq3qf,1rlok2,jokes,top_week,4,2
epsiblivion,I was expecting no body text ,0,cdos84v,1rlok2,jokes,top_week,1,1
baylithe,I love when rjokes really makes me laugh Great one,0,cdosf4v,1rlok2,jokes,top_week,1,1
spartanblue,Someone explain this to me,1,cdot770,1rlok2,jokes,top_week,2,1
Improblystoned,Ive normally seen it as two daughters and a son,0,cdotuof,1rlok2,jokes,top_week,1,1
DokerinZion,i heard this as him visiting their rooms before bed and the punch line was Gnite Cinderblock,0,cdougo5,1rlok2,jokes,top_week,1,1
formatlostmypw,I dont get it,0,cdp4ilu,1rlok2,jokes,top_week,1,1
cheesy,Ive heard the same joke but with the rd daughter dad replies shut up fridge,0,cdpd364,1rlok2,jokes,top_week,1,1
imbetterthanandrew,I thought I was in raskhistorians and I was just waiting for it to be removed,6,cdoofb5,1rlrlg,jokes,top_week,85,79
Siex,rhistoryporn this is a known fact,2,cdomoju,1rlrlg,jokes,top_week,15,13
dunkybones,And they still won,0,cdoqoni,1rlrlg,jokes,top_week,11,11
OhAces,I remember it as why was there only  Natives at Custards last stand They couldnt get the other station wagon started,1,cdp3yl5,1rlrlg,jokes,top_week,7,6
DokerinZion,buh dum tis,1,cdouffx,1rlrlg,jokes,top_week,4,3
motsanciens,How many Jews can you fit in a VW Beetle        Two in the front three in the back and eleven in the ash tray As told by my high school chemistry teacher,5,cdp62ye,1rlrlg,jokes,top_week,4,-1
ReverendDexter,They only had  Toyota pickups and a VW Microbus to get there,8,cdorctg,1rlrlg,jokes,top_week,4,-4
ILikeToSmokeWeedAlot,Very racist,82,cdopuec,1rlrlg,jokes,top_week,17,-65
CANZIGZAG,Though it should be a good way to clean up your credit history,0,cdongdu,1rltiq,jokes,top_week,2,2
CANZIGZAG,YEAH  You stick it to him bro,1,cdonk4c,1rlysu,jokes,top_week,3,2
CANZIGZAG,you gotta be micheal KEATON me,17,cdonl15,1rm0m7,jokes,top_week,46,29
gman,Everyones a Joker,3,cdos9g6,1rm0m7,jokes,top_week,9,6
Jamesth,Whats it called when the Catholic converts to Judaism,0,cdpbxrj,1rm0m7,jokes,top_week,1,1
woolybooger,I asked an acquaintance if he knew anything about electricity He answered in the affirmative so I told him I had shorts in my ass and needed help getting them out he thought it was a pretty shitty idea,7,cdolc1k,1rm220,jokes,top_week,1,-6
akaJimothy,To which a fed up St Peter exclaims Oh why dont you just go to Hell,91,cdosf79,1rm7c9,jokes,top_week,372,281
SpiGeddyLee,I think the eons long storm part is actually Jupiter Mars doesnt have an atmosphere ,56,cdorlrg,1rm7c9,jokes,top_week,167,111
DokerinZion,And St Peter fainted,20,cdoqvt7,1rm7c9,jokes,top_week,56,36
HoofaKingFarted,Your PS ruined it ,16,cdopff7,1rm7c9,jokes,top_week,35,19
boolove,Seriously need to take the ps out If someone cares enough about the sex of God to get up in a tizzy then they dont need to read jokes ,12,cdopiwu,1rm7c9,jokes,top_week,22,10
tarandfeathers,TIL in Heavens Jupiter is called Mars,5,cdowpvv,1rm7c9,jokes,top_week,8,3
MrSquiglum,Its awesome,3,cdop5ff,1rm7c9,jokes,top_week,5,2
ImRedditingOnMyPhonr,Wouldnt he know everything about everything since he created it all why does he need to ask Peter,1,cdp09gl,1rm7c9,jokes,top_week,3,2
conundrumu,This joke has been around since before god invented the Katskills,1,cdoyze9,1rm7c9,jokes,top_week,1,0
Dave,Sorry doesnt flow ,25,cdoqnf1,1rm7c9,jokes,top_week,13,-12
IWillNotLie,Wow thats offensiveLOL YOU GOT TROLLED IF YOU BOUGHT THAT,35,cdortp7,1rm7c9,jokes,top_week,11,-24
mindtrapped,gtGod decides hed like to take a vacation So he goes to St Peter at the pearly gates and asks gtPete I need a vacation being God is stressful Where should I gogtSt Peter says well Pluto has good skiinggtGod shakes his head fervently and replies no way I broke my leg there oncegtNext St Peter suggests Mars  theres an eonslong storm that could be fun gtGod says no way I almost got struck by lightning there last timegtSo then St Peter suggests Earth  you can do just about anything theregtGod fires back No way in hell Pete I went there  years ago knocked up some Jewish chick and theyre still  talking about that shitMy own beliefs aside whether a deity or lil johnny F bombs really dont add anything to a joke They represent a limited vocabulary and if you replace them with more socially acceptable  expletives it makes the joke palatable to a much larger crowd  Great joke btw   you can go ahead and downvote me now ,99,cdopv7f,1rm7c9,jokes,top_week,57,-42
MrRedLogan,Belongs in rMeanjokes,61,cdoq7zq,1rm7c9,jokes,top_week,11,-50
CANZIGZAG,Youre LION,0,cdonv5n,1rm7j0,jokes,top_week,1,1
Phonecount,This joke should be illegal What a groaner ahaha,0,cdoo2r4,1rmakg,jokes,top_week,4,4
catherder,And was shielded by the law,1,cdoubub,1rmd7q,jokes,top_week,4,3
Razna,What does the pot of glue have to do with anything,0,cdoov3h,1rmefd,jokes,top_week,2,2
johnthebison,Since this is the fifth time I have seen this todayWhat about the glue,0,cdopxc0,1rmhf9,jokes,top_week,6,6
catherder,If you adhere to the correct scales you may just get it to work both ways,1,cdoughs,1rmhf9,jokes,top_week,1,0
phoeniks,uh,3,cdopksj,1rmhf9,jokes,top_week,1,-2
thingker,Nobody had the balls to join Sorry to be that guy but eunuchs have penises members their testicals have been removed,8,cdorfhm,1rmj31,jokes,top_week,33,25
docjeff,This doesnt work because eunuchs can still have their members  just not their testicles,0,cdov7zt,1rmj31,jokes,top_week,4,4
woolybooger,Who really gives a fuck Apparently the eunuchs can not,1,cdoxbt7,1rmj31,jokes,top_week,5,4
catherder,Perhaps you could acquire a choir of castrati,2,cdou9px,1rmj31,jokes,top_week,2,0
IWillNotLie,lol this is so lameI hope I get the downvotes I so desire,1,cdowqqq,1rml47,jokes,top_week,13,12
Jondwolf,LoL,0,cdpd6kt,1rml47,jokes,top_week,1,1
mushbo,The real punchline is Why do you ask Broken rubber,9,cdoy9ru,1rml47,jokes,top_week,5,-4
ThatDevilTech,Didnt quite see that coming lolor is it cumming,28,cdor334,1rml47,jokes,top_week,10,-18
brucexavier,What,0,cdoxag9,1rmllo,jokes,top_week,2,2
jwlalanne,Is this supposed to be a three fifths compromise joke,0,cdphe2t,1rmllo,jokes,top_week,1,1
arthur,,1,cdovc76,1rmllo,jokes,top_week,1,0
arthur,Now that was a shitty situation,10,cdovcgm,1rmnhg,jokes,top_week,3,-7
PirateDinoAstronaut,I laughedhttpiimgurcomxCgXBTOpng,1,cdos4to,1rmpq6,jokes,top_week,10,9
NyQuil,He got too hung up on his work ,1,cdp0drs,1rmpq6,jokes,top_week,9,8
szdorik,Why didnt Jesus get very far past medical school He got nailed on the Boards,1,cdovdtf,1rmpq6,jokes,top_week,5,4
Suntjack, good one ,1,cdotkej,1rmpq6,jokes,top_week,2,1
Taeyeonalol,Jesus Christ that was a good one,0,cdpg96d,1rmpq6,jokes,top_week,1,1
nickysixish,In other words he got nailed,0,cdq10ab,1rmpq6,jokes,top_week,1,1
owlman,Could stand an updating but very funny,0,cdosck7,1rmqw3,jokes,top_week,18,18
Wolfir,I would have taken two seconds to replace Clinton with Obama I mean seriously Clinton hasnt been president in thirteen years Overall good joke ,0,cdp7ye0,1rmqw3,jokes,top_week,11,11
pitr,A classic always funny D,0,cdoyhjw,1rmqw3,jokes,top_week,4,4
Suntjack,Such wow Good joke Hard Laugh So Bubba,12,cdotn6b,1rmqw3,jokes,top_week,3,-9
Moki,I love it That tickled my funny bone,0,cdp3dlt,1rms4u,jokes,top_week,4,4
IWillNotLie,Palm tree  Coconut treeOh god please downvote me for Christs sake,2,cdowq1g,1rmshy,jokes,top_week,11,9
bigdickmcstick,gtgtWhat did the hurrican say to the palm treegtgt WOOSH CRASH KSSSHHHHHH,0,cdpydj4,1rmshy,jokes,top_week,1,1
arthur,rantijokes,0,cdovco1,1rmtlh,jokes,top_week,1,1
SparkplugX,I dont get it ,0,cdp0oxs,1rmx1i,jokes,top_week,3,3
wartooth,What did the letter O say to the letter QPut that thing back in your pants,0,cdp8x78,1rmx1i,jokes,top_week,4,4
Secularsam,Nice belt fuckface   Doug Benson,0,cdovw2w,1rmx1i,jokes,top_week,2,2
Watermello,Personally I thought he was going to say Hey  onetwothreefourfivesixseven,0,cdou79f,1rmx1i,jokes,top_week,2,2
aquilar,rdadjokes,1,cdoygub,1rmx1i,jokes,top_week,2,1
CANZIGZAG,So you decided to opt for Gastric bypass eh,0,cdpa2cz,1rmx1i,jokes,top_week,1,1
mclarke,Ill just show myself out shall I,3,cdovisl,1rn2qe,jokes,top_week,2,-1
CANZIGZAG,I am guessing he does all the crap in bed,3,cdpa4p5,1rn4bv,jokes,top_week,3,0
listomania,Man Im just going to LEAVE you to it,0,cdp1uaa,1rn61y,jokes,top_week,1,1
MoreThanANoob,You butchered the joke,3,cdoythy,1rn9iw,jokes,top_week,12,9
vanoranje,Cheetos they are fucking Cheetos,0,cdozxfm,1rn9iw,jokes,top_week,10,10
Forfuckssakes,The doctor fainted,1,cdpd7xb,1rn9iw,jokes,top_week,1,0
YCYC,had to read it twice,42,cdoxh5q,1rna91,jokes,top_week,217,175
Corknugget,i dont get it,26,cdoydvi,1rna91,jokes,top_week,89,63
tannerjdheard,ImIm happy I read this,7,cdp116e,1rna91,jokes,top_week,31,24
csolisr,As a native Spanish speaker I actually understood Yes we silla at first,9,cdp4dnb,1rna91,jokes,top_week,28,19
Oltarus,Amazing,0,cdp3l6w,1rna91,jokes,top_week,4,4
xxkemmyxcookiexx,I had to say it out loud,1,cdp57uv,1rna91,jokes,top_week,5,4
EmperorNOPEolean,Took me a few seconds but then I laughed,2,cdp2zfn,1rna91,jokes,top_week,4,2
erogesor,i speak spanish so the ja sounds like ha for me soo i hd to read it three times,1,cdp9xcd,1rna91,jokes,top_week,3,2
Nokijuxas,For some reason I feel like Ive heard it on QI Not saying youre infringing their copyrights or anything,0,cdpj2rg,1rna91,jokes,top_week,2,2
ForRealsaBub,Yes Oui Sí Ja  Yes we see yaYes  Yes in English Oui  Yes in French Sí  Yes in Español Ja  Yes in German,0,cdpeirj,1rna91,jokes,top_week,1,1
deathmetal,Yes we see ya,0,cdpfce6,1rna91,jokes,top_week,1,1
RussianForRent,I cant believe no ones noticed that Ja is pronounced ha not ya,1,cdpg5gb,1rna91,jokes,top_week,1,0
empirer,TIL how the French spell weEdit I did not literally mean the word we but in how the French pronounce Oui An English speaking person would spell it we if they did not know French,11,cdp99io,1rna91,jokes,top_week,5,-6
Rikkushin,As somebody that speaks Spanish it left me a bit confused at first because the pronunciation of Sí is slightly different from SeeEDIT Based on the Castilian pronunciation people,36,cdp1lbs,1rna91,jokes,top_week,24,-12
Bakkie,And the other five people said Nein,28,cdozt65,1rna91,jokes,top_week,11,-17
arthur,Huh,0,cdoyh62,1rnbme,jokes,top_week,3,3
bondoville,Reminds me of the family guy episode where Peter drinks so much red bull he gets kidney failure,27,cdp2e5b,1rnepl,jokes,top_week,128,101
agentidaho,Now i am tempted to try sweetening my coffee with energy drink,5,cdp2pbm,1rnepl,jokes,top_week,28,23
specieshumanoid,now I see noiseshttpiimgurcomTbqbjpg,2,cdp8rj0,1rnepl,jokes,top_week,20,18
jpwrangler,I lold ,26,cdp0yzq,1rnepl,jokes,top_week,41,15
sammydizzo,I dont get it,0,cdpkfmz,1rnepl,jokes,top_week,3,3
Deanb,probably one of the worst jokes Ive ever heard ,5,cdpfyr9,1rnepl,jokes,top_week,6,1
Isaius,Good one lmao,16,cdp1n7o,1rnepl,jokes,top_week,12,-4
SlenderSnake,This is nothing I drank two cans of Red Bull and went to sleep I slept for seven hours ,10,cdpczgh,1rnepl,jokes,top_week,4,-6
DoYouKnowTheTacoMan,Is the joke that you are running on the highway,25,cdp50rz,1rnepl,jokes,top_week,10,-15
DullMan,Red Bull is nasty,24,cdp5rk7,1rnepl,jokes,top_week,12,-12
StalevarZX,Whats bilingual pun Like this Со щитом иль весь в shitе protoss archon,0,cdoyxmj,1rnfsl,jokes,top_week,2,2
dyjoots,From my wife who gets a kick out of odd jokes with too much setupWhere does an American General keep his armies In his sleeviesWhere does a Russian General keep his plums In his sleeviesSleevies sounding quite a bit like the Russian word for plum Im sure you can work out a better way to work the joke,0,cdp03rx,1rnfsl,jokes,top_week,1,1
ZincHead,This kills the lemon,0,cdozfy3,1rnh7x,jokes,top_week,13,13
OhAces,Can you treat lemonaids with lemonade,0,cdp3zlb,1rnh7x,jokes,top_week,7,7
vikristianz,Please comment for more jokes,2,cdoyzxm,1rnh7x,jokes,top_week,5,3
ShedaPitaBread,what do you give a sick priest,0,cdpaqdp,1rnh7x,jokes,top_week,1,1
bcr,insert sarcasm Because i did not see that one coming,0,cdp4il2,1rnii0,jokes,top_week,1,1
Shenfara,this totally made my day thank you xD,0,cdp4b62,1rnjpg,jokes,top_week,4,4
CANZIGZAG,Are you saying that Mary Ann Ginger and Mrs Howell all grew beards  ,2,cdpa87i,1rnjpg,jokes,top_week,3,1
chaqalaqalaqa,I dont get it,2,cdpay05,1rnjpg,jokes,top_week,4,2
GeneralFriend,Straggly means growing or spread out in a disorderly or aimless way like straggly ivy I didnt specifically mean bearded ,0,cdppqyd,1rnjpg,jokes,top_week,1,1
CANZIGZAG,Away in a Manger because if Obamacare fails more and more couples will end up having babies outside the typical hosptial setting,2,cdpabp4,1rntuo,jokes,top_week,1,-1
beepbeepsean,rfarmjokes ,0,cdp3hrj,1rnujr,jokes,top_week,1,1
CANZIGZAG,Yeah right try to get someone past the security of a missle silo siteKABOOM,0,cdpahrt,1rnujr,jokes,top_week,1,1
kglass,How does she confuse you She tells you shes done,0,cdpbcr0,1rnujr,jokes,top_week,1,1
Patel,Can I ask who Berlusconi is,2,cdp57yr,1rnuua,jokes,top_week,4,2
CANZIGZAG,and in both the Roma Gypsies provide the entertainment,0,cdpalgm,1rnuua,jokes,top_week,2,2
CANZIGZAG,Jeanclaude van damme yells out No Retreat No Surrender,0,cdpap6u,1rnw14,jokes,top_week,1,1
GenericCheesePuffs,,0,cdp5rxv,1rnx83,jokes,top_week,28,28
ImNotJon,The timing of this post along with the  score makes my head hurt ,1,cdp4fic,1rnx83,jokes,top_week,13,12
ducksonmeth,Too bad green bay got their asses whooped,2,cdp5018,1rnx83,jokes,top_week,14,12
DrSensiBud,Lol,0,cdp3ned,1rnx83,jokes,top_week,3,3
jumpintothefog,I laughed but only out of depression for the direction my belived bears are heading sigh Today I want to watch the Lions destroy Greenbay,2,cdp3xvb,1rnx83,jokes,top_week,3,1
jewliuscaesar,rchibears,2,cdp979z,1rnx83,jokes,top_week,2,0
CANZIGZAG,The Detroit Lions what you have here is lions that have no pride,2,cdpasso,1rnx83,jokes,top_week,1,-1
Ishman,Fuck the Packers They fucked up,5,cdp7kre,1rnx83,jokes,top_week,1,-4
Yshane,Go lions,4,cdp6x3j,1rnyg5,jokes,top_week,5,1
CANZIGZAG,gtThe NY Jets website is downAs is the Obama Healthcare site so looks likes there are at least two places where you cant sign up for Government Health Insurance  ,3,cdpax6n,1rnyg5,jokes,top_week,2,-1
brucev,Im pretty sure the Green Bay Packers are experiencing problems with their website also For the very same reason,4,cdp4chl,1rnyg5,jokes,top_week,2,-2
CANZIGZAG,Dont forget kids There are starving Vampires in Africa that would beg for that,1,cdpb2lm,1rnz0h,jokes,top_week,1,0
bcr,I have seen this joke five times And its not even fucking funny,0,cdp4j10,1rnze8,jokes,top_week,4,4
CANZIGZAG,Out on a limb too  But are willing to branch out,1,cdpb4ge,1ro0eq,jokes,top_week,1,0
alester,Relevant  How do you fit four gay men in one barstool  Flip it upside down,1,cdphyit,1ro4rv,jokes,top_week,0,-1
bawyn,YeahI dont get it,2,cdp6re6,1ro698,jokes,top_week,5,3
CANZIGZAG,What will you be charging for a deposit,3,cdpcapm,1rofn9,jokes,top_week,1,-2
CANZIGZAG,I had a Communist shepherd piss in my flower garden many years ago from the window I yelled at him and in notime he jumped the fence and was Russian out of there,4,cdpcfru,1rofs8,jokes,top_week,3,-1
carmabound,iDunno,33,cdpao81,1roisz,jokes,top_week,202,169
galatv,It would be difficult to break into an Apple storeTheres no windows,30,cdpgur1,1roisz,jokes,top_week,178,148
NegativeFriction,Microsoft,11,cdpehqg,1roisz,jokes,top_week,52,41
Nwsamurai,iGetit,10,cdpbffm,1roisz,jokes,top_week,31,21
Wilko,iSeeWhatYouDidThere,7,cdpe5ex,1roisz,jokes,top_week,25,18
CANZIGZAG,iWATCHed it APPen,8,cdpciq9,1roisz,jokes,top_week,21,13
Dlgredael,iTT iJokes,5,cdpi1os,1roisz,jokes,top_week,15,10
MulattoLatte,iGuess,3,cdpflap,1roisz,jokes,top_week,12,9
jsayut,iThinkSo,2,cdpewas,1roisz,jokes,top_week,9,7
rabbit,iComplice,6,cdpdb6r,1roisz,jokes,top_week,12,6
kukendran,Judging by the way Apple price their products this would make it iRonic,4,cdphcpz,1roisz,jokes,top_week,11,7
justadd,iDidit,2,cdpcves,1roisz,jokes,top_week,8,6
manbearpigboy,iLold,2,cdpjf9z,1roisz,jokes,top_week,6,4
Crisps,and you can be on iwitness news   pm,0,cdplzbq,1roisz,jokes,top_week,3,3
untainable,iNo,0,cdpmfl1,1roisz,jokes,top_week,2,2
smartwhale,iKnowWhatYouDidLastSummer,3,cdpgxry,1roisz,jokes,top_week,5,2
USADV,It makes you Elliot Reeds perfect boyfriend,0,cdphkgn,1roisz,jokes,top_week,1,1
pleyland,iCantBelieveICavedIn,0,cdpihsr,1roisz,jokes,top_week,2,2
capnhook,iSwydt,0,cdpm9dp,1roisz,jokes,top_week,1,1
veganluke,iDontgetit,0,cdpmaiz,1roisz,jokes,top_week,1,1
Pritbhud,idont think anyone would care ,0,cdpvcxu,1roisz,jokes,top_week,1,1
ThomasStrife,Well isnt this joke iRonic,0,cdq0ntk,1roisz,jokes,top_week,1,1
ThomasStrife,After Steve Jobs died everyone at apple stores where crying their is out,0,cdq0u6c,1roisz,jokes,top_week,1,1
GrimCoder,iSeedeadpeople,0,cdq1eol,1roisz,jokes,top_week,1,1
lillo,iDidntDoIt,3,cdpgz9e,1roisz,jokes,top_week,3,0
zijital,uryanbimmer send this to rdadjokes theyll be like iLove it,1,cdpkssj,1roisz,jokes,top_week,1,0
brucev,iWillLetYouKnow,3,cdpf9rk,1roisz,jokes,top_week,2,-1
garotte,Apple are truly an icon,3,cdphgv4,1roisz,jokes,top_week,1,-2
Charod,Not since LeBron left Cleveland,3,cdphuov,1roisz,jokes,top_week,1,-2
lailac,My  bumped you up to  Also Really good joke D,10,cdpgzr9,1roisz,jokes,top_week,4,-6
nytcrawler,Android ,11,cdph0a8,1roisz,jokes,top_week,4,-7
tuf,Apple robs the customer daily so its just an i for an i as far as i see it,13,cdph6yq,1roisz,jokes,top_week,3,-10
Snackhat,Middle school must love you,8,cdpcca7,1romdi,jokes,top_week,21,13
whjms,hahaha butts,0,cdpl228,1romdi,jokes,top_week,2,2
CANZIGZAG,gtdrake insists on lavender scented condoms What does  scents want,12,cdpcm92,1romdi,jokes,top_week,11,-1
kiddo,Drakes the type a nigga that uses scented condoms so his farts dont stink,17,cdpfcuu,1romdi,jokes,top_week,5,-12
CalamityJesus,Nobody died he said as he set down a halfempty pint I quit drinking,8,cdpek9v,1roo4o,jokes,top_week,45,37
HoofaKingFarted,rruinedpunchlines,0,cdpmpem,1roo4o,jokes,top_week,4,4
jussiadler,ive heard it with the wife made him quit drinking,0,cdpj968,1roo4o,jokes,top_week,1,1
nakedatkeyboard,I just gave up on beer Yeah nobody said that ,0,cdptfer,1roo4o,jokes,top_week,1,1
LOHare,In a way he did  he went down from  beers to  beers,10,cdpe8sa,1roo4o,jokes,top_week,3,-7
xp,httpmediatumblrcomcccfdbaeecbbfbffdtumblrinlinemvnsiULsLrbmhpng,0,cdpdr2l,1ropd5,jokes,top_week,5,5
Jkc,httpiimgurcomRSpWvfgif,0,cdpf4ny,1ropd5,jokes,top_week,2,2
kaosdaklown,Ill come down your chimney twice Guess who made the naughty list Hohoho play with this candy cane Im out of ideas,0,cdpccfs,1roq0e,jokes,top_week,14,14
Ace,I brought you a present its in my giant sack,2,cdpcvxk,1roq0e,jokes,top_week,11,9
TheDarkShadows,Why doesnt Santa have any kidsBecause he only comes once a year and when he does its down a chimney,0,cdpef85,1roq0e,jokes,top_week,6,6
ConCarne,Whys Santa always so jolly He knows where all the naughty girls live,1,cdph44s,1roq0e,jokes,top_week,6,5
telehubby,All Ive come up with so far is Id like to go down on your chimney,1,cdpcef4,1roq0e,jokes,top_week,5,4
ChainerSummons,Ho ho ho The North Pole seems to have gone South,1,cdpetls,1roq0e,jokes,top_week,4,3
Eaglewing,Kinda Christmasy Whats the difference between insert dumbass of the week here and Santa Claus Santa stops at three Hos Wouldnt be surprised if that has been floating around reddit for years but it isnt in this thread so there you go ,1,cdpg2fm,1roq0e,jokes,top_week,4,3
