author,comment,downs,id,post,subreddit,type,ups,score
CANZIGZAG,This joke is for the birds shows a cock to get a turkey,4,cdkypap,1r8yr6,jokes,top_week,6,2
TheSeriousRedditor,Pinyin Version     Ni hao wo renshi ni ma     Dui Haojiu bujian ni hao ma Ni kanlai meishenme bianhua     Ni zuozai zheli ma     Wo hen lei ni ne     Wo hen kuaile     Tingqilai bucuo ni you haopengyou ma     Dui Jintian ni he ni de pengyoumen yao zuo shenme     Women yao zuo yanjiusheng     Ni zai xuexiao shiyong shijian de fangfa hen buheli     Qi ta ren wei shenme zheyang zuo ne Jiu kao zheyang na dao xuewei     Yanzhong de shi yanjiusheng Zhe zenme keneng     Wo yizi zheyang zuo     Shenme     Chengzhangzhong wo yizhi buting xuexi Wo neng yingfu ziru     Ni he shenme Bai putaojiu hongjiu shui huo guozhi     Zhe you shenme guanxi     Ni he dongxi ma     Naer Zheer Bushi xianzai Zai wo de daxue Weisheme ge yanjiusheng xianzai zai qingchen de huoche zhan     Wo weishenme bu yanjiusheng Zhe nandao bushi ni zai daxue huode gaoshuiping de fangfa Bushi mei geren dou zheme zuode ma Weishenme xianzai bu zheme zuo     Zhege mei you shi jian     Mei shi jian shi zhen de ma Bie diuren le     Biqi bieren lai Wo bu hui diuren     Yanjiushengshi dui ni de jiankang you hai de     Yanjiusheng Ni bu mingbai Wo yao zuo yanjiusheng     Ah Wo yiwei ni shuo yanjiusheng le Ma ya      ha ha ha     Wo de ban gong shi jiu zai zheli wo dei zou le Ni hen you mo Ni de dian hua hao ma shi shen me     Wu wu wu  wo xiang liao liao     Xian zai deng yi xia     Shen me     Shou xian ni weishenme ku Wo bu xi huan kandao bieren ku     Ni shi shen me yi si     Wu wu wu     Deng yi xia xian zai ni wei shen me ku     Wo mei ku Ni kan Zhishi gaosu ni wo de dian hua hao ma     Haoma shi Wu  wu  wu     Rong yi lijie le Haoma shi Wuwuwu     Wu san liu liuwo xiang liao liao     Wo mei you shi jian jixu liao Geiwo haoma jiu xing le     Wu san liu liuwo xiang liao liao      Wo yi jing gaosu ni      Haoma shi wu san liu liu     dian hua hao ma ye shi wu wu wu wu san liu liu ma Shi bu shi     Dui,0,cdks8xi,1r8zku,jokes,top_week,1,1
SirHoboTheSecond,You know when I was in Amsterdam they would call it a royal with cheese,3,cdkxa3w,1r8zy2,jokes,top_week,11,8
ThatDandyMan,What do you call a white girl with a yeast infection Cracker with cheese,0,cdkwfny,1r8zy2,jokes,top_week,3,3
Evildead,A hot mess ,3,cdkub4v,1r8zy2,jokes,top_week,4,1
Randomtask,hyuk hyuk LR allophone so funnee,5,cdky9vy,1r9818,jokes,top_week,14,9
CANZIGZAG,Do Chinese Sealth Drones really WOK,6,cdkys4y,1r9818,jokes,top_week,13,7
person,RelaventhttpiimgurcomZVqgif,1,cdl1cxg,1r9818,jokes,top_week,8,7
vairocana,Its the Japanese who cant pronounce the R sound,3,cdl1gh5,1r9818,jokes,top_week,4,1
jsh,This is awfur,2,cdl1l67,1r9818,jokes,top_week,2,0
CANZIGZAG,Dont the people of Seattle ie Kurt Cobain get to Nirvana,2,cdkyvem,1r981e,jokes,top_week,2,0
triplers,No no no youre not taking anything Its just theft of service,0,cdkvisp,1r985c,jokes,top_week,3,3
carmabound,If you rape a minor is it breaking amp entering,0,cdkvnzm,1r985c,jokes,top_week,2,2
OhAces,I do believe its larseny ,0,cdkxlsx,1r985c,jokes,top_week,1,1
Finrodtheawesome,Hookers arent people therefore its not rape,3,cdkvsr3,1r985c,jokes,top_week,1,-2
CANZIGZAG,That crazy Muppet frog walks into a bank to get a loanSadly he could not Kermit to paying if off with such high interest rates,2,cdkyybm,1r98rl,jokes,top_week,5,3
CANZIGZAG,Yet another frog walks into a bank to rob itThe police were immediately dispatched to the scene of the crime and they caught him WEBHANDED,3,cdkyyzo,1r98rl,jokes,top_week,5,2
OhAces,its been on once a week minimum not just six months ago,1,cdkxj5h,1r98rl,jokes,top_week,1,0
Michichael,General tip Jokes Theyre supposed to be funny ,4,cdkvrut,1r9agt,jokes,top_week,10,6
CANZIGZAG,AWWWWW is that not the cutest thing looks like they are trying to have a Seniors Moment together,3,cdkz10h,1r9agt,jokes,top_week,3,0
Rsebramos,I dont get it,3,cdkxqys,1r9bk6,jokes,top_week,7,4
CANZIGZAG,My whole family loves dogs my meth addicted brother says he is hoping to get a lab for Christmas,12,cdkz2ti,1r9bk6,jokes,top_week,16,4
CANZIGZAG,That had to be one heck of a Hallmark MomentTM FYIhttpenwiktionaryorgwikiHallmarkmoment,1,cdkz65j,1r9csd,jokes,top_week,2,1
HeMightBeJoking,I like to go to clubs with a jar of strawberry preserves That way I can hold up my jar and yell OMG this is my jam,3,cdkylmj,1r9g7m,jokes,top_week,21,18
PhillyG,Sometimes I pretend Im a pig since they cant look at upward and ask Whats up,0,cdl5glx,1r9g7m,jokes,top_week,3,3
Evildead,Because a witch is a witch is a witchwitch,0,cdl3s3j,1r9i9o,jokes,top_week,1,1
dajerkler,but a pile of dead rotting foreskin would be a perfect window display for a circumcision office,0,cdlg091,1r9p9t,jokes,top_week,3,3
dbowman,httpiimgurcomUtBugif,1,cdl2znp,1r9phr,jokes,top_week,3,2
Evildead,Hospital Hand Sanitizer,0,cdl3pug,1r9phr,jokes,top_week,2,2
thunderstrut,This isnt a joke,2,cdl0ipc,1r9ply,jokes,top_week,5,3
GeorgeOlduvai,Back to rpolitics with you,0,cdl1yfu,1r9ply,jokes,top_week,2,2
Evildead,Slander ,0,cdl3mav,1r9ply,jokes,top_week,2,2
Evildead,Sadly john didnt know that his used braille bible was vandalized beforehandSo jesus had one leg and squawked all night father,0,cdl3m74,1r9reu,jokes,top_week,3,3
CANZIGZAG,They say that believing in Jesus POINTS the way to God,1,cdlcdpg,1r9reu,jokes,top_week,3,2
carmabound,I find myself in a state of confusion,1,cdl1c9r,1r9rmi,jokes,top_week,4,3
carmabound,Youre layering it on a little thick,2,cdl1hb2,1r9u3d,jokes,top_week,6,4
Evildead,And your mouth gaping,3,cdl3k2y,1r9w9r,jokes,top_week,3,0
madeyouangry,Heh Its funny because hes lonely,1,cdl52ie,1r9xu1,jokes,top_week,12,11
loufizzle,What does your parents do Grammar,4,cdldd5e,1r9xu1,jokes,top_week,9,5
johnny,,0,cdmbocj,1r9xu1,jokes,top_week,2,2
thefacestealer,You should probably add necrophilia as well ,0,cdl30ci,1r9z1y,jokes,top_week,2,2
Evildead,Seems some one out grew the foot hands fetish and,0,cdl3jcp,1r9z1y,jokes,top_week,1,1
Evildead,My imaginary friend brags about his huge cock which im not too happy to hearbefore i have sex,1,cdl3iy8,1r9z66,jokes,top_week,10,9
SentientHAL,I thought his dad was dead,5,cdl90jx,1ra53t,jokes,top_week,20,15
arthur,dun dun DUUUUUUN,0,cdl4wsm,1ra65z,jokes,top_week,1,1
SNSDTyeon,Thought it was going to be about the Colorado shooting whoops,1,cdlb2m2,1ra65z,jokes,top_week,2,1
CANZIGZAG,Dont believe him Cant you see hes LION to you damn it,1,cdlcva8,1ra65z,jokes,top_week,2,1
Pydope,I dont get it,0,cdl5v1x,1ra7gz,jokes,top_week,2,2
CANZIGZAG,He asks if he is meringue  more like light headed I would think,1,cdlcscw,1ra7gz,jokes,top_week,2,1
Huskar,Not too bad of a joke but you managed to ruin it,5,cdl5hm8,1ra8sh,jokes,top_week,17,12
mlapecaf,Lay out is important,1,cdl95bk,1ra8sh,jokes,top_week,7,6
jsayut,Some things you just cant explain,0,cdl7aes,1ra8sh,jokes,top_week,3,3
kushe,I dont understand this can someone explain please,2,cdlbwdr,1ra9pt,jokes,top_week,7,5
MarchingPillows,This reminds me of the punchline to Benders joke in The Breakfast Clubhttpwwwimdbcomtitlett ,1,cdljlrk,1ra9pt,jokes,top_week,2,1
Sammish,REEEEEPOOOOOST,15,cdlcw7t,1ra9pt,jokes,top_week,2,-13
OptimumWaste,Well atleast she came out of coma,136,cdl672h,1ra9vc,jokes,top_week,691,555
sayja,What a nice guy he came to bring her out of the coma,51,cdl6km3,1ra9vc,jokes,top_week,286,235
NiceMeetingYou,Fuck I didnt realise it was a joke untill i read the punchline ,48,cdl7rzx,1ra9vc,jokes,top_week,194,146
LoganJH,Reposting one of the top jokes of all time from rjokes  brave move,39,cdl8ybt,1ra9vc,jokes,top_week,94,55
LivingSaladDays,I thought it was going to be a joke about commas ,3,cdlct5f,1ra9vc,jokes,top_week,19,16
cowmix,The Doctor must have been a Shameless fan,1,cdlbdng,1ra9vc,jokes,top_week,7,6
VeraCitavi,I just read this to my husband  What the fuck is that website ,0,cdlqxfb,1ra9vc,jokes,top_week,6,6
mrsshrew,Awesome,5,cdl7t0l,1ra9vc,jokes,top_week,7,2
CivilityBeDamned,Worth it,2,cdlfxqj,1ra9vc,jokes,top_week,5,3
javoss,hahahaha dark lol,2,cdlix46,1ra9vc,jokes,top_week,4,2
Kaxs,Thats not funny,4,cdldavs,1ra9vc,jokes,top_week,6,2
MuseofRose,Damn good joke,2,cdlgk19,1ra9vc,jokes,top_week,3,1
iratam,FUNNY ,3,cdlfor1,1ra9vc,jokes,top_week,3,0
sean,I see this joke on here every week ,4,cdlnfb7,1ra9vc,jokes,top_week,3,-1
ChoskarChulian,I dont get it D,32,cdl88v1,1ra9vc,jokes,top_week,31,-1
jerrymatthewmorris,Ugh  My inner grammar Nazi is going wild ,9,cdl9nfe,1ra9vc,jokes,top_week,7,-2
fingin,I read the title as A woman was in a comma,8,cdl9rjq,1ra9vc,jokes,top_week,8,0
GStringPanda,Funny and sad at the same time,4,cdlaxw8,1ra9vc,jokes,top_week,2,-2
youwishyouwereacat,There are times when I could have murdered her,7,cdla33g,1ra9vc,jokes,top_week,6,-1
czhunc,The ending I always heard was gtThe doctor asked what happened gtAnd the husband said I dont know First I unzipped my pants,14,cdl9w4h,1ra9vc,jokes,top_week,6,-8
xdleet,Dumbest fucking joke ever,9,cdljrqr,1ra9vc,jokes,top_week,4,-5
lightsbane,So if I want karma here I just need to repost top jokes from  months to a year ago,31,cdl90on,1ra9vc,jokes,top_week,18,-13
jg,Damn probably throat cancer from the HPV virus Oral not even once lol so many down votes it was satire people ,41,cdl7nx6,1ra9vc,jokes,top_week,26,-15
bobotheking,Just as sexist as the last time it was posted,40,cdl9fg1,1ra9vc,jokes,top_week,17,-23
YCYC,Bad bad bad bad bad,96,cdl6rqu,1ra9vc,jokes,top_week,22,-74
NyQuil,gtGive it to me straight I need the feed backTerrible joke I dont get it at all gtA doctor walks into a bar He appears to be exhausted his hair is disheveled his face is drawn Bartender asks rough day The doctor sits at the bar and says its flu season give me a shotrdadjokesgtAn elderly man walks into a bar holding hands with a beautiful young woman He is obviously a man of great wealth as his watch is decked in diamonds and his suit is of Italian make As the pair sits down the bartender says Im sorry sir but we dont serve minors here nodding towards the woman The man retorts Now hold on just a minute How would you know if shes a minor You havent even asked for her ID The bartender shrugs and says shes clearly a gold diggerGroan gtA large block of ice walks into a bar and places his order Ill take a whisky on the rocks but dont serve my kidsMehgtThe bartender walks into a doctors office and says same punch line different context This would work better if it came immediately after the first one gtTwo nuns walk into a bar The first is elderly and seems to be fully devout The other is young blonde and appears to be new to the convent Bartender says the elderly nun I was wondering if you could settle a little dispute for us You see my trainee believes that true holiness can be achieved in a matter of days rather than with the years on end that Ive been practicing One year out of catholic school and she thinks that she is as holy as me Ill tell you what replies the bartender both of your write down your arguments and Ill decide who among you is most holy The sisters begin to write their cases The elder nun finishes first and slides her paper toward the bartender At this point the blonde sister has pulled out a calculator and starts to plug away at the buttons The bartender reads the first paper aloud Everyday for the last  years Ive woken at dawn for morning prayer I prepare breakfast lunch and dinner for the entire convent while using any spare hours for reading the texts and scripture In case that isnt holy enough I volunteer on the weekends Good gracious sister Says the bartender this is quite exemplary By now the young nun has finished and has passed her paper to the bartender All this says is πr r Hold on is this an equation for the area of a circle exclaims the bartender Oh sorry says the blonde blushing It was supposed to be circumferenceSo the its supposed to be a holegtA bartender has been going through a financial rough patch and hoped that his wife would accommodate for the tough times by letting him try anal Now the wife resents her husband and was appalled by his audacity to ask for such a thing with their marriage on the fritz She denies his request Later in the week a man walks into the bar and asks the bartender for a prostitute The bartender is about to send the man on his way when he gets an idea that would make him some money while simultaneously punishing his wife You see that woman in the corner He asks Well shes one of the best girls we got You go over to her and take her into the private room You can do whatever you want with her no matter how much she resists Its all part of the act After youre through come back here and pay full price  The man nods his head excitedly in agreement and walks toward the wife The bartender watches from afar as the two exchange a few quick words All of a sudden he sees the man grab his wife by the arm and pull her into the private room The bartender smiles inwardly to himself and thinks Ha Thatll teach the bitch to appreciate me Plus Im making a small fortune After about twenty minutes the wife comes out alone She heads over to the bartender with a slight limp Wheres your new friend asks the bartender smiling He owes me a little money The wife snickers pulls her husband in close and whispers in his ear I let him use the back door and walks away Yup the only thing funnier than a rape joke is an anal rape joke especially when theres prostituion involvedgtA man walks into a bar and the bartender says NO STOP GET OUT OF HERE THIS ISNT FUNNY ANY MOREBest one yet ,2,cdl7ef3,1rad5f,jokes,top_week,9,7
catherder,An elderly man walks into a bar holding hands with a beautiful young woman He is obviously a man of great wealth as his watch is decked in diamonds and his suit is of Italian make As the pair sits down the bartender says Im sorry sir but we dont serve minors here nodding towards the woman The man retorts Now hold on just a minute How would you know if shes a minor You havent even asked for her ID The bartender shrugs and says shes clearly a gold diggergt Best one of the lot havent seen that one before,0,cdlqk17,1rad5f,jokes,top_week,3,3
iamasociopath,I remember this joke being about bush and probably every other president ever ,3,cdlngcx,1raesf,jokes,top_week,23,20
kleinbottlecap,Nonpolitical comment,2,cdllllz,1raesf,jokes,top_week,16,14
Greggers,Yore,3,cdlml0r,1raesf,jokes,top_week,14,11
CobaltFang,Ah the South Where kids are hospitalized for being hospitable,62,cdla0wi,1raesf,jokes,top_week,27,-35
CANZIGZAG,gtnew tiles in their bathroomGood luck getting the old ones grout,1,cdlcnf1,1rahc6,jokes,top_week,3,2
CANZIGZAG,HAHAHA  That was wheely quite a funny spoke,1,cdlcm1m,1rajkf,jokes,top_week,2,1
CANZIGZAG,Be ObamaCareful he still is president afterall,0,cdlckud,1rakgs,jokes,top_week,7,7
naghallac,heh,0,cdm2doz,1ransa,jokes,top_week,1,1
iratam,I dont get it ,3,cdlg0dq,1ransa,jokes,top_week,3,0
SentientHAL,Is this a fucking joke to you,2,cdl9v8i,1rapg8,jokes,top_week,3,1
CANZIGZAG,Queasy does it,4,cdlchvl,1rasps,jokes,top_week,16,12
alester,Havent seen this one around here before  Very funny,0,cdlcb5a,1rasps,jokes,top_week,12,12
carmabound,At least it isnt a repostbut I found it hard to swallow,1,cdlgcrz,1rasps,jokes,top_week,12,11
avalisk,I dont like there being any leftover mystery in my jokes  how does the bear vanish,1,cdll1b5,1raszc,jokes,top_week,13,12
Dragoru,rconfusedboners,1,cdlnjkr,1raszc,jokes,top_week,6,5
drdoom,Funny but the punch line leaves something to be desired,0,cdme6et,1raszc,jokes,top_week,1,1
Kasko,NOTE Im dont speak german but  diese ist eine reposte,30,cdlbga1,1raszc,jokes,top_week,9,-21
therealraybeam,rdadjokes  ,0,cdlqoxy,1rayw7,jokes,top_week,2,2
Traveshamockery,Flava Flav has a huge clock,0,cdma1lu,1rayw7,jokes,top_week,1,1
CANZIGZAG,Is grey time also known as half time,4,cdlluyn,1rayw7,jokes,top_week,4,0
Dragoru,I think it flows better as with my dick in the way ,2,cdlnkti,1rayzh,jokes,top_week,5,3
iratam,And that is why Santa has a big sac He cums only once a year ,5,cdlfy1j,1rayzh,jokes,top_week,2,-3
CANZIGZAG,Why did he buy a kitten  He already had Pussy Galore in Goldfinger,5,cdlm16o,1razgy,jokes,top_week,7,2
epicplatypus,its taking too long for it to come out,0,cdll3mz,1rb0ga,jokes,top_week,5,5
beer,Its terrible  The buildup was painful then it crapped out at the end,1,cdlpely,1rb0ga,jokes,top_week,6,5
CANZIGZAG,I heard Part  is in the works to be entitled Shit Happens,3,cdlm4ja,1rb0ga,jokes,top_week,4,1
azurescen,This was posted a few days ago,0,cdlro5r,1rb0ga,jokes,top_week,1,1
Hadouken,When it did come out it was shitAnd I hated the one about garbage trucks It was Rubbish,0,cdlrw99,1rb0ga,jokes,top_week,1,1
alester,I have seen it and I cant get it out of my head,1,cdlqf86,1rb0ga,jokes,top_week,1,0
totric,not good joke,8,cdljeex,1rb0ga,jokes,top_week,1,-7
TheGrammarCop,What are you ,9,cdlll9x,1rb0ga,jokes,top_week,1,-8
FlipFlopTurtleShop,When I read he started fighting with the dog I thought it meant he was helping the dog,2,cdlqql2,1rb7ap,jokes,top_week,40,38
KingAndross,But funny joke nonetheless,6,cdlm81u,1rb7ap,jokes,top_week,16,10
caboosemyhero,I first saw it as a jets fan then a giants fan then he ended up being a cowboys fan,2,cdlta5s,1rb7ap,jokes,top_week,8,6
Himynameis,This was a funny joke but at the end it made me a little sad Sorry to bring melancholy to this threat,3,cdly059,1rb7ap,jokes,top_week,5,2
TyrannaSamboRex,Why does it have to be a pitbull,15,cdlq81d,1rb7ap,jokes,top_week,15,0
mojojojo,Goddamn liberal media  ,16,cdllny5,1rb7ap,jokes,top_week,14,-2
CANZIGZAG,Boyfriend cat says Dont worry it will turd up soon enough,8,cdlm793,1rb7g9,jokes,top_week,4,-4
kojak,How do you get to Carnegie Hall Practice man practice,0,cdlkir1,1rbdha,jokes,top_week,2,2
CANZIGZAG,Cant get to Carnegie Hall get Carnegie Hall through an amplifier with Dolby Surround SoundTM  to come to you,1,cdlmbtg,1rbdha,jokes,top_week,2,1
CANZIGZAG,A gorilla does not clog up the drain with nearly as much hair,3,cdlmey2,1rbehf,jokes,top_week,6,3
Therabidmonkey,People talk to him the way he talks,3,cdlwmsm,1rbj2o,jokes,top_week,9,6
KeepPushinIt,I dont get it,2,cdlxkqt,1rbj2o,jokes,top_week,3,1
pgb,Fantastic,0,cdlkobx,1rbmg3,jokes,top_week,6,6
AmirZ,Never heard that one before,1,cdm4dhx,1rbmg3,jokes,top_week,1,0
Tacsol,So the cat could get to the other side,1,cdljnm1,1rbn6x,jokes,top_week,9,8
wilieecoyote,So that it could harm the chicken crossing the road no more,1,cdll209,1rbn6x,jokes,top_week,3,2
Excaliber,Because Curiosity is a dickhole ,1,cdlu0gi,1rbn6x,jokes,top_week,3,2
CANZIGZAG,Because as of yet there is no cure,2,cdlmmmb,1rbn6x,jokes,top_week,3,1
dartmanx,Did you really buy the peaceful exploration of Mars bit,0,cdm8iv5,1rbn6x,jokes,top_week,1,1
StrobesNQueens,This isnt a joke,1,cdm11vb,1rbn6x,jokes,top_week,1,0
CANZIGZAG,The librarian knew for a fact that the library did not have such a book she directed him to the  section of the libraryMacramé you know knot tying,35,cdlmqlo,1rbnld,jokes,top_week,129,94
Michaeletc,Isnt theyre all out the punchline to this,5,cdltwe8,1rbnld,jokes,top_week,34,29
MancmbSeepgood,Fuck off was unnecessary and probably made it less funny than it should have been Just felt forced,8,cdlsskm,1rbnld,jokes,top_week,26,18
TheSeanWalker,I thought she was gonna say its in the DoItYourself section,0,cdluj9z,1rbnld,jokes,top_week,12,12
carmabound,Shhh,6,cdlkhe1,1rbnld,jokes,top_week,13,7
HGlpIyHkLiGP,Then drink the water  but not before adding the cyanide,2,cdlow17,1rbnld,jokes,top_week,4,2
eunice,Laughed out loud Truly  not just the smiled then stopped Am a librarian by the way,1,cdlxbmu,1rbnld,jokes,top_week,3,2
jokerofthedeck,I would have checked the selfhelp section ,3,cdlsea0,1rbnld,jokes,top_week,4,1
TruExOnyXKilLA,The man should have said Never mind I know how it ends,0,cdm5amk,1rbnld,jokes,top_week,1,1
thewizard,Where I got it fromhttpwwwjokebookeujokessuicidebest,14,cdlmz7j,1rbnld,jokes,top_week,14,0
thewizard,I might as well cross this off the list of reasons why Im going to hell,27,cdlmx02,1rbnld,jokes,top_week,16,-11
thewizard,I might post another one,26,cdln24k,1rbnld,jokes,top_week,12,-14
manias,gt A male whale and a female whaleThanks now my tongue is all kinked,15,cdlsno0,1rbu8e,jokes,top_week,60,45
CANZIGZAG,He should find himself a nice HumpBack Whale,14,cdlmvjo,1rbu8e,jokes,top_week,24,10
Funkimonster,Here it is in video formhttpwwwyoutubecomwatchvIxPRkYDyNZo,0,cdltxhu,1rbu8e,jokes,top_week,7,7
aquafemme,I know its just a joke but I didnt think whales could swallow people because they have a baleen which is a huge screen for sifting plankton,5,cdlva8d,1rbu8e,jokes,top_week,7,2
Aputheapricot,The guy whale is used to swallowing the seamen he blew Could it be the redditor everyone was talking about a couple of weeks back,6,cdlr0qz,1rbu8e,jokes,top_week,8,2
DarkSideOfLeSpoon,rSeamenOnFigurineshttpwwwredditcomrJokescommentsrbueawhaleofajoke,0,cdm3ppk,1rbu8e,jokes,top_week,1,1
iconhas,Whats lost in a naval battleSeamen,0,cdm706s,1rbu8e,jokes,top_week,1,1
ThatFag,ramjokes,1,cdlwmpn,1rbu8e,jokes,top_week,1,0
CANZIGZAG,One can only do this when they have a stealy determination to do so,1,cdm5m82,1rc27g,jokes,top_week,2,1
dreadredJ,Any time I hear someone say Ill be back with Arnolds accent I always respond with And Ill be Beethoven,7,cdlpt48,1rc35x,jokes,top_week,42,35
FlipFlopTurtleShop,Hey Arnold,6,cdlr9fc,1rc35x,jokes,top_week,20,14
Zeppelanoid,This has more potential as an antijoke IMO,2,cdlwf0u,1rc35x,jokes,top_week,6,4
pogare,Cheesy but in a good way,2,cdlt3o5,1rc35x,jokes,top_week,4,2
CANZIGZAG,gtArnold responds Ill be BachHe better be quick these great producers of music are decomposing,2,cdm5qql,1rc35x,jokes,top_week,3,1
carmabound,It wooddont leave us stumped,10,cdlq2e8,1rc6wx,jokes,top_week,33,23
StifledByCorp,This gives a hole new meaning to morning wood,5,cdlv7c6,1rc6wx,jokes,top_week,11,6
GeneralFriend,they make great knockers,1,cdmd5tw,1rc6wx,jokes,top_week,5,4
UnoriginalPenguin,Aw man httpwwwredditcomrJokescommentsyjsbawomangotbreastimplantsmadeofwoodyesterday,5,cdlzid7,1rc6wx,jokes,top_week,6,1
thrilled,You think thats strange my wife has a cedar chest,0,cdmz2n5,1rc6wx,jokes,top_week,1,1
AMotherlessChild,That is mahogany,2,cdlzydf,1rc6wx,jokes,top_week,2,0
CANZIGZAG,My girlfriend got wooden breast implants too What a Birch,4,cdm5sjw,1rc6wx,jokes,top_week,4,0
mtwestbr,Drill baby drill,2,cdlyoqn,1rc6wx,jokes,top_week,1,-1
arguablytrue,Would I like it more  Wood eye,2,cdmaeeo,1rc6wx,jokes,top_week,1,-1
SicTim,Knockers you can knock on,2,cdmdxr3,1rc6wx,jokes,top_week,1,-1
HGlpIyHkLiGP,To go look at some TTYs,2,cdlv7fv,1rcdgz,jokes,top_week,5,3
carmabound,Control Alt Del eat,4,cdlslry,1rcdgz,jokes,top_week,6,2
arthur,                   ,1,cdls8if,1rcdgz,jokes,top_week,2,1
CANZIGZAG,It was an old  PC with the dozen peripheralscords still connected to it ended up tied around the chicken,1,cdm5yu5,1rcdgz,jokes,top_week,2,1
NickNegus,Thought for sure this was going to be a boner joke,5,cdlxeli,1rcdl8,jokes,top_week,30,25
Excaliber,Yay I dont understand it ,2,cdltndg,1rcdl8,jokes,top_week,9,7
Excaliber,Oh wait now i do ,5,cdltnlg,1rcdl8,jokes,top_week,6,1
Excaliber,Why is it only boys,3,cdltnso,1rcdl8,jokes,top_week,2,-1
ShubhamP,Someone explain this one please,0,cdmfj9o,1rcfp5,jokes,top_week,1,1
CANZIGZAG,gtA farmer buys several pigsHe sure went Whole Hog didnt he,4,cdm61am,1rcfp5,jokes,top_week,4,0
carmabound,I was way off track with this one,75,cdlsqgb,1rcg2l,jokes,top_week,387,312
tricky,A better endingThe friend says Wow Thats amazing Did you get headThe other guy says No I couldnt find it ,55,cdlydea,1rcg2l,jokes,top_week,219,164
watermizu,I laughed so hard and bow my head in shame ,9,cdlt41i,1rcg2l,jokes,top_week,32,23
emptycollins,This is my favorite joke that Ive never retold ,6,cdlyzcr,1rcg2l,jokes,top_week,26,20
evanh,Ending legitimately caught me off guard  Well done sir,3,cdm3x7g,1rcg2l,jokes,top_week,15,12
JaredCP,,2,cdm5e0f,1rcg2l,jokes,top_week,6,4
ToastyXD,To be quite honest I thought this joke was going to go somewhere along the lines of Brokeback Mountain because you say they were getting a little testy testes Happy that it was a twist on a joke I heard before I like this one better,3,cdm2xh4,1rcg2l,jokes,top_week,7,4
quinnclever,I heard a very similar joke So a news reporter was doing a story on homeless people and wanted to find out what type of interesting things they found on railroad tracks So he visited the local soup kitchen and found a table of three homeless men sitting down He asked to sit down and said he was doing a story on cool things found on railroad tracks He asked the first man what the coolest thing he has ever found Once while wondering the track I found a twenty dollar bill and came back here with cheap wine and drank with my palsThe next man said Last week when I was crossing the tracks I found a hundred dollar bill and came back here a with lots of liquor and got drunk with my friends The news reporter was shocked at how much money he found and asked the last guy what the best thing he has found the man replied Last weekend I found a beautiful women tied to the tracks so I untied her and had the best sex ever all day and night we did all kinds of thingsThe news reporter was astounded that a women would have sex with this homeless man The man siting beside him leaned over and asked if he gotten head The homeless guy said unfortunately I could not find it,1,cdm9ufa,1rcg2l,jokes,top_week,4,3
nbSailboat,This is too close to a subplot of Child of GodhttpenwikipediaorgwikiChildofGod for me to laugh,0,cdm63vm,1rcg2l,jokes,top_week,2,2
sunzi,Classic,1,cdlx78b,1rcg2l,jokes,top_week,2,1
ZincHead,Ive heard this joke told before with a less wordy description Still pretty good though it had me going for a while,0,cdlzmjh,1rcg2l,jokes,top_week,1,1
