author,comment,downs,id,post,subreddit,type,ups,score
carmabound,That is amaizeingly cornier,1,cdn1zpb,1rgovd,jokes,top_week,4,3
CANZIGZAG,Did he give him a kernal of wisdom,2,cdn4ftm,1rgovd,jokes,top_week,2,0
MNGaming,I see what you did thereTaking the Tr from tricks and exchanging it with the K in Kids to get Trids and kicks Nice ,1,cdn5pts,1rgr73,jokes,top_week,4,3
PirateDinoAstronaut,Oh man I havent heard this joke in so long It was the first storyform joke I ever heard,0,cdnfa5j,1rgr73,jokes,top_week,2,2
CuriousRob,A threelegged cat trying to cover its shit on a linoleum floor is busier,2,cdn36x0,1rgsbe,jokes,top_week,5,3
bobsabillion,Love sick worm in a bowl of spaghetti,2,cdn484m,1rgsbe,jokes,top_week,3,1
BurnAtlanta,A  whore when the fleets in port,2,cdn55fo,1rgsbe,jokes,top_week,3,1
CANZIGZAG,The lawyers for the carnival ride operators,5,cdn4ktw,1rgsbe,jokes,top_week,2,-3
bobsabillion,Nooooooo  Fine Ill ditch my stuff and count  grassesEdit Guys I just thought grasses sounded funnier were in the jokes section ,16,cdn42r1,1rgt0e,jokes,top_week,86,70
shifflez,Omg I hate you ,14,cdn4ity,1rgt0e,jokes,top_week,71,57
DeadCabbie,That was perfect lol,1,cdn3rmr,1rgt0e,jokes,top_week,14,13
dndtweek,My mom and sisters left me at a rest stop in Pennsylvania after I let this joke go on for about an hour Worth it ,5,cdnel5w,1rgt0e,jokes,top_week,18,13
jsake,Oh man This is one of my all time favourites Like you say its super fun to tell but boy do people hate you at the end of it Especially the version I tell which has a slightly different noise A ticking noise from the top of a bell tower and instead of just becoming a monk the person has to be taken through several levels of indoctrination each time being led on to believe theyll get an answer only to be told someone higher up must know  If I want to I can stretch this bad boy out for well over a half hour but rarely do due to fear regarding my personal safety immediately after the punchline drops,6,cdn9off,1rgt0e,jokes,top_week,18,12
Treeboys,Aaaaaaaaaaaaaaaaaaaaaaaahhhhhhhhhhhhhhhhhhhhhhhh,1,cdn4n5v,1rgt0e,jokes,top_week,9,8
Bangs,This is wonderful I hate you,1,cdn6ns2,1rgt0e,jokes,top_week,7,6
kayserenade,ThishttpiimgurcomlOuWdYgif about sums up how it feels like,0,cdneec8,1rgt0e,jokes,top_week,6,6
tacodeoho,What do you do if you tell this story to a monk,0,cdnfhiz,1rgt0e,jokes,top_week,4,4
sumupid,this joke takes me way back  Thanks,0,cdn8so3,1rgt0e,jokes,top_week,3,3
NewsWeeks,People who tell this joke or its variations are always so pleased with themselves Instead of bringing joy to their listener they bring frustration I guess the appeal is that the listener can then go out and get someone else with it but that just passes on the frustration I didnt like this joke when I first heard it  years ago and I dont like it today I dont think humor should be onesided But hey comedy is tastebased and if yall like this joke and it makes you happy thats ok with me I just dont understand the appeal,1,cdnfslb,1rgt0e,jokes,top_week,4,3
Thogicma,haha I love this one I used to tell it all the time  The best way to tell it in person is to finish with He opens the door and sees what has been making the noise and then wait  Inevitably someone will ask what it was and you can reply Im sorry I cant tell you youre not a monk  Beautiful,0,cdng4vk,1rgt0e,jokes,top_week,3,3
idefixthedog,But how do I tell it when Im not a monk It loses all credibility because theyll say well neither are you so you dont know eitherWill have to become monkstarts counting grass,0,cdnfhpv,1rgt0e,jokes,top_week,2,2
Shaviro,A monk installing doors,0,cdnfzp4,1rgt0e,jokes,top_week,2,2
jcaseys,It was the headmaster of the monastery having a little bit of alone time He goes to great lengths to make sure no one finds out ,0,cdnssk1,1rgt0e,jokes,top_week,2,2
tedtutors,Shaggy monk story,0,cdngk9u,1rgt0e,jokes,top_week,1,1
ultrachronic,Im imagining it as a giant one of thesehttpdeitchleycomwpcontentuploadsmonkeyjpg right  RIGHT,0,cdnhjpw,1rgt0e,jokes,top_week,1,1
dream,Life is too precious to waste on this crap,1,cdnjb56,1rgt0e,jokes,top_week,2,1
ShadyDude,You are a special kind of asshole,0,cdnkmpj,1rgt0e,jokes,top_week,1,1
WetNightmares,Was it the last guy who fell for it banging his head on the wall,0,cdnlq9u,1rgt0e,jokes,top_week,1,1
reggaetonfreak,Fuck,1,cdnb8an,1rgt0e,jokes,top_week,1,0
Crayons,This is Perfection ,1,cdnbzv0,1rgt0e,jokes,top_week,1,0
buscoamigos,this is not a joke its an antijoke  Its not why I subscribed to this sub,3,cdnhcad,1rgt0e,jokes,top_week,3,0
Raeman,Ive been telling this joke for years stealing minutes and hours from peoples timeWho are you and how did you hear my monastery joke,2,cdndm0k,1rgt0e,jokes,top_week,1,-1
Afrenc,Ive heard a different version where when the man comes back he doesnt have a number answer The correct answer is supposed to beonly God knows how many blades of grass are in the worldJust sayin,4,cdnd6sz,1rgt0e,jokes,top_week,2,-2
NinjaPeppers,I bet Sheldon would hate this Big Bang Theory Reference,14,cdnbrnq,1rgt0e,jokes,top_week,2,-12
CANZIGZAG,Are you stillhorsing around,3,cdn4ndy,1rgtcy,jokes,top_week,2,-1
OKLTHS,Come on Little Johnny,0,cdomput,1rgu6j,jokes,top_week,1,1
razezero,You both suck,2,cdnr4l6,1rgwig,jokes,top_week,1,-1
CANZIGZAG,Ohhhh I get it thats why its called a hardware store,9,cdn4sy9,1rgwig,jokes,top_week,6,-3
globexco,I think this would be better without the magic hammer part in the questionDid you hear about the blind carpenterHe picked up a hammer and saw,0,cdngfd2,1rh1ci,jokes,top_week,3,3
carmabound,Im trying knot to let that one soak in,0,cdn70v1,1rh4s7,jokes,top_week,4,4
CANZIGZAG,OKOK its a gross question but what breed is the dog  A Bloodhound,4,cdn7awu,1rh4s7,jokes,top_week,6,2
catherder,Bloody hell thats a bit off,0,cdnapj2,1rh4s7,jokes,top_week,2,2
BurnAtlanta,No its not  Chemically speaking  Its a compoundYou can have fun debating whether alcoholic drinks are tinctures which is what you call something dissolved in alcohol many of those somethings herbal extracts  You can have more fun masturbating over rNSFW,0,cdn7vsy,1rh4su,jokes,top_week,5,5
CANZIGZAG,Too much of this can one getchemically impaired,2,cdn7fhd,1rh4su,jokes,top_week,2,0
x,This was awesome  Even if you decide the joke isnt worth your time I highly suggest you read the small paragraph after the joke it is rather interesting,0,cdndj6b,1rh509,jokes,top_week,6,6
LordHarryWotton,YOUVE GOT TO BE FUCKING KIDDING ME,0,cdn9y3h,1rh509,jokes,top_week,3,3
PirateDinoAstronaut,aka how to piss people off with formatting and unnecessary details,0,cdnbnzd,1rh509,jokes,top_week,3,3
CANZIGZAG,  ,1,cdn7jwy,1rh509,jokes,top_week,3,2
severusquim,TLDR,0,cdnfoky,1rh509,jokes,top_week,1,1
Frhzrd,Im disappointed That punch line,0,cdo6cea,1rh509,jokes,top_week,1,1
QuarterLifeCrisis,That was really very interesting Especially the afterwards I guess it was just a lucky day that I had nothing else to do and needed to keep my mind busy otherwise I probably wouldnt have read it all the way through ,0,cdpu7t4,1rh509,jokes,top_week,1,1
yummerzzz,Sadly this is one of those jokes that can only be said out loud,0,cdn84iz,1rh726,jokes,top_week,1,1
dentitten,I always feel sorry when I read about homeless cars,1,cdnaav3,1rh7r2,jokes,top_week,23,22
myownreddit,At least the homeless car now has a buddy ,0,cdnfptb,1rh7r2,jokes,top_week,5,5
carmabound,Thats cold,2,cdn9r96,1rhebd,jokes,top_week,5,3
Escalade,I heard the movie wasnt that good anyways httpwwwimdbcomtitlettreffnaltt,0,cdpoja9,1rhebd,jokes,top_week,1,1
dssorg,The older bull says Burr its cold  Lets go down to the barn and slip into a nice warm Jersey,0,cdni0v1,1rhmo8,jokes,top_week,6,6
AFreudianSlip,Correction Heifers are cattle that are female that have never given birth A cow is a female that has given birth Cattle  CowSource Am a farmer,0,cdnrgc5,1rhmo8,jokes,top_week,5,5
ItsAChainReactionWOO,If I may Ive told this joke for years now and use it for more of a philosophy of life as a single male in his s The young bull says lets run down and fuck as many as we can The old bull says lets walk and fuck them all Moral of the story as Ive learned is be patient with women and treat them all with respect Dont burn bridges Eventually what you couldnt fuck one day could be fuckable the next ,1,cdo66os,1rhmo8,jokes,top_week,3,2
werepat,How do you cheer up a grumpy squidTen tickles,76,cdnhq61,1rhzjd,jokes,top_week,343,267
guntotingpothead,go to rdadjokes you will like it there,70,cdnfmza,1rhzjd,jokes,top_week,150,80
DASPOSTMASTER,Every year around black Friday I get to use this joke  I make it into a story about how the dolls were shocking kids so they started testing each one before it left the factory  Some faulty ones still got through and were shocking little kids  They fixed it by testing them twice  So now every ticks me Elmo gets  test ticklesThe joke goes over really well if you tell it like its something you heard on the news,12,cdniv93,1rhzjd,jokes,top_week,45,33
meelmo,yeah but no one ever mentions the prostate exam fuck that shit,2,cdnjdm5,1rhzjd,jokes,top_week,14,12
madshm,This is also why I was fired from the ticklemeelmo factory,7,cdnk5cc,1rhzjd,jokes,top_week,15,8
destructifier,queue the suicidal Elmo gifs,1,cdnlaxl,1rhzjd,jokes,top_week,6,5
riveal,Did you purposely title in the past tense,0,cdntww4,1rhzjd,jokes,top_week,2,2
TheKert,httpwwwyoutubecomwatchvKDrsm,0,cdnkpyq,1rhzjd,jokes,top_week,1,1
robertqout,if quizzes are quizzical what are tests,0,cdnrhwp,1rhzjd,jokes,top_week,1,1
Aoroc,I dont get itedit oh nevermind now I get it Youre supposed to say it in your head or out loud to get it Just read it and didnt get it ,0,cdns09b,1rhzjd,jokes,top_week,1,1
anhero,Stop touching me Elmo,0,cdnt12m,1rhzjd,jokes,top_week,1,1
diagonallines,RIP dad,3,cdnoljm,1rhzjd,jokes,top_week,2,-1
Jekkus,A joke my dad loved was tldr I dont have a dad,2,cdnvemw,1rhzjd,jokes,top_week,2,0
QueenKaleesi,Ive heard this joke before so Im going to hire a lawyer and hit you with a lawSEUSS,10,cdnkini,1rhzjd,jokes,top_week,1,-9
nolossforwords,This joke could be betterDid you know they are making the new ticklemeelmo dolls anatomically correct I heard each one get two test tickles before they leave the factoryFeel free to put this on the bad pun coon meme,11,cdnq6yd,1rhzjd,jokes,top_week,4,-7
TheBoil,Now thats what its all about,0,cdng7zg,1ri2yo,jokes,top_week,1,1
Dethklokninja,You should have left this one on the road ,0,cdngbim,1ri3he,jokes,top_week,1,1
Crizcook,And the other responds wow a talking snowman,0,cdnp6pb,1ri3u0,jokes,top_week,3,3
Unclefrank,Are you him,0,cdo5gkm,1ri3u0,jokes,top_week,1,1
catherder,So what can you pick up with that,0,cdo4687,1ri7h7,jokes,top_week,2,2
KnightOfNights,Theres no esc,6,cdnhx5b,1ri8nq,jokes,top_week,30,24
pninjaman,you just need some SPACE SHIFT yourself away from HOME,2,cdns3jx,1ri8nq,jokes,top_week,11,9
beans,At least you tried Ill give you an upvote for the Ft,1,cdo266g,1ri8nq,jokes,top_week,4,3
vinemadness,The key thing is that you are not board,0,cdo2cvs,1ri8nq,jokes,top_week,1,1
paulasutton,No because hes black,23,cdnqnze,1ribo5,jokes,top_week,20,-3
baseballandfreedom,being from ohio which has something like the biggest amish population in america this joke is awesome,0,cdnwwbc,1ricnf,jokes,top_week,3,3
CANZIGZAG,Was Harrison Ford a Witness,2,cdnz27y,1ricnf,jokes,top_week,3,1
djglasg,rclopclop,8,cdnkxo6,1ricnf,jokes,top_week,4,-4
CANZIGZAG,Oh my Lord,1,cdnz3ig,1rihsp,jokes,top_week,2,1
monkeydinosaur,Jokesa on you Im actually Thai,5,cdnr0hu,1rinda,jokes,top_week,23,18
tahiru,AFRICAS NOT A FUCKING COUNTRY nice joke tho,4,cdnte0i,1rinda,jokes,top_week,17,13
pervokris,Shouldnt it be an Uzbek,0,cdnrhdp,1rinda,jokes,top_week,7,7
TheAwsom,Bravo if you typed that out,1,cdnqeka,1rinda,jokes,top_week,4,3
HappyRotter,Logged in just to upvote you I think Id hate this joke if told in person but reading the first two words and then the punchline was beautiful,0,cdo2c1i,1rinda,jokes,top_week,4,4
AaronLifshin,Should be an Ecuadorian,0,cdnr59b,1rinda,jokes,top_week,2,2
loufizzle,A ugandan is already an african,0,cdo1u9v,1rinda,jokes,top_week,1,1
son,Oh it took me a while to realize it wasnt a bar THEN I got it,0,cdopcmx,1rinda,jokes,top_week,1,1
arguablytrue,Im straining to get the joke here,0,cdnuv4k,1rio0d,jokes,top_week,4,4
AttackTribble,A pastafarianhttpwwwhuffingtonpostcomtexaspastafarianlicensephotonhtml,1,cdnnfih,1rio0d,jokes,top_week,4,3
CANZIGZAG,HAHAHA  I can see right through that joke,1,cdnz5fn,1rio0d,jokes,top_week,1,0
patnard,wat,0,cdnu1iq,1rio3h,jokes,top_week,2,2
CANZIGZAG,Owls are nocturnal active during the night time hours Mating in the rain and the dark Well come on who would enjoy that,1,cdnz9kx,1rio3h,jokes,top_week,1,0
crescentkick,thank you for this,1,cdo02yx,1rioqs,jokes,top_week,4,3
MrRandomSuperhero,Oh god I just had a major flashback to Master Of Olympus ZeusI finally got the joke after over  years I get it Thank you,0,cdnqkxc,1riqcd,jokes,top_week,3,3
nehpets,I dont get it,0,cdnus3d,1riqcd,jokes,top_week,2,2
catherder,Alternate version from tv show The Young Ones told by two rats playing cardsKnock knockWhos thereEuripidesEuripides whoYou Euripides trousers Eumenides trousers,0,cdo2o4v,1riqcd,jokes,top_week,1,1
zforeversleeping,nice,0,cdnndo8,1riqea,jokes,top_week,1,1
DictatorDan,This will get more traction in rAntiJokes,0,cdnnvy4,1riqea,jokes,top_week,1,1
bwsullivan,Dude Chinaman is not the preferred nomenclature,3,cdnu7fd,1rishr,jokes,top_week,10,7
Vethica,You want a Japanese guy in this joke L and R are separate phonemes in Chinese,2,cdns4q3,1rishr,jokes,top_week,7,5
boombatz,Thats from the Sopranos right I love that one,0,cdnzm6f,1rishr,jokes,top_week,3,3
dellarness,Thats the Japanese Chinese is r gt l  Example fried rice gt fly lice,0,cdnv8vj,1rishr,jokes,top_week,2,2
SDSakuragi,May want to post this in rMeanJokes instead While the punchline itself isnt particularly offensive Chinaman in the modern context is considered a racial pejorative similar to addressing a black man as Boy Still funny though so have an upvote,4,cdnrpvb,1rishr,jokes,top_week,5,1
WHiStLr,Its snot,1,cdnqgmb,1riwsu,jokes,top_week,3,2
CANZIGZAG,Do they not allow for conjugal visits in that state,3,cdnzie7,1riy6y,jokes,top_week,3,0
ultrachronic,Sorry to kill the joke but in the very first series the theme song had an extra verse with Will Smith on a planeEdit Starts at httpyoutubenCqRmxDnwts,0,cdnrmwb,1rj4eo,jokes,top_week,8,8
johnny,Still four more than whats singing on stage ,11,cdnw4dz,1rj4mh,jokes,top_week,52,41
colourandshape,I was told this joke a long time ago but it was at a tokio hotel concert ,1,cdo2lb2,1rj4mh,jokes,top_week,5,4
TonyUK,Same with Take That first time Steps,1,cdo7uvw,1rj4mh,jokes,top_week,1,0
WhyamIreadingthis,I dont get it Justin Bieber has young fanswhy is that funny,25,cdnx4r7,1rj4mh,jokes,top_week,19,-6
hitsec,Midget files away,0,cdo3uza,1rj6z9,jokes,top_week,1,1
Escalade,I think the correct term is elf,0,cdpo6i5,1rj6z9,jokes,top_week,1,1
CatchEmAllXY,I saw this coming  miles away ,3,cdnwguy,1rj7pn,jokes,top_week,9,6
CANZIGZAG,Holy Hannah,0,cdnzrbu,1rj7pn,jokes,top_week,1,1
BurnAtlanta,Thats what she said but what she meant was you have to buy water at three times the price you were paying for it so her daughters can get their contraception for free,4,cdnwn5u,1rj91j,jokes,top_week,2,-2
wheeliegimp,Would be her life cow is female,4,cdntpka,1rj934,jokes,top_week,6,2
catherder,Youd be scared too if you were steered in there,0,cdo2pwe,1rj934,jokes,top_week,1,1
dudester,I thought it was because theres no Mexicans in Hockey,1,cdnwxli,1rj96w,jokes,top_week,4,3
CANZIGZAG,Jesus could walk on water but skating on ice seemed to be more of a challenge for him,1,cdnzwt0,1rj96w,jokes,top_week,2,1
TopAce,Smart dog,2,cdo25v0,1rjf6v,jokes,top_week,13,11
mschyljuk,Repost,38,cdnw7b2,1rjf6v,jokes,top_week,8,-30
fauxnetikz,Two old ladies were strolling along the beach  One had a stroke,56,cdo4w96,1rjgme,jokes,top_week,286,230
xxdofxx,This thread is a minefield of downvotes  I thought the joke was funny and I even understood the punch line,4,cdoaldm,1rjgme,jokes,top_week,30,26
bobbyjoechan,Can someone explain the joke Is she supposed to be talking about a cane but it sounds like shes talking about a penis,61,cdo6jqz,1rjgme,jokes,top_week,33,-28
nakedatkeyboard,This is just Nasty,61,cdo5flf,1rjgme,jokes,top_week,23,-38
GoingBraindead,ITT Downvotes,115,cdo4ksz,1rjgme,jokes,top_week,51,-64
imhigher,Nsfw is for nude picsnot words wtf,283,cdo4115,1rjgme,jokes,top_week,131,-152
abeniman,Why do milking stools have three legsBecause the cow has the udderDont hurt me please,7,cdo2lgj,1rjh43,jokes,top_week,31,24
ttnorac,No stay a while I laughed ,7,cdnvbxi,1rjh43,jokes,top_week,25,18
vinemadness,At the risk of milking this threadTwo cows in a field  One says Moooooh  The other replies Oi I  was going to say thatIll give myself a cow pat on the back,2,cdo2bwe,1rjh43,jokes,top_week,11,9
sea,You are milking this joke for all its worth,1,cdo3bfi,1rjh43,jokes,top_week,5,4
Grue,BarbedcowueOk that was terrible,1,cdo2hl0,1rjh43,jokes,top_week,4,3
jebusyoon,Two cows on a hilltop enjoying the grass when all of a sudden a helicopter lands  One cow turns to the other and says Hey look a helicopter  The other cow exclaims OMFG  A talking cowSorry that joke had no cow puns  I should just hoof it out of here,0,cdoomuc,1rjh43,jokes,top_week,2,2
thetobester,I guess the steaks werent high enough ,0,cdp3sch,1rjh43,jokes,top_week,1,1
NothingToDoGuy,But did it grass over,8,cdo17ts,1rjh43,jokes,top_week,3,-5
Haggg,Thank you the whole Chinese thing was silly,1,cdnxu5y,1rjh66,jokes,top_week,4,3
steventheunicorn,He called in sick from work,2,cdo3ku5,1rjh66,jokes,top_week,5,3
dellarness,How did she hear him,1,cdnv9yv,1rjhsq,jokes,top_week,5,4
Escalade,I dont get it,0,cdpo9ah,1rjhsq,jokes,top_week,1,1
DRTYRYDR,I chuckled then felt bad about itgreat joke ,0,cdnwh8d,1rjjje,jokes,top_week,2,2
Adreeisadyno,I do not like holocaust jokes Anne Frankly I will not stand for them,0,cdpfbe5,1rjjje,jokes,top_week,2,2
CANZIGZAG,HAHAHA that left me in stitches,9,cdo09ag,1rjkdw,jokes,top_week,9,0
boomatog,i dont understand ,1,cdo29cv,1rjn25,jokes,top_week,2,1
IQof,How do you get him downInvite a few Mexican kids over and tell them its a pinata party ,1,cdoajzf,1rjn25,jokes,top_week,2,1
nathantheman,U sir make a valid point I meant ceiling  the roof would make no sense,1,cdonw56,1rjn25,jokes,top_week,2,1
willonic,Confucius say good to meet girl in park better to park meat in girl,3,cdo3djo,1rjske,jokes,top_week,23,20
pwndevil,Confucius sayman who drop watch in toilet bound to have crappy time,4,cdo1xot,1rjske,jokes,top_week,22,18
palordrolap,Confucius say Real knowledge is to know the extent of ones ignoranceWait Am I doing this right,3,cdoa8ld,1rjske,jokes,top_week,15,12
TripleFFF,Confucious say Man with hand in pocket always on the ball  Confucious say Man with hole in pocket feel cocky all day,1,cdo3587,1rjske,jokes,top_week,10,9
Nunbarsheguna,confucius say masturbation come in handy,2,cdo87kk,1rjske,jokes,top_week,9,7
catherder,Confucius say Woman who fly aeroplane upside down feel crack upConfucius say Man who go sideways through turnstile probably going to BangkokConfucius say Man who have hole in pocket not only feel silly but feel dicky tooConfucius say Naked man doing pushups in long grass very suspicious,2,cdo2mhw,1rjske,jokes,top_week,8,6
goodoldmac,Confucius say man who go to bed with sex problem wake up with solution in hand,1,cdo7ne0,1rjske,jokes,top_week,6,5
Rihozzle,Confucius say man who run behind bus get exhaustedConfucius also say pretty girl who sit on Judges lap get honorable discharge ,3,cdoad6n,1rjske,jokes,top_week,9,6
ChintzyFob,Confucius sayMan who run in front of car get tired,2,cdoak8y,1rjske,jokes,top_week,7,5
invisiblereality,Confucius say Man who stand on toilet high on pot,3,cdo8sdy,1rjske,jokes,top_week,6,3
damitws,Man who fart in church sit in own pew,3,cdo2wda,1rjske,jokes,top_week,5,2
Omnipotato,Confucius say man who go to bed with itchy butt wake up with stinky finger,1,cdo92pc,1rjske,jokes,top_week,3,2
Teriyakuza,Confucius say he who stand on corner with hands in pocket no feel dumb feel nuts,1,cdo865f,1rjske,jokes,top_week,1,0
queefcannon,Confucius say never play leapfrog with unicorn,1,cdoa4el,1rjske,jokes,top_week,1,0
SLeAKeR,They put a rock in a can amp throw it on a tin roof Ping Pang Ting,1,cdo5hrx,1rk0kl,jokes,top_week,1,0
dmnhntr,Borat is that you,0,cdocgto,1rk1ie,jokes,top_week,1,1
nakedoc,Reeves,3,cdoal4w,1rk2uj,jokes,top_week,1,-2
Gawdzillers,On a nearby road they see Gorbachev piss ass drunk leaning out of the sunroof of a limousine with American flags all over it,6,cdo3it0,1rk310,jokes,top_week,26,20
GENGUNNER,I guess its not for me sigh,1,cdo1wwj,1rk310,jokes,top_week,16,15
LA,Alternately The Russians assembled the greatest computer ever Imputed all the greatest communist speeches and asked it the question When will true Communism be  achieved After a while it came up with the answer miles They ran the program again and it came back with the same answer  miles They then asked the computer how it came to that conclusion It replied Every  years plan will bring us one step closer to true communism,0,cdobm7d,1rk310,jokes,top_week,7,7
DataDwarf,nice joke dude D i laughed,1,cdo26kg,1rk310,jokes,top_week,7,6
szdorik,U have it all wrong dingus  Khrushchev issues decree saying crew is alive Bresvnev issues decree saying train is now moving And dont forget reason train stops Stalin looks out window no more tracks,0,cdovi8z,1rk310,jokes,top_week,1,1
iglitz,Well I like my woman how I like my steak bought cut into little pieces and kept in the freezer,1,cdodbzi,1rk5qb,jokes,top_week,2,1
Guanaja,I like my women like I like my coffee covered in bees  Eddie Izzard,0,cdpq1ps,1rk5qb,jokes,top_week,1,1
LlON,its a big penissss god damn ithttpswwwyoutubecomwatchvJgjZDs,6,cdo8dzm,1rk8rg,jokes,top_week,61,55
Headbanger,Of course it seems short when you have such giant quads,5,cdo8mqq,1rk8rg,jokes,top_week,44,39
minimalistreply,Definitely telling this at thanksgiving dinner ,3,cdod5mq,1rk8rg,jokes,top_week,7,4
teejoooooo,Playboy April ,1,cdoiuna,1rk8rg,jokes,top_week,5,4
dowhatuwant,Love these jokes making fun of bodybuilders junk Truth is you might have a bigger junk than a bodybuilder but that blonde you like will never know,1,cdoqram,1rk8rg,jokes,top_week,3,2
vaiyach,rdadjokes is this way gt,1,cdo3f1h,1rk9mf,jokes,top_week,3,2
jakielim,By Steffan Andrews httpswwwfacebookcomsteffanandrewsmusic dj ,0,cdo442s,1rk9mf,jokes,top_week,1,1
lledargo,I take offense to this Mostly because I know the lions wouldnt be able to defend themselves,2,cdo7kwr,1rk9zn,jokes,top_week,14,12
razezero,I think hes lion,0,cdoi208,1rk9zn,jokes,top_week,2,2
maximuz,lame joke,1,cdo86q0,1rk9zn,jokes,top_week,2,1
Hongo,Well That was fucking dreadful Definitely telling this one next chance I get ,1,cdo9xdz,1rkc25,jokes,top_week,6,5
npoppy,plate,1,cdoa0dq,1rkc25,jokes,top_week,4,3
Piogre,Wow stolen from day,2,cdoij6z,1rkc25,jokes,top_week,2,0
carmabound,And they like hip hop,1,cdo49hi,1rkew7,jokes,top_week,7,6
urbanbutter,Go to bed grandma youre drunk,0,cdoq7n2,1rkew7,jokes,top_week,1,1
ilovefuckedup,They dig homesLike you dig homesHarmless pun not heaps racist,0,cdoujpl,1rkew7,jokes,top_week,1,1
IWillNotLie,Wow thats so racist,5,cdo4gye,1rkew7,jokes,top_week,5,0
dcampthechamp,Who even says negro anymore,2,cdo6h2a,1rkew7,jokes,top_week,2,0
woolybooger,Had you the intelligence to formulate an actual joke I might have been somewhat offended However seeing how you didnt I will leave you with your bare face hanging out,0,cdolm3t,1rkh8e,jokes,top_week,2,2
umpire,I have serious reservations about this joke,8,cdo7h35,1rkikw,jokes,top_week,46,38
IAmAnObvioustrollAMA,Ill trade you  and this shiny bead for this joke ,1,cdo9zrs,1rkikw,jokes,top_week,8,7
DesertRat,GROAN Heh,0,cdoa75i,1rkikw,jokes,top_week,2,2
LookDeeper,for  beads and a shiny nickel,0,cdoahch,1rkikw,jokes,top_week,2,2
Bodymaster,A priest and a rabbi are walking down the road together when they pass a playground full of children playing The priest turns to the rabbi and saysWe should go over there and screw one of those kidsThe rabbi repliesSure out of what,15,cdob8py,1rkj5f,jokes,top_week,59,44
Rabbimeat,It sure does,11,cdo9wtd,1rkj5f,jokes,top_week,37,26
Venkerman,Explain please Im slow,2,cdoaglp,1rkj5f,jokes,top_week,11,9
cleanyesgermno,But there wasnt anything else to fuck so I used an alterboy ,2,cdoj8cn,1rkj5f,jokes,top_week,3,1
Petrocrat,I think if you said it like Radish Inn it would have a better effect and people would still make the Raddison connection,0,cdo9e6z,1rkj7h,jokes,top_week,2,2
Shazaamalama,Youre right It is a terrible joke but using the accent makes it funny I actually started thinking of the actor on SNL that used to imitate him ,1,cdo6oia,1rkj7h,jokes,top_week,2,1
OhAces,My favourite is Eric Cartmans Bob Saget and Sarah Silverman were pretty great too,0,cdocola,1rkkcu,jokes,top_week,1,1
linearone,Mitch Hedberg ,0,cdo6a3u,1rkktv,jokes,top_week,5,5
OhAces,A once frozen banana is not a regular banana hearing Mitch deliver this joke is funny but written in text its just a sad story about a guy whos going to have a black banana in his lunch bag,0,cdocvdw,1rkktv,jokes,top_week,1,1
liberaltexan,But dont they want to live with such a fungi,38,cdo8975,1rklmr,jokes,top_week,143,105
ScopeMonkey,Because of the institutionalized racism that prevents them from being able to afford it,16,cdoaakj,1rklmr,jokes,top_week,50,34
verdatum,Sometimes I think we need a rlaffytaffyjokesEdit Well damn  It is indeed a thing,2,cdoeddi,1rklmr,jokes,top_week,11,9
MPiR,Would you want to live under a toads pile of excrement,0,cdoflbe,1rklmr,jokes,top_week,5,5
heyjoetodd,because they live in closetssosorry,1,cdodeh0,1rklmr,jokes,top_week,4,3
