author,comment,distinguished,downs,id,post,subreddit,type,ups
PolloMagnifico,"I love the look in a persons eyes when that last piece of their soul nopes the fuck out.

It will be ok...

*one of us...*

*one of us...*

*one of us...*",null,2,cdna2qy,1rhfb1,talesFromRetail,top_day,14
Nazi_Psychiatrist,"Typically, sociopaths demonstrate no strong reactions to illogical hotbed political/social topics (e.g. Octomom or Catholic priest child molestation)."" Your comment history indicates many such strong reactions, therefore I find your claim of sociopathy lacking. 

That will be two Reddit silvers. No, I do not take insurance. See you next week.",null,1,cdnateb,1rhfb1,talesFromRetail,top_day,5
Firemission13B,I just don't like people in general. ,null,0,cdnfqa2,1rhfb1,talesFromRetail,top_day,5
Darthspaz92,It took you 3 years? Props to you man. I was only in 3 maybe 4 months before I got to that point.,null,0,cdna1xx,1rhfb1,talesFromRetail,top_day,3
techiejames,I know the feeling.  I don't give a fuck anymore.,null,0,cdncx8n,1rhfb1,talesFromRetail,top_day,1
adelajoy,"One time, I came home from a long shift at the Customer Service Desk and my husband was mad at me for something. I remember saying, ""Sorry... No, I'm not sorry. I say sorry all fucking day! I'm not sorry for those things, but it's my job to say sorry. 'Sorry you couldn't find that', 'Sorry that's the wrong price', 'Sorry you didn't like this product'... I am not truly sorry for this, so I refuse to apologize to you!""

It was a week or two after that when I put in my notice. The job was not worth the stress it was putting on me and subsequently my marriage. Also, the realization that I hated everyone was a major factor.",null,1,cdnhcxb,1rhfb1,talesFromRetail,top_day,3
ThorneLea,"I've been here for a decade. 

Help me.

I can't get out.

Edit: I am rapidly running out of fucks to give.",null,0,cdo0nmn,1rhfb1,talesFromRetail,top_day,1
the_Bryman,"Working in retail just makes you realize all the bullshit materialism and entitlement that is rampant in society today. It hardens your heart and with every false smile and ""have a great day"" you utter, you die a little more on the inside.",null,0,cdo2tm4,1rhfb1,talesFromRetail,top_day,1
locolarue,I also close produce. What a jerk! I feel your pain. Thankfully we don't deal with that free sample crap.,null,0,cdn9t1h,1rhdjx,talesFromRetail,top_day,2
Godolin,"&gt;Hey, I use to work in a fruit store aswell, I know what its like, so deal with it!

So he used to be in your position, but chooses to be the customer he would have hated in your position? People nowadays, man.",null,0,cdnaqqb,1rhdjx,talesFromRetail,top_day,1
krzymndy,"You can ask for free samples in produce? I mean, I don't see why not but I had no idea it was ""a thing""!",null,0,cdndbxg,1rhdjx,talesFromRetail,top_day,1
MagicalKartWizard,"&gt; but when I saw him ordering things from the deli hed give me a bitter stare but that was it.

You should've smiled just as sweetly as you could and given a little wave.",null,0,cdndywy,1rhdjx,talesFromRetail,top_day,1
DolfyuttSrednaz,"It was the way that she showed her CCP and the way she said that it was her ID is what annoyed my manager. She was being snobby the entire check out period and was trying to rush me through the check verification process (which is annoying enough as it is) and when it came down to asking for ID, she kinda smirked and ""Here, how about THIS one? Good enough for you?"", like she was telling me, hey, I have a gun, so hurry this shit up. That pissed off my manager and he made a scene. I was a little worried at that point, but I wasn't expecting her to do anything, but my manager wasn't having any of it. But then she apologized and just handed me her drivers license. By the way, the only accepted forms of ID are driver's licenses, state issue (driver's permits/state ID's) and military ID's. No green cards, CCP, or anything else. My computer just doesn't allow it.",null,1,cdnajzg,1rhcmf,talesFromRetail,top_day,7
Godolin,"&gt;I walked into a store when an irate woman was berating the crap out of the manager on duty.

&gt;I explained to her that we simply.... I let her know that she was no longer welcome... if you'd like to talk to my Regional, I'll dial the number...

So why had you just walked in when you were clearly on shift there?

I'm sorry, but I'm absolutely lost here. Are you a customer? An employee? Are you telling this from the MoD's point of view? Is this a modern art exhibit?",null,1,cdnao7z,1rhcmf,talesFromRetail,top_day,6
ScaldingSoup,"People get so weird about IDs sometimes.  It's like, what are you going to do if you get in an accident or something?  I never said that to anyone, obviously but sheesh.  

My least favorite was one bozo that thought it would be cute to hold it almost to my nose and then pull it back really fast.  

Him: ""Well you saw it"" &lt;annoying, thinks he's WAY funnier than he is laugh&gt; 

Me: ""No sir, I really do have to compare the names and see the face on it to make sure"".",null,0,cdnb5bi,1rhcmf,talesFromRetail,top_day,3
DolfyuttSrednaz,"I had a woman show me a CONCEAL/CARRY PERMIT to me as a form of ID to verify a check. I was shocked, and my manager told her that I can technically take that as a form of intimidation or even the start of a robbery. She was taken aback and apologized profusely and showed me her driver's license. YOU COULDN'T HAVE DONE THAT FIRST?!",null,4,cdn9d1m,1rhcmf,talesFromRetail,top_day,6
adelajoy,"I once had someone show me his younger brother's ID, and tell me that he was the older brother, so it should count. But this is ***way*** weirder.",null,0,cdne11m,1rhcmf,talesFromRetail,top_day,2
DolfyuttSrednaz,"It was the way that she showed her CCP and the way she said that it was her ID is what annoyed my manager. She was being snobby the entire check out period and was trying to rush me through the check verification process (which is annoying enough as it is) and when it came down to asking for ID, she kinda smirked and ""Here, how about THIS one? Good enough for you?"", like she was telling me, hey, I have a gun, so hurry this shit up. That pissed off my manager and he made a scene. I was a little worried at that point, but I wasn't expecting her to do anything, but my manager wasn't having any of it. But then she apologized and just handed me her drivers license. By the way, the only accepted forms of ID are driver's licenses, state issue (driver's permits/state ID's) and military ID's. No green cards, CCP, or anything else. My computer just doesn't allow it.",null,1,cdnajzg,1rhcmf,talesFromRetail,top_day,7
Godolin,"&gt;I walked into a store when an irate woman was berating the crap out of the manager on duty.

&gt;I explained to her that we simply.... I let her know that she was no longer welcome... if you'd like to talk to my Regional, I'll dial the number...

So why had you just walked in when you were clearly on shift there?

I'm sorry, but I'm absolutely lost here. Are you a customer? An employee? Are you telling this from the MoD's point of view? Is this a modern art exhibit?",null,1,cdnao7z,1rhcmf,talesFromRetail,top_day,6
ScaldingSoup,"People get so weird about IDs sometimes.  It's like, what are you going to do if you get in an accident or something?  I never said that to anyone, obviously but sheesh.  

My least favorite was one bozo that thought it would be cute to hold it almost to my nose and then pull it back really fast.  

Him: ""Well you saw it"" &lt;annoying, thinks he's WAY funnier than he is laugh&gt; 

Me: ""No sir, I really do have to compare the names and see the face on it to make sure"".",null,0,cdnb5bi,1rhcmf,talesFromRetail,top_day,3
DolfyuttSrednaz,"I had a woman show me a CONCEAL/CARRY PERMIT to me as a form of ID to verify a check. I was shocked, and my manager told her that I can technically take that as a form of intimidation or even the start of a robbery. She was taken aback and apologized profusely and showed me her driver's license. YOU COULDN'T HAVE DONE THAT FIRST?!",null,4,cdn9d1m,1rhcmf,talesFromRetail,top_day,6
adelajoy,"I once had someone show me his younger brother's ID, and tell me that he was the older brother, so it should count. But this is ***way*** weirder.",null,0,cdne11m,1rhcmf,talesFromRetail,top_day,2
doctor_hooha,She sounds kinda awesome.  I've worked with a few... characters before.  But sometimes you gotta just appreciate some entertainment in the workplace.,null,2,cdn8mp0,1rha57,talesFromRetail,top_day,7
techiejames,She could have been a stripper. ,null,0,cdndh90,1rha57,talesFromRetail,top_day,4
Liquid_Sky,"I feel that is what I would do in a lame attempt to appear ""sexy""... I would feel so awkward.",null,0,cdnebhw,1rha57,talesFromRetail,top_day,3
doctor_hooha,My first job was in a tourist shop in a port city.  The ratio of dogs in strollers to children on leashes that came through there was unsettling.,null,11,cdn8p98,1rh8hc,talesFromRetail,top_day,68
now_she_is_dead,"Manager saw this one:

Fabric store.  Now the round tables that were used in my store (See [Image](http://www.lovesewing.com/magazine/wp-content/uploads/2012/11/fabric_store_service1-500x281.jpg) for an example) are not actually attached to the base.  The fabric is balanced along the edge of these rounds.  The center of the table is unoccupied (we usually put a price sign in there).

So on this particular day, the manager watches as this woman comes into the store with her toddler.  She then picks up the kid and puts her in the opening at center of the table, takes a bolt of fabric, and puts it on top of the opening to stop the kid from escaping.

My manager races over to the table and asks the lady what on earth she's doing, that's very unsafe!

""Well, how am I supposed to shop and watch her at the same time?""

... sigh.",null,11,cdn98sr,1rh8hc,talesFromRetail,top_day,56
MobileInfantry,"Last week, a woman let her kid run around the petrol pumps at work, during one of our busiest times. Kid almost got squashed by a SUV pulling up at another pump. But her 4 year old kid wouldn't do that, he knows better, was the response I got when I pointed it out to her and asked her to leave him in the car in future. ",null,4,cdn9d6t,1rh8hc,talesFromRetail,top_day,29
crickey23,"One day this lady with seven kids in tow stopped by my shoe department. Not only did the kids absolutely destroy our displays--moving samples around, throwing clearance shoes on the floor, pulling out chairs to play hide and seek--the mother made no effort to control her kids. In fact, she was also supremely rude. She constantly interrupted other customers that were talking to me and refused to believe me about all the clearance we had being out on the racks (well, at that point, on the floor). The whole ordeal was awful; it took an hour and a half and two people to reset everything.",null,0,cdncanb,1rh8hc,talesFromRetail,top_day,26
Icalasari,"To be fair, the kid also needed to be punished for the urination stunt and the huge mess

Honestly though, good parents would have kept a close enough eye on the kid that he wouldn't have managed the mask stunt",null,3,cdn91y0,1rh8hc,talesFromRetail,top_day,15
AlphaEnder,"I used to feel terrible about lost kids, or kids that were running around and smacked their head, or kids (not infants, that's awful) that would fall out of carts. Now I just laugh quietly because while the kid is in pain, they'll learn and the parent gets a nice fright that will hopefully teach them to look after their children better. ",null,0,cdna0re,1rh8hc,talesFromRetail,top_day,11
RDMcMains2,Did they have to pay for all the (one would think) ruined toys?,null,2,cdn8u75,1rh8hc,talesFromRetail,top_day,11
asian_uni_lecturer,"My accounting lecturer once said on a recorded lecture:

""And who do people take to the furniture store with them? Little kids! And what do these kids do? They SHIT all over our lovely chairs! That's why we need an account for damaged furniture and accrued damages"".

I still cannot believe he said ""shit"" on a recorded university lecture. Still. He's a bloody good lecturer!",null,5,cdnbt3p,1rh8hc,talesFromRetail,top_day,12
prettehkitteh,I cannot believe how people could raise their kid so horribly that the little shit could PEE on things he didn't own and think it's okay. This is full of SO MUCH WIN. I wish something like this could have happened at the toy store i worked at for months. ,null,1,cdnenn9,1rh8hc,talesFromRetail,top_day,6
AKraiderfan,"In the future, you might want to tell Jared to word it: ""clean it up or else you're banned,"" not ""clean it up AND you're banned.""

They should be banned regardless, but there is no incentive for them to clean up the piss if they're getting banned, and they could just walk right now (I am assuming people like that have no shame and would have no sense of obligation to clean up their mess). Have them clean it up, AND THEN tell them they're not welcome here.",null,1,cdngz8b,1rh8hc,talesFromRetail,top_day,7
Techsupportvictim,"I don't blame the parents for nature kid stuff. Like their infants starts crying etc.

But that nope, not happening in my watch. If you are under 13 you will be with your parents the whole time. If mommy and daddy don't like this you can all leave. If they let you run off that is child neglect and they will be explaining it to the Juvie cop that comes to collect the unattended minor in my store

(And yes I did it once to a chronic family. They would let their 8 year old twins come in while they smoked outside, or even went to movies or to have a drink)",null,0,cdnhrga,1rh8hc,talesFromRetail,top_day,6
compguytracy,"i worked at bk many many years ago, back when pokemon was a big thing. bk had the toy rights for the pokemon, and let me tell you, people are insane. we would get 1000, yes, 1000 toys, a week, on wednesday, oh yeah whopper wed, 99 cents, joy. we would be sold out by friday at the lates, probably thursday. i am telling you, i have seen parents come through drive thru, order 10 kids meals, throw all the food out, because we could not sell just the toy, then come back for ten more. adults crying in line because we where sold out, on a monday. come back wed by lunch, we should have more, nope. fucking people asking for rainchecks like we where a retail store. thank goodness out truck came at 5am or i would have been mobbed then too. all for a talking pikachu, or charizard. ",null,1,cdnh9i1,1rh8hc,talesFromRetail,top_day,5
ferafish,"I worked at a grocery store, and there was one family that was horrible for that. They had two kids, I would put them both at under 10, that just ran throughout the store. I saw the little girl run out the doors into the parking lot. No parent came to look for her, nothing. She wandered back in a few minutes later.

Another incident with them had them making a fort on the toilet paper shelf and hiding behind the toilet paper. I walked over and told them they had found a great hiding spot. So great, in fact, that weren't they worried their parents would forget them and leave them behind? They immediately got off the shelf and I fixed the display.",null,0,cdnfyp6,1rh8hc,talesFromRetail,top_day,3
crankypants15,"Wow, some of these other stories. At what point should someone call the police for child endangerment? 
",null,0,cdnh74p,1rh8hc,talesFromRetail,top_day,3
mynameisbacon,Antietam reference...bonus points!,null,0,cdnokyh,1rh8hc,talesFromRetail,top_day,3
OsimusFlux,"I work in a home improvement store, and I rarely have any bad children incidents. Besides the standard crying or little messes here and there, most of the incidents are the parents themselves. I often see the children nicely carrying products for their parents or running back to aisles to put product away. Adults are the main source of messes, tantrums and misbehavior.",null,0,cdnmod2,1rh8hc,talesFromRetail,top_day,2
motown_missile,"I believe both should be punished; the kid, for making the mess, and the parents for having the kid.",null,0,cdnnm8g,1rh8hc,talesFromRetail,top_day,2
bytef0x,"Ewww.

That kid should be leaving the store in the back of a police car.",null,4,cdnggv1,1rh8hc,talesFromRetail,top_day,1
bobnojio,... And was promptly fired by corporate.,null,6,cdney6h,1rh8hc,talesFromRetail,top_day,1
doctor_hooha,My first job was in a tourist shop in a port city.  The ratio of dogs in strollers to children on leashes that came through there was unsettling.,null,11,cdn8p98,1rh8hc,talesFromRetail,top_day,68
now_she_is_dead,"Manager saw this one:

Fabric store.  Now the round tables that were used in my store (See [Image](http://www.lovesewing.com/magazine/wp-content/uploads/2012/11/fabric_store_service1-500x281.jpg) for an example) are not actually attached to the base.  The fabric is balanced along the edge of these rounds.  The center of the table is unoccupied (we usually put a price sign in there).

So on this particular day, the manager watches as this woman comes into the store with her toddler.  She then picks up the kid and puts her in the opening at center of the table, takes a bolt of fabric, and puts it on top of the opening to stop the kid from escaping.

My manager races over to the table and asks the lady what on earth she's doing, that's very unsafe!

""Well, how am I supposed to shop and watch her at the same time?""

... sigh.",null,11,cdn98sr,1rh8hc,talesFromRetail,top_day,56
MobileInfantry,"Last week, a woman let her kid run around the petrol pumps at work, during one of our busiest times. Kid almost got squashed by a SUV pulling up at another pump. But her 4 year old kid wouldn't do that, he knows better, was the response I got when I pointed it out to her and asked her to leave him in the car in future. ",null,4,cdn9d6t,1rh8hc,talesFromRetail,top_day,29
crickey23,"One day this lady with seven kids in tow stopped by my shoe department. Not only did the kids absolutely destroy our displays--moving samples around, throwing clearance shoes on the floor, pulling out chairs to play hide and seek--the mother made no effort to control her kids. In fact, she was also supremely rude. She constantly interrupted other customers that were talking to me and refused to believe me about all the clearance we had being out on the racks (well, at that point, on the floor). The whole ordeal was awful; it took an hour and a half and two people to reset everything.",null,0,cdncanb,1rh8hc,talesFromRetail,top_day,26
Icalasari,"To be fair, the kid also needed to be punished for the urination stunt and the huge mess

Honestly though, good parents would have kept a close enough eye on the kid that he wouldn't have managed the mask stunt",null,3,cdn91y0,1rh8hc,talesFromRetail,top_day,15
AlphaEnder,"I used to feel terrible about lost kids, or kids that were running around and smacked their head, or kids (not infants, that's awful) that would fall out of carts. Now I just laugh quietly because while the kid is in pain, they'll learn and the parent gets a nice fright that will hopefully teach them to look after their children better. ",null,0,cdna0re,1rh8hc,talesFromRetail,top_day,11
RDMcMains2,Did they have to pay for all the (one would think) ruined toys?,null,2,cdn8u75,1rh8hc,talesFromRetail,top_day,11
asian_uni_lecturer,"My accounting lecturer once said on a recorded lecture:

""And who do people take to the furniture store with them? Little kids! And what do these kids do? They SHIT all over our lovely chairs! That's why we need an account for damaged furniture and accrued damages"".

I still cannot believe he said ""shit"" on a recorded university lecture. Still. He's a bloody good lecturer!",null,5,cdnbt3p,1rh8hc,talesFromRetail,top_day,12
prettehkitteh,I cannot believe how people could raise their kid so horribly that the little shit could PEE on things he didn't own and think it's okay. This is full of SO MUCH WIN. I wish something like this could have happened at the toy store i worked at for months. ,null,1,cdnenn9,1rh8hc,talesFromRetail,top_day,6
AKraiderfan,"In the future, you might want to tell Jared to word it: ""clean it up or else you're banned,"" not ""clean it up AND you're banned.""

They should be banned regardless, but there is no incentive for them to clean up the piss if they're getting banned, and they could just walk right now (I am assuming people like that have no shame and would have no sense of obligation to clean up their mess). Have them clean it up, AND THEN tell them they're not welcome here.",null,1,cdngz8b,1rh8hc,talesFromRetail,top_day,7
Techsupportvictim,"I don't blame the parents for nature kid stuff. Like their infants starts crying etc.

But that nope, not happening in my watch. If you are under 13 you will be with your parents the whole time. If mommy and daddy don't like this you can all leave. If they let you run off that is child neglect and they will be explaining it to the Juvie cop that comes to collect the unattended minor in my store

(And yes I did it once to a chronic family. They would let their 8 year old twins come in while they smoked outside, or even went to movies or to have a drink)",null,0,cdnhrga,1rh8hc,talesFromRetail,top_day,6
compguytracy,"i worked at bk many many years ago, back when pokemon was a big thing. bk had the toy rights for the pokemon, and let me tell you, people are insane. we would get 1000, yes, 1000 toys, a week, on wednesday, oh yeah whopper wed, 99 cents, joy. we would be sold out by friday at the lates, probably thursday. i am telling you, i have seen parents come through drive thru, order 10 kids meals, throw all the food out, because we could not sell just the toy, then come back for ten more. adults crying in line because we where sold out, on a monday. come back wed by lunch, we should have more, nope. fucking people asking for rainchecks like we where a retail store. thank goodness out truck came at 5am or i would have been mobbed then too. all for a talking pikachu, or charizard. ",null,1,cdnh9i1,1rh8hc,talesFromRetail,top_day,5
ferafish,"I worked at a grocery store, and there was one family that was horrible for that. They had two kids, I would put them both at under 10, that just ran throughout the store. I saw the little girl run out the doors into the parking lot. No parent came to look for her, nothing. She wandered back in a few minutes later.

Another incident with them had them making a fort on the toilet paper shelf and hiding behind the toilet paper. I walked over and told them they had found a great hiding spot. So great, in fact, that weren't they worried their parents would forget them and leave them behind? They immediately got off the shelf and I fixed the display.",null,0,cdnfyp6,1rh8hc,talesFromRetail,top_day,3
crankypants15,"Wow, some of these other stories. At what point should someone call the police for child endangerment? 
",null,0,cdnh74p,1rh8hc,talesFromRetail,top_day,3
mynameisbacon,Antietam reference...bonus points!,null,0,cdnokyh,1rh8hc,talesFromRetail,top_day,3
OsimusFlux,"I work in a home improvement store, and I rarely have any bad children incidents. Besides the standard crying or little messes here and there, most of the incidents are the parents themselves. I often see the children nicely carrying products for their parents or running back to aisles to put product away. Adults are the main source of messes, tantrums and misbehavior.",null,0,cdnmod2,1rh8hc,talesFromRetail,top_day,2
motown_missile,"I believe both should be punished; the kid, for making the mess, and the parents for having the kid.",null,0,cdnnm8g,1rh8hc,talesFromRetail,top_day,2
bytef0x,"Ewww.

That kid should be leaving the store in the back of a police car.",null,4,cdnggv1,1rh8hc,talesFromRetail,top_day,1
bobnojio,... And was promptly fired by corporate.,null,6,cdney6h,1rh8hc,talesFromRetail,top_day,1
danubiss,"Oh, yeah. She's gonna get fired. Because that man is gonna get his billing statement and know he didn't pay that much. It's credit card fraud if she signs it knowing it's not all his.",null,1,cdn804g,1rh77t,talesFromRetail,top_day,20
anonarcheo,I certainly hope she DOES lose her job over this. ,null,0,cdoahwv,1rh77t,talesFromRetail,top_day,1
danubiss,"Oh, yeah. She's gonna get fired. Because that man is gonna get his billing statement and know he didn't pay that much. It's credit card fraud if she signs it knowing it's not all his.",null,1,cdn804g,1rh77t,talesFromRetail,top_day,20
anonarcheo,I certainly hope she DOES lose her job over this. ,null,0,cdoahwv,1rh77t,talesFromRetail,top_day,1
PolloMagnifico,"Three weeks later she demands you give her a dicount because she brought you static guard.

*There are no good customers*.

Only ones that haven't revealed themselves to be disgusting excuses for human beings.",null,18,cdn9l7q,1rgx63,talesFromRetail,top_day,7
PolloMagnifico,"Three weeks later she demands you give her a dicount because she brought you static guard.

*There are no good customers*.

Only ones that haven't revealed themselves to be disgusting excuses for human beings.",null,18,cdn9l7q,1rgx63,talesFromRetail,top_day,7
theBaron01,"Damn it, Bobby!",null,0,cdn66m7,1rgvl7,talesFromRetail,top_day,10
Erainor,"When I worked the drug store chain, we'd get corner stores coming in and buying up a ton of our inventory on sale to resell at their place down the street.  We got to know who the main people were, and told them in no uncertain terms that they weren't welcome any more.  

Best part was some of the stuff had OUR brand on it.  One of our employees went over there at the head manager's discretion and reported that.  I'm thinking that's what you've got here, a resell scam.

Also, good for you for dealing with the perv the way you did.",null,0,cdn5u0f,1rgvl7,talesFromRetail,top_day,10
BendyBobcat,"I know we don't reveal names of businesses in this subreddit, but I don't understand 'spark store'. ",null,0,cdnaii3,1rgvl7,talesFromRetail,top_day,2
