author,comment,distinguished,downs,id,post,subreddit,type,ups
d4m4s74,"And that's why casinos, and actually every single store should be able to, and actually do, kick out and ban anyone for being a dick to their personnel. ",null,11,cdnpgdq,1riony,talesFromRetail,top_day,51
reddittailedhawk,"Tempted to share this with my coworkers and tell them, ""See? It could be worse. Much worse.""  
Thought you may have actually been a former coworker till I got to the tax form part. (I'm Canadian, which means non-taxable casinos huzzah!)",null,0,cdnwgf7,1riony,talesFromRetail,top_day,3
Steffany_w0525,"Not sure what city you live in but I deal in a Canadian casino and that sounds pretty standard. Poker players are notoriously bad, to the point one barked at another dealer until he got kicked out. ",null,0,cdo0b18,1riony,talesFromRetail,top_day,1
keddren,Expected this story to be about Jeremy Clarkson.,null,1,cdo6to1,1riony,talesFromRetail,top_day,1
50CAL5NIP3R,He is rather lucky they rubber band the claws huh? ,null,12,cdnmqkx,1rioer,talesFromRetail,top_day,69
hannahcyanide,Of all the things to steal and places to put them.,null,4,cdnn9f7,1rioer,talesFromRetail,top_day,31
motown_missile,"Upvote for ""Lobster Johnson""...yeah, I got the reference.",null,1,cdnwq0y,1rioer,talesFromRetail,top_day,17
Undoer,"Please tell me you stopped him with ""Is that a lobster in your trousers, or are you just pleased to see me?""",null,0,cdo6gbe,1rioer,talesFromRetail,top_day,10
crosenblum,"That appears dangerous to future conception abilities, lol.",null,1,cdnqbi0,1rioer,talesFromRetail,top_day,8
SirLambda,"Looking at the title I was confused if this was TFR or futurama.. 

Love the story",null,0,cdnr1jp,1rioer,talesFromRetail,top_day,9
cman_yall,"&gt;His kids have some expensive tastes.

Maybe they wanted a pet?",null,0,cdns4jh,1rioer,talesFromRetail,top_day,8
j-sap, “Woop woop woop woop!” ,null,0,cdnx3te,1rioer,talesFromRetail,top_day,3
The_Technogoat,"&gt; I may not be in the best shape of my life but I can still move quicker than a guy with a large lobster squirming around in his pants.

/r/nocontext",null,1,cdo54ej,1rioer,talesFromRetail,top_day,4
thespottedbunny,"I am reminded of one of the recent episodes of American Dad about shoplifting. It's called ""crotch walking"". You should look it up on Hulu. I think you'd enjoy it. ",null,0,cdnx40s,1rioer,talesFromRetail,top_day,2
AcneZebra,"okay, important question here, what do you do with the lobster after something like that? its live, so it not like you just toss it in the dumpster, but i assume you don't put it back in the tank along with its 'extra flavoring'. Keep it as a pet?",null,2,cdnudcx,1rioer,talesFromRetail,top_day,4
Brodivh,"I wanted to start these tales at the beginning. So I got creepy and searched your submissions for parts 1 and 2. I found 1,2, and apparently 3. Isn't this part 4?",null,0,cdnwm0v,1rioer,talesFromRetail,top_day,1
-JuSt_My_LuCk,http://m.youtube.com/watch?v=Qqa-AEXDpD0&amp;desktop_uri=%2Fwatch%3Fv%3DQqa-AEXDpD0,null,0,cdo2rx2,1rioer,talesFromRetail,top_day,1
SemperSometimes11,"http://www.darwinawards.com/legends/legends2000-03.html

Hmmmm, similar story here.",null,0,cdo6j9g,1rioer,talesFromRetail,top_day,1
FuckingAppleOfDoom,[you missed a golden opportunity here OP.](http://i.imgur.com/0ASVGf5.jpg),null,0,cdopbhg,1rioer,talesFromRetail,top_day,1
theamazingroberto,"&gt;he glanced around once more and shoved the lobster right down the front of his pants. The guy, whom shall be hence forth called ~~Lobster Johnson~~ /u/toxlab",null,0,cdoszk0,1rioer,talesFromRetail,top_day,1
blarghusmaximus,Wtf store sells clothes and lobster,null,1,cdnxa7o,1rioer,talesFromRetail,top_day,1
50CAL5NIP3R,He is rather lucky they rubber band the claws huh? ,null,12,cdnmqkx,1rioer,talesFromRetail,top_day,69
hannahcyanide,Of all the things to steal and places to put them.,null,4,cdnn9f7,1rioer,talesFromRetail,top_day,31
motown_missile,"Upvote for ""Lobster Johnson""...yeah, I got the reference.",null,1,cdnwq0y,1rioer,talesFromRetail,top_day,17
Undoer,"Please tell me you stopped him with ""Is that a lobster in your trousers, or are you just pleased to see me?""",null,0,cdo6gbe,1rioer,talesFromRetail,top_day,10
crosenblum,"That appears dangerous to future conception abilities, lol.",null,1,cdnqbi0,1rioer,talesFromRetail,top_day,8
SirLambda,"Looking at the title I was confused if this was TFR or futurama.. 

Love the story",null,0,cdnr1jp,1rioer,talesFromRetail,top_day,9
cman_yall,"&gt;His kids have some expensive tastes.

Maybe they wanted a pet?",null,0,cdns4jh,1rioer,talesFromRetail,top_day,8
j-sap, “Woop woop woop woop!” ,null,0,cdnx3te,1rioer,talesFromRetail,top_day,3
The_Technogoat,"&gt; I may not be in the best shape of my life but I can still move quicker than a guy with a large lobster squirming around in his pants.

/r/nocontext",null,1,cdo54ej,1rioer,talesFromRetail,top_day,4
thespottedbunny,"I am reminded of one of the recent episodes of American Dad about shoplifting. It's called ""crotch walking"". You should look it up on Hulu. I think you'd enjoy it. ",null,0,cdnx40s,1rioer,talesFromRetail,top_day,2
AcneZebra,"okay, important question here, what do you do with the lobster after something like that? its live, so it not like you just toss it in the dumpster, but i assume you don't put it back in the tank along with its 'extra flavoring'. Keep it as a pet?",null,2,cdnudcx,1rioer,talesFromRetail,top_day,4
Brodivh,"I wanted to start these tales at the beginning. So I got creepy and searched your submissions for parts 1 and 2. I found 1,2, and apparently 3. Isn't this part 4?",null,0,cdnwm0v,1rioer,talesFromRetail,top_day,1
-JuSt_My_LuCk,http://m.youtube.com/watch?v=Qqa-AEXDpD0&amp;desktop_uri=%2Fwatch%3Fv%3DQqa-AEXDpD0,null,0,cdo2rx2,1rioer,talesFromRetail,top_day,1
SemperSometimes11,"http://www.darwinawards.com/legends/legends2000-03.html

Hmmmm, similar story here.",null,0,cdo6j9g,1rioer,talesFromRetail,top_day,1
FuckingAppleOfDoom,[you missed a golden opportunity here OP.](http://i.imgur.com/0ASVGf5.jpg),null,0,cdopbhg,1rioer,talesFromRetail,top_day,1
theamazingroberto,"&gt;he glanced around once more and shoved the lobster right down the front of his pants. The guy, whom shall be hence forth called ~~Lobster Johnson~~ /u/toxlab",null,0,cdoszk0,1rioer,talesFromRetail,top_day,1
blarghusmaximus,Wtf store sells clothes and lobster,null,1,cdnxa7o,1rioer,talesFromRetail,top_day,1
juksayer,This is a lot funnier when I pretend you're a dude.,null,5,cdnu3b7,1rimmj,talesFromRetail,top_day,29
FitzyFool,That is lovely. I am secretly a bit jealous.,null,1,cdnqmor,1rimmj,talesFromRetail,top_day,11
albinosquirel,I wish someone would serenade me!,null,1,cdnu57m,1rimmj,talesFromRetail,top_day,8
AmaterasusBrush,Love your title!,null,0,cdnucuz,1rimmj,talesFromRetail,top_day,7
lolag0ddess,Totally happened to me two years ago working in my call center! Strange but awesome to think about when you get that one customer that just won't stop being an asshole. ,null,0,cdnus4i,1rimmj,talesFromRetail,top_day,3
citrusonic,American South here. WTF is a long john?,null,0,cdnvij8,1rimmj,talesFromRetail,top_day,3
anonarcheo,"Yeah, I would have called the cops and had him arrested for assault. If I want my hand back but can't pull away, that's creepy and I'm done. ",null,6,cdo5zp4,1rimmj,talesFromRetail,top_day,1
Grevling89,I can see from your professionalism that you have been in the game for quite some time. If only I could handle scumbags the same way...,null,1,cdnmpwi,1rigon,talesFromRetail,top_day,13
ukimport,So... can you make me change for a $20?,null,0,cdnlq9e,1rigon,talesFromRetail,top_day,3
Grevling89,I can see from your professionalism that you have been in the game for quite some time. If only I could handle scumbags the same way...,null,1,cdnmpwi,1rigon,talesFromRetail,top_day,13
ukimport,So... can you make me change for a $20?,null,0,cdnlq9e,1rigon,talesFromRetail,top_day,3
notmyfaultyousuck,She was definitely trying to get a rise out of you. I love not giving it to them and watching them become more and more frustrated. ,null,6,cdnmkxw,1rie8h,talesFromRetail,top_day,33
KorbeeeenDallaaaas,"I never have anything witty or funny to say, but whenever I read a story like that, I can't help but think that some people are just assholes.  Fuck assholes.  Go you. ",null,3,cdnohoc,1rie8h,talesFromRetail,top_day,18
theowlsgohoot,He's obviously kidding though when he asks right? Haha,null,0,cdo3dvu,1rie8h,talesFromRetail,top_day,2
notmyfaultyousuck,She was definitely trying to get a rise out of you. I love not giving it to them and watching them become more and more frustrated. ,null,6,cdnmkxw,1rie8h,talesFromRetail,top_day,33
KorbeeeenDallaaaas,"I never have anything witty or funny to say, but whenever I read a story like that, I can't help but think that some people are just assholes.  Fuck assholes.  Go you. ",null,3,cdnohoc,1rie8h,talesFromRetail,top_day,18
theowlsgohoot,He's obviously kidding though when he asks right? Haha,null,0,cdo3dvu,1rie8h,talesFromRetail,top_day,2
Defenestrator66,"I know this is mostly unrelated (it's a ""kids say the darndest things"" stories), but it reminded me of a story my grandmother used to tell me from when I was a kid and went to a department store. I apparently liked smelling all the tiny bars of fragrant soaps. The clerk approached us and said ""those are buy one, get one free."" Apparently, in what may have been the best off-the-cuff retort I've ever spoken, my pre-kindergarten self said ""But the free ones smell better.""

I know that would've been probably asinine and annoying for an adult to say, but apparently in this case it was cute enough that the clerk actually gave me the little bar of soap.",null,16,cdnohps,1ridmp,talesFromRetail,top_day,78
bilfdoffle,"I only hope my son is as well trained as that. And if I was the parent of screaming child, I totally would have backed up your kid.",null,9,cdnl4nh,1ridmp,talesFromRetail,top_day,37
WhiteyDude,"&gt; ""Well, if you act like that, you really won't get anything.""

I'm guessing he's heard that before. :)  It's a lesson he's learned though. ",null,9,cdnrky3,1ridmp,talesFromRetail,top_day,33
fun2bsassy,"My sister is just like that girl.. And my parents are like no. After the tantrum.. ""Of course sweetie. How about a pony too?""",null,2,cdnsbg8,1ridmp,talesFromRetail,top_day,13
bloomcnd,"he sounds awesome!

i've got my first coming now in december and i can only hope we'll raise him to be that well brought up",null,4,cdnkbny,1ridmp,talesFromRetail,top_day,10
jlwoodin,You're raising him right!,null,2,cdnrs3j,1ridmp,talesFromRetail,top_day,8
Metalhead2881,Awesome. Pure awesome.,null,0,cdnryqf,1ridmp,talesFromRetail,top_day,5
dagronBorn,"Sounds like you two raised a good kid if he recognizes that kind of behavior as inappropriate. Have an upvote, on the house.",null,0,cdo1jih,1ridmp,talesFromRetail,top_day,3
null,null,null,3,cdo1am1,1ridmp,talesFromRetail,top_day,3
Martsigras,"&gt;This story happened when my son was 4. It takes place in the store where I work. I wasn't there at the time. My son, I'll call him Cee, was browsing the toy department with his dad while they were waiting for me to finish my shift

This paragraph made my head hurt before I realised you were not the dad being mentioned, and instead the dad was your husband/partner",null,4,cdo3r5d,1ridmp,talesFromRetail,top_day,2
Defenestrator66,"I know this is mostly unrelated (it's a ""kids say the darndest things"" stories), but it reminded me of a story my grandmother used to tell me from when I was a kid and went to a department store. I apparently liked smelling all the tiny bars of fragrant soaps. The clerk approached us and said ""those are buy one, get one free."" Apparently, in what may have been the best off-the-cuff retort I've ever spoken, my pre-kindergarten self said ""But the free ones smell better.""

I know that would've been probably asinine and annoying for an adult to say, but apparently in this case it was cute enough that the clerk actually gave me the little bar of soap.",null,16,cdnohps,1ridmp,talesFromRetail,top_day,78
bilfdoffle,"I only hope my son is as well trained as that. And if I was the parent of screaming child, I totally would have backed up your kid.",null,9,cdnl4nh,1ridmp,talesFromRetail,top_day,37
WhiteyDude,"&gt; ""Well, if you act like that, you really won't get anything.""

I'm guessing he's heard that before. :)  It's a lesson he's learned though. ",null,9,cdnrky3,1ridmp,talesFromRetail,top_day,33
fun2bsassy,"My sister is just like that girl.. And my parents are like no. After the tantrum.. ""Of course sweetie. How about a pony too?""",null,2,cdnsbg8,1ridmp,talesFromRetail,top_day,13
bloomcnd,"he sounds awesome!

i've got my first coming now in december and i can only hope we'll raise him to be that well brought up",null,4,cdnkbny,1ridmp,talesFromRetail,top_day,10
jlwoodin,You're raising him right!,null,2,cdnrs3j,1ridmp,talesFromRetail,top_day,8
Metalhead2881,Awesome. Pure awesome.,null,0,cdnryqf,1ridmp,talesFromRetail,top_day,5
dagronBorn,"Sounds like you two raised a good kid if he recognizes that kind of behavior as inappropriate. Have an upvote, on the house.",null,0,cdo1jih,1ridmp,talesFromRetail,top_day,3
null,null,null,3,cdo1am1,1ridmp,talesFromRetail,top_day,3
Martsigras,"&gt;This story happened when my son was 4. It takes place in the store where I work. I wasn't there at the time. My son, I'll call him Cee, was browsing the toy department with his dad while they were waiting for me to finish my shift

This paragraph made my head hurt before I realised you were not the dad being mentioned, and instead the dad was your husband/partner",null,4,cdo3r5d,1ridmp,talesFromRetail,top_day,2
Vato_Loco,[Here you go](http://gifrific.com/guy-dressed-as-gumby-blocks-shot/),null,0,cdnqmqp,1ricmx,talesFromRetail,top_day,8
SongBird2,I would have bitched slapped the kid out of reflex and probably would have gotten fired  ,null,0,cdnwbxj,1ricmx,talesFromRetail,top_day,5
WishfulOne,That made me laugh.  Not funny for you but...I still laughed.,null,0,cdnjjdc,1ricmx,talesFromRetail,top_day,4
Muscly_Geek,"&gt;real certified baristas

I never knew this was a thing. 

TIL there is a barista certification.",null,0,cdnq4lm,1ric04,talesFromRetail,top_day,13
hannahcyanide,I actually like that tea.,null,2,cdnkrez,1ric04,talesFromRetail,top_day,9
WishfulOne,That's kind of creepy.,null,1,cdnjmjt,1ric04,talesFromRetail,top_day,8
CioCZ,shout out to all the ladies that smell like Rooibos,null,0,cdnq3dk,1ric04,talesFromRetail,top_day,5
Rajron,"&gt; Evan dumped out all the Vanilla Rooibos and replaced it (not a big deal, nobody gets it anyway.)

Are you kidding? That stuff is incredible.",null,0,cdnr5gm,1ric04,talesFromRetail,top_day,4
cubone1337,You've been submitted to /r/bestofTLDR.,null,0,cdnw3hr,1ric04,talesFromRetail,top_day,3
morgueanna,"I had this happen all the time.

One, I worked at Goth store in the mall, so most of our clientele were young people who weren't that good at keeping track of where they bought stuff (if they bought it themselves, sometimes Mom did and told them the wrong store).

Two, the reputation that Goth store had in the 90's and 00's for appealing to drug oriented youth seems to be well earned, if my customers were any indication. Some of them were lucky to remember their own names and complete a sentence, let alone figure out where they bought their merchandise from.

Three, people seem to think that Goth store and That Store That Sells Knockoff Crap Jewelry and Dildos To Frat Boys are the same store. Even though Goth store had a policy of no drug or alcohol references. I had people bring in body jewelry with pot leaf designs, beer logo tee shirts, all sorts of crazy stuff and swear up and down that it was from my store.

Best story: My district manager was helping me with some paperwork at the desk. This kid comes up to the desk with a band tee shirt that had, guess what, a pot leaf in the design. I politely explained to them that we didn't carry that particular shirt and told them to check out Crappy Frat Party Store instead. The kid started losing his mind, cursing, screaming, waving his finger in my face. My district manager could see I was one inch from smacking this guy so he smoothly came over and leaned in and said in a conspiratorial whisper, ""I'll give you five bucks for it, man."" The kid's demeanor instantly changed and he said ""Deal!""  O.o

My DM pulled five bucks out of his pocket, handed it to the kid, and when the kid was gone, threw the shirt in the trash. Then he went back to paperwork like it never happened. ",null,10,cdnlh10,1riaxl,talesFromRetail,top_day,81
cerbaroo,It's amazing how hard it is for some people to accept that they can be wrong at times.,null,0,cdnk9p0,1riaxl,talesFromRetail,top_day,19
carriegood,"At my chocolate shop, much of my business was selling hostess gifts, often a cute housewares piece like a serving platter or teapot filled with candy.

A woman came in one day with one of our gift bags saying she wanted to return the gift she got. I opened the bag and way at the bottom was one sad, lonely, grubby pen shaped like an asparagus.  I told her, ""I'm sorry, but we don't sell pens, food-shaped or not.""

""But it's in your bag.""

""Yes it is. Because your friend saved the bag when she got a gift from someone else, bought you this pen, probably at a cheap variety store, and put it in my bag to pass it off as something nice from my store.""

I know I sounded snotty, but I was really pissed that there were people out there putting garbage in my bags, fooling others into thinking I sell junk.  My store served a small tight-knit community, and I relied on word of mouth and a reputation for a certain amount of taste.",null,9,cdnpfeb,1riaxl,talesFromRetail,top_day,24
WishfulOne,I'm surprised she left and didn't insist that you do the return since she was already at your store.,null,1,cdnjtn7,1riaxl,talesFromRetail,top_day,9
snowball17,I had a customer call me once asking me to look for a pair of pants for her. She claimed she had seen them earlier at our store downtown (we don't have a store downtown) in a wall with a bunch of green tops (we didn't have a single green top in the store at the time). There is another clothing store chain with a kind of similar name to ours that caters to the exact same demographic. They have a store downtown. I happened to have been there earlier that same day and had seen all of the green tops they had. The customer was 100% sure that she knew what store she was at and which store she was calling. Eventually I just gave up and told her we didn't have her size. ,null,1,cdnug7p,1riaxl,talesFromRetail,top_day,10
morgueanna,"I had this happen all the time.

One, I worked at Goth store in the mall, so most of our clientele were young people who weren't that good at keeping track of where they bought stuff (if they bought it themselves, sometimes Mom did and told them the wrong store).

Two, the reputation that Goth store had in the 90's and 00's for appealing to drug oriented youth seems to be well earned, if my customers were any indication. Some of them were lucky to remember their own names and complete a sentence, let alone figure out where they bought their merchandise from.

Three, people seem to think that Goth store and That Store That Sells Knockoff Crap Jewelry and Dildos To Frat Boys are the same store. Even though Goth store had a policy of no drug or alcohol references. I had people bring in body jewelry with pot leaf designs, beer logo tee shirts, all sorts of crazy stuff and swear up and down that it was from my store.

Best story: My district manager was helping me with some paperwork at the desk. This kid comes up to the desk with a band tee shirt that had, guess what, a pot leaf in the design. I politely explained to them that we didn't carry that particular shirt and told them to check out Crappy Frat Party Store instead. The kid started losing his mind, cursing, screaming, waving his finger in my face. My district manager could see I was one inch from smacking this guy so he smoothly came over and leaned in and said in a conspiratorial whisper, ""I'll give you five bucks for it, man."" The kid's demeanor instantly changed and he said ""Deal!""  O.o

My DM pulled five bucks out of his pocket, handed it to the kid, and when the kid was gone, threw the shirt in the trash. Then he went back to paperwork like it never happened. ",null,10,cdnlh10,1riaxl,talesFromRetail,top_day,81
cerbaroo,It's amazing how hard it is for some people to accept that they can be wrong at times.,null,0,cdnk9p0,1riaxl,talesFromRetail,top_day,19
carriegood,"At my chocolate shop, much of my business was selling hostess gifts, often a cute housewares piece like a serving platter or teapot filled with candy.

A woman came in one day with one of our gift bags saying she wanted to return the gift she got. I opened the bag and way at the bottom was one sad, lonely, grubby pen shaped like an asparagus.  I told her, ""I'm sorry, but we don't sell pens, food-shaped or not.""

""But it's in your bag.""

""Yes it is. Because your friend saved the bag when she got a gift from someone else, bought you this pen, probably at a cheap variety store, and put it in my bag to pass it off as something nice from my store.""

I know I sounded snotty, but I was really pissed that there were people out there putting garbage in my bags, fooling others into thinking I sell junk.  My store served a small tight-knit community, and I relied on word of mouth and a reputation for a certain amount of taste.",null,9,cdnpfeb,1riaxl,talesFromRetail,top_day,24
WishfulOne,I'm surprised she left and didn't insist that you do the return since she was already at your store.,null,1,cdnjtn7,1riaxl,talesFromRetail,top_day,9
snowball17,I had a customer call me once asking me to look for a pair of pants for her. She claimed she had seen them earlier at our store downtown (we don't have a store downtown) in a wall with a bunch of green tops (we didn't have a single green top in the store at the time). There is another clothing store chain with a kind of similar name to ours that caters to the exact same demographic. They have a store downtown. I happened to have been there earlier that same day and had seen all of the green tops they had. The customer was 100% sure that she knew what store she was at and which store she was calling. Eventually I just gave up and told her we didn't have her size. ,null,1,cdnug7p,1riaxl,talesFromRetail,top_day,10
emopanda18,It gives me a little bit of happiness to know that there are supervisors out there who arent afraid of customers. I was always annoyed at the ones that let the customer get away with murder. ,null,0,cdntlq5,1ri8kg,talesFromRetail,top_day,7
shortfermata,"Is it possible that you're referring to the [Scanning Code of Practice](http://www.competitionbureau.gc.ca/eic/site/cb-bc.nsf/eng/01262.html) or is it your-store-only policy?

Gah. I had a bad experience trying to use the Scanning Code of Practice at a store - the girl told me she could give me the right price instead of for free, since the ""transaction has to be complete before I can do that"". I said ""so I have to pay for everything, and THEN you fix it?"" She said ""no, but I have to swipe your card and everything first. If you notice it after then we give it to you for free.""

She didn't want to get me her supervisor because I was ""wrong"". I told her I was a cashier too and asked her about 3 more times to get a supervisor to double-check. I got a lot of eyerolling.

When her manager came over she was red as a tomato. I felt bad, but I really can't take attitude from fellow retail employees. I promise I know how things work too :(",null,0,cdo1wc4,1ri8kg,talesFromRetail,top_day,1
nakedinthepond,"I used to have people bring me tags off the shelf ALL THE TIME. Whenever I would call for a price check, at least once a day, one of the customers would bring me either the sticker or the WHOLE DAMN PLASTIC TAG. I was just so confused. Why would you ever think to pull a tag off of a shelf?? Why??",null,0,cdoqk2v,1ri8kg,talesFromRetail,top_day,1
Stuck_In_Purgatory,"""how about I draw a line down the middle of your head so it looks like a but?""

This was all i was seeing in my head haha. ",null,14,cdnh4l0,1rhynu,talesFromRetail,top_day,58
Teslok,So what did he draw/write? Was it just a scribble?  ,null,3,cdnjyeo,1rhynu,talesFromRetail,top_day,17
anonarcheo,I was expecting a harassment story. Not bad turnout. ,null,0,cdnle0n,1rhynu,talesFromRetail,top_day,5
crosenblum,Heh :),null,1,cdnptt9,1rhynu,talesFromRetail,top_day,2
beemill,Did no one else notice manager was spelled wrong in the title? Hehe sex jokes,null,0,cdnx4a0,1rhynu,talesFromRetail,top_day,1
Stuck_In_Purgatory,"""how about I draw a line down the middle of your head so it looks like a but?""

This was all i was seeing in my head haha. ",null,14,cdnh4l0,1rhynu,talesFromRetail,top_day,58
Teslok,So what did he draw/write? Was it just a scribble?  ,null,3,cdnjyeo,1rhynu,talesFromRetail,top_day,17
anonarcheo,I was expecting a harassment story. Not bad turnout. ,null,0,cdnle0n,1rhynu,talesFromRetail,top_day,5
crosenblum,Heh :),null,1,cdnptt9,1rhynu,talesFromRetail,top_day,2
beemill,Did no one else notice manager was spelled wrong in the title? Hehe sex jokes,null,0,cdnx4a0,1rhynu,talesFromRetail,top_day,1
MagpieChristine,"Oh my goodness. I love working with volunteers, but getting some of them to keep a schedule would make herding cats look easy. I was on floating duty once, filling in during lunch breaks, and eventually got relieved by someone else when the person never came back after his break. I found him just sitting down &amp; enjoying a show. He seemed *shocked* to discover that he was expected back.",null,0,cdni1qh,1rhy5m,talesFromRetail,top_day,4
