author,comment,distinguished,downs,id,post,subreddit,type,ups
AKraiderfan,"People with ""hundreds and hundreds of dollars in sales and few hundred customers"" within their influence, do not have time or the desire to tell off a vendor, 


they just walk away.",null,3,cdnh5fv,1rhsfa,talesFromRetail,top_day,18
OffWhiteBeige,"I'm trying to figure out how they could influence hundreds of customers not to shop there, just because you didn't see them when you first looked. It's a very common, easily fixed mistake.

And I can't see him not coming back. Smokers tend to go for the nearest and most convenient place to feed their habit. I am assuming though, that your store is not right next to another store that sells cigarettes, and that he lives nearby.",null,1,cdnhdoi,1rhsfa,talesFromRetail,top_day,12
swilty,he calls them his disciples. they follow him wherever he goes,null,1,cdnh0wt,1rhsfa,talesFromRetail,top_day,6
Sigillite,"Wow fuck that dude.... there are a lot of stories of rude people on this sub but come on, he had to wait for, what, a minute??",null,1,cdng936,1rhsfa,talesFromRetail,top_day,5
Techsupportvictim,"You should feel nothing. He was the rude one. 

And you know what, all those folks screaming about never coming back, you will lose sales. Nope. They come back. And you still make the sales to someone else if they don't 

And you can't ""refuse"" a sale on something you don't have in stock. Although legally you might have the right to cause he was mean",null,0,cdnmt15,1rhsfa,talesFromRetail,top_day,4
amaninja,Hundreds and hundreds until he drops dead from cancer and the stick stuck up his butt.,null,0,cdnntxb,1rhsfa,talesFromRetail,top_day,3
Ms_Melissa,He can take his arrogance and entitlement and shove them up his over inflated head! ,null,0,cdnp9x8,1rhsfa,talesFromRetail,top_day,2
damnitanders,Pffft yeah he's just all talk. You'll get plenty more. I recently had a guy threaten to call Fox News about our establishment because we asked for his signature.,null,0,cdo1lh4,1rhsfa,talesFromRetail,top_day,2
Maloth_Warblade,"Tell her happy Hanukkah next. When she tries to report you for that, state you're Jewish, and forcing her beliefs on you is offensive.",null,130,cdnfat8,1rhs01,talesFromRetail,top_day,641
Coaz,"Just wait, it gets better. I work in a phone store so each customer I deal with I get to talk to for around 20 minutes at least. 

There's always those customers who I'll have great conversations with and they're laughing and loving being here and then they invite me to go to church with them. I don't have a problem with church, I go with my devote Christian mother whenever I visit, but I have no interest in religion. I go because it makes her happy and I love spending time with my family. 

So they invite me to church and I'll try and brush it off with ""Maybe, yeah. I might make it out there."" Some people drop it there, but about half keep pushing. They then ask me where I go to church and then keep pressuring me to come to church with them. They'll offer to pick me up from my house and I can come over and they make me lunch and all sorts of things. It usually devolves into a really awkward conversation at this point so I usually just tell them I have to work every Sunday and most of them understand and leave it alone. However, I have had a few people who've offered to buy me groceries to make up for the money I missed from being at work. 

Anyway, wall of text over. Enjoy your first holiday on retail OP. I expect more stories from you because of the holidays. Once you're here, you can never leave. You're one of us now. ",null,26,cdng1fu,1rhs01,talesFromRetail,top_day,134
Cheeky6892,"People need to calm down about Happy Holidays. I'm a Christian, and I don't expect retail workers to wish me a Merry Christmas. At the end of the day, it's just a nice sentiment when a customer is leaving. Some people just need to get over themselves.",null,15,cdnhp4u,1rhs01,talesFromRetail,top_day,84
vivling,"As a flight attendant, I generally said Merry Christmas to departing passengers, but would switch it up to Happy Holidays, what have you, when I would get bored saying the same thing over and over.  I'm also a bit of a troll in real life, so I would sometimes save the Happy Holidays for someone I knew would get offended, just to see them swell up with indignation, then deflate as they realized I just said Merry Christmas to the person in front of them. 

Sometimes, this was the only bright spot in my day.",null,12,cdngwzu,1rhs01,talesFromRetail,top_day,74
HSChronic,"How dare you not wish me Happy 4th of July OP. It is right around the corner after all. What is wrong with you. I'm taking this one to corporate, I can't believe what type of people they hire. ",null,13,cdnfefn,1rhs01,talesFromRetail,top_day,74
oddballgeek,"""Oh is it christmas? Really? You'd think someone would put up a few decorations or play some songs or something. Huh. Well, maybe next year the stores will *finally* get into the spirit early enough so it's easy for people to remember when it is.""",null,7,cdni1dy,1rhs01,talesFromRetail,top_day,47
lcoursey,"Remind her that no one said Merry Christmas until Charles Dickens used it in the 1800's.  Last I checked ""A Christmas Carol"" isn't the bible...",null,9,cdndahb,1rhs01,talesFromRetail,top_day,48
dereckc1,"Perhaps she's...

Well maybe she...

Yeah I've got nothing. Feigned indignation when you're a week or two away I can see having some relevance in her mind given that mindset, but not when there's another major holiday between you and Christmas. ",null,7,cdnjsdq,1rhs01,talesFromRetail,top_day,37
etterboce,"I once had two customer complaints in one day.

The first was because I did not wish a customer a Merry Christmas. She complained loudly to my manager and called corporate.

Later that day, I had a customer call corporate because I wished her a Merry Christmas and she found it offensive. 

You can't please everyone. And any retail manager who has worked the holidays before will write off these complaints because there is absolutely nothing that can be done to satisfy these customers.

Maybe they should realize that their consumerism is far more contradictory to the spirit of Christmas than the inclusion or exclusion of the word Christmas from their interactions with cashiers, or how the holidays are portrayed on the store's marketing materials and signage.",null,7,cdne9f2,1rhs01,talesFromRetail,top_day,39
ichosethis,I worried my boss the other day when I told her I was offended that a box of Christmas decorations was in her office. She thought I was offended about Christmas when really it was in front of the water cooler.,null,7,cdnf5rk,1rhs01,talesFromRetail,top_day,35
Benanov,"Damn it, it's too early for the Christian Persecution Machine.",null,11,cdnjs2d,1rhs01,talesFromRetail,top_day,38
scrimmy,Wish her a blessed winter solstice.. She'll love that.,null,5,cdnpm10,1rhs01,talesFromRetail,top_day,33
KroipyBill,"I'm a Christian. You say Happy Holidays to me, I will be thankful for the gesture. You think I'm Jewish for some reason and say Happy Hanukkah to me? I'll laugh to myself, but I'll appreciate the gesture. You say Happy Kwanzaa to me, I will be confused, but appreciate the gesture. 

There is a trend here. I don't care what you say. I'll appreciate the gesture. ",null,5,cdnf712,1rhs01,talesFromRetail,top_day,28
motocyclisme,"You just started in August??? Well, good luck to you. I have plenty of great memories from retail. But you will definitely learn the meaning of ""you can't please all the people all the time."" People like that customer have nothing better to do but get a stick up their ass about *nothing.* Just remember to not take it personally! Hope your holiday work goes smoothly. ",null,4,cdniu8s,1rhs01,talesFromRetail,top_day,25
Jeremyiswin,Merry Mother Fucking Christmas to each and every one of you.,null,2,cdnko5u,1rhs01,talesFromRetail,top_day,24
Reddit_Burninator,"People forget that Jesus, when asked what the greatest commandment was, said to love God and love your neighbor. Just love people, dang it! Any Christian who isn't loving, is doing it wrong, and shouldn't be able to apply the title Christian.

It's like saying I'm a pacifist, and then grabbing a bat and hitting someone for saying they like to watch violent movies.",null,4,cdnlbwn,1rhs01,talesFromRetail,top_day,25
Kikiface12,"This might have been my mother, and if so I apologize a thousand times over.

Seriously, my mom doesn't go to church, EVER. She doesn't do anything religious other than no eating meat during lent, and cooking way too much for Christmas/Easter. 

HOWEVER she will 100% bitch about anyone that uses the phrase Happy Holidays, she'll complain about people not being Christian, and she'll gladly tell you how you should go to church and be closer to God.

I absolutely can see her bitching because you didn't say Merry Christmas over a month before Christmas. Some people are insane.. :&lt;",null,6,cdnmvzm,1rhs01,talesFromRetail,top_day,26
LRGinCharge,"This is exactly what I never understood about being pissed over ""happy holidays."" Within a one month span there is Thanksgiving, Christmas, Hannukah, Kwanzaa, sometimes Ramadaan, and New Year's. ""Happy Holidays"" is just a way to encompass any and all the holidays you may be celebrating during this time, not a refusal to say ""Merry Christmas.""",null,2,cdnprge,1rhs01,talesFromRetail,top_day,21
crosenblum,"I'm jewish, and I used to never really care.

Because I understood people's intent. To wish good things on other people, to be friendly.

What happened to people having a thick skin. Life ain't a bowl of roses.

If you don't like what someone else had to say, ""GET OVER IT""

Who says everyone likes what you have to say!",null,1,cdnt20h,1rhs01,talesFromRetail,top_day,16
CustosClavium,"Dear Fellow Christians:

Christmas is December 25th. The Christmas season lasts from Christmas to the Feast of the Baptism of the Lord (Jan 12th this year). If you're non-mainline Protestant, well, I guess Christmas is just on the 25th. If you're a fundamentalists...erm...happy December 25th?

There are *other* holidays between Halloween and Christmas that people celebrate, and some that aren't Christian, so ""Happy Holidays"" ain't too shabby. Hell, if you're Catholic, there's tons of holidays between Thanksgiving and Christmas (St. Nick's Day, anyone? Immaculate Conception?), so again, ""Happy Holidays!""

If you're Christian, it is now *Advent*. Not Christmas. Not the Christmas season. It's frickin' Advent. A solemn period of expectation. 

Quit bitchin' about Happy Holidays. Be happy anyone is trying to be cordial with you at all, because if you're this bitter over it, you might be lucky to have that much friendly interaction.

- Signed, disgruntled theology student. Have a prayerful Advent.",null,5,cdnro6s,1rhs01,talesFromRetail,top_day,18
Wazza89,"I remember this happening on November 11th, cause that's when our store started playing Christmas carols...

A regular came in (who I'm not a particular fan of, I work in a liquor store). When he finished his purchase, I said ""have a good day"", he replied ""Merry Christmas"", and walked out. Turned around at the door and said ""did you hear me? I said Merry Christmas"". I said, ""no worries, have a good day mate"". He starts carrying on ""what's your fucking problem""etc etc, and it's a really warm day (South Australia being weird this year) and so this is the thing want, so I responded with ""it's not even halfway through fucking November! I'll start saying Merry fucking Christmas when it's fucking Christmas!""

Haven't seen him since thankfully. And we can get away with this sort of thing quite a bit where I work, we're known as the ""bad store to work in"". ",null,1,cdnks0w,1rhs01,talesFromRetail,top_day,14
gamerlen,"When I worked retail I'd try to give customers the once over to see if I could guess. If I saw any religious jewelry or something on their teeshirts (crucifix necklace, star of david, etc) I'd wish them a happy whatever-that-represented because it was a safe bet thats what they believed in.

Otherwise I'd go with Happy Holidays and if they didn't like it I'd just shrug and say 'corporate's orders' and leave it at that.",null,2,cdnosj6,1rhs01,talesFromRetail,top_day,13
KotovSyndrome,"I don't even say ""Happy Holidays"" or ""Merry Christmas"".

If you walk out the door saying ""Have a merry Christmas"", I'll reply with a ""You too, sir/ma'am."" I'm not getting involved in this war.",null,0,cdnl3dq,1rhs01,talesFromRetail,top_day,11
cheestaysfly,"God speed to you if you're working Black Friday. People like to get real nasty that day. You know, the spirit of giving and all that.",null,2,cdntb3w,1rhs01,talesFromRetail,top_day,12
Mewshimyo,These people are so focused on keeping the Christ in Christmas that they can't be bothered to keep the Christ in Christian.,null,1,cdnofpu,1rhs01,talesFromRetail,top_day,11
_the_bored_one_,"I started saying ""Well you know, Thanksgiving, Christmas, New Years, all holidays. Hope you enjoy them all!"" anytime someone gets a bug up their ass about not saying happy xmas",null,0,cdnowe7,1rhs01,talesFromRetail,top_day,8
LostRib,God dammit. There's no war on Christmas. Fuck you Fox News!,null,2,cdnrenq,1rhs01,talesFromRetail,top_day,10
amigocesar,"I like to pull the british classic ""Happy Christmas."" 

They hear the 'happy' and their ready to be pissy and then the curveball with the Christmas.",null,0,cdnsovv,1rhs01,talesFromRetail,top_day,7
FartingBob,The plight of the white middle class Christian in America is the most important issue in the world today.,null,0,cdnif3c,1rhs01,talesFromRetail,top_day,5
dmac0018,"The way I avoid conflicts like this is if they say merry christmas to me, I say it back to them. If they say happy holidays, I say that back to them.",null,0,cdninov,1rhs01,talesFromRetail,top_day,4
DancesWithPugs,I'm facepalming so hard I want to palm *her* face. Get a life lady.,null,0,cdnje60,1rhs01,talesFromRetail,top_day,4
Emperor_NOPEolean,"Am I the only one

Who doesn't give a shit either way?",null,1,cdnzedv,1rhs01,talesFromRetail,top_day,5
techiejames,"The United States was not, nor has it ever been, a Christian nation.  While the evidence does show that most of our Founding Fathers were Christian, not all of them were (source:  http://en.wikipedia.org/wiki/Founding_Fathers_of_the_United_States#Religion).  Not once in the Declaration of Independence does it mention religion nor Christianity.  In the actual Constitution of the United States, not once is Christianity mentioned, but also religion is only mentioned in Article 6, paragraph 3.  Later in the Bill of Rights, Christianity isn't mentioned and religion is only mentioned once, and that is in Amendment 1.  

For further details as well as my sources (the find feature in most web browsers is a great feature to have:

http://www.ushistory.org/declaration/document/

http://www.ushistory.org/documents/constitution.htm

http://www.ushistory.org/documents/amendments.htm

",null,1,cdnm7eh,1rhs01,talesFromRetail,top_day,4
mmisery,"I usually say Merry Chrismakwanzakah, it offends no one :)",null,1,cdnr74i,1rhs01,talesFromRetail,top_day,4
GrimGuy,"Damned if you do, damned if you don't. Start saying 'Merry Christmas' to enough people and I guarantee you'll hit up a particularly smug /r/atheism type who will spend half an hour lecturing you on why they're not interested in your holiday wishes.

During my many retail years, I just stopped saying anything and adopted full 'grump mode' during Nov/Dec. If someone said Merry Christmas/Happy Holidays to me, I'd respond in kind - but that's it. ",null,1,cdnttk0,1rhs01,talesFromRetail,top_day,5
eminenthalcyon,"""Oh my God, other people exist in the world, and their feelings have to be considered by places of business! I'm so oppressed!""",null,0,cdny9d7,1rhs01,talesFromRetail,top_day,3
secret2594,Whatever happened to Festivus?,null,0,cdnjc2t,1rhs01,talesFromRetail,top_day,3
PlumoUy,some people have an uncanny ability for bullshit :/,null,0,cdnm6rd,1rhs01,talesFromRetail,top_day,2
dignam4live,"People actually get angry about using the term ""Happy Holidays"" instead of ""Merry Christmas?"" No one even cares if you're religious or not in Australia.",null,2,cdnpxk6,1rhs01,talesFromRetail,top_day,4
ph0bos,I like to say Happy Chrismahanakwanzakah. ,null,0,cdnqu27,1rhs01,talesFromRetail,top_day,2
WhiteyDude,"&gt; ""Oh yeah, there's a reason alright.""

Some people just love finding a reason to be pissed off. It's what they look forward to, what they relish.  You can bet she's told this story 20 times already, getting herself worked up everytime. ",null,1,cdnro3q,1rhs01,talesFromRetail,top_day,4
poeticdisaster,"You have the right plan.   Don't let other people who choose to be offended change how you react to people as a whole.  

",null,0,cdnshiw,1rhs01,talesFromRetail,top_day,2
ForgetfulDoryFish,"It only bothers me if it is December and I say ""Merry Christmas"" to a cashier first, and in response get a cold stony glare and a ""Happy *holidays*"" in return. ",null,2,cdnt006,1rhs01,talesFromRetail,top_day,3
Furfaidz,"Christmas used to be illegal in places like Alabama until a little over 100 years ago because it was believed to be considered pagan (and it is). One thing that pisses me off more than anything else is that type of privileged ignorance. 

If I say ""Happy Holidays"" and someone tells me ""No, it's merry Christmas"" I'm going to educate them on Saturnalia, which is not only what Christmas is based off of, it's *even better than Christmas*.",null,1,cdnuney,1rhs01,talesFromRetail,top_day,2
Laniius,"I work retail. Over the years, I've actually grown to like it (then again, I'm working at a bookstore which was like my dream job when I was little, even though the pay isn't that great). 

But I will be the first to say that the holidays suuuuck. For everyone who's day you make because you help them find the right gift, you'll get a dickwad who make you weep for humanity. As Christmas lurches ever closer, you'll get more dickwads. 

",null,0,cdnv625,1rhs01,talesFromRetail,top_day,3
Cheeky6892,"For all those assholes that complain about not hearing Merry Christmas, just remember: It's only one fucking day. I should not have to be wishing you a Merry Christmas from the first of November onwards. Unless it's actually Dec 25, it's just the holidays, so Happy Holidays to all you fuckers.",null,0,cdnvfc2,1rhs01,talesFromRetail,top_day,2
theschillingmaster,"Here is a list of winter holidays....It should be fun to watch people react when you wish someone a ""Happy Dongzhi Festival!""

http://en.wikipedia.org/wiki/List_of_winter_festivals",null,0,cdnvtsw,1rhs01,talesFromRetail,top_day,2
tml417,"You should really fuck with them and say ""Happy Hanukkah"" on Thanksgiving because it actually is both.  ",null,0,cdnwntt,1rhs01,talesFromRetail,top_day,2
negaburgo,It's not even December yet...,null,0,cdny1wk,1rhs01,talesFromRetail,top_day,2
usernamenotknown,"What about ""My"" beliefs?  Now yes they do change based on whom I want to piss off but so what?  ",null,0,cdnyp83,1rhs01,talesFromRetail,top_day,2
SongBird2,I've always been tempted to say have a Happy Hanukkah or a Joyous Kwanzaa just to see what they would say. I never do because i don't think they would appreciate it coming from an extremely white girl.,null,0,cdnkruq,1rhs01,talesFromRetail,top_day,2
Maloth_Warblade,"Tell her happy Hanukkah next. When she tries to report you for that, state you're Jewish, and forcing her beliefs on you is offensive.",null,130,cdnfat8,1rhs01,talesFromRetail,top_day,641
Coaz,"Just wait, it gets better. I work in a phone store so each customer I deal with I get to talk to for around 20 minutes at least. 

There's always those customers who I'll have great conversations with and they're laughing and loving being here and then they invite me to go to church with them. I don't have a problem with church, I go with my devote Christian mother whenever I visit, but I have no interest in religion. I go because it makes her happy and I love spending time with my family. 

So they invite me to church and I'll try and brush it off with ""Maybe, yeah. I might make it out there."" Some people drop it there, but about half keep pushing. They then ask me where I go to church and then keep pressuring me to come to church with them. They'll offer to pick me up from my house and I can come over and they make me lunch and all sorts of things. It usually devolves into a really awkward conversation at this point so I usually just tell them I have to work every Sunday and most of them understand and leave it alone. However, I have had a few people who've offered to buy me groceries to make up for the money I missed from being at work. 

Anyway, wall of text over. Enjoy your first holiday on retail OP. I expect more stories from you because of the holidays. Once you're here, you can never leave. You're one of us now. ",null,26,cdng1fu,1rhs01,talesFromRetail,top_day,134
Cheeky6892,"People need to calm down about Happy Holidays. I'm a Christian, and I don't expect retail workers to wish me a Merry Christmas. At the end of the day, it's just a nice sentiment when a customer is leaving. Some people just need to get over themselves.",null,15,cdnhp4u,1rhs01,talesFromRetail,top_day,84
vivling,"As a flight attendant, I generally said Merry Christmas to departing passengers, but would switch it up to Happy Holidays, what have you, when I would get bored saying the same thing over and over.  I'm also a bit of a troll in real life, so I would sometimes save the Happy Holidays for someone I knew would get offended, just to see them swell up with indignation, then deflate as they realized I just said Merry Christmas to the person in front of them. 

Sometimes, this was the only bright spot in my day.",null,12,cdngwzu,1rhs01,talesFromRetail,top_day,74
HSChronic,"How dare you not wish me Happy 4th of July OP. It is right around the corner after all. What is wrong with you. I'm taking this one to corporate, I can't believe what type of people they hire. ",null,13,cdnfefn,1rhs01,talesFromRetail,top_day,74
oddballgeek,"""Oh is it christmas? Really? You'd think someone would put up a few decorations or play some songs or something. Huh. Well, maybe next year the stores will *finally* get into the spirit early enough so it's easy for people to remember when it is.""",null,7,cdni1dy,1rhs01,talesFromRetail,top_day,47
lcoursey,"Remind her that no one said Merry Christmas until Charles Dickens used it in the 1800's.  Last I checked ""A Christmas Carol"" isn't the bible...",null,9,cdndahb,1rhs01,talesFromRetail,top_day,48
dereckc1,"Perhaps she's...

Well maybe she...

Yeah I've got nothing. Feigned indignation when you're a week or two away I can see having some relevance in her mind given that mindset, but not when there's another major holiday between you and Christmas. ",null,7,cdnjsdq,1rhs01,talesFromRetail,top_day,37
etterboce,"I once had two customer complaints in one day.

The first was because I did not wish a customer a Merry Christmas. She complained loudly to my manager and called corporate.

Later that day, I had a customer call corporate because I wished her a Merry Christmas and she found it offensive. 

You can't please everyone. And any retail manager who has worked the holidays before will write off these complaints because there is absolutely nothing that can be done to satisfy these customers.

Maybe they should realize that their consumerism is far more contradictory to the spirit of Christmas than the inclusion or exclusion of the word Christmas from their interactions with cashiers, or how the holidays are portrayed on the store's marketing materials and signage.",null,7,cdne9f2,1rhs01,talesFromRetail,top_day,39
ichosethis,I worried my boss the other day when I told her I was offended that a box of Christmas decorations was in her office. She thought I was offended about Christmas when really it was in front of the water cooler.,null,7,cdnf5rk,1rhs01,talesFromRetail,top_day,35
Benanov,"Damn it, it's too early for the Christian Persecution Machine.",null,11,cdnjs2d,1rhs01,talesFromRetail,top_day,38
scrimmy,Wish her a blessed winter solstice.. She'll love that.,null,5,cdnpm10,1rhs01,talesFromRetail,top_day,33
KroipyBill,"I'm a Christian. You say Happy Holidays to me, I will be thankful for the gesture. You think I'm Jewish for some reason and say Happy Hanukkah to me? I'll laugh to myself, but I'll appreciate the gesture. You say Happy Kwanzaa to me, I will be confused, but appreciate the gesture. 

There is a trend here. I don't care what you say. I'll appreciate the gesture. ",null,5,cdnf712,1rhs01,talesFromRetail,top_day,28
motocyclisme,"You just started in August??? Well, good luck to you. I have plenty of great memories from retail. But you will definitely learn the meaning of ""you can't please all the people all the time."" People like that customer have nothing better to do but get a stick up their ass about *nothing.* Just remember to not take it personally! Hope your holiday work goes smoothly. ",null,4,cdniu8s,1rhs01,talesFromRetail,top_day,25
Jeremyiswin,Merry Mother Fucking Christmas to each and every one of you.,null,2,cdnko5u,1rhs01,talesFromRetail,top_day,24
Reddit_Burninator,"People forget that Jesus, when asked what the greatest commandment was, said to love God and love your neighbor. Just love people, dang it! Any Christian who isn't loving, is doing it wrong, and shouldn't be able to apply the title Christian.

It's like saying I'm a pacifist, and then grabbing a bat and hitting someone for saying they like to watch violent movies.",null,4,cdnlbwn,1rhs01,talesFromRetail,top_day,25
