author,comment,distinguished,downs,id,post,subreddit,type,ups
crickey23,"I really hate how customers think ""the back"" is a magical room that can magically produce the item they want, like we're hiding it away for ourselves.",null,27,cdnclpz,1rhj7w,talesFromRetail,top_day,156
bobnojio,"Pfft. I ruined thanksgiving over a month ago. When our thanksgiving happened.

--Canada",null,4,cdnf6d2,1rhj7w,talesFromRetail,top_day,51
Gneissisnice,"How dare you hide those parsnips from that poor woman? We all know that all stores keep extras of everything hidden in the back instead of putting them out on the floor to be sold.

You should be ashamed of yourself.",null,7,cdnckj6,1rhj7w,talesFromRetail,top_day,35
adelajoy,"On the rare occasion, a customer asks for something specific, and I remember opening a box with that item but not having time to put it out yet, I tell them to wait, run to the back, look through the handful of boxes and return holding what they asked for. I'm afraid this kind of help makes people think what they want is always in the back. I've probably single-handedly ruined it for everyone else. I apologize.",null,0,cdnei1y,1rhj7w,talesFromRetail,top_day,25
halo00to14,"[Found on imgur last night, oddly topical...](http://i.imgur.com/yY8D6.png)",null,2,cdnf5b4,1rhj7w,talesFromRetail,top_day,21
ianufyrebird,"So, what you're saying is... tomorrow, you'll have [Parsnips a-plenty](http://www.youtube.com/watch?v=lqallz5Ypog)?",null,1,cdncusj,1rhj7w,talesFromRetail,top_day,15
coatrack68,"Lean in until she leans in too, like you're telling her where the secret parsnips are.  then say, ""everyone hates the stuffing.  they just don't tell you becuase they know you'll go batshit crazy.""",null,1,cdnif8j,1rhj7w,talesFromRetail,top_day,16
hannahcyanide,"I'm in an Asian country, so thanksgiving isn't a thing here - but I have seen this exchange in my local supermarket. The poor man got cursed out in three different languages.",null,1,cdnb9jg,1rhj7w,talesFromRetail,top_day,15
TheNovamonk,"&gt;Bonus tale- nineteen year old new hire asks: ""Are you working tomorrow?""
  
  

&gt;""Everyone is working tomorrow. Everyone.""


I pictured this phrase being delivered in front of a stunning landscape shot, light streaming down.  In the distance you see a thunderstorm start to form.  The words are being voiced by James Earl Jones.  The background music is a quiet, solemn dirge the slowing builds in intensity. 
",null,2,cdnhhuz,1rhj7w,talesFromRetail,top_day,14
WishfulOne,"I ruined Christmas one year.  Apparently, as a cashier, it was my fault that we were sold out of cranberry sauce.  How dare I let all those other customers purchase it before she decided to show up 30 minutes before close on Christmas Eve. Sheesh, some people's children.",null,0,cdni942,1rhj7w,talesFromRetail,top_day,13
carriegood,"Last year, I was going to make my special brussels sprouts for Thanksgiving. But recently, the veggie has been getting very popular, even trendy.  So last year, I went to 5 grocery stores and everyone was out. At my favorite store, I did ask the produce guy if they had any ""in the back"" and to his credit, he told me they had them first thing in the morning, but they were long gone.

Last night I stopped at a small local grocer, and they not only had a giant bin of loose ones, they had the stalks. There were stalks piled up with the rest of the vegetables, there were stalks on a special 6' shelving unit by the front door, and there were stalks on another unit at the end of the aisle. 

When I was checking out, I thanked the cashier for thinking ahead and stocking so much. She looked at me like I was crazy.  From now on, I'm just paying for my sprouts and leaving.

",null,1,cdnih6d,1rhj7w,talesFromRetail,top_day,14
DancesWithPugs,"""Grandma? why does the stuffing taste better this year?""

""BECAUSE THERE WERE NO FUCKING PARSNIPS YOU BRAT!""",null,0,cdnpdkr,1rhj7w,talesFromRetail,top_day,12
I_really_just_cant,And you officially saved Thanksgiving for the children that had to eat those things.,null,4,cdncwwr,1rhj7w,talesFromRetail,top_day,12
tryreadingsometime,I'm going to be on register tomorrow. Fffuuuuuuu.....,null,1,cdnd4rr,1rhj7w,talesFromRetail,top_day,9
msprang,"She could've bought them earlier, especially since parsnips and other root vegetables have good longevity.",null,0,cdnhp6g,1rhj7w,talesFromRetail,top_day,7
xVarekai,"When screamed at to go in the back:

*Goes into the back room.*

*Stands there/checks phone/bitches about customer to other employees/enjoys a little quiet for a moment/contemplates life.*

*Returns empty-handed, looking sorrowful.*

Customer:  ""Oh.  Not even in the back?  Man, you weren't kidding.  Ok, guess I'll go look at the other store up the road.""

*sigh*",null,0,cdno78l,1rhj7w,talesFromRetail,top_day,6
Sigillite,I hate ***THE BACK***,null,1,cdndlt4,1rhj7w,talesFromRetail,top_day,5
ferafish,"Sadly, it's stores like the one I used to work at that perpetuate this idea. We were always open until 9 PM, but our stock people went home around 6 PM. With certain popular things, especially in produce, there often was some in the back.

For example, strawberries went on sale. The person in produce had filled the display before leaving, and in two hours it was empty. So at 8:30, we get someone who was hoping to get strawberries. Low and behold, there were a couple flats of them.

Similar thing happens with meat department, but no one outside of meat can actually price it, thus we can't help in that case.",null,0,cdng5j8,1rhj7w,talesFromRetail,top_day,4
sunshineeyes,"In scenarios like these, I like to think that maybe her grandmother just passed and she's hosting this year for the whole family for the first time. 

It makes her seem like less of a bitch and just more of a sad little nut.",null,0,cdnmhjh,1rhj7w,talesFromRetail,top_day,4
techiejames,"WTF?  All of that over parsnips?

Just breath.",null,1,cdncv9r,1rhj7w,talesFromRetail,top_day,3
bender_2982,"This story *must* be fake. No one likes parsnips that much. 

/s",null,0,cdnh9t8,1rhj7w,talesFromRetail,top_day,3
Vanetia,"&gt;""Everyone is working tomorrow. Everyone.""

This was my pizza place the day before Halloween.

And Easter strangely enough (lots of ham pizzas are ordered on that day--no joke)",null,0,cdnmktb,1rhj7w,talesFromRetail,top_day,4
CactusSleuth,"My store recently implemented policy changes and our overstock is has less space to inhabit. Even before this, we probably didn't have any extra shit in the back. Or if we did, it would take so long to find, you would leave before we did. With a few exceptions, of course.   ",null,0,cdndrtn,1rhj7w,talesFromRetail,top_day,2
ssm316,You should of just told her what isle Stove top was in in. I doubt anyone would notice. ,null,3,cdng565,1rhj7w,talesFromRetail,top_day,5
dotlurk,"&gt;Bonus tale- nineteen year old new hire asks: ""Are you working tomorrow?""

&gt;""Everyone is working tomorrow."" 

http://imgur.com/MbzDmcu",null,0,cdok5bv,1rhj7w,talesFromRetail,top_day,2
albinosquirel,what grocery store regularly stocks parsnips for fuck's sake?????,null,1,cdnvf4w,1rhj7w,talesFromRetail,top_day,2
crickey23,"I really hate how customers think ""the back"" is a magical room that can magically produce the item they want, like we're hiding it away for ourselves.",null,27,cdnclpz,1rhj7w,talesFromRetail,top_day,156
bobnojio,"Pfft. I ruined thanksgiving over a month ago. When our thanksgiving happened.

--Canada",null,4,cdnf6d2,1rhj7w,talesFromRetail,top_day,51
Gneissisnice,"How dare you hide those parsnips from that poor woman? We all know that all stores keep extras of everything hidden in the back instead of putting them out on the floor to be sold.

You should be ashamed of yourself.",null,7,cdnckj6,1rhj7w,talesFromRetail,top_day,35
adelajoy,"On the rare occasion, a customer asks for something specific, and I remember opening a box with that item but not having time to put it out yet, I tell them to wait, run to the back, look through the handful of boxes and return holding what they asked for. I'm afraid this kind of help makes people think what they want is always in the back. I've probably single-handedly ruined it for everyone else. I apologize.",null,0,cdnei1y,1rhj7w,talesFromRetail,top_day,25
halo00to14,"[Found on imgur last night, oddly topical...](http://i.imgur.com/yY8D6.png)",null,2,cdnf5b4,1rhj7w,talesFromRetail,top_day,21
ianufyrebird,"So, what you're saying is... tomorrow, you'll have [Parsnips a-plenty](http://www.youtube.com/watch?v=lqallz5Ypog)?",null,1,cdncusj,1rhj7w,talesFromRetail,top_day,15
coatrack68,"Lean in until she leans in too, like you're telling her where the secret parsnips are.  then say, ""everyone hates the stuffing.  they just don't tell you becuase they know you'll go batshit crazy.""",null,1,cdnif8j,1rhj7w,talesFromRetail,top_day,16
hannahcyanide,"I'm in an Asian country, so thanksgiving isn't a thing here - but I have seen this exchange in my local supermarket. The poor man got cursed out in three different languages.",null,1,cdnb9jg,1rhj7w,talesFromRetail,top_day,15
TheNovamonk,"&gt;Bonus tale- nineteen year old new hire asks: ""Are you working tomorrow?""
  
  

&gt;""Everyone is working tomorrow. Everyone.""


I pictured this phrase being delivered in front of a stunning landscape shot, light streaming down.  In the distance you see a thunderstorm start to form.  The words are being voiced by James Earl Jones.  The background music is a quiet, solemn dirge the slowing builds in intensity. 
",null,2,cdnhhuz,1rhj7w,talesFromRetail,top_day,14
WishfulOne,"I ruined Christmas one year.  Apparently, as a cashier, it was my fault that we were sold out of cranberry sauce.  How dare I let all those other customers purchase it before she decided to show up 30 minutes before close on Christmas Eve. Sheesh, some people's children.",null,0,cdni942,1rhj7w,talesFromRetail,top_day,13
carriegood,"Last year, I was going to make my special brussels sprouts for Thanksgiving. But recently, the veggie has been getting very popular, even trendy.  So last year, I went to 5 grocery stores and everyone was out. At my favorite store, I did ask the produce guy if they had any ""in the back"" and to his credit, he told me they had them first thing in the morning, but they were long gone.

Last night I stopped at a small local grocer, and they not only had a giant bin of loose ones, they had the stalks. There were stalks piled up with the rest of the vegetables, there were stalks on a special 6' shelving unit by the front door, and there were stalks on another unit at the end of the aisle. 

When I was checking out, I thanked the cashier for thinking ahead and stocking so much. She looked at me like I was crazy.  From now on, I'm just paying for my sprouts and leaving.

",null,1,cdnih6d,1rhj7w,talesFromRetail,top_day,14
DancesWithPugs,"""Grandma? why does the stuffing taste better this year?""

""BECAUSE THERE WERE NO FUCKING PARSNIPS YOU BRAT!""",null,0,cdnpdkr,1rhj7w,talesFromRetail,top_day,12
I_really_just_cant,And you officially saved Thanksgiving for the children that had to eat those things.,null,4,cdncwwr,1rhj7w,talesFromRetail,top_day,12
tryreadingsometime,I'm going to be on register tomorrow. Fffuuuuuuu.....,null,1,cdnd4rr,1rhj7w,talesFromRetail,top_day,9
msprang,"She could've bought them earlier, especially since parsnips and other root vegetables have good longevity.",null,0,cdnhp6g,1rhj7w,talesFromRetail,top_day,7
xVarekai,"When screamed at to go in the back:

*Goes into the back room.*

*Stands there/checks phone/bitches about customer to other employees/enjoys a little quiet for a moment/contemplates life.*

*Returns empty-handed, looking sorrowful.*

Customer:  ""Oh.  Not even in the back?  Man, you weren't kidding.  Ok, guess I'll go look at the other store up the road.""

*sigh*",null,0,cdno78l,1rhj7w,talesFromRetail,top_day,6
Sigillite,I hate ***THE BACK***,null,1,cdndlt4,1rhj7w,talesFromRetail,top_day,5
ferafish,"Sadly, it's stores like the one I used to work at that perpetuate this idea. We were always open until 9 PM, but our stock people went home around 6 PM. With certain popular things, especially in produce, there often was some in the back.

For example, strawberries went on sale. The person in produce had filled the display before leaving, and in two hours it was empty. So at 8:30, we get someone who was hoping to get strawberries. Low and behold, there were a couple flats of them.

Similar thing happens with meat department, but no one outside of meat can actually price it, thus we can't help in that case.",null,0,cdng5j8,1rhj7w,talesFromRetail,top_day,4
sunshineeyes,"In scenarios like these, I like to think that maybe her grandmother just passed and she's hosting this year for the whole family for the first time. 

It makes her seem like less of a bitch and just more of a sad little nut.",null,0,cdnmhjh,1rhj7w,talesFromRetail,top_day,4
techiejames,"WTF?  All of that over parsnips?

Just breath.",null,1,cdncv9r,1rhj7w,talesFromRetail,top_day,3
bender_2982,"This story *must* be fake. No one likes parsnips that much. 

/s",null,0,cdnh9t8,1rhj7w,talesFromRetail,top_day,3
Vanetia,"&gt;""Everyone is working tomorrow. Everyone.""

This was my pizza place the day before Halloween.

And Easter strangely enough (lots of ham pizzas are ordered on that day--no joke)",null,0,cdnmktb,1rhj7w,talesFromRetail,top_day,4
CactusSleuth,"My store recently implemented policy changes and our overstock is has less space to inhabit. Even before this, we probably didn't have any extra shit in the back. Or if we did, it would take so long to find, you would leave before we did. With a few exceptions, of course.   ",null,0,cdndrtn,1rhj7w,talesFromRetail,top_day,2
ssm316,You should of just told her what isle Stove top was in in. I doubt anyone would notice. ,null,3,cdng565,1rhj7w,talesFromRetail,top_day,5
dotlurk,"&gt;Bonus tale- nineteen year old new hire asks: ""Are you working tomorrow?""

&gt;""Everyone is working tomorrow."" 

http://imgur.com/MbzDmcu",null,0,cdok5bv,1rhj7w,talesFromRetail,top_day,2
albinosquirel,what grocery store regularly stocks parsnips for fuck's sake?????,null,1,cdnvf4w,1rhj7w,talesFromRetail,top_day,2
BlankName55,"[This story](http://www.reddit.com/r/TalesFromRetail/comments/1r6krb/humanity_in_lane_12_tales_from_a_little_spark/) is real but was turned in as fiction in a writing course, and I tried to note that in the post. So that's my $0.02.",null,0,cdnedrm,1rhi3l,talesFromRetail,top_day,2
RaxonDR,"What? But surely nobody would ever really lie about their experiences here in TFR.

That would be like frat brothers lying about who they've slept with. That would be violating a sacred trust!",null,1,cdnky7j,1rhi3l,talesFromRetail,top_day,1
BlankName55,"[This story](http://www.reddit.com/r/TalesFromRetail/comments/1r6krb/humanity_in_lane_12_tales_from_a_little_spark/) is real but was turned in as fiction in a writing course, and I tried to note that in the post. So that's my $0.02.",null,0,cdnedrm,1rhi3l,talesFromRetail,top_day,2
RaxonDR,"What? But surely nobody would ever really lie about their experiences here in TFR.

That would be like frat brothers lying about who they've slept with. That would be violating a sacred trust!",null,1,cdnky7j,1rhi3l,talesFromRetail,top_day,1
DingleBerryCobbler,"One time a woman did that over about 30 cents. I was young and dumb and in my most sarcastic voice I said ""Oh my gosh! I am SO sorry! You really need those 30 cents. Here, I'll get them for you. Oh sorry, I'm out of quarters and dimes, here have one nickel...five, two nickels, ten cents... four, five... Sorry, the rest have to be in pennies. HAVE A GREAT DAY!""

I have never seen more rage on any person, ever.",null,9,cdncogk,1rhfwt,talesFromRetail,top_day,59
Icalasari,Your managers sound like they have less spine than a timid jellyfish,null,4,cdnadoa,1rhfwt,talesFromRetail,top_day,29
Killer_Avocado,"Sort of related and I am ashamed to admit this, but hell I will anyway!

When the Samsung Galaxy SIII came out, I was up for a new phone. I went to my local cell shop. It was a privately owned shop that did prepaid (boost, virgin mobile) and my contracted carrier, or so I thought.

I walk down to the store, open the door and continue to walk in. There is a line so I find an appropriate spot to wait, happened to be a rather comfy chair. I look at all the people, try to eavesdrop on various conversations, just general people watching. A reasonable amount of time passes, and I am able to start my transaction. 

Cashier: ""Hi, what can I do for you today""

Me: ""I'd like to purchase a new phone""

Cashier: ""Ok, and wh0 is your carrier?"" 

Me: ""Sprint""

Cashier: ""I'm sorry sir. I can't help you as we aren't affiliated with Sprint 
anymore""

Me: ""What?!"" 

Cashier: ""Yes, we only service Boost and Virgin Mobile here""

Then I take a look around, notice that the store is devoid of any Sprint logos, or yellow for that matter.

Me ""Wow, I'm an idiot. I'm sorry, have a good one""

I then turn around and walk out the door. Defeated, ashamed, embarrassed and lacking my new phone.

tl:dr Dumbass walks into store to purchase phone, store doesn't even serve his carrier. ",null,4,cdne9v9,1rhfwt,talesFromRetail,top_day,17
Leider1000,I hate these managers. You abuse our staff and you GET REWARDED FOR THAT. WTF is wrong with people these days,null,2,cdndgsj,1rhfwt,talesFromRetail,top_day,10
Kahluka,"I remember pissing off some kids at my old fast food job..

Stoned Kid pulls up to window, loudly complains that he ordered a large ham and cheese with extra cheese, and that it certainly did not have extra cheese on it! Of course he doesn't have the sandwich with him, he left it at home. I told him politely that we didn't even have a large ham and cheese sandwich here, but he continued to throw a fit. I'm angry at this point, and I know he's lying. So I go in back and simply grab a side of melted cheese for him that costs us pennies. I hand it to him with a smile telling him to go home and put the extra cheese on his sandwich, close my window and walk away as fast as possible. ",null,1,cdnorgm,1rhfwt,talesFromRetail,top_day,9
RunsWithFish,"I work in a pet store and my old gm (who is now gone thankfully) used to override what I said all the time. What makes this worse? It was over selling of animals! I would tell someone that they weren't properly set up for it so I wouldn't sell it, and to appease them she would sometimes just sell it anyways. I started just pretending my assistant manager ran the store after that (always backed up my call), at least until that gm left anyways.",null,1,cdnexew,1rhfwt,talesFromRetail,top_day,10
thorlord,"When you have a manager with no spine. Make sure to set up you calling them over to handle the situation by saying to the customer

""You know what, my manager doesn't have a spine, you probably will get that refunded if you complain at them. Let me call one over.""

You feel better because whatever the outcome you are happy, customers feel like they will act like less of a dick to you as they see an easier scam, and if your manager says anything ask them if they gave the customer the discount.",null,0,cdnrlha,1rhfwt,talesFromRetail,top_day,2
Techsupportvictim,I could understand if there was a price match policy but this was an item you don't sell so she clearly either didn't get it or get it there. The manager should have been able to figure that out and send her packing,null,0,cdnmyc1,1rhfwt,talesFromRetail,top_day,1
DingleBerryCobbler,"One time a woman did that over about 30 cents. I was young and dumb and in my most sarcastic voice I said ""Oh my gosh! I am SO sorry! You really need those 30 cents. Here, I'll get them for you. Oh sorry, I'm out of quarters and dimes, here have one nickel...five, two nickels, ten cents... four, five... Sorry, the rest have to be in pennies. HAVE A GREAT DAY!""

I have never seen more rage on any person, ever.",null,9,cdncogk,1rhfwt,talesFromRetail,top_day,59
Icalasari,Your managers sound like they have less spine than a timid jellyfish,null,4,cdnadoa,1rhfwt,talesFromRetail,top_day,29
Killer_Avocado,"Sort of related and I am ashamed to admit this, but hell I will anyway!

When the Samsung Galaxy SIII came out, I was up for a new phone. I went to my local cell shop. It was a privately owned shop that did prepaid (boost, virgin mobile) and my contracted carrier, or so I thought.

I walk down to the store, open the door and continue to walk in. There is a line so I find an appropriate spot to wait, happened to be a rather comfy chair. I look at all the people, try to eavesdrop on various conversations, just general people watching. A reasonable amount of time passes, and I am able to start my transaction. 

Cashier: ""Hi, what can I do for you today""

Me: ""I'd like to purchase a new phone""

Cashier: ""Ok, and wh0 is your carrier?"" 

Me: ""Sprint""

Cashier: ""I'm sorry sir. I can't help you as we aren't affiliated with Sprint 
anymore""

Me: ""What?!"" 

Cashier: ""Yes, we only service Boost and Virgin Mobile here""

Then I take a look around, notice that the store is devoid of any Sprint logos, or yellow for that matter.

Me ""Wow, I'm an idiot. I'm sorry, have a good one""

I then turn around and walk out the door. Defeated, ashamed, embarrassed and lacking my new phone.

tl:dr Dumbass walks into store to purchase phone, store doesn't even serve his carrier. ",null,4,cdne9v9,1rhfwt,talesFromRetail,top_day,17
Leider1000,I hate these managers. You abuse our staff and you GET REWARDED FOR THAT. WTF is wrong with people these days,null,2,cdndgsj,1rhfwt,talesFromRetail,top_day,10
Kahluka,"I remember pissing off some kids at my old fast food job..

Stoned Kid pulls up to window, loudly complains that he ordered a large ham and cheese with extra cheese, and that it certainly did not have extra cheese on it! Of course he doesn't have the sandwich with him, he left it at home. I told him politely that we didn't even have a large ham and cheese sandwich here, but he continued to throw a fit. I'm angry at this point, and I know he's lying. So I go in back and simply grab a side of melted cheese for him that costs us pennies. I hand it to him with a smile telling him to go home and put the extra cheese on his sandwich, close my window and walk away as fast as possible. ",null,1,cdnorgm,1rhfwt,talesFromRetail,top_day,9
RunsWithFish,"I work in a pet store and my old gm (who is now gone thankfully) used to override what I said all the time. What makes this worse? It was over selling of animals! I would tell someone that they weren't properly set up for it so I wouldn't sell it, and to appease them she would sometimes just sell it anyways. I started just pretending my assistant manager ran the store after that (always backed up my call), at least until that gm left anyways.",null,1,cdnexew,1rhfwt,talesFromRetail,top_day,10
thorlord,"When you have a manager with no spine. Make sure to set up you calling them over to handle the situation by saying to the customer

""You know what, my manager doesn't have a spine, you probably will get that refunded if you complain at them. Let me call one over.""

You feel better because whatever the outcome you are happy, customers feel like they will act like less of a dick to you as they see an easier scam, and if your manager says anything ask them if they gave the customer the discount.",null,0,cdnrlha,1rhfwt,talesFromRetail,top_day,2
Techsupportvictim,I could understand if there was a price match policy but this was an item you don't sell so she clearly either didn't get it or get it there. The manager should have been able to figure that out and send her packing,null,0,cdnmyc1,1rhfwt,talesFromRetail,top_day,1
PolloMagnifico,"I love the look in a persons eyes when that last piece of their soul nopes the fuck out.

It will be ok...

*one of us...*

*one of us...*

*one of us...*",null,2,cdna2qy,1rhfb1,talesFromRetail,top_day,14
Nazi_Psychiatrist,"Typically, sociopaths demonstrate no strong reactions to illogical hotbed political/social topics (e.g. Octomom or Catholic priest child molestation)."" Your comment history indicates many such strong reactions, therefore I find your claim of sociopathy lacking. 

That will be two Reddit silvers. No, I do not take insurance. See you next week.",null,1,cdnateb,1rhfb1,talesFromRetail,top_day,5
Firemission13B,I just don't like people in general. ,null,0,cdnfqa2,1rhfb1,talesFromRetail,top_day,5
Darthspaz92,It took you 3 years? Props to you man. I was only in 3 maybe 4 months before I got to that point.,null,0,cdna1xx,1rhfb1,talesFromRetail,top_day,3
techiejames,I know the feeling.  I don't give a fuck anymore.,null,0,cdncx8n,1rhfb1,talesFromRetail,top_day,1
adelajoy,"One time, I came home from a long shift at the Customer Service Desk and my husband was mad at me for something. I remember saying, ""Sorry... No, I'm not sorry. I say sorry all fucking day! I'm not sorry for those things, but it's my job to say sorry. 'Sorry you couldn't find that', 'Sorry that's the wrong price', 'Sorry you didn't like this product'... I am not truly sorry for this, so I refuse to apologize to you!""

It was a week or two after that when I put in my notice. The job was not worth the stress it was putting on me and subsequently my marriage. Also, the realization that I hated everyone was a major factor.",null,1,cdnhcxb,1rhfb1,talesFromRetail,top_day,3
ThorneLea,"I've been here for a decade. 

Help me.

I can't get out.

Edit: I am rapidly running out of fucks to give.",null,0,cdo0nmn,1rhfb1,talesFromRetail,top_day,1
the_Bryman,"Working in retail just makes you realize all the bullshit materialism and entitlement that is rampant in society today. It hardens your heart and with every false smile and ""have a great day"" you utter, you die a little more on the inside.",null,0,cdo2tm4,1rhfb1,talesFromRetail,top_day,1
