author,comments,downvotes,id,score,selftext,time_created,title,upvotes,subreddit,type
SigmaEpsilonChi,12352,10466,1rjj2f,2648,,1385518155.0,What is the greatest reallife plot twist in all of history,13114,AskReddit,top_week
funkyfurry,5101,9617,1rjox0,2645,,1385522781.0,Reddit what is your favorite free webgame,12262,AskReddit,top_week
Luithien,11693,8897,1rgpdf,2599,Edit Reddit loves to pee in stuff,1385430725.0,What is the laziest thing youve ever done,11496,AskReddit,top_week
monkeyman,7540,5897,1ra6k6,2578,,1385208412.0,Whats a weird rule at your job where you know its only there because someone was dumb enough to do it in the first place,8475,AskReddit,top_week
thedizzle,2172,9139,1rlkd0,2524,,1385586216.0,What are some great cyber monday deals reddit might not know about,11663,AskReddit,top_week
aax,5816,8266,1rogyw,2433,,1385686444.0,What is the best website other than reddit,10699,AskReddit,top_week
unorthodoxspork,3712,6329,1rawl2,2425,,1385235484.0,People working in television When an actor finds out hisher character is about to be killed off how does that go down and have you ever witnessed it going poorly,8754,AskReddit,top_week
Manonthemoons,12964,5803,1rcchm,2369,,1385287757.0,What movie has a misinterpreted ending,8172,AskReddit,top_week
Lintriff,10600,6109,1rmw4j,2289,,1385627541.0,Redditors who got married too soon what did you find out about your SO after it was too late,8398,AskReddit,top_week
callux,9774,5519,1rnrch,2275,,1385663453.0,Whats one of the smallest things that makes you the happiest,7794,AskReddit,top_week
Denton,9068,8148,1re0rl,2266,Whether you work retail currently or just did in the past Ive got to know what the craziest thing youve ever seen on Black Friday isEDIT Wow front page Thank you everyone for your very entertaining repliesEDIT  Too all the people nervous about working on Black Friday after this I offer one small condolence A beer will never taster better than it does at the end of a crappy shift,1385345010.0,Retail Employees of Reddit What Are Your Black Friday Horror Stories,10414,AskReddit,top_week
searchandrecover,11355,5804,1rfffh,2193,Some of these comments made me cringe  Thanks to all of you who have posted stories and thanks for brightening my shitty Monday ,1385400036.0,What is the most humiliatingawkward situation that you have ever witnessed in a classroom,7997,AskReddit,top_week
OfficerDanDan,9698,5960,1rkmze,2179,,1385562940.0,When was the first time you felt like an adult,8139,AskReddit,top_week
starstufft,4157,3046,1rezhh,2176,,1385386787.0,What is your poor mans food recipe,5222,AskReddit,top_week
TheMagicSkyFairy,3371,4567,1rneak,2164,edit Was told to remove my guess from description,1385652802.0,serious Buffet owners  managers of Reddit how much food does one need to eat to get their moneys worth,6731,AskReddit,top_week
Hotash,3929,2302,1rhj2i,2095,,1385459339.0,What is one Documentary that everyone should watch and why,4397,AskReddit,top_week
bigtime,2444,3246,1rnjev,2085,,1385657355.0,Reddit what are some SFW jokes I can tell around the table tonight,5331,AskReddit,top_week
BeNiceme,3289,3059,1rl2pg,2081,,1385574698.0,Older Redditors What do you like best about the younger generation,5140,AskReddit,top_week
woo,6442,10219,1rewhf,2030,Thanks for uChillMurray for posting this httpwwwphillycomphillyblogstrendingMallsantastorieswillhityourightinthefeelshtmlThanks to uZebz for pointing this one out httpwwwhlntvcomarticleconfessionsmallsantahpthptFor those that are still reading thisWe can certainly see that there are many atneed children in this world We also remember what it was like to get that favorite toy during the holidays You may not be Santa but you can still help I implore you please donate at least one toy to a cause Could be some local charity or perhaps Toys for Tots Also most donations are for toddlers Older kids have a tendency to be short changed in these drives So if you can try to get something for the  year olds I would strongly suggest something along the lines of science Why not guide those young minds while you have a chance A  gift can make a difference,1385382644.0,Mall Santas of Reddit What is the most disturbing heartwrenching or weirdest thing a child has asked you for,12249,AskReddit,top_week
HardAtWorkPainting,2348,2143,1rf9yd,2025,EDIT Im seeing a lot of college related stuffEDIT So many stories its kinda sad but I hope it does some goodEDIT Damn Reddit are you OK,1385396151.0,People whove had a mental breakdown or snapped how did it feel what happened,4168,AskReddit,top_week
MolecularBlackout,11863,4247,1rd3ci,2016,,1385320199.0,What video game to you is a must play,6263,AskReddit,top_week
ChuckECheeseBandit,7542,4245,1rnbkc,2017,,1385650138.0,What is the biggest or fucked up secret your family has,6262,AskReddit,top_week
amsterDerp,4077,4334,1rchhl,2014,,1385297872.0,People who have posted a secret on reddit and had a friend find it what was it and how did it go,6348,AskReddit,top_week
Davisasm,5632,2540,1riazr,1976,,1385487998.0,Whats the one creepiest thing that has ever happened in your life,4516,AskReddit,top_week
ScorchtheAssasin,7266,3383,1rkq22,1947,,1385565599.0,What was the biggest lie told to you about college before actually going,5330,AskReddit,top_week
Administrata,6194,4299,1rpdk1,1931,,1385723460.0,If your first love came back to offer you everything you ever dreamed of what would you do,6230,AskReddit,top_week
SugarFreeCyanide,3887,4645,1rf091,1865,,1385387683.0,Drug dealers of Reddit what is an average day for you,6510,AskReddit,top_week
AliceMorganLuther,10235,4728,1rbskp,1851,Either because its outside of the sexual norm youve been judged for it in the past or because its not socially acceptable ,1385262400.0,NSFW What is something that turns you on but dont like to admit to,6579,AskReddit,top_week
erikangstrom,14044,7138,1rctjs,1838,Something everyone always goes on and on about but actually isnt all that great,1385312442.0,NSFW What is the single most overrated experience of life,8976,AskReddit,top_week
ChicagoFire,2888,1343,1rlnx2,1757,,1385588660.0,Aside from sex What is the most intimate experience youve ever shared with someone else,3100,AskReddit,top_week
Fidodo,4784,1976,1reshi,1744,I remember hearing some really ridiculous rumors from friends as a kid about outlandish secrets in video games Obviously in retrospect they were completely full of it What are yours,1385375955.0,What is the stupidest rumored video game secret you believed as a child,3720,AskReddit,top_week
ZenTempus,3945,2085,1ra4dg,1734,I remember hearing about a guy who stayed up for I think eleven consecutive days He ended up hallucinating So Redditwould youcould you ,1385203981.0,What is the longest youve ever stayed awake,3819,AskReddit,top_week
supmatt,3602,1906,1rknwo,1722,,1385563810.0,Which videogames allow players to cooperate and then suddenly betray others,3628,AskReddit,top_week
ilovelgswhowearTNA,1916,1593,1rabjf,1681,SPOILER People who have not read  Room  is a room in which you are faced against your greatest fear to the point of insanity For example in the book the protagonist fears rats the most and so he is trapped with enormously large vicious purposely starved street ratsEDIT Wow i made this at like  am thinking id get atleast  legit answers thanks to everyone who upvoted CLOSING EDIT The amount of NSA jokes were too damn high,1385216432.0,People who have read George Orwells  What would happen to you in your Room ,3274,AskReddit,top_week
Joebebs,11940,9221,1rhsx0,1664,Thanks guys I enjoyed the comments ,1385473687.0,What was one of your WTF Brain moments,10885,AskReddit,top_week
wheelitzo,2551,2149,1r9ocj,1651,,1385181148.0,When aliens land on the earth  years from now and all of mankind has long since perished what one photograph or picture would best represent humanity for them to see,3800,AskReddit,top_week
Dwner,1563,1153,1rkp2l,1625,,1385564772.0,Redditors who have survived a fall from a potentially deadly height what happened Do you remember what you were thinking about on the way down Do you remember hitting the ground,2778,AskReddit,top_week
snappingturtlee,3007,2984,1roqaj,1619,,1385695631.0,Whats the weirdest porn video you watched but still got off to NSFW,4603,AskReddit,top_week
hatetotellyouthisbut,3511,1896,1r9gve,1575,What were the circumstances Please dont be rude and keep this serious and honest Edit Thank all of you for sharing your experiences My condolences to each of you which saw a loved one pass away I myself saw my own mother pass away due to cancer when I was  In any case this is all awfully depressing I had to stop checking my inbox but I appreciate you all sharing your responses ,1385174228.0,Reddit when was the first time you saw a dead body Serious,3471,AskReddit,top_week
MozillaFirefoxx,8474,18186,1ri6ca,1542,Post a flattering picture Edit Front Page And plenty of beautiful women Im glad we kept it as classy as possible when it comes to this profession It looks like we all have a lot of research to do ,1385484784.0,Who is the prettiest pornstar in your opinion Nsfw,19728,AskReddit,top_week
manwithtoes,5529,3157,1rjmel,1499,,1385520780.0,Whats the scariest image youve found on the internet that still haunts you NSFW,4656,AskReddit,top_week
hondacivic,2200,1062,1r9wcm,1413,,1385190022.0,Former prisoners of Reddit what is the craziest thing you witnessed in prison,2475,AskReddit,top_week
IchbinRick,4373,865,1rhtww,1397,,1385474754.0,Whats a movie that you didnt want to see at first but ended up loving,2262,AskReddit,top_week
DisturbingSilence,2086,796,1rinhm,1385,,1385496378.0,When was the best time you thought I clearly underestimated this person,2181,AskReddit,top_week
awrobl,4346,975,1rhwa8,1381,I did something pretty bad recently and would like to know whether or not I am the worst person on Reddit Sound off get something off your chest Lets talk it outedit As umoofied pointed out some of the more interesting replies to this thread can be found when sorting by controversy And also I have posted in the thread under a different account name,1385477034.0,What do you feel is the worst thing you have ever done serious,2356,AskReddit,top_week
allhailnart,4066,1075,1rcpor,1380,In partial response to the paradox thread which got me thinking,1385308791.0,What is the most thoughtprovoking question you know,2455,AskReddit,top_week
iamkokonutz,2658,853,1rnv9o,1324,The basis for this question is from this video on YouTubehttpswwwyoutubecomwatchvyeBsrOS I found randomly the other day while searching for something else Now I just wanna drop things from great height,1385666582.0,What would be the most satisfying object to drop from the height of a tall building,2177,AskReddit,top_week
kd,1592,900,1rmn5e,1319,The JFK assassination is considered one of the first breaking news television events Given the state of todays media how would the coverage be different if it had happened today,1385617240.0,If the JFK assassination happened in  how would the news coverage be different,2219,AskReddit,top_week
coppertellurium,2878,652,1rf8t0,1298,Instead of just naming them if you could post the actual riddle on here please,1385395324.0,Whats the hardest riddle brain teaser or logic puzzle you know,1950,AskReddit,top_week
JesBOOica,1527,1739,1rdv7m,1292,,1385340805.0,Students who have had affairs with teachers or vice versa how did it start and how long did it go on for,3031,AskReddit,top_week
Professor,3148,649,1rkt1x,1249,What have you been getting away with,1385567975.0,How are you cheating the system,1898,AskReddit,top_week
phattykins,5103,1274,1rkgfy,1230,Thanks everyone for your suggestions theyre greatEdit Check out uTacendas Aladeen new rewrite of the Gettysburg Address somewhere in the comments below,1385555520.0,If you could erase one word from existence which word would you get rid of,2504,AskReddit,top_week
vpatel,1584,681,1rc503,1227,Edit Woah guys I just made this account like  hours ago This is my second post Idk what to say P Haha thanks for all the replies Keep em coming,1385275322.0,What is your best experience with a stranger who you never saw again in your life,1908,AskReddit,top_week
JumbleSale,1985,2678,1rcir7,1211,,1385300016.0,Parents of porn actorsactresses how did you find out amp how do you feel about your child being in the business,3889,AskReddit,top_week
cupcakeandzombie,1966,778,1rhoaz,1133,Wow  I laughed and was entertained so much while reading all these replies Thanks,1385467839.0,What childrens book would you like to see made in to a M or R rated movie,1911,AskReddit,top_week
CaptainBenbo,2618,599,1rnxy7,1133,,1385668804.0,What upgrade do you wish the human body had,1732,AskReddit,top_week
ShaquilleNeal,4113,723,1rm4x5,1127,Wow guys this did really well thank you for making this my most successful post,1385601409.0,Whats one restaurant you swear to never go back to and why,1850,AskReddit,top_week
newbievc,3696,790,1rkjyg,1101,Whats the creepiest song you have ever heard,1385559850.0,Whats the creepiest song you have heard,1891,AskReddit,top_week
Smearmytables,3014,818,1rkiw4,1094,,1385558643.0,Reddit whats the worst part about doing the thing you love,1912,AskReddit,top_week
AnAverageAsianGirl,3236,709,1rn141,1087,,1385635067.0,Whats your favourite quote from a video game,1796,AskReddit,top_week
YetiMagic,3652,618,1rciib,1084,,1385299623.0,Whats smallest claim to fame you have,1702,AskReddit,top_week
sgtjayp,7144,10091,1rac06,981,Do you think about the act Making dinner Solving world peace What are you thinking about,1385217028.0,Females of Reddit What thoughts commonly go through your head while giving a blowjob,11072,AskReddit,top_week
icepower,824,594,1rcxpj,965,,1385315860.0,Teachers of Reddit do you actually have a favorite student or favorite students If so why are they your favorite,1559,AskReddit,top_week
Hexodus,2557,501,1rg7b4,932,,1385418340.0,What are some of your simple joys in life,1433,AskReddit,top_week
amroki,1469,396,1rbjas,900,I hear stories all the time of people having to put up with the crazy shit their roommate does Whats yoursedit As a high school senior Id like to thank all of you for thoroughly scaring the shit out of me about rooming in college Cheers,1385254213.0,What was your experience with your roommate from hell,1296,AskReddit,top_week
BearCanoe,1869,648,1rpk1k,1006,,1385733858.0,If you had to be reincarnated into any animal of your choice which would you choose what would you do and why,1654,AskReddit,top_week
Tradias,2167,509,1rdqwl,886,,1385337449.0,What songs have been forever ruined for you because of a commercial movie or show,1395,AskReddit,top_week
BarryMcKockinner,4155,433,1revr5,869,What undesirable traitgene did you inherit from your ancestorsEdit Wow you guys have taken me through a rollercoaster of emotions with this thread I wish you all the best of luck and health for years to come,1385381436.0,How did you lose in the genetic lottery,1302,AskReddit,top_week
zisslefish,1363,462,1rnazp,869,,1385649480.0,What is the greatest thing your parents have done for you,1331,AskReddit,top_week
starstufft,1432,385,1rkhq5,804,,1385557216.0,What is the most intelligent thing your pet has done,1189,AskReddit,top_week
blueribbonspy,955,502,1rhvun,804,,1385476628.0,Whats your favorite creepypasta,1306,AskReddit,top_week
IAmATable,4185,1123,1rport,1193,,1385739158.0,Have you ever called  If yes why,2316,AskReddit,top_week
hiohibioh,2156,457,1rn7is,788,,1385645188.0,If you could destroy your relationship in five words or less What would you say,1245,AskReddit,top_week
botibalint,2080,393,1rnzzb,795,Or alternatively what was the meanest thing a bully did to you if you were the bullymagnet of your school,1385670464.0,In school what was the meanest thing youve seen a bully do to someone,1188,AskReddit,top_week
PMMeYourBoobs,3351,430,1rdp1p,774,,1385335954.0,Whats the quickest way to piss you off,1204,AskReddit,top_week
SleepytimeSausage,1749,286,1rcvbk,755,Movie doesnt have to be new or popular,1385313937.0,What movie would you say is really genuinly terrifying even by todays standards,1041,AskReddit,top_week
rkarwecki,896,623,1r9yc7,722,,1385192743.0,Former or current prostitutes of Reddit What are the major Dos and Donts of your service For you and your clients NSFW,1345,AskReddit,top_week
NoMoreChowMein,1186,414,1rcjiz,724,Yes I am aware that it might be history holograms rather than books,1385301299.0,Serious In  in history books what will be said about the s and s,1138,AskReddit,top_week
mewha,2585,481,1rpmhs,987,,1385736749.0,What video game tells the best story,1468,AskReddit,top_week
wookiespit,1953,398,1rhd9t,705,,1385450657.0,Guys of Reddit what compliments do you love receiving from girls,1103,AskReddit,top_week
psykikduk,2130,416,1rol2m,709,,1385690577.0,Serious What are some things you do that you believe is common courtesy but do not see others doing enough,1125,AskReddit,top_week
megnolia,2760,310,1ra92h,688,,1385212879.0,Whats a big decision youre struggling to make right now Serious,998,AskReddit,top_week
jaggedllama,1743,316,1reuvs,670,EDIT Well this was unexpected I didnt expect so many replies Spent the last  hours reading them all some are hilarious and some are just sad  ,1385379962.0,Couples of Reddit what is something you have had to give up in order to keep your SO happy,986,AskReddit,top_week
Agent,1081,298,1rb47n,675,,1385241688.0,What bad idea turned out really well,973,AskReddit,top_week
DrownedInSpaghetti,2287,283,1rm8mh,658,First front page post Thanks guys Im going to try to read all of the replies Happy thanksgiving,1385604427.0,What is something you cant believe people complain about,941,AskReddit,top_week
mearyyy,665,291,1ra8jc,661,,1385211997.0,What is your favourite thing to do in town when you have no money and are waiting around for an hour,952,AskReddit,top_week
Kafqa,1911,282,1rhpqy,655,Animals places things everything you can imagine,1385469873.0,Reddit whats the scariest thing created by nature,937,AskReddit,top_week
DreyaNova,2451,356,1rj5t5,628, Who is the weirdest person that makes you feel all tingly inside  Why are they a strange person to have a crush on ,1385508418.0,Reddit who is your weirdest crush fictional character or real person,984,AskReddit,top_week
MisterIncher,990,204,1rkyw4,627,,1385572099.0,What is the eeriest coincidence in History,831,AskReddit,top_week
Sy,2461,278,1rjq90,602,Didnt like his tie Was her resume font to big Maybe you didnt like the way they spelled their name,1385523834.0,Hiring Managers of Reddit Whats the Most Inconsequential Reason You have Ever Disregarded an Applicant,880,AskReddit,top_week
countryskyglow,1959,378,1rkthw,585,,1385568296.0,Whats the first thing you do when you wake up,963,AskReddit,top_week
Iandian,1748,395,1r9re3,578,,1385184173.0,What was the most offensive thing youve said on accident,973,AskReddit,top_week
ToddlerTerrorist,993,678,1rgl2r,551,EDIT Thanks for all the comments guys Out of all the comments Ive read most say its a delight to have them although they may be a pain at some times,1385427658.0,Parents with autistic children do you ever regret having a child,1229,AskReddit,top_week
HKSeaN,2785,216,1rflv6,532,Anything minormajor ,1385404371.0,What is something that scares you about your body but yet you dont seek medical help,748,AskReddit,top_week
priceguncowboy,1526,325,1rktff,522,,1385568238.0,If you won the lottery and never HAD to work again but were required to continue to work full time what jobprofession would you choose,847,AskReddit,top_week
wpgra,496,148,1rkd8p,457,,1385550485.0,Who has a family recipe that is the bomb and they are willing to share,605,AskReddit,top_week
HULLcity,2114,221,1rgmvy,460,Answer has to be about a book that hasnt already been made into a movie obviously,1385428959.0,If you could make a movie out of one book which book would it be,681,AskReddit,top_week
lotuscodex,1319,216,1rf01f,448,From films specifically But games as well ,1385387455.0,What CGI has aged the worst over time,664,AskReddit,top_week
Soyala,2608,296,1rhup2,438,,1385475498.0,Girls what is one compliment you hate to recieve,734,AskReddit,top_week
RecoveringRedditor,1218,186,1rj36y,433,Wether it be an argument or a simple conversation what has someone said to you that changed how you act your outlook on life your habits your selfesteem etc,1385506608.0,Serious What is the singlemost life changing sentence a person has ever said to you,619,AskReddit,top_week
Trenches,1280,204,1rkd07,426,,1385550062.0,Whats the most hypocritical act youve ever witnessed or heard someone say,630,AskReddit,top_week
tigerprowess,1193,210,1rad0d,422,,1385218271.0,What comedy movie do you turn to when you are in a bad mood but will make you in a good mood Why,632,AskReddit,top_week
DBV,622,162,1rlp54,396,Possible NSFW,1385589492.0,What is a memory youre pretty sure happened but is so strange awkward or embarrassing that you wont ask anyone to confirm it,558,AskReddit,top_week
stapviggo,1313,174,1rnwig,383,,1385667600.0,What TV episode scaredunsettled you the most,557,AskReddit,top_week
Idontbonegoats,1561,196,1rdf3w,373,,1385328888.0,What person is generally celebrated as a hero or saint even though they were actually a terrible person,569,AskReddit,top_week
Sibmo,1391,154,1rofg5,357,,1385684879.0,What do you hope will no longer exist in ,511,AskReddit,top_week
IAmTheDinkleberg,1528,382,1rbkt7,357,And please tell us what your highest rated comment is ,1385255572.0,If your highest rated comment was on your tombstone what would people think of you,739,AskReddit,top_week
rpeeezy,2323,180,1rhzbm,348,,1385479683.0,What band did you see live that you did not previously know about that made you into an instant fan,528,AskReddit,top_week
sltfaf,576,160,1rgth0,350,,1385433708.0,What are some things you wish you had done in your somethings,510,AskReddit,top_week
Thromok,735,286,1ric6q,347,Edit Thanks for all the responses guys and gals I never thought I would get this much traffic but I always really hoped Also front page of askreddit Woo,1385488855.0,What is your bestworst I got caught while having sex story,633,AskReddit,top_week
SilentWalrus,1384,149,1rkmx4,340,,1385562871.0,What did you want to be as a child and what is your current job,489,AskReddit,top_week
SweatyTripod,1343,255,1rcj5f,336,Edit A nice mixture of replies so far  some I agree with some Im not sure about and some where I have no idea what film it is ,1385300647.0,What movie do you think has the best music,591,AskReddit,top_week
shortandcynical,733,120,1rm08a,334,,1385597623.0,If we lived in a world where magic existed what would be the most overused spell,454,AskReddit,top_week
starstufft,1055,134,1rag3d,329,,1385221623.0,What are some unconventional ways you have made money,463,AskReddit,top_week
guessinggame,582,144,1racu9,317,Wow guys I didnt expect this to get so many comments,1385218074.0,What is the most awkward carbusplane ride of your life,461,AskReddit,top_week
freemoo,927,193,1rpqi4,423,,1385740822.0,Whats the  thing you miss about being a kid,616,AskReddit,top_week
sirtootington,1021,191,1rnh0a,312,,1385655256.0,Whats your favourite thing to say when you hurt yourself,503,AskReddit,top_week
hesretahded,819,309,1rak3a,311,,1385225398.0,Men of Reddit  How do you feel about going down on your girl,620,AskReddit,top_week
nugget,1159,186,1rfn7g,310,,1385405264.0,What is your best Holy shit my ex is crazy realization,496,AskReddit,top_week
angryblackman,702,143,1rntfj,301,,1385665106.0,What is the best oxymoron you can think of,444,AskReddit,top_week
awesomejunior,890,119,1ribi8,297,,1385488357.0,What is the angriest youve ever been at an inanimate object,416,AskReddit,top_week
avesk,1038,148,1rew7x,296,,1385382226.0,What simple mistakes do you continue to make over and over again,444,AskReddit,top_week
quirkythrowawayname,2149,149,1rbs5b,292,,1385262015.0,What weird pronunciation of a common word drives you insane,441,AskReddit,top_week
speakerjam,441,197,1rkpbc,289,Youre trapped in a big name brand hardware store and must prepare defenses to keep you alive for a full day against  zombies Youre limited by materials available and what you alone could build in a day Go,1385564974.0,Youre trapped in a hardware store and have  hours to prepare against a zombie invasion  what do you build,486,AskReddit,top_week
jedibuster,749,215,1reosq,289,,1385369994.0,Who is the most underrated person of all time and why,504,AskReddit,top_week
KnomeRev,347,91,1rd6k7,287,,1385322654.0,Reddit what are your cheap and easy Christmas presents bought or DIY,378,AskReddit,top_week
Kilojojo,277,171,1rowy0,296,I wanted to know because one of my loved family members is in an induced coma did you remember anything Did you have dreams Is it like falling asleep and waking up,1385701836.0,Redditors who have been in a coma before what was it like,467,AskReddit,top_week
gangreneindick,906,257,1rp9v9,283,,1385717453.0,To those who got out from a specific religious group Whats the first sin that you indulged yourself into to celebrate and how did it feel doing it,540,AskReddit,top_week
DaybreakComet,512,213,1rfxky,260,Also please share any other cool stories regarding your experiences for example Id love to know which type of tattoo you think is the most unoriginaloverused bet its something to do with feathers or on the flip side which was the coolestmost original or meaningful,1385412069.0,Tattoo Artists of Reddit Weirdest reason to get a tattooweirdest tattoo youve given,473,AskReddit,top_week
didoaja,1344,190,1rf2ya,261,You know that moment when youre swearing for awesomeamazing moment in gaming while your mouth is gaping D,1385390447.0,What is your best holyshit moment in video gaming,451,AskReddit,top_week
kcman,724,85,1rmuun,253,,1385625702.0,What book have you been blown away by after reading,338,AskReddit,top_week
Boston,872,136,1rcfe5,246,,1385293832.0,What would you request as your last ever drink,382,AskReddit,top_week
