author,comments,downvotes,id,score,selftext,time_created,title,upvotes,subreddit,type
ajbrundell,338,47,1rignj,42,,1385491907.0,What is something that you did before it became popular,89,AskReddit,top_week
ChiefDraggingCanoe,141,20,1rfkj1,45,,1385403464.0,What is the scariest thing that has happened to you while you were in a foreign country,65,AskReddit,top_week
MyRedditMe,301,63,1rc798,42,,1385278312.0,Men of reddit who is your man crush,105,AskReddit,top_week
wookiespit,235,33,1rox1y,40,,1385701947.0,What phraseword do you say too much,73,AskReddit,top_week
MrSundance,107,37,1rizkl,46,,1385504236.0,Why are bisexuals given a hard time by the lgbt community,83,AskReddit,top_week
stopwonder,293,42,1resjl,43,,1385376040.0,What song is stuck in your head right now and how did it get there,85,AskReddit,top_week
avestar,121,15,1rdwa8,44,,1385341674.0,What is the worst realization about life that you came to as you grew up,59,AskReddit,top_week
latenightnerd,193,17,1rkcri,41,,1385549638.0,What is a big event positive or negative that happened to you this year,58,AskReddit,top_week
ssongbirdd,28,49,1ripvl,43,,1385497968.0,When did it become common andor expected for women to shave their body hair to be considered beautiful,92,AskReddit,top_week
frightenedinmtwo,450,49,1rcglc,43,,1385296260.0,Whats a word you pronounced wrong for far too long,92,AskReddit,top_week
godsdead,440,71,1rf254,37,Piggybacking off the previously posted What video game to you is a must playhttpwwwredditcomrAskRedditcommentsrdciwhatvideogametoyouisamustplayBut specifically multiplayer games,1385389682.0,What multiplayer video game to you is a must play,108,AskReddit,top_week
iwa,161,28,1rf197,40,,1385388782.0,If humans are the most dominant species on the planet what is the second most dominant,68,AskReddit,top_week
SmashedBug,352,77,1rct7x,44,,1385312171.0,If the last time you had sex could be described by a movie title what would it be NSFW,121,AskReddit,top_week
Rambots,134,26,1rcg3i,40,,1385295234.0,If you met someone who had just arrived  years from the past what would be the first few things you would show them,66,AskReddit,top_week
killhimalready,224,29,1rc368,39,,1385273150.0,What is a forgotten or lesserknown TV show that deserves some attention,68,AskReddit,top_week
toastyawesomeness,132,19,1rm9yr,39,Id love to hear some mysteries of the world,1385605601.0,What events do we currently have no way to explain,58,AskReddit,top_week
theonlyVi,211,42,1rkg82,39,This video got me thinking httpswwwyoutubecomwatchvbBBwEQaYampfeatureyoutubegdataplayer,1385555204.0,If you could combine two movies into one which would you choose and why,81,AskReddit,top_week
riginalPoser,211,35,1rgwsl,38,,1385436129.0,When you were a child what scene from a G or PG movie did you always dread,73,AskReddit,top_week
MrInconsistent,145,26,1rntna,39,,1385665279.0,Gamers of Reddit what are your top  games,65,AskReddit,top_week
Aethrum,130,20,1rmcv9,41,,1385608143.0,What do you feel is Humanitys greatest achievement,61,AskReddit,top_week
professorF,186,20,1rl3wn,41,I really enjoy hearing great lyrics to a song what are some that come to mind,1385575461.0,What is your favorite song lyric,61,AskReddit,top_week
KongEdvard,185,32,1rkzcd,43,To get this one out of the way,1385572401.0,Mathematicians of reddit whats the most fascinating number and why,75,AskReddit,top_week
gangreneindick,141,29,1ri14b,40,,1385481020.0,What very minor change can turn a movie into a whole new genre,69,AskReddit,top_week
Redheadedshroom,91,50,1rbh4z,40,,1385252320.0,Teachers what is really going on in the teachers lounge,90,AskReddit,top_week
pascale,195,29,1rohtd,39,,1385687318.0,What is something you wish was more socially acceptable,68,AskReddit,top_week
loveiscoolandall,255,36,1rn26y,36,,1385636905.0,Reddit is there anything that you would like to get off your chest,72,AskReddit,top_week
AlienVII,72,12,1rj08e,39,,1385504673.0,What was the most embarrassingbad thing that happened when you introduced your boyfriendgirlfriend to your parents,51,AskReddit,top_week
maywatcher,151,15,1ri9rk,35,,1385487159.0,What is one of the biggest scams that you know of yet somehow always seem to fall for,50,AskReddit,top_week
BilingualBloodFest,115,25,1rdti9,41,,1385339451.0,What is the single most underrated experience in life,66,AskReddit,top_week
tscott,246,30,1r9xl3,40,When I say absolute I mean absolute ,1385191677.0,If you won  mil what would be the absolute first thing you buy,70,AskReddit,top_week
modestmeese,105,16,1r9vfx,42,,1385188802.0,Are you scared of dyingwhat is your philosophy on death,58,AskReddit,top_week
thepkmncenter,140,27,1r9i74,40,,1385175453.0,What nonmonetary goal do you want to achieve before you die,67,AskReddit,top_week
YoureNotAGenius,557,95,1rgx4u,33,,1385436397.0,Reddit is having a party based on your username what kind of guest are you,128,AskReddit,top_week
XxCoreySxX,200,34,1rgacj,40,Just those little things that give you dat feeling I repeat nonsexual,1385420346.0,Whats something nonsexual that feels really good or is really satisfying,74,AskReddit,top_week
GlowInTheDarkNinjas,222,50,1rftsf,38,,1385409612.0,Everyone is now required to wear a warning label What does yours say,88,AskReddit,top_week
Waffle,171,24,1rppbs,39,,1385739677.0,What is something you are really interested in but you dont talk about because most people find it boring or uninteresting,63,AskReddit,top_week
MrsJohnnyButt,149,17,1rkke0,37,,1385560328.0,What is one disgustingembarrassing thing that you do that no one else knows about,54,AskReddit,top_week
mmacpuguy,221,16,1rcps2,36,,1385308868.0,What movie ending makes you angry,52,AskReddit,top_week
atheistphilosophy,141,19,1rc0ed,37,Nothing harmful but like values or rules that they must follow stuff like that,1385270041.0,What is the worst nonabusive thing can parents do to a child,56,AskReddit,top_week
mrbangost,138,83,1ral1r,35,,1385226234.0,Males of Reddit What thoughts commonly go through your head while going down on a girl,118,AskReddit,top_week
IamBrokeAMA,71,27,1r9u5h,40,Im  years old unemployed still living at home and I have a BA in History with no plans to attend teachers college Ive made some poor choices in my lifeWhat I do know is that that by the time Im  I want to have some degree of financial abundance even if that means putting off having a family until laterYou see I was in an  year relationship that ended a few years back and it really messed me up Since then Ive had little motivation to turn my life around Ive lived as a hermit and Ive done small jobs for people that have helped me to just get byWhat are some things that I can start doing today so that I can create financial abundance for myself by the time Im  You advice is greatly appreciated ,1385187198.0,Wealthy redditors what are some things that I can start doing today so that I can eventually have financial abundance,67,AskReddit,top_week
HAWAll,177,19,1rpnvz,37,,1385738228.0,Reddit what sequel to a movie do you believe to be better than the original,56,AskReddit,top_week
cashbeam,104,14,1rm3gi,37,,1385600225.0,What is the worst mistake you made on the job that you were not fired for,51,AskReddit,top_week
NeedYourKarma,192,26,1rk87l,33,Its about AM central right now What are you up to The front ten pages are exhausted where do you go for fun after that,1385542511.0,Late night redditors  What are you doing up so late,59,AskReddit,top_week
misterbadnews,93,36,1rj9x9,35,Just curious,1385511270.0,What are some of the telltale signs that a woman is faking an orgasm nsfw,71,AskReddit,top_week
wolfforest,82,23,1rd1k1,38,I am interested to hear your stories of events that had drastic effects on your life,1385318850.0,What is your moment that changed everything,61,AskReddit,top_week
Ravinglol,94,30,1rchbm,34,,1385297579.0,Burglars of Reddit how can I protect myself from people breaking into my house,64,AskReddit,top_week
isoman,62,22,1ra5yz,32,I ask this only because I was in Italy and noticed many Italian men still living at home with their mom and they seem so happy and confident with themselves It seems someone would be extremely insecure in such a situation at least from my perspective  ,1385207265.0,Why is living with your parents seen as unsuccessful at least from an American or perhaps a western perspective,54,AskReddit,top_week
IWEJOHF,155,17,1rpipq,35,,1385731977.0,Reddit whats the worst compliment you have ever received,52,AskReddit,top_week
Theoroses,181,20,1rny5c,34,edit possibly nsfw,1385668968.0,whats the most fucked up thing you wish you didnt know,54,AskReddit,top_week
kreateen,169,16,1rayrd,36,I was recently asked by my family what sort of gifts I am hoping to receive this Christmas and it turns out I have absolutely no idea I am very interested in hearing what sorts of things other people are hoping to receive not just because I am interested but because I am hoping it will expose me to things I had never even considered wanting,1385237298.0,Users of Reddit what do you want for Christmas this year,52,AskReddit,top_week
Ahtomic,87,16,1ratct,32,,1385232962.0,What is something that you or your company sells and is complete bullshit,48,AskReddit,top_week
Iziama,130,32,1raqm2,32,,1385230763.0,What is that one thing that you regret but made you who you are today,64,AskReddit,top_week
SuchDyrone,93,14,1rm5a7,31,,1385601678.0,What city has the best or worst  Capital of the World,45,AskReddit,top_week
beyondbelief,126,18,1rjo1t,33,,1385522096.0,What is the creepiest thing a stranger has said to you,51,AskReddit,top_week
SENDMECOOKIES,128,17,1resbj,36,,1385375695.0,If you could put one thing into a time capsule to be opened in  years what would you put,53,AskReddit,top_week
TokyoElectric,41,16,1ra1c3,33,,1385198097.0,Dear Reddit What is your best or worst drunk text,49,AskReddit,top_week
ExStoner,200,50,1r9jyj,33,,1385177043.0,Men of Reddit what one fashion accessory worn on carried by or pierced into a woman makes you think no way,83,AskReddit,top_week
picking,70,26,1rl01b,29,,1385572872.0,Married redditors with a prenuptial agreement what provisionsassets are you protecting How did your SO handle the proposition,55,AskReddit,top_week
sks,202,28,1rh46u,35,,1385441928.0,Guys what is something you should always keep in your car,63,AskReddit,top_week
ShiversAhoy,225,33,1rpn4e,31,It can be anything bookvideo game movie ect,1385737432.0,Who is the best villian of all time,64,AskReddit,top_week
askthatguyoverthere,179,23,1rocnb,34,,1385682113.0,Who is the most hated person alive,57,AskReddit,top_week
EarwaxPanties,115,15,1rnmfv,30,,1385659611.0,Whats a job youd refuse to do no matter how high it paid,45,AskReddit,top_week
HopelessPotato,59,31,1rek7l,32,,1385363401.0,What was your OH NO THEY DIDNT moment,63,AskReddit,top_week
Randomslayer,41,46,1reav6,31,Im generally assuming college and university teachers will answer this but I could be wrongEdit My inbox just shit a brick thanks reddit,1385352980.0,TeachersProfessors of reddit whats the most NSFW thing youve done at work,77,AskReddit,top_week
Jonny,113,24,1rcid4,33,Ok my one is some time during jr high around year  one of my friends acquired nude pictures of a girl that liked him he was pretty stoked and only showed them to people he knew well In the end he deleted them and they never leaked or it never got out that the girl had taken nudes Now fast forward to year  I am now in a large group of friends that this girl happens to be in and I am also friends with her No one else in this group or almost the entire school knows what she did and it feels so weird to think that I have seen nudes of her ,1385299385.0,Reddit whats your most NSFW secret you know about someone else,57,AskReddit,top_week
notwhelmed,29,15,1rbt40,34, So I was curious for you guys and girls that actually do the masssaging what are some of the things youve seen,1385262910.0,Massage therapists of Reddit what is the most embarrassing thing done by a customer during a massage,49,AskReddit,top_week
martyamccann,211,17,1rbpsg,27,,1385259893.0,What TV show do you think had the best theme song,44,AskReddit,top_week
Chibler,127,28,1rb6qw,29,,1385243682.0,What is a question google cannot answer for you but wish it could,57,AskReddit,top_week
JaDinklageMorgoone,300,44,1ra2a0,33,Such as something thats inpossible to do something thag can never happen  so forth,1385199963.0,What is something that is LITERALLY impossible,77,AskReddit,top_week
Tomlansdown,58,12,1rny1a,29,,1385668875.0,Whats the cheesiest joke you know,41,AskReddit,top_week
RPShep,270,19,1rn9fb,30,,1385647719.0,What is one word or phrase that someone can say that makes you instantly dislike them,49,AskReddit,top_week
CheeryCynic,625,28,1rgaos,31,You can only choose one song,1385420565.0,Will you comment with a band or artist you like and everyone can respond with their favorite song by them,59,AskReddit,top_week
Boppinnigga,146,17,1rbgjg,32,,1385251782.0,What is the most absurd thing your teacher ever said or did during school,49,AskReddit,top_week
nevertoosoon,204,12,1rbfzs,28,My classmate was recently telling me how he almost died because of his macademia nut allergy,1385251317.0,What genetic lottery have you lost,40,AskReddit,top_week
isucatthis,73,14,1rajat,28,,1385224644.0,What is the most awkward situation you encountered at a Thanksgiving dinner,42,AskReddit,top_week
newbieaccnt,44,21,1r9ubp,26,What do you think all the animals in the world of The Walking Dead are doing They arent depicted much in the show and I didnt read the comics When I have seen them in the show they dont appear infected Are they infected too Are dogs forming feral packs What abouts cats wild animals etc,1385187404.0,What do you think all the animals in the world of The Walking Dead are doing,47,AskReddit,top_week
fuckportland,75,28,1rpyj1,36,My SO of  years just left me I need some good love stories,1385747856.0,What is your reallife love story,64,AskReddit,top_week
froeyjoe,20,17,1rpwjq,38,We all have heard of scumbag siblings drunken uncles critical grannies and bitchy in laws It doesnt have to be a negative thing either I just want to hear some stories of events around family gatherings Throwaways are more than welcome to flesh out your family secrets as well  ,1385746119.0,Crazy Family Gathering Stories  Whats yours Throwaways are more than welcome ,55,AskReddit,top_week
RancidRemnants,81,18,1rnwh5,28,,1385667562.0,Whats something you used to enjoy but now hate,46,AskReddit,top_week
ftanuki,50,16,1rmaze,32,,1385606468.0,You have  trillion dollars you must spend it on only one project to better the future of humanity and the project must come to fruition or produce results in twenty years What project would you spend the money on and why,48,AskReddit,top_week
fatfred,118,11,1rm46k,32,,1385600773.0,Are your favorite bands from your teenage years still your favorite bands,43,AskReddit,top_week
tst,50,18,1rl3n8,27,,1385575292.0,What is the most degrading thing youve ever had to do,45,AskReddit,top_week
bellibones,66,11,1riuda,29,,1385500821.0,What are your best tips to people going into their first job interview,40,AskReddit,top_week
misspinkxox,66,21,1rh01j,28,ie pictures documents etc,1385438634.0,People who work on computers What is the weirdest thing youve seen in someones files,49,AskReddit,top_week
kahomusic,106,21,1rgzlt,31,,1385438273.0,Winter lovers of reddit How do you survive the cold And why do you like winter so much,52,AskReddit,top_week
blueocean,109,27,1rgpq6,28,Magazines sex guides even reddit says to play with the balls during a handie What it never seems to say however is how What on earth am I supposed to do with them Roll em Poke em Stick em in a stew,1385431008.0,Men of Reddit Whats a girls supposed to actually do with the balls,55,AskReddit,top_week
mpwilliamson,210,33,1rg9dc,26,,1385419671.0,What is the most underrated video game and why,59,AskReddit,top_week
rapp,159,13,1rfb70,32,,1385397031.0,What is your least favorite part about the holiday season,45,AskReddit,top_week
ARealHuman,99,10,1reudq,29,,1385379100.0,If you had to sum your life up with some song lyrics what would it be,39,AskReddit,top_week
coedced,150,13,1rebjd,29,,1385353498.0,What TV shows are a must watch,42,AskReddit,top_week
LoverOfTheLight,71,20,1ra748,32,,1385209426.0,How different would Earth be if there had been nothing to wipe out the dinosaurs,52,AskReddit,top_week
UnbeatableUsername,85,14,1r8y3q,28,,1385158997.0,What replacement actor in a movie  television series portrayed the character better than the original actor,42,AskReddit,top_week
AtomFTW,38,20,1rpzgf,38,EDIT Thanks for all the great stories Keep them coming,1385748592.0, Operators of Reddit what is the weirdest story you have from your job,58,AskReddit,top_week
SpunkReynolds,34,13,1rndts,28,,1385652367.0,Serious Cancer patientscaregivers of reddit what is the single best piece of advice you can give to someone about to go through chemotherapy,41,AskReddit,top_week
ULandDHC,76,14,1rkl3c,26,,1385561065.0,How do you fight the cold season Whats your secret to not get sick,40,AskReddit,top_week
robbielolo,138,26,1rjf0b,26,,1385515032.0,What in your opinion would be the absolute worst superpower to have,52,AskReddit,top_week
RunningOutOfCopes,109,13,1rirae,26,When in your life has something which statistically shouldnt have happened to you didStats would be appreciated but not necessary Lucky draw Or becoming a medical phenomenon ,1385498884.0,What is the most statistically unlikely thing that has happened to you,39,AskReddit,top_week
maverik,40,19,1rgl24,29,I have a mental illness and have been reading up on some of the meds Im being put on I want to ask another doctors opinion but dont want to seem like Im undermining my current doctor ,1385427647.0,Doctors of reddit how do you feel when a patient gets a second opinion I want to get one but dont want to piss off my current doc,48,AskReddit,top_week
SuckAsAdult,52,18,1rfm5o,28,Hey Reddit as you can tell by the throwaway I suck as an adult To provide context to my most recent blunder recently for the first time ever I overdrafted my bank account and had to pay debts with a credit card I was living above my means eating out a lot and whatnot and yeah Now I am living pretty much paycheck to paycheck I know that there are others worse off than I am as I can fix this I have no one to blame but myself for being irresponsible NowI have a budget but I really wish I hadnt been such of an idiotThis is just the latest in a long line of Holy crap I suck as an adult So I ask you reddit how can I suck less as an adult What is something every adult should know how to do,1385404560.0,How can I suck less as an adult What is something every adult should know how to do,46,AskReddit,top_week
HUNGASFUCK,86,11,1rebvf,27,,1385353769.0,What happened between you and your one that got away,38,AskReddit,top_week
glenng,100,6,1rb7em,30,Im always looking for new music I would love to see what you guys are into,1385244239.0,If you wanted to get someone into your style of music what songs would you have them listen to,36,AskReddit,top_week
Talkashie,48,13,1roh7k,28,,1385686689.0,When you die you are given a chance to view five stats of your choice about your life What stats would you choose to view,41,AskReddit,top_week
drewthepirate,47,14,1rnr3a,25,,1385663252.0,Reddit assume you have no job income but suddenly find yourself with one million dollars What do you do with that money to ensure that you can live comfortably for the rest of your life without ever having a job,39,AskReddit,top_week
Mrcoreylahey,121,18,1rnggc,28,,1385654766.0,What is the most valuable thing you have ever stolen,46,AskReddit,top_week
ThermoPacMan,152,12,1rj3f5,27,,1385506774.0,What expression do you say all the time,39,AskReddit,top_week
DiepSleep,190,21,1rimln,23,And how did it fall under your possession andor most valuable thing sentimental unique or monetary ,1385495796.0,What is the rarest thing you own,44,AskReddit,top_week
bobcanada,208,31,1rid72,25,,1385489553.0,Guys what are some girly things you do on a regular basis,56,AskReddit,top_week
TyrannosaurusHives,220,24,1ri1ql,27,,1385481485.0,Which videogame had the best soundtrack,51,AskReddit,top_week
Shamwow,22,10,1rfp5z,26,,1385406566.0,Those who have had cosmetic surgery What did you have done and are you satisfied with the results Serious,36,AskReddit,top_week
bigblackwiener,141,14,1rc1p6,28,,1385271477.0,If you could own any animal regardless of its ability to maul you to death what would you own,42,AskReddit,top_week
FilharmonicPorkestra,4,19,1rbyji,28,,1385268154.0,Truckers of Reddit you see a world most of us dont what memorable things have you seen on your travels,47,AskReddit,top_week
jadedjester,136,23,1rbbql,26,,1385247725.0,Which small acts of rebellion do you incorporate into your daily life,49,AskReddit,top_week
Eschaffer,112,19,1r9gjx,26,,1385173936.0,In response to the Movie thread what book made you cry,45,AskReddit,top_week
GrandTheftCompliment,74,9,1rpeiw,30,,1385725105.0,Whats a TLDR version of a major historical event,39,AskReddit,top_week
lax,134,20,1ro7ew,25,,1385677111.0,What is the strangest thing you believed as a child,45,AskReddit,top_week
houseofmatt,89,20,1rma3s,26,Ive dropped phones in toilets left one on top of a car dropped on off the second floor of a building a couple hot tub calamities but nothing too weird I saw there was a phone that stopped a bullet Any really strange stories out thereSome pretty funny stuff so far I was reminded of one bizarre phone break I had preDroid It had a sliding keyboard and the screen tilted up I remember buying it because it would run Microsoft Business Contact Manager which was vital to my work at the time The phone got hot in my hand and actually popped while the screen turned a bright white it then died and could not be restarted All this happened as I was explaining to an ATampT store manager how my phone was acting quite strangely while holding it up in my palm to show him the phone I was given a new phone right then in store ,1385605734.0,What is the weirdest way your phone has ever been broken,46,AskReddit,top_week
Vagaygaynator,110,11,1rijzc,27,Edit For those who have already reached your goals what did it take to achieve it,1385494075.0,What is your ultimate goal in life,38,AskReddit,top_week
nolmurph,95,16,1rgj2d,24,,1385426251.0,What is the darkest joke you know,40,AskReddit,top_week
keeganlol,42,26,1rftis,29,,1385409444.0,Redditors who have survived a plane crash Can you describe your experience,55,AskReddit,top_week
GrimGuy,188,13,1repfo,25,Reddit is full of unpopular opinions regarding politics religions and social issues But what about the realm of the geeky and nerdy It seems there are certain things that are considered universally shunned or sacred surely this isnt the casePlease keep answers contained to the world of comics gaming anime etc It would be great if this didnt deteriorate into a big genderraceorientation war  ,1385371024.0,What is your most unpopular opinion regarding GeekyNerdy things,38,AskReddit,top_week
boxofkangaroos,155,13,1re31g,29,,1385346842.0,Who is the most famous person youve ever met,42,AskReddit,top_week
depletedmotivation,21,8,1re2aj,25,Hey allIm somebody whos got a great job in a field I love technology whos in decent shape has a recovering sexlife and is in OK financial shape However Im still largely dissatisfied with my life Ive always been lazy but until now at the ripe old age of  it hasnt become a sufficiently big problem At this stage of life where Im expected to start taking charge of life I find that Im unable to muster the motivation to do the things I want  I want to get fitter but I dont have the motivationenergy to go to the gym run etc I want to make new friends but going out and meeting people seems like too much work Im an introvert I want to learn the guitar but practising everyday seems like a chore Work is starting to get more and more boring and Im making few efforts to get better at my craftYou get the idea I hate hate HATE the way I feel Ive tried many things to regain my motivation meditation breaking tasks into the smallest unit trying to form simple positive habits but nothing seems to stick I feel like a potential failure not yet but if I stay like this my life might deteriorate in the future I often feel depressed depression has been a constant companion most of my life I feel helpless lost and disappointed in myselfHas anybody been where I am How did you get out of this rut Why do I feel so out of energy all the time ,1385346233.0,How did you regain motivation in life,33,AskReddit,top_week
pettifogging,145,23,1rbc60,25,,1385248071.0,What is a skill that came naturally to you but many others have to work hard to acquire it,48,AskReddit,top_week
Cronny,43,11,1rp1js,28,,1385706408.0,Whats the coolest thing about deep space that we cant explain,39,AskReddit,top_week
jdpatric,44,7,1rorr4,26,,1385696993.0,Reddit whats your favorite linepassage from a book,33,AskReddit,top_week
JewishPotato,117,13,1roooi,25,,1385694017.0,What was your worst experience with drugs,38,AskReddit,top_week
READlbetweenl,113,8,1rodx6,27,,1385683362.0,What food did you assume would taste disgusting until you tried it,35,AskReddit,top_week
hurdur,20,18,1ro74f,27,From any country or continent anywhere eg universities businesses police officers etcFor example lets say the meter has just expired for a few minutes Will I get ticketed by most officers Is there a way that the parking officer will know that the meter has only recently expiredAlso if you leave a nice note for the parking enforcement officer how likely is it that heshe will show mercy,1385676838.0,Parking Enforcement Employees what are some interesting facts tips or tricks about parking and parking enforcement,45,AskReddit,top_week
