author,comments,downvotes,id,score,selftext,time_created,title,upvotes,subreddit,type
themostnotuniquename,72,3,1rm5p8,19,,1385602002.0,What did you always want for Christmas but never received,22,AskReddit,top_week
OswaldOctopus,56,7,1rm5h9,20,Im starting college next year and the other college thread was a bit depressing to read ,1385601823.0,What was your favorite part of college,27,AskReddit,top_week
kingcarter,108,3,1rid1q,18,You can listen through em and every song is greatEdit Give a personal explanation why,1385489449.0,What albums do you consider to be ,21,AskReddit,top_week
forgotmypwagain,113,15,1ri0gw,19,,1385480553.0,What is a simple thing that you cant stand your personal nails on a chalkboard,34,AskReddit,top_week
WrongChoices,73,12,1rhgdo,19,,1385455041.0,What is one of the best things to wake up to,31,AskReddit,top_week
ReclaimerSpirit,5,4,1rgis3,19,,1385426043.0,Bartenders of Reddit whats the saddest story youve heard a customer tell over a pint,23,AskReddit,top_week
DickeyMolenz,136,31,1rf4tm,17,,1385392144.0,Where is the strangest place you have masturbated NSFW,48,AskReddit,top_week
Willomo,107,3,1rezj6,20,Not necessarily your favourite movie or the move you think is best but what movie can just be rewatched a million times with ease,1385386835.0,What do you think is the most rewatchable movie ever made,23,AskReddit,top_week
GibrT,87,12,1r9t2k,16,,1385185976.0,SERIOUS If you could choose your parents would you have chosen yours,28,AskReddit,top_week
IJustLoveWinning,111,14,1r9og1,19,I wouldnt know what to do all day ,1385181251.0,If the internet were to shut down indefinitely tomorrow what would you do after the shutdown,33,AskReddit,top_week
cmh,52,9,1rq3u9,20,,1385752123.0,After setting your bags down what is the first thing you do after you get into your hotel room,29,AskReddit,top_week
Eli,33,8,1rokqy,17,,1385690258.0,What is a regret that youve had in your life big or small that you seem to never be able to forget,25,AskReddit,top_week
GrandTheftCompliment,43,15,1roj8n,17,For those of you who are dogless pretend you have one ,1385688784.0,So long as it obeys the laws of physics and gravity what do you wish you could train your dog to do,32,AskReddit,top_week
ColBanana,87,11,1rog8u,18,,1385685697.0,You can have one superpower but it must be related to food What would it be,29,AskReddit,top_week
tschust,60,13,1rob94,17,,1385680759.0,Reddit What is your guilty pleasure,30,AskReddit,top_week
Andrewdetmer,57,8,1ro553,17,,1385674943.0,If you could choose one picture to best portray your country what would it be,25,AskReddit,top_week
Ruft,18,13,1ro4kq,18,,1385674460.0,Who is your favorite YouTuber with  subscribers or less,31,AskReddit,top_week
Granttank,44,7,1rnfvk,17,Links would be great also,1385654256.0,Reddit what is your favorite free multiplayer game,24,AskReddit,top_week
asshatbackwards,72,5,1rkt4n,18,,1385568026.0,Hi Reddit What wellused and muchloved quote or passage or parable do you hear often  and absolutely despise,23,AskReddit,top_week
gummywormsyum,24,7,1rks7w,17,,1385567332.0,What decision that you made a decade ago in  actually still affects you today,24,AskReddit,top_week
icycoolx,84,8,1rj3ep,15,,1385506767.0,What is your favorite soundtrack of any game,23,AskReddit,top_week
veryunimaginative,87,10,1rizyv,16,,1385504486.0,What can you tell me about yourself that is most likely to make me hate you,26,AskReddit,top_week
Xickle,130,3,1riucw,18,,1385500814.0,Whats the worst thing that has happened to you in the last  hours,21,AskReddit,top_week
tbshep,52,13,1rh37n,16,Quick Example A pen exploding on you ,1385441148.0,What is something frequently depicted in movies and television as something that happens often yet has never happened to you,29,AskReddit,top_week
Wzup,88,32,1rgumf,17,,1385434553.0,Ladies of Reddit what makes a first date good,49,AskReddit,top_week
aricharliegold,13,14,1rglmk,17,As a year old this could be pretty interesting,1385428059.0,Parents of Reddit what do you know about your kids that they think you dont know,31,AskReddit,top_week
ben,63,14,1rfy60,17,,1385412418.0,What would be the best way for the world to end,31,AskReddit,top_week
summertimeacid,39,8,1rexut,17,By that kid I mean the one who wore these shirtshttpstoresouthwestbowlcomimagesproductsdetailhotjpg and would tell the most ridiculously unbelievable stories and expect you not to question him,1385384574.0,What was the most ridiculous story that kid told when you were young Or if you were that kid why,25,AskReddit,top_week
WhoKnowsWho,47,6,1reoix,18,,1385369559.0,What subreddit have you visited once and strongly suggest no one visit,24,AskReddit,top_week
hydec,95,8,1remob,15,,1385366641.0,Americans of reddit What parts of America feel like a whole different country,23,AskReddit,top_week
MailTo,25,7,1reaiy,16,,1385352700.0,How long do you think humans have left on this planet and why,23,AskReddit,top_week
Flyingmailbox,47,15,1rdu2e,17,,1385339898.0,Whats the most offensive rhyme you can come up with,32,AskReddit,top_week
shanekg,72,18,1rdb7n,18,,1385326082.0,Whats something you can say to your pet but not your SO,36,AskReddit,top_week
thestickystickman,26,7,1rcudg,17,Im totally not procrastinating by asking this,1385313131.0,Serious What is the best way to stop procrastinating,24,AskReddit,top_week
StrexCorp,11,8,1rce3s,19,More specifically can you recognize someone by their writing style  I know people with very distinctive writing style and I was wondering how well the teachers know the writingEdit Welp incorrectly did the title  I blame late night posting,1385291149.0,Teachers of Reddit how well do you know your students writing,27,AskReddit,top_week
CaptainJubbJubb,63,7,1rcaq7,18,Think about it No really Think about it,1385284121.0,If you could remove one person from history who would you choose and why,25,AskReddit,top_week
Juststopposting,66,12,1rbzk9,18,,1385269200.0,If you could tldr your favorite book or movie what would you say,30,AskReddit,top_week
undercunt,44,15,1rbqhi,16,,1385260533.0,Reddit what was the best reaction you got from your parents when they walked in on you watching porn,31,AskReddit,top_week
mindthethighgap,77,3,1raf7j,19,No naming names pleaseSeriously Besides brothers sisters family etc unless they were REALLY that bad ,1385220695.0,Reddit who is the worst roommate youve ever had and what made them so awful,22,AskReddit,top_week
Airiq,20,6,1ra0f2,19,,1385196258.0,What is something that you didnt realize was that bad until it got better,25,AskReddit,top_week
emme,36,3,1rq6f8,19,,1385754167.0,Whats the strangest thing someone ever told you when you first met them,22,AskReddit,top_week
fanfer,79,14,1rpufd,17,,1385744216.0,Virgins of Reddit have you ever had a clear opportunity to get laid How did it go bad,31,AskReddit,top_week
carmabound,92,10,1ronay,18,,1385692690.0,Where is a good place to go on vacation by yourself,28,AskReddit,top_week
boldemort,65,10,1robxu,17,Ironically Im writing this as Im unable to get to sleep ,1385681449.0,What keeps you awake at night,27,AskReddit,top_week
getSmoke,583,83,1ro112,15,Suffocation,1385671379.0,Based on your username how will you die,98,AskReddit,top_week
raymndv,41,3,1ro0tc,18,,1385671193.0,What is one of the most unique prizes youve ever won,21,AskReddit,top_week
Pecanpig,70,7,1rniyd,16,I dont just mean political groups but also things like ideological groups professional groups engineers for example and things like workforce lobbies,1385656993.0,Serious What are some groups today that you think will be viewed VERY differently  years from now,23,AskReddit,top_week
SchmigMingMong,12,4,1rm6rr,16,,1385602882.0,Do you have any friends that have become enemies What happened,20,AskReddit,top_week
sadDCsportsfan,109,10,1rm66t,17,,1385602440.0,If you could have a threesome with any two characters from one TV show who would they be,27,AskReddit,top_week
bubblystegosaurus,41,9,1rlgvy,17,,1385583916.0,Reddit what is your all time favorite excuse,26,AskReddit,top_week
thefrayed,60,7,1rl4p9,16,,1385575981.0,Where are your scars and birth marks,23,AskReddit,top_week
dopeboyfreshy,68,9,1rl34e,16,,1385574963.0,What is something unacceptable in society but really isnt that bad,25,AskReddit,top_week
TomaccoAddict,38,6,1rkw5q,17,,1385570259.0,Whats the best way to make extra money,23,AskReddit,top_week
thedubo,86,8,1rktow,16,I am really into standup and am curious to what other people like Links are appreciated,1385568460.0,Who is your favorite standup comedian and why,24,AskReddit,top_week
deathofpatriotism,62,19,1rks5p,15,,1385567287.0,What movie  believed to be fictional  would be most mind blowing if it ended with Closely based on real events,34,AskReddit,top_week
pollofiesta,61,8,1rkl5y,18,I suffer from them myself and Im really interested in hearing how other people deal with them,1385561134.0,PanicAnxiety attack victims of Reddit how do you get through them,26,AskReddit,top_week
xberx,67,5,1rkbby,17,What methodstools do you use to see things different or cheer you up,1385547362.0,People of reddit who suffer from depression what keeps you going serious,22,AskReddit,top_week
snowstriker,87,12,1rjy87,16,,1385530662.0,Whatre some of your favorite locations from video games,28,AskReddit,top_week
remotectrl,63,4,1rjq2o,18,,1385523689.0,What was the last thing to bring a tear to your eye,22,AskReddit,top_week
lancerfan,24,11,1ria3h,17,,1385487394.0,what is the single greatest reddit comment of all time,28,AskReddit,top_week
falconaround,49,3,1rgl57,16,,1385427710.0,What are you reading,19,AskReddit,top_week
RockoBOOM,83,10,1rg9t4,15,,1385419962.0,What are some songs thatll immediately ruin a party,25,AskReddit,top_week
Elmyh,109,13,1rg00r,16,,1385413598.0,What is your favorite line in a song text,29,AskReddit,top_week
FlySociety,66,6,1rfrf6,15,,1385408082.0,With the end of  in sight what is one thing you did that made this your best year or at least better,21,AskReddit,top_week
hannahmeowser,58,7,1reov7,17,Take a look around here if you need some more contexthttptvtropesorgpmwikipmwikiphpMainHomePage ,1385370097.0,In terms of tropes and stereotypes used in movies and TV which do you find to be the most damaging or otherwise annoying,24,AskReddit,top_week
AaronTiberius,43,11,1rdy6e,14,,1385343093.0,Women of reddit what is something you wish men wouldnt do or say during sex,25,AskReddit,top_week
theonewhoknocks,33,2,1rcfrj,16,,1385294569.0,What little insignificant things can completely make your day,18,AskReddit,top_week
Plasmm,97,4,1rbr37,17,At this very moment,1385261076.0,Whats keeping you from doing what you want right now,21,AskReddit,top_week
hackery,27,2,1rbgmj,17,Or you have done for a stranger,1385251869.0,What is the nicest thing a stranger has ever done for you,19,AskReddit,top_week
ProudNativeTexan,55,25,1rbat2,16,Just curious,1385246932.0,If you and  or more people are dining at a restaurant and can get a  discount if you agree to keep your cell phones off and put away would you do it,41,AskReddit,top_week
jakery,91,2,1rawlb,18,,1385235488.0,What is a product or service that only idiots buy,20,AskReddit,top_week
SuperSaiyanEric,59,11,1r9yce,17,,1385192747.0,What are you really good at but hate doing,28,AskReddit,top_week
celestinha,121,20,1r9q2i,17,,1385182795.0,Whats your biggest turnoff in a guy or girl,37,AskReddit,top_week
BurnItWithWater,83,18,1r9pw6,16,,1385182635.0,When was the movie better than the book,34,AskReddit,top_week
Lithiarch,60,13,1royke,14,Figurines Collectibles Shiny rocks Dirty underwearI hoard fancy boxes and chapstick like a deranged beaver,1385703391.0,What do you collect,27,AskReddit,top_week
Dan,69,22,1roy8e,16,Edit Budget is under Hes going away to college in a few months so I want it to be something that he can take with him and still enjoy,1385703082.0,Reddit what is a good gift for an  year old guy,38,AskReddit,top_week
Forttomato,27,7,1rohcg,16,I will try to make as many witty retorts as possible,1385686817.0,Hey reddit whats the best pun you know,23,AskReddit,top_week
sparklingdiamond,22,3,1rogb7,15,A gift idea for my SO is a wallet insert that is engraved but is also a bottle opener I have room for a short quote and Id like it to be powerful Hes leaving for the Air Force soon and Id like it to effect him every time he sees it when he uses his wallet ,1385685763.0,What is your favorite short motivationalsuccess quote,18,AskReddit,top_week
MrSundance,13,6,1ro620,16,,1385675815.0,Why do i feel smarter when i am drunk,22,AskReddit,top_week
BlazingHeart,25,5,1rm7t9,16,,1385603761.0,Redditors who have been to couples counseling did it help at all with your problems Are you still with the person,21,AskReddit,top_week
lprekon,72,4,1rm5i4,17,,1385601852.0,What items should you buy before you need them,21,AskReddit,top_week
MCBillin,33,2,1rm59u,17,,1385601674.0,What strange or irrational thing do you worry about every day but has never actually happened to you,19,AskReddit,top_week
oth,68,4,1rl458,15,,1385575622.0,In your opinion what was the darkest kids movie youve ever seen,19,AskReddit,top_week
ScrewSnow,59,7,1rkw06,16,,1385570134.0,Whats your weird college room mate story,23,AskReddit,top_week
PalmerZombie,30,6,1rknct,16,Always fighting bad spenders ect,1385563288.0,What is the worst relationship you have ever seen,22,AskReddit,top_week
IeatSilver,54,12,1rjr90,16,,1385524648.0,What are some unwritten laws of reddit,28,AskReddit,top_week
ZanderdanderSpenceri,25,3,1rimhc,16,From something as simple as ear lobe piercings to stretched lobes and dreadlocks and everything in between Though theres all sorts of loose rules about denying workers because of these things What are your opinions on the matter,1385495718.0,Employers of reddit how do tattoos piercing and other body modifications affect your view on potential workers,19,AskReddit,top_week
CopeGuy,60,7,1ri614,14,,1385484561.0,What video game did you not want to play at first but ended up loving it,21,AskReddit,top_week
Itsating,51,5,1rdzmf,14,,1385344139.0,Whats the oldest joke you know,19,AskReddit,top_week
,57,4,1rdlqi,16,,1385333523.0,If you can make one thing free for everyone what would it be,20,AskReddit,top_week
Samwellpeeps,69,4,1rd72d,14,,1385323033.0,What realistically is the most dangerous thing that could happen to you in the next hour,18,AskReddit,top_week
deleted,24,9,1rcyfh,15,,1385316444.0,How important does a person have to be before they are considered assassinated instead of just murdered,24,AskReddit,top_week
SuckyBoyfriend,59,10,1rcy6i,13,,1385316250.0,What will be the next stages in human evolution,23,AskReddit,top_week
skievl,58,6,1rcmys,15,Just curious to see what is brought about,1385305805.0,What do you have that no one else in the world has,21,AskReddit,top_week
bito,61,17,1rcke6,17,,1385302462.0,People of Reddit have you ever had a incredibly awkward encounter with a celebrity or famous individual,34,AskReddit,top_week
ragehorse,89,5,1rbxpy,16,I love language If there is a word you favour Id like to hear why Whether its the etymology the evolution of the definition an untranslatable phrase Anything Please Reddit educate and indulge me ,1385267344.0,Reddit what is your absolutely favourite word and why,21,AskReddit,top_week
pudahapsgoto,49,13,1rale2,14,,1385226535.0,How old were you when you went on your first date and what was it like,27,AskReddit,top_week
vaucheretfabs,29,9,1r9t9p,13,My buddy thought of this question when he was waiting for his screensaver to change to the next picture,1385186206.0,Reddit what was the longest minute of your life,22,AskReddit,top_week
abrown,5,8,1r9hs3,14,Also which show was it and how did you do,1385175059.0,For those that have been on a game show what was it like,22,AskReddit,top_week
MrsHeisenberg,92,19,1r9hl0,13,,1385174885.0,Males of Reddit what is your favorite chick flick,32,AskReddit,top_week
starknakedmonster,75,17,1rpfyf,14,,1385727446.0,What is the most sexy word that isnt normally dirty,31,AskReddit,top_week
thepotatoface,61,8,1rp3ui,14,Im an Aussie chick heading to America for a few months next year and plan to spend my time trying out all kinds of restaurants and food trucks and craft beer and whatever other crazy shit America has to offer What are the best places your average tourist wont know about ,1385709033.0,What are the musteat food experiences in America,22,AskReddit,top_week
daysofstatic,33,3,1ronnq,15,,1385693034.0,Reddit what are some simple things the average person can do to make your job easier,18,AskReddit,top_week
zzrzz,26,4,1rol5u,15,,1385690670.0,Whats the biggest cry for attention youve every seen,19,AskReddit,top_week
jadedjester,16,2,1rok1y,15,,1385689583.0,Whats the strangest request youve ever had at work,17,AskReddit,top_week
Mooseyxhmx,3,4,1roi9p,14,Did you get a lighter sentence for signing the release forms Are you ashamed of it or is it a badge of honor,1385687783.0,People of reddit that appeared on COPS what was your experience like,18,AskReddit,top_week
SpiderMann,59,13,1rnprt,16,I am curious to know what to do and what not to do,1385662215.0,What advice would you give to high school redditors,29,AskReddit,top_week
IAmTheHamartia,48,4,1rnod9,14,where was it who was it with and what happened was it awkward or sweet,1385661113.0,What happened during your first kiss,18,AskReddit,top_week
thomasmeadia,29,13,1rmguh,14,Jumping out of a cab a couple of years ago I said have a good day to the driver He replied with Sure its what you make of it isnt itMay seem simple but it had a profound effect on me The circumstances of life can suck a lot but your life doesnt have toYours,1385611698.0,Reddit what advice has changed your life,27,AskReddit,top_week
Njfarmer,60,3,1rmcxr,16,Edit The environment would be a concrete box with nothing it it beside the fighters and lit light bulbs so they could see,1385608207.0,What do you think is the largest predatory animal a human in peak fighting condition could kill,19,AskReddit,top_week
mustangcbra,80,9,1rm6fh,14,What gems of knowledgeencouragement or advice what you give to the yr old you,1385602631.0,If you could go back and talk to yr old you what would you tell yourself,23,AskReddit,top_week
SENDMECOOKIES,43,2,1rm4qa,15,,1385601239.0,Reddit what is a unique thing people in your country do,17,AskReddit,top_week
NotAVirginatReddit,30,7,1rly5t,13,,1385595960.0,What is a good question to ask someone that will make them feel extremely awkward no matter the person,20,AskReddit,top_week
blacktickle,32,0,1rlo0o,14,Im watching a documentary on young people sentenced to ridiculously longterm confinement in the prison system one of them attempted suicide during criminal proceedings was rescued then sentenced to forty years  Is the point of a lifesentence to keep dangerous people from the populace or to inflict a punishment that must be endured  If it to keep them away from society why arent they given the option to just be given a lethal injection if they so wish  It seems like it would lift a huge burden from the taxpayers and if they WANT to die why not let them  This isnt a troll question I am really curious about this,1385588732.0,If someone is sentenced to life in prison why are they not given the option of suicide,14,AskReddit,top_week
hckiller,46,6,1rljsk,16,What do YOU want to do before you die,1385585839.0,What do YOU want to do before you die,22,AskReddit,top_week
MrWalz,54,7,1rkbm3,15,,1385547795.0,What musical artistband are you ashamed of having most in your music library If any why,22,AskReddit,top_week
jadedjester,73,6,1rjo7n,13,,1385522214.0,What would you eat all the time if it was less expensive,19,AskReddit,top_week
sacredgrove,67,10,1ripf8,12,,1385497641.0,Males of Reddit how much does a womans weight really matter to you,22,AskReddit,top_week
BlueLaserCommander,30,3,1rhcfm,15,I have heard a lot about people watching recently Didnt really know it was a real thing,1385449651.0,Do you ever people watch If you do what are your best peoplewatching games,18,AskReddit,top_week
BaseballDude,128,11,1rh847,15,,1385445358.0,What TV show will you refuse to watch Why,26,AskReddit,top_week
ArcherDangerZone,74,8,1rgo14,15,Just curious to see what others think ,1385429776.0,Serious If you could live in ANY fictional world instantly which would it be,23,AskReddit,top_week
Grahambert,42,10,1rg5e3,14,,1385417023.0,What is the most despicable thing someone could legally do,24,AskReddit,top_week
bloofo,78,5,1rg3q7,14,My divorce was finalized today I need some tunes,1385415958.0,Whats your favorite Im angry music,19,AskReddit,top_week
Graw,37,5,1rfz0a,15,I am a terrible morning person who can just lay in bed for hours if I have nothing to do,1385412943.0,What are some ways to make the early morning easier,20,AskReddit,top_week
thatdutchgirl,39,6,1rfqsi,14,Parents always say that having a child is the best thing that ever happened to them Still is that what society dictates us to say or do people actually feel this way As a  year old female I have been wondering whether I ever want to have children or not Of course this is not a decision I would make lightly but maybe you could help shed some light on the matter,1385407674.0,Parents of Reddit knowing then what you know now would you still choose to have children Please be honest,20,AskReddit,top_week
MinhAnh,27,1,1rfj42,14,,1385402494.0,What is the best word you have ever played in Scrabble,15,AskReddit,top_week
JsksWorld,332,33,1rf2f9,13,,1385389966.0,What are some rather controversial beliefs that you have,46,AskReddit,top_week
Rocklobster,101,8,1reyqo,14,,1385385803.0,What really ruins your day,22,AskReddit,top_week
DErpThinker,27,3,1rea4l,12,,1385352380.0,If you were an international fugitive where would you hide to avoid capture,15,AskReddit,top_week
ExcaliburBo,42,9,1rdoch,16,,1385335428.0,Whats the nicest thing a complete stranger has ever done to you,25,AskReddit,top_week
sugnaz,82,7,1rd4rp,13,,1385321282.0,If you could choose your last words what would you say,20,AskReddit,top_week
cakearchitect,32,5,1rbfmt,15,,1385251028.0,Travelers of Reddit what do you do to entertain yourselfpassengers on long drives,20,AskReddit,top_week
Lolliee,65,8,1rba31,14,,1385246357.0,Whats something you do when nervous or worried about something,22,AskReddit,top_week
nextturtle,120,11,1rakjy,16,Im new at this whole parenting thing and my son recently asked for an allowance The problem is I dont really know where to startHe suggested  dollars per week  seems extremely high but I was thinking along the lines of him getting  cents per chore We are a middlehigh class family so money isnt that much of an issue,1385225804.0,Whats a reasonable allowance for a  year old,27,AskReddit,top_week
ironslinkey,27,3,1rag7c,16,,1385221730.0,Whats the best financial advice you can give me,19,AskReddit,top_week
nottrent,33,5,1rae09,12,Im going to move out of my parents on monday and I wanted to know what it was like for you guys If you guys had any advice that I should know let me know,1385219389.0,What was is like living on your own for the first time Any advice,17,AskReddit,top_week
lax,64,15,1r9g0d,12,,1385173430.0,What movie would have a bad sequel,27,AskReddit,top_week
ProSchmo,10,0,1r8xym,14,,1385158899.0,Attorneys or anyone of Reddit what is the most unexpected or funniest thing that is ever happened to you in court,14,AskReddit,top_week
DinnerorBreakfeast,51,5,1rq0mq,17,,1385749539.0,What automatically ruins your day,22,AskReddit,top_week
hahahellnawgirl,60,16,1rp6ja,12,Clearly the holocaust was a horribly shitty event And racism was a huge part of it I want someone to convince me that these events are extremely necessary for modern society to be where it is today in a positive manner with out some general version of the butterfly effect I want specific examples of positive change that came from these events Do not get the wrong ideaI mean no disrespect to any victims of any form of oppression regardless of how said oppression was initiated That being said this is something that has always made me think and curious I AM NOT LOOKING FOR JUSTIFICATION OF THE HOLOCAUST OR OPPRESSION OF ANY PEOPLE,1385712613.0,What good could hitler be indirectly be responsible for Serious RO,28,AskReddit,top_week
tfredr,57,16,1rowu8,12,,1385701746.0,Serious What is the most cruel thing someone has done to you,28,AskReddit,top_week
WallMatt,49,4,1roast,14,What and why,1385680289.0,Have you ever stolen something,18,AskReddit,top_week
eatsabortedfetuses,14,0,1ro0w5,15,These never cease to intrest me so reddit how did you get revenge,1385671259.0,Reddithow did you get revenge,15,AskReddit,top_week
Thatdesignguy,44,7,1rno14,14,Be creative,1385660850.0,if you were offered  million to launch your own business what would it be and how would you like to execute your plan,21,AskReddit,top_week
PinkySmart,19,3,1rn9x7,14,,1385648295.0,If your pet could talk what is the most embarrassing thing it could say about you,17,AskReddit,top_week
unbirthday,59,16,1rmnug,15,,1385617932.0,what nonsexual activity gets you ridiculously horny,31,AskReddit,top_week
sharktopuskracken,78,5,1rmf5w,15,Please state the song to ,1385610165.0,What line of a song is really meaningful to you,20,AskReddit,top_week
RedTech,8,2,1rm5dp,13,How do you know when youve done your best and its time to say no ,1385601750.0,PeoplePleasers of Reddit Where do you draw the line,15,AskReddit,top_week
BlueMewMagic,25,1,1rm3b1,14,,1385600090.0,With company Christmas parties looming what are some great gifts for people you barely know,15,AskReddit,top_week
winterjam,29,5,1rlzfz,13,,1385596970.0,If you could combine the mechanics of  video games which  would you pick,18,AskReddit,top_week
AcidHurrah,27,1,1rlxba,13,Edit And why,1385595318.0,Reddit what activities make you feel happy,14,AskReddit,top_week
IAmNotFinite,2,1,1rlv2h,13,,1385593667.0,People of Reddit who have worked in new and used car sales what are some secrets and things that you dont want us to know about,14,AskReddit,top_week
