author,comments,downvotes,id,score,selftext,time_created,title,upvotes,subreddit,type
Fragrantburp,14,5,1rlrmo,12,,1385591194.0,What is the single best deed someone has done for you in your lifetime,17,AskReddit,top_week
BravoSherpa,49,11,1rkzrc,14,,1385572691.0,Reddit what are you getting away with,25,AskReddit,top_week
NotEvanMA,32,4,1rktc1,14,,1385568179.0,What do companies try and do to have better employees but backfires,18,AskReddit,top_week
phoenixprince,41,2,1rks7v,13,One word brocolli,1385567331.0,What things did you hate as a kid but have come to appreciate as an adult,15,AskReddit,top_week
MaGinty,17,7,1rjwvq,11,,1385529433.0,Strippers of Reddit what are some secrets of the industry that people do not know about,18,AskReddit,top_week
imdoctordoom,44,9,1rjp57,13,I hope I phrased that correctly,1385522971.0,Which subreddits do you hate,22,AskReddit,top_week
Sloosh,107,13,1rjj4x,14,,1385518206.0,Reddit what foods do you absolutely hate,27,AskReddit,top_week
Mk,59,5,1ric0q,14,You know as in you know they exist and know something about them Not personally knowExplaining why you think this would be very niceEdit I mean people that are hated on but in your opinion not so bad So this isnt a pace to put your I hate this guy rants,1385488740.0,Who is the most undeservedly hated famous person you know,19,AskReddit,top_week
IAMAEGGMANAMA,47,5,1ri7uo,14,,1385485834.0,What is the most dark joke you know,19,AskReddit,top_week
Coke,51,6,1rhxhn,15,Im talking super ninja entertainment Low system requirements low bandwidth if its online easy to hide quickly and most of all FUN,1385478117.0,Reddit whats the best computer game to play at work,21,AskReddit,top_week
deamer,89,11,1rhmko,12,I get too bored with cereal looking for something healthy to start the day with,1385465123.0,What do you eat for breakfast,23,AskReddit,top_week
DJROSAPARKS,58,9,1rhe3j,12,,1385451710.0,What are your favorite condescending names,21,AskReddit,top_week
tolurkistolearn,43,11,1rhcw8,11,,1385450195.0,What moment in history would you like to see captured on camerafilm,22,AskReddit,top_week
RockoBOOM,47,5,1rg7t2,13,,1385418662.0,Whats a song that makes you feel badass,18,AskReddit,top_week
ObeseCheeseCake,89,6,1rfnk6,12,,1385405508.0,How poor are you,18,AskReddit,top_week
elforastero,12,8,1rfltn,15,There are always many batches of food in different states of preparations What do they do with that food Do they finish preparing it Do they serve it to the audience to the crew ,1385404345.0,What happens with the food on the food shows,23,AskReddit,top_week
jwoelfy,59,10,1rfgmp,14,,1385400849.0,What is something you didnt appreciate as a child but now cherish,24,AskReddit,top_week
Throwaway,37,3,1rerzs,15,Recently I have realised a lack of fulfilment in my life and have decided to change what I do and how I live my life and i wanted to know has the same happened for any of you Throwaways for no real reason,1385375143.0,Reddit what was your defining I need to change my life moment,18,AskReddit,top_week
imsilly,12,7,1rer60,13,The recent example that comes to mind is white house down and Olympus had fallen but I know there are a lot more that just dont come to mind My guess is rival companies spying on each other to steal stories and come out with the concept first or better but my imagination drags me to believe that old producer friends get together and bet something like  on who will do better EDIT Thanks guys Now I feel a little bit sad that is all our the viewers fault for paying to watch both versions of the story  But now I feel less guilty of streaming online YEY,1385373774.0,People in the movie industry why is it that often  movies will come out with the same topic,20,AskReddit,top_week
segasaver,7,3,1re9gv,13,These should hopefully be interesting,1385351877.0,Whats the biggest screw up you have ever done at work that no one noticed,16,AskReddit,top_week
MyNewEgo,73,19,1re92p,11,The world is full of hypocrites who force double standards onto society on a daily basis Which ones get on your nerves the most,1385351590.0,What double standard infuriates you the most,30,AskReddit,top_week
slothbabe,62,4,1re2je,14,,1385346436.0,Whats your best scar story,18,AskReddit,top_week
Wafflecop,29,4,1rdyik,14,,1385343330.0,What was the darkest time of your life,18,AskReddit,top_week
Zombiepineapple,47,3,1rdacn,14,,1385325450.0,Whats one movie game or show that you wish you could change the ending to,17,AskReddit,top_week
Tomly,24,3,1rcf4i,14,,1385293300.0,What is the strangest thing youve done in your dreams,17,AskReddit,top_week
kilalareno,52,7,1rc7mp,15,,1385278890.0,Straight men of Reddit what do girls do that you find adorable,22,AskReddit,top_week
JeepNomad,127,20,1rbxa6,11,,1385266894.0,Whats your safeword,31,AskReddit,top_week
OBLIVIOUSBLACKMAN,41,2,1rbl0d,14,Or request,1385255742.0,People of retail what was the stupidest question you have had a customer ask,16,AskReddit,top_week
noedelgado,14,13,1rbfuq,13,Also what are some stories about stripping at a strip club if you have any,1385251204.0,Former Strippers how did you get a job as a stripper How did you apply Is there a test or is it by looks,26,AskReddit,top_week
andrewx,22,7,1rbe24,15,Ive had trouble with my left eye for over a decade and the time has come to take it out I know it is the right decision but Im still a bit nervous about the procedure What will life be likeHow will life be different afterwards,1385249661.0,Oneeyed people of Reddit what will it be like when my left eye is removed next month,22,AskReddit,top_week
CrystalNesh,70,4,1rb7ss,15,,1385244553.0,What song is stuck in your head right now,19,AskReddit,top_week
theglassisfull,40,4,1rb5km,13,,1385242730.0,What is the worst gift you have ever recieved,17,AskReddit,top_week
CardboardTubeKnight,25,3,1rb2nr,13,,1385240446.0,Reddit What is a must read book that will leave you speechless at the end,16,AskReddit,top_week
FranklyScarlet,52,3,1raqj4,12,Where can I read an accurate account of what is going on in the world,1385230691.0,What is the most truthful unbiased news source,15,AskReddit,top_week
KFC,13,8,1rabde,15,,1385216218.0,what was your most embarrassing moment,23,AskReddit,top_week
brownpower,108,10,1r9zb8,14,Ex in class you imagine a criminal coming in and you find a clever way to save the class,1385194326.0,For the people who live in their heads what do you think about,24,AskReddit,top_week
Tiante,110,30,1r9kc4,14,,1385177415.0,What movie title best describes your last bowel movement,44,AskReddit,top_week
DatKinkyGreen,52,7,1r9i4j,12,,1385175381.0,Women of Reddit what makes a penis attractive ,19,AskReddit,top_week
iwannafuckyousobad,28,8,1r97pn,12,,1385166279.0,What is an almostforgotten event in history that should really be in our history books,20,AskReddit,top_week
AskamilliusReddiquis,105,9,1rqdhq,20,Worthless defined Why in Gods name did you buy that,1385759723.0,If you were given  but had to spend it on something worthless what would it be,29,AskReddit,top_week
FUTBALAR,57,4,1rqarq,20,,1385757642.0,What is that one intrusive thought that you always think about and cant get rid of,24,AskReddit,top_week
doenr,49,10,1rq7bb,13,Feel free to add stories if you want,1385754856.0,What is something you are glad you got rid of,23,AskReddit,top_week
smbrynien,30,4,1rq1wt,14,,1385750577.0,What are the best video games to play for the story and environment,18,AskReddit,top_week
Zafiada,5,7,1rq0qv,16,,1385749632.0, operators of reddit whats the scariestcreepiest thing youve ever heard on the other end of the line,23,AskReddit,top_week
OnlyDeathAwaits,51,25,1rpjvy,12,,1385733643.0,If the NSA had a TV show what would be its theme song,37,AskReddit,top_week
FudginFiddleSticks,55,3,1rp3jk,13,,1385708642.0,What is something that you always wanted as a child but your parents never got for you,16,AskReddit,top_week
GlitterSquirter,35,5,1rp1is,14,,1385706389.0,Whats the worst birthday youve had thus far,19,AskReddit,top_week
Fatmanicorn,69,12,1roua7,13,,1385699367.0,serious Whats your personal reason for smoking weed,25,AskReddit,top_week
Mynameisfez,66,7,1ros3t,12,,1385697310.0,Serious Reddit what is it youre most afraid of,19,AskReddit,top_week
thatswhatyouthink,18,1,1roqgt,12,,1385695785.0,What is the greatest thing youve learned from your younger siblings,13,AskReddit,top_week
CheeseMonkey,11,2,1romk8,12,,1385691974.0,What is the greatest investment that you have made,14,AskReddit,top_week
ExquisiteLIGHT,79,14,1rogdq,13,,1385685838.0,Whats something porn that is always an instant turnoff for you,27,AskReddit,top_week
remjensen,33,6,1roelf,11,,1385684034.0,What is your favorite Fucked Up Joke,17,AskReddit,top_week
Grayditch,42,5,1rnytu,13,Buy it for life items and little things that most people overlook I have some time to prepare and want to make sure I start lookingbuying now Modest budget for now and first place will be an apartment although I am interested in items for a house as well so I can keep a list for later Thanks in advance,1385669518.0,Getting my own place soon What are some quality items that every home needs,18,AskReddit,top_week
MrSir,17,3,1rnwrw,13,,1385667810.0,What is the craziest wrong number text that you have ever received,16,AskReddit,top_week
PowertronX,82,9,1rnoc9,12,,1385661093.0,What is your favourite roses are red violets are blue poem,21,AskReddit,top_week
onePun,28,10,1rmyg4,11,My dog is about to die any day now its been a long time coming Weve had her for over  years and I can barely remember a time that she wasnt involved in my life Ive had close relatives grandparents die and yet I am still unsure in how to deal my dogs upcoming demise Simultaneously I am feeling glad that her suffering will end but also selfishly want her to stay with me Reddit I realize this might not be your favorite topic but can you help me by showing how you dealt with your longtime pets death,1385630963.0,How did you deal with your longterm pet dying,21,AskReddit,top_week
splenda,33,2,1rmd4x,13,,1385608389.0,Reddit what is the most fucked up thing youve ever laughed at,15,AskReddit,top_week
CruisingOnFalcor,61,8,1rm9e1,14,,1385605086.0,If money was not an issue what job would bring you the most happiness,22,AskReddit,top_week
slipshod,37,8,1rkzbj,13,Lets make it faptastic,1385572390.0,Reddit what is the most amusing thing you have seen in porn,21,AskReddit,top_week
thejaytheory,59,5,1rkvmo,12,,1385569865.0,What are some words and phrases that you overuse,17,AskReddit,top_week
scword,14,2,1rkv4a,13,If you can describe your experience the change in your attitude toward employment really anything you think is appropriate that would be cool,1385569506.0,Very successful people of Reddit when did you go from wanting a job to jobs wanting you and how did you get there,15,AskReddit,top_week
riginalPoser,30,15,1rktu8,13,,1385568569.0,Whats the creepiest thing you have seen or heard in the dark,28,AskReddit,top_week
QuotationStation,59,21,1rkmme,12,,1385562623.0,What is the best answer you can come up with to how many redditors does it take to screw in a lightbulb,33,AskReddit,top_week
excynimphica,74,17,1rkiyq,14,For all you grammar freaks yes I knew it should be WAS made Continue on ,1385558728.0,If a movie were made with your username being the title what would be the story,31,AskReddit,top_week
ztikmaenn,36,5,1rk85i,12,,1385542435.0,What is the most profoundly upsetting feeling,17,AskReddit,top_week
goddessgurl,62,4,1rk4q9,13,,1385537559.0,What can you eat the whole container of without thinking,17,AskReddit,top_week
Scarlettptista,5,2,1rjpef,12,Bonus question Do you still eat out,1385523176.0,Health Inspectors of Reddit Whats the grossestworst restaurant youve ever seen,14,AskReddit,top_week
FourMy,55,3,1rixbb,13,Try to support this with an actual picturedrawingpainting edit Except you ElGrandeDick,1385502713.0,If Reddit allowed us to have avatars that represented your username what would yours look like,16,AskReddit,top_week
smw,63,4,1rimgg,11,,1385495699.0,What do you dislike most about Thanksgiving,15,AskReddit,top_week
Slimyjr,49,4,1rii74,11,,1385492926.0,Reddit what is your favorite Kung Fu Martial Arts movie,15,AskReddit,top_week
Stph,44,5,1rhe8q,13,Some children are absolutely feral Were you one if them,1385451945.0,What is the cruelest thing you did as a child,18,AskReddit,top_week
backroadsuptown,48,9,1rh8ma,12,,1385445828.0,What is the single best piece of life advice you can give someone,21,AskReddit,top_week
quartzduck,92,12,1rh2vd,12,Reddit what is your equivalent to nails on the chalkboard,1385440898.0,Reddit what is your equivalent to nails on the chalkboard,24,AskReddit,top_week
BowPeep,23,2,1rgu7p,12,,1385434250.0,Punctual Redditors any tips to help someone who is habitually late,14,AskReddit,top_week
ALRIHAE,26,10,1rgu5g,14,,1385434207.0,Cops of Reddit If two cars are driving down the highway one in front of the other breaking the speed limit Which one would you pull over,24,AskReddit,top_week
rodinj,78,11,1rg76e,12,,1385418253.0,What is the first video game you completed,23,AskReddit,top_week
Champens,76,19,1rg3vb,14,,1385416042.0,Can money buy happiness,33,AskReddit,top_week
quwertie,35,10,1rfxss,10,,1385412201.0,What is your terrible boss story,20,AskReddit,top_week
mysticalme,45,5,1rfs7k,14,,1385408614.0,What are the best final words in a break up,19,AskReddit,top_week
AlanDeButton,35,13,1rfi5v,10,,1385401865.0,If you could erase one scenarioexperience from your memory in order to relive it for the first time what would it be,23,AskReddit,top_week
HonestVillain,14,4,1rfhmf,13,Heres your chance to brag anonymously Edit You are all awesome  No matter how small it may seem these little acts of kindness make all the difference,1385401513.0,Whats the kindest thing youve done but never told anyone about,17,AskReddit,top_week
mikeypayload,79,6,1rfgvy,11,What desirable trait did you inherit the rest of us heathens did not,1385401002.0,How did you win in the genetic lottery,17,AskReddit,top_week
SheZowRaisedByWolves,15,2,1rfeih,12,,1385399414.0,What is the biggest misunderstanding you have ever seen or got in,14,AskReddit,top_week
hanktheskeleton,20,1,1rfdm6,12,I definitely learned to verify any information before accepting it  I always head into the comments first before reading political and scientific articles,1385398771.0,What have you learned on Reddit that has changed your life positively or negatively,13,AskReddit,top_week
Zing,58,4,1rfcdi,14,Possibly NSFW,1385397900.0,Reddit what gives you goosebumps,18,AskReddit,top_week
ubetts,103,14,1rf714,13,,1385393980.0, somethings and older of reddit What do you see teens do that makes you realize how old your getting,27,AskReddit,top_week
smitewin,34,5,1reqye,14,,1385373441.0,What is something youve seen that you know you shouldnt have,19,AskReddit,top_week
Insanityremedy,23,2,1rebh0,11,,1385353444.0,Grocery store workers of Reddit Whats the oddest mix or singular thing bought youve ever seen,13,AskReddit,top_week
Kenzing,6,1,1re9fg,13,Anything from creepy stories to strangely amusing web articles are greatly appreciated,1385351853.0,What are the most interesting reads youve ever found from the internet,14,AskReddit,top_week
Deathproofer,22,6,1rdd93,12,,1385327579.0,What is the strangest family secret youve uncovered,18,AskReddit,top_week
crapholyalmighty,27,27,1rctpm,14,I took a religious history class in which it was explained to me that indeed many early Christian Churches had very egalitarian ideologies and practices in line with Jesus teachings about aiding the impoverished  But today with so many Christians being hardcore republicans and supporting laws that help the rich and hurt the poor Im curious where the ideological change happened  I didnt post this to generate some antireligious rant I actually want to know about the historical context of this change in the religion,1385312571.0,If Jesus said so many things about helping the poor when and how did modern Christianity take such an antipoor procapitalist conservative slant,41,AskReddit,top_week
iamjacketboy,47,4,1rcn5o,12,,1385306008.0,What would be your desired last meal,16,AskReddit,top_week
woakula,73,2,1rc83d,12,Need for Speed,1385279566.0,Videogamers of reddit what was the very FIRST videogame you ever played,14,AskReddit,top_week
Mikester,79,9,1rby98,12,,1385267858.0,Howd you get that scar of yours,21,AskReddit,top_week
Hovenbeet,87,18,1rbpy8,12,,1385260030.0,You wake up tomorrow morning and every human being except yourself has disappeared What do you do serious,30,AskReddit,top_week
Speedm,14,5,1rbhvy,13,,1385252980.0,To the Police Officers out there Whats the highest BAC youve come across in the field,18,AskReddit,top_week
nigelnofriend,21,10,1rbgzp,13,,1385252194.0,People of Reddit why do you keep answering questions for people who if they just typed their question into google would get an answer much more quickly and save you the inconvenience of typing,23,AskReddit,top_week
AlexisBlack,209,10,1rbg4l,12,Unless Bruce tasted his own blood admittedly shit would go down a whole different way in that caseI dont follow MMA that closely but whenever I catch a fight I see what I think might be either judo or jujitsu with some whatever poundaguyintheheadwhilepinninghimdown is called but no crane drunken monkey eagle claw mantis Shaolin HOOWHWAAAAAAAAHHHHHHHH awesomenessFrom the eastern bloc to the Amazon folks worship literally idolize Bruce Lee  That being said MMA is a multibillion dollar industry  If kung fu lead to wins I figure Id see it in the ring  Am I wrong,1385251422.0,Why do I never see Kung Fu at UFC or other MMA competitions Absolutely no offence intended but does that mean that Bruce Lee was an incredible dancer gymnast and acrobat but that BJ Penn or even a middling MMA welterweight could have ripped Bruce to shreds in the ring,22,AskReddit,top_week
jakeybunz,78,3,1rb7yu,13,I am  and i happen to be looking for a job and I wanted to know what your first job was,1385244689.0,What was your first job and what age did you get it at,16,AskReddit,top_week
submastr,23,3,1rb021,13,Until I was  they paid for rent  tuition for me at in instate school Then until graduation at  they just paid my tuition That last tuition payment was the last support I received Working an engineering job so I dont need their support now but I am incredibly grateful for the gift they provided by letting me graduate debtfree Curious how my experience compares with others,1385238330.0,How old were you when you stopped receiving any financial support from your parents,16,AskReddit,top_week
nightshade,78,19,1rayjr,11,,1385237117.0,Which fictional characters would probably be redditors,30,AskReddit,top_week
PieFaceKai,39,2,1rau50,11,Sorry if this has been asked before,1385233581.0,If you could stop only one event from happening in the past what would it be,13,AskReddit,top_week
didntlogin,18,3,1rakfv,12,,1385225705.0,Reddit whats a website you wish existed,15,AskReddit,top_week
Crown,47,12,1racht,11,This doesnt have to be religious,1385217653.0,Why are you going to hell,23,AskReddit,top_week
PhantomHunter,27,4,1raaoh,14,Thought,1385215271.0,Whats something you though would be terrible when you tried it ended up being amazing,18,AskReddit,top_week
WnTn,35,2,1r9lxp,12,What certain words or phrases of can send of into anger a fandom,1385178809.0,What words or phrase can I use to piss off a certain fandom,14,AskReddit,top_week
Aiede,44,4,1r9gqj,12,My personal vote is for the  ALCS when the Yankees were within three outs of sweeping the series but lost that game and then the next three to the Red Sox Other nominations,1385174100.0,Sports fans of Reddit whats the biggest choke job youve ever watched,16,AskReddit,top_week
Cobis,22,5,1r8ymk,14,,1385159374.0,Bisexual people of Reddit do you find same sex relationships easier or more difficult than heterosexual relationships,19,AskReddit,top_week
mrbusinesspants,62,11,1rqchn,10,,1385758911.0,Redditors who did not go shopping on Black Friday Why made you decide not to take part of shopping on Black Friday,21,AskReddit,top_week
RGBmono,21,2,1rq874,11,,1385755556.0,What is the one thing technology cant make faster,13,AskReddit,top_week
socratesconundrum,35,4,1rq6g3,13,It can be anything from torture to making the world better,1385754186.0,If you could become undisputed ruler of the world what would you do,17,AskReddit,top_week
SnotBakula,59,11,1rq43j,16,,1385752315.0,Whats wrong with you,27,AskReddit,top_week
knhnw,43,7,1rp9b7,11,Thanks for all the advice and the new Information I have learned I will try my best to fix myself out of this misery before I fall into a depression because of it,1385716645.0,People of reddit What advice can you give to a academically struggling student,18,AskReddit,top_week
aex,59,8,1rp8xc,13,EDIT Please elaborate on these stories Im so curious,1385716063.0,What is the most inconvenient place youve ever gotten stungbitten by an insect,21,AskReddit,top_week
dshab,18,7,1rp0a1,11,Ive always been curious and skeptical about hypnotism shows Where that guygirl goes on stage picks several audience members and hypnotizes them so heshe can make them do emberassing things,1385705139.0,Have you ever been hypnotized at a show If so what was it like,18,AskReddit,top_week
duckplus,58,4,1roudn,13,If this has been asked before my apologies Im new,1385699456.0,What is the most difficult question you have ever had to answer,17,AskReddit,top_week
Dragoness,30,3,1roo8w,12,Twist  the first reply to each comment should try to describe how a sneaky troll genie would try to corrupt your wish to be something awful,1385693575.0,A genie appears and grants you one wish but it must be in the form of a historical or movie quote What is your wish,15,AskReddit,top_week
anchormanrulz,6,1,1rojlo,11,,1385689112.0,What is the most memorable excusejustification youve heard someone use for why they purchased an item,12,AskReddit,top_week
lindsinator,23,2,1rnxzq,11,Just wondering what your thoughts are I like to learn about jobs Ive never heard of and acknowledge ones I know about more often ,1385668841.0,Reddit What are some of the most under recognizedacknowledged jobs,13,AskReddit,top_week
ButteryCrutons,8,2,1rnxsf,11,Just curious because my brother and his wife have continuously tried to match her sister and me up and Ive just always been uncomfortable with the idea Its not because Im not Im attracted to her we actually get along great were the same age have similar interests and shes pretty hot,1385668672.0,Reddit has anyone ever dated their brothersisterinlaws brothersister If so how did it go,13,AskReddit,top_week
Frdge,60,3,1rnubh,13,If there isnt anything right now what was the last one that was,1385665826.0,Reddit what song is currently stuck in your head,16,AskReddit,top_week
MasterMarvick,40,2,1rnt7s,11,,1385664921.0,Reddit what is your favorite nonamerican movies,13,AskReddit,top_week
naturalunsweetened,104,9,1rmpj7,11,The amount of gold on this thread thowasnt me,1385619597.0,What is your recent mindblowing realization,20,AskReddit,top_week
ShortyMcNoRide,28,2,1rmg3n,13,,1385611032.0,What household items with expiration dates dont actually go bad until much later,15,AskReddit,top_week
wschamps,44,2,1rmf5g,11,,1385610154.0,Who is one athlete you have always idolized,13,AskReddit,top_week
cheezeblock,34,2,1rm6ue,11,,1385602933.0,what is the biggest relief that youve had in your life,13,AskReddit,top_week
RickNNick,55,4,1rm6eo,11,,1385602616.0,If you could make one law for your country that would immediately be enforced what would it be,15,AskReddit,top_week
CynicH,21,2,1rm12k,10,,1385598297.0,Reddit whats your favorite Thanksgiving dishdessert,12,AskReddit,top_week
forkforkfork,27,0,1rlzqn,11,All of us are unfairly misjudged by others in some way sometimes it can be good or badReddit how are you usually poorly judged,1385597215.0,What positivenegative misconceptions do people commonly have about you,11,AskReddit,top_week
Marchingbanddick,32,3,1rly9o,11,Is there anything that you miss,1385596043.0,What do you miss about high school,14,AskReddit,top_week
steezeirwinjr,16,1,1rlxd6,11,Im broke but I have time to spend,1385595360.0,Reddit what is a way I can change someones life without spending money,12,AskReddit,top_week
waytooshady,19,2,1rllq9,12,,1385587158.0,Has anyone ever broken into your house with you there What happened,14,AskReddit,top_week
GOLDENITALY,38,4,1rlihz,11,,1385584953.0,Whats the funniest  word combination you can think of,15,AskReddit,top_week
exauqa,44,2,1rlfys,11,,1385583294.0,Reddit whats a small thing you keep on your person all day that fits in a pocket,13,AskReddit,top_week
TheUltimateBro,59,5,1rlavd,11,,1385580019.0,Whats your favorite smell,16,AskReddit,top_week
willbill,50,5,1rl77z,10,,1385577626.0,College students what was your SATACT score and where did you go to college,15,AskReddit,top_week
riginalPoser,62,7,1rl408,10,,1385575525.0,What is currently your computer or phone background,17,AskReddit,top_week
althius,53,17,1rkxtw,9,Not Voldemort  The other guy  Red suit somewhat overweight  Nice fellowI was in rd grade I was beginning to have my doubts  I remember very clearly asking for the Knight Rider talking carhttpdailygrindhousecomthewiretoytravelkennersknightvoicecarcommerical  It was a bit out of our price range so I wrote a letter hoping the big guy would come through Anyway my mom had to run some errands and I was waiting in the car  Killing some time I started to go through the glove box when I found my letter  Unstamped and unsent I remember feeling like someone just punched me in the gut  As an adult looking back the closest I can come to describing the feeling was being dumped  I just got dumped by Santa and my mom broke the newsSo how did you find out and what kind of long lasting emotional scars did it leave,1385571399.0,Reddit How did you discover that YouKnowWho wasnt really Real,26,AskReddit,top_week
