author,comments,downvotes,id,score,selftext,time_created,title,upvotes,subreddit,type
ToteSport,2,15,1qj7kf,58,in one of his finest suits the hope that when he visits the Vatican he can be granted an audience with the Holy Father During one of the Papal processions he manages to make his way to the front of the barrier as the Pontiff walks past them Instead the Pope completely blanks the man and stops several metres after him and stoops down to talk to an old and raggedlooking homeless person The wealthy man is insanely jealous and later finds the homeless person that the Pope had talked to and offers him his own fine suit as well as  in exchange for the hobos rags to which the man greatly obligesThe next day the man positions himself in his new hobo clothing in  roughly the same spot the original man was in the previous day And sure enough as the Pope came down the procession he stopped by the homeless man bent down and whispered in his earI thought I told you to fuck off yesterday,1384348540.0,A wealthy man goes to Rome,73,jokes,hot
gregg,1,10,1ql6wj,2,Döppelspider,1384398882.0,What has  legs and speaks german,12,jokes,hot
ThatDandyMan,3,4,1qk8x5,12,A corny one,1384376092.0,Whats the healthiest type of joke,16,jokes,hot
shostabrovich,4,11,1qjicf,26,The past present and future walk into a bar It was tense,1384358260.0,For all the English lovers,37,jokes,hot
ItsThatKush,28,270,1qhjtw,778,Asian Keanu arrives at partyAsian Keanu gets boredAsian Keanu Reeves,1384293476.0,Asian Keanu,1048,jokes,hot
clearedasfiled,12,109,1qipum,156,With Little Caesars,1384323548.0,How do Mexicans cut their pizza,265,jokes,hot
Brewbird,3,15,1ql0i8,2,Mother  pulls out picture from purse This is my son Abdullah He would have been  now but alas he became a martyrMother  Ah yes I remember when he lost his first tooth sighsMother  pulls out another picture This is my son Hussein He would have been  now but alas he became a martyrMother  Ah yes I remember when he took his first steps deep sighMother  pulls out yet another picture  This is my son Muhammed He would have been  now but alas he became a martyrMother  Ah yes I remember when he was born deepest sigh You know they blow up so fast,1384394408.0,Two Mothers Are Sitting Together At An Outdoor Café In Baghdad,17,jokes,hot
mvanoort,2,7,1qkjc1,7,It goes pretty smoothly until you start hitting the rock ,1384382547.0,How is digging fence post holes like being the mayor of Toronto,14,jokes,hot
Jdawgity,8,154,1qhx3a,401,Sherlock Holmes and Dr Watson were going camping They pitched their tent under the stars and went to sleep Sometime in the middle of the night Holmes woke Watson up and said Watson look up at the sky and tell me what you seeWatson replied I see millions and millions of starsHolmes said And what do you deduce from thatWatson replied Well if there are millions of stars and if even a few of those have planets its quite likely there are some planets like Earth out there And if there are a few planets like Earth out there there might also be lifeAnd Holmes said Watson you idiot it means that somebody stole our tent,1384302123.0,Old joke is old but still great,555,jokes,hot
ARedMailbox,4,9,1qkxho,5,Drew Brees The guys a saint,1384392222.0,Whos the nicest player in the NFL,14,jokes,hot
Beishe,0,8,1qlqhz,0,Womens rights,1384417961.0,You guys wanna hear a joke,3,jokes,hot
redtie,1,9,1qjj20,20,A lawyer was just wakingup from anesthesia aftersurgery and his wife wassitting by his side His eyesfluttered open and hesaid Youre beautifuland then he fell asleepagain His wife had neverheard him say that so shestayed by his sideA couple minutes later hiseyes fluttered open andhe said Youre cuteWell the wife wasdissapointed becauseinstead of beautiful itwas cute She saidWhat happened tobeautiful His reply wasThe drugs are wearingoff,1384358751.0,beautiful,29,jokes,hot
GatorJohnson,0,3,1qloyn,1,They marched backwards and the Polish thought they were leaving ,1384415620.0,How was Germany able to Take over Poland so easily,4,jokes,hot
brucexavier,1,6,1qjx3r,11,Youre Welcome,1384368343.0,Whats q  q,17,jokes,hot
goatrentals,2,7,1qkxvl,3,Its the only country where burning fags is still acceptable,1384392519.0,I love Britain,10,jokes,hot
fillyflasherr,12,29,1qivv8,69,In pentagrams,1384330908.0,How does the devil measure his drugs,98,jokes,hot
mindtrapped,0,6,1qlnn3,0,I dunno but the real question is howd they get in there in the first place,1384413809.0,How many mice does it take to screw in a lightbulb,4,jokes,hot
Braakman,9,95,1qj0pa,46,A priest rapist and pedophile enter a barHe orders a beer,1384338571.0,A priest rapist and pedophile enter a bar,141,jokes,hot
TRAshMcCan,197,1715,1qggj2,1700,My apologies if this has been told here already I havent found it yet A military buddy of mine told me this when he got back homeOne day during the Gulf War an Iraqi general and his army were patrolling through semimountainous terrain Suddenly over one of the hills they hear a soldierOne American soldier can take out  Iraqi soldiersThe Iraqi general smirks then sends  of his soldiers over the hill A brief firefight ensues and then everything goes quietOne American soldier can take out  Iraqi soldiersThe Iraqi general is rightfully impressed so he laughs and sends  of his soldiers over the hill to finish the job A large battle is heard over the hill that lasts much longer than the previous fight Finally everything calms downOne American soldier can take out  Iraqi soldiersThe Iraqi general is furious and sends over  of his best soldiers A massive and lengthy battle takes place over the hill During the fight a wounded Iraqi soldier comes crawling back over the hill toward the generalSir Do not send any more men Its a trap THERES TWO OF THEM,1384267096.0,One American Soldier,3415,jokes,hot
everclaire,5,7,1qk4cr,7,In little Nazis,1384373238.0,How did Hitler tie his shoes,14,jokes,hot
NiceMeetingYou,1,3,1qk829,5,bracket,1384375563.0,What do you call a bee in a space rocket,8,jokes,hot
aster,0,4,1ql0ct,1,after I destroy Uranus,1384394295.0,There will only be seven planets,5,jokes,hot
jg,6,74,1qhqqb,268,but alas it was in vein,1384297843.0,Two red blood cells met and fell in love,342,jokes,hot
OldManMullet,0,5,1qleo4,1,big hands and big feet  out of ,1384404896.0,You know what they say about a guy with,6,jokes,hot
jikerman,1,6,1qkkpg,4,A woman is at her fathers deathbed She hasnt seen him in years and now they only have a few moments leftDad Im sorry she whispersGoodbye Sorry he says Im dead,1384383414.0,A sad dad joke,10,jokes,hot
zatoichifan,0,4,1qjooq,6,A friend of mine recently got into a really bad accident they had to amputate his left arm and left leg When I visited him in the hospital he was very upset so I told him the important thing is youre all right he looked me in the eyes how can I be all right he lamented when I have nothing left,1384362645.0,youre all right,10,jokes,hot
batman,15,87,1qh85u,317,GlovesNah Im just kidding He hasnt opened it yet ,1384286241.0,What did the boy with no hands get for Christmas,404,jokes,hot
TwilightNite,4,9,1qirr0,27,And then a chair And then a table,1384325500.0,A blind man walks into a bar,36,jokes,hot
jcrowe,4,23,1qi13f,67,A soldier has been deployed overseas almost a year ago Hes a single guy and well after all this time is starting to have certain sexual needs They are in a place that is a bit far from civilization so its kind of hard to meet womenHe mentions this to his superior Sir Ive been here for almost one year and well I feel I have some needs if you know what I meanWell there is the camel over there in the shelter you couldEww no Thats disgustingThe soldier after being proposed this decides to wait he was kind of turned off anywaysAfter  months or so he feels his need resurfacing and goes to see his superior againSir the need are coming back dont you have any other suggestionsWell the camel isNo way and he storms outAfter another  months he goes to see his superior again and once again asks his about what he could to to satisfy his needsThe camel is available if youThe soldier just leaves a bit disgusted but finally realizing that there arent many possible solutionsHe peeks into the shelter and sees the camel Taking a deep breath he says Fuck it Ive got needs I have to do this So he starts doing his thingAfter about  or  minutes his superior walks in on him and startled  yellsWhat the hell are you doing The camel is to go to the village you idiot,1384304753.0,A soldier with needs,90,jokes,hot
TheTrooperKC,1,4,1qkl7l,2,At least she cant get the clap,1384383732.0,Did you hear about the prostitute with no hands,6,jokes,hot
StrokenSmoke,10,63,1qheh3,114,The cop comes over to the window and asks the man Whats the rushWell you see I a body in the trunk and I wanna bury it ASAP before it stinks up the place Answers the manThe cop confused Why is there a body in the trunkWell I wanted to buy  kilos of heroin and the other guy wanted to screw me so I shot him The man calmly repliedSo theres a dead  kilos of heroin and a gun in your trunk The cop nervously asksYeah and also a bunch of C Im planning to blow up the White House The man continuedThe cop frightened called for back and returned to his vehicle As the back up arrived the police chief decided to talk to the man in the car againSo whats in the trunk Asked the chiefNothing just a spare tireThe chief checks the trunk and sees nothing but a spare tireOk where is the bomb weapons dead body and drugsI have no such things The man answered and seemed very consumedWell the officer told me you had all these things in your trunkThe man looks him in the eye and says Yeah he probably said I was speeding too ,1384290227.0,A man gets pulled over for speeding,177,jokes,hot
justaverage,9,39,1qh1me,157,Q Who made King Arthurs table roundA Sir Cumference,1384281979.0,Heard this one from my  year old and couldnt stop laughing,196,jokes,hot
delicioushypocrisy,2,6,1qkfcn,0,Let me fill you in,1384380029.0,Has anyone ever told you what its like to be royally screwed,6,jokes,hot
TMucks,4,8,1qhxlw,47,It was a pigment of my imagination,1384302472.0,Last night I dreamed of a color I had never seen before,55,jokes,hot
Soddington,4,23,1qhvof,48,Pope Benny Ratzinger was out on Romes high street looking for a replacement PopemobileThe old one was getting long in the tooth  and way past its prime John Paul had never take service and oil change stickers seriously Now this is before all the austerity stuff was really kicking inand he fells like he deserves a bit of a treat since hes been doing some great Popeing lately so he wanders into the Mercedes dealership and like a good German Ladheads directly to the AMGsAnd there is the one he figures will be a great upgradeIts white so it still goes with the uniformbut its a  horse power twin superchaged monster of a carNot exactly practicalbut the Holy Father reckons he could get the back end redone with a nice low profile glass box for waving and blessingSo he talks to the dealerwho is pretty awestruck that the PopeThe FUCKING POPE is in his dealership asking about zero to sixty timesWhats its top speedIs it much of a hassel to disable the speed limitersThen the Pope asksCan we go for a test run and Do you think I could drive The Cardinals never let me up front when Im workingWellthe dealer is not going to say no to the Popeeven though company policy is as definative as Leviticus on the subject of clients in the driverseats of the high end performance modelsHe says Sure thing your Holiness and they head out for a quick spin around RomeWell its not long before the special red leather papal slippers are putting far to much torque to the road and then of course Wha whaWha wha up pops the Law on a bike from nowhere and he pulls over the crisp white AMG and saunters over to the car with ticket book in handDrivers licence and regisThe Policeman does a double takeand tries againbut words fail himLooks at the Driveris thatNo it cant bebutLooks at the passengerthe driver againAfter a moments confused silence he just raises a finger and says Excuse me please Ill just be one momentAnd so he does the best thing he could do in this situationcall the base and ask them what he should doHello Chief Yeah Ive pulled over someone really REALLY powerful for speeding and I dont want to cause an incident without talking to someone higher up about itWho is itWell Im not surebut he has The Pope as his chauffeur,1384301185.0,A Pope Joke,71,jokes,hot
edfitz,5,23,1qi0xh,42,Tupacaday,1384304644.0,What do you call a Rapper who smokes too much,65,jokes,hot
NJFTYM,2,4,1qk94k,0,My aunt got struck by lightning at a golf course It was in between the first and second holes something about her stance ,1384376227.0,My aunt got struck by lightning at a golf course,4,jokes,hot
theonewhowrites,2,12,1qk3ei,0,A factory worker dressed in overalls sat down to have his lunch in a park across from his officeThen he noticed a very distinguished and dignified man step out of a top of the line BMW walk into the park and sit down a few feet away on the grass he was extremely well dressed in a hand tailored Brioni pinstriped business suit perfectly tied silk necktie starched white dress shirt monogrammed cuff links silver tiepin Rolex watch immaculately polished black leather shoes and silk socks He placed his expensive briefcase next to him and prepared for lunchOne of those executives Ill bet thought the factory worker and after introducing himself he found out he was right not only an executive but an investment bankerThe factory worker glanced at the bankers shoes glistening in the sunlightYou have those polished every day dont you he askedThe Investment Banker nodded Just about I have to look good for the clients These were handmade for me The first thing people notice are your shoes at least in my line of work And I keep the shoeshine men busyThe factory worker snapped What about the poor A few shoeshines would pay for a lot food You suits are all alike Tell me something How much money did you pay for those fancy shoesThe Investment Banker looked surprised and said calmly Eight hundred dollarsThe factory worker yelled Just for ONE pair of shoes How are you helping out other people Never trust a suit And how much was that suitThe banker said quietly Well its none of your business but it was two thousand for the suit and two hundred for the tie and two hundred for the shirt since you ask I help them through taxes but we all have a personal responsibility Brioni pinstripes are expensiveThe factory worker said Im telling you the poor only need a chance You should be GIVING them money they havent had your advantagesThe Investment Banker shrugged and said We all have to work for what we have I have worked VERY hard for what I haveI saw you get out of that car Pretty classy said the factory worker That BMW would pay for several cheap carsYes it is a classy car said the banker smiling and pulled out his computer I am trading stocks so I would prefer some privacyThe factory worker said Stocks Look poverty can happen to anyone Theres no way you can know that from where you sit with your high and mighty job and your car and your hotshot clothes If you were not a SUIT you would KNOW that You need to know what its like to NOT be a suitThe Investment Banker smiled and said Keep talking if you want to When I sleep nothing wakes me  and I mean NOTHING I sleep like a rockThe investment banker put down his computer sighed relaxed on the grass and fell into a deep sleepThen a barefoot homeless man appeared holding whiskey and asked the factory worker for change The factory worker apologized and said he had nothing but then he saw the investment bankers wallet in his suit pocketHe had an idea He slipped the wallet out and handed it to the homeless man ID credit cards and allThen he had another idea  a riskier one He looked at the bankers feetWhy not This is a Suit who needs to give to society The homeless man needs shoes and the banker definitely needs to be humbled What size shoe he asked the homeless manTen He looked again at the feet of the sleeping investment banker Wait Im sure you need these more than he does He then started to slowly untie the investment bankers mirror polished  shoes and very slowly and very carefully pulled them off his feetHe looked inside Size ten Youre in luck Give me your whiskey and Ill give you the shoesDeal said the homeless manYou have to have socks to go with these shoes he said and he wont be needing socks now And even more carefully he reached up under the bankers suit cuffs to his knees and peeled the thin black dress socks off the bankers legs heels soles and finally his toes and held them up like trophies He handed both shoes and socks to the homeless man who grinnedThe factory worker said With my compliments They are handmade and they were just polished Somebody told me that the first thing people notice are your SHOESThe factory worker took the bottle of whiskeyThe investment banker now barefoot yawned stretched but continued to sleep soon he started to snore again while the bum walked off in the bankers shoesI guess he wont be seeing any more clients today and hell have to miss that board meeting said the factory worker to himself but hell be a much better person now that hes humbled Im changing his destinyAn old man walked by and stared at the sleeping banker and the contrast between the tailored suit and his bare feet he laughed out loud and walked onThen a mugger ran by holding on to money he had just stolen A victim of society thought the factory workerHe slid the keys to the BMW out of the bankers suit pocket threw them to the mugger and pointed to the carThe mugger didnt stop to ask questions  he just drove offThen the factory worker saw a sad woman with a baby walking by Can I help you he asked her When he found out that she needed money for her rent the factory worker again approached the snoring investment banker and removed his cuff links then he slipped the tiepin out of the silk tieHis wristwatch will be worth plenty said the factory worker to himself and slipped the Rolex off the bankers manicured hand He handed them all to the delighted woman Sell these the factory worker cried Oh thank you sir said the woman and ran offIts the least I can do said the factory workerHe then thought Well he has no more fancy shoes no socks no keys no car no ID or credit cards or wristwatch or license or money I guess Im turning him from a Suit into something much better I might as well finish the jobThe factory worker then noticed the bankers computer and the password on a piece of paper He sold all of the bankers stocks and bonds and gave the money to the charitiesNext a man in a janitors uniform walked by looking dejectedWhats the matter my friend said the factory worker sympathetically Ilost my job I have a chance for a better one but I dont have the clothes This is all I have and he held up a pair of old polyester pantsThe factory worker sighed and then looked at the bankers navy blue pinstriped business suitWould this help Its a two thousand dollar suit A Brioni he asked the manSure cried the man But how are you going to strip it off himJust watch and see said the factory workerHe very slowly moved one of the bankers arms and then the other and the banker rolled on to his stomach still sleeping and removed the suit jacketYou could use a briefcase too said the factory worker and opened up the investment bankers briefcaseHe removed the contents and handed it to the joyful man He also gave him the bankers Blackberry and computer and password Then he looked at the bankers expensive silk tie and white shirt Could he manage itHe had to move the banker again a few times but he only snored and slept as he untied the tie and pulled off the shirt Then he unbuttoned the bankers suspenders and pulled them offTriumphantly he handed the starched white shirt suspenders and necktie to the man leaving their formerly welldressed owner in his tshirtWait the factory worker said You really need the full suit Give me a hand and Ill need those polyester pants Im getting good at this taking his suit pants off him will be the hardest job yet and with great care and trouble set to work removing the suit trousers Ten minutes later the man was holding up the full pinstriped suit with admiration while its former owner was reduced to wearing the polyester pantsHe thanked the factory worker profusely and ran off who brushed off his words Im always glad to help those who need it Ive always been generousHow good it is to help people he said to himself And mister hotshot isnt a Suit anymoreHe sprinkled some of the whiskey on the bankers shirt and hair and placed the bottle next to himTwenty minutes later a policeman walks up to the formerly impeccably dressed investment banker slapped him on the soles of his naked size tens and snapped Hey buddy wake up no loitering We dont allow drunk bums to sleep here I can smell it from hereFinally the investment banker woke up with a start and looked down at himself with astonishmentThere was nothing left of the perfectly dressed banker he had been when he fell asleep He was barefoot and wearing only cheap trousers and a tshirt It took him a moment to realize that his suit shoes socks tie shirt watch jewelry money credit cards ID computer and briefcase had all been stripped from himHe turned to the factory worker in astonished fury WHAT HAVE YOU DONE WHERE IS MY SUIT MY TIE MY SHIRT WHERE ARE MY SHOES AND SOCKS MY BRIEFCASE MY WALLET HOW CAN I GO BACK TO MY OFFICE LIKE THIS I LOOK LIKE A BUM I smell like a bum tooThe factory worker then told him about his car and stocks The banker began to yellThe policeman then turned to the factory worker and said Is this bum disturbing you and grabbed the struggling investment banker by the arm and says You can sleep it off in the tank buddy Vagrancy disturbing the peace resisting arrest assaulting an officer harassmentAt that moment his boss walked by on a stroll saw his bedraggled employee being dragged away and cried out What are you doing Youre firedThree months later the factory worker wandered into the park and saw the homeless man on the corner as usual wearing the same gleaming black shoes and socks but now there was a new panhandler with him barefoot with matted hair and a grizzled face wearing polyester pants and a Tshirt It cant be he says as he walked up to him But it isThe homeless man looked up and winked Hes one of us now he said laughing And Im even wearing HIS fancy shoesThe expensive haircut and the manicure were gone along with everything else and the former investment banker is now an unemployed homeless bum with a criminal record he had been thrown out of his condo and his wife had left him Its hard to believe this was the same confident man in the expensive suit and the polished shoes he had seen that day in the parkI have been stripped of everything and my life is destroyed Spare change sir Can I give you a shoeshine said the bankerturnedpanhandler without looking up He pulled out a shoeshine kitForget it snapped the factory worker Get a job Those Suits They never think it will happen to them,1384372637.0,The Factory Worker Meets a Suit a long joke story,7,jokes,hot
CondoleezzaJesus,14,120,1qgaj7,293,but when I got home all the signs were there,1384260784.0,I didnt want to believe my flatmate was stealing from his job as highway maintenance,413,jokes,hot
OZO,2,7,1qk16t,0,When they reach the top of the mountain God appearsand tells them to say something they love very much and then jumpthe thing they said before they jump will wait for them at the bottomSothe american goes first and yells FUCKIN BURGERSjumps and falls into a pit full of delicious hamburgersThen the german approaches the edgeyells BEERJA and lands into a sea of the greatest beer he ever tastedFinallyjust before the Brit says somethinghe slips and yells OH SHIT,1384371150.0,A GermanAmerican and Brit go to a mystical mountain,7,jokes,hot
memarianomusic,1,13,1qik1n,12,Pyrex of the Caribbean,1384318301.0,What do you call glass cookware from Jamaica,25,jokes,hot
lafoma,2,29,1qh5h0,71,Little Sally comes home from school one day and says to her mom Mommy mommy you wont believe it Little Johnny pulled out his peepee in class today It was like a peanutThe mom replies Oh it was smallLittle Sally says No it was salty,1384284518.0,Little Johnnys peanut,100,jokes,hot
theCinephile,6,112,1qg2aw,353,The train was very crowded so the soldier walked the length of the train looking for an empty seat The only unoccupied seat was directly adjacent to a well dressed middleaged French lady and was being used by her little dog The war weary soldier asked Please maam may I sit in that seat The French woman looked down her nose at the soldier sniffed and said You Americans You are such a rude class of people Cant you see my little Fifi is using that seat The soldier walked away determined to find a place to rest but after another trip down to the end of the train found himself again facing the woman with the dog Again he asked Please lady may I sit there Im very tired The French woman wrinkled her nose and snorted You Americans Not only are you rude you are also arrogant The soldier didnt say anything else he leaned over picked up the little dog tossed it out the window of the train and sat down in the empty seat The woman shrieked and railed and demanded that someone defend her and chastise the soldier An English gentleman sitting across the aisle spoke up You know sir you Americans do seem to have a penchant for doing the wrong thing You eat holding the fork in the wrong hand You drive your cars on the wrong side of the road And now sir youve thrown the wrong bitch out the window,1384248191.0,The train was very crowded so the soldier walked the length of the train looking for an empty seat,465,jokes,hot
