author,comments,downvotes,id,score,selftext,time_created,title,upvotes,subreddit,type
son,56,766,1rporv,1689,So an older couple is discussing the inevitable matter of death  The wife asks her husband If I die before you do will you remarry  To which the husband replies Well I dont want to be lonely for the rest of my life so yes  The wife then asks What about the house  Will you live in the same house  And the husband says Well I suppose  I mean its already paid for  The wife getting a little protective asks And what about my car  Will she drive my car  The husband says again Well its already paid forThe wife annoyed at this point shoots What about my golf clubs  And the husband says Oh no  Shes left handed,1385739159.0,My grandpa told me this one,2455,jokes,hot
ryanbimmer,79,540,1roisz,836,Does that make you an iWitness,1385688342.0,If you see an Apple store getting robbed,1376,jokes,hot
cookiesmasher,1,31,1rpgut,93, little girl walks into a pet shop and asks in the sweetest little lisp Excuthe me mithter do you keep wittle wabbits And the shopkeeper gets down on his knees so that hes on her level and asks Do you want a wittle white wabby or a soft and fuwwy bwack wabby or maybe one like that cute wittle bwown wabby over there The little girl puts her hands on her knees leans forward and says in a quiet voice I dont fink my pyfon really giveths a thit,1385728999.0,Wittle Wabbit,124,jokes,hot
quotejester,2,17,1rps08,46,The Mayans taught me that if you dont finish something its not really the end of the world,1385742158.0,What the Mayans taught me,63,jokes,hot
Huggbees,26,64,1rp0kc,237,When all of the sudden in the midst of a paticularly moving segment he hears a loud uproarious sneeze coming from amongst the crowd Stalin stops speaking glares at the soldiers becomes very visibly annoyed and says Who sneezedAll of the soldiers dont say anything some of them start to sweat and others nervously glance around After a brief moment Stalin motions towards a few soldiers with him on the stage Execute the first row he commands and the soldiers on stage begin opening fire at the first row of troops on the groundIll ask again who sneezed says Stalin Another pause and no one speaks up Finally Stalin says Execute the but before he can finish a soldier about  rows back raises his hand and says It was me General Secretary Stalin Im the one who sneezedStalin then stares cold and hard at the soldier who spoke up for an uncomfortable amount of time before he leans towards his microphone and says Bless you ,1385705431.0,Joseph Stalin is giving a speech to his army,301,jokes,hot
temalyen,5,11,1rprr3,30,Im tired of people ringing my doorbell at all hours of the day and night asking for donations This morning it was some woman from the sperm bank Boy did I give her a mouthful ,1385741919.0,I hate it when people bother me,41,jokes,hot
Yanetoe,0,3,1rq9v7,14,With a crowbar,1385756909.0,How do you separate the men from the boys in the Navy,17,jokes,hot
son,0,0,1rqkwa,6,So he asked If there are any idiots in the room will they please stand up After a long silence one freshman rose to his feet  Now then mister why do you consider yourself an idiot Inquired the teacher with a sneer  Well actually I dont said the student But I hate to see you standing up there all by yourself,1385765560.0,A mean teacher wanted to show his class he meant business,6,jokes,hot
Injuringset,0,0,1rqg4q,7,Horton hears a hue ,1385761757.0,What do you call a childrens book aimed at synaesthetes,7,jokes,hot
ArtsyMNKid,7,68,1rp04v,103,You have to get out and check to see how bad your car is damaged,1385704999.0,Whats the worst part of running into your ex,171,jokes,hot
VersalEszett,34,735,1rnepl,1134,After about  minutes on the highway I realized I left my car at home,1385653166.0,I had coffee with Red Bull this morning,1869,jokes,hot
beerdude,72,792,1rna91,1407,An Englishman a Frenchman a Spaniard and a German are all standing watching an American street performer do some juggling The juggler notices the four gentleman have a very poor view so he stands up on a wooden crate and calls out Can you all see me nowYesOuiSíJa,1385648675.0,An Englishman a Frenchman a Spaniard and a German xpost from rdadjokes,2199,jokes,hot
gydot,2,72,1roy1m,81,What does Miley Cyrus eat for ThanksgivingTwerkyJust kiddingDrugs She eats drugsAdam Zopf adamzopf,1385702892.0,Thanksgiving joke,153,jokes,hot
ieatcrispybacon,0,3,1rpw49,10,A muenster,1385745708.0,What did the cheese go as for Halloween,13,jokes,hot
dylanm,0,2,1rqi00,2,so little tyrome is in the locker room getting changed for gym class He notices that he has the biggest penis in his class and from the looks of it the whole third grade He goes home that day and asks his dad hey dad ive got the biggest penis in the third grade is it because im black His dad replies no tyrone its because your eighteen,1385763236.0,You guys ever hear the one about little tyrome,4,jokes,hot
GeneralFriend,0,4,1rq4tb,4,She gives her grandpa a slice of pumpkin pie He passes it down the tableShe brings out another slice of pie and gives to grandpa He passes it down the tableShe brings out another slice of pie and gives to grandpa He passes it down the tableShe slams her hand down Grandpa this is ridiculous All the slices are the same size,1385752899.0,A little girl helping with holiday meal,8,jokes,hot
TheStabbingHobo,0,2,1rqfq4,3,The taste,1385761439.0,Whats the difference between an oral thermometer and a rectal thermometer,5,jokes,hot
Cygnus,0,3,1rq1ki,5,HAAAAAAYYYYhttpwwwinfiniteloopercomvliZZuZo,1385750311.0,What does James Brown feed his horse,8,jokes,hot
xereeto,0,1,1rqda6,4,Shamus and Murphy fancied a pint or two but didnt have a lot of money between them they could only raise the staggering sum of one Euro Murphy said Hang on I have an idea He went next door to the butchers shop and came out with one large sausage Shamus said Are you crazy Now we dont have any money left at all Murphy replied Dont worry  just follow me He went into the pub where he immediately ordered two pints of Guinness and two glasses of Jamieson Whisky Shamus said Now youve lost it Do you know how much trouble we will be in We havent got any money Murphy replied with a smile Dont worry I have a plan Cheers They downed their Drinks Murphy said OK Ill stick the sausage through my zipper and you go on your knees and put it in your mouth The barman noticed them went berserk and threw them out They continued this pub after pub getting more and more drunk all for free At the tenth pub Shamus said Murphy  I dont think I can do any more of this Im drunk and me knees are killinme Murphy said How do you think I feel I lost the sausage in the third pub,1385759564.0,Irish Sausage,5,jokes,hot
Blink,8,20,1rp8ow,27,Well this morning I had scrambled eggs,1385715720.0,What does a man with a  penis have for breakfast,47,jokes,hot
benhahmeen,8,68,1roo4o,60,He sits down and orders  beers One day the bartender asks Hey man whats with the  beers Why not just order one glass The man says My brothers and I made an agreement that wherever we are in the world at  every night well share a beer to remind each other of our bond  for each of us The bartender is touched and gives them to him for free One day the bartender notices that the man only orders  and assuming that one of the brothers passed away offers his condolences to which the man laughs and says Nobody died I just gave up beer Im on a diet ,1385693474.0,A man goes to a bar every night at ,128,jokes,hot
michaelscarnfbi,1,6,1rpnz0,6,He drowned in his teapee,1385738313.0,What happened to the Indian chief who drank too much tea,12,jokes,hot
mythernalite,0,3,1rp5rx,22,Some of my personal favorite onesA snail gets mugged by a gang of turtles When the police show up and ask what happened the snail say  I dont know it happened so fastA woman gets on a bus with her baby The bus driver say Thats the ugliest baby Ive ever seen ugh The woman goes to the rear of the bus and sits down fuming She says to the man next to her The driver just insulted me The man say you go right up there and tell him offIll hold your monkey for youA couple from Minneapolis decided to go to Florida to thaw out during one particularly icy winter They planned to stay at the very same hotel where they spent their honeymoon  years earlier Because of hectic schedules it was difficult to coordinate their travel schedulesso the husband left Minnesota and flew to Florida on Thursday with his wife flying down the following day The husband checked into the hotel There was a computer in his room so he decided to send an email to his wife However he accidentally left out one letter in her email address and without realizing his error he sent the e mail to somewhere in Houston A widow had just returned home from her husbands funeral He was a minister of many years who was called home to glory following a sudden heart attack The widow decided to check her email expecting messages from relatives and friends After reading the first message she fainted Her son rushed into the room and found his mother on the floor and couldnt imagine what happened to her until he looked up at the computer screen and readTO My Loving Wife Subject Ive arrived Date January   I know youre surprised to hear from me They have computers here now and you are allowed to send emails to your loved ones Ive just arrived and have been checked in I see that everything has been prepared for your arrival tomorrow Looking forward to seeing you then Hope your journey is as uneventful as mine was Your Loving HusbandPS Sure is hot down hereAnd finallyA man goes into the confessional box He finds on one wall a small bar with Guinness on tap On the other wall is a box of the finest Cuban cigars On the seat is the latest copy of Playboy Finally the priest comes in Father forgive me for its been a very long time since Ive been to confession but I must first admit that the confessional box is much more inviting these days The priest replies Get out Youre on the my side,1385711508.0,Some of my favorite SFW jokes,25,jokes,hot
Bearlung,5,57,1romdi,56,So his farts dont stink,1385691798.0,I heard that drake insists on lavender scented condoms,113,jokes,hot
Furevuralone,0,0,1rqmzo,1,Hello is this the Sheriffs OfficeYes what can I do for youIm calling to report my neighbor Virgil Smith Hes hiding marijuana inside his firewood Dont quite know how he gets it inside them logs but hes hidin it there Thank you very much for the call sirThe next day the Sheriffs Deputies descend on Virgils house They search the shed where the firewood is kept Using axes they bust open every piece of wood only to find no marijuana They sneer at Virgil and leave Shortly the phone rings at Virgils houseHey Virgil This heres Floyd Did the Sheriff come byYeah Did they chop your firewood for the winter YepMerry Christmas buddy,1385767263.0,Oh Floyd,1,jokes,hot
kunsjef,0,1,1rqliu,0,He was a really mean drunk ,1385766023.0,Why was Hitler never allowed to drink alcohol,1,jokes,hot
CELOTA,0,1,1rqk3p,1,No but Ive heard a whore moan ,1385764928.0,Have you ever seen a vitamin,2,jokes,hot
sickmilk,0,2,1rqgzk,1,Its amazing I didnt even know they could knitwaaaaaaka waka,1385762439.0,did you know it takes  sheep to make a wool sweater,3,jokes,hot
nakedoc,0,4,1rppn1,2,There was some guy collecting the waste from the urinals at work today I think he was taking the piss to be honest ,1385739989.0,Collection,6,jokes,hot
Quaileater,0,2,1rqdb6,1,walks over to his wife with a sheep under his arm He announces loudly This is the Pig Ive been fucking  His wife looks at the poor creature and says Gethin you silly bastard thats a sheep not a pig Gethin replies I wasnt talking to you ,1385759587.0,A Welsh Farmer,3,jokes,hot
EKiller,4,27,1rox2w,12,Because the deals are suchA steal,1385701979.0,Why is it called Black Friday,39,jokes,hot
fergiz,0,6,1rpphh,2,This is an old oneA man goes to a psychologist and says Doc you have to help me I cant sleep Every time I close my eyes my mother is right there giving me grief When I open them its even worse there she is again nagging and bullying me Sometimes its so bad at night time all I can do is go downstairs and eat a piece of toastThe doctor looks at him and replies What One piece of toast For a big boy like you,1385739855.0,Recurring Visions,8,jokes,hot
DisneyReference,4,19,1rp9z3,8,,1385717597.0,What do you get when you mix a joke with a hypothetical question,27,jokes,hot
ketR,0,4,1rq4c5,0,A twentysomething with a rainbow colored mohawk is sitting at a booth at a restaurant After a while he realizes an old man sitting there staring at him He goes back to eating but the old man is still staring at him Eventually he goes over and asks look can I help you and the old man says well son years ago I had sex with a parrot and I was wondering if you might be my son,1385752515.0,Since Were Posting Jokes From Our Grandpas,4,jokes,hot
telehubby,13,22,1roq0e,17,My girlfriend is wanting to get kinky in an elf costume tomorrow and Santa is in need of some good puns for the naughty dirty talk,1385695347.0,Ok rJokes I I realize that its still Thanksgiving but I need your help what are your dirtiest Santaelf related jokes,39,jokes,hot
GeneralFriend,5,29,1rnjpg,116,On a Christmas cruise on a luxury ocean liner in the Pacifica passenger sees seven straggly people on a small islandjumping up and down and waving their hands and shoutingWho are they the passenger asks the captainIve no idea But each year when we pass they go nuts,1385657580.0,Somewhere off Gilligans Island,145,jokes,hot
unkleknuckles,1,16,1rofn9,23,Itll be called coming or going ,1385685107.0,Im going to open a building that functions as a sperm bank as well as a urine analysis center,39,jokes,hot
MartinLutherKingJ,0,10,1rpx9c,0,Nignog,1385746744.0,What do black people drink during the Holiday Season,4,jokes,hot
vikristianz,8,57,1rnh7x,89,What do you give a sick birdTweetmentWhat do you give a sick lemonLemonade,1385655460.0,Sick Lemon and Sick Bird,146,jokes,hot
dsade,0,4,1rpt8m,2,Hes bringing Skeksis Back,1385743183.0,Justin Timberlake has announced hes involved with a sequel the The Dark Crystal,6,jokes,hot
lasertoast,3,6,1rppfr,1,This blind guy walks into a fish storeHe turns to his buddy wow so many chicks,1385739798.0,This blind guy walks into a fish store,7,jokes,hot
theboy,13,20,1rnuua,41,In the European Heaven The police is British the cooks are French the mechanics are German the Italian are the lovers and everything is run by the SwissIn European Hell The police is German the cooks are British the mechanics are French the Swiss are the lovers and everything is run by the Italians,1385666247.0,European Heaven In honour of Berlusconi enjoy your ban,61,jokes,hot
killerswisscheese,2,17,1ropd5,10, Below,1385694717.0,What is the temperature of the average coffin,27,jokes,hot
mikalshorti,69,650,1rm7c9,960,God decides hed like to take a vacation So he goes to St Peter at the pearly gates and asks Pete I need a vacation being God is fucking stressful Where should I goSt Peter says well Pluto has good skiingGod shakes his head fervently and replies no way I broke my leg there onceNext St Peter suggests Mars  theres an eonslong storm that could be fun God says no way I almost got struck by lightning there last timeSo then St Peter suggests Earth  you can do just about anything thereGod fires back Fuck that Pete I went there  years ago knocked up some Jewish chick and theyre still fucking talking about it,1385603363.0,Gods Vacation,1610,jokes,hot
Spyisheavy,0,6,1ro9ey,19,Its two days before thanksgiving A young boy wakes up and upon walking across the hall to his parents room hears them talking about last nights sex But the only words he can make out through the door are dicks and vaginas He opens the door and immediately asks Mommy Daddy what are dicks and vaginasHis dad quickly answers Theyre just fancy words for hats and coats Satisfied with this the boy leaves the roomLater that day while his mom was prepping a turkey that she had just bought she accidentally cut herself and immediately shouted out FUCKUpon hearing this the young boy rushes into the kitchen and asks Mommy what does fuck meanShe quickly responds its just a way of cooking the turkeyNow it is thanksgiving day and the father is shaving when he accidentally cuts himself and yells out SHITThe young boy rushes in and asks daddy what does shit meanThinking fast his dad says its just the brand of shaving cream Im using And then the doorbell rang The young boys dad told him to get the doorThe boy rushed to the door opened it and upon seeing his guests said Good evening May I take your dicks and vaginas please My mom is In the kitchen fucking the turkey and my dad is upstairs scraping the shit off of his face,1385679012.0,A great one to tell at thanksgiving parties,25,jokes,hot
mheller,11,64,1rnx83,27,,1385668185.0,The Detroit Lions,91,jokes,hot
MyKarmaKilledURDogma,4,21,1ro4rv,20,Jerk one off the other two will come,1385674620.0,How do you get three gay men off your couch,41,jokes,hot
jubileo,1,6,1rpi5a,0,Headmaster,1385731115.0,What is the name of a person who is a specialist in giving Blow jobs,1,jokes,hot
mikerobbo,1,15,1rofs8,9,then he came back today with his dog,1385685242.0,Yesterday a German Shepherd did a shit in my garden,24,jokes,hot
rolstonrye,3,12,1ro698,11,The year is  and the French have just begun colonization in North America Young JeanLuc is in his newly crafted home when suddenly his friend JeanPierre bursts through his front door Jean Luc he exclaims  You weel nevar believe I ave eard word of a bacon tree JeanLuc looks confused and scoffs Imposseeble You cannot grow BaycON on a tree Come And I weel show you ze bacon tree So JeanLuc amp JeanPierre set off down the river with Jeanpierre providing direction to the enigmatic bacon tree  Finally they pulled over onto a small beach that lead to a large forest Stay ere and watch ze canoe and I weel bring ze bacon back from ze bacon tree said JohnPierre Hours go by and JohnPierre hasnt returned As night falls and JeanLuc is about to enter the forest to look for his friend he hears a rustling in the nearby brush to which JeanPierre stumbles out bloody and with arrows through his legs and arms JeanPierre What appened exclaimed Jeanluc Turns out it was not a bacOn treeit was an AMBUSH,1385676014.0,The Bacon Tree,23,jokes,hot
kongo,5,18,1rnyg5,15,apparently they cant put together  ws,1385669219.0,The NY Jets website is down,33,jokes,hot
fuden,3,9,1rosm1,3,The pro football team had just finished their daily practice session when a large turkey came strutting onto the field While the players gazed in amazement the turkey walked up to the head coach and demanded a tryoutEveryone stared in silence as the turkey caught pass after pass and ran right through the defensive line When the turkey returned to the sidelines the coach shouted Youre terrific Sign up for the season and Ill see to it that you get a huge bonusForget the bonus the turkey said All I want to know is does the season go past Thanksgiving Day httpwwwbizfriendorg,1385697810.0,JOKE OF THE DAY,12,jokes,hot
jeets,18,182,1rlrlg,517,they only had one pickup,1385591170.0,Why did the Mexican army attack the Alamo with only  soldiers,699,jokes,hot
jadezx,5,35,1rmpq6,119,He got too attached to his work,1385619780.0,Why did Jesus drop out of the carpentry business,154,jokes,hot
dafuq,0,10,1rp4s9,0,well stop doin anal,1385710200.0,Do you know what i say to people that are butthurt,3,jokes,hot
sticklause,22,231,1rlok2,469,A man had  daughters The first daughter walks up to her dad and says Daddy why is my name RoseBecause a rose petal fell on you when you were a baby Replied the father The first daughter smiles and skips off to play with her dollsThe second daughter walks up to her dad and says Daddy why is my name TulipBecause a Tulip petal fell on you when you were a baby Replied the father The second daughter smiles and skips off to play with her dollsThe third daughter walks up to her dad and says HhhhhnnngngngnggggddddddrrrrruhuuhuhhuhhuhdadghGo to your room cinderblock Replied the father,1385589116.0,A man had  daughters,700,jokes,hot
ndnh,5,5,1rp2u4,0,Jill came down with ,1385707809.0,Jack and Jill went up the hill with a dollar and a quarter,5,jokes,hot
winterjam,11,168,1rm0m7,227,Christian Bale,1385597947.0,What do you call it when Batman skips church,395,jokes,hot
wannabgourmande,10,59,1rml47,85,and asks Father how do we get our namesFather says When your brother was born I came out of the teepee and saw a bear standing in the distance so we called your brother Standing BearThen when your sister was born a white dove flew by the teepee when I stepped outside so we named your sister White Dove Why do you ask Two Dogs Fucking,1385615395.0,A young Native American boy walks up to his father,144,jokes,hot
eggsalade,6,14,1rmqw3,62,Bubba was bragging to his boss one day You know I know everyone there is to know Just name someone anyone and I know them Tired of his boasting his boss called his bluff OK Bubba how about Tom CruiseSure yes Tom and I are old friends and I can prove it So Bubba and his boss fly out to Hollywood and knock on Tom Cruises door and sure enough Tom Cruise shouts Bubba Great to see you You and your friend come right in and join me for lunchAlthough impressed Bubbas boss is still skeptical After they leave Cruises house he tells Bubba that he thinks Bubbas knowing Cruise was just luckyNo no just name anyone else Bubba saysPresident Clinton his boss quickly retortsYes Bubba says I know him lets fly out to WashingtonAnd off they go At the White House Clinton spots Bubba on the tour and motions him and his boss over saying Bubba what a surprise I was just on my way to a meeting but you and your friend come on in and lets have a cup of coffee first and catch upWell the boss is very shaken by now but still not totally convinced After they leave the White house grounds he expresses his doubts to Bubba who again implores him to name anyone elseThe Pope his boss repliesSure says Bubba My folks are from Poland and Ive known the Pope a long timeSo off they fly to Rome Bubba and his boss are assembled with the masses in Vatican Square when Bubba says This will never work I cant catch the Popes eye among all these people Tell you what I know all the guards so let me just go upstairs and Ill come out on the balcony with the PopeAnd he disappears into the crowd headed toward the Vatican Sure enough half an hour later Bubba emerges with the Pope on the balconyBut by the time Bubba returns he finds that his boss has had a heart attack and is surrounded by paramedics Working his way to his boss side Bubba asks him What happenedHis boss looks up and says I was doing fine until you and the Pope came out on the balcony and the man next to me said Whos that on the balcony with Bubba,1385621044.0,Bubba and Friends,76,jokes,hot
JoeBourgeois,0,9,1rorim,0,Microsoft Word,1385696772.0,How do you greet an overweight Micronesian when youre trying to sound cool,3,jokes,hot
mclarke,34,510,1rklmr,1005,Because theres not mushroom,1385561601.0,Why dont fairies live under toadstools,1515,jokes,hot
hkdharmon,1,26,1rms4u,41,An old man was lying on his deathbed His wife of forty years was holding his handHe looked at her and said Margaret It seems like you have always been with me when I was in need Remember that time I fell down the stairs You stayed with me And when I lost my job You were right there Now that I am dying you are here You know what MargaretWhat JohnI think youre a jinx,1385622431.0,An old man was lying on his deathbed,67,jokes,hot
CanadianQuad,1,25,1rmnhg,49,A guy walks into a bar with his pet monkey He orders a drink and while hes drinking the monkey jumps all over the place eating everything behind the bar Then the monkey jumps on to the pool table and swallows a billiard ballThe bartender screams at the guy Your monkey just ate the cue ball off my pool table  wholeSorry replied the guy He eats everything in sight the little bastard Ill pay for everythingThe man finishes his drink pays and leavesTwo weeks later hes in the bar with his pet monkey again He orders a drink and the monkey starts running around the bar The monkey finds a maraschino cherry on the bar He grabs it sticks it up his ass pulls it out and eats itThe bartender is disgusted Did you see what your monkey did now he asksYeah replies the guy He still eats everything in sight but ever since he swallowed that cue ball he measures stuff first,1385617572.0,A guy walks into a bar with his pet monkey,74,jokes,hot
mclarke,1,4,1ro0eq,4,Life on the hedge,1385670840.0,How do tree surgeons live,8,jokes,hot
BVTheEpic,7,41,1rmj31,59,But there werent enough members,1385613617.0,I was trying to form a club for eunuchs at my high school,100,jokes,hot
niknikbluhh,5,14,1rmshy,36,Hold on to your nuts this is no ordinary blow job,1385622823.0,What did the hurricane say to the palm tree,50,jokes,hot
ScotchRobbins,1,8,1rn4bv,10,The first man says When I get up at  AM it takes me a half hour to peeSecond man says Youre lucky When I get up at  AM it takes me a straight hour to take my morning poopThird man says I piss like a racehorse at  and crap like a goose at Then whats the matter with you asked the other twoProblem is Im not up until ,1385640367.0,So three elderly men at a rest home are conversing about their age,18,jokes,hot
READINGSFORFAGS,0,14,1rocuq,0,Twerky,1385682315.0,What did Miley Cyrus have for thanksgiving,5,jokes,hot
ebaysellr,6,18,1rmx1i,13,Nice belt,1385628866.0,What did the zero say to the eight,31,jokes,hot
