author,comments,downvotes,id,score,selftext,time_created,title,upvotes,subreddit,type
Lighterless,4,8,1r98rl,13,and approaches the teller whos name is John Paddywack I would like to take out a loan for  the frog declares Mr Paddywack looks at the frog and says Since you dont have any credit with this bank youll need a cosignerNo Problem says the frog My father is Mick Jagger and hell cosign the loan for meWell youll also need some collateral Mr Paddywack counteredWill this work Asks the frog and pulls from his pocket a mishappen Buddha figurine made out of bronzeWell maybe Lets go ask the bank manager Says Paddywack and the two go back to the bank manager where Paddywack explains the situationAnd so what should I do I dont even know what this thing is Paddywack tells the bank manager while showing him the BuddhaThe bank manager repliesIts a knickknack PaddywhackGive the Frog a loanHis old mans a rolling stoneThis is how it was told to me but this joke has also been told about  months ago in this sub herehttpwwwredditcomrJokescommentsevqxafroggoesintoabankandapproachestheteller,1385167141.0,A Frog Walks Into A Bank,21,jokes,hot
PRWN,12,73,1r7fc5,224,for a followup visit after the doctor had prescribed testosterone for her She was a little worried about some of the side effects she was experiencing Doctor the hormones youve been giving me have really helped but Im afraid that youre giving me too much Ive started growing hair in places that Ive never grown hair in before The doctor reassured her a little hair growth is a perfectly normal side effect of testosterone Just where has this hair appeared On my balls which is something else I want to talk to you aboutreplied the woman,1385108252.0,A woman went to her doctor,297,jokes,hot
TheStabbingHobo,3,34,1r87w8,36,Because he only comes once a year,1385140429.0,Why is Santas sack so big,70,jokes,hot
UnknownUser,13,26,1r84ee,37,Get summoned by his bossWho is looking very worriedAnd she says to himIve just walked by the dolphin tankAnd theyre feeling very amorous Theyre doing all sort of things to each otherAnd the trouble is in less than an hourWeve got three busloads of second graders comingWe cant have them watching those naughty dolphinsBehaving as if they were in a porno flickNow there is only thing that acts as an antiaphrodisiac for dolphinsAnd thats the meat of baby seagullsSo I want you to go down to the seashoreAnd catch us baby seagullsPut them in this bagAnd hurry on backBut be careful A lion escaped from the zoo this morningAnd although he was heavilly sedatedHe still just might be dangerousOK get goingAnd make it snappySo the guy takes a shortcut through the forest to the seashoreHe fills the bag with baby seagullsAnd hes walking back to the forestWhen he sees lionAnd it is lying across the pathDirectly in front of himIts too late to run awayAnd the feline does seem so placidSo summoning up all his courageHe steps across the lionNothing happensAnd so with much relief the guy begins to resume his journeyWhen none of the sudden the policeman steps aside out of the forestHe grabs the guy by the armAnd says to himYoure under arrestThe guy cant beleave it He saysTell me officer whats the chargeAnd the policeman saysTransporting young gulls across the staid lion for immoral porpoises,1385137952.0,So this guy who works in an aquarium,63,jokes,hot
ZinMan,1,5,1r9csd,6,The patient was smitten with his proctologist After receiving a clean bill of health he made another appointment anyway I told you last time there was nothing wrong the proctologist saidPlease look again I think there something in there said the patientThe proctologist started his exam and exclaimed Jesus there IS something in hereHe reached in and pulled out a bouquet of flowersGood God there was a bouquet of flowers up your ass said the proctologistLooking back over his shoulder the patient exclaimed Read the card read the card ,1385170534.0,Smitten Patient,11,jokes,hot
Frreek,6,30,1r8k34,14,Nothing they were both stuck up bitches,1385149094.0,What did one tampon say to the other,44,jokes,hot
tttttttttttttty,6,24,1r8b7v,20,I dont have a Cadillac in my garage,1385142820.0,What is the difference between a Cadillac and five dead Asian hookers,44,jokes,hot
UNSCNova,4,22,1r7vs1,39,A husband and wife went out to dinner They settled in a nice steak restaurant and begin ordering The man told the waiter I would like a regular sirloin steak The waiter asks and the doneness The man says  I would like it bloodyrare The concerned waiter asks what about MadCow The man replies Oh she can order for herself,1385131198.0,A husband and wife went out to dinner,61,jokes,hot
HypnoCin,1,9,1r981e,4,Poor Bob dies and his spirit heads up to Heaven  But at the Pearly Gates hes told that he hasnt been good enough he has to go down to Hell instead  So he does and when he gets there theres a long line of spirits waiting to be processed into Hell  Bob watches for a while and sees that Satan seems to be sending some people off to the right through a big door and other people would be tossed into a big pit of huge flames to the left  But once in a while Satan would appear to deliberate over a person and then just chuck them into a pile off to the side  When he finally made it to the front of the line Bob couldnt help himself he just had to know he asked Satan Why didnt you throw those people in the pile into the pit of fire Satan put his hands on his hips and shook his head frustrated  Oh those people are from Seattle  Theyre too wet to burn ,1385166557.0,Poor Bob in Hell,13,jokes,hot
jollyerich,137,1965,1r53pz,2311,A wealthy lawyer was riding in his limousine when he saw two men along the roadside eating grass Disturbed he ordered his driver to stop and he got out to investigate He asked one man Why are you eating grass We dont have any money for food the poor man replied We have to eat grass Well then you can come with me to my house and Ill feed you the lawyer said But sir I have a wife and two children with me They are over there under that tree Bring them along the lawyer replied Turning to the other poor man he stated You come with us also The second man in a pitiful voice then said But sir I also have a wife and SIX children with me Bring them all as well the lawyer answered They all entered the car which was no easy task even for a car as large as the limousine Once underway one of the poor fellows turned to the lawyer and said Sir you are too kind Thank you for taking all of us with you The lawyer replied Glad to do it Youll really love my place the grass is almost a foot high,1385045838.0,A wealthy lawyer was riding in his limousine when he saw two men along the roadside eating grass,4276,jokes,hot
WaterproofThis,4,15,1r7wou,25,She kept sitting on Pinocchios face and screaming Lie to me Pinocchio Lie to me,1385132043.0,Did you hear about the woman banned from Disney World,40,jokes,hot
marycartlizer,3,13,1r9agt,5,A man goes to the doctor and tells him that he and his wife are not enjoying sex as much any more  The doctor asks How old are you and your wife The man says We are both The doctor asks When did you first start noticing thisThe man answers Well three times last night and twice this morning  ,1385168515.0,Old man and his wife are not enjoying sex as much,18,jokes,hot
sumitpnp,8,29,1r7pzx,31,Two guys are in a locker room when one guy notices the other guy has a cork in his ass He says Howd you get a cork in your ass The other guy says I was walking along the beach and I tripped over a lamp There was a puff of smoke and then a red man in a turban came oozing out He said I am Tonto Indian Genie I can grant you one wish And I said No shit,1385124920.0,Indian Genie,60,jokes,hot
Cheekyburrito,1,16,1r7my4,37,Santa stops at three Hos,1385120414.0,Whats the difference between Santa Claus and Tiger Woods,53,jokes,hot
Cygnus,2,18,1r88f8,11,A Green Bean,1385140809.0,What do you call an environmentallyconscious Mexican,29,jokes,hot
thefieldsofdawn,8,88,1r6spw,194,Jesus and Satan were having an ongoing argument about who was better on his computer They had been going at it for days and God was tired of hearing all of the bickeringFinally God said Cool it I am going to set up a test that will run two hours and I will judge who does the better jobSo Satan and Jesus sat at the keyboards and typed away They moused They did spreadsheets They wrote reports They sent faxes They sent email They sent out email with attachmentsThey downloaded They did some genealogy reports They made cards They did every known jobBut ten minutes before their time was up lightning suddenly flashed across the sky thunder rolled the rain poured and of course the electricity went offSatan stared at his blank screen and screamed every curse word known in the underworld Jesus just sighedThe electricity finally flickered back on and each of them restarted their computers Satan started searching frantically screaming Its gone Its all gone I lost everything when the power went outMeanwhile Jesus quietly started printing out all of his files from the past two hours Satan observed this and became irate Wait He cheated how did he do itGod shrugged and said Jesus savesSourcehttpwwwsquarewheelscomjokescomputerjokeshtml,1385087350.0,An unholy competition,282,jokes,hot
Japanimekid,13,41,1r77h6,102,My girlfriend never laughs at my jokes,1385099090.0,Whats the difference between my dick and my jokes,143,jokes,hot
Khanzi,5,14,1r7spe,22,You know if a house is Jewish on Christmas if theres a parking meter on the roof,1385128143.0,Jewish house on Christmas,36,jokes,hot
dsade,2,9,1r7wei,18,Mein Camphor,1385131761.0,What does a Nazi reach for when he has a head cold,27,jokes,hot
Pyrteknix,4,22,1r8830,10,Depends on which direction she wipes,1385140567.0,How many calories do you get from eating pussy,32,jokes,hot
Lighterless,4,8,1r9rmi,0,She wore her New JerseyWhy did CaliforniaShe called to ask HawaiiWhere did ChicagoThe same place OregonWhere has Oregon I dont know but AlaskaShe said she went to pay her TexasWhat did MissisipShe sipped a MinnesotaWhat did TennesseeThe same thing ArkansasHow did WisconsinHe robbed an Oklahoma using a Kentucky httpwwwyoutubecomwatchvNztfOSyCCFM,1385184425.0,What Did Delaware,1,jokes,hot
AjsIrish,6,23,1r6xtk,70,Why are librarians so lonelyTheyre always by them shelvesJust wanted to see if that library joke checked outSorry for all the library jokes Ill put them on hold,1385091104.0,Library joke,93,jokes,hot
sean,15,100,1r6cib,146,So they dont get mistaken for feminists ,1385075753.0,Why do sumo wrestlers shave their legs,246,jokes,hot
DoorNamedDan,3,43,1r6mf7,93,A Jewish lady calls the New York Times and says I want an obituary for my husband The person at the times says its  a word  a word The lady exclaims Fine she says Burnstein dies The lady says there is a minimum of  words Fine she grumbles Burnstein dies Buick for sale EDIT Holy Moly front page Id like to thank everyone You all are amazingEDIT  Quote marks,1385082756.0,A Jewish lady wants an obituary for her husband,136,jokes,hot
TommyKitten,10,24,1r707t,51,Wookie error,1385092967.0,When Chewbacca was learning his bowcaster skills he accidentally shot himself in the foot,75,jokes,hot
curdt,29,72,1r6803,150,,1385072772.0,Here is a joke for all the mind readers and psychics,222,jokes,hot
LarsEl,5,28,1r7bis,28,A small medium at large,1385103237.0,What do you call a little person who can talk to ghosts and just escaped from prison,56,jokes,hot
jdlincicome,4,16,1r985c,0,Is it shoplifting,1385166637.0,If I rape a prostitute,9,jokes,hot
chnaideur,6,23,1r6sag,53,and so the couple decides to ask their rabbi for advice Easy he says When you make love get a young man to shake a towel above the two of you while you are doing it They decide to go for it and get the strapping chap from next to door to awkwardly stand there shaking the towel above them while they copulate and nothing happensDisappointed they return to the Rabbi who suggests that next time perhaps the husband and the young man should swap places Theyre not too sure about this one but the situation is quite dire So here they are the guy from next door is having sex with the wife while the husband is shaking the towel when suddenly the wife has this screaming windowshattering orgasm At this point the husband gets really angry and yells Cant you see THATs how youre supposed to shake the towel,1385087053.0,A Jewish wife isnt getting any joy in bed,76,jokes,hot
pigshaveflown,10,28,1r6pws,42,He goes up to the bartender and asks Got any grapes The bartender replies No sorry this is a bar We dont have any grapes The duck turns and leaves The next day the duck returns to the bar and again asks the bartender Got any grapes The bartender slightly flustered at this point says No This is a bar We do not have grapes we have never had grapes and we will almost definitely never have grapes The duck turns and leaves The following day the duck once again returns to the bar and once more asks the bartender Got any grapes The bartender shouts No We do not have any grapes And the next time you ask I swear I will nail your beak to this bar The duck quickly waddles away in fright A day later the duck cautiously approaches the bar As the bartender glares the duck asks Got any nails With a surprised and confused expression the bartender replies No With a pleased expression the duck responds Good Got any grapes,1385085347.0,A duck walks into a bar,70,jokes,hot
Jonny,2,21,1r6niz,38,A mans sitting next to a dog at the bar     Woman walks in Is your dog friendly  Im a dog lover can I pet him     Man replies sure     Dog proceeds to bite woman      Irate woman to the man I thought you said your dog was friendly       Man replies  That aint my dog,1385083540.0,Dog at the bar,59,jokes,hot
Mateoheo,8,51,1r67hm,66,A man goes to the doctor and says doctor I have pain all over my body everywhere I touch hurt He then proceeds to point to various parts of his body cringing in pain The doctor gives him a thorough examination and concludes Sir it appears you have a broken finger,1385072442.0,Man goes to a doctor,117,jokes,hot
Teckel,2,24,1r6nov,40,They make up everything,1385083670.0,Never trust an atom,64,jokes,hot
JustinBandana,1,15,1r8psy,0,A mother asks her sonWhat do you write at the end of a sentenceMmmmh a com,1385153024.0,Short joke about the computerera generation,8,jokes,hot
Lavarekira,4,10,1r7tk2,3,Slow children,1385129062.0,What is my favorite street sign,13,jokes,hot
brando,1,11,1r8l2v,0,dingdingdingdingdingding,1385149792.0,what does the fox say,3,jokes,hot
VVega,2,30,1r690s,46,Its not hard,1385073455.0,How do you spot a blind man at a nudist colony,76,jokes,hot
sgtchokenstroke,1,10,1r6mz9,25,Youll integrate something you dont need,1385083136.0,Never drink and derive,35,jokes,hot
Whiterthanjew,9,38,1r6rmt,21,Because  is a registered  offender Not because  ,1385086587.0,Why was  afraid of ,59,jokes,hot
OldManMullet,2,18,1r6ske,16,Q What do you call a hipster with a speechimpedimentA Mumblr Q Why do hipsters love iceA Because ice was water before it was cool Q Why are all the ugly chicks hipstersA Because beauty is just too MainstreamQ How many hipsters does it take to screw in alightbulbA You wouldnt know its kind of an obscurenumber Q How do you drown a hipsterA In the mainstream Q Why did the hipster leave his oceansidemansionA It was too current Q How much does a hipster weighA An instagram,1385087239.0,some hipster jokes,34,jokes,hot
buddyolpal,4,16,1r69ba,30,because three Wrights make a left,1385073641.0,Why did the Wright brothers turn their aircraft  degrees west when their dad walked in the cockpit,46,jokes,hot
verger,2,13,1r70vh,12,And Mickey replied I didnt say she was being silly I said she was fucking Goofy,1385093512.0,The judge said Mickey You cant divorce Minnie for being silly,25,jokes,hot
MagnaMike,4,8,1r668g,32,It was a good bonding experience,1385071623.0,Two students became friends in chemistry class,40,jokes,hot
MEGACLOPS,2,12,1r64jk,24,but none of the applicants were koalafied,1385070508.0,I wanted to hire a marsupial butler,36,jokes,hot
frogsrbetter,39,471,1r3q2j,999,Your mom cant take a joke ,1384995360.0,Whats the difference between three dicks and a joke,1470,jokes,hot
likethemapples,16,45,1r590c,60,Nothing it just wavedSea what I did there Im shore you did Laugh you son of a beach,1385049799.0,What did one ocean say to the other,105,jokes,hot
wpiman,2,36,1r4u68,114,What is the difference between a inlaws and outlawsOutlaws are wanted,1385035517.0,Inlaws,150,jokes,hot
francisrocks,2,17,1r7rwl,1,Earlier people used to remove their hats to give respect and our new generation removes head phones to give respect Source httpwwwmobitexternetappshareagxzfmvYmlZXhZXJyDAsSANtcxikYAlDApage,1385127246.0,Hats Vs Head Phones,18,jokes,hot
Reconius,2,8,1r6lq0,8,Achoo Achoo,1385082240.0,What does a sick train say,16,jokes,hot
spongebob,18,112,1r4u0s,101,a command,1385035274.0,If iron man is a superhero whats iron woman,213,jokes,hot
atodaso,2,22,1r5ayu,23,Im not sure but their flag is a big plus,1385051169.0,Whats the best thing about Switzerland,45,jokes,hot
Cryovenom,4,19,1r58nx,23,Hebrews,1385049566.0,How does Moses make beer,42,jokes,hot
Fileobrother,4,18,1r7er3,0,The judge began reading the charges and the man burst out laughing He was giggling uncontrollably The judge was so angry he had the bailiff take the man out immediately When asked layer what made him so angry the judge replied It was the mans laughter,1385107392.0,A man went to court for running over and killing an elderly womanOC,10,jokes,hot
AalphaQ,0,12,1r5x4t,8,A guy goes into a liquor store and the guy behind the counter asks if he needs any help He says Ill take a case of beer please Anything but Guinness Clerk Sure buddy but whats wrong with Guinness Its one of our top sellersGuy I dont have anything bad to say about the taste or anything like that its just that the last time I drank a case of Guinness to myself I blew chunksClerk I dont think Guinness is your issue If you drink a case of any beer to yourself you will blow chunksGuy No sir you dont understand See Chunks is my dog,1385065836.0,Anything but Guinness,20,jokes,hot
The,0,6,1r60zu,7,and the doctor tells him he has dyslexia The man replies Dyslexia I just met her,1385068246.0,A man goes to the doctor,13,jokes,hot
LeavesItHanging,50,256,1r2uke,674,You should go up to a person and start telling them thisThere are three bees stuck in a jar Two females and one male The females want to get out of the jar and the male knows how to get out of the jar One of the females goes to the male and asks him How do I get out of this thing The male bee is very horny and he replies Fuck me and Ill tell you Out of desperation the female bee fucks him and says Now tell me how to get out of this jar The male keeps his promise and tells the female bee to go round the corner and shoot upwards the jar lid will pop open She complies and does what he said she goes round the corner and goes up but she hits the lid so hard that she dies and it lid remains closedNow there is one male and female bee The last female bee is also desperate to get out so she goes to the male bee and asks him How do I get out of this jar The male bee being very horny says again Fuck me and Ill tell you The female being equally desperate fucks him and he tells her how to get out go round the corner and shoot upwards the jar lid will pop open Same advice he gave to the first bee The second female bee listens to him and she goes round the corner and shoots upwards she too hits the lid and falls down and diesNow the male bee is remaining alone in the jar He feels lonely and he knows how to get out of the jar So he does what he told the female bees goes round the corner and shoots up The jar pops open and he leavesAt this point the person youre telling it to would be like HowTo which you should reply Fuck me and Ill tell you,1384974956.0,Three bees in a jar,930,jokes,hot
efie,16,93,1r3k0h,257,The food is good but the atmosphere is terrible,1384991241.0,Did you hear about the new restaurant on the moon,350,jokes,hot
sassageflare,1,11,1r63a1,4,he then goes up to the barkeep and says sir Id like to order  shots of vodka and a round for everybodySo the barkeep fulfills his orders and serves the happy man his drink curious he asks hey man why are you so happy todayTodays the day that I got into an orgy for the st time ever the man saysThe barkeep pours the man another shot and says congrats man heres another on the houseThe man then says thanks but I dont know if thats enough to wash the taste of dick out of my mouth,1385069684.0,A man happily walks into a bar,15,jokes,hot
SkinnyDrunkArtist,7,14,1r74ah,0,This is just an entertaining game that creates joy Have fun ,1385096295.0,Some tell the first half of a joke then someone else make up the end of it,13,jokes,hot
SGrumpy,0,8,1r5odv,5,Hello said the barman what can I get you Ill have a whisky if I mayCertainly sir which would you fancyWell Im not sure what do you haveAh  lets see we have Black amp White or Cutty Sark  we even have one named after you sirReally Eric,1385060146.0,A white horse walks into a bar,13,jokes,hot
TheKetoLyfeChoseMe,1,10,1r5b9y,9,but that doesnt stop me from trying,1385051401.0,Its hard to imagine someone getting any pleasure from beastiality,19,jokes,hot
Randomflyingobject,2,23,1r4xkv,16,You cant get kids to eat broccoli,1385039902.0,Whats the difference between broccoli and boogers,39,jokes,hot
themndiddy,66,923,1r21l4,1349,AspareIguess,1384953175.0,What does a vegetable get in bowling,2272,jokes,hot
snowman,1,12,1r6zvm,0,First you cut a hole in the ice then you sprinkle some pees around the hole When the polar bear goes to take a pee you kick him in the ice hole,1385092709.0,How do you get a polar bear in the water,4,jokes,hot
guianet,2,10,1r6rzs,0,bacan la cancion,1385086858.0,Kalimba  Tocando Fondo,4,jokes,hot
jerrylovesbacon,0,5,1r5bgt,5,Its the thought that cunts,1385051542.0,I bought a Valentines Day card for everyone at our local Tourettes Society,10,jokes,hot
mczplwp,1,11,1r6qmr,0,My wife and I at Cracker Barrel tonight I looked around and said looks like were having dinner at the nursing home,1385085901.0,Dinner at Cracker Barrel,8,jokes,hot
kunair,12,78,1r2w9q,247,Because he knows where all the naughty girls live,1384976058.0,Why is Santa so jolly,325,jokes,hot
sassageflare,1,16,1r6jdv,0,I simply go on YouTube search for Skrillex videos and read the commentsInstantly I feel a lot better,1385080566.0,Whenever Im feeling like shit,9,jokes,hot
stealingfrom,1,13,1r6hna,0,He walks the rest of the way makes his appointment and tells the doc what happenedDoctor tells him Say AAA,1385079329.0,Guy has a sore throat and is on the way to the doctors office when his car breaks down,11,jokes,hot
DeadCabbie,7,13,1r6gg2,0,If youre sailing through the desert and your house gets a flat how many flapjack a would it take to put that motherfucker up on stilts,1385078475.0,A puzzling amount of nonsense,6,jokes,hot
Adr,0,8,1r6ell,0,No Its because A peace if crap was already taken,1385077153.0,You know why itd called modern jazz right,1,jokes,hot
kokain,9,88,1r2g2x,294,A man and a woman are sitting beside each other on a flight to New YorkThe woman sneezes takes out a tissue gently wipes her nose and then visibly shudders for about ten secondsA few minutes later the woman sneezes againOnce more she takes a tissue wipes her nose and then shuddersA few more minutes pass before the woman sneezes and violently shudders againCurious the man says I cant help noticing that you shudder every time you sneeze Are you OK Im so sorry if Im disturbing you says the woman Im suffering from a very rare medical condition Whenever I sneeze I have an orgasmAre you taking anything for it he asks Yes  says the woman Pepper ,1384965499.0, Im suffering from a very rare medical condition,382,jokes,hot
justsomenoname,1,12,1r6cpx,0,None In Soviet Russia light bulb changes you,1385075894.0,How many Soviets does it take to change a light bulb,2,jokes,hot
laxerado,9,108,1r2jlg,245,The first guy walks up to the bar and sits down The bartender asks him what hes drinking The man says Ill have a rum and coke The bartender then reaches behind the bar and after a couple seconds the bartender hands him and apple What the hell is this I asked you for a rum and coke damnit the bartender looks to him and says Trust me just eat No way man this is an apple I want my drink Trust me says the bartender So the guy decides ehh why not and bites into it Whoa he exclaims That tastes like rum Flip it over says the bartender And so he does Whoa he exclaims again this side tastes like coke Thats amazing how did you do that The bartender says nothing and gives the man a wink The second guy walks in sits down and orders a gin and tonic then goes through the same thing as the first and finally bites into it Whoa he says that tastes like gin Flip it over says the bartender That tastes like tonic Thats amazing And now the third guy walks up with the first two explaining to him how awesome this bartender is These apples taste just like the drinks we ordered exclaimed the first He can make it taste like anything you want says the second guy Anything the third guy asks Well Mr Bartender in that case I want one that tastes like pussy Thinking he had him stumped the bartender shrugs and after a couple seconds hands him an apple He bites into it and immediately spits it out This apple tastes like Shit he yelled The bartender replies flip it over,1384967799.0,Three guys walk in to a bar,353,jokes,hot
Nutty,4,14,1r698n,0,With an umbrella,1385073597.0,How did the cops stop the killers reign of terror,10,jokes,hot
Koyoteelaughter,1,8,1r68di,0,It would taste like just us,1385073010.0,If a giant capture you and me and made a smoothie out of us what would it taste like,2,jokes,hot
