author,comments,downvotes,id,score,selftext,time_created,title,upvotes,subreddit,type
malleusmaleficarum,64,766,1qsndq,1386,Three couplesan elderly couple a middleaged couple and a young newlywed couplewanted to join a Baptist church The pastor says We have special requirements for new parishioners You must abstain from having sex for two weeksThe couples agreed and came back at the end of two weeksThe pastor goes up to the elderly couple and asks Were you able to abstain from sex for the two weeksThe old man replies No problem at all PastorCongratulations Welcome to the church said the pastorThe pastor goes to the middleaged couple and asks Well were you able to abstain from sex for the two weeksThe man replied The first week was not too bad The second week I had to sleep on the couch for a couple of nights but yes we made itCongratulations Welcome to the church said the pastorThe pastor then goes to the newlywed couple and asks Well were you able to abstain from sex for two weeksWell Pastor we were not able to go without sex for the two weeks the young man repliedWhat Happened inquired the pastorMy wife was reaching for a light bulb on the top shelf and dropped it When she bent over to pick it up I couldnt help myself and we had sex right there on the floorThe pastor said Well then youre not welcome in the Baptist churchThats OK said the young man Were not welcome at the supermarket anymore either,1384650453.0,You must abstain from sex for two weeks,2152,jokes,hot
FeelingSassy,0,8,1qwh8d,0,adfcdecadddbdcbdafPM me the answer,1384790570.0,How Many Bit Coins Does it take to screw in a Lightbulb,3,jokes,hot
kokain,6,110,1qtx4m,67,A fucking Goodyear  ,1384707695.0,If you had sex  times in one year and melted the rubbers down to make a tire what would you call it,177,jokes,hot
Brakula,4,16,1qv6t9,13,when daddy tomato and mommy tomato noticed that baby tomato had started to fall behind so daddy tomato went back to the baby and stomped on him and said Ketchup,1384741379.0,The tomato family was walking down the street,29,jokes,hot
FeelingSassy,2,9,1qwg11,0,Ive only ever been caught stealing cookies,1384789609.0,Whats The difference between Stealing Cookies from a Jar and Child Molesting,3,jokes,hot
GettinEtDone,0,10,1qwa6e,0,Its alright but just feels like another form of escaphism,1384784723.0,Ive been playing this online game where you mostly end up immobilised and eaten alive by insects,4,jokes,hot
bavasava,4,65,1qtruc,57,My three favorite things,1384702836.0,Chicken Pot Pie,122,jokes,hot
socool,9,17,1qu5v4,28,After a long night at performing at a local restaurant  an accordion player goes to have a few late night drinks He drives up to the bar and goes inside After finishing his first drink he realizes he left his car unlocked He rushed outside opened the trunk of his carbut it was too latea nd accordion was already there ,1384714362.0,An accordion player goes to a bar warning dumb joke,45,jokes,hot
IrrevrentHoneyBadger,4,25,1qu2a7,34,A woman was very distraught at the fact that she had not had a date or any sex in quite some time She was afraid she might have something wrong with her so she decided to seek the medical expertise of a sex therapist Her doctor recommended that she see Dr Chang the wellknown Chinese sex therapist so she went to see himUpon entering the examination room Dr Chang said OK take off all you crose The woman did as she was told Now get down and craw reery reery fass to odder side of room Again the woman did as she was instructed Dr Chang then said OK now craw reery reery fass back to me So she didDr Chang shook his head slowly and said Your probrem vewy bad You haf Ed Zachary Disease Worse case I ever see Dat why you not haf sex or datesWorried the woman asked anxiously Oh my God Dr Chang what is Ed Zachary DiseaseDr Chang looked the woman in the eye and replied Ed Zachary Disease is when your face rook Ed Zachary rike your ass,1384711742.0,Ed Zachary Disease,59,jokes,hot
LGC,2,10,1quhdv,19,Because its still dressing ,1384722721.0,Why shouldnt you look at a cup of ranch,29,jokes,hot
PBnJX,2,17,1qu3ie,24,What do you call the area between a womans vagina and butt holeThe driving range because thats where I hit my balls,1384712615.0, holes,41,jokes,hot
iknewaguyonce,5,8,1qtzkc,20,Stranded ,1384709691.0,What do you call a black man thats hitch hiking,28,jokes,hot
cholong,5,12,1qvkso,3,I am a long object You put me in your mouth and shake me Then you either swallow or spit out white liquid  Yes it is me your toothbrush,1384751918.0,Guess who i am,15,jokes,hot
omailnumber,23,137,1qspiw,279,Tom is cruising down the highway way over the speed limit Cop pulls him overSorry officer guess the speedometer got away from me Happens every time I get hammered and try to drive homeWhat Youre intoxicatedWell I needed a stiff drink after I shot that guy Its okay though I managed to fit the body in the trunkSir keep your hands where I can see them Give me your license and registration right nowWell I would but its in the glove box where I threw the gun its still pretty bloody and I dont want it to fall out until its driedDo Not Move Im calling for backupBackup gets there Second officer gets out and saysSir please open your trunkTom opens it Clean as a whistlePlease show me your glove boxTom opens it Clean as a whistle along with his license and registrationIll need you to take a breathalyzerTom blows a Well whats going on This officer said you had a dead body in the trunk a bloody gun in the glove box and were drunkTom saysHa I bet he said I was speeding too,1384652319.0,Speeding,416,jokes,hot
Starzajo,3,11,1qvs7l,0,He did this in the Sahara Rain Forest ,1384759241.0,Chuck Norris farted once,6,jokes,hot
thefonztm,0,17,1qtp2o,21,The brain said that it was the most important since it did all the thinking The heart thought it was the most important since it pumped all the blood The lungs said they were the most important since the gathered the fresh air Suddenly from the back the asshole spoke upIm the most important because without me you are all full of shit,1384699684.0,All the parts of the body were arguing about who was the most important,38,jokes,hot
austinator,2,7,1qtwnm,12,But it slipped It seems as though my efforts wereFruitless,1384707285.0,So I was trying to grab a grape with my fork,19,jokes,hot
kokain,76,812,1qrf0d,1562,A man a sheep and a dog were survivors of a terrible shipwreck They found themselves stranded on an islandAfter being there a while they got into the habit of going to the beach every evening to watch the sun go down One particular evening the sky was red with beautiful cirrus clouds the breeze warm and gentlea perfect night for romanceAs they sat there the sheep started looking better and better to the man Soon he leaned over to the sheep and put his arm around it But the dog got jealous growling fiercely until the man took his arm from around the sheep After that the three of them continued to enjoy the sunsets together but there was no more cuddlingA few weeks passed by and lo and behold there was another shipwreck The only survivor was a beautiful young woman the most beautiful woman the man had ever seen She was badly injured when they rescued her and they slowly nursed her back to health When the young maiden was well enough they introduced her to their evening beach ritual It was another beautiful evening red sky cirrus clouds a warm and gentle breezeperfect for a night of romancePretty soon the man started to get those feelings again He fought them as long as he could but he finally gave in leaned over to the young woman and cautiously whispered in her ear  Would you mind taking the dog for a walk ,1384613679.0,A man a sheep and a dog were stranded in an island,2374,jokes,hot
copopeJ,9,38,1qsuav,135,Dont worry he was cured,1384656511.0,Did you hear about the guy addicted to eating salt,173,jokes,hot
omailnumber,9,81,1qt25o,66,A Marine boarded a train on his way home from deploymentThe train was quite crowded and the Marine walked the entire length looking for a seat There seemed to be one next to a welldressed middleaged French woman but when he got there he saw it was taken by the womans poodle The warweary Marine asked Maam may I have that seatThe French woman sniffed and said to no one in particular Americans are so rude My little Fifi is using that seatThe Marine walked the entire train again but the only seat available was under that dog Please Maam May I sit down Im very tired She snorted Not only are you Americans rude you are also arrogant This time the Marine didnt say a word he just picked up the little dog tossed it out the train window and sat downThe woman shrieked Someone must defend my honor Put this American in his place An English gentleman sitting nearby spoke upSir you Americans seem to have a penchant for doing the wrong thing You hold the fork in the wrong hand You drive your autos on the wrong side of the road And now sir you seem to have thrown the wrong bitch out the window,1384664014.0,The Window,147,jokes,hot
ZinMan,2,9,1qv7ai,1,It reached just to the back of her sisters throat,1384741743.0,My wife caught me measuring my dick Embarrassing,10,jokes,hot
MoralLesson,3,27,1qt3ap,43,Abominable say it out loud slowly,1384665148.0,What do you call it when you feed a stick of dynamite to a steer,70,jokes,hot
ThePrinterDoesntWork,1,10,1qux1v,0,It was out of this world because the amount of suspense was astronomical However I didnt like Sandra Bullock because she didnt really seem down to earth But all in all the movie was pretty stellar,1384734186.0,I saw the movie Gravity yesterday,4,jokes,hot
settlers,8,19,1qt5mh,28,NEW MEXICO CHILI COOK OFFIf you can read this whole story without laughing then theres no hope for you I was crying by the end This is an actual account as relayed to paramedics at a chili cookoff in New Mexico For those of you who have lived in New Mexico you know how true this is They actually have a Chili Cookoff about the time Halloween comes around It takes up a major portion of a parking lot at the Santa Fe Plaza Judge  was an inexperienced Chili taster named Frank who was visiting from Springfield ILFrank Recently I was honored to be selected as a judge at a chili cookoff The original person called in sick at the last moment and I happened to be standing there at the judges table asking for directions to the Coors Light truck when the call came in I was assured by the other two judges Native New Mexicans that the chili wouldnt be all that spicy and besides they told me I could have free beer during the tasting so I accepted and became Judge Here are the scorecard notes from the eventCHILI    MIKES MANIAC MONSTER CHILEJudge    A little too heavy on the tomato Amusing kickJudge    Nice smooth tomato flavor Very mildJudge   Frank  Holy crap what the hell is this stuff You could remove dried paint from your driveway It took me two beers to put the flames out I hope thats the worst one These New Mexicans are crazyCHILE    EL RANCHOS AFTERBURNER CHILEJudge    Smoky with a hint of pork Slight jalapeno tangJudge    Exciting BBQ flavor needs more peppers to be taken seriouslyJudge    Keep this out of the reach of children Im not sure what Im supposed to taste besides pain I had to wave off two people who wanted to give me the Heimlich maneuver They had to rush in more beer when they saw the look on my faceCHILI    ALFREDOS FAMOUS BURN DOWN THE BARN CHILIJudge    Excellent firehouse chile Great kickJudge    A bit salty good use of peppersJudge    Call the EPA Ive located a uranium spill My nose feels like I have been snorting Drano Everyone knows the routine by now Get me more beer before I ignite Barmaid pounded me on the back now my backbone is in the front part of my chest Im getting faced from all of the beerCHILI    BUBBAS BLACK MAGICJudge    Black bean chile with almost no spice DisappointingJudge    Hint of lime in the black beans Good side dish for fish or other mild foods not much of a chileJudge    I felt something scraping across my tongue but was unable to taste it Is it possible to burn out taste buds Sally the beer maid was standing behind me with fresh refills This  lb woman is starting to look HOT  just like this nuclear waste Im eating Is chili an aphrodisiacCHILE    LISAS LEGAL LIP REMOVERJudge    Meaty strong chili Jalapeno peppers freshly ground adding considerable kick Very impressiveJudge    Chili using shredded beef could use more tomato Must admit the jalapeno peppers make a strong statementJudge    My ears are ringing sweat is pouring off my forehead and I can no longer focus my eyes I farted and four people behind me needed paramedics The contestant seemed offended when I told her that her chili had given me brain damage Sally saved my tongue from bleeding by pouring beer directly on it from the pitcher I wonder if Im burning my lips off It really ticks me off that the other judges asked me to stop screaming Screw themCHILE    VARGAS VERY VEGETARIAN VARIETYJudge    Thin yet bold vegetarian variety chili Good balance of spices and peppersJudge    The best yet Aggressive use of peppers onions garlic SuperbJudge    My intestines are now a straight pipe filled with gaseous sulfuric flames I crapped on myself when I farted and Im worried it will eat through the chair No one seems inclined to stand behind me except that Sally Cant feel my lips anymore I need to wipe my butt with a snow coneCHILE    SUSANS SCREAMING SENSATION CHILIJudge    A mediocre chili with too much reliance on canned peppersJudge    Ho hum tastes as if the chef literally threw in a can of chili peppers at the last moment I should take note that I am worried about judge number  He appears to be in a bit of distress as he is cursing uncontrollablyJudge    You could put a grenade in my mouth pull the pin and I wouldnt feel a thing Ive lost sight in one eye and the world sounds like it is made of rushing water My shirt is covered with chili which slid unnoticed out of my mouth My pants are full of lava to match my shirt At least during the autopsy theyll know what killed me Ive decided to stop breathing Its too painful Im not getting any oxygen anyway If I need air Ill just suck it in through the inch hole in my stomachCHILE    BIG TOMS TOENAIL CURLING CHILEJudge    The perfect ending this is a niceblend chile Not too bold but spicy enough to declare its existenceJudge    This final entry is a good balanced chili Neither mild nor hot Sorry to see that most of it was lost when Judge  farted passed out fell over and pulled the chili pot down on top of himself Not sure if hes going to make it Poor feller wonder how hed have reacted to really hot chiliJudge    No Report,1384667588.0,New Mexico Chili Cookoff,47,jokes,hot
brianw,1,14,1qt4qv,28,A traveling salesman trying to make a buck was driving through the plains of Nebraska when he decided to stop at a farmhouse coming up on his leftAs he was walking up the driveway toward the front door of the house a pig with three legs caught his eye It was just hobbling through the grassWhen the farmer answered the door and asked what he was selling the salesman first asked about the three legged pigThat pig is the most amazing pig in the land son The farmer saidLast year our house caught fire when we were all asleep and that pig ran in and woke us all up one by one and saved our livesThe salesman was surprised That is one special pig He saidThe Farmer replied Thats not all Last summer that pig jumped into the pond and dragged my drowning son to safety He would have diedThe salesman was in disbelief as to how incredible this pig was One question Why does he have  legs is it from the fire He askedNo son ya see a pig like that you just dont eat all at one time,1384666658.0,Three legged Pig,42,jokes,hot
ZapThis,24,100,1qrpvj,257,Three guys talk in a bar Two discuss how they are kings in their castles and how much their wives respect them The third guy remains quietFinally one guy turns to the quiet guy and asks What about you Do you rule your roostThe quiet guy says Well just the other night my wife came to me on her hands and kneesWhat happened then they askShe said Get out from under the bed you son of a bitch and fight like a man,1384623763.0,REAL MEN,357,jokes,hot
sean,10,51,1qspo4,62,A Chinese man living in London went to the bank and asked the banker Why I have less money in my account than yesterday The banker replied Fluctuations The Chinese man said Oh yeah Well fluck you Blitish too,1384652443.0,Chinese man in a London bank,113,jokes,hot
TheDoctor,10,51,1qsk9s,71, it becomes a show where people pay money to ask questions,1384647849.0,If you watch Jeopardy backwards,122,jokes,hot
eciujc,7,37,1qshul,71,Abe the rancher was having issues with his stock because his prized bull would not mate Abes friends told him to try a vaginal smear technique They told Abe to get a cow and rub the vaginal juices and then rub it onto and under the bulls noseSure enough Abes prized bull when crazy and began to mate that dayAfter a long day of success Abe headed back to his home where his wife was sound asleep He saw his wife laying there and though maybe hed give the vaginal smear technique at try on himself He reached into her panties fondled around and smeared the juices all over his nose Instantly he felt a surge he was up and ready to go He tried to wake up his wife Honey Honey get up I have something important to show youAbes wife looked at him in shock Abe You woke me up to tell me you had a nose bleed,1384645802.0,Rancher Abe and his mating bull,108,jokes,hot
moodybastard,1,7,1qthbw,6,A turkey was chatting with a bull I would love to be able to get to the top of that tree sighed the turkey but I havent got the energy Well why dont you nibble on my droppings replied the bull Theyre packed with nutrients The turkey pecked at a lump of dung and found that it gave him enough strength to reach the lowest branch of the tree The next day after eating some more dung he reached the second branch Finally after a fourth night there he was proudly perched at the top of the tree Soon he was spotted by a farmer who shot the turkey out of the treeMoral of the story Bullshit might get you to the top but it wont keep you there,1384686333.0,Real BullShit,13,jokes,hot
discordianizer,3,9,1qtydn,2,,1384708732.0,How many mathematicians does it take to screw in a light bulb,11,jokes,hot
lostinthesnow,18,78,1qrmcw,163,Goes up to the bartenderBear Hi Id like a ginand tonicBartender Sure but whats with the big pausebear looks at own paws,1384620866.0,A bear walks into a bar,241,jokes,hot
LycheeDemon,8,24,1qs4ws,76,Would you like anything to eat Mr BearThe bear respondsNo Im stuffed,1384635617.0,A little girl is having a tea party with her teddy bear and she asks it,100,jokes,hot
BobbyWestside,0,19,1qt4t2,15,or else Im going to get audited soon,1384666727.0,Ive really got to stop being so antisemitic,34,jokes,hot
Thatisafilthylie,0,7,1qt7pw,13,He says Doctor Ive been having sexual feeling towards my horseThe psychiatrist says How long have you been having these feelingsThe man responds About three monthsThe psychiatrist asks Is the horse a stallion or a mareThe man says A mare  Im not some kind of pervert,1384670055.0,A man goes into a psychiatrists office,20,jokes,hot
anotherbrokenhome,0,5,1qt5qz,10,A woman at a petting zoo bent down to pet a pony She began to cough violently A man came over to her an asked her to leave She saidWhat Its no big deal Im just feeling a little  hoarse,1384667718.0,Petting Zoo,15,jokes,hot
iglitz,0,10,1qtzub,0,Yo mama so old and so fat that when she sat down they called it the Cambrian mass extinction,1384709922.0,Yo Mama,2,jokes,hot
Morktorknak,2,19,1qsduz,26,A week before Lincoln was shot he was in Monroe Maryland A week before Kennedy was shot he was in Marilyn Monroe,1384642538.0,There was one similarity between Lincoln and Kennedys assassination that everyone overlooked,45,jokes,hot
Beernacle,0,10,1qt4y1,6,Decalfinated,1384666864.0,What do you call a cow that gets an abortion,16,jokes,hot
TACTICALOPERATORR,12,104,1qqzb6,428,They happen to walk by the condom display and the boy asks What are these DadTo which the man matteroffactly replies Those are called Condoms son Men use them to have safe sexOh I see replied the boy pensively Ive heard of that in health class at schoolHe looks over the display and picks up a package of  and asks Why are there  in this packageThe dad replies Those are for high school boys one for Friday one for Saturday and one for SundayCool says the boy He notices a  pack and asks Then who are these forThose are for college men the dad answers two for Friday two for Saturday and two for SundayWOW exclaimed the boy then who uses these he asks picking up a  packWith a sigh the dad repliedThose are for married menOne for January one for February one For March ,1384586730.0,A man walks into a drug store with his year old son,532,jokes,hot
ZinMan,3,5,1qt99i,5, A young couple having marital difficulties goes to a marriage counselor During the session the counselor talks about mixed emotionsThe husband turns to the wife and says yeah mixed emotions are okay I bet you cant say something that makes me both sad and happy at the same timeThe wife thinks for a second then says Your dick is bigger than all your friends dicks,1384672032.0,Happy and Sad,10,jokes,hot
FreyasCloak,0,6,1qt0rs,8,Its the one on the range,1384662614.0,There are three flies in the kitchen Which one is the cowboy,14,jokes,hot
kokain,5,51,1qr2u3,270,On their way to get married a couple gets into a fatal car accident They are sitting outside the Pearly Gates waiting for St Peter to turn up and register them While theyre waiting they wonder if they could possibly get married in heaven St Peter finally shows up and they ask himSt Peter says I dont know this is the first time anyones ever asked Let me go and find out and he leavesThe couple sits around for a couple of months and begins to wonder if they really should get married in heaven what with the eternal aspect of it all What if it doesn  t work out they wonder Are we stuck together foreverSt Peter returns after another month looking somewhat worn out Yes he informs the couple you can get married in heaven  Great   says the couple  but what if things dont work out Could we also get a divorce in heaven St Peter redfaced slams his clipboard onto the groundWhat  s wrong exclaims the frightened coupleChrist St Peter exclaims It took me three months to find a priest up here Do you have any idea how long its going to take me to find a lawyer ,1384592471.0,The problem with getting married in heaven,321,jokes,hot
NagaNooch,4,16,1qstbn,9,Did you hear about the two antennas that got married  The wedding sucked But the reception was AWESOME,1384655643.0,Reception,25,jokes,hot
oscartranman,49,760,1qq742,1368,Because they dont have windows ,1384559274.0,Dont fart in an apple store,2128,jokes,hot
HowTheyGetcha,4,37,1qrqi6,39,The diver went below another  feet and the guy joined him a few minutes later The diver went below  feet and minutes later the same guy joined himThis confused the diver so he took out a waterproof chalkboard set and wrote How the hell are you able to stay under this deep without equipmentThe guy took the board and chalk erased what the diver had written and scrawled Im drowning you moron,1384624287.0,A diver was enjoying the aquatic world  feet below sea level when he noticed a guy at the same depth but with no scuba gear whatsoever,76,jokes,hot
chrisnthat,5,13,1qsml2,11,Sit at the back and ting,1384649772.0,My friend just joined a Reggae band he plays the triangle He says its pretty easy all he has to do is,24,jokes,hot
MBArceus,2,8,1qtkjc,0,With a lot of beer,1384692788.0,I deal with my problems like how Coors makes money,5,jokes,hot
harveyc,9,17,1qrtgd,29,The shampoo bottle put him in an infinite loop,1384626780.0,Why did the computer scientist die in the shower,46,jokes,hot
jaydubya,0,14,1qs8by,17,Are you doing the Hokie Pokey,1384638252.0,If you poke a Virginia Tech fan,31,jokes,hot
Cletuspsu,7,26,1qrnaw,34,Ten,1384621649.0,How many tickles does it take to make an octopus laugh,60,jokes,hot
ShiShoSha,4,48,1qrkkz,31,   and asks the pharmacist for birth control for his twelveyear old daughter The pharmacist looks shocked and asks incredulously Your TWELVE yearold daughter is sexually active The man responds emphatically Hmmph I wish She mostly just lays there and cries,1384619297.0,Man walks into a pharmacy   ,79,jokes,hot
deadhead,0,18,1qsnmq,5,A general reads War and Peace another soldier asked him how he liked it liked the first half  hated the second  he said,1384650684.0,A general reads War and Peace,23,jokes,hot
peterjswift,1,11,1qsmxq,6,Dont worry theyll tell you,1384650069.0,How do you tell if someone is opposed to GMOs,17,jokes,hot
skweeds,11,43,1qr7mp,69,A brick,1384602103.0,Whats red and bad for your teeth,112,jokes,hot
kokain,8,119,1qqhd5,334,A paperboy is doing his monthly round of collecting money from customers One door is opened by a fairly sexy buxom woman who is wearing a transparent lace negligeeHi Missus Ive come for the paper money Its  please says our boy with his hand held outIm afraid Ive no money in the house the woman replies in a breathy voice but if you come in Im sure I can think of somethingSo our lad goes in and the woman throws herself back on the fireside rug pulling off the negligee moaning  You can have ME instead   The kid sighs takes off his bag and then produces a dick that wouldnt look out of place on a stud bull The woman is agog Our lad then produces a load of big rubber rings from his bag which he proceeds to stack around his giant knobWhat are they for asks the womanOh theyre just to make sure I dont go all the way in when I fuck you replies the boyTo hell with them implores the woman Ill take all of youOur lad replies Not for five fucking dollars you wont ,1384568118.0,I just love a good twist,453,jokes,hot
