author,comments,downvotes,id,score,selftext,time_created,title,upvotes,subreddit,type
IsilZha,36,30,1rghh8,115,Alright thought Id share a headache I had to endure this AugustSeptember its a bit of a long story as we hit a stumbling block of some sort and almost every single pointSo heres the deal We got a school district thats desperately needed an upgrade for their WAN They had  schools running single T pointtopoints to the District office DO which then ran it over a multilink Tx to the County office for web filtering and internet One school is right next door to the DO with a direct fiber link They have an ASA firewall just a  at the DO that has their public IP  the county office has it setup to expose that public IP to the internet Obviously this presents a problem Each school except the one next door is limited to  Mb internet bottlenecked further by having to share  Mb on the main line out In practice they got between  Mb and  Mb woohooAll the schools have their own subnets and DCs Traffic flows from the schools to the DO through the DOs ASA and out the CountyBehold a diagram  httpiimgurcomVxMvPpngJust to curb the concern Ive changed all the IPsThe routers are mostly Cisco s  the switches are HP procurve managed layer  switchesNow they brought us in cause at the time their IT department consisted of two people It now consists of one for the entire district That madness is beside the point of this post though This started a year ago  my boss drew up a design using MPLS to get them  Mbit links to the DO and a  Gbit link from the DO to the County Office COWe only heard a few scant details for a few weeks after he submitted the design then nothing until early this year The district met with ATampT and ATampT drew up their own plans completely disregarding what we had presented Oh and the district excluded their own IT department from these meetings So the first thing their own IT department hears about whats happening with the upgrade is when his bosses come to him with This is what ATampT is doingAnd what ATampT came up with and started working on wasis to put it lightly atrociousTo start off with  ATampT ran  months behind They were supposed to have links ready at the schools midsummer for the change over to avoid disrupting the schools Instead they got the link at the DO and  other links up  days before the start of school So the first thing is that we need to minimize downtimeSo heres what ATampT did httpiimgurcomLNAWPbUpngNote I removed the T links in the chart above to unclutter it  they still exist and are up at this point to facilitate the changeoverThey ran Mb fiber to each school site and the CO and  Gb to the DO Yes thats right to start off with the DO gets a Gb to take in all the connections but the link out to the CO is only  MbSo anyway they put in a small Cisco switch at each site to take in the fiber and handed off the connection as copper at each site except the DO  where they handed it off as Fiber A single fiber link Are you seeing another problem here That single fiber is a VLAN trunk for all the sites including to the CO  so all the traffic comes in through the single fiber link and needs to go back out the same fiber link after being filtered through the ASAATampTs instructions when they finished putting in the link at the DO Just plug each site into a switch at each site and itll all just work I kid you not What about all the subnetting Oh you dont need to do any of that oO Before we heard this ourselves they had been repeatedly telling the Superintendent who is a complete jerk and more of a hinderence than anything that it would all be plug and play and just work We had to pry at them for the first day before we could even get the VLAN informationOther issues No equipment at the DO has a Gb fiber port The routers are full  no more connections available The ASA is license locked and cannot have anymore VLANs aside from the two it has inside and outside It will not handle VLAN tagging at all None of the switches in the core stack support VLAN taggingEven though the switch they put in at the DO has multiple ethernet and fiber ports they refused to give us more of them all the others are disabled even though it would be a  minute configuration That will take a change order How long would that take About  weeksIn fact ATampT refused to change anything anywhere to help make this work When calling their ENOC center which is the number provided for support to setup your connection did nothing more but repeat just plug it into a switch at each siteThe project manager went on a  week vacation the day after the link at the DO went in After talking with our contact at ATampT for days who had been talking as though he were an Engineer suddenly reveals Im just a salesman God this is explains so muchAlso yes they installed a link at the site next door that already has a direct fiber link to the DOSo to recap ATampT provided a completely flat solution and wanted the district to just flatten the whole network Wouldnt work anyway due to VLANs and only providing a single link at the DO        Seriously they wanted us to just flatten the entire network Only a single link is provided to take all the school traffic in and send it out ATampT has and still continues to stubbornly refuse to do anything to help make their craptacular plan workIts clear from the design they came up  They presumed the internet access presided at the DO instead of the CO  A salesman probably designed this garbage  it shows a blatant lack of understanding of the type of network needs as well as putting in crap they dont need at all the link at the site next door  HERP DERP LETS CHARGE YOU MO FOR AN INDIRECT FIBER LINK AT A SITE THAT ALREADY HAS A DIRECT FIBER LINKFrom here on we seemed to run into some odd stumbling block at every turn not just from ATampT FMLWe got a layer  VLAN tagging capable HP switch so that we could split up the VLANs for inbound and outbound which we got in a few days after the link was put in at the DOSo I console into the command line to do basic setup and enable web administration Holy crap is the command line clunky and the command paths make little sense For one backspacing doesnt work  so any mistakes start over Try to go back and just modify the last part of your previous command Start overGet through that and get the web interface up WTF is this The GUI is convoluted and clunky  it takes  steps to configure a port andor VLAN and much of it makes as much sense as the CLI did The fiber wouldnt come up either normally on HP switches it just works Screw this  we call up HP to help us with the configurationTurns out the switch is actually a COM switch rebranded as an HP switch  gt We have to setup the fiber port as this weird hybrid port to work Okay  we also get  ports setup for out VLAN to the CO and  setup for in VLANs of the schoolsCome back the next day  plug in a laptop at one of the sites to see if we can ping through to another laptop on the HP switch Nothing  we look  fiber link shows down Look at ATampTs equipment link is down Its only been  days and the link at the DO is down So come back a few days later succesfully test sitetosite and now we also have a new Cisco  to be the router for this new madness  As well as  more s one site has an older router with only  ethernet interface and another is so old is only MbThe third  is to take the school VLANs from the HP switch that ATampTs fiber is plugged into and route them to the DOs network for various services Exchange school applications etc  Then it goes out the ASA into the  which sends it to the COs VLAN on the HP switchThis had the fun side affect of being able to independantly route incoming and outgoing traffic which actually became usefulSo we got this all setup run some connectivity tests beforehand and got the goahead to swap DOs link to the CO over so now we just need to coordinate with the CO to swap routes and give us the right IPIts one guy at the CO that handles all the network stuff   We had been talking with him and he told us to just let him know when we were going to swap over and he would make the apporpriate changes on his end which included moving to a different subnet  He also just now mentions that the next day he will be going on vacation for  weeks  And he wont be giving anyone else at the CO access to anything to take over while hes goneSo were all ready to go and try to get ahold of him to get us going  He doesnt respond  To anything  We head off for the day never getting a response from him expecting well be stuck for  weeks nowhe sends the schools IT guy the info late that night and indicates hell answer the next day  Finally we get ahold of him the next day and swap over that part goes smooth  we can now pull Mb at the DOOnce this was done I went through and preconfigured the unused fastEthernet ports on the school site routers and preconfigured the two new s for the new stubnetworks and routing  We went to the first site swapped the gateway over  successSort ofOnly getting  Mb  Test from DO again still getting  Mb  Another stumbling block  At this point its x better than what the school was used to well troubleshoot that part later maybe everyone just blasted the bandwidth  no errors or problems on the equipment onsite for now we should get more schools up and runningNext school goes up and gets almost the full speed the DO gets okay thats working good  Get the next site go to plug in and swap over oh ATampT brought their link in at a building on the opposite end of the campus from the T and core stack claiming there wasnt enough room  there was plenty of room they were lazy about running the fiber it was just easier to run it where they did  gt  Ended the work day on that noteThe next day we had a plan  grabbed one of those s meant for another site put it in to handle ATampTs link swapped the gateways confirmed up and working  This school already had a  that was used for the T  we pulled it to use at the site we were originally going to use the new  for  This site got full bandwidthNext stop is two sites that are next door to each other  The last sites were doing  Both of them get the  Mb problem  On the last site I give something a try to confirm my suspicion I route the upsteam back through the T  Now we can get Mb down  Which at the time was the same we were getting at the DO no way for us to tell how loaded down the COs link is  I suspect I know what the problem is will start looking into it the next dayAs it turns out ATampT between the switches they installed onsite and their own internal stuff had the Duplex randomly set to half full or auto  For the life of me I cannot fathom what idiot was changing around the duplex to anything but auto or for that matter why they werent even consistant about it  The  Mb issue was caused by ATampTs links having duplex mismatches all over the place After getting the run around for an hour with ATampT we finally got a tech who knew what he was doing and he helpfully checked every link and found all these duplex mismatches and fixed them set them all to auto  All sites now running at the bandwidth we expect  whewAt this point today we still have one site with just a T link  ATampT has to get a permit to shut down a railroad line to run their fiber under it  Again they dropped the ball on this and didnt put in the request until late August  We dont expect the permit will be granted for  months  Additionally weve had to wait several months to get a change order going to make the link to the CO a Gb link  We have a new ASA waiting to be put in that can handle the Gb  Still waiting on that  So its not quite done but the worst is over at least,1385425123.0,Tales from a NetAdmin Ep   The NetAdmin vs ATampT,145,TalesFromTechsupport,top_week
imranilzar,18,21,1ra0bd,114,This one came from my mother She is teaching basic Excel in high school This is high school specialized in electronics and computer scienceSo the lesson is about auto sequences where you enter  items of the same type of data numbers dates name of the months etc and you can expand the sequence by drag and drop The current exercise is making auto sequence of the names of the week days so you enter Monday Tuesday in cells and you can expand it to the whole week Nothing fancy  year old could do itStudent Teacher It is not workingTeacher What do you mean it is not working Let me see what have you typed thereOn screen Mundey TuesdayTeacher Well you have two spelling errors there is no such word in the English languageStudent What Impossible What wordTeacher Cant you see it MundeyStudent What do you mean it is not a word Whatever it is a computer it should be able to get itfacepalm,1385196059.0,What do you mean with not a word,135,TalesFromTechsupport,top_week
Gambatte,30,31,1rjrxi,117,A quick one for today TFTS the bloodwolves are out in force today and I have a VM that keeps crashing for no apparent reason  must be those damned checks list transient voltagesA few weeks after the events of M is for Musophobiahttpredditrj the very same pimply faced youth PFY as starred in that story had done very little but bombard me with how amazingly fantastic he was at everything to do with IT and technical support Arrogant egotistic totally up himself  these words barely do him justice He would constantly tell everyone around him about his monster computer which would simultaneously run  WoW accounts and Glider  grinding his latest set of accounts up to level cap which hed then promptly sell on eBay But he considered himself too cool to actually play WoWSo basically the worst kind of scum you can find in ITOn this particular Friday morning I was at my desk on the third floor and he was midspiel about he awesome he was in his previous role at the IT department when I received an email from the IC of the building the IC had recently been upgraded to a full office and it was time to move his PC The IC was all sorts of stupid stories for another time but at least he knew that he didnt know about computers so had put the request through to my teamWe did this stuff all the time but I was down a few team members due to some recent departmental reshuffling and everyone else was busy I tuned back into the PFYs selfaggrandizing rantgt PFY basically I was running the entire IT team which made the actual supervisor look bad so he got me transferred over heregt ME PFY the building IC needs his computer moved Seeing as youre so good at IT it shouldnt take you long to move his computer from his old desk to the new one rightgt PFY Thats easy Half hour topsgt ME Well we dont have much on this morning and its the IC so take your time do it right Hell be a massive PITA if its not done right the first time Hes getting a second screen added as well which is already in the officegt PFY SureSo about two hours pass and I come back from my morning vitamin D session to find PFY sitting in the office checking his emailsgt ME Have you finished moving the ICs computergt PFY Yeah it was easy like I saidgt ME Okay another jobs come in soand I left it at that PFY was trying to get promoted to my IC position or at least a position at the same level on one of the other teams so in the back of my head I thought I could take him at his word that the job was doneI should have known better Actually I did know better but I disregarded my instinct its okay I would pay for my hubris laterSo PFY is set to work on some other task and we go about our dayAbout  pm PFY gets a call and has to go to another department for the rest of the day I make a note to follow up with that department so as to make sure he hasnt just taken off early for the weekendAbout half an hour to closing and I finally get hold of someone at that department Theyre basically closed and noone has any idea that the PFY is meant to be there I make myself a note to reprimand the PFY first thing on Monday its not a good idea to be lying to take off early on a Friday when youve got your hopes up for a promotionClosing time finally arrives and I start to head out of the building My exit route just happened to take me past the building ICs new office where I see him looking behind his screen with a very confused expression on his facegt ME Hey IC whats upgt IC Oh my computers not going for some reasongt ME When did this startgt IC Oh I havent used it since its been in this office  Ive been in meetings with the boss all day Thats why it was the perfect time to get my office movedgt ME Give me a second Ill see what I can doI look behind the screen and notice that there is no power or VGA cable plugged in Hmm weird Maybe they forgot to supply one with the second screenCheck other screen same thingAt about this point I let out an expletive that could be heard clearly throughout the building as we were on the third floor having it heard on the ground floor was quite an achievementI checked the back of the computer No cords there either No power no ethernet certainly no VGA cablesSearching through the ICs old desk I found all of the cables in a tangled mess After spending the next half hour untangling them and connecting them into the appropriate sockets I had the ICs computer powered up and working on both screens Of course I then had to sit through the boot up and log in sequence to make sure that everything was working correctlyBoth the building IC and I did not leave until an hour after closing that nightCome Monday morning PFY was late getting in some excuse about a medical appointment just like first thing every other Monday I quickly consulted with the building IC who promptly approved my plan a quick call to the front desk let the security guards in on it tooYou see access to each floor was controlled by an RFID tag When the PFY arrived that day he gained access to the elevator and stairwell but found his card would not get him through the third floor door Eventually he tailgated someone else through the door and made it to the officeHe dropped into his seat by the large whiteboard that we kept current outofoffice task assignments on so as to know where a particular PFY should be if they were not immediately on hand and started cursing about the broken access control system and how he could build a better one himselfI picked up the phone and made a call Within minutes the building IC arrived with his boss in tow followed by a security guard I met them at the office door and brought them to the PFYs deskgt PFY Whats going ongt ME I tasked you with moving the ICs computer on Friday did I notgt PFY Yeahgt ME And you told me you had finished it did you notgt PFY I did finish itgt ME THEN WHY DID THE IC AND I SPEND AN HOUR ON FRIDAY NIGHT MAKING IT WORKgt PFY It must have broken after I leftgt ME Oh I see  so every single cable just disconnected themselves moved back to the original office and put themselves in a drawer did theygt PFY Whagt ME Turn your head to the right and tell me what is written across the top of the whiteboardgt PFY Task Locationgt ME Across the topgt PFY A job is notgt ME Continuegt PFY A job is not completed until it is testedgt ME Correct So given the way that the job was completed on Friday I must conclude that you either chose to ignore this offices standard procedure for completing work or that you are so incompetent as to not be able to determine the difference between a working computer and one with no cables connected to it AT ALL or that you did almost nothing for over two hours lied about completing the job and hoped you wouldnt get caughtgt PFY Bugt ME interrupting him midword near trembling with ragegt ME SHUTgt ME UPgt ME None of these options are suitable for a person to continue working here either in this office or for megt ME Compounding the matter is the fact that you lied about an out of office job on Friday leaving the rest of the team to pick up the slack while you took off for an early weekend Ive been in touch with the department head to confirm both on Friday afternoon and again this morning and no one asked for you to go over there nor saw you in the buildinggt ME Your card access to this building has been limited to unclassified areas only and will be revoked completely as soon as you leave the building You are to report to the general resource pool immediately  Ill be calling your new supervisor to let them know that youre on your waygt ME to Security Guard Please escort this man out of the buildinggt ME to PFY Get the hell out of my buildingPFY was escorted away by Security and IC came up to megt IC You looked like you wanted to swear at himgt ME Because I didgt IC I still think we should have kept him around to scrub the toiletsgt ME So he could do a terrible job of that too Better to just be rid of himPOSTSCRIPT Two weeks later HR sent me the performance review form for that particular PFY I sent it back with a note saying that he no longer worked for my department with a full transcript of the reasons whyThey sent it back apparently hed lasted longer working for me than any of his previous departmentsI filled it out  brutally honestly My final line While PFY does show some technical aptitude his unwarranted arrogance leads him to have a lackadaisical and borderline insubordinate attitude which prevents him from gaining any significant experience in this roleMy counterpart at the general resource pool where people who are still under contract but unable to perform their duties end up later told me that he had put him in a team that was clearing bushes from outside a company building The following day he had to move him to a team that was painting a wall as he was unable to follow the safety instructions for using the chainsawLast I heard the PFY had moved on to a sales role with another companyBrowse other volumes of the EncyclopædiaAhttpredditqywlBhttpredditrtjrCDhttpredditpwforEFhttpredditqkzrGhttpredditquffhHIJKLMhttpredditrjNOPhttpredditrgwQRSThttpredditrjrxiUVhttpredditrdukuWhttpredditqiiXYZ,1385525199.0,Encyclopædia Moronica T is Tested A Repair Is Not Completed Until It Is,148,TalesFromTechsupport,top_week
hicow,18,26,1ra1jy,115,Prologue sales manager gets all new furniture part of the mess I posted about herehttpredditplnel which still hasnt been fixed  I walk past his office the other day and his monitor is decidedly blue  I stop turn around and ask him about it Hes got no idea it just started happening that morning  I ask him about the VGA cable from the monitor to his dock he says he replugged it at both ends but it didnt help  Im busy and technically not IT anymore so I shrug tell him to try a reboot and if it doesnt work call DerpContractIT  He hollers at me the other a couple days ago his office is  away from my cubicle and I pop my head into his office  Monitor is still blue and hes got an Excel sheet open thats almost unreadable  I futz with the settings on the OSD with him helpfully chiming in that he cant mouseclick on the OSD  thanks Captain Dumbass but nothing makes a difference I tell him to hang on while I find another monitor cable and dig a DVI cable out of the server roomI unplug the VGA cable and shove it through the desk grommet plug in the DVI and push it through  Go around and under the desk to feed it back up to the laptop dock and its just a hair short I get it through the grommet near the dock and go back topside  I need to move the dock to the right a couple inches but theres nearly no slack in the cables  I wrestle it over but its nearly touching his desk phone so I try to move that over  It moves maybe a half inchBack under the desk the cables had been managed within an inch of their lives The dude who did the cable management used short screws and the keyhole hangers on the surge protector to get it out of the way then cheap oneway zip ties on those selfadhesive loops to get the cables off the floor  Theres zero slack anywhere  The zipties cant be cut with scissors and I dont want to take a razor to them The guy had apparently pulled the zipties too tight as the loose DVI cable works fine  I shake my head apologize for the interruption and question the wisdom of using a dude who had never in his life done cable management to do cable managementTLDR Who knew you could strangle a VGA cable until it made the monitor blue in the face ,1385198544.0,More fun with cable management,141,TalesFromTechsupport,top_week
