author,comments,downvotes,id,score,selftext,time_created,title,upvotes,subreddit,type
Gambatte,15,38,1rlvnp,154,About a year after the events of T is for Testedhttpredditrjrxi I was leading a small group of technicians in a field office Our support area was the network connecting multiple other devices which had their own specialized support teams the interface devices and the systems that collated and correlated the dataOne of the listed tasks assigned to all new as in fresh out of the training courses technicians was to produce an overview of all of the systems in the office This was quite involved and usually ended up requiring the production of at least three documents each of which would be approved by the supervisor of the team for the relevant areaSo on a semiregular basis a new batch of fresh technicians would arrive in the office theyd complete their listed tasks and receive a pay rise on completion of their on job training book and become available for further training and promotion Generally the OJT book could be completed in a couple of months with a little bit of effortExcept for one particular pimply faced youth PFY He slacked off and never bothered to progress his OJT book at all Much like the PFY of T is for Tested his attitude saw him bounced from department to department Suddenly eight months have passed and the training department is trying to schedule him on a course for further training with a view to promotion when it becomes apparent that he doesnt meet the requirements having still not completed his OJT bookQueue mad rush to get it completed in under two weeksHis system overview hit my desk I picked it up and read through it and immediately wondered why someone who was in such a desperate rush to get it completed had taken the time to Photoshop a photo on page one so that the pictured screen read PFY IS THE MASTERNaturally the write up was a mess Sections that should have had pages of information were covered in four sentences Sections that should have been covered in four sentences went on for pages and pagesSo heavily annotated with the required corrections the draft was returned to the PFY It was not uncommon for three drafts to be required five was not unheard ofWithin two hours he submitted the second draft having changed only one paragraph And again the same comments were madeThe third draft was the same  one paragraph changed despite pages of required corrections I pulled him into the office closed the door and went over every required correction I did everything short of dictate the required text to himFourth draft  one paragraph And the fifth And so onBy the time I was about to reject his eighth draft I was pulled into the office by my supervisor SUgt SU Whats going on with PFY Im catching some flak from the training department over his OJT book and they tell me one of the last things hes got to do is your system overview Has he done itgt ME Well hes triedgt SU What do you meangt ME reaching into hammerspace Heres his latest draft  number eight as I recall Ive already annotated it with where corrections or more information is required Every one of his drafts that I have rejected has had this information and most of the time the information hasnt changedgt ME also from hammerspace For comparison heres an overview that meets the required standardMy supervisor quickly flicked through the two documents and rapidly agreed that the produced overview did not meet the required standardWhich is when the fun startedIn order to assist with the rapid completion of the overview PFY was assigned to my department I was given strict instructions he was to be given all the support he asked for and no other tasks until his overview was up to standard He had  access to the system every reference document except for the previously accepted standard meeting overviews and access to the personnel who knew the system inside and out namely me and my team of PFYsA further three weeks pass Once PFY learned he was to receive no tasks until the overview was completed he spent the time watching DVDs and playing PS  for comparison I received eight drafts in seven days then he was explicitly given nothing else to work on I received two drafts in three weeksEventually with a great deal of encouragement read punishment that increased with each passing day between submissions an acceptable overview was completed and PFY was out of my hair and off on a training courseAnd then his performance review form arrived Again by virtue of him bouncing around so much the time he spent with his thumb firmly implanted in his rear pretending to work was more than with anyone else I tried to pass it off to his previous supervisor PS seeing as hed actually done some work for him but he bluntly refusedSo I filled it out honestlyThe form then went to management for approval and thats when the REAL fun startedApparently PSs manager did not agree with my review PS also disagreed with it when they confronted me about it I mentioned that I had specifically offered PS the chance to fill it out but he had refused to do sogt PS Youre only giving him a bad review because you dont like himgt ME I offered you the chance to fill it out Wait are you saying that I review on factors other than performanceThen PS dropped the bomb he had previously had the PFY of T is for Tested working for him who had filled his head with how much I sucked to work for how I hated my PFYs and how I loved to throw my weight around bully them and so on Despite having known me for years PS had decided to believe this rubbishI was beyond livid at this point I had reached a point where anger gives way to calm resolve in a way I suspect is similar to a fullblown psychotic break I took a deep breath picked up the nearest phone and made a couple of callsMy entire team of PFYs assembled Individually and as a group they all swore that I was one of the better supervisors theyd worked for and had no knowledge of any kind of bullying or harassing actions on my partThe IC from T is for Tested arrived hed transferred to that office not long after I had and laid out the truth of T is for Tested independently verifying that the lies that had been spread about me were completely baselessMy supervisor arrived and verified that the drafts the PFY had handed in had not met the required standard and yes we had an independent source to verify againstPFYs poor review stood  not that it even mattered he was promoted immediately after completing his training course which obviated all performance reviews poor or otherwise from his prior levelPS received an unofficial verbal reprimand for his gossipmongering which he promptly blamed me for He went out drinking to forget his selfinflicted troubles eyed up the wrong girl at the bar made the wrong smartass comment to her enormous boyfriend and ended up with a fractured eye socket and three titanium plates holding his face togetherKarma never worked so well in my favor beforeIt occurred to me later that the old maxim people are often guilty of the very sins they loudly decry may apply and talking in confidence to PSs PFYs revealed that the more he liked them aka the more they would go boozing with him in the weekends the better their performance reviews would readUnfortunately because of the fallout of this event I was never in a position where I could pass that information on to management without it looking like a move from malice or spite rather than a genuine desire that the procedure for conducting performance reviews be followedBrowse other volumes of the EncyclopædiaAhttpredditqywlBhttpredditrtjrCDhttpredditpwforEFhttpredditqkzrGhttpredditquffhHIJKLMhttpredditrjNOPhttpredditrgwQRShttpredditrlvnpThttpredditrjrxiUVhttpredditrdukuWhttpredditqiiXYZI just got gilded for the Encyclopædia I would have thought TFTS would know the dangers of positive reinforcement now Im going to keep on writing it,1385594103.0,Encyclopædia Moronica S is for Standards and The Dangers Of Having Them,192,TalesFromTechsupport,top_week
iisdmitch,23,20,1rfygn,131,I work as Tier  support at a university occasionally I assist with student online testing We do not have a lab for this for whatever reason so the students have to do testing on their personal laptops The particular college I was working with today uses a pretty bad testing site I dont want to say which but its pretty bad Java always needs to be the most current version Flash needs to be current and Firefox seems to be the only browser we dont have issues with which isnt a huge deal but not everyone keeps their PC or Mac up to date which causes problemsA student raises her hand and I walk over to her She is having an issue with her test It appears to be a Java issue so the first thing I tell her to do is go to Javacom to see if she has the latest version She does not so I have her download Java She kept telling me its not popping up to install I told her that she needed to check her downloads window in Firefox which was popped up on the screen She couldnt see the file clearly labeled so she proceeded to download it again and again and again So finally she listens to me finds the download window and installs it Cool Java is up to date now so lets start the test Reopen Firefox and go to the testing site She instead opens Chrome and goes to the siteMe Please open FirefoxHer But I dont like using FirefoxMe I understand but the developer recommends using FirefoxHer I dont want to use Firefox because I have the website book marked in ChromeMe Me Open Firefox pleaseHer Okay fineMe In the address bar type in wwwtestingsitecomHer Oh that was allMe YesShe got into the test I forgot to mention above that she was using an outside voice in this room with other students testing while I am whispering instructions to herTLDR If you dont listen to someone trying to help you youre gonna have a bad time,1385412603.0,Listen to the person helping you,151,TalesFromTechsupport,top_week
drexhex,33,24,1rgojm,127,Said by an administrator when in a meeting about upgrading our underground fiberAll this is below ground What if in the future everything is higher up like with this cloud stuff  would we be behind the tech curveI shit you not,1385430130.0,The Cloud,151,TalesFromTechsupport,top_week
SimpleSyrups,22,27,1rm485,130,At my job we receive tech tickets from users via a web page Today I got a user on the phone who was having some difficulty submitting a ticket Lots of people call because theyre generally STOOPIDHello thanks for calling Company SimpleSyrups speaking How can I help youHi um I think I talked to you the other dayOkay Because really am I supposed to magically know who this person is amongst all of the phone calls in a dayOh um well you told me to submit a ticket to get my program runningYesWell it isnt working and now I havent been able to use it for DAYSOkay well I can see what I can do for you What isnt working for you You went to ltinsert website heregtYeah Your site is downWell I dont think its down Ive been receiving tickets all day and for the past three daysThen I confirmed the web address with him and he emailed me a screenshot of what he was seeing with the URL when I asked him what the URL was he told me Safari BTW Had to explain what a URLBrowser was YUPSomehow this guy found a URL that was WAY old  and really a back end worst case scenario preforming system upgrades sorry for the downtime message on a web page that you would need the exact URL to find Really I have no idea how he found it I have a sneaking suspicion he has it bookmarked in his computer like thatAnywayOnce I see it I just figure since he claims he keeps getting directed to it from the main site Lets just have him reset his browser historycache and see if it works thenOkay I see what youre saying but thats not actually a functioning page on the site The tech site is up and running You are getting an error possibly from old history being stored on your browser Please reset your browser and lets try againOkay No problem  just did it Restarted the computer just to be safeNow here I am like that was fast Okay  so you deleted your history from the Safari toolbar before restarting correctNope proud about it too Just was safe and restarted the whole thing  gtlt  I then explained the difference this guy was young too one can only imagine all the porn history thats never cleared when his computers are serviced and spent another  minutes on the phone walking him through complicated things like verify email drop down list and Yes you do have to provide that informationTLDR Happy Drinksgiving   ,1385600813.0,Bro Do you even internet,157,TalesFromTechsupport,top_week
Matvalicious,24,21,1riix1,127,I work for an IT support company that does both residential as well as commercial customers Today a residential customer walks in Completely stressed out because he is missing a lot of emails He slams his laptop on my desk ranting about his emails while I turn on the laptop Windows has booted I connect him to our WiFi and ask him to open his email client Its just my email its right there just open it Not pointing or moving himself or anything I say I dont know how he reads his emails he could be using webmail or Outlook or Windows Live Mail No desktop icons He proceeds to open Windows Live Mail with a bit of confusion on his face There You see it He rapidly scrolls through the emails telling me there is a huge gap between yesterday and a date about a month ago I notice he is using the Unread email view so I switch to his Inbox and show him all his missing emails But no Thats not how I read my email I always use this one Goes back to Unread Email I try to explain him the difference between Unread mail and the Inbox It took me about  minutes before he would believe me telling him his email was still there and eventually I think he got the difference between the two folders He then ends the intervention with Because I got this problem before and then a friend of mine who is really into computers told me I had to switch to Offline mode to get it fixed but now all my emails were gone No sir They werent and your friend is an idiot,1385493399.0,Where are my emails,148,TalesFromTechsupport,top_week
Nerdiator,57,75,1rp7bl,125,My neighbour recently bought a new Asus notebook She is  years old and its the first time in decades that she used a computer As you can guess I had lots of explaining to do Mostly since its Windows  and thats not really the easiest operating system for a new user  So I ask her if she had ever worked with Windows before Her answer No we used the internetI have a feeling that there will be many facepalms for me in the nearby futureTLDR Internet is an OS,1385713758.0,Learning the neighbour how to use a computer,200,TalesFromTechsupport,top_week
