author,comments,downvotes,id,score,selftext,time_created,title,upvotes,subreddit,type
Meltingteeth,184,228,1rjd61,939,Quick background This is back from my tier support days at a university This generally involved me sitting at a desk waiting for students to bring me their computers when they had some sort of issue however occasionally I worked with staff members and various departments across campus This happened during my final weeks at this job I received a call from the head of the relatively small Reference department The department head was a crotchety old man COM who submitted trouble tickets like he was trying to win the lottery He had been working at this job for a solid decade and was stubborn as a mule COM had said that his computer was running ridiculously slow Checking old tickets I saw that he had complained of this three times before The first time they had wiped a solid amount of trash programs files and registry redundancies This legitimately helped him The next two times he had demanded that they take it to the workbench for servicing because it was still slow and there was obviously something wrong Both times they found nothing I massage my temples as he talks and tell him Ill be right over to look at itTen minutes later Im in COMs office looking at his computer Its nothing fancy just a Dell Optiplex i and  gigs of RAM He didnt need it for anything other than database study and library cataloging Predictably COM tells me quote The damn thing is far too slow and never speeds up when you people bring it back from repair I wish you would just fucking replace it already IBM computers are absolute shit This little bit was important because it showed me that he had absolutely no clue what kind of computer he was usingNow I have a pretty high patience level but I get particularly annoyed when users say you people and swear at me I inspect his computer and theres nothing urgently wrong with it He has an Ask toolbar installed but nothing thats eating resources or bogging it down After a few more minutes of COMs bickering I have a fun idea and tell him that Im going to take it over to the workbench transfer all of his files safely and give him a new processor and more memory I usually try to keep terminology as simple as possible with users but the larger words are always there to boost user confidence and add flair So I take COMs computer over to the workbench and grab a pail of cleaning supplies As you can probably guess from this I spend the next ten minutes dusting out his computer and wiping every safe surface down with Clorox wipes By the time Im done the computer looks brand new I even snagged an i badge from a shelved unit in the back and put it on the front I bring the shiny new model to COMs office I tell him that Ive upgraded his memory as well as installed an i processor and ask him to try it out Right away I get Jesus Christ thats much better out of him I stick around for another minute to change some accessibility settings for him and leave his office as he provides me with a low Thanks kid The influx of tickets from COM fortunately stopped for the rest of the time I was there however I wonder to this day if he took my replacement as an example of how to acquire new equipment At the very least it shouldnt have been too hard for helpdesk to outfit him with a new mouse and keyboardTLDR Angry older user demands a newer faster computer Clorox wipes and a sticker are the best upgrade,1385513663.0,My computer is running too slow replace it with a new one A case study on the placebo effect,1167,TalesFromTechsupport,top_week
ender,266,214,1rcenx,878,Recently we sold a computer to a client for his friend Pretty nice machine  i Haswell TB disk SSD Geforce  GB RAM Windows  Two weeks later he brings it back because it wouldnt boot After some poking around I noticed that the Software and System registry hives were empty and looking on disk the files that held them were only kB in size but apparently the real hives were still there just renamed to have iobit extension WTFAfter I solved that Windows slowly booted logged in desktop appeared and after some half minute an animated snail appeared in the lower right corner with Computer speed slow  optimize now written under it But before I could do anything Windows froze mouse pointer stopped moving no disk activity wouldnt respond to ping Since the same thing happened after several reboots I went into Safe Mode and looked at Programs and Features  Start Menu replacements one we provided two installed later  different optimizers several Registry cleaners countless toolbars As there were other problems registry permissions were screwed up so badly that you couldnt change view modes in Explorer I simply reinstalled Windows and upgraded to  which came out that dayI later found out that user installed the optimizers and registry cleaners himself to make the computer faster,1385292291.0,When  seconds from power on to desktop is not fast enough,1092,TalesFromTechsupport,top_week
Techsupportvictim,41,199,1ral73,850,Gent comes in to our store a couple of weeks ago Issue with his laptop I dont actually recall what the issue was in the end but we needed to send it to our repair depot At least three days out of his hands as many as seven He needed to back up his stuff cause apparently he never had in the almost year he had had it So we had gotten him a hard drive showed him out to set it up etc Game plan he goes home backs it up and then drops it off and we send it out With luck they dont have too many machines and its back fast Roll forward two weeks and he comes in to drop it out off morning Saturday To be shipped via a third party that doesnt pick up on Saturdays to go to a center that isnt open on Sundays anyway Im not the one doing the paperwork but I can hear the whole thing from my postTech taking it in tells him that it will go out Monday with luck by delivered back on Wednesday maybe Thursday To wit the guy yells out him that he is leaving to go out of the country first thing Monday morning and must have his computer for the trip Now remember this all started two weeks ago and we could have sent it out that day if hed been backing it up like a good user double since he uses this for business it seems The tech explains to him that this is not a repair we can do in store because we dont have the proper tools and parts and they would take a week to arrive even if we could get them And according to the notes he knew two weeks ago what needed to be done All very calmlyThe guy yells for a manager and our lead tech comes over Hears the whole convo hears the guy ranting about what are you going to do about it  and with a totally calm and straight face simply replies A lack of planning on your part doesnt equal an emergency on ours Ive heard it said several times on the web but never in the wild,1385226351.0,A lack of planning on your part   ,1049,TalesFromTechsupport,top_week
nightshadeOkla,117,191,1rfdui,840,Ok so many years ago when I worked teaching a networking program at a college I was also responsible for the campuss IT needs The Director a genius in her own mind but otherwise clueless bought a laptop and I got it all set up This was on a Friday On Monday I was called into her office she was generally irate this day was no exceptionDirector My laptop didnt have Internet at home you didnt set it up properlyMe It works fine here so it should work fine at home did you connect it to your Internet connection at home Director No I dont have wireless internet at home thats why I bought a wireless laptop so Id have Internet access everywhereMe Um ok thats not really how wireless works I can get you a cellular card but that will run you at the time about  a month to have internet anywhereDirector What good was it to but a wireless laptop when it doesnt work wirelesslyMe Call your internet company and get wireless internet I didnt want to go to her houseI resigned the next Summer,1385398933.0,But its wireless,1031,TalesFromTechsupport,top_week
caleblowery,108,209,1rdysb,758,Im the IT guy in the family so my little brother  calls me whenever something goes wrong A few minutes ago he called terrified that hed broken something As he told the storyHe was plugging a new mic into his desktop last night when he accidentally unplugged the computer Knowing this was a bad thing he swiftly rebooted and started trying out programs Sure enough LOL and Minecraft Online are down Failure to connect He tries Google and Facebook also unavailable Yahoo It worksAlright internet works Assuming that hed messed up the software in the hard shutdown hed uninstalled and reinstalled his browser and LOL but was unable to update Check Google again still unavailable Be stumped and wait in a panic all day Finally call CalebMe Alright go to googlecomBro I cantMe Go and tell me what error you getBro Ok It says that the security somethingsomething is out of date or not recognized The only option I have is to go back to safetyMe Whats todays dateBro I dont know Ill check Me Bro Wait That isnt rightMe Yeah go ahead and fix that Should clear up your problemsAnd thats how my brother learned about security certificatesEDIT New to the reddit TIL Selfposts  karma Sadface,1385343526.0,My little brother was panicking Some of the internet doesnt work,967,TalesFromTechsupport,top_week
Meltingteeth,145,143,1rguyg,645,Background My first IT job involved me doing Tier  support at a University This basically involved sitting at a desk waiting for users to come to me with issues which was pretty awesome Phone troubleshooting sucks However I would occasionally get a call from across campus or a remote location that would require me to go there personally This was no problem I generally enjoy the exercise and fresh airSo about a week into this job I get a call from our University Records department to come help with a monitor issue No problem someone had logged it from a previous ticket that it had a failing VGA port that would likely eventually fail The monitor wasnt swapped because at the time it was still perfectly functional albeit a tad finicky when it came to bumps and the user had a dualmonitor setup I grabbed another monitor up and hurried over to the building where it was located I knocked on the door to the targeted office what greets me is a scowling middleaged woman SW for short who practically drags me inside The conversation went something like thisSW Finally Ive been waiting here staring at a blank monitor for ages It had been ten minutes At this point I notice that her second monitor is also offMe Im not sorry I see that your second monitor is off Is there something wrong with it as wellSW No I dont use that monitor because having two screens is inefficient and overly complicatedWut But you could have put your work on the other  Screw it Im not here to change her work style I swap out the monitor which does in fact have a faulty port while SW continues to rant Me Well that should do it Customer service reflex Is there anything else I can help you withSW Yes actually cringe My damn scanner is too slow when I try to scan documentsMe Ok lets take a lookSW proceeds open a PDF file from email The file opens in Adobe Acrobat Pro the default prints it out the department was using an Inkjet at the time which took an extra minute places it on the scanner and selects the scanners stock program to scan the page into an oddly highresolution JPEG Cringe whiplash This of course takes a few minutesSW See The damn thing takes forever to scan and Im emailed  of these documents every dayMe Well could we possibly lower the quality of Wait that document you just printed from that file and scanned is that the same process you use for all of your other scanned documentsSW Yes i have to scan these into an image for our record system and I cant lower the quality because then some of the signatures dont showShe was printing documents from Adobe Acrobat Pro and scanning them into images for whatever system she had to store them in using the default program that came with the scanner I noted that this program had a big obvious Scan as JPEG function with a few sliders one of which controlled resolutionI then spent the next ten minutes showing and writing the process for saving the image to a JPEG directly from Adobe Acrobat Pro She had apparently been doing this open print scan and save process for months I took an early lunch after that one and pondered my career pathTLDR Irate recordkeeper finds a wildly inefficient process to keep records Tier  employee saves department hundreds of dollars,1385434808.0,Basic Googling or even asking someone else would have saved  man hours,788,TalesFromTechsupport,top_week
Rhywden,119,122,1r99ob,638,This is another story from back when I was one of the admins for a mediumsized students dormitory  connected clientsPhysical layout consisted of  houses connected by fiber with every house sporting several Netgear managed switches thus providing  Mbit connections So one evening I was sitting in my room and reading when someone knocked on my door Internet is downFirst thing to check Local issue Tried connecting to the router remotely  no dice Not only is the Internet down but the whole network Went over to the server room and logged in locally and discovered that the router was alive and kicking also the uplink was fine but the connection to our network was borked Around that time a fellow admin showed up who forgot more about networking than Ill ever learnHowever he too failed to spot an immediate source of this error Uplink  fine No errors in the logs Blinkenlights on the switches in the server room are indeed blinking and showing not only connected ports but also active onesWe tried several things over the course of the next hour but did not find anything TCPdump didnt show any incoming traffic on our network facing cardUntil by pure chance or maybe desperation we rebooted the switches Because the network suddenly came to life again and ground to a halt mere seconds laterOkay time for another reset this time with TCPdump to watch whats happening And thats when we saw it A TCP packet which consisted entirely of zeros yes even the leading bytes which should include stuff like source and target port and just one single xF somewhere And it flooded the network for the short time it workedWe then worked out what had obviously happened Some computer in our network broadcasted those malformed packets which in turn caused our switches to freeze in such a state that they appeared to still be working I kid you not if you didnt watch them closely youd notice nothing  it was just that the pattern of blinking and steady lights didnt change over time as it usually would in a live networkThe solution was to pull out all the cables and connect them one by one until the switch failed again That way we discovered the culprit  who wasnt home at the time of course He later told us that he came home to discover that his PC which he had left on to complete a slow and huge download had bluescreened which obviously didnt agree with his NIC which then decided to retaliate against the cruel world in the only way it could,1385167866.0,The TCP packet of death,760,TalesFromTechsupport,top_week
ChoppingOnionsForYou,161,157,1rkp0i,638,I work in a school and because theres just me and Im somewhat lazy I use remote access a lot to updatefix computers round the school If I know Im going to be some time Ill start what I want lock the computer and come back to my desk leaving a LARGE sign stuck to the screenkeyboard saying words to the effect of Mrs ChoppingOnionsforYou is using this PC DO NOT TOUCH ITJust this very lunchtime I decided that the best policy with a PC so infested with malware and crap that nothing ran with anything remotely approaching speed was to nuke it from orbit rebuild it I left the OS rolling out and not  not  but  notes stuck to various places on the PC monitor and keyboard telling anyone NOT to use the machine I ambled off to snarl at some kids fix other issues with the knowledge that by the time Id done that the machine would be ready for the final phases of rollout  viz Making sure Office was properly registered our school database software installed and local printers set up correctlySure in the knowledge that my notes would deter ALL comers I attempted to log onto the PC remotely only to find that someone had beaten me to itArriving at the PC I found all my carefully scribbled notes removed littering the desk in their uselessness as the VERY SAME teacher whod listened to me tell a child NOT to let anyone log onto the PC sat there smug in his knowledge that the PC was now working againMe So despite my copious notes telling you NOT to log on you decidedUser Its OK itd finished updating so I thought I could use itMe Long and hopefully eyeglazingly boring description of the rest of the process required to bring the PC to full useThe user cowed by my grumpy annoyance slunk off to teach his classSure it would have been better if Id removed the PC completely brought it back to my desk and done the rollout here but theres nothing quite like the knowledge of a PC rolling out in a classroom to galvanise me to my fastest worktldr I think you all know the policy on jelly babies by now  if I have to explain it againEdit For all of you kindly suggesting that I remove power to the monitor  I thought about this because it seemed a sensible option but theres BOUND to be one user who actually thinks to restart the damn thing  and while I can always restart the WDS rollout it adds to the time The only sure solution is to remove the PC back to my cupboard,1385564725.0,No no  just ignore my signs I didnt WANT to work on the machine anyway,795,TalesFromTechsupport,top_week
Sounderhawks,138,193,1rn4x4,591,I was told to post this here after putting it in a thread in rtechnology Hopefully its something that will make you laugh Im finally at a point where I laugh about it Please forgive me if it isnt too clear Its been  years since then and Ive been out for  years in college so some of the real technical details have fadedAboard Al Asad in Iraq there was a huge morale drive I was in the Networking Division of unit on base We had a few extra IPs We attached a large NAS to one of our Staff NCOs machines so that if we ever got in trouble theyd just tell them to take it down If it was a Sergeant or below theyd probably end up getting ninjapunched and losing rankAnyway when night shift came on I monitored was able to que up and download most of the Al Asad Morale Drive which at the time was supported by G aka the IT department at the General Officer level When the time to return home came we had close to TB of movies music and TV shows We were somehow acquiring great quality copies of the newest episodes of TV shows I remember getting the newest episode of Generation Kill within  days of it airing back in the USFlash forward about  months and my unit is deploying out to what at the time was a small presence MEB for those who know what that is Camp Bastion When we arrived there wasnt much and we did a lot of work to repair the damage the unit we were replacing had done Since this was our units first full deployment into Afghanistan we took pretty much the best people we could forward in every department This means we had lots of experience in our unitWhen we arrived we were told we dont have a morale drive because we dont have the resources to manage it Well we had more IPs than we needed at the time so we threw that old NAS up on the network We password protected it to our unit to preserve bandwidth This worked fantastic for about two weeks until our S happenedFor those of you who dont know S is the logistics part of a unit They decided to give our password out to various units on the base in exchange for favors Withing  days our unit could barely do any work because our bandwidth was being hammered We decided to change the password againUnfortunately this pissed off the whole base The next day we had calls and emails from angry Es and above asking why the base morale drive had been taken downThis all happened fast so we still werent aware that it was the S who got us in the mess We start replying to the emails like this This is our units asset This isnt the bases server Therefore we are the ones who decide if we will allow access to everyone outside our unit Currently the bandwidth it was using was cutting into performance on our mission critical systems When infrastructure improves we will consider restoring access to the morale driveThis did not go over well There is no fury quite like that of an entitled Master Gunnery Sergeant Soon enough G comes calling asking about access to the morale drive We tell them no for the aforementioned reasons They respond that they have the power to take anything off the network and order us to hand it over to them so they can administer itWe say no because we have a portion of it only accessible to us which had a bunch of things like cracked software cracked versions of LAN games etc We had built an internal network to our department so that after shift change people could hang our and blow off steamWe saw the writing on the wall so we had friends back in the states ship another of the same model NAS out with extra hard drives We backed everything up to that NAS then hid it in some space in one of our legacy servers racks Finally we wiped the harddrives and repeatedly dropped the original NAS until it wouldnt turn on anymoreWe took the broken NAS with the blank harddrives to G The final straw for turnover was their Information Assurance Manager deciding that he was confiscating it because it was a security vulnerability to the internal network Thats the one thing we really couldnt fight since he just has a senior officer sign off on itFor the next couple of months all of us had strange issues with our admin permissions being adjusted and other random annoying netadmin trolling commenced What they didnt know is that we had the domain admin password because they left it in plaintext in a startup scriptAt this point it probably seems really petty and it was However when youre deployed for several months these petty things build up We were pissed because we felt like we were A being punished for trying to provide a service that didnt work out B our stuff was taken with no compensation and C G were fucking with us just because they had nothing better to doAfter we started having random things disappear from our share drive we started counterattacking them Things escalated a bit but they didnt really know how we were getting in Certain people started taking liberties with our billet of being information security personnel They reasoned they could tap into other peoples harddrives if they were connected and delete anything that didnt belong on an official government networkThat all changed when someone deleted the wrong persons pornographic material Technically no porn is allowed on the network This means no naked pictures emailed from the states etc Well apparently these were naked pictures of this guys wife that went missing He took his harddrive to the Colonel of G and had it given to the IAMThat launched a pretty long investigation into my department that ended up with several senior NCOs being relieved of duty and even sent home earlyIronically that wasnt the worst investigation I had done to memy department while deployed By that point I actually knew my rights and was able to skate freeTlDR Attempted to have a morale drive for our unit since one wasnt up Entitled senior enlisted decide their happiness is more important than the bandwidth we needed to run our servers Leads to netadmin troll war between us and a superior unit This leads to a serious investigation and relief of senior leaders This also made our CO mad because it made the unit look bad and we were basically annexed into HQ instead of being our own department and thus got thrown into the mix of a bunch of shitty billetsIf you guys like this one I have one more long one like this about the same department getting investigated on a different deployment That one is my personal favorite because it was the perfect storm of incompetence witch hunting and a command trying to deflect attention from gross misconduct from the senior leadership ,1385641253.0,Tried to implement a media share drive in Afghanistan goes horribly wrong xpost from a thread in rtechnology,784,TalesFromTechsupport,top_week
suckingalemon,46,110,1rc2hr,592,I used to work for a phone network in the UK in retailI was out on the sales floor when a woman pushing a young child in a pram approached me with her cheap Gingerbread may have been earlier Android phoneShe began to tell me how her phone kept crashing and was running incredibly slowlyWith a quick glance I quickly noticed a metric shit tonne of resource hogging apps running like battery savers app killers and that kind of nonsense I tried to explain to her that all these applications could potentially slow her device down and reduce the quality of her experience She didnt understand what I was saying I tried again and bluntly said your phone has a virus thinking that most people would understand the gist behind thisShe quickly became incredibly panicked and worried that the phone virus might have infected here infant child as he had apparently been ill over the last few days It took me several minutes to convince her he was safe and that it most definitely wasnt transferableIt was a long day,1385272366.0,So this mom was scared that her child caught a virus A computer virus,702,TalesFromTechsupport,top_week
