author,comments,downvotes,id,score,selftext,title,upvotes
IllegitimateFather,6,2,1r0rtq,2,"I have never committed this story to writing. I am doing it now because I think it should be told.  God help me (its T minus 1 hour and counting b4 I have to be clocked in!!) I have often thought of putting this all down but haven't done it because of the emotional tax that has to be payed recounting it. I haven't yet been able to tell this story without seeing red and getting sad/mad/hateful/suicidal and tearing up  

In '94 I was living with a woman (we will call her A)for a few years when she tells me that she cheated with a person who she didn't really know, and could never locate since he was from another astate and it was a one night stand. She also told me she was pregnant.  I was upset to begin with, but after I cooled down, the thought of her alone with the baby was something I wanted to avoid. I still had deep feelings for her. The baby, regardless of how it arrived, was blameless. I stayed with her every step of the way throughout the pregnancy, all the DR visits, every pre-natal exam. I was there for every second of the delivery. I left only to go to the nursery and see the baby, who I will call D. I fell in love right away.  It didn't matter to me any more that I was not the biological father. I saw a little boy who needed me. 
I remember him lying his incubator in the nursery, I came in and was stroking his little head, whispering to him. He was the most beautiful thing I had ever seen. I vowed to him I would be the best dad in the world. I would never leave him, a promose I was forced to break.
I did something I am not proud of and would come back to bite me and almost derail my relationship with my father. I told my famaily that the baby was mine. It was either that, or tell them what happened and get pressured into leaving her or at the very least treating D as an outsider. Im ashamed of this and if I could do it over, I would tell the truth. I did come clean and tell them after the fact that I had lied and why I lied. We had decided to likewise tell D, at least in the beginning, that I was his father.   


We took him back home a few days later.  She had some post postpartum depression issues but I was there and took excellent care of our newborn. After the depression, I just continued to get up at night for feedings and changings. Truth be told, I loved it. I didn't mind. At the time she was going to a local university for nursing degree and I was D's full time care giver during the school year working night time as a temp, doing whatever I could to keep our heads above the water…selling plasma to pay for the diapers was a regular thing. I was right there for every single one of his firsts.  I took him everywhere I went and we were inseparable. He got sick a few times, he had some asthma  as a small child. I was there by his side the entire time in Children's hospital, I never left him until it was time for him to be released. This happened 3 separate times. 
When he was about 5, his mother started acting strangely. She would leave and not come home till later and later and later until she started not coming home for days on end.  She had become involved with some other guy I found out. We wound up separating and I kept our son with me most of the time so he wouldn't get confused while she got her life straightened out. I got an apartment for us and we were doing pretty well until the building caught fire and we lost most everything we had.  A friend took us in, gave us a room, watched my son while I worked.  During this time, I had D-----, his mom came over to visit him once in awhile but for the most part I had him with me.  About the time that A started not coming home, I met a woman I will call K, who had a  daughter named L the same age as D. She would look after D while I went to give plasma or to work , fed us and made sure we were okay. D and L became very close but there was never anything between K and myself until years after I had lost D.  
 
A wound up marrying this person and at that point, she started taking our son more often,  keeping him with her.  She told me that she was living in her Dads house and there was a room for our son, and this was to be his address now. I could still come get him (that lasted for a few weeks) and got harder and harder to do until I was being told to just leave when I came to pick up D. 
I got a summons a few days later to appear at a clinic to undergo paternal testing. I knew what hat meant. I was being dealt our of my little boys life.  A few weeks later, it was a matter of fact I was not  his father. I had no legal footing whatsoever. I got a lawyer and I fought, but in the end, I was not his biological father. I was not married to his mom. The only thing I had was my name on his birth certificate. 
There was one incident that stands out in my mind. I was awarded visitation at the beginning of the legal process. I was also to get D for a special weekend that was planned. I had the court order in my hand as I went to pick up D from A's mom.  I was denied by her mom and so was nto able to get D for the amusement part trip we had planned. 
In the end I lost my son.  The court saw no reason for me to be involved in his life. The last time I saw my son, he was telling me that he had a new dad, and he was supposed to call me by my name and that I was not ""dad"" any more.  ( this was a few weeks before I lost all rights to see him, I had come over to see him on his birthday, he told me he couldn't take the present I brought ( I still have it)  and his mom let me know that his name could be getting changed (he was named after my brother and father). I made the decision to not fight any more. The look on his face, the tone in his voice, his overall confusion about what was happening, all told me that it was time to stop fighting and let the inevitable happen.   
  

My family adored her (before she took D) and  D, My father sent her to Toronto to see Phantom Of The Opera, paid for it all. Threw outlandish Christmas and Birthday parties for D. My brother would make regular trips to town to see us. And even took us up to his house for a weekend. After A and I broke up, my friend  K and I took D and L to my dads for xmas and birthdays.  
  
I cannot convey the feeling of loss. There are no words that comes close to expressing the utter sense of hopelessness. The thought that my little boy needed me but I could not even see him. I was not going to see him grow up. I was never going to hear his voice again. It was as if he had died. I wanted to die. I didn't.  Id like to say that it has gotten easier to live with. It hasn't.  I have thought about him every single day since then. I celebrate his birthday.  He turned 18 this year. It would be nice to talk to him but I don't know where he is. I intentionally made no attempt to locate him since I wanted to stay out of his life so as to not confuse him.  It sure would be nice to talk to 18 year old D , but as for 5 year old D, he is gone forever.  

What did I learn? What was my lesson from this? Tell the truth. To yourself and your family.  Also, if you don't try to be a Good Guy Greg, be a Scumbag Steve or you might find your self a Bad Luck Brian. 
  
[Proof](http://imgur.com/a/L4hqU)",REDDIT: What Would You Have Done?,4
thisnamewontagewell,8,1,1r0rt2,3,,"What is a physical trait in someone you find attractive that makes you think ""This person is out of my league""?",4
QuotableIowa,2,7,1r0rsd,17,,"911 operators of Reddit, what's the most haunting call you've ever answered?",24
lax4,2,2,1r0rrf,0,,"Athletes of reddit, What was the craziest fight that ever happened on the field and how did it start?",2
blackthorn1984,13,2,1r0rqp,2,,Have you ever had a point in your life where you truly did not think you were going to live?,4
Chill-Flow,17,1,1r0rl9,8,,What's your way of cheating the system?,9
igiveup_youwonreddit,15,2,1r0rgk,4,,What is the best decision you have ever made in your life?,6
Jpjoshuapeter,5,2,1r0rgb,3,,What is honor? Does honor matter anymore?,5
TheLoveTin,2,0,1r0rez,1,I've got tons of dvd's taking up space...would love to convert them to files and have them all in one place.  Thanks!,What's a good program to convert my dvd's into files to store on my external hard drive or iPad?,1
hookahshikari,3,0,1r0re3,1,"The registration for next semester classes opened at my school, and I want to know my options, whether they are the popular ones or the more obscure courses.","Reddit, what is an amazing college course that you would recommend to anyone?",1
puffmonkey92,13,1,1r0rdj,5,,"If you had to come up with a catchphrase for your home country, what would it be?",6
NinjaMonkey77,24,1,1r0rd1,9,,What job(s) did you have in high school?,10
compress_the_tension,1,0,1r0rbq,1,"The question is pretty much in the name, should I be avoiding loans like the plague or should I take what I need to get through. My Mom recently got a massive raise in pay that will prevent me from getting financial aid and I am worried that I might be drug into life long debt if I go to a Uni. Is it easier for engineers to pay off debt? What kind of loans should I be looking for? Thanks in advance!",Should student loans be feared as an engineer under-grad?,1
Gonzalo800,9,1,1r0raa,3,,How high would gas prices need to be for you to stop buying gas?,4
kelseystrasdin,5,1,1r0r9z,2,probably been done before but I'm in a sappy mood and would love to hear,"Redditors, what is your favorite memory of you and your S/O?",3
sfrelich,1,1,1r0r92,0,,What are some good items to put on your Christmas list this year?,1
Pershaun,8,1,1r0r91,2,,What are some of the funniest pranks you've pulled on a substitute?,3
goranistan,12,0,1r0r5p,2,The video of a waffle falling over was my introduction to Reddit. What was yours?,What was your first Reddit experience like?,2
Throwaway3968,35,11,1r0r49,11,"Edit: Additionally, how did you discover them?","Reddit, what are your strangest fetishes?",22
cakebreadd,8,2,1r0r48,5,include links please!,What is the best short film you've ever seen?,7
Yasoon,6,0,1r0r2p,4,I was thinking - could I defend my views to an extraterrestrial being that has no cultural context for our religions? ,How would you describe your religious views to an extra terrestrial being?,4
Abe2424,2,5,1r0r1g,0,,"What are some of the biggest ""circle jerk"" topics of Reddit and how are they when you have tried them?",1
Comassion,6,2,1r0r16,9,,"This holiday season, dollar for dollar, which charity or cause will do the most good with my donation?",11
Thewallmachine,1,1,1r0r0z,1,Tell me what happened.,Have you ever fucked up at work and thought for sure you would be fired but were not?,2
track_attack,0,3,1r0r0x,0,"My girlfriend works at Starbucks. Every day she has a story about some crazy thing a customer has done, whether it's cry because the soy milk is out, or request that they police the parking lot for people driving badly. I'm fortunate enough to have never had to work a job dealing with customers like that, but some of the people she describes are insane. So tell me, what's some of the craziest people you've had to deal with.","Starbucks Baristas, what is some of the craziest things people have done as customers?",3
thewillium,12,0,1r0r06,3,"Reddit, 
What commonly used phrase or word has generally lost its meaning?","What word or phrase in common use has ""lost its meaning?""",3
emmit76,7,1,1r0qyx,1,I never have been in a fight. Tell me some insane stories.,"Reddit, what is the craziest fight you had/seen?",2
lazerllama,16,1,1r0qwe,7,,Whats another website you visit when you're bored of reddit?,8
kuroshishi,3,0,1r0qw6,1,,Have you ever experienced love at first sight? What was it like?,1
Jabberminor,7,3,1r0qw5,2,,"[NSFW] What aspect of sex did you initially think you were amazing at, but soon found out that you were awful at it?",5
HotPants_Dribblebits,1,3,1r0qub,0,,What is your favorite text post?,2
lossofspeech,9,2,1r0qts,1,,"If you could summarize your entire life story in one sentence, what would it be?",3
NamenRoodles,2,1,1r0qsm,1,,"Reddit, what is a catch phrase that you will never forget?",2
rednorberg,4,0,1r0qrr,4,,"Those who were formerly depressed, what steps did you take to break out of your episode?",4
senor_blake,0,1,1r0qrq,0,From stopping Kony to hating Melissa Bachman I want to hear it!,"Reddit, what is the dumbest circlejerk you ever found yourself in and looking back you feel like an idiot?",1
Frankie_Carbone,448,34,1r0qmt,61,Let the hate flow through you,"In 5 words or less, what pisses you off more than anything else?",95
bullet4mv92,9,0,1r0qm3,2,,"To those who were adopted: did you ever meet your birth parents? How did it go? If you haven't, do you want to? Why or why not?",2
Gantznaught,0,0,1r0qlv,1,Like personal trainer Jack Squat,What is the most obscure career oriented name staples you've heard? (like Joe the Plumber),1
RelaxedCease,3,0,1r0qkg,2,"I personally believe life is about growing and evolving in every facet of your being. I believe the only thing that is truly real is the emotions we have, and the way in which we make others feel. I don't know about life after death, but if your life goal is to treat others well and improve yourself physically, mentally and spiritually, any afterlife that exists will favour you.

Just my thoughts, give me yours? ",What unorthodox theory do you have about the meaning of life and what happens when we die?,2
vuhn1991,8,0,1r0qke,4,,What's an annoying myth that your culture/country likes to perpetuate?,4
Capta1nCrunch2,0,1,1r0qjc,0,"For starters, my favorite anime is ""Witch Hunter Robin"" mainly for the reason of the sense of betrayal and realization that the main character experiences through her line of work.","Otaku's of Reddit, what is your favorite anime and why?",1
SmokinHotHusband,9,1,1r0qh0,2,,Why is it that cell phone battery life seems to have a hard time keeping up with the rest of cell phone technology?,3
epain485,11,0,1r0qgt,4,Maybe you tickle your ass clit a bit. I don't know.,What's the weirdest thing you do when alone?,4
platysaur,14,2,1r0qgj,5,,You can only watch one episode of a TV show for the rest of your life. What show is it?,7
SaturnFlyTrap,2,2,1r0qfw,0,,What's something you love to do that not everyone else does?,2
pccd26,22,1,1r0qdk,6,,What is the most useful thing to know before going into highschool?,7
JewishPotato,1,1,1r0qcm,0,,What is the coolest/rarest prop that you own?,1
bigblackmang,4,6,1r0qc0,0,"No money is involved, politicians just make a campaign page which states their policies and then people get a limited number of up and down votes. This is just an exmaple I came up with on the spot but you'd think something similar but better thought-out could be invented?",Why dont we have a political system like reddits upvotes and downvotes? Why hasnt the information revolution effected politics?,2
Agelessbadaboom,4,1,1r0q8c,1,,What is the worst thing you have done but has taught you the best life lesson?,2
crazy_hunter,8,3,1r0q84,0,,"If you could eat one food for the rest of your life, what would it be?",2
Dr_Coathanger,6,2,1r0q7s,0,"Currently I'm rocking Zelda Overworld Theme for calls and Professor Farnsworth saying ""Good news everyone!"" for texts.","Reddit, what's your ringtone/text alert?",2
failsandfacepalms,4,1,1r0q4r,1,,What is the most useful website you have found for doing better in school?,2
newrunner12,8,2,1r0q4c,0,,What kinds of strange Thanksgiving rituals will you practice with your family next week?,1
aphin715,6,2,1r0q3w,1,,"If you could prevent the holocaust by killing Hilter as a baby, but the result is you are never born and you never get credit for it, would you do it?",3
BFirebird101,5,1,1r0q3e,0,,What stops a car from rolling backwards on an incline at a stoplight?,1
mviebuf91,8,1,1r0q2r,3,Why by Louis CK. Hysterical.,What's your favorite routine in stand up comedy? Anything under ten minutes,4
Oakamoor,2,1,1r0q27,0,,"If you were a character in a book, how would you initially be described and what role might you play?",1
emarko1,5,1,1r0q26,0,,"What is one thing that appears to be normal, but when you think about it is really screwed up?",1
intelligentphone,3,1,1r0q1k,0,,"Whats your funniest ""Oh shit"" moment?",1
Nooneeatsat10,3,3,1r0q0w,0,,"Bouncers, what's the worst and/or funniest thing you've had to throw someone out of the bar for? Possible [NSFW]",1
CallMeSoothSayer,9,1,1r0pyt,3,,What little things you are fascinated by but other people seem to completely ignore?,4
catsgelatowinepizza,4,1,1r0pyo,1,"Off the top of my head, I loved the first two Before Sunrise/set movies but realised that Jesse and Celine are actually awful and irritating human beings in the third instalment. I know they're three separate films, but for some reason they are more cohesive than say, Star Wars/Trek/Harry Potter/LOTR/Dr Who etc. to judge as a whole. ","What book/film did you hate the first time, but grew to love? Conversely, what book/film did you used to love but eventually concluded that it was actually pretty shit?",2
proudtob3awesome,2,1,1r0pyk,1,,What helps you feel less insecure/jealous?,2
marbledduck,3,1,1r0pyf,1,,What was your biggest mini-heart attack situation that turned out to be nothing.,2
Caitt,5,1,1r0px6,1,,"What is the sweetest, or most romantic song lyric you can think of?",2
thahuh6,4,1,1r0pwj,1,,What is your daily internet routine?,2
krazekidg,5,1,1r0pw0,1,,What is one decision that you regret making?,2
Aznb01p,3,2,1r0pvt,0,In that job opportunities will be bad. I'm basing this off of increased enrollment/number of medical schools but fixed residency cap.,Will medical school end up like law school?,1
pat8034442,5,1,1r0ptz,2,At somepoint everyone in their lives have checked what they were like in the past. What is the most cringe-worthy thing you saw?,What is the most cringe-worthy thing you realized about yourself in the past?,3
misterkrazykay,12,1,1r0ptx,2,,What's the story of your first kiss? Would you change it in any way?,3
DeepPenetration,14,2,1r0ptr,4,,What is one taste you will never forget?,6
sheeyat223,5,3,1r0prp,1,,[SERIOUS] What is the best lie you've ever told/heard?,4
BobbyWestside,3,2,1r0prk,0,,"People who have died and were revived of reddit, what was it like to die? what was it like to come back?",2
The1RGood,3,3,1r0pqm,1,,"What do you think is the best Tootsie Pop flavor, and why?",4
slid3r,3,4,1r0pq2,0,"Will there come a time when we can no longer eat fish from the Pacific?  Could it get that bad?  What's best case, worst case, most likely going to happen?","How screwed are we in the U.S., (or the world for that matter) from the radiation from Fukushima? [serious]",3
throwawaymilkshake22,5,1,1r0ppz,1,"Recently, someone I work with gave up the opportunity to interview for a promotion because they said they were unable to work with me. How have you (or would you) deal with someone who has problem with you at work? I have no problem working with this person, but do feel this person will be unable to continue working with me without making their issue public.","Redditors, how have you dealt with working with someone who hates you?",2
xFEARFULDEMISE,7,5,1r0pny,0,"In my English class tomorrow we're having a debate on Men vs. Women and who has more power in society. So I was wondering how r/askreddit  would respond to the question, there are many things that tie into it.","Men vs. Women, who has more power in society?",4
alynx,4,2,1r0pmr,4,Let's pretend that overpopulation isn't an issue and all countries wanted said aliens to immigrate  ,"If aliens decided to move to earth, what would every country's slogan be to attract these ""immigrants"" ?",6
cephalopodsandrum,14,3,1r0pjo,14,"Particularly those who were adopted as very young children/babies, how did you react? How do you feel towards your adopted parents about when they told you?
Edit: biological parents,rather than real. Sorry.","Adopted children of reddit, how did you find out your adopted parents weren't your real parents? How did you feel after finding out?",17
ImMitchell,8,1,1r0pji,2,,What are some of your best/ worst/ funniest fake ID stories?,3
Dreakor,3,2,1r0pif,5,"Be it american, french or german, I just want to know how corrupted or twisted they may be.",What are the bad things that the big Universities keep hidden?,7
rland916,27,1,1r0pi5,3,,What is the best smell you've ever smelled?,4
Desmodus1,0,0,1r0pi3,3,"Having left my ""young and immortal"" stage well behind me, I now find myself in the middle of a period where I'm quite afraid of dying. As you pass middle age and enter your senior years does your perception of dying change?  Are you less afraid?

FYI, I don't really believe in an afterlife, so obviously that affects my outlook.",Elder Redditors: How does your perception of death change as you age?,3
014-Andy,7,0,1r0phb,3,,"Reddit, what's the most ""heart warming/made you almost cry"" video that you have ever seen? Something that made you very happy to watch.",3
iamberlo,16,2,1r0pdi,3,,"Without telling us what you did, why are you sorry?",5
MascoTJ,5,1,1r0pdb,2,,"When did you have your first ""I'm getting to old for this shit"" moment?",3
Reddevil313,1,0,1r0pb2,1,,What are some common real life loopholes you can take advantage of in your daily life?,1
JuliusSeizure713100,8,1,1r0p8g,3,,"What villain's goals or motivations are portrayed as evil in the circumstances, but are actually quite reasonable?",4
ABlackwelly,47,7,1r0p6c,14, ,What are the the most significant words in human history?,21
gericks,7,0,1r0p5c,3,,What are some pros and cons to living in your country?,3
DarwinDanger,48,2,1r0p4j,16,,What is a phrase you could say today that wouldn't have made any sense whatsoever just 10 years ago?,18
extropy,4,0,1r0p4b,2,Please be serious in your answers too! I'm legitimately curious as I have never experienced sleep paralysis.,"To those of you who have experienced sleep paralysis, what is the scariest thing to happen?",2
mintyeggrol,0,0,1r0p40,1,,What are some government agencies you never knew existed.,1
yu139,14,3,1r0p3t,0,"You hear a knock at the door. [You open it to see this] (http://i.imgur.com/hfVye.jpg). Kate looks you in the eye and says, ""let's fuck"" You hear your wife/gf calling from the kitchen, ""who is it?"" What do you do?",To all guys in a relationship: What do you do if Kate Upton shows up at your house ready for sex?,2
mar1378,7,0,1r0p21,2,,"[Serious] Which personal trait (i.e. personality, talent, etc.) of yours are you especially proud of?",2
missellie514,1,1,1r0p0w,0,"I recently took a drug test in order to complete the hiring process with Petsmart. I recede a call today from the doctor, telling me that i had tested positive for amphetamine, due to my daily consumption of adderall. he asked for all the prescription information to validate that i was prescribed the drug by a doctor, and said he would call back within a few minutes. Its now been two hours since he's called?! My potential employer is getting annoyed with how long the results are taking, and I'm worried that he may think i'm trying to hide drug use. I was wondering if anyone has ever received a false positive due to prescription drugs, and how long it took to verify the prescription. Help!! ",Have you ever received a false-positive on a drug test due to medication?,1
truth_hertz,0,0,1r0p0s,3,"I used to work retail during the holidays when I would go home between university terms.  One place I worked was a department store, and one day a family came in with a tag from the mall's ""Giving Tree"" that was set up for needy families.  The tag said that the requestor had a daughter and a son about the same ages as the two kids in the family that was buying the gifts.  I ended up helping the family for over an hour, buying things that the kids would have wanted for themselves; the young girl and boy were consulted at length over what clothes would be nicest, which shoes for the anonymous boy would be most admired, and which handbag the preteen girl would like the best.  The family ended up spending quite a bit of money, all the while talking about how great it would be for the two kids to have some nice things that would make them feel like they fit in at school.

Two days after Christmas I was working the returns desk and happened to get the return of all the lovely gifts that the donors had so carefully picked out.  Even worse, the mother had brought her two children with her to return these items.  The girl, who was twelve according to the tree tag, just stood silently sullen with her arms crossed, but the little boy, who was 8, was struggling to keep his bottom lip from trembling as he put the box containing a cool pair of  Nikes on the counter.  The mother acted disgusted with his lack of control and told him that ""you've known all along we weren't keeping any of this when we need it for bills.""

Because they had a gift receipt, our store policy dictated they could get cash for everything.  The mother was annoyed that the donors had bought a couple of the items on sale, so she wasn't entitled to the full retail price but she returned them anyway.

The looks on the faces of the two children broke my heart, and the attitude of the mother infuriated me.  I am pretty sure that she signed her kids up for this toy drive with the express intention of using it to get cash for herself.

Since then, I have never donated to any of these ""buy gifts for needy families"" schemes, because I don't want to get so emotionally invested in the purchase but be thinking in the back of my mind that I'm just being scammed.

Is there a way to make sure that the kids who don't have much for gifts this holiday season get something that their parents won't take away from them in favor of lining their own pockets?  Or are my options simply ""don't buy, or resign myself if I do""?",Is there a way to donate nice charitable holiday gifts that can't/won't be returned for cash?,3
