author,comments,downvotes,id,score,selftext,title,upvotes
puppiesandspiders,2,1,1r0ymc,1,,Could someone please tell me your story of getting out of financial trouble? I am in the process of the contacting debters and panicking about a warrant. I could really use a success story right now!,2
15okac,8,0,1r0ym1,3,"People obviously spend a lot of time on this website, doing various things. I'm curious, for what reasons do you keep logging back on, upvoting or downvoting, why do you keep posting?",Why do you keep coming back to Reddit?,3
JenniferHewitt,3,2,1r0yl6,0,,"Reddit, when did you realize it was time to grow up?",1
Actuarial,24,1,1r0ykk,6,,"Without giving us any context, what is the one thing you absolutely won't do anymore?",7
nomisehtshif,8,6,1r0yhq,0,,"Ladies, who is your favorite male pornstar?",2
Mitcheson555,10,3,1r0yg9,4,,What movie or tv show would be better/funnier with 1 letter dropped from title?,7
bloodkid187,38,7,1r0ycv,7,Please add some context as to why you named it this.,"If you could name your most recent shit after a movie, what would it be?",14
lentenlatkes,6,3,1r0yct,5,"I'm at the age where I think a lot about starting a family vs not starting a family. But for everyone who loves their cute little toddler, there are a lot of adults who have stormy relationships with their parents and issues stemming from them. I read an article once where a woman who chose not to have children said she may never feel a child's love, but she'll also never feel their resentment. So I'm wondering how many (if any) of you have good relationships with your parents as an adult, and if so, what created that relationship?","Do you have a good relationship with your parents as an adult? If so, why? [Serious]",8
JFrye,5,1,1r0yc5,3,,[Serious] What is a quality that you have that you would never change that you think most people would if they had it?,4
Moomoozilla,5,3,1r0y88,0,,What is the nicest thing you have done?,2
Mark_Anatoya,2,2,1r0y85,0,,What was the best day of your life so far? What were the highlights of that day?,1
eliwood98,8,0,1r0y80,2,,What is the one thing you did that you will never tell your parents about?,2
KingCaspianX,1,0,1r0y77,4,"By ""little people"", I mean people who work behind closed doors to keep the world going, like people who work in bridges, in factories, in sewers, undertakers, and private detectives. Anyone who does a job that most of us know exist, and that someone has to do, but no one thinks about. ","Redditors who do jobs most of us don't even think about, what's your story?",4
nadanutcase,2,3,1r0y6b,0,"Seriously, one of the places I go to help buoy my spirit is that subreddit and it seems the rate of new additions is quite low as compared to many other areas that are less worthy in my estimation.  Is this because there really IS less good in the world to point out, because many people with such inclinations and interests are engaged DOING good things, something else ??",Why is there so little new on the Examples of Good subReddit?,1
stever3000,8,2,1r0y5n,0,[serious answers],"People that agree that the American government should keep digital records of its citizens without warrants, why do you believe that? (and vice versa)",1
Dreakor,6,0,1r0y3b,5,,What is the craziest thing you were offered in order to keep something a secret?,5
triton2toro,13,1,1r0y1d,4,"Twice in my life I've known someone who lies constantly.  One was a girl in her late teens, another is a student I have now who is 13.  

Here's what I can't understand.
1.  Who are they lying for?  Are they trying to convince me to believe their lies or themselves?  I've witnessed them doing x and yet they keep telling me they didn't do it.  
2.  Do they believe their own lies?  Do they know they are lying but are trying to avoid trouble, OR are they delusional?  Do they truly believe the lies they tell?  
3.  If they are delusional, what would happen if I videotaped them secretly?  They would lie about something; I'd play them back the videotape proving they are lying.  Would they admit their lie OR would they somehow attempt discredit the video tape evidence? 

I just want to know what's going on in their minds.  I'd ask the student, but he's so dishonest (or delusional) I wouldn't get a meaningful answer anyway.  Anyone have any experience with these type of people?",What goes through the mind of a compulsive liar?,5
cowboyzfan27,9,0,1r0y1c,4,,What is the best approach to slip by without getting a ticket when a cop pulls you over?,4
mytardisisaford,23,3,1r0y0z,1,"I am 23 years old but everyone I meet comments on my appearance saying how I look like I'm still in high school. Everyone thinks I look like I'm 15-17. It annoys me because I want to look mature, not like a little girl. When I complain to people about it all they say is ""you'll be thankful for it later"". But I want to know why I look so young. Is it just genetics or something else?",Why do I look so much younger than I actually am?,4
JuandaHadTrips,8,0,1r0y0f,5,,"Reddit, what ""I'm about to die"" experience have you went through?",5
Samason560,1,1,1r0xzm,4,,What is the best moment of kindness that anyone has shown you?,5
I_Love_Underscores__,7,0,1r0xzj,4,,"What's something that very few people own, but, makes your life so much easier if you do own it?",4
gibbler,7,2,1r0xz5,2,,Do you think people with tattoos or piercings are more likely to be promiscuous?,4
FuneralShadow,10,2,1r0xz0,2,"November 22nd will mark the 50th anniversary of President JFK's assassination. If you look online, there are many theories as to what people think killed our president John F. Kennedy. Lee Oswald, the 0 year curse, and some people believe our own government was responsible. Which do you think happened? Do you believe there was something else? 

I know many people believe Oswald did it. But some people think there's more to it. What do YOU think? 

Edit: I a word. But very interesting comments so far! Some of these really get you thinking. Keep them coming! I'd love to hear what you all think. ","This year will mark the 50th year since JFK was shot. Reddit, which theory do YOU believe happened?",4
Blazichicken,4,0,1r0xxs,3, ,What is something that you expect to be invented within your lifetime?,3
quitehodor,0,1,1r0xxn,0,"Obviously donating and microloans to fix the problems in developing areas (if microloans are a good way, I'm not sure). But if I want to go there and help, should I contact some coordinating organization? Can I just how up and start helping? In case of a typhoon or hurricane abroad somewhere? ","Humanitarian workers of reddit, how did you get to the position you're in now and how could I help in e.g. humanitarian crisis area?",1
WillyWONKA880,8,0,1r0xxi,6,,What is something normal that you find really odd?,6
scuczu,1,3,1r0xx5,0,"Not that it really matters, but kind of curious, walking through airport security my gf was stopped because they saw a unknown mass in her shoulder, right in the spot where she's been having some pain lately, and we're both wondering if the sore muscle could show up on the scanner.",Can a tense muscle pain show up on an airport scanner?,1
gobslobbler,10,6,1r0xwz,0,"I was raised by strong women to respect women, and I don't stand for nudge-wink bullshit. I am curious about how you have encountered/discovered chauvinism (blatant, back-room, suspected, etc.) and how you chose to deal with it. Thanks!","Feminists of Reddit, what is the single most disgusting example of male chauvinism you have encountered in the workplace (or otherwise)?",6
Fetal_Sacrifice,7,0,1r0xwb,3,"or what, artist, EP, album, whatever!",What song makes you happy?,3
jimifun,1,0,1r0xvn,1,,"People with niche hobbies/interests, when have found an other one of your people out in the wild?",1
thejaytheory,6,1,1r0xvf,1,,What is your guilty pleasure that you don't typically broadcast?,2
LollypopLane,4,1,1r0xtn,1,,"Reddit, how did you deal with your bad breakup?",2
malachiii,28,2,1r0xt7,0,"Last January, I met a girl in my university-level French class. She was a freshman, I was a junior (4 years age difference). She sat next to me in a language lab and introduced herself. I didn't think much of her at first. She was plain, I was an ass who could've gotten any girl that I wanted, but she liked talking to me I could tell. I lied a lot at first, too. I wanted her to think that I was more important than I actually was because I was four years older than her. The thing is, I never was good at lying, and maybe she saw through it, but she kept talking to me. We'd walk home from class together every Tuesday and Thursday.

Our first date was to the movies. It was a good time and I found that I could be quite honest with her. I didn't kiss her that night because I was and still am very nervous around girls beneath my exterior. 

The second place we went was to a concert. Things were more forced. We danced. It was much more different than our first date. I was the one being forceful because I was getting impatient waiting for us to make some kind of physical contact. 

She disappeared for a week. She replied to my texts but her response was always that she was busy. I took it as a ""fuck you.""

Our next time walking home togther, she explained that she wasn't looking for a relationship. I told her that I was not either. She then said that she couldn't see me because she still had feelings for her ex, who treated her like shit. But she asked me if we could still be friends. This killed me as I had heard this story so many times but I accepted it and didn't get angry.

The rest of the semester in French class was awkward. She would seldom go to class and when she did she was always distracted by her phone and would sit in the back of the room by herself. Towards the end of the semester, we had a group project. I asked her if she wanted to work with me and two other friends and she said yes. It was around this time that she started warming up to me and talking again, even if it was only about school.

Once the semester was over, she went home to the Midwest, I went home to the East. Our hockey teams were playing each other in the playoffs and we texted back and forth for a full week and a half. It wasn't all banter; at one point she admitted to missing me.

When we returned to school in the Fall, we made plans to meet up but it didn't happen until halfway through October when I ran into her at the gym and she asked me out for a drink. I still don't know if the connotation was friendly or something more.

We met up for drinks - it ended up just being the two of us. We talked and smiled a lot. I found that we could talk about anything, that I could talk about my real opinion with her and she was always interested in what I had to say. The feeling was mutual, as I could not be brought down around her. We made it all the way back to her apartment, where we talked for another two hours about almost anything. We even made plans to throw a party for both of our birthdays together. As comfortable as I was with her, it had been some time since I had kissed or even hugged a girl and my nerves were still on end. Even after breaking the physical barrier, I couldn't do anything more than hug her, just out of plain fear that she didn't want me to kiss her. As I was leaving her apartment, I had the impulse to just go for it, but just as I did, she froze up and I quickly turned it into another hug. 

A few days later, she sent me a text explaining that she has feelings for someone else ""unfortunately"" and that the other night was just supposed to be friendly and she had never intended on inviting me back to her apartment. I tried telling her my feelings about the night but she only responded with ""I just need to know that we are just friends.""

I suggested meeting up to talk things over and she agreed. But four weeks have gone by and we still have not talked face to face. 

Last week, she was participating in a dating auction. She and her friend were volunteering themselves as part of a charity fundraiser event to be purchased by spectators and taken out on a date. Feeling like I had to become a presence in her life again, I had the idea to go. My friends suggested that buying her would be too weird of a gesture, but that buying her friend would send a powerful message. 

So I did it. I went to the auction, saw her there - neither of us said hi even though we weren't far apart - and I bought her friend for $75. She was bought by a guy who she had come with for only $65. 

She didn't have any reaction though. Or if she did, she certainly did not want me to know about it. This was disappointing.

I took her friend out to the movies on Sunday as a follow-up to the date auction. The plan was to make no mention of the girl I liked but to be flirtatious with her friend. The idea was that if her friend talked about me, it would be good for me. 

But the date didn't go as planned. First, her friend made plans with me, i.e. ""we should do this sometime..."" By the end of the date, however, all such talk had ended, even though we hadn't even talked that much during the movie. Her friend knew about my past feelings. She also knew that I wasn't going to make a move on her. It turned out just to be a friendly date. When I asked her out of curiosity if she'd do it again, she said she'd have to think about it, but that she was rooting for me ""back when"" her friend and I had a thing. She also said that her friend is very bad at expressing her feelings. 

Now I'm here, wondering what my next move should be. She has not contacted me. I can't move on from this. I want her but getting to her has been a major life task. My gut and my friends tell me to just forget about her, that I'm wasting time. But every time I see her all anger I feel toward her for keeping me in the dark is vanished. I can't stay angry at her, and I have so much I want to say, but I can't be with her. So that's where I am. My fear is that she's just waiting for this to blow over since she is not good at confronting people with her emotions. 

I can't tell if she just thinks I'm immature or if she's just trying to avoid falling for someone.",Broken-hearted. Is it just bad luck or am I a fool for trying?,1
ohthatsgay,0,2,1r0xt3,1,"I was recently sexually assualted and even though I have reported it, I still feel like shit. How did you guys deal with it?",How did you deal with/ cope with being sexually assaulted?,3
lefsok,5,2,1r0xss,1,,Do you require your servants to wear uniforms?,3
Fatmuffin,3,1,1r0xs3,0,What pleases thee reddit? And Yes drugs count as an answer ,What is your go to thing to make a crappy day better?,1
Ihaveaquestionyo,1,3,1r0xrn,0,"Hey guys. So I remember awhile back hearing about a twitter called ""ratemymeat"". Today I was bored and curious (I didn't expect it to be what it was) and I googled it and looked at the twitter for like a minute before realizing what it was and turning it off while on my university wifi. Idk if that's considered porn but we can't watch porn here and it's all blocked but that wasn't. Can I get in trouble? It was sorta on accident I should've just realized. Thanks. ",Uni wifi question?,1
osk1123,15,0,1r0xqd,7,"Anything besides puberty really. I'm asking about life experiences which had never happened to you before, changing who you are as a person and not as a body. ","When did you first realize you were ""growing up""?",7
pavelperez,1,0,1r0xq8,2,I mispronounce words in my language wrong because of them. Also my mom told me that getting a shower after eating could make puke. ,What did your parents teach you that once you grew up you realize was false/inaccurate/silly?,2
SD_Guy,23,3,1r0xpq,14,"My fiance said she would prefer it if I was ""cut"". I'm considering it because I love her. Tell me about it.",Anyone been circumcised as an adult? How was that?,17
VoidInsanity,9,1,1r0xpk,1,,We've done adding - Now what is the most amusing new film we can make by removing 1 letter?,2
Yfredo,6,0,1r0xpi,1,,When is the last time you flipped someone off?,1
razz7,8,2,1r0xo5,1,Background: I can grow a decent beard. Not bad but not great. I get mixed reviews on it; my family and coworkers mostly think its funny but my friends think its pretty good. I leave my decision to you ladies.,Ladies of Reddit: how do you feel about beards?,3
lax4,2,1,1r0xns,1,,"If you could go back in time and stop an historic event from happening, What event would it be and why?",2
caesarshome,2,1,1r0xkz,1,"I just watched a documentary called married to Moonies. For people who don't know what they are, moonies are people who are in unification church, and they have a mass wedding of 3500 people. 

It's like arranged marriage except there will be thousands of people getting married at the same time in the same way. Usually the couples are from different countries, and some have high language barrier. 

So I was very curious how the marriage worked. If there are any in reddit, please answer away :) ","Married Moonies, what's your marriage like?",2
blocknfall,4,1,1r0xk0,0,I was just curious as to what also first sparked those interests and the lengths you've gone to obtain items.  I've been collecting birds nests for the past few years and have them displayed around my apartment on shelves.  What are yours?,Reddit: What are the most odd collections/ interests that you've accumulated over the years?,1
DwayneAllDay,6,1,1r0xjx,1,I'm ready to read some good stories...,What is the weirdest/craziest thing to ever happen during your college lecture?,2
errorcode1347,5,0,1r0xjv,4,,"People of Reddit, how do/did you deal with depression? How did someone you know deal with it?",4
RDCoste,5,1,1r0xjh,0,If I came up to you and said I was thinking about majoring in philosophy what would you tell me?,What do you think about philosophy?,1
dcfoxcoisfuckinggay,4,2,1r0xil,0,I'm learning about different kinds of religion in seminar and I'd like to hear what you guys have to say.,"How does history affect Zoroastrianism, and how does Zoroastrianism affect history?How does history affect Zoroastrianism, and how does Zoroastrianism affect history?",1
DeathBiChocolate,9,5,1r0xi0,0,"Yeah, doing that whole opposite question thing. ","What's the most amusing new film we can come up with, by taking away a letter from an existing title?",3
guysnake,1,2,1r0xgu,0,"Can't wait to see all the murder cases. Actually, I probably could wait. I'm going to sleep soon.",What is something you want to know more about but you're too scared to look it up?,1
Intoxicated_mermaid,23,1,1r0xgc,6,"
","Hey guys of Reddit, what made you finally realize that a girl had a crush on you?",7
UncleNukem,2,1,1r0xfu,3,,"Reddit, whats your paranormal experiences that can't be explained?",4
eldercreedjunkie,6,1,1r0xfr,1,,"What is something you used to do in the past that you thought was cool at the time, but now makes you cringe when you think about it?",2
andthisiswhere,5,2,1r0xef,0,Looking for fun or interesting things that you can learn in 15 minutes or so. What are some quick and interesting skills you have picked up?,What is an interesting skill that you can learn within 15 minutes?,1
Rainbow_Dazzles,16,3,1r0xd0,0,,What's one opinion you have that everybody else disagrees with?,2
shawndw,1,0,1r0xbh,2,I'm not up to anything illegal but if an employer saw my browsing habits they might be less inclined to hire me. I've been looking for work for months now and have been through plenty of interviews that seem to go well but no job. I've recently installed donottrackme which is a firefox addon that blocks tracking cookies but I'm wondering if the damage is already done. Do human resources departments use information gathered from tracking cookies in their hireing process and if so is this legal?,Can employers get information from companies that use tracking cookies?,2
IN_U_Endo,6,1,1r0xbe,5,Edit: chemicals too,What technology do you think exists that governments/militaries still keep secret?,6
eddiedean0,6,1,1r0xb7,1,"I have a relative that disappeared two years ago, and recently we discovered that he joined a cult (it seems to be a variation of 'Family international'). I want to know stories about how people got out.",Have you ever been in a sect? How did you get out?,2
RogueLieutenant,6,0,1r0xaw,2,"And why?You know, like Christopher Columbus...",What famous figures are looked up to or idolized wrongly?,2
Maedroas,35,1,1r0x8d,7,,"If you are in a room with 1000 other people, and in order to leave alive you have to be the best of them all at one thing, what would it be?",8
AlexE91,1,0,1r0x6o,2,,What is the absolute worst thing you have said/heard someone say to another human being?,2
allymacster,1,0,1r0x6m,2,"It frightens me that the government can sensor legal material and I question where the line will be drawn if we don't try and counter this now. As it contains scenes of simulated rape will everyone who owns a copy of Pulp Fiction or 50 Shades of Grey face a prison sentence?

I am currently in the process of writing to my local MP, but I fail to see how my letter alone will make any kind of impact.

I would like to argue against all of Mr Cameron's arguments by stating that I am not an ""embarrassed husband"" I am a woman, I enjoy watching pornography and reading erotic literature; I watch porn with my partner and we often send each other videos we think each other will enjoy.

I believe as long as 2 (or more) consenting adults are legally enjoying what they are doing together no one should ever be made to feel like a sexual deviant like I have been made to feel about enjoying BDSM.",Is there anything that can be done to stop the government censoring material on the internet in the UK?,2
Yasoon,4,1,1r0x56,1,,What do you think is the greatest danger we face as a civilization? (ecological disaster / plague / social decay / intergalactic bypass construction?),2
rosemarlene,3,0,1r0x50,2,,What is your earliest memory (and how old were you at the time)?,2
Yiffing_Time,17,1,1r0x3d,7,,"Other than cheating and abuse, what is the one button a boy/girlfriend could push that would make you ex them right on the spot?",8
nastymonk,8,1,1r0x1q,1,,What everyday item is probably based off alien technology ?,2
JaviG,3,1,1r0x1p,2,"That's it. I am currently playing Folklore for PS3, and it is insane, but I guess a lot of people missed it because it didn't have enough advertising, hype or whatever.

So, I was wondering what other good games could the regular gamer have missed, and should totally try before changing to the next gen?

Obviously, GTA, Skyrim and the likes do not count. If anyone has not tried them yet, they can't argue that they never heard of them.","Now that the end of the current gen of consoles is upon us, what games have gone under the radar and you consider totally awesome?",3
ShiShoSha,1,1,1r0wzk,1,What is the world supposed to be like?,"Literature buffs of Reddit, what stories written in the past are set in our present?",2
I_Cant_Alphabet,7,1,1r0wz4,1,"During my interview for my current job, I asked about the tattoo policy because I want to get one soon. After the standard ""make sure it's in good taste, or can be covered"" response, my reply was ""ok I was thinking of getting THUG LIFE tattooed across my knuckles. My current boss thought it was awesome and I've been there 5 months and just got a raise. What do you say that made you go ""oh shit!"" but turned out well?",What's the dumbest thing you've ever said during an interview that still ended in a job?,2
gatamarilla,5,1,1r0wyr,0,"I am looking for the title of an European movie I saw many years ago: it must have been Italian, Russian, French or German. An oldish gentleman is traveling through the countryside (Russia?) and ends up in an aristocratic hotel/retreat mansion where everybody is sipping tea and dragging their dresses. A woman makes him believe that they have had a relationship in the past and he cannot remember but she keeps telling them their story through flashbacks. ",Name this film! Please?,1
swordkill38,5,1,1r0wxf,2,,If you could turn one non-living object in the world living for 1 day what would you pick and why?,3
ModelZXGiro,6,2,1r0wwi,0,,"Whats A game you have always wanted to see made, and how would it play?",2
MileysBieber,3,1,1r0ws1,2,"I need to write a 20 something page research paper in the North Korean kidnappings of Japanese during the 70's and 80's, but I have no clue where to start.

I have collected research materials, prominent books and articles.","How do I start a research paper? Without a rubric, and based off my own research I am clueless.",3
Dirty_Mike_69,14,3,1r0wrt,2,,"In 10 years, who do you think will be the next Superpower?",5
Revojake,86,5,1r0wrp,8,"I guess you could say I'm wondering what our ""Achilles' heel"" is...;D",What do you consider to be the biggest flaw in the human body?,13
Jetoable,1,0,1r0wqo,3,I'm interested in knowing other pilot's stories and how they became pilots! ,"Pilots of the air, both commercial, military and private, how did you begin your flying careers? What do you do now and whats the funniest/most intense story you can tell Reddit about your flying experience?",3
WeskerFare,2,2,1r0wqa,0,"I have a tendency to fall in love with the image I create for someone based on only their appearance and what I see and hear from a distance. I tested my theory again today, and I've realized that after I actually get to know them, my idea of them is shattered and I want nothing to do with them. It's really frustrating actually. I'd like to know what you all think.","Experienced men(or women) of reddit, how drastically has your perception of a girl(boy) changed after actually meeting them?",1
freekuzoyd,5,6,1r0wq6,0,,"If you couldn't add a new word to the English dictionary, what would it be and what would it mean?",1
UnitedRD,20,1,1r0wq3,5,,Reddit what is your favourite video game song?,6
