author,comments,downvotes,id,score,selftext,title,upvotes
DillPicklesNcream,0,0,1r18tp,1,"I would have to say the Leapfrog toys, and the gaming systems of today.","What toys do modern children have, that you would have wanted when you were a child?",1
Niichie,0,0,1r18tg,1,So I think me and my girlfriend of four years just split up. It was mutual but I don't know how to feel about it. It was my fault I made bad decisions and acted selfishly most of the time which had lead to a very unhealthy relationship for both of us. I feel like I've just lost the most beautiful thing in the world but I want her to be happy. I've always been a selfish person and this is honestly the first not-selfish thing I've ever done but it honestly feels like I just lost a massive part of myself just now.. Does anyone have any experience in this?,"Hey reddit, how did you deal emotionally with your worst breakup?",1
Chef_de_Stein,0,0,1r18s4,1,"I live in Connecticut, USA and I was just wondering when I can see the comet. What time? What direction? And a general point of interest in the sky?
Thanks ahead of time!",Comet Ison viewing times?,1
bknaust,1,0,1r18qx,1,,Current/former marching band or pep band members of reddit: What was your favorite popular song to play and why?,1
shartsy,0,0,1r18ql,1,"Pics please, obviously. ","Reddit, what celebrity do you look like?",1
ImAFrekingFlyingBear,0,0,1r18om,2,"For Example, those ""Life hacks"" that people say work.","People of Reddit, is there anything you have learned from Reddit/The internet that you commonly use in your life?",2
Princess_Little,0,1,1r18n6,0,During David Blaine 's special. 35 minutes in.,Did anyone else get as excited as I did to see Stephen Hawking smile?,1
Bevoandbroncos,2,3,1r18mz,0,Dogde.... no. Doge. Like what other word is pronounced like that. Not vogue. Not rogue. Doggggeeee. This is really bothering me.,"Okay this is serious, is it pronounced doge- like grudge is pronounce grudge? With a hard g?",1
paulk94,1,0,1r18mv,2,,What are some creative ways to save money?,2
waveform,1,0,1r18m4,1,"I had an extremely unusual dream last night (well, as far as I can remember), in which I was mucking about with my dream characters. I was telling them we're all in a dream right now, and they seemed not to know what to say.

I proved it by making them sit down, or spin around, against their will - they were surprised but accepted it. I took them outside and created a rainbow from my hand, saying, ""see?""

Then I took two of them aside and said, ""I want you to try and *remember what happens after I wake up, and tell me if I see you again. Tell me if you continue to think and remember anything, or if you just cease to exist then pop up again. You see, we're very similar - I can't remember what happened before I appeared in my world either! My life could be a dream too, like yours."" And then I woke up.

It's the sort of thing I'd probably do, if I really was ""lucid"" - be very excited, do some stuff and try to find out how this universe works. But one thing bothers me - I didn't have sex. If I was *really* aware I was dreaming, I suspect the first order of the day would be to have sex with five women and a mongoose. Once that's out of the way, sure, have a look around.

So how do I know if this was a lucid dream, or *just a dream about having free will in a dream*?","How do you really know if you've had a lucid dream, as opposed to simply dreaming that you had one?",1
woodenturkey,0,0,1r18lh,1,"Mine are the seeing these awesome shows 

[**Outside Tour**](http://en.wikipedia.org/wiki/Outside_Tour) David Bowie and NIN Together






[**The Area Festival**](http://en.wikipedia.org/wiki/Area_Festival) Moby, OutKast, New Order, Carl Cox, Nelly Furtado, Incubus, Paul Oakenfold, The Roots, The Orb, Rinôçérôse. At this beyond beautiful [place](http://i.imgur.com/zYd445w.jpg)


And every Beastie Boy  show. 
",What is your most unique concert experiences?,1
pierater,2,1,1r18l0,1,,So what's on your Christmas list?,2
Tbomb1016,0,0,1r18ku,2,,What is the most moving documentary you have seen?,2
JohnnyMooseknuckle,0,0,1r18ks,1,,"Call center employees of reddit, what are your best stories?",1
Camohunter,2,3,1r18k4,0,,Female hemophyliacs- are periods more of an issue because of your condition?,1
jsennn,2,0,1r18j0,2,,What do you think the Reddit front page would look like if everyone got no more than 1 vote per day?,2
DoctorWhovian91,2,1,1r18ih,0,What does she do that drives you bonkers? The hair flip? The lip bite? Does she dp yoga naked in the living room?,"Men of Reddit, are there any little things that your girlfriend does that you find irresistible?",1
yeoldthrow,11,1,1r18h2,0,,"Reddit, I am drunk. What should I do next?",1
amazingymnast,0,2,1r18go,0,So I found out I have it and I was wondering how other people experience it differently.,"Fellow people with synesthesia, how does it effect you? Can you describe your experiences with it?",2
donnielehmkuhl1,8,0,1r18gk,5,,What simple action or thing turns you off completely ?,5
impresently,3,0,1r18g2,2,,"Besides your family, friends, school, (and all the obvious stuff) what three things have shaped who you are today?",2
KalenaCrazy,3,3,1r18eu,0,"What the hell kind of noodles do I buy? I don't want to use Top Ramen, I'd like to use something more fresh maybe even something I can make myself. I'm open to suggestions but I want to go for a more authentic flavor.",Homemade Yakisoba?,1
miurace,8,1,1r18et,3,Is there a reason for it? Past experiences?,What is your greatest fear?,4
Bond___James_Bond,2,0,1r18em,1,What would be a good word or phrase to add into Cards Against Humanity,What would be good a word or phrase to add into Cards Against Humanity,1
jizzissippi,4,0,1r18dy,3,,"Hypochondriacs of reddit, what is the worst problem you've thought to have had that turned out to be nothing?",3
Narcotic_nugget,5,0,1r18d0,2,"One of my favorites is:
I’m not a weatherman, but tonight, you can be expecting at least 9 inches. ",What are some of the funniest/ dirtiest pickup lines you know?,2
throw1837,2,1,1r18cq,0,,Which Subreddit can I use to find people who will help me track down old posts on reddit?,1
robroymacgregor,2,1,1r18ch,1,"I am not a conspiracy theorist at all, I am just curious as to why those of us who choose to believe in these theories hold their views so strongly. I want to know what causes people to adopt alternative narratives to what is commonly believed to be true in mainstream Western society.

Edit: I guess I'm asking, what was the particular trigger?",Conspiracy theorists of Reddit: what makes you believe?,2
twstr709,7,2,1r18ax,1,,What is the best song that came out of the '90s?,3
ox_raider,1,1,1r18av,0,"Salaries, SSN's, everything.  What a joke.  How can I best protect myself against people taking advantage of my info?",My company just sent out a mass email sharing everyone's Social Security Numbers. ~ 1000 people now have all my personal information. What should I do?,1
ShaggyKyle,0,0,1r18ao,1,"Just curious as to what is the common perception of Sharia law and the general view on certain extremists?  Is it like Christianity where many people ignore large parts of the Bible, or do you accept everything in the Quran?  Is Sharia law common, or is it just certain sects that practice it?

This is after reading this article posted earlier:
http://tribune.com.pk/story/632590/honour-killing-case-initiated-against-brother-for-murder/",Muslim thoughts on Sharia and Extremists?,1
wyo_style2,2,0,1r18af,1,I work three jobs that all require me to be on my feet and are physically demanding. So...limited sleep. Lots of physical strain. Energy drinks make me sick the days I don't have time to eat. What do you do when you hit that wall?,What are your go to forms of energy?,1
Ketchupplease,2,0,1r189a,3,"So obviously I feel uncomfortable in small spaces and elevators or small ceiling hotels where I feel like I could get trapped. But also there is this element that has to do with my claughsterphobia where in my mind things start to close in and I start to have a panic attack, sometimes it happens when experimenting with drugs or alcohol but still..? Also, this doesn't have to do with claughsterphobia but I have this thing where I always have to make people like me by always choosing the right decision however that stresses me about because I don't always know what to do and when I get it wrong I feel like that person will hate me. So basically I feel like I always have to please everybody and that's annoying. I overthink things. Any suggestions or similarities on maybe what I should so to control it?I",Is there anyone out there that shares the same claughsterphobic symptoms as me?,3
asnailsrage,5,2,1r187v,0,"I've been trying the whole day yesterday and my human check always fails, although I make sure it's correct",Why can't I post stuff?,1
flashfusion,2,0,1r187h,2,"And please dont mention anything sexual. ( we all have our dirty fantasies) 
For Example: Me im honestly a nice guy one of the nicer guys out there, but i secretly cant stand to see someone proud or have pride on something. for example i have a friend (23y/o) who has 3 very close nieces that look to him as a role model. He takes very much pride in them and so i got close to his 3 nieces pulled them away from him and made them like me more. I felt bad after so i stepped back a little and now they like us equally as much. Also im very manipulative. i tend to use my charm and pretend to act young and stupid to make others do what i want them to do. and no one ever really catches it.","People Of Reddit, Do you have an evil side?",2
ansleyelley,0,0,1r1874,1,What was it like being raised by one? ,Does anybody have Sociopath/Psychotic parents?,1
poopitypong,2,2,1r186j,1,,How is the American Revolution taught in England?,3
Yelsiap,8,2,1r184k,6,"Our 5 year anniversary is coming up in a month and I had been planning to pop the question, only not on our anniversary, and I wanted it to be a surprise. Well... She knows about the ring, AND that it was my mothers, so the surprise thing is out the window, and with our anniversary being so close, I think she's expecting it that night... I want to do something romantic and clever that will take her breath away and that she'll be proud to tell people about for her whole life, but I'm at an utter loss... Reddit help? ",How should I propose to my girlfriend?,8
sunshine2607,3,0,1r183q,1,,"What are some song lyrics that, when taken completely out of context, sound really suspicious?",1
therealprometheus,0,0,1r183p,1,"The question is pretty open.
(I am assuming USA's economy is not going great over these last few years )


If you think the question is not clear enough here are more specific questions.

* What are the everyday experiences and effects of the economy on the graduate students?
* How do you think the US economy is doing today?
* Did you notice any change in the economy?
* If you did notice the change in the economy did it have any influence on what you are studying right now?
* What are you expectation for the future of the economy?
* If the economy was doing better or worse, would you change what you are studying right now? And what would you expect from the future?
* What are you financial expectation after you are done with graduate college?
* How is the job market for your field?
* Do you expect to find a job based on how the economy is? What financial expectations do you have with the job you might have after graduate college based on how the economy is doing right now?

I can't think of anymore questions hopefully you get the idea and help me. I need to interview graduate students and Reddit is one of my sample. ","Graduate students, How has the current economy affected you?",1
megfry88,3,0,1r1832,2,"OK!  My SO and I cannot come to a consensus on this, so we turn to you Reddit!

Let's say today is Wednesday the 20th.  My SO is asking me if I have to work ""next"" Tuesday.  I took this to mean Dec 3rd, which skips Nov 26th, because, to me, ""next"" is meaning not this Tuesday, but the one after.

He thinks I am an idiot and that there's no way anyone would make that mistake.  He claims that ""next"" means the next one in line (which I claim the word ""this"" makes more sense).

So, when someone says ""next"" whatever day, does it mean ""the one coming up closest to today"", or does it mean ""not the one coming up closest to today, but the one after""?","Askreddit, when discussing upcoming days of the week, are the words ""next"" and ""this"" interchangeable? If not, what is their difference in this context? (Example in comments).",2
thejewznextdoor,4,3,1r181w,0,,"If Reddit were a high school, what cliques would each subreddit fall under?",3
opeyshion,2,3,1r180v,0,I mean why is it so unbelievable that other civilizations could have an accident? I mean humans have been using boats for over a thousand years and we still manage to kill ourselves on them.,"Why is ""if a civilization had the capability to travel all the way to Earth there's no way they would ever crash"" an argument?",1
shootingstar1196,4,1,1r180m,1,"Not necessarily the lyrics, but just the storyline of the video itself. Some music videos are almost comparable to mini-movies because they have developed a plot to run with the song. Which would you choose? ","If you could live/experience the plot of a music video, which would you choose?",2
Spenser4Hire,2,1,1r17zm,0,That involves no electronics?,What ordinary inventions do you find fascinating,1
Teslatyr,3,1,1r17zl,3,"No holds barred, say what you want to get off your chest. 

**""Better out than in I always say"" - Shrek**","Hey Reddit, what do you want to rant about?",4
Maoatu,6,1,1r17zf,2,,"[serious] If you suddenly received $100,000 (78,000 Euro), what would you do with it?",3
Philestor,5,1,1r17yf,2,"Any truth, aphorism, or statement about life, the world or anything!",What is your favorite late night deep thought?,3
SwankSauce,1,1,1r17xw,1,Me and my team need a song for warm ups to pump us up.,"Reddit, what are the best songs to get pumped up to?",2
ih8legal,6,1,1r17vs,1,,"Reddit, what was your favorite toy as a child?",2
DoctorBurlyBeard,2,1,1r17v2,1,,"If you could choose the cast of a new Dragonball Z film, who would play which characters? I'm talking live action film, not just the voices.",2
communistapple,9,8,1r17v0,0,,What's the trick to getting a lot of karma?,3
westcoastbounce,2,1,1r17ux,2,,"Students of Reddit, what are your best studying techniques or tips for improving memory?",3
Dahamburglur,0,1,1r17uu,2,"I'm just curious because everyone always says you change once you become a father or mother.

For me, I think it was my stance on homosexuality. I was very condescending and admittedly a asshole but once my son was born it changed drastically. Someone asked me what I would do if he turned out gay and I honestly said I wouldn't care. It hit me that I would love him regardless and I couldn't imagine an instance that would change that, so why would I care if someone else was gay. I had been kind of gravitating towards this idea but that just cemented it for me!","Reddit parents: what's one thing that changed for you, for example with your personality or lifestyle, when you became a parent for the first time?",3
aphrodeaniac,10,3,1r17un,0,,What is your favorite drink which you struggle to find when abroad?,3
Sopp45,6,1,1r17ti,1,,What's the stupidest song-lyrics you've ever heard?,2
Thee_Nick,5,5,1r17ss,0,"I figure being this is a widely browsed international site with plenty of insomniacs, like myself, nothing posted at night really seems to fly up like the daytime hours (i.e. Noon EST time in America). 

Have I just not been on the site long enough or is there just less traffic at night (again night at EST time).",Why don't posts at night really catch on?,3
Part-TimeCollegiate,5,3,1r17q9,0,,Dear Reddit: What would you have liked to known before you moved out to live on your own?,3
PeanutMelonKing,4,12,1r17pw,0,...,"I really wish the Holocaust never happened, anyone agree?",3
aardusxx,1,4,1r17p9,0,,What's your second worst sexual experience?,3
FawkesNi,3,6,1r17p5,0,,Does the Morning After Pill work?,1
Joewolff24,2,3,1r17oo,0,My roommate just proposed this question and both of our opinions were that fashion norms today are pretty neutral for the most part. What does everyone else think?,Are the clothes we wear now relatively normal compared to fashion of previous generations or are we biased towards believing that they look normal?,3
DonDrapersSpermCount,2,7,1r17nx,0,,"Redditors who have attended AA meetinga, do you have any good stories?",3
Satherton,28,8,1r17ni,0,,I have $100 bucks burning a hole in my pocket: Do i spend it on a girl for a date (which i know will end in sex) or go to the strip club and blow $100 at the place?,2
scrivenette,1,1,1r17kl,2,,"Reddit, what has rendered you speechless?",3
SirBloopy,3,1,1r17ka,4,,"If you've experienced sleep paralysis, what's your story?",5
Kelvindork,5,2,1r17js,0,,"If you saw a Dementor, what form would it take?",2
pirateo,4,0,1r17ij,2,"My grandfather once called mom over and gave her a sealed envelope and told her it contains his will etc and that she should open it once he's passed away. Mom put it away and after 5-7 years when grandpa died, she took it out. It had all the legal stuff, some photos and a letter for my mom. Grandpa had been ill for sometime and had recently gotten back home from hospital and one night he just passed away.

The crazy thing is that grandpa had dated the letter he gave mom many years ago with exactly the same date he died.",Has anything ever happened in your life that you could not explain scientifically?,2
GlowWithTheFlow,3,0,1r17hz,3,,How would you describe your family if you could only use movie titles?,3
KillerA,13,0,1r17hx,1,"Could be pics or text, either one.",What comes up when you 'Google' your username?,1
Finntastic,2,0,1r17gi,1,Just wondering if it actually can happen.,Are Your In-Laws Friends with Your Parents?,1
VenomenonMTL,5,2,1r17fl,1,"In light of all the discussion spawned from the most recent UFC event between my friends and Co workers, what do you think Reddit ? 

",What do you think has been the worst call in the history of professional sports?,3
TheGreatSako,4,0,1r17ds,3,"Hardware, OS, software, some IEEE standard, etc. 

Curious 'cause I'm a CS major and I've come to understand just how prohibitive things like backwards comparability and legacy code can be. So I'm curious what answers I can get from this.","Reddit, if you could go back in time and change something about computers, what would it be?",3
aKiDnamedMowgli,5,0,1r17c7,3,"I will be graduating in April of this coming year and I am the only person out of my friend group that is not going to med school.  I am a business major and I plan to work and live with my girlfriend upon graduation.  I am honestly terrified.    How do you cope with such a huge change?  I'm going to miss just hanging out and all the crazy stuff we do on the weekends.  They'll be only an hour away, but I'm just concerned that I'm going to be really depressed when its just me and my girlfriend. ","How do you cope with ""the real world"" after college?",3
Shmashquaqua,0,0,1r17c3,1,,What's your story of public embarrassment?,1
LunarWulfe,7,0,1r17c0,3,,Who is your celebrity crush and why?,3
jkginger11,4,0,1r17ay,2,I was reading and posting in the worst physical feature thread and thought that this thread might be nice. Tell me! What do you like best about your appearance?,"Reddit, what's your best physical feature?",2
BassForDays,3,6,1r177d,0,,What is your worst sleep paralysis experience?,6
Cake4ju,10,2,1r1772,2,,What Celebrity/Voice actor could you tolerate as a preacher?,4
jswilly12,4,2,1r176b,0,,What is the weirdest thing you've seen while watching Disney Channel?,0
ungulate,5,1,1r1767,2,,What's your most memorable experience at the dentist's?,3
TheJeff000,3,1,1r1742,0,,What commercial have you been in?,1
Crazygoingslowlyami,7,1,1r1731,2,"Pretty much exactly how it sounds. If a figure of speech was taken literally or meant literally which would have the most interesting results? 
Ie: he really put his foot in his mouth!
Or shit really hit the fan!",What phrase or figure of speech would have the most interesting outcome if taken/meant literally?,3
Pikochu,3,1,1r171k,1,,What is your worst Murphy's Law moment?,2
Tizy,6,1,1r171f,2,We've all had to do something that was harder or worse than people say it is. ,What's something that's worse than people make it out to be?,3
chrysanthemumsies,7,0,1r170h,4,,What's your favorite fictional universe?,4
VermhatWormHat,19,3,1r16zh,5,"No really, like if someone is new at this, why are people so rude? How does someone even make it in this community? ",Why are people on reddit such assholes?,8
BiggySmallzzz,4,1,1r16xi,3,,What is the most descriptive way you can describe your favorite food?,4
Alexa-the-hexa,16,0,1r16xf,1,"Edit: I guess I needed to be more specific
how do you get people to stop WANTING you to only be their Friend With benefits and never anything more","How do you get everyone to stop considering you their ""friend with benefits""",1
jKyril,2,0,1r16wy,1,,What's your favorite campaign mission/level from any game?,1
_rhino,8,0,1r16uy,3,,"Redditors who've served jury duty, what was the experience like?",3
dlfarthing,1,0,1r16uq,2,,"If you could only keep one thing, what would it be?",2
suppox,2,1,1r16ua,2,"[Link to 1picasso100euros website](http://www.1picasso100euros.com/?lang=en)

My friend sent me a link to this site. It claims a 1/50,000 chance at winning a million dollar Picasso painting if you buy a ticket for 100 Euros (limited to 50,000 tickets).

The website looks a bit rough, and I noticed their Facebook page was opened in March. Have they really not sold 50,000 tickets in 9 months?

Is this a scam?","Reddit, is this website (lottery for a Picasso painting) a scam?",3
Stubbledorange,6,0,1r16tw,4,"And if you're feeling generous, why?","If you could have any historical figure do an AMA, who would you choose?",4
kperovic,13,2,1r16ss,1,,"How old are you, and what are you most passionate about?",3
RVB90,2,0,1r16sd,6,"Embarrassing, rude, costly, let's hear it all!","Reddit, what's the most embarrassing thing you've done at someone else's house without them finding out?",6
Southern_Pianist,0,0,1r16qv,1,"http://www.youtube.com/watch?v=2SAFC4_KbW0  
It seems easy to make, and I'm a bad musician so I would appreciate your help.",How can I make a song like the one in this video?,1
thekaykat,1,0,1r16q2,1,"for example, reading the time","There are plenty of skills that almost everyone has(and should), what is your story for finding people without them?",1
nathancoleman101,1,1,1r16q0,1,"I was bored one night and decided to make a flag that would represent the North American super nation. I called the fantasy nation ""United Americas"".

I wanted to see other designs that would make an equal flag between all three nations. I think mine is more American-oriented.

[This is it](http://i.imgur.com/2Uk408E.png)","If all the nations in North America joined to become a supernation, what would the flag be?",2
6ksuit,18,1,1r16py,3,,"[Serious] What's your age, gender, and what about you, physically, are you most self conscious about?",4
Ethan54theboss,2,1,1r16oq,2,"Ill be posting one Question a day and will be covering a topic from a wide spectrum of topics. 

Please answer with detail. Thanks.",Have you ever had a Horrible teacher/Professor that just gave you hell?,3
hilberry,0,1,1r16oj,0,"I love watching the squirrels figure out ways to get around the ""squirrel proof"" bird feeders in the neighbor's yard.  I'm thinking I could entertain the family by coming up with some fun obstacles or things for them to navigate for treats.  Looking for ideas that will be fun but not cause bodily harm.",What kind of tricks can I teach the wild squirrels in my yard to do for food this winter?,1
berkardo,2,0,1r16m5,4,,What is one thing people like about you that you don't understand why?,4
Lampoonzer,0,1,1r16la,4,,"Reddit, have you ever found yourself in a position where you had to serve up some street justice?",5
desynchronize,3,0,1r16l6,2,Eating the box. ,Females of reddit what do you think of guys that can't foreplay?,2
izdawalrus,2,0,1r16jz,1,"I have a graphic design project to do where I am going to use a Photoshop-painted illustration to show spontaneity, and I have no idea how to represent this in the form of an image.",How would you illustrate spontaneity?,1
davantage,5,0,1r16jw,3,"And if you could go back in time and change one thing, what would it be? ","Redditors who didn't achieve their life long goals, what went wrong?",3
blueflowerchild,1,0,1r16iw,3,,What's the most awkward thing you've ever re-gifted?,3
zrussell197,11,0,1r16hm,2,Last years was Long Daddy Legs. Has to be approved by college administration.,What would be a good name for a comedy show?,2
sFooby,1,0,1r16hc,1,"Health innovations, breakthroughs, health politics, and the related.",What are some good and reliable sources for news on science and/or health?,1
raws_dawg,6,0,1r16g2,1,"It seems to be a daily occurrence: I log onto Facebook, scroll through my feed, and usually see something inaccurate that grinds my gears. What do you see that ticks you off?","Redditors, what false bits of information that circulate on Facebook infuriate you the most?",1
redsy,7,0,1r16g0,4,,What is the most eargasmic sound you've ever had the pleasure of hearing?,4
smbarrett3,3,0,1r16ec,2,"The guy in the stall next to me starts saying ""Hi Honey, how was your day?"" and just unleashes fury into the toilet without he or the listener breaking a pause. To any perpetrators or accessories of this crime, how can it possibly be necessary that you conduct business while the clear sounds of feces being flung into a bowl of water is audible during your conversation?",Why do people talk on cell phones while pooping in public restrooms?,2
