author,comments,downvotes,id,score,selftext,title,upvotes
Alisha33,2,0,1r13k2,1,"   Older ladies of Reddit, I would like to pick your brains for a moment. I know it's a bit long so bare with me.

   I have noticed that girls my age (early 20s) tend to people pleasers. We try to positively accommodating to everyone and often apologize for incidences which aren't even our fault. Sure, we turn around and complain about shitty situations to a sympathetic ear but when it comes down to the moment we turn into complete doormats. 
   For example: Late last week I came home from work with a slight headache to the sound of our lovely upstairs neighbors' children running a marathon in circles around their living room, complete with periodic thuds coming down on our ceiling at the end of each sprint that shook the picture frames on our walls. The first thing I thought was ""I should say something"" followed far too quickly with ""Well, it is only 6:30. The kids don't really need to start settling down until about 8.""
Wait, what? I actually though this? They are making my pictures rattle and knocking on my already pounding head and I'm thinking about how I would inconvenience THEIR day by knocking on their door and asking them to tone it down??
It was at that point that I put on my shoes and walked upstairs to politely inform them that they were being a bit to rowdy and brought to their attention the effect it was having on my evening. 
I'm starting to realize that there's a difference between being assertive and being rude, being polite and being walked all over. And I'm beginning to understand that if I don't say something to people like my upstairs neighbors then nobody will. 

So I ask, Is this something that every woman has to contend with as they grow into themselves? How did you come to this realization if ever? And do you think there's something we can do to teach younger girls that it's not being bossy or a bitch if you politely but firmly state your concerns?

Thanks

edit: *Difference* in the title. I noticed it right as my finger hit the post button.","Older ladies of Reddit, when did you begin to realize that there's a different between being a bitch and being politely assertive? Do you have any advice you could give younger women on stating everyday concerns without fear for being accused of such?",1
not-now,0,0,1r13jp,1,Restarting**,How can I stop gifs from starting over while they load?,1
mangopie101,3,0,1r13jo,1,The seasons almost here and I have no clue,"I need some ideas Reddit, what are some good Christmas gifts you've gotten for people?",1
Ravensnow,1,1,1r13hv,4,"I don't know of any cross references regarding his relative power. Was he Ringwraith level, elf queen level?",Could Smaug beat Sauron? Or Gandalf? Where on the middle earth power scale did he fall?,5
Quelandoris,21,1,1r13ho,3,"Can be anything, ANYTHING besides sex. ",What is the best thing ever?,4
dingusanchez,11,2,1r13g7,3,"Ok so i know everyones all cracking up (get it?) about our wonderful crack-smoking, pussy eating, old woman trampling fatass mayor, but what r ur thoughts? And most importantly, DO YOU THINK HE WILL BE RE-ELECTED?","Citizens of Toronto, what are your thoughts on our beloved crack-smoking fatass mayor?",5
tofin8r,2,0,1r13f9,2,,"People who believe they have encountered something supernatural- what happened, and how did it change your worldview?",2
dancingmonkey789,7,2,1r13ev,0,,Why can't we tickle ourselves?,2
selkadi,7,1,1r13dp,4,,"What is the weirdest ""gif"" you have ever come across of?",5
MadMaxDingo,23,0,1r13c3,3,,"If you were the host of a TV show and the your co-host was the main character of the last videogame you played, who would it be?",3
JustAHiccup,19,0,1r13bw,1,I am currently in college and well I have extreme anxiety about stuff at the moment. I just worry every night if I am doing well since my teachers don't really tell us. I just need to be able to clear my head when I am home and just relax. So I am asking reddit. How do you guys do it?,What do you do about everyday anxiety and stress?,1
matschmid,12,0,1r13bq,4,,"What is something you wish you had, but doesn't exist",4
I-have_a-question,7,1,1r13a5,0,,What percentage of redditors can name all 50 states? How does this percentage compare to the general public?,1
funkmastertom,12,0,1r1398,3,Please don't include things you've intentionally inserted... ,What's the weirdest thing that has come out of your body?,3
mpfh13,16,0,1r133v,3,,What is a bad habit of yours that no matter how hard you try you can't kick?,3
confusedab,4,1,1r132q,0,"My cousin is having her baby shower and has asked me to help her out with games etc. I have never been to a baby shower before so I have absolutely no idea what games we could play! I really want this to be awesome for her!

Thanks in advance :)",Does anyone have any good baby shower ideas?,1
WABSTA3,9,0,1r132g,2,,How are Adult Video Stores still operating with all the porn that is available on the Internet?,2
Chucky1539,16,0,1r131t,5,,People of Reddit: What do you regret not doing in high school?,5
smitty00217,49,0,1r131g,8,Just looking for some ideas to brighten random peoples days! ,"Hey, Reddit! What are some simple, awesome things I can do for random others to make their day?",8
neonicblast,12,1,1r1315,2,,"If you dropped everything right now and walked in an unknown direction, where would it lead?",3
jusbo0219,0,0,1r130n,1,"I know that Physiognomy is still relatively popular in Korea, Japan, and China, especially with the older generations, but im curious if any redditors have had any experience with this?

For those who dont know: http://en.wikipedia.org/wiki/Physiognomy",Does anyone have any experience with Physiognomy?,1
blindsamuri,2,0,1r130b,2,"This can be anything (books, music, etc.), not just visual art.","Reddit, what is the most influential works of art to you?",2
stoneduranus,17,0,1r1305,5,,Did any of you luck out with genetics? How did you get screwed over?,5
MastroCode,1,1,1r12zl,0,,"What is the strangest, most unexplainable thing that has ever occurred to you?",1
fiestydreams,26,2,1r12zg,1,,What do females do that if a male did they would get questioned?,3
turtlecrossing,3,0,1r12yp,3,"I am driving a lot for work and have been listening to various audio books on philosophy and psychology, as well as some comedy.

I was curious to see if there are any books out there that you've read that really helped change your perspective on things in your life.  Trying to make the best use of my time.

Doesn't matter what areas of your life it may have affected,  I'm interested in everything.

","Reddit, what self help book (health, mental health, or other.) changed your life?",3
Lights18,10,0,1r12yh,1,Basically I'm open to the idea but it also seems kind of terrifying at the same time. What are some suggestion you wish someone would have made to you before your first time?,What are some things I should know before trying anal for the first time?,1
hinsonan,9,0,1r12ya,5,,What is the most manly thing you can do to impress a woman?,5
Dawson10,0,0,1r12xw,1,To you or to your room or to other people!,What is your best story of crazy things your roommate did,1
DerrickD26,8,2,1r12wr,1,Thank you in advance ,Is there a aquarium reddit ?,3
RDRKeeper,5,0,1r12we,3,"Has there been any subreddits that you love everything about except for most of the people in it? 

Share your stories.","Hey Redditors, Which Subreddits have the best communities and which ones have the worst?",3
codyg553,13,0,1r12vj,5,,"Legality aside, What is something you do that you also consider immoral or unethical?",5
Rheeronick,5,0,1r12tw,3,,"I need a website where I can submit data from a survey, and then find correlations between the data.",3
aahhaamm,6,1,1r12tv,1,"I am planning on making a sign for my dad for his shed for X-mas, but I'm having trouble thinking of the perfect quote.  I would like it to be funny, but not a tacky overused phrase. So hit me with the best you've got!

P.S. Please DO NOT use the phrase ""man cave"".",Can you come up with the cleverest quote?,2
Drabby,4,0,1r12to,2,Thank them here and restore our faith in humanity!,Has anyone done you a favor and you never got to thank them for it?,2
Flaccid_Flapjacks,4,2,1r12ti,0,,"Reddit, what was your favorite song(s) that were played at the roller skating rink during the 90s?",1
IdiotLantern,11,1,1r12t5,5,"I have two that always make me smirk.

Sometimes I'll say, ""Shut the fuck door!""

Once, during an argument, my father called me a ""mouth ass"" for being a smarty pants. We both chuckled and the fuss was short lived. 

Hbu?","Dudes and Dudettes, What Are The Best Uses Of Or Variations Of Curse Words You've Used Or Heard?",6
aerostotle,1,5,1r12t4,0,,What is your estimate of the total number of upvotes and downvotes?,1
BERTRAMUS,4,0,1r12sa,2,,"If you could change one thing in history, what would it be and what would the world look like after?",2
niplysrelieveitorbot,4,1,1r12s7,1,"This will probably end in weed tits and crackheads. Anyone ever encounter or hear of ""Tree Knockers"" or ""Rock People"" out in the wild? My cousin, who is in the Forest Service swears these ""mountain people"" or possible Sasquatch' live in places like the Sequoia National Forest and signal/warn/communicate to one another by knocking on tree trunks with sticks. He has heard it several times and says that when you knock... they knock back. He is convinced that it is a Forest Service cover up. I'm convinced this post will yield pictures of trees wearing bras and Flavor Flav.","Anyone ever encounter or hear of ""Tree Knockers"" or ""Rock People"" out in the wild?",2
Mr_OG_KUSH,3,0,1r12r6,1,I'm writing a paper on Common Core changes in the classroom and I am trying to get some different perspectives from people with children in the school system now. If somebody could state their view that would be great.,What changes will be implemented in the classroom with the change from NCLB to Common Core?,1
NotAnotherStory,43,2,1r12pi,5,"I guess I should start this off by saying it wasn't any weird porn, just some lesbian stuff. My parents share a laptop and they are both very computer illiterate. I was looking through the ""downloads"" folder when there they were, mini porn clips downloaded. I know this is weird but I feel like I should help him you know? I'm a guy so I know how he feels. But I don't want it to be awkward If I show him a website or how to delete the files... What should I do?",I found undeleted porn on my dad's laptop... what should I do?,7
girl_on_bike,13,3,1r12p0,0,"This is my first Reddit post.  I've heard great things about this community, and I sincerely need your advice/opinions.

3 yrs ago, my then boyfriend and I won a $20k diamond ring in a scavenger hunt. Though we won it equally, he wanted it to be the engagement ring, so he put it in a safety deposit box in his name, then paid the taxes on it (which totaled ~$1,600). (Full disclosure: I entered us into the contest hoping to win and sell the ring to pay off my student loans. When he suggested a future engagement ring, I didn't argue but felt quietly ""off"" about it).  1 year later we broke up, in the most amicable way possible. 

It took me another year to get access to the ring (he was always ""busy""). We agreed to sell it and split it equally, but he put up a lot of road blocks. He would not let me remove it from the safety deposit box unless it was insured, but he wouldn't pay to have it insured, so I paid for it.  I then spent another year marketing the ring, taking it to various jewelers and posting it on various sites to try and sell it for the best price possible. Throughout this process I was transparent and communicative with him, and he was mostly unresponsive.  

On Sunday I sold the ring, and took a picture of the check for his reference.  I told him I'd transfer him 50%, but then he demanded I also pay for half the taxes from 3 years ago.  Obviously after all the hours I put into researching, marketing, and negotiating the sale of this ring, and my cost to insure it, I don't think I should give him cash for taxes he paid 3 years ago, without ever discussing it with me, or showing the paperwork.  It was his choice, because he intended to use it as the engagement ring, but then we broke up.  So people of Reddit, am I being fair?  What would you do in my situation?

I've looked all over the internet for similar cases, but can't find anything for me to compare this to.  Has anyone ever been in a similar situation?  How did you handle it? 
","My ex-boyfriend and I won a $20k diamond ring, is it a blessing or a curse?",2
Mrcoreylahey,2,0,1r12nh,2,,What is your near-death experience or a time when you were positive that the end was near for you?,2
Santabot,0,0,1r12nb,1,"I'm writing a research paper that's supposed to connect the ideas of Thoreau's Civil Disobedience and Melville's Bartleby, the Scrivener to a contemporary film, art, popular culture, politics, advertisements, etc.

Any recommendations on something that's similar or deals with applicable topics? I was originally supposed to analyze the 1972 BBC Bartleby film and the 2000 American version, but this was for some reason unapproved after being agreed upon since the beginning of the course. 

Thanks for your suggestions, I look forward to your insights!","Contemporary film related to Bartleby, the Scrivener?",1
aocbb,3,2,1r12mo,4,,If my eye popped out and I touched it would I instinctually blink my eye lids?,6
linzphun,4,0,1r12mh,12,,"Craigslist Missed Connections users of Reddit, have you ever succeeded in connecting with someone? What happened?",12
begeyk,6,0,1r12lg,3,,What was the best age of your life and why?,3
MikelWillScore,8,0,1r12iq,2,"Or you can do the opposite. Like the ending to a famous movie may have gone completely over your head and everyone else got it first time.

Edit: If you're going to spoil something make sure you put what you're spoiling outside a spoiler tag then tag the info.",What is something that seems like common knowledge to you but isn't to anyone else?,2
Benthew,14,0,1r12il,4,,What is your favorite one-hit wonder?,4
Midlaf,0,7,1r12h8,0,I've seen this gif once and I want to show my friends so they have my same conflicting boner.,Does anyone have a link to the animated gif where two women drawn in black and white have sex but had penises?,1
drizzy94,3,1,1r12gl,1,,How can I be a more creative person and embrace my own personality?,2
fthhall,1,7,1r12gj,0,"In kindergarten I played with myself as any curious kid would; then this interesting feeling happened. At the age of 5 I had my first orgasm, minus the semen. Wasn't until I was 11 when that happened. Scared the shit out of me.
My questions

1 How is this even possible? 
2 Have I been mastubating for the last 16 years of my life?

Also AMA",I wouldn't know who to ask so I ask Reddit. I've masturbated since the age of 5. Even possible? AMA as well,2
MrSundance1498,21,6,1r12fg,1,,Is abortion still a major issue?,7
hedgehogsamuri,11,1,1r12du,2,"My little brother is a college freshman and I've found myself giving him advice on just about everything he's about to run into. As the oldest, I wish I would have had someone to prepare me for the pitfalls ahead of me when I was 18. Based on your experiences, what advice would you offer these young'uns?","Adults of Reddit, what advice would you give high schoolers about to enter the real world?",3
TheDerkKnight7,3,0,1r12cj,3,I'm really interested in seeing what it was like for someone experiencing the trick in person rather than on TV.,"Has anyone here ever been part of a famous magician's trick? (Chris Angel, David Blaine, etc) what was the experience like?",3
DroYo,24,4,1r12cg,1,"I'm just curious to see what reddit would choose as a superpower
","If you could have ANY superpower ever, what would it be and why? [Serious]",5
Z9L,7,4,1r12cc,1,,"Hey, Reddit, welcome to the Salty Spitoon. How tough are ya?",5
sleeping_in_time,1,2,1r12c3,0,,You 30 words to write the plot to the sequel of your favorite movie. What do you write?,2
cwilliams128,17,0,1r128w,3,,Which sense would you be most okay with losing? Why?,3
firerobin88,0,0,1r128n,2,"I'm a big fan of wargames from Panzer General, Civ V, Total War, Europalis Universalis etc. 

It always amazes me when the AI is able to operate complex strategies on a Grand Strategy, Operational and Tactical level. Especially with all I read about how stupid AI is, running an entire economy, and planning a whole war effort should be beyond their capability. 

As a layman, it amazes me how programmers can turn code into sophisticated strategies. 

Can anyone explain to me the basics of how AI 'thinks' in strategy games?",How does the AI in wargames (both Real-Time and Turn-Based) plan out complex strategy and tactics?,2
xmikeonreddit,2,1,1r128g,0,"My friend's mom (who is fairly attractive) got pulled over once. When the cop asked for her license and registration she said, ""I just got my nails done so I can't reach into my purse."" The cop replied, ""Well, those are beautiful nails. We can't ruin those now can we?"" and let her go. What's your story?",What is the most ridiculous experience you've had or heard for getting out of a ticket?,1
emarko1,2,0,1r128d,3,,What is your unnoticed or thankless job?,3
lars5067,0,1,1r128c,1,,People of Reddit who have seen or heard something unexplainable while in the wilderness (i.e. bigfoot)! What is you story?,2
Tigerman97,6,0,1r1284,1,,What would you do if you could not fail?,1
n0tcreatlve,10,3,1r1279,1,"Basically, im one of those preppers that you think is bat-shit crazy, but when shit hits the fan, youre ready to huddle next to, and mooch off of.   Im broke, in college, but am finding ways to save up for a nice firearm or two.   When/if shit hits the fan, what are you all willing to and not to do....does anyone want to just off themselves and not have to put up with the work and hazards of killing zombies / friends / survivalists willing to kill you?    ","Zombies run the streets....Explain where you go, how you get there, who goes with you, and what supplies do you try and acquire?",4
Goukan,13,3,1r1275,2,"
 Before you get out the pitchforks hold on a minute, this is a very serious question.

 As a man i've realized one of the greatest flaw of my gender to be loosing control.

 Be it to overwhelming passion in the presence of women.

The idea of defending ones honor from lack of respect or insult. 

Or even the pull of pure purpose, to ""Do"", 'Create"" or merely ""Destroy"".

All with a strong emotional link but not on a superficial level, it can be fought and suppressed. In turn changing who/ what we are, our interests and how we live our lives.

IMO my gender has the potential to be much more than we are,... Better, with more ""Control"".

So again women of reddit, what do you consider to be the greatest flaws of your gender? and what potential do you see for your side without them. ","Women of Reddit, What do you consider to be the greatest flaws of your gender?",5
Thewhitemexicangirl,2,0,1r126e,1,"Really need advice/answers sorry if this wasn't the best subreddit but I know there is a greater audience so i'm giving it a shot. So this is what happened in order:
1. Financed a new used car (first time in my name) 3 weeks ago and got insurance through the general.
2. Sunday night I was driving in the rain when the back tires slid and I lost control , ended up in a ditch but no injuries.
3. Police say that my back tires were bald on the inside to the point they were showing the wires.
4. I find out that the repairs will be too expensive for me to fix at this moment (estimate $1,500) 
My questions are:
1. Though I did buy the car as is with no guarantee is there anything I can do about the dealership selling me with the tires that bald? (I know it's very unlikely but I like to ask.)
2. Do I have to report the accident to my insurance company if I did no damage to anything besides my car and I want to pay for repairs myself? 
3. Since I won't be able to fix the car for a couple months can I pause my insurance? Will I have to say exactly why I want to pause or suspend insurance? 

Some info: I'm 19, this is first time having insurance and a car put in my name, I live in TN. 

I'm desperate to get some answers before I go talk to the car dealership and I appreciate all help! Thanks in advance.","Leasing/financing a new used car, had a car accident in less than a month. Really need answers about what I can do, more info in comments!",1
aggiepls,4,1,1r1265,3,"im pretty sure this has been asked but there might newer stories

edit: forgot the question mark sorry.",What's your crazy girlfriend/boyfriend story,4
BigTalk45,6,0,1r1262,2,"My wife has the most gorgeous silver, platinum and white hair. She's always getting compliments. There is a limited number of colours from the box so there's a boring sameness. I recall Oprah referring to women who didn't dye their hair as 'giving up' which I thought was odd coming from the guru of living an authentic life.",Why do women dye their hair as they get older?,2
JBalz,3,1,1r1259,1,,Stemming from the UFO question... What are your ghost stories/encounters?,2
biscuitbagel,6,0,1r124e,4,,"What was your most expensive bar tab and what, if you recall, was on it?",4
Dubstyles,38,2,1r1236,8,,"If you were to become a dinosaur, what kind would you be and why?",10
BoBean,4,3,1r122z,0,"Ive read the sidebar and alot of post but it still confuses me, can someone summarize what exactly you do?",How do I take the red pill?,3
CapMerica,12,1,1r1216,7,"Or, perhaps, the most ridiculous thing a newly hired person has said during their first week in the job?","Reddit Bosses: In all of the interviews you have conducted, what's the most flabbergasting thing a job candidate has shared with you?",8
smugglers_creed,12,0,1r120n,4,,What is your favorite junk food?,4
noreligionplease,5,2,1r11z9,4,"Example, everyone seems to **hate** it when someone chews/masticates with their mouth open, it does not bother me in the slightest.","What is something that really seems to peeve other people, but doesn't bother you at all.",6
nekosmash,0,0,1r11z8,2,How did you get out? Did you get out?,"Reddit, What is the most hopeless situation you have ever been in?",2
DuskOfDawn23,9,2,1r11y7,3,"Today, a friend of mine and allegedly a couple other people from his group submitted ""Hail Satan"" as their senior quotes. I know for a fact that they are all athiest and were just doing it for fun. Administration didn't take too kindly to their quotes, but instead of voiding those specific ones, they went ahead and cancelled ALL senior quotes of 2014 from being in the yearbook. Are they overreacting?

Note: the high school is in a mostly white and Christian community in southern California, has a zero tolerance policy, and a dress code that prohibits you from wearing red shoelaces and hats / beanies of non-school colours.","Is my old high school going too far by cancelling all senior quotes just because two or so people put ""Hail Satan"" as theirs for fun?",5
shadowasdf,5,0,1r11w7,4,"When I was 5 or so, I decided to test the ""cats always land on their feet"" theory by throwing mine down the stairs - a good 30 of them.  That cat never liked to cuddle with me.  What about you?",What's the worst/stupidest thing you've done as a child?,4
mvp4life,6,2,1r11ub,0,,What are some social norms that would be hilarious if broken?,1
JohnnyHopscotch,5,0,1r11tl,3,,What is the greatest gift you have ever received?,3
mathison14,2,1,1r11so,1,,What simple information were you told way too late in your life?,2
DeathByOrgasm,9,4,1r11sg,1,,"[Serious] Sexually assaulted victims of Reddit, have you ever ran into/seen your perpetrator on the street? What happened?",5
DeputyDangleDunk,17,0,1r11s7,2,,"People of reddit, what do you think your life/personality would be like if you were the opposite gender?",2
chronophobiclock,7,1,1r11ru,3,,"If every job had its pay adjusted according to how it benefits society, what would be the highest paying and lowesst paying jobs?",4
OneManNinjaClan,0,0,1r11q1,1,,What health food supplement do you swear by?,1
mrthrowaway32,24,2,1r11ps,4,"I will start. I have a downward curve that hits some amazing spots during sex, but IMO is visually distracting. Would prefer a straight or slightly upward curve to it.","Men of Reddit, if there was ONE thing you could change about your penis, what would that ONE thing be?",6
L1amas,2,1,1r11oi,0,"For informational purposes, I'd like to compile an all-inclusive list of subreddits to meet people for all sorts of reasons.",What are other subreddits than r4r where you can meet other people in your area?,1
meham,0,0,1r11o9,1,"Hello r/AskReddit!

My husband and I have decided that this year we will be doing a donations Christmas rather than the traditional gifts.  We are asking our families to donate to in our names and we will be donating to several charities in each of their names.

So far we have a couple of ideas but we want to make sure they are the most fitting causes.

Some of our ideas are: 

* [Canadian Wildlife Federation](http://www.cwf-fcf.org/en/) for each of our nieces.
* Local Humane Society for one set of parents.
* Adopt-a-family for another set of parents.

Where do you donate?

",What charities/causes are you donating to this holiday season?,1
throwaway123454321,0,0,1r11mx,2,Please give context as to why it was the best/most meaningful.,What was the best gift you received that wasn't purchased at a store?,2
mossandmushroom,4,0,1r11it,3,,What's the worst case of corruption you've witnessed?,3
mightypeanuts,7,0,1r11hw,2,"Questions that can be used on dates, to sound cool/smart, or introducing yourself. You get the idea.",What are good conversation starters/topics to know?,2
kingeryck,9,1,1r11hr,2,,What are your best tips for moving an apartment?,3
