author,comments,downvotes,id,score,selftext,time_created,title,upvotes,subreddit,type
maarliya,4,12,1ransa,43,A young couple came into the church office to fill out a premarriage questionnaire form The young man who had never talked to a pastor before was quite nervous and the pastor tried to put him at ease When they came to the question Are you entering this marriage of your own free will There was a long pause Finally the girl looked over at the apprehensive young man and said Put down Yes,1385228472.0,Getting Married,55,jokes,top_week
rwebb,3,17,1rayzh,39,Its Christmas Eve and Santa comes down the chimney and sees a hot girl sitting there  She says Santa please stay Santa says  ho ho ho gotta go gotta go gotta deliver presents to the children I know So she takes off her shirt and pants and says Santa please stay Santa says  ho ho ho gotta go gotta go gotta deliver presents to the children I know So she takes off her bra and panties and says  Santa please stay Santa says  hey hey hey gotta stay gotta stay cant get up the chimney with my dick this way,1385237469.0,Merry Christmas,56,jokes,top_week
kokain,4,17,1ra8sh,37,A farmer is sitting in the neighborhood bar getting drunk A man comes in and asks the farmer Hey why are you sitting here on this beautiful day getting drunkFarmer Some things you just cant explain Man So what happened thats so horrible Farmer Well today I was sitting by my cow milking her Just as I got the bucket about full she took her left leg and kicked over the bucketMan OK but thats not so badFarmer Some things you just cant explain Man  So what happened then Farmer  I took her left leg and tied it to the post on the left  Man AgainFarmer Some things you just cant explain Man So what did you do thenFarmer  I took her right leg this time and tied it to the post on the right Man And thenMan And thenFarmer Well  sat back down and continued to milk her Just as I got the bucket about full she took her right leg and kicked over the bucketFarmer Well I sat back down and began milking her again Just as I got the bucket about full the stupid cow knocked over the bucket with her tailMan HmmmFarmer Some things you just cant explain Man So what did you doFarmer Well I didnt have any more rope so I took off my belt and tied her tail to the rafter In that moment my pants fell down and my wife walked in ,1385212448.0,It was all a big misunderstanding,54,jokes,top_week
theboy,13,23,1rnuua,36,In the European Heaven The police is British the cooks are French the mechanics are German the Italian are the lovers and everything is run by the SwissIn European Hell The police is German the cooks are British the mechanics are French the Swiss are the lovers and everything is run by the Italians,1385666247.0,European Heaven In honour of Berlusconi enjoy your ban,59,jokes,top_week
BallerOnABudget,9,23,1rb0ga,35,i cant wait for it to come out,1385238629.0,did you hear about that new movie called constipation,58,jokes,top_week
Buttocks,6,11,1rkc25,40,A guy goes back to his home town for Christmas and he stops by the local diner to get his favorite breakfast eggs Benedict  But he has a special request he wants it served on a big shiny metal plate  The waiter doesnt understand why so he asks him Sir why do you want eggs Benedict on a shiny metal plate  And the man says Because theres no place like chrome for the hollandaise,1385548497.0,Just in time for the holidays,51,jokes,top_week
RareMeat,2,14,1rf2ou,40,the bartender asks You want a long neckThe giraffe says I have a choice,1385390198.0,A giraffe walks into a bar and orders a beer,54,jokes,top_week
quotejester,2,15,1rps08,47,The Mayans taught me that if you dont finish something its not really the end of the world,1385742158.0,What the Mayans taught me,62,jokes,top_week
niknikbluhh,5,16,1rmshy,34,Hold on to your nuts this is no ordinary blow job,1385622823.0,What did the hurricane say to the palm tree,50,jokes,top_week
ex,7,14,1rgdlz,31,A farmer in Maine was just finishing up a tough day in the Summer Sun He decided that after such a tough day the perfect thing he needed was a walk around his pond The blueberries were in full bloom so he decided that it was worthwhile to pick some up for breakfast the next day so he grabbed a bucketAs he approached the lake he heard some girls laughing and giggling Fortunately for the girls they saw him force and quickly retreated to the deeper waters As he noticed them he smiled to himself There were three gorgeous girls covering themselves  skinny dippers he thought to himself Were not coming out until you leave One of the girls shouted at himHe frowned and furrowed his brow Honestly I didnt come down here to see some naked girls or anything of the like I dont care if you stay in there or leave He lifted the bucket slightly Im just here to feed my pet alligator Bill ,1385422495.0,Skinny Dippers,45,jokes,top_week
JustGivingRedditATry,1,21,1reemh,31,Social netwerking,1385357926.0,What do you call making your booty clap for likes and upvotes,52,jokes,top_week
amosfargus,2,24,1rbmg3,33,The bartender says Why the same face,1385257001.0,Two Chinese men walk into a bar,57,jokes,top_week
lolcamis,1,17,1rk2uj,33,Canoe,1385535239.0,I can row a boat,50,jokes,top_week
jesse,3,17,1rjh66,35,A man is calling in sick from work and says to his boss sorry boss I cant come into work Im feeling sick His boss replies Im sorry to hear that Whenever I feel sick I have sex with my wife and usually feel better You should try it The man agrees and calls him back later that day He says you were right I do feel better and your house is really nice  ,1385516700.0,Calling in sick from work,52,jokes,top_week
PirateDinoAstronaut,4,15,1rhmo8,31,are standing on a hill and see cows in the pasture belowThe young bull eagerly says Lets run down there and screw one of those cowsNo the older bull replies Lets walk down there and screw all of them,1385465301.0,A Young Bull and an Old Bull,46,jokes,top_week
carydog,0,37,1rbhxz,33,with a mysterious illness After the doctor said that there was nothing else he could do he turned and left the couple alone in the room The man asked his wife Honey is there anything I can do for you before you goShe weakly replied Yes I want you to go down on meHer husband was shocked What Why You mean right here nowYes please dear It would make me happy one last timeSo the husband reluctantly begins to carry out his wifes request As his wife nears climax she becomes more and more animated and finally screams out in pleasureThe husband looks at her in shock just as the doctors and nurses rush into the room The wife looks at the everyone and says I feel wonderful Better than Ive felt in my life The doctor in disbelief asked what had happened The wife explained what had transpired and just then her husband sat down on the bed weepingHis wife asked Honey why are you crying You saved my lifeHer husband answered her Yes and Im so happy about that Its just to think I could have saved Mom and Aunt Mary,1385253022.0,A mans wife lay dying in the hospital,70,jokes,top_week
mheller,11,67,1rnx83,28,,1385668185.0,The Detroit Lions,95,jokes,top_week
ghengisken,0,18,1reu0q,27,doesnt matter  It was supposed to say size doesnt matter but the print was to big,1385378432.0,Saw a billboard in Rhode Island,45,jokes,top_week
djdeejay,4,11,1rl64p,27,So I saw a joke on here about  Irish guys with their friend and the punchline is something like the dead guy being with the two arseholes They were identifying their friends body I believe,1385576887.0,Need help with a joke that was on here,38,jokes,top_week
mysticalme,2,13,1rg98k,26,Because he can never never land ,1385419584.0,Why is Peter Pan always flying around,39,jokes,top_week
KroganVanguard,1,7,1re4mi,29,Public indecency my ass,1385348116.0,The other day I was almost arrested for mooning,36,jokes,top_week
kdotrukon,4,28,1re1c0,30,Darn tootin this is so dumb im sorry,1385345466.0,What do you call a cowboy with a case of bad gas,58,jokes,top_week
Hatweed,4,16,1rk9zn,24,A man runs into a gas station obviously very flustered The attendant asks You look like youve seen a ghost What happened The man looks at the attendant and says in a very shaky voice Its horrible Someone just broke into my car when I came in to pay for my gas a minute ago The attendant says Oh my The man continues losing more coherence as he speaks I had a ticket to the Lions game on Sunday sitting on the dashboard The attendant asks Did they take your ticket The man says barely able to speak at this point No worse They left another one there,1385545281.0,A most horrible occurrence,40,jokes,top_week
molafich,3,15,1rda7e,27,two fish swim into a concrete wall one turn to the other and saysDam,1385325342.0,two fish,42,jokes,top_week
Blink,8,20,1rp8ow,27,Well this morning I had scrambled eggs,1385715720.0,What does a man with a  penis have for breakfast,47,jokes,top_week
daddydidncare,2,17,1rl02n,26,Instagram,1385572891.0,What do you call a reliable coke dealer,43,jokes,top_week
unkleknuckles,1,13,1rofn9,28,Itll be called coming or going ,1385685107.0,Im going to open a building that functions as a sperm bank as well as a urine analysis center,41,jokes,top_week
dudewhodoesstuff,9,21,1rcdgz,24,To get a byte to eat,1385289834.0,Why did the computer cross the road,45,jokes,top_week
Finrodtheawesome,2,9,1rgwig,24,to mount on a wall to hang her coat She walks up to the counter with it but doesnt have a screw to mount it to the wall The checkout guy says do you want a screw for the hook She answers No but Ill blow you for that toasterA version of an old Andrew Dice Clay joke,1385435907.0,A lady goes to the store to buy a hook,33,jokes,top_week
temalyen,5,12,1rprr3,31,Im tired of people ringing my doorbell at all hours of the day and night asking for donations This morning it was some woman from the sperm bank Boy did I give her a mouthful ,1385741919.0,I hate it when people bother me,43,jokes,top_week
MBArceus,2,19,1rmd7q,24,He pinned it on someone else,1385608463.0,How did the badge get away with murder,43,jokes,top_week
CharlesKincaid,1,12,1rm220,24,Dad was a Bell System engineer  I told him that he had put up with BS for  years  But that is not his joke  His wasHow long is a short circuitAs long as it takes to find it,1385599078.0,Electrical Joke,36,jokes,top_week
boomatog,4,8,1rk5qb,22,Short difficult to read and with regular periods,1385538912.0,I like my women like I like my Paragraphs,30,jokes,top_week
MBArceus,9,12,1rgovd,23,One stalk of corn said to the other stalk of corn Hey can I tell you somethingThe other stalk of corn said Im all ears,1385430364.0,An even cornier joke,35,jokes,top_week
sflo,14,22,1rishr,22,After the exam the doctor says I know why youre having trouble The China man says Why The doctor says You have a Cataract The China man says No I have a Rincoln Continental,1385499648.0,A Chinaman goes to see an eye doctor,44,jokes,top_week
MyKarmaKilledURDogma,1,6,1rihsp,22,At a religious revival they say STAND UP FOR JESUSAt a bikers rally they say SIT DOWN FOR CHRISTS SAKE,1385492654.0,Whats the difference between a religious revival and a bikers rally,28,jokes,top_week
ballew,3,20,1rayw7,25,The size of their clock ,1385237399.0,Whats the difference between white time and black time Warning Dad joke,45,jokes,top_week
loufizzle,3,14,1ra65z,20,Director Now well let the lion out of the cage and hell chase but dont worry he wont eat youActor What makes you so sureDirector Its in the scriptActor Has the lion read the script ,1385207611.0,During the shooting of a movie,34,jokes,top_week
konag,2,22,1r9w9r,21,anal will make your hole weak,1385189896.0,A blowjob will make your day,43,jokes,top_week
laughoutloud,2,11,1rgr73,18,Once in a land far far away there lived a group of people called Trids The Trids were happy except for a giant that lived on the mountain The giant would often terrorize the TridsThe Trids tired of the giant sent a group led by the communitys minister to reason with the giant But before they could even say one word the giant kicked them down the mountain The Trids thought maybe this was because the giant was Catholic so they sent another group this time led by the local priest But alas as they approached the giant once again kicked them all down the mountainThe Trids were upset until they thought that perhaps the giant was Jewish Unfortunately no Trids were Jewish so they asked a rabbi of a different community for help The Rabbi led a group of Trids up the mountain The giant saw them coming and kicked all of them except for the Rabbi down the mountain The Rabbi knowing the giants past wondered why he alone had not been kicked down the mountain so he asked the giant The giant laughed and repliedSilly Rabbi kicks are for Trids,1385432071.0,The Trids and the Giant,29,jokes,top_week
mythernalite,0,5,1rp5rx,20,Some of my personal favorite onesA snail gets mugged by a gang of turtles When the police show up and ask what happened the snail say  I dont know it happened so fastA woman gets on a bus with her baby The bus driver say Thats the ugliest baby Ive ever seen ugh The woman goes to the rear of the bus and sits down fuming She says to the man next to her The driver just insulted me The man say you go right up there and tell him offIll hold your monkey for youA couple from Minneapolis decided to go to Florida to thaw out during one particularly icy winter They planned to stay at the very same hotel where they spent their honeymoon  years earlier Because of hectic schedules it was difficult to coordinate their travel schedulesso the husband left Minnesota and flew to Florida on Thursday with his wife flying down the following day The husband checked into the hotel There was a computer in his room so he decided to send an email to his wife However he accidentally left out one letter in her email address and without realizing his error he sent the e mail to somewhere in Houston A widow had just returned home from her husbands funeral He was a minister of many years who was called home to glory following a sudden heart attack The widow decided to check her email expecting messages from relatives and friends After reading the first message she fainted Her son rushed into the room and found his mother on the floor and couldnt imagine what happened to her until he looked up at the computer screen and readTO My Loving Wife Subject Ive arrived Date January   I know youre surprised to hear from me They have computers here now and you are allowed to send emails to your loved ones Ive just arrived and have been checked in I see that everything has been prepared for your arrival tomorrow Looking forward to seeing you then Hope your journey is as uneventful as mine was Your Loving HusbandPS Sure is hot down hereAnd finallyA man goes into the confessional box He finds on one wall a small bar with Guinness on tap On the other wall is a box of the finest Cuban cigars On the seat is the latest copy of Playboy Finally the priest comes in Father forgive me for its been a very long time since Ive been to confession but I must first admit that the confessional box is much more inviting these days The priest replies Get out Youre on the my side,1385711508.0,Some of my favorite SFW jokes,25,jokes,top_week
MyKarmaKilledURDogma,4,22,1ro4rv,19,Jerk one off the other two will come,1385674620.0,How do you get three gay men off your couch,41,jokes,top_week
HashSlingingHacker,2,18,1rd2or,19,A young businessman was getting ready for a trip His flight wasnt until later in the night so he decided to go into work get his tickets work for a bit and then get on the flight right from work As he walked into work he couldnt help but notice that the secretary who was working the front desk has en enormous chest He snuck a look but did not stare He approached herBusinessman Hi Im Adam I need my pickets to Titsburgh He immediately recognized his slipSecretary Excuse meBusinessman Uhh Sorry I mean uh I need my tickets to Pittsburgh Secretary Oh of course here you go She slid him the tickets and he proceeded to take his walk of shame to the elevator On the way up he reminded himself of how much of an idiot he was He arrived on the floor where he worked and went to his boss Boss Hey glad to see you made it Only a few people came in todayBusinessman Yeah no problem God I just made such an ass of myself downstairs I feel like an idiot Boss Whatd you doBusinessman Well you know that girl with the big chest who works the front desk Well I went up to her and asked her for my plane tickets What I meant to say was I need my tickets to Pittsburgh but I ended up saying I need my pickets to TitsburghBoss Oh dont worry about it Its just a little slip It happens to me all the time Like last week I was having dinner with my wife What I MEANT to say was Pass me the butter but what I actually said was You horrible bitch you ruined my life,1385319691.0,A little slip,37,jokes,top_week
JediCreed,13,6,1r8yr6,19,A mother sends her son to the store with  for a turkey for Thanksgiving He comes back with a turkey and hands her back  so she asks him Where did you get that turkey son He says I won it Momma They said the person with the biggest pecker gets a turkey So you took your pecker out and showed it all in front of those peopleNo just enough to win,1385159469.0,A mother sends her son to the store for a turkey,25,jokes,top_week
Spyisheavy,0,6,1ro9ey,19,Its two days before thanksgiving A young boy wakes up and upon walking across the hall to his parents room hears them talking about last nights sex But the only words he can make out through the door are dicks and vaginas He opens the door and immediately asks Mommy Daddy what are dicks and vaginasHis dad quickly answers Theyre just fancy words for hats and coats Satisfied with this the boy leaves the roomLater that day while his mom was prepping a turkey that she had just bought she accidentally cut herself and immediately shouted out FUCKUpon hearing this the young boy rushes into the kitchen and asks Mommy what does fuck meanShe quickly responds its just a way of cooking the turkeyNow it is thanksgiving day and the father is shaving when he accidentally cuts himself and yells out SHITThe young boy rushes in and asks daddy what does shit meanThinking fast his dad says its just the brand of shaving cream Im using And then the doorbell rang The young boys dad told him to get the doorThe boy rushed to the door opened it and upon seeing his guests said Good evening May I take your dicks and vaginas please My mom is In the kitchen fucking the turkey and my dad is upstairs scraping the shit off of his face,1385679012.0,A great one to tell at thanksgiving parties,25,jokes,top_week
sean,1,21,1rd0x1,18,An Aboriginal was walking along the beach when he found a bottle He thought that he might be able to sell it and make some money so he started cleaning it up rubbing it with his sleeveAll of a sudden a genie popped out and said I will grant you three wishes but wish carefullySo the Aboriginal says I would love to be whitePOOF He becomes whiteFor my second wish I would love to be richPOOF He becomes rich and is dressed in designer clothes and has a nice carOkay says the genie what is your third wishHmm says the Aboriginal this is something I have always wanted I never want to have to work againOkay says the geniePOOF He is turned into an Aboriginal,1385318346.0,The genie and the Aboriginal,39,jokes,top_week
LethalVacancy,3,8,1r9u3d,17,Even the cake was in tiers,1385187124.0,I just went to a very emotional wedding,25,jokes,top_week
Budde,7,23,1rl06b,20,In Northern Ireland theres a new Catholic priest in town at the ripe age of  He gives his first sermon ever and the whole town is blown away and approaches him with lots of praise after hes finished mass Feeling inspired so much so that he tells the town that he will come and visit all of them for breakfast lunch or dinner at some point in the next year With  or so families in the town this is quite the undertaking He decides to start all the at the outskirts of his Parrish and work his way inward As hes walking the  miles to the Oleary farm he notices how perfect the soil is and how bountiful the upcoming harvest will be for the Oleary family He thinks to himself how blessed by God they are He comes to the door and tells Seamus Oleary how blessed he has been by God for this farm and with the help of God he hopes he wakes up everyday thankful for what he has To which Seamus replies Aye I awake everyday thankful for what I have Fadder but you should seen the place when just God owned itTldr My marriage counselor is an agnostic EDITTitle should be and I I no word good ,1385572962.0,Great joke from a marriage counselor to my fiancé and Iast night,43,jokes,top_week
ScottishBrong,5,6,1rj934,17,His life was at stakeBadum psh,1385510670.0,Why was the cow scared about going into the slaughter house,23,jokes,top_week
alester,4,11,1reoae,18,If you had an onelegged horse what would you name it  Flattery,1385369147.0,Do you like jokes that make you think a little,29,jokes,top_week
telehubby,13,21,1roq0e,18,My girlfriend is wanting to get kinky in an elf costume tomorrow and Santa is in need of some good puns for the naughty dirty talk,1385695347.0,Ok rJokes I I realize that its still Thanksgiving but I need your help what are your dirtiest Santaelf related jokes,39,jokes,top_week
sassageflare,2,11,1rlnv9,16,The sexual tensions,1385588623.0,You want to know whats the toughest part about Thanksgiving dinner at my house,27,jokes,top_week
queensavior,1,21,1rfllm,16,they always take things literally,1385404203.0,i always struggle using sarcasm with kleptomaniacs,37,jokes,top_week
EKiller,4,29,1rox2w,12,Because the deals are suchA steal,1385701979.0,Why is it called Black Friday,41,jokes,top_week
kongo,5,19,1rnyg5,15,apparently they cant put together  ws,1385669219.0,The NY Jets website is down,34,jokes,top_week
arcticanomaly,2,10,1riwsu,16,When youre kissing with your honeyand your nose is kinda runnyyou may think its kinda funnybut its not,1385502385.0,My dads favorite,26,jokes,top_week
rutroraggy,1,8,1rgrhm,15,Saw a post for a hot water heater for sale I responded and asked if it worked on cold water as well,1385432279.0,browsing craigslist,23,jokes,top_week
