author,comments,downvotes,id,score,selftext,time_created,title,upvotes,subreddit,type
SGrumpy,96,2742,1ra9vc,2151,and she had been in it for months Nurses were in her room giving her a blanket bathOne of them was washing her private area and noticed that there was a slight response on the monitor when she touched her They tried it again and sure enough there was a small recognisable movementThey went to her husband and explained what happened telling him Crazy as this sounds maybe a little oral sex will do the trick and bring her out of the comaThe husband was sceptical but they assured him that with the curtains closed for privacy and his cooperation it might just work He finally agreed and went into his wifes roomA few minutes passed and then the womans monitor flat lined no pulse no heart beat alarms ringing the nurses burst into the room What happened they criedThe husband said Im not sure maybe she choked,1385214084.0,A woman was in a coma,4893,jokes,top_week
docpepson,113,2472,1rdxt4,2142,Because Ken came in a different boxBadum tiss,1385342837.0,Why did Barbie never get pregnant,4614,jokes,top_week
sterling,79,1458,1rhzjd,1922,Whats the last thing each ticklemeelmo doll gets before leaving the factoryTwo test tickles ,1385479852.0,Joke my dad loved,3380,jokes,top_week
thehedgemon,136,2162,1rfkud,1777,Two friars decide to open up a business selling flowers in LA They settup a booth right outside of Hugh Hefners playboy mansion After about a week their business wasnt going so well and it was also driving away people from the playboy mansion seeing two friars outsideEventually Hugh Hefner himself came out and put a stop to all of thisThe point of the story is Only Hugh can prevent florist friarsBadum psh,1385403689.0,Corniest joke I know,3939,jokes,top_week
son,56,769,1rporv,1680,So an older couple is discussing the inevitable matter of death  The wife asks her husband If I die before you do will you remarry  To which the husband replies Well I dont want to be lonely for the rest of my life so yes  The wife then asks What about the house  Will you live in the same house  And the husband says Well I suppose  I mean its already paid for  The wife getting a little protective asks And what about my car  Will she drive my car  The husband says again Well its already paid forThe wife annoyed at this point shoots What about my golf clubs  And the husband says Oh no  Shes left handed,1385739159.0,My grandpa told me this one,2449,jokes,top_week
beerdude,72,797,1rna91,1398,An Englishman a Frenchman a Spaniard and a German are all standing watching an American street performer do some juggling The juggler notices the four gentleman have a very poor view so he stands up on a wooden crate and calls out Can you all see me nowYesOuiSíJa,1385648675.0,An Englishman a Frenchman a Spaniard and a German xpost from rdadjokes,2195,jokes,top_week
SGrumpy,61,658,1rcg2l,1315,had spent four days together and they were getting a little testy One morning the first friend says You know were starting to get on each others nerves Why dont we split up todayIll hike north and spend the day looking around you hike south and spend the day Then tonight well have dinner and share our experiences over the campfireThe second friend agrees and hikes south The first man hikes northThat night over dinner the first man tells his storyToday I hiked into a beautiful valley I followed a stream up into a canyon and ate lunch Then I swam in a crystal clear mountain lake As I sat out and dried I watched deer come and drink from the stream The wildflowers were filled with butterflies and hawks floated all day overhead How was your dayThe second friend says I went south and ran across a set of railroad tracks I followed them until I came across a young woman tied to the tracks I cut the ropes off gently lifted her off the tracks and I had sex with her in every imaginable way all afternoon Finally when I was so tired I could barely move I came back to campWow the first guy exclaimed Your day was MUCH better than mine Did you get a blow job tooNah says the second friend over his meal I couldnt find her head,1385295183.0,Two men camping in the mountains,1973,jokes,top_week
VersalEszett,34,737,1rnepl,1131,After about  minutes on the highway I realized I left my car at home,1385653166.0,I had coffee with Red Bull this morning,1868,jokes,top_week
steventheunicorn,54,675,1rjgme,1086,There was a man who really took care of his body One day he took a look in the mirror and noticed that he was tan all over except for his penis So he decided to do something about it He went to the beach and got completely undressed and buried himself in the sand except for his penis which he left sticking outTwo old ladies were strolling along the beach one using a cane Upon seeing the thing sticking up out of the sand she began to move it around with her cane remarking to the other lady There is no justice in this world The other lady asked what she meantWell when I was  I was curious about it When I was  I enjoyed it When I was  I asked for it When I was  I paid for it When I was  I prayed for it When I was  I forgot all about it Now Im  and the damn things are growing wild and Im too old to squat,1385516290.0,I found this on the interwebs NSFWish,1761,jokes,top_week
mclarke,34,514,1rklmr,1004,Because theres not mushroom,1385561601.0,Why dont fairies live under toadstools,1518,jokes,top_week
mikalshorti,69,649,1rm7c9,958,God decides hed like to take a vacation So he goes to St Peter at the pearly gates and asks Pete I need a vacation being God is fucking stressful Where should I goSt Peter says well Pluto has good skiingGod shakes his head fervently and replies no way I broke my leg there onceNext St Peter suggests Mars  theres an eonslong storm that could be fun God says no way I almost got struck by lightning there last timeSo then St Peter suggests Earth  you can do just about anything thereGod fires back Fuck that Pete I went there  years ago knocked up some Jewish chick and theyre still fucking talking about it,1385603363.0,Gods Vacation,1607,jokes,top_week
thewizard,45,427,1rbnld,938,The librarian replied Fuck off you wont bring it back,1385257978.0,A man went to a library and asked for a book on committing suicide,1365,jokes,top_week
ryanbimmer,79,540,1roisz,838,Does that make you an iWitness,1385688342.0,If you see an Apple store getting robbed,1378,jokes,top_week
apatheticclown,15,170,1rfec0,556,A man goes up to the circus and says to the leader of the circus I can do great bird impressions The leader of the circus says Thats nothing special lots of people can do great bird impressions so get out of hereThe man says ok and flies away,1385399270.0,A man goes up to the leader of a circus,726,jokes,top_week
jeets,18,184,1rlrlg,517,they only had one pickup,1385591170.0,Why did the Mexican army attack the Alamo with only  soldiers,701,jokes,top_week
FlyingMonkey,17,236,1rd7fv,492,A teacher asks her class If there are  birds sitting on a fence and you shoot one of them how many will be left She calls on little Johnny None they all fly away with the first gunshot The teacher replies The correct answer is  but I like your thinking Then Little Johnny says I have a question for YOU There are three women sitting on a bench having ice cream One is delicately licking the sides of the triple scoop of ice cream The second is gobbling down the top and sucking the cone The third is biting off the top of the ice cream Which one is married The teacher blushing a great deal replies Well I suppose the one thats gobbled down the top and sucked the cone The correct answer is the one with the wedding ring on but I like your thinking,1385323318.0,A teacher asks her class,728,jokes,top_week
omailnumber,26,156,1rbu8e,489,A male whale and a female whale were swimming off the coast of Japan when they noticed a whaling ship The male whale recognized it as the same ship that had harpooned his father many years earlier He said to the female whale Lets both swim under the ship and blow out of our air holes at the same time and it should cause the ship to turn over and sink They tried it and sure enough the ship turned over and quickly sank Soon however the whales realized the sailors had jumped overboard and were swimming to the safety of shore The male was enraged that they were going to get away and told the female lets swim after them and gobble them up before they reach the shore At this point he realized the female was becoming reluctant to follow him Look she said I went along with the blow job but I absolutely refuse to swallow the seamen,1385263952.0,A whale of a joke,645,jokes,top_week
catherder,10,173,1rk8rg,481,The body builder takes off his shirt and the blonde says What a great chest you have  He tells her Thats  lbs of dynamite baby  He takes off his pants and the blonde says What massive calves you have The body builder tells her Thats  lbs of dynamite baby He then removes his underwear and the blonde goes running out of the apartment screaming in fear The body builder puts his clothes back on and chases after her He catches up to her and asks why she ran out of the apartment like that            The  blonde replies I was afraid to be around all that dynamite after I saw how short the fuse was,1385543394.0,The Bodybuilder,654,jokes,top_week
sticklause,22,235,1rlok2,463,A man had  daughters The first daughter walks up to her dad and says Daddy why is my name RoseBecause a rose petal fell on you when you were a baby Replied the father The first daughter smiles and skips off to play with her dollsThe second daughter walks up to her dad and says Daddy why is my name TulipBecause a Tulip petal fell on you when you were a baby Replied the father The second daughter smiles and skips off to play with her dollsThe third daughter walks up to her dad and says HhhhhnnngngngnggggddddddrrrrruhuuhuhhuhhuhdadghGo to your room cinderblock Replied the father,1385589116.0,A man had  daughters,698,jokes,top_week
fuzzyblackyeti,58,158,1rgt0e,452,So a man is driving home from a buisness trip He has a pretty low paying job so obviously he doesnt have the best of carsAfter a few hours of driving he drives past a monastery That kind with all the monksAnd holy tits his car breaks down right in front of the monasteryBeing a man of God he obviously figures I bet the monks will let me stay with them while my car is repaired So he goes to the front gate and knocks on the door A man in robes answersHe tells the monk his predicament and the monk being a monk lets him stay the night and even helps with repair costs for his carWhile the business man is sleeping that night he hears this strange noiseIt just perplexes him and for the life of him he cant figure out what it is He decides when he wakes up in the morning hell ask the monks about itWhen he wakes up he finds the monk who he met when his car first broke down and asks him Can you tell me what that noise I heard was last nightThe monk replies Im sorry brother I cannot tell you for you are not a monk The man accepts this He thanks the monks for their graciousness and goes about his way when he gets his car back years later he is driving on another buisness trip And wouldnt you know it his car breaks down in front of the monastery againAgain he figures he can stay the night And of course the monks let him stay and offer him the same help as beforeAnd once again during the night he hears that noise He has no idea what it could be He decides to ask the monk once again with hopes that he would trust him more this time aroundIn the morning he meets the monk again and asks Im sorry for asking again but what is that noiseThe monk replies I cannot tell you for you are not a monkThe man says Alright Ill become a monk What do I need to doThe monk replies I need you to travel the world and count every blade of grass if you truly wish to become a monkThe man swiftly accepts and leaves all of his worldly possessions behind him to travel the world on this missionHe goes to all corners of the globe counting grass bladesAfter  years he comes back to the monasteryHe gives the monk accurate numbers and the monks give him monkhoodAnd obviously the first thing he wants to do is find out what that noise was So he asks the head monkThe head monk beckons him to follow him and he doesAfter a few minutes of walking through corridors and rooms they happen upon a wooden door The man can hear the noise He gets excited The head monk hands him a brass keyHe reaches with the key to the lock and unlocks the doorThere is another door though This time iron And the monk hands him an iron keyThis happens again and againSo many types of doors and keys Every thing you could imagine Glass doors gold doors EverythingFinally they get to a door made of solid diamond The noise is louder than ever The monk hands the man the final keyHe opens the door and finally sees what has been making the noiseBut I cant tell you what it is because you arent a monk,1385433388.0,This is my favorite joke to tell A mans car breaks down outside of a monastery,610,jokes,top_week
XeroInfinity,19,164,1rb7ap,394,Suddenly he sees a little girl being attacked by a pit bull dog  He runs over and starts fighting with the dog He succeeds in killing the dog and saving the girls lifeA policeman who was watching the scene walks over and says You are a hero tomorrow you can read it in all the newspapers Brave New Yorker saves the life of little girlThe man says But I am not a New Yorker Oh then it will say in newspapers tomorrow morning Brave American saves life of little girl  the policeman repliedBut I am not even an American Says the manOh what are you then The policeman asks The man replies I am a SaudiThe next day the newspapers says Islamic extremist kills innocent American dog,1385244144.0,A man was walking in Central Park in NYC,558,jokes,top_week
ThethNeedle,11,189,1rc35x,335,and the theme is composers Bruce tells the other stars  Ill dress up as Mozart Sylvester responds Id be a great Beethoven As the two are planning their costumes Arnold checks the time and notices hes late for an appointment As he hurries out the door Bruce and Stallone ask Hey Arnold wholl you dress up as Arnold responds as he walks out of the room Ill be Bach,1385273143.0,Bruce Willis Arnold Schwarzenegger and Sylvester Stallone are planning a costume party,524,jokes,top_week
itspampers,10,105,1rfq4x,319,Eclipse itHa,1385407246.0,How does the moon cut its hair,424,jokes,top_week
WhyHellYeah,18,130,1rkj5f,318,A priest and a rabbi were having lunch and the priest asked Have you ever strayed from not eating pork The rabbi said Well once but there was absolutely nothing else to eat so I had a ham sandwichThen the rabbi asked the priest Did you ever stray from your vow of celibacy The priest said Yes just onceAnd the rabbi said Sure beats a ham sandwich doesnt it,1385558923.0,Priest and Rabbi,448,jokes,top_week
OlsS,34,151,1rkq2r,289,Morris Schwartz is on his deathbed knows the end is near is with his nurse his wife his daughter and  sons So he says to themBernie I want you to take the Beverly Hills housesSybil take the apartments over in Los Angeles PlazaHymie I want you to take the offices over in City CentreSarah my dear wife please take all the residential buildings downtownThe nurse is just blown away by all this and as Morris slips away she says  Mrs Schwartz your husband must have been such a hard working man to have accumulated all this propertySarah replies Property The schmuck had a paper round,1385565619.0,Morning Jew,440,jokes,top_week
laxerado,11,70,1raesf,261,When he tripped and fell over a bridge railing and landed in the river below Before secret service could get to him  kids who were fishing pulled him out of the water He was so grateful he offered the kids whatever they wanted in return for saving his life The first kid said I want to go to Disney world To which Obama replied not a problem Ill even fly you there in Air Force one The second kid then says I want a new pair of Nike Air Jordans You got it Said Obama Ill even have Michael Jordan himself sign them Then the third kid says I want a motorized wheelchair with a built in big screen tv and headset Obama seemed a bit confused at this You dont look like yore handicapped He said To which the kid replied I will be after my dad finds out I saved you from drowning ,1385220245.0,Barack Obama was out jogging one day,331,jokes,top_week
winterjam,11,168,1rm0m7,228,Christian Bale,1385597947.0,What do you call it when Batman skips church,396,jokes,top_week
Huggbees,26,61,1rp0kc,241,When all of the sudden in the midst of a paticularly moving segment he hears a loud uproarious sneeze coming from amongst the crowd Stalin stops speaking glares at the soldiers becomes very visibly annoyed and says Who sneezedAll of the soldiers dont say anything some of them start to sweat and others nervously glance around After a brief moment Stalin motions towards a few soldiers with him on the stage Execute the first row he commands and the soldiers on stage begin opening fire at the first row of troops on the groundIll ask again who sneezed says Stalin Another pause and no one speaks up Finally Stalin says Execute the but before he can finish a soldier about  rows back raises his hand and says It was me General Secretary Stalin Im the one who sneezedStalin then stares cold and hard at the soldier who spoke up for an uncomfortable amount of time before he leans towards his microphone and says Bless you ,1385705431.0,Joseph Stalin is giving a speech to his army,302,jokes,top_week
paulasutton,17,84,1reuyn,217,It hates that,1385380100.0,Never treat a woman like an object,301,jokes,top_week
maximuz,8,113,1rkuwg,195,A guy notices a new bar at the top of a tall building Looking for a new place he goes in He sits next to a very drunk guy at the bar who turns to him immediately This place has a magic drink do you know about it The man responds no but looks intrigued The drunk man orders a drink downs it and jumps out of the window and flies around the building one time before returning and sitting down Wow the man exclaims Can you do it againAgain the drunk man downs another drink and repeats the feat of flying around the buildingAfter  or  flights the man decided that he wants to try this magic drink and fly too He orders a drink downs it and jumps out the window falling to his deathThe bartender looks at the drunk man and says You know you can be a real dick when you are drunk Superman,1385569349.0,The magic drink,308,jokes,top_week
Albythere,6,33,1re5io,177,This morning I was in luck and was able to buy two boxes of Bud Light cheapI placed the boxes on the front seat and headed back home I stopped at a service station where a dropdead gorgeous blonde in a short skirt was filling up her car at the next pumpShe glanced at the two boxes of beer bent over and leaned in my passenger window and said in a sexy voice Im a big believer in barter handsome Would you be interested in trading sex for beerI thought for a few seconds and asked What kind of beer ya got,1385348799.0,Beer,210,jokes,top_week
NascentEcho,12,115,1rc6wx,182,I think this joke would be more funny with a punchlinewooden tit,1385277844.0,My girlfriend got mahogany breast implants yesterday,297,jokes,top_week
takesjokeliterally,10,58,1rjh43,170,It was an udder disasterIll show myself out,1385516665.0,What happened when the cow jumped over the barbed wire fence,228,jokes,top_week
pervokris,13,74,1rj4mh,152,The first row at a Justin Bieber concert,1385507575.0,What has  legs and four pubic hair,226,jokes,top_week
Lovefunatwork,3,34,1r9z66,151,Im Jealous of my imaginary friend because he has a real friend,1385194073.0,Im Jealous of my imaginary friend,185,jokes,top_week
Flynn,17,24,1reht0,149,An explorer in the deepest Amazon suddenly finds himself surrounded by what appears to be a bloodthirsty group of cannibalsUpon surveying the situation he says quietly to himself Oh God Im screwed There is a ray of light from the sky above and a voice booms out No you are not screwed Pick up that stone at your feet and bash in the head of the chief standing in front of you So the explorer picks up the stone and proceeds to bash the life out of the chiefHe stands above the lifeless body breathing heavily and surrounded by  cannibals with a look of shock on their faces The voice booms out again Now youre screwed,1385360733.0,An explorer in the Amazon finds himself surrounded by a group of cannibals,173,jokes,top_week
Worfrat,9,29,1rfoaa,139,An Italian a Scotsman and a Chinese man are hired at a construction site The foreman points out a huge pile of sandHe says to the Italian guy Youre in charge of sweepingTo the Scotsman he says Youre in charge of shovelingAnd to the Chinese guy Youre in charge of suppliesHe then says Now I have to leave for a little while I expect you men to make a dent in that pile of sandSo when the foreman returns after being away for a couple of hours the pile of sand is untouchedHe asks the Italian Why didnt you sweep any of itThe Italian replies I no hava no broom You saida to the Chinesea fella that he a wasa ina charge of supplies but he hasa disappeared and I no coulda finda him nowhereThen the foreman turns to the Scotsman and says And you I thought I told you to shovel this pileThe Scotsman replies Aye that ye did laddie boot ah could nae get meself a shoovel Ye left th Chinese gadgie in chairge of supplies boot ah couldna fin him neitherThe foreman is really angry now He storms off toward the pile of sand to look for the Chinese gentJust then the Chinese man leaps out from behind the pile of sand and yells SUPPLIES,1385406012.0,A day at the construction site,168,jokes,top_week
Albythere,6,34,1rdmq4,137,A Man went to the doctors office to ask for a Triple Dose of ViagraThe doctor told him that he couldnt allow him a triple doseWhy not asked the manBecause its not safe replied the doctorBut I need it really bad said the manWell why do you need it so badly asked the doctorThe man said My girlfriend is coming into town on Friday my exwife will be here on Saturday and my wife is coming home on Sunday Cant you see Ive got to have a triple doseThe doctor finally relented saying All right Ill give it to you but you have to come in Monday morning so that I can check you to see if there are any side effectsOn Monday afternoon the man dragged himself into the doctors officehis right arm in a slingThe doctor asked Good gawd What happened to you The man said No one showed up,1385334242.0,Triple dose,171,jokes,top_week
Furevuralone,8,32,1ra9pt,129,Sally was driving home from one of her business trips in Northern Arizona when she saw an elderly Navajo woman walking on the side of the road As the trip was a long and quiet one she stopped the car and asked the Navajo woman if she would like a ride  With a silent nod of thanks the woman got into the car Resuming the journey Sally tried in vain to make a bit of small talk with the Navajo woman The old woman just sat silently looking intently at everything she saw studying every little detail until she noticed a brown bag on the seat next to Sally What in bag asked the old woman Sally looked down at the brown bag and said Its a bottle of wine I got it for my husband The Navajo woman was silent for another moment or two Then speaking with the quiet wisdom of an elder she said Good trade,1385213849.0,AZ Hitchhiker,161,jokes,top_week
helloalicehello,14,37,1rinda,122,An Englishman a Scotsman an Irishman a Welshman a Latvian a Turk a German an Indian several Americans including a Hawaiian and an Alaskan an Argentinean a Dane an Australian a Slovak an Egyptian a Japanese a Moroccan a Frenchman a New Zealander a Spaniard a Russian a Guatemalan a Colombian a Pakistani a Malaysian a Croatian a Uzbek a Cypriot a Pole a Lithuanian a Chinese a Sri Lankan a Lebanese a Cayman Islander a Ugandan a Vietnamese a Korean a Uruguayan a Czech an Icelander a Mexican a Finn a Honduran a Panamanian an Andorran an Israeli a Venezuelan an Iranian a Fijian a Peruvian an Estonian a Syrian a Brazilian a Portuguese a Liechtensteiner a Mongolian a Hungarian a Canadian a Moldovan a Haitian a Norfolk Islander a Macedonian a Bolivian a Cook Islander a Tajikistani a Samoan an Armenian an Aruban an Albanian a Greenlander a Micronesian a Virgin Islander a Georgian a Bahaman a Belarusian a Cuban a Tongan a Cambodian a Canadian a Qatari an Azerbaijani a Romanian a Chilean a Jamaican a Filipino a Ukrainian a Dutchman a Ghanaian a Ecuadorian a Costa Rican a Swede a Bulgarian a Serb a Swiss a Greek a Belgian a Singaporean an Italian a Norwegian  Africans and youwalk into a fine restaurantIm sorry says the maître d after scrutinizing the group but you cant come in here without a Thai,1385496301.0,An Englishman a Scotsman an Irishman long joke,159,jokes,top_week
hyperstation,24,36,1rk310,120,Josef Stalin Nikita Khruschev and Leonid Bresnev are riding together on a train headed towards Communism Suddenly the train grinds to a halt The three leaders are annoyed most of all Stalin who immediately orders the trains personnel executed Still the train does not move Khruschev stands up and tells Stalin he is wrong and his way is the best way to restart the train He has the crew posthumously reanimated Still the train does not moveNow some time has gone by and the leaders are becoming irate that is except for Bresnev who now believes he knows exactly how to restart the train and arrive at CommunismHe stands up and moves to the window of the train He lifts the curtain and says Comrades the best way to make it Communism is to look out this window and pretend the train is moving,1385535453.0,Russian history joke maybe not for everyone but my Soviet studies professor told it in class and I had to share,156,jokes,top_week
jadezx,5,38,1rmpq6,115,He got too attached to his work,1385619780.0,Why did Jesus drop out of the carpentry business,153,jokes,top_week
