author,comments,downvotes,id,score,selftext,time_created,title,upvotes,subreddit,type
beans,2,14,1rad5f,15,Give it to me straight I need the feed backA doctor walks into a bar He appears to be exhausted his hair is disheveled his face is drawn Bartender asks rough day The doctor sits at the bar and says its flu season give me a shotAn elderly man walks into a bar holding hands with a beautiful young woman He is obviously a man of great wealth as his watch is decked in diamonds and his suit is of Italian make As the pair sits down the bartender says Im sorry sir but we dont serve minors here nodding towards the woman The man retorts Now hold on just a minute How would you know if shes a minor You havent even asked for her ID The bartender shrugs and says shes clearly a gold diggerA large block of ice walks into a bar and places his order Ill take a whisky on the rocks but dont serve my kidsThe bartender walks into a doctors office and says same punch line different contextTwo nuns walk into a bar The first is elderly and seems to be fully devout The other is young blonde and appears to be new to the convent  Bartender says the elderly nun I was wondering if you could settle a little dispute for us You see my trainee believes that true holiness can be achieved in a matter of days rather than with the years on end that Ive been practicing One year out of catholic school and she thinks that she is as holy as meIll tell you what replies the bartender both of your write down your arguments and Ill decide who among you is most holyThe sisters begin to write their cases The elder nun finishes first and slides her paper toward the bartender At this point the blonde sister has pulled out a calculator and starts to plug away at the buttonsThe bartender reads the first paper aloud Everyday for the last  years Ive woken at dawn for morning prayer I prepare breakfast lunch and dinner for the entire convent while using any spare hours for reading the texts and scripture In case that isnt holy enough I volunteer on the weekends Good gracious sister Says the bartender this is quite exemplary By now the young nun has finished and has passed her paper to the bartenderAll this says is πr r Hold on is this an equation for the area of a circle exclaims the bartenderOh sorry says the blonde blushing It was supposed to be circumferenceA bartender has been going through a financial rough patch and hoped that his wife would accommodate for the tough times by letting him try anal Now the wife resents her husband and was appalled by his audacity to ask for such a thing with their marriage on the fritz She denies his requestLater in the week a man walks into the bar and asks the bartender for a prostitute The bartender is about to send the man on his way when he gets an idea that would make him some money while simultaneously punishing his wifeYou see that woman in the corner He asks Well shes one of the best girls we got You go over to her and take her into the private room You can do whatever you want with her no matter how much she resists Its all part of the act After youre through come back here and pay full price The man nods his head excitedly in agreement and walks toward the wife The bartender watches from afar as the two exchange a few quick words All of a sudden he sees the man grab his wife by the arm and pull her into the private roomThe bartender smiles inwardly to himself and thinks Ha Thatll teach the bitch to appreciate me Plus Im making a small fortuneAfter about twenty minutes the wife comes out alone She heads over to the bartender with a slight limpWheres your new friend asks the bartender smiling He owes me a little moneyThe wife snickers pulls her husband in close and whispers in his ear I let him use the back door and walks awayA man walks into a bar and the bartender says NO STOP GET OUT OF HERE THIS ISNT FUNNY ANY MORE,1385218440.0,Some God Awful OC Bartender Jokes,29,jokes,top_week
ebaysellr,6,18,1rmx1i,15,Nice belt,1385628866.0,What did the zero say to the eight,33,jokes,top_week
Elaborateshoe,2,18,1rj6z9,14,Because the grass tickles their balls,1385509231.0,Why do migits laugh when they run,32,jokes,top_week
MrMuz,5,13,1rio3h,13,Toowet Towoo,1385496792.0,Why do owls not mate when its raining,26,jokes,top_week
deltopia,17,6,1rl6jn,14,I was going to submit a joke of this nature but I thought it would be better if we just had an umbrella thread where everyone could throw in a joke and we wouldnt wipe out the whole front page of rjokesHow do you like your women  Go,1385577162.0,I like my women like,20,jokes,top_week
presqueisle,1,10,1riy6y,13,Bernie was in prison for seven years The day he got out his wife and son were there to pick him up He came through the gates and got into the car The only thing he said was FFHis wife turned to him and answered EF Out on the highway he said FF She responded simply EF He repeated FF She again replied EFMom Dad their son yelled Whats going on Bad Bernie answered Your mother wants to eat first,1385503299.0,Bad Bernie,23,jokes,top_week
James,1,13,1razgy,14,The cat shat on the mat,1385237841.0,What happened when Sean Connery bought himself a little kitten,27,jokes,top_week
rolstonrye,3,10,1ro698,14,The year is  and the French have just begun colonization in North America Young JeanLuc is in his newly crafted home when suddenly his friend JeanPierre bursts through his front door Jean Luc he exclaims  You weel nevar believe I ave eard word of a bacon tree JeanLuc looks confused and scoffs Imposseeble You cannot grow BaycON on a tree Come And I weel show you ze bacon tree So JeanLuc amp JeanPierre set off down the river with Jeanpierre providing direction to the enigmatic bacon tree  Finally they pulled over onto a small beach that lead to a large forest Stay ere and watch ze canoe and I weel bring ze bacon back from ze bacon tree said JohnPierre Hours go by and JohnPierre hasnt returned As night falls and JeanLuc is about to enter the forest to look for his friend he hears a rustling in the nearby brush to which JeanPierre stumbles out bloody and with arrows through his legs and arms JeanPierre What appened exclaimed Jeanluc Turns out it was not a bacOn treeit was an AMBUSH,1385676014.0,The Bacon Tree,24,jokes,top_week
alamurda,4,22,1rb7g9,12,A girl cat asked her boyfriend cat where her mouse stuffed animal was He says that was a stuffed animal I thought it was real so I ate it She responds THIS IS WHY WE CANT HAVE MICE THINGS ,1385244266.0,cat problems,34,jokes,top_week
paulasutton,0,12,1ra36i,12,Has yet to be used on a woman,1385201641.0,Throughout the history of espionage the phrase We have ways of making you talk,24,jokes,top_week
Lighterless,4,9,1r98rl,13,and approaches the teller whos name is John Paddywack I would like to take out a loan for  the frog declares Mr Paddywack looks at the frog and says Since you dont have any credit with this bank youll need a cosignerNo Problem says the frog My father is Mick Jagger and hell cosign the loan for meWell youll also need some collateral Mr Paddywack counteredWill this work Asks the frog and pulls from his pocket a mishappen Buddha figurine made out of bronzeWell maybe Lets go ask the bank manager Says Paddywack and the two go back to the bank manager where Paddywack explains the situationAnd so what should I do I dont even know what this thing is Paddywack tells the bank manager while showing him the BuddhaThe bank manager repliesIts a knickknack PaddywhackGive the Frog a loanHis old mans a rolling stoneThis is how it was told to me but this joke has also been told about  months ago in this sub herehttpwwwredditcomrJokescommentsevqxafroggoesintoabankandapproachestheteller,1385167141.0,A Frog Walks Into A Bank,22,jokes,top_week
mikerobbo,1,15,1rofs8,9,then he came back today with his dog,1385685242.0,Yesterday a German Shepherd did a shit in my garden,24,jokes,top_week
ScotchRobbins,1,6,1rn4bv,12,The first man says When I get up at  AM it takes me a half hour to peeSecond man says Youre lucky When I get up at  AM it takes me a straight hour to take my morning poopThird man says I piss like a racehorse at  and crap like a goose at Then whats the matter with you asked the other twoProblem is Im not up until ,1385640367.0,So three elderly men at a rest home are conversing about their age,18,jokes,top_week
enfoxer,1,11,1rlysu,10, Stop pucking around,1385596485.0,What do you tell a Hockey player messing up with you,21,jokes,top_week
DisneyReference,4,21,1rp9z3,6,,1385717597.0,What do you get when you mix a joke with a hypothetical question,27,jokes,top_week
killerswisscheese,2,16,1ropd5,11, Below,1385694717.0,What is the temperature of the average coffin,27,jokes,top_week
APottedPlant,2,24,1rmakg,9,Lawl School,1385606128.0,Where do lawyers go to study comedy,33,jokes,top_week
mikearmy,2,7,1rj96w,8,Hes scared of getting nailed into the boards,1385510745.0,Why doesnt jesus play hockey,15,jokes,top_week
chadridesabike,3,21,1rj7pn,11,TwerkyIll show myself out,1385509753.0,What does Miley Cyrus eat for Thanksgiving,32,jokes,top_week
Oltarus,3,4,1rhebd,9, they came to see the movie Closed for Winter,1385452023.0,An old couple was found dead in a drive in theater,13,jokes,top_week
hisnameisntimportant,4,10,1rgsbe,8,A onelegged man in an ass kicking contest,1385432901.0,Who is busier than a onetoothed man in a corn eating contest,18,jokes,top_week
Ninjygingy,2,8,1r9reu,7,Holy Braille ,1385184199.0,What does a blind person read in church,15,jokes,top_week
eriknorth,8,17,1rmhf9,7,You can tuna piano but you cant piano tuna,1385612199.0,What do a piano tuna and glue have in common,24,jokes,top_week
widestangle,3,9,1rh4s7,9,I told her to call the vet maybe they can pull some strings,1385442395.0,So my girlfriend told me her dog ate some tampons,18,jokes,top_week
ieatcrispybacon,0,3,1rpw49,10,A muenster,1385745708.0,What did the cheese go as for Halloween,13,jokes,top_week
acidGRUNT,6,14,1rks8e,8,They didnt get the permission to land so they arrive an hour late Hollande steps out first shaking Obamas hand and saying Im sorry for being late Second Putin steps out of the plane greeting Obama and adding Im sorry for being late too Last one leaving the plane is Merkel and she walks to Obama and says Im sorry for being late threeHeard this joke a few years back when it was still Bush and Sarcozy and thought it was quite good at mocking our talent for the English language i am German myself ,1385567339.0,Hollande Putin and Merkel sit on a plane to visit Obama,22,jokes,top_week
Mjeck,14,15,1rjhsq,7,The man is was old and blind while his wife was deaf After a week the old blind man had enough and told his wife That damn bird is too loud get rid of itThe deaf woman replied But shes so pretty,1385517165.0,An old retired couple adopt a bird,22,jokes,top_week
smittyballack,2,7,1rgkz9,7,Rudolph the Red Nosed Reindeer passed away today at the age of  He was struck by a  jet liner and a flock of seagulls as he flew over Barcelona Coroners say that the reindeer in Spain was hit mainly by the plane,1385427593.0,A classic by the great Colin Mochrie,14,jokes,top_week
TacoPrince,1,14,1rakgs,7,not many people approve ,1385225727.0,I have a new Obama joke but,21,jokes,top_week
ZinMan,1,5,1r9csd,7,The patient was smitten with his proctologist After receiving a clean bill of health he made another appointment anyway I told you last time there was nothing wrong the proctologist saidPlease look again I think there something in there said the patientThe proctologist started his exam and exclaimed Jesus there IS something in hereHe reached in and pulled out a bouquet of flowersGood God there was a bouquet of flowers up your ass said the proctologistLooking back over his shoulder the patient exclaimed Read the card read the card ,1385170534.0,Smitten Patient,12,jokes,top_week
readingismyboyfriend,0,4,1rmuq6,6,You make a seizure salad,1385625540.0,What do you do with epileptic lettuce,10,jokes,top_week
helluva,2,11,1rkj7h,8,What hotel does the vegetable Sean Connery stay inIn a faux connery accent  The Radishon,1385558987.0,Joke made up by friend of friend It is terrible but I laughed,19,jokes,top_week
jakielim,3,17,1rk9mf,7,This is commonly referred to as Rebecca Black Friday ,1385544711.0,This Friday millions of people will risk getting trampled to get the best seat on a car,24,jokes,top_week
exaggeratedsarcasm,0,5,1rjze9,7,Ten tickles,1385531723.0,How many tickles does it take to make an octopus laugh,12,jokes,top_week
macthecomedian,0,14,1rjy11,7,Little boysenberries,1385530481.0,What is a priests favorite snack,21,jokes,top_week
nathantheman,5,20,1rjn25,8,Put Velcro on the roof,1385521289.0,How do u stop a black person from jumping on the bed,28,jokes,top_week
BrendonMurphy,4,13,1rjjje,7,So I asked this Jewish girl for her number She rolled up her sleeve ,1385518506.0,Joke my friends told me,20,jokes,top_week
kngnk,3,14,1rj4eo,7,Alright that will be  said the taxi driverafter taking Will Smith from West Philadelphia to Bel Air,1385507415.0,The Fresh Prince,21,jokes,top_week
jcardinal,2,5,1ri3u0,5,Do you smell carrots,1385483048.0,Two snowmen are standing next to each other in a field when one looks over to the other and asks,10,jokes,top_week
DwightAllRight,1,9,1rg8ac,5,Ba dum tss,1385418969.0,Two drums and a cymbal fall off a cliff,14,jokes,top_week
HypnoCin,1,9,1r981e,6,Poor Bob dies and his spirit heads up to Heaven  But at the Pearly Gates hes told that he hasnt been good enough he has to go down to Hell instead  So he does and when he gets there theres a long line of spirits waiting to be processed into Hell  Bob watches for a while and sees that Satan seems to be sending some people off to the right through a big door and other people would be tossed into a big pit of huge flames to the left  But once in a while Satan would appear to deliberate over a person and then just chuck them into a pile off to the side  When he finally made it to the front of the line Bob couldnt help himself he just had to know he asked Satan Why didnt you throw those people in the pile into the pit of fire Satan put his hands on his hips and shook his head frustrated  Oh those people are from Seattle  Theyre too wet to burn ,1385166557.0,Poor Bob in Hell,15,jokes,top_week
GeneralFriend,0,5,1rq4tb,5,She gives her grandpa a slice of pumpkin pie He passes it down the tableShe brings out another slice of pie and gives to grandpa He passes it down the tableShe brings out another slice of pie and gives to grandpa He passes it down the tableShe slams her hand down Grandpa this is ridiculous All the slices are the same size,1385752899.0,A little girl helping with holiday meal,10,jokes,top_week
michaelscarnfbi,1,5,1rpnz0,7,He drowned in his teapee,1385738313.0,What happened to the Indian chief who drank too much tea,12,jokes,top_week
Froggyhop,0,7,1rmngf,7,They are out standing in their field,1385617549.0,Why are farmers the best at what they do,14,jokes,top_week
ImaTeaRex,14,27,1rkwls,4,It hasnt come out yet though ,1385570565.0,Anyone heard of that movie Constipation,31,jokes,top_week
FightEntropy,1,3,1rc27g,5,which isnt too difficult as a kleptomaniac,1385272032.0,They say not to covet,8,jokes,top_week
Yanetoe,0,4,1rq9v7,13,With a crowbar,1385756909.0,How do you separate the men from the boys in the Navy,17,jokes,top_week
Cygnus,0,3,1rq1ki,5,HAAAAAAYYYYhttpwwwinfiniteloopercomvliZZuZo,1385750311.0,What does James Brown feed his horse,8,jokes,top_week
bzos,7,10,1rh509,3,httplongestjokeintheworldcom,1385442588.0,The Longest Joke In The World,13,jokes,top_week
cookieguy,2,8,1rh4su,2,Alcohol is a solution ,1385442409.0,Chemically Speaking,10,jokes,top_week
marycartlizer,3,14,1r9agt,4,A man goes to the doctor and tells him that he and his wife are not enjoying sex as much any more  The doctor asks How old are you and your wife The man says We are both The doctor asks When did you first start noticing thisThe man answers Well three times last night and twice this morning  ,1385168515.0,Old man and his wife are not enjoying sex as much,18,jokes,top_week
ketR,0,4,1rq4c5,0,A twentysomething with a rainbow colored mohawk is sitting at a booth at a restaurant After a while he realizes an old man sitting there staring at him He goes back to eating but the old man is still staring at him Eventually he goes over and asks look can I help you and the old man says well son years ago I had sex with a parrot and I was wondering if you might be my son,1385752515.0,Since Were Posting Jokes From Our Grandpas,4,jokes,top_week
nakedoc,0,4,1rppn1,3,There was some guy collecting the waste from the urinals at work today I think he was taking the piss to be honest ,1385739989.0,Collection,7,jokes,top_week
fuden,3,8,1rosm1,4,The pro football team had just finished their daily practice session when a large turkey came strutting onto the field While the players gazed in amazement the turkey walked up to the head coach and demanded a tryoutEveryone stared in silence as the turkey caught pass after pass and ran right through the defensive line When the turkey returned to the sidelines the coach shouted Youre terrific Sign up for the season and Ill see to it that you get a huge bonusForget the bonus the turkey said All I want to know is does the season go past Thanksgiving Day httpwwwbizfriendorg,1385697810.0,JOKE OF THE DAY,12,jokes,top_week
mclarke,1,4,1ro0eq,4,Life on the hedge,1385670840.0,How do tree surgeons live,8,jokes,top_week
fergiz,0,7,1rpphh,1,This is an old oneA man goes to a psychologist and says Doc you have to help me I cant sleep Every time I close my eyes my mother is right there giving me grief When I open them its even worse there she is again nagging and bullying me Sometimes its so bad at night time all I can do is go downstairs and eat a piece of toastThe doctor looks at him and replies What One piece of toast For a big boy like you,1385739855.0,Recurring Visions,8,jokes,top_week
JamBug,4,10,1rio0d,4,COLIN Duh,1385496733.0,What do you call a man with a colander on his head,14,jokes,top_week
Injuringset,0,0,1rqg4q,7,Horton hears a hue ,1385761757.0,What do you call a childrens book aimed at synaesthetes,7,jokes,top_week
TheStabbingHobo,0,2,1rqfq4,3,The taste,1385761439.0,Whats the difference between an oral thermometer and a rectal thermometer,5,jokes,top_week
Quaileater,0,2,1rqdb6,1,walks over to his wife with a sheep under his arm He announces loudly This is the Pig Ive been fucking  His wife looks at the poor creature and says Gethin you silly bastard thats a sheep not a pig Gethin replies I wasnt talking to you ,1385759587.0,A Welsh Farmer,3,jokes,top_week
xereeto,0,2,1rqda6,3,Shamus and Murphy fancied a pint or two but didnt have a lot of money between them they could only raise the staggering sum of one Euro Murphy said Hang on I have an idea He went next door to the butchers shop and came out with one large sausage Shamus said Are you crazy Now we dont have any money left at all Murphy replied Dont worry  just follow me He went into the pub where he immediately ordered two pints of Guinness and two glasses of Jamieson Whisky Shamus said Now youve lost it Do you know how much trouble we will be in We havent got any money Murphy replied with a smile Dont worry I have a plan Cheers They downed their Drinks Murphy said OK Ill stick the sausage through my zipper and you go on your knees and put it in your mouth The barman noticed them went berserk and threw them out They continued this pub after pub getting more and more drunk all for free At the tenth pub Shamus said Murphy  I dont think I can do any more of this Im drunk and me knees are killinme Murphy said How do you think I feel I lost the sausage in the third pub,1385759564.0,Irish Sausage,5,jokes,top_week
dsade,0,4,1rpt8m,2,Hes bringing Skeksis Back,1385743183.0,Justin Timberlake has announced hes involved with a sequel the The Dark Crystal,6,jokes,top_week
lasertoast,3,6,1rppfr,1,This blind guy walks into a fish storeHe turns to his buddy wow so many chicks,1385739798.0,This blind guy walks into a fish store,7,jokes,top_week
ndnh,5,5,1rp2u4,1,Jill came down with ,1385707809.0,Jack and Jill went up the hill with a dollar and a quarter,6,jokes,top_week
Seikoholic,2,11,1retv0,2,Linda McCartney,1385378196.0,s joke What do you call a dog with wings,13,jokes,top_week
humanornament,1,13,1rdpct,3,Lets make like a baby and head out,1385336194.0,This party is boring,16,jokes,top_week
pinus,0,7,1rqa1c,0,son of Arathorn and am called Elessar the Elfstone Dúnadain the heir of Isildur Elendils son of Gondor Sir that does NOT fit on your Starbucks cup Ok just put Bob in it,1385757042.0, My name is Aragorn,5,jokes,top_week
Francke,1,5,1rm7j0,0,Snoop Dogg made a rap for Hot pockets Did he No Snoop dogg,1385603525.0,Diddy,5,jokes,top_week
tylerbrazier,1,2,1rltiq,0,I guess you could say Ive been laundering money,1385592545.0,My wallet just went through the wash,2,jokes,top_week
ilovefuckedup,6,21,1rkew7,0,Because they dig homes,1385553141.0,Why are all rabbits negro,21,jokes,top_week
ryanknapper,2,2,1ri7h7,0,How do you breathe through that thing,1385485583.0,What did the elephant say to the naked man,2,jokes,top_week
BurnAtlanta,0,4,1ri3s4,0,They cut a little off before they know how big its going to be,1385483013.0,Why Are Jews Considered Optimists,4,jokes,top_week
SupremeMitchell,1,5,1rgtcy,2,but Ill need a moment of inertia ,1385433639.0,I want to get back on the merry go round,7,jokes,top_week
TheMasterofLOLZ,2,13,1reue5,0,He worked it out with a pencil,1385379113.0,What did the accountant do when he was constipated,11,jokes,top_week
meltyourheart,1,5,1rajkf,0,Because theyre two tired,1385224886.0,Why cant bicycles stand up on their own,5,jokes,top_week
DomtheWop,2,8,1r9phr,2,Depends ,1385182266.0,Whats an old woman taste like,10,jokes,top_week
skaj,1,9,1r9i9o,0,Her husband had a holloweenie,1385175511.0,Why couldnt the witch get pregnant,9,jokes,top_week
DrHelminto,0,8,1rq1yt,0,An I wont write it because you must HEAR itProps to ELI DIRTY JOKES heres the link httpwwwyoutubecomwatchvhEGJIyiJEnjoy the channel with many good jokes around,1385750614.0,I heard this joke from you tube and it rapidly became my favorite one making huge crowds laugh and here it is,7,jokes,top_week
MObaid,0,6,1ro4up,0,Muhammad ordered cranberry juice and Jesus said to the bartender  Just water for me,1385674697.0,Muhammad and Jesus walked into a bar,3,jokes,top_week
BrewsterThePigeon,1,8,1rnz0h,0,Eat your dinner before it clots,1385669663.0,What did the vampire say to her kids,6,jokes,top_week
dsade,1,12,1rntuo,0,Let It Snowden,1385665448.0,What is Obamas least favorite Christmas Carol,10,jokes,top_week
arthur,4,4,1rnfsl,0,,1385654183.0,Can anyone give me a RussianEnglish bilingual pun,4,jokes,top_week
hoopsman,5,5,1rmefd,0,You can tuna piano but you cant piano a tuna ,1385609546.0,What is the difference between a piano a tuna and a pot of glue,4,jokes,top_week
TheKalawishis,0,19,1rm8lp,0,Its Allah this world,1385604412.0,Did you hear about that new space mosque,18,jokes,top_week
INTERNALCARNAGE,0,5,1rkakx,0,A guy wakes up in the morning only to discover he forgot to set his alarm clock making him late for work So his day is off to a rough start He arrives at his work but is later confronted by his boss with news that the company he works for has to lay off a few people Including him So his day gets worse As he is about to tell his wife what happened he gets a text saying that she doesnt love him anymore shes been seeing another man for months and shes taking everything in the divorce At that point the mans day has gone to shit So after he takes his stuff he goes to a hotel and goes to a huge bar nearby to drink away his sorrows After  or  beers a man comes up and sits next to him and notices that the guy looks like shit So he asks whats up The guy told him about his day The man next to him says You know what I know what will cheer you up So he invites the guy up to the th floor which is basically a VIP lounge bar Its completely fancy with sonw of the best top shelf drinks known to man So the two guys sit down and the generous man asks Have you ever had a flyerNo the guy repliesWell the name says itself man Itll make you fly Bullshit The guy says backTo disprove his skepticism the man says Larry get me A flyer So Larry the bartender pours him a green liquid which the man downs quickly and goes out to the bars balcony jumps and starts flying around The man suddenly gets happy Hes thinking that this could help him feel like the king of the world So he tells Larry to get him a flyer After he downs the drink he climbs to the balcony jumps and falls to his death The man still flying goes back into the bar and sits back down at the bar Larry looks over at him and says You know what Superman You can be a huge dick sometimes,1385546203.0,Get Me A Flyer a joke I heard from a friend,4,jokes,top_week
WeTrippyMayne,2,9,1rk0kl,0,They throw a drawer of silverware down the stairs and name it whatever sound it makes,1385532865.0,How do Asians name their babies,8,jokes,top_week
Stuiereds,0,7,1rju5o,0,I was gardening the other day when my older brother rang to ask if I wanted to hang out I promptly said yes because you know what they say bros before hose,1385527069.0,Gardening,6,jokes,top_week
