author,comments,downvotes,id,score,selftext,time_created,title,upvotes,subreddit,type
WDandWN,0,4,1rj7ny,0,Three friends are in an a car accident John Jay and Chris John amp Jay die and travel through the magnificent tunnel of light into The Kingdom of Heaven St Peter meets them at the pearly gates and welcomes them in Once inside they stop by the administration building for inprocessing Inside they see walls filled with clocks They asked St Peter What are all of these clocks for St Peter explains they are masturbation clocks and everyone has one Each time you masturbate a the hand moves a little Curious the men ask to see their own clocks John noticed his had moved a little but nothing to be ashamed of Jay sees his and while obviously more hands on than his buddys he wasnt ashamed Now curiosity really got the best of them and they asked if they could see their pal Chriss St Peter responded sheepishly Oh his is in the office we are using it for a fanPlease LIKE amp SHARE our page httpswwwfacebookcomWastedDaysWastedNights,1385509726.0,Clocks in Heaven,2,jokes,top_week
mdragon,1,3,1ri3he,0,Whats a skeletons least favorite gamewishbone,1385482801.0,Came up with this on a long car ride,2,jokes,top_week
crazyeihts,1,2,1ri2yo,0,But I turned myself around,1385482429.0,I used to be addicted to the hokey pokey,1,jokes,top_week
BillyBatts,0,5,1rhxg2,0,Ive had enough of your shit,1385478075.0,What did the scat fetishist say to his wife before divorcing her,4,jokes,top_week
brooklynpossum,1,10,1rf8r6,0,you know where there are certain things youre not supposed to eat buy you cant help yourselfthats why I can never be a gynecologist,1385395286.0,NICE SPREAD,8,jokes,top_week
vfcascaes,5,20,1rdpd4,0,,1385336201.0,Is Black Friday bigger than all the other Fridays,17,jokes,top_week
Dougifyouknowme,1,4,1rahc6,0,They call the renovaters and tell them that one wall is  meters by  meters and the two other walls are  meter by  meters The renovators ask Thats only three walls dont you want all the walls to be tiled The couple replies We wanted to but Deadpool broke the fourth wall,1385222809.0,A couple is getting new tiles in their bathroom,3,jokes,top_week
WetsNoodle,0,7,1racwp,0,who cares,1385218158.0,A black guy and a mexican jump off a building who hits the ground first,4,jokes,top_week
brooklynpossum,0,3,1rabzn,0,whats another definition of a goateea gay mans bullseye,1385217010.0,DEFINITION,2,jokes,top_week
SGrumpy,3,5,1r9z1y,0,Am I flogging a dead horse ,1385193882.0,Im a violent sadist but I also enjoy beastiality,4,jokes,top_week
SnarkyUsername,0,4,1rlu15,0,I guess that makes female fireflies firewalks,1385592918.0,I read a Snapple fact that said that only make fireflies can fly,2,jokes,top_week
extralongnipples,1,6,1rl1qb,0,Your mom cant take a joke,1385574013.0,Whats the difference between  dicks and a joke,4,jokes,top_week
LiquidDerp,1,7,1rfxnt,0,what is brown and hangs in a treea stick,1385412114.0,I shouldnt laugh at all,5,jokes,top_week
DoctorCocktor,0,6,1rfe4h,0,A Faggot,1385399123.0,What do you call a man who just had his back waxed,2,jokes,top_week
catherder,0,12,1revj7,0,Two goldfish are swimming around their bowlOne asks the other Here  do you believe in GodThe other one says Of course I do Who you think changes the water in our bowl,1385381066.0,God,11,jokes,top_week
bendaman,0,13,1reuch,0,Theyre hella quick on the rebound,1385379033.0,The NBA should really draft some thirsty ratchet bitches,10,jokes,top_week
Irishguy,1,9,1rbehf,0,The gorilla gets out to shit,1385250012.0,Whats the difference between a gorilla and an Italian in the bathtub,7,jokes,top_week
thunderbolt,0,8,1ra8ol,0,Just before the Obamacare debate Pelosi was at the Doctor having a physical examDr I want you to go into the bathroom and shit into this cup Pelosi  Why Dr  I need to examine your stool to make sure theres nothing bad in itPelosi  I promise you I am healthy  You dont need to see my shitDr  You have to pass it to see what is in itAnd now you know the rest of the story,1385212242.0,Nancy Pelosis epiphany  The rest of the story,6,jokes,top_week
arthur,0,7,1r9s1r,0,Buddhapest,1385184878.0,What European city is home to the most Indians,4,jokes,top_week
TheSeriousRedditor,1,5,1r8zku,0,     你好我认识你吗     对好久不见你好吗你看来没什么变化     你坐在这里吗     我很累你呢     我很快乐     听起来不错你有好朋友吗     对今天你和你的朋友们要做什么     我们要做研究生     你在学校使用时间的方法很不合理     其他人为什么这样做呢就靠这样拿到学位     严重的是烟酒生这怎么可能     我一直这样做     什么     成长中我一直不停学习我能应付自如     你喝什么白葡萄酒红酒水或 果汁     这有什么关系     你喝东西吗     哪儿 这儿不是现在在我的大学为什么个研究生现在在清晨的火车站     我为什么不烟酒生这难道不是你在大学获得高水平的方法不是每个人都这么做的吗为什么现在不这么做     这个没有时间     没时间是真的吗别丢人了     比起别人来我不会丢人     烟酒生是对你的健康有害的     烟酒生 你不明白 我要做研究生     啊 我以为你说 烟酒生 妈呀     ha ha ha     我的办公室就在这里我得走了你很幽默你的电话号码是什么     五五五五三六六 我想聊聊     现在等一下     什么     首先你为什么哭我不喜欢看到别人哭     你是什么意思     五五五     等一下现在你为什么哭     我没哭你你看只是告诉你我的电话号码     号码是         容易理解了号码是         五三六六我想聊聊     我没有时间继续聊给我号码就行了     五三六六我想聊聊     我已经告诉你      号码是五三六六     电话号码也是五三六六吗是不是     对    Puns used    研究  yanjiusheng  Graduate Student    烟酒  yanjiusheng  smoking and drinking          五五五 Sounds Like Someone Crying ie boohoohoo      无三六六 Sounds Like 我想聊 or I Want To ChatHow can I improve on thisEDIT Pinyin version below in case simplified are hard to understandEDIT If you downvote please explain why,1385160105.0,Starting out in Xiangsheng Like what I have so far,3,jokes,top_week
Spinnocks,5,33,1rn9iw,0,Doctor So how can i help youGuy Doc I have no idea whats going on but it seems my penis is turning orange Youve got to help me out Doctor Hmm lets seestart from the beginning What are your hobbiesGuy Eating bbq chips and watching pornReedit ,1385647850.0,A guy visits the doctor,30,jokes,top_week
Guava,1,4,1rmtlh,0,He arrived at his destination safely,1385624085.0,A man went onto a train with a banana and a suitcase,1,jokes,top_week
SLeAKeR,1,10,1rkkcu,0,Surely this place can come up with some pretty dirty shit for this one,1385560296.0,After viewing The Aristocrats What are Redditors version of this joke,6,jokes,top_week
alester,0,4,1rk8s6,0,Dont mistake me for a fool  Im just a half,1385543425.0,Another shitty joke,1,jokes,top_week
kavirm,1,11,1rk1ie,0,Wedding Drama down underhttpwwwntnewscomaunewsonlyintheterritoryflyingdildohitsbuckspartyguestdrawsbloodstoryfnktgd,1385533809.0,Is it a bird Is it a plane not wait Its A,8,jokes,top_week
ThatDandyMan,0,6,1rfho6,0,Holy shit,1385401542.0,What does a black guy call a priest,2,jokes,top_week
Evning,0,7,1rejz8,0,Awhere are you goingBto the toilet where else can one go in an airportI would like to add that my emotional response was mixed,1385363130.0,Joke i heard between  airport janitors,3,jokes,top_week
pizzarun,3,10,1rchan,0,They become super glue,1385297539.0,What happens to gay horses when they die,5,jokes,top_week
justonejok,3,9,1r9ply,0,She doesnt,1385182364.0,How does Ann Coulter get the smell of semen out of her hair after she is on Fox and Friends,7,jokes,top_week
Dickinabx,0,6,1rmyyj,0,A crowbar,1385631751.0,How do you seperate the men from the boys,2,jokes,top_week
drtech,1,7,1rlo1s,0,Because the grass tickles their balls,1385588749.0,Do you know why midgets giggle when they run,3,jokes,top_week
asiaafrica,0,9,1rf1tk,0,Be nice to fat people theyre human too Human Boeings,1385389352.0,People and airplanes,4,jokes,top_week
MarchingPillows,6,6,1ra7gz,0,A man walks into a bakers points at something in the display and asksIs that a doughnut or a meringueThe baker says No youre right its a doughnut,1385210060.0,The bakers,2,jokes,top_week
MartinLutherKingJ,0,10,1rpx9c,0,Nignog,1385746744.0,What do black people drink during the Holiday Season,4,jokes,top_week
jubileo,1,6,1rpi5a,0,Headmaster,1385731115.0,What is the name of a person who is a specialist in giving Blow jobs,1,jokes,top_week
SwitchBlayd,1,10,1rn61y,0,About tree fiddy,1385642932.0,How much does wood cost,5,jokes,top_week
mclarke,1,17,1rn2qe,0,Ouch,1385637848.0,A man walked into a bar,12,jokes,top_week
VR,0,6,1rlq0w,0,A lady was waiting at home and thought it would be funny to suck off her husband as soon as he got home Sure enough a couple of hours later he opens the door and says Honey Im ho She begins to zip down his pants and says Ssshhh dont talk She goes in to suck when the husband says Honey Stop I was about to say these are my parents theyre staying over for thanksgiving,1385590085.0,A lady was waiting at home NSFWish,1,jokes,top_week
OhAces,2,12,1rlcm2,0,Gimme fuel,1385581173.0,What did James Hetfield say when he go to the gas station,8,jokes,top_week
superdiglett,1,14,1rlaja,0,Knock knock  Whos there  Banana  Banana who  Knock knock  Who is there  Banana  Banana WHO  Knock knock  Who is fucking there  Banana  BANANA WHO  Knock knock  Whos there  Banana  GOD DAMN IT BANANA WHO  Knock knock  Oh not this shit again Whos there  Orange  Orange Okay orange who  Orange you glad I didnt say banana  YES  ,1385579819.0,Thought this old joke might be relevant,8,jokes,top_week
Spinnocks,3,11,1rkh8e,0,How do you call a depressed retardDown,1385556628.0,Stoopid,7,jokes,top_week
hydrarulz,0,8,1rii5c,0,walked into a club,1385492898.0,A baby seal,3,jokes,top_week
Amio,0,12,1rigem,0,And she is almost done her drink when she realizes the builtin straw is too short I said well thats stupid Are all the bottles like that or did you just pick the short straw,1385491744.0,So my friend has this water bottle,7,jokes,top_week
Embrooks,3,14,1rgify,0,When the cops bust in They all run down to the cellar to hide They find a pile of potatoes in bags and decide to hide in a few of the empty bags nearby When the cops come downstairs they see the bags and being the crafty buggers they are decided to check them out They kicked the bag with the first guy and he yelled woof woof The cop then said ah there is only dogs in this oneThey then kicked the second bag meow meow went the criminal Ah theres only cats in this oneThey then kicked the third bag and the last criminal called out potato potatoBusted,1385425800.0,Three criminals are in a bar,8,jokes,top_week
ScottishBrong,3,10,1rgfk0,0,Mexicane,1385423774.0,What do you call a person from South America with a walking assist,6,jokes,top_week
sciencebrony,5,10,1rfrn9,0,An Australian turist came to America and rented a motorcycle He drives in the speed of MPH in a MPH speed limit road when a police officer tells him to pull over The cup yells at the turist What is wrong with you did you came here to dieNo answer the turist I came here today,1385408233.0,Australians,5,jokes,top_week
airsoftwizard,3,11,1rfpd4,0,So I can literally rock out with my cock out ,1385406704.0,I always play music in the shower,4,jokes,top_week
arthur,1,10,1rf0mb,0,who was bashing his head on the border between aisles  and  He said Go away muggle Im trying to get into aisle  ,1385388090.0,I saw this guy in Walmart,4,jokes,top_week
DoctorCocktor,1,10,1rdtjb,0,Juan Andonlé,1385339476.0,What do you call your Mexican crush,4,jokes,top_week
ZinMan,0,18,1rdrbg,0,The first grade teacher was asking her class to think of a word that started with each letter of the alphabet She began with A Several students raised their hands but in the back Johnny a notoriously foul mouthed kid was jumping up and down pleading to be called on The teacher thinking Johnny would say something like asshole skipped hima dn called on Jennifer Apple Jennifer said Very good Jennifer said the teacher Next was B Again Johnny was jumping up and down with a raised hand The teacher thinking Johnny would say butthole or bastards instead called on Tommy Baseball said Tommy Next was C and Johnny immediately began jumping up and down wanting to be called on The teacher thought for sure Johnny would say Cunt so she called on Alice Cat said Alice On through the alphabet they went and by the time they reached R it became too obvious the teacher was ignoring Johnny She couldnt think of a bad word that began with R so she cautiously called upon JohnnyRATS Teacher he exclaimed The teacher was relieved not the best word but not that bad But Johnny wasnt done Big fucking rats teacher with huge cocks like that spreading his arms as wide as he could,1385337762.0,Johnny in st Grade,14,jokes,top_week
tueman,6,17,1rbn6x,0,Why did curiousity kill the cat,1385257622.0,I have but one question,11,jokes,top_week
InnerBoyka,3,14,1rbdha,0,take a taxi,1385249179.0,How do you get to Carnegie Hall,10,jokes,top_week
JoeBourgeois,0,9,1rorim,0,Microsoft Word,1385696772.0,How do you greet an overweight Micronesian when youre trying to sound cool,3,jokes,top_week
MarbleBoy,1,16,1rnbme,0,and asks Father how do we get our names Father says When your brother came of age I came out of the teepee and saw a bear standing in the distance so we called your brother Standing Bear Then when your sister came of age a white dove flew by the teepee when I stepped outside so we named your sister White DoveSo the boy says so when I came of age you saw a thrush and thats why Im called little ThrushAnd the Father says No We called you that because youre an irritating cunt,1385650201.0,A teenage Native American boy walks up to his father,9,jokes,top_week
XxActionJacksonxX,0,15,1rmnyn,0,Cancer,1385618038.0,What did the blind deaf and mute kid get for Christmas,10,jokes,top_week
typhdf,4,17,1rmllo,0,Nigeria has  people per capita,1385615814.0,Fun fact,12,jokes,top_week
nathantheman,0,26,1rmchi,0,They could only find three minivans,1385607804.0,Why were there only  thousand Mexicans at the Alamo,20,jokes,top_week
Farmerd,0,10,1rl7aj,0,I man calls in sick to work His boss thinks he sounds fine so he says You dont sound sickMan IM FUCKING MY SISTER IS THAT SICK ENOUGH FOR YOU,1385577680.0,Is that sick enough for you,3,jokes,top_week
kidbrandon,3,9,1rkktv,0,I said No but I want a regular banana later so yeah,1385560801.0,My friend asked me if I wanted a frozen banana,4,jokes,top_week
GeneralFriend,1,13,1rj91j,0,She said If you like your Dr Pepper you can keep your Dr Pepper,1385510643.0,Why am I not afraid of Michelle Obama banning soda pop,7,jokes,top_week
sassageflare,0,12,1riksr,0,I wasnt too disappointed that my XBone crashed and burned but I couldnt  stand the fact that the smoke was even in lowres,1385494605.0,I had an issue with my XBone suddenly breaking amp emitting smoke,5,jokes,top_week
olliethestuntbum,0,9,1rhfju,0,but im afraid it might be too cheesy,1385453824.0,i want to tell you a joke about pizza,3,jokes,top_week
winkyshropshire,1,10,1rg5nm,0,Have you ever tried pulling apart a grilled cheese sandwich,1385417197.0,Why dont you eat a girl out first thing in the morning,6,jokes,top_week
antdude,0,9,1rfzo7,0, was heard and shared this morning on my way to my almost monthly dentist appointment dang exposed hurting teeth again  The local talk radio host was talking about a dessert that had oysters inside The receiver said it was grossdisgusting or something The other person asked who gave it to him He said it was from his mother in law The other person said he better eat it thenNote this was from my dumb brain so it could be wrong I wished I had it recorded P,1385413372.0,A dessert joke,4,jokes,top_week
RainbowGod,2,14,1rdoet,0,,1385335476.0,My life,7,jokes,top_week
cromagnus,1,12,1rdlt7,0,I asked him why and he told me Beware of blood in the water The fearsome beast will bite your head clean off unprovoked when you least expect it,1385333580.0,A guy I know calls womens periods shark week,5,jokes,top_week
Lighterless,4,7,1r9rmi,0,She wore her New JerseyWhy did CaliforniaShe called to ask HawaiiWhere did ChicagoThe same place OregonWhere has Oregon I dont know but AlaskaShe said she went to pay her TexasWhat did MissisipShe sipped a MinnesotaWhat did TennesseeThe same thing ArkansasHow did WisconsinHe robbed an Oklahoma using a Kentucky httpwwwyoutubecomwatchvNztfOSyCCFM,1385184425.0,What Did Delaware,2,jokes,top_week
dafuq,0,10,1rp4s9,0,well stop doin anal,1385710200.0,Do you know what i say to people that are butthurt,2,jokes,top_week
OZO,1,10,1rnw14,0,Whos in there He yellsHe gets a reply jeanclaude van damme All  of youget out,1385667212.0,A guard is patrolling when he sees something moving in the bushes,3,jokes,top_week
itakmaszraka,0,10,1rj80z,0,How do you make a gay guy fuck a woman     Shit in her cunt,1385509958.0,How do make a gay guy fuck a woman,3,jokes,top_week
sapoodle,2,8,1riqea,0,Because he was fat,1385498316.0,Why did James Gandolfini die of a heart attack,2,jokes,top_week
vn,0,11,1rhube,0,why else would you wish Merry Christmas to every Juan badumtss,1385475141.0,I think Christmas is made for Mexicans only,4,jokes,top_week
chopliver,2,13,1rh726,0,Theres twenty of them,1385444408.0,Whats the best part about fucking  year old girls,4,jokes,top_week
MisterPigoo,0,13,1rbj6a,0,Straight Outta Coffin,1385254091.0,Where is Eazy E from,7,jokes,top_week
jdlincicome,4,14,1r985c,0,Is it shoplifting,1385166637.0,If I rape a prostitute,7,jokes,top_week
nathantheman,3,11,1rnujr,0,Tell them to pee in the corner of a silo,1385666014.0,How do u confuse a blonde,2,jokes,top_week
DoctorCocktor,1,12,1rextf,0,You dont,1385384513.0,How do you you ask your male friend to shave your body,5,jokes,top_week
READINGSFORFAGS,0,13,1rocuq,0,Twerky,1385682315.0,What did Miley Cyrus have for thanksgiving,5,jokes,top_week
GeneralFriend,0,16,1rnkk3,0,You dont want to know,1385658196.0,On Thanksgiving how does Miley Cyrus stuff her bird,6,jokes,top_week
OfficerShitBird,1,26,1rnii0,0,Twerky,1385656611.0,What does Miley Cyrus eat for Thanksgiving,15,jokes,top_week
iHobbledehoy,6,12,1rapg8,0,,1385229839.0,Nigger,4,jokes,top_week
jackslack,1,17,1rcmvp,0,Because when you see it you turn one degree and walk away,1385305715.0,Why is it called xbox one,8,jokes,top_week
joeporterme,1,17,1rnze8,0,Twerky Yup I just did that ,1385669972.0,Happy Thanksgiving What does Miley Cyrus have on Thanksgiving,4,jokes,top_week
SGrumpy,96,2739,1ra9vc,2159,and she had been in it for months Nurses were in her room giving her a blanket bathOne of them was washing her private area and noticed that there was a slight response on the monitor when she touched her They tried it again and sure enough there was a small recognisable movementThey went to her husband and explained what happened telling him Crazy as this sounds maybe a little oral sex will do the trick and bring her out of the comaThe husband was sceptical but they assured him that with the curtains closed for privacy and his cooperation it might just work He finally agreed and went into his wifes roomA few minutes passed and then the womans monitor flat lined no pulse no heart beat alarms ringing the nurses burst into the room What happened they criedThe husband said Im not sure maybe she choked,1385214084.0,A woman was in a coma,4898,jokes,top_week
docpepson,113,2473,1rdxt4,2144,Because Ken came in a different boxBadum tiss,1385342837.0,Why did Barbie never get pregnant,4617,jokes,top_week
sterling,79,1461,1rhzjd,1919,Whats the last thing each ticklemeelmo doll gets before leaving the factoryTwo test tickles ,1385479852.0,Joke my dad loved,3380,jokes,top_week
thehedgemon,136,2161,1rfkud,1784,Two friars decide to open up a business selling flowers in LA They settup a booth right outside of Hugh Hefners playboy mansion After about a week their business wasnt going so well and it was also driving away people from the playboy mansion seeing two friars outsideEventually Hugh Hefner himself came out and put a stop to all of thisThe point of the story is Only Hugh can prevent florist friarsBadum psh,1385403689.0,Corniest joke I know,3945,jokes,top_week
son,56,767,1rporv,1683,So an older couple is discussing the inevitable matter of death  The wife asks her husband If I die before you do will you remarry  To which the husband replies Well I dont want to be lonely for the rest of my life so yes  The wife then asks What about the house  Will you live in the same house  And the husband says Well I suppose  I mean its already paid for  The wife getting a little protective asks And what about my car  Will she drive my car  The husband says again Well its already paid forThe wife annoyed at this point shoots What about my golf clubs  And the husband says Oh no  Shes left handed,1385739159.0,My grandpa told me this one,2450,jokes,top_week
beerdude,72,793,1rna91,1405,An Englishman a Frenchman a Spaniard and a German are all standing watching an American street performer do some juggling The juggler notices the four gentleman have a very poor view so he stands up on a wooden crate and calls out Can you all see me nowYesOuiSíJa,1385648675.0,An Englishman a Frenchman a Spaniard and a German xpost from rdadjokes,2198,jokes,top_week
SGrumpy,61,657,1rcg2l,1314,had spent four days together and they were getting a little testy One morning the first friend says You know were starting to get on each others nerves Why dont we split up todayIll hike north and spend the day looking around you hike south and spend the day Then tonight well have dinner and share our experiences over the campfireThe second friend agrees and hikes south The first man hikes northThat night over dinner the first man tells his storyToday I hiked into a beautiful valley I followed a stream up into a canyon and ate lunch Then I swam in a crystal clear mountain lake As I sat out and dried I watched deer come and drink from the stream The wildflowers were filled with butterflies and hawks floated all day overhead How was your dayThe second friend says I went south and ran across a set of railroad tracks I followed them until I came across a young woman tied to the tracks I cut the ropes off gently lifted her off the tracks and I had sex with her in every imaginable way all afternoon Finally when I was so tired I could barely move I came back to campWow the first guy exclaimed Your day was MUCH better than mine Did you get a blow job tooNah says the second friend over his meal I couldnt find her head,1385295183.0,Two men camping in the mountains,1971,jokes,top_week
VersalEszett,34,736,1rnepl,1134,After about  minutes on the highway I realized I left my car at home,1385653166.0,I had coffee with Red Bull this morning,1870,jokes,top_week
steventheunicorn,54,671,1rjgme,1091,There was a man who really took care of his body One day he took a look in the mirror and noticed that he was tan all over except for his penis So he decided to do something about it He went to the beach and got completely undressed and buried himself in the sand except for his penis which he left sticking outTwo old ladies were strolling along the beach one using a cane Upon seeing the thing sticking up out of the sand she began to move it around with her cane remarking to the other lady There is no justice in this world The other lady asked what she meantWell when I was  I was curious about it When I was  I enjoyed it When I was  I asked for it When I was  I paid for it When I was  I prayed for it When I was  I forgot all about it Now Im  and the damn things are growing wild and Im too old to squat,1385516290.0,I found this on the interwebs NSFWish,1762,jokes,top_week
mclarke,34,511,1rklmr,1010,Because theres not mushroom,1385561601.0,Why dont fairies live under toadstools,1521,jokes,top_week
mikalshorti,69,650,1rm7c9,955,God decides hed like to take a vacation So he goes to St Peter at the pearly gates and asks Pete I need a vacation being God is fucking stressful Where should I goSt Peter says well Pluto has good skiingGod shakes his head fervently and replies no way I broke my leg there onceNext St Peter suggests Mars  theres an eonslong storm that could be fun God says no way I almost got struck by lightning there last timeSo then St Peter suggests Earth  you can do just about anything thereGod fires back Fuck that Pete I went there  years ago knocked up some Jewish chick and theyre still fucking talking about it,1385603363.0,Gods Vacation,1605,jokes,top_week
thewizard,45,430,1rbnld,933,The librarian replied Fuck off you wont bring it back,1385257978.0,A man went to a library and asked for a book on committing suicide,1363,jokes,top_week
ryanbimmer,79,540,1roisz,841,Does that make you an iWitness,1385688342.0,If you see an Apple store getting robbed,1381,jokes,top_week
apatheticclown,15,167,1rfec0,562,A man goes up to the circus and says to the leader of the circus I can do great bird impressions The leader of the circus says Thats nothing special lots of people can do great bird impressions so get out of hereThe man says ok and flies away,1385399270.0,A man goes up to the leader of a circus,729,jokes,top_week
jeets,18,186,1rlrlg,513,they only had one pickup,1385591170.0,Why did the Mexican army attack the Alamo with only  soldiers,699,jokes,top_week
